[
    {
        "title": "\u0110i\u1ec1u h\u00f2a Toshiba Inverter 9.000 BTU (1 HP) RAS-H10Z1KCVG-V",
        "price": "gi\u00e1 hi\u1ec7n t\u1ea1i l\u00e0 8,730,000 \u20ab nh\u01b0ng tr\u01b0\u1edbc \u0111\u00e2y n\u00f3 c\u00f3 gi\u00e1 l\u00e0 10,990,000 \u20ab",
        "colors": "Tr\u1eafng",
        "technical_specifications": [
            {
                "Lo\u1ea1i m\u00e1y": "1 chi\u1ec1u (ch\u1ec9 l\u00e0m l\u1ea1nh)"
            },
            {
                "C\u00f4ng ngh\u1ec7 inverter": "M\u00e1y l\u1ea1nh Inverter"
            },
            {
                "C\u00f4ng su\u1ea5t l\u00e0m l\u1ea1nh": "1 HP - 9.000 BTU"
            },
            {
                "Ph\u1ea1m vi l\u00e0m l\u1ea1nh hi\u1ec7u qu\u1ea3": "D\u01b0\u1edbi 15m\u00b2 (t\u1eeb 30 \u0111\u1ebfn 45m\u00b3)"
            },
            {
                "Nh\u00e3n n\u0103ng l\u01b0\u1ee3ng": "5 sao (Hi\u1ec7u su\u1ea5t n\u0103ng l\u01b0\u1ee3ng 4.33)"
            }
        ],
        "description": "\u0110i\u1ec1u h\u00f2a Toshiba Inverter 9.000 BTU (1 HP) RAS-H10Z1KCVG-V mang l\u1ea1i kh\u1ea3 n\u0103ng l\u00e0m l\u1ea1nh hi\u1ec7u qu\u1ea3 trong c\u00e1c kh\u00f4ng gian c\u00f3 di\u1ec7n t\u00edch nh\u1ecf. V\u1edbi thi\u1ebft k\u1ebf m\u00e0u tr\u1eafng tinh t\u1ebf v\u00e0 k\u00edch th\u01b0\u1edbc nh\u1ecf g\u1ecdn, s\u1ea3n ph\u1ea9m kh\u00f4ng ch\u1ec9 \u0111\u01b0\u1ee3c d\u1ec5 l\u1eafp \u0111\u1eb7t d\u1ec5 d\u00e0ng m\u00e0 c\u00f2n ph\u00f9 h\u1ee3p v\u1edbi nhi\u1ec1u phong c\u00e1ch n\u1ed9i th\u1ea5t. \u0110\u01b0\u1ee3c trang b\u1ecb c\u00e1c c\u00f4ng ngh\u1ec7 ti\u00ean ti\u1ebfn nh\u01b0 l\u00e0m l\u1ea1nh nhanh Hi Power , ti\u1ebft ki\u1ec7m \u0111i\u1ec7n Hybrid Inverter , c\u00f9ng c\u00e1c t\u00ednh n\u0103ng l\u1ecdc kh\u00f4ng kh\u00ed v\u00e0 ch\u1ed1ng n\u1ea5m m\u1ed1c , chi\u1ebfc \u0111i\u1ec1u h\u00f2a n\u00e0y \u0111\u1ea3m b\u1ea3o mang l\u1ea1i s\u1ef1 m\u00e1t m\u1ebb v\u00e0 kh\u00f4ng gian s\u1ed1ng trong l\u00e0nh cho ng\u01b0\u1eddi d\u00f9ng. \u0110\u1eb7c \u0111i\u1ec3m n\u1ed5i b\u1eadt M\u00e0u tr\u1eafng sang tr\u1ecdng v\u1edbi k\u00edch th\u01b0\u1edbc nh\u1ecf g\u1ecdn, d\u1ec5 d\u00e0ng l\u1eafp \u0111\u1eb7t trong nhi\u1ec1u kh\u00f4ng gian n\u1ed9i th\u1ea5t. C\u00f4ng ngh\u1ec7 l\u00e0m l\u1ea1nh nhanh Hi Power gi\u00fap \u0111\u1ea1t nhi\u1ec7t \u0111\u1ed9 mong mu\u1ed1n trong th\u1eddi gian ng\u1eafn, mang l\u1ea1i c\u1ea3m gi\u00e1c m\u00e1t m\u1ebb nhanh ch\u00f3ng. C\u00f4ng ngh\u1ec7 Hybrid Inverter v\u00e0 ch\u1ebf \u0111\u1ed9 Eco gi\u00fap t\u1ed1i \u01b0u h\u00f3a hi\u1ec7u su\u1ea5t v\u00e0 gi\u1ea3m chi ph\u00ed \u0111i\u1ec7n n\u0103ng. C\u00f4ng ngh\u1ec7 Ultra Fresh, Magic Coil v\u00e0 b\u1ed9 l\u1ecdc ch\u1ed1ng n\u1ea5m m\u1ed1c \u0111\u1ea3m b\u1ea3o kh\u00f4ng kh\u00ed trong l\u00e0nh, an to\u00e0n cho s\u1ee9c kh\u1ecfe. Th\u00f4ng s\u1ed1 k\u1ef9 thu\u1eadt chi ti\u1ebft c\u1ee7a m\u00e1y l\u1ea1nh Toshiba Inverter 9.000 BTU (1 HP) RAS-H10Z1KCVG-V Th\u00f4ng s\u1ed1 Chi ti\u1ebft Lo\u1ea1i m\u00e1y 1 chi\u1ec1u (ch\u1ec9 l\u00e0m l\u1ea1nh) C\u00f4ng su\u1ea5t l\u00e0m l\u1ea1nh 1 HP - 9.000 BTU Ph\u1ea1m vi l\u00e0m l\u1ea1nh hi\u1ec7u qu\u1ea3 D\u01b0\u1edbi 15m2 (t\u1eeb 30 \u0111\u1ebfn 45m3) K\u00edch th\u01b0\u1edbc v\u00e0 tr\u1ecdng l\u01b0\u1ee3ng d\u00e0n l\u1ea1nh D\u00e0i 77 cm - Cao 28.8 cm - D\u00e0y 22.5 cm N\u1eb7ng 9 kg K\u00edch th\u01b0\u1edbc v\u00e0 tr\u1ecdng l\u01b0\u1ee3ng d\u00e0n n\u00f3ng D\u00e0i 66.5 cm - Cao 53 cm - D\u00e0y 21.5 cm N\u1eb7ng 17 kg \u0110\u1ed9 \u1ed3n trung b\u00ecnh 24 - 42/48 dB Lo\u1ea1i gas R-32 Ti\u00eau th\u1ee5 \u0111i\u1ec7n 0.9 kW/h C\u00f4ng ngh\u1ec7 ti\u1ebft ki\u1ec7m \u0111i\u1ec7n Hybrid Inverter Eco Kh\u1ea3 n\u0103ng l\u1ecdc b\u1ee5i, kh\u00e1ng khu\u1ea9n, kh\u1eed m\u00f9i C\u00f4ng ngh\u1ec7 tinh l\u1ecdc kh\u00f4ng kh\u00ed Ultra Fresh C\u00f4ng ngh\u1ec7 ch\u1ed1ng b\u00e1m b\u1ea9n Magic Coil B\u1ed9 l\u1ecdc ch\u1ed1ng n\u1ea5m m\u1ed1c C\u00f4ng ngh\u1ec7 l\u00e0m l\u1ea1nh nhanh Hi Power Ch\u1ebf \u0111\u1ed9 gi\u00f3 \u0110i\u1ec1u khi\u1ec3n l\u00ean xu\u1ed1ng t\u1ef1 \u0111\u1ed9ng, tr\u00e1i ph\u1ea3i t\u00f9y ch\u1ec9nh tay C\u00f4ng ngh\u1ec7 l\u00e0m l\u1ea1nh nhanh Hi Power Ti\u1ec7n \u00edch T\u1ef1 kh\u1edfi \u0111\u1ed9ng l\u1ea1i khi c\u00f3 \u0111i\u1ec7n Ch\u1ee9c n\u0103ng h\u00fat \u1ea9m H\u1eb9n gi\u1edd b\u1eadt/t\u1eaft m\u00e1y Ch\u1ebf \u0111\u1ed9 ch\u1ec9 s\u1eed d\u1ee5ng qu\u1ea1t Fan Only - ch\u1ec9 l\u00e0m m\u00e1t, kh\u00f4ng l\u00e0m l\u1ea1nh Ch\u1ee9c n\u0103ng t\u1ef1 l\u00e0m s\u1ea1ch D\u00f2ng \u0111i\u1ec7n v\u00e0o D\u00e0n n\u00f3ng ho\u1eb7c d\u00e0n l\u1ea1nh D\u00f2ng \u0111i\u1ec7n ho\u1ea1t \u0111\u1ed9ng 1 pha S\u1ed1 l\u01b0\u1ee3ng k\u1ebft n\u1ed1i d\u00e0n l\u1ea1nh t\u1ed1i \u0111a 1 \u0110\u00e1nh gi\u00e1 chi ti\u1ebft \u0111i\u1ec1u h\u00f2a Toshiba Inverter 9.000 BTU (1 HP) RAS-H10Z1KCVG-V \u0110i\u1ec1u h\u00f2a Toshiba RAS-H10Z1KCVG-V kh\u00f4ng ch\u1ec9 n\u1ed5i b\u1eadt v\u1edbi thi\u1ebft k\u1ebf sang tr\u1ecdng m\u00e0 c\u00f2n c\u00f3 kh\u1ea3 n\u0103ng l\u00e0m l\u1ea1nh m\u1ea1nh m\u1ebd. V\u1edbi c\u00f4ng ngh\u1ec7 l\u00e0m l\u1ea1nh nhanh Hi Power v\u00e0 c\u00f4ng ngh\u1ec7 ti\u1ebft ki\u1ec7m \u0111i\u1ec7n Hybrid Inverter, s\u1ea3n ph\u1ea9m n\u00e0y kh\u00f4ng ch\u1ec9 mang l\u1ea1i c\u1ea3m gi\u00e1c m\u00e1t l\u1ea1nh t\u1ee9c th\u00ec m\u00e0 c\u00f2n gi\u00fap ti\u1ebft ki\u1ec7m chi ph\u00ed \u0111i\u1ec7n n\u0103ng \u0111\u00e1ng k\u1ec3. Ngo\u00e0i ra, \u0111i\u1ec1u h\u00f2a c\u00f2n c\u00f3 c\u00e1c t\u00ednh n\u0103ng ti\u00ean ti\u1ebfn nh\u01b0 l\u1ecdc b\u1ee5i, kh\u00e1ng khu\u1ea9n v\u00e0 t\u1ef1 kh\u1edfi \u0111\u1ed9ng l\u1ea1i khi c\u00f3 \u0111i\u1ec7n gi\u00fap mang \u0111\u1ebfn kh\u00f4ng gian s\u1ed1ng tuy\u1ec7t v\u1eddi cho ng\u01b0\u1eddi d\u00f9ng. Thi\u1ebft k\u1ebf m\u00e0u tr\u1eafng tinh t\u1ebf, c\u00f4ng su\u1ea5t l\u00e0m l\u1ea1nh 9.000 BTU M\u00e1y l\u1ea1nh Toshiba Inverter 9.000 BTU (1 HP) RAS-H10Z1KCVG-V n\u1ed5i b\u1eadt v\u1edbi thi\u1ebft k\u1ebf m\u00e0u tr\u1eafng tinh t\u1ebf, mang \u0111\u1ebfn v\u1ebb \u0111\u1eb9p sang tr\u1ecdng v\u00e0 hi\u1ec7n \u0111\u1ea1i cho m\u1ecdi kh\u00f4ng gian. V\u1edbi k\u00edch th\u01b0\u1edbc nh\u1ecf g\u1ecdn c\u00f9ng tr\u1ecdng l\u01b0\u1ee3ng ch\u1ec9 9 kg , chi\u1ebfc \u0111i\u1ec1u h\u00f2a n\u00e0y kh\u00f4ng chi\u1ebfm qu\u00e1 nhi\u1ec1u di\u1ec7n t\u00edch v\u00e0 c\u00f3 th\u1ec3 d\u1ec5 d\u00e0ng l\u1eafp \u0111\u1eb7t trong c\u00e1c ph\u00f2ng nh\u01b0 ph\u00f2ng ng\u1ee7, ph\u00f2ng l\u00e0m vi\u1ec7c, ph\u00f2ng kh\u00e1ch. B\u00ean c\u1ea1nh \u0111\u00f3, \u0111i\u1ec1u h\u00f2a c\u00f2n \u0111\u01b0\u1ee3c trang b\u1ecb d\u00e0n n\u00f3ng v\u1edbi \u1ed1ng d\u1eabn gas b\u1eb1ng \u0110\u1ed3ng v\u00e0 l\u00e1 t\u1ea3n nhi\u1ec7t b\u1eb1ng Nh\u00f4m, gi\u00fap t\u0103ng c\u01b0\u1eddng hi\u1ec7u su\u1ea5t l\u00e0m l\u1ea1nh. V\u1eadt li\u1ec7u cao c\u1ea5p n\u00e0y kh\u00f4ng ch\u1ec9 gi\u00fap m\u00e1y ho\u1ea1t \u0111\u1ed9ng \u1ed5n \u0111\u1ecbnh m\u00e0 c\u00f2n k\u00e9o d\u00e0i tu\u1ed5i th\u1ecd, gi\u1ea3m thi\u1ec3u c\u00e1c v\u1ea5n \u0111\u1ec1 h\u1ecfng h\u00f3c trong qu\u00e1 tr\u00ecnh s\u1eed d\u1ee5ng. Thi\u1ebft k\u1ebf c\u1ee7a c\u1ea3 d\u00e0n n\u00f3ng v\u00e0 d\u00e0n l\u1ea1nh \u0111\u1ec1u \u0111\u1ea3m b\u1ea3o mang l\u1ea1i hi\u1ec7u qu\u1ea3 s\u1eed d\u1ee5ng t\u1ed1i \u01b0u cho ng\u01b0\u1eddi d\u00f9ng. V\u1edbi c\u00f4ng su\u1ea5t 1 HP - 9.000 BTU , Toshiba Inverter 9.000 BTU (1 HP) RAS-H10Z1KCVG-V l\u00e0 s\u1ef1 l\u1ef1a ch\u1ecdn ho\u00e0n h\u1ea3o cho nh\u1eefng kh\u00f4ng gian nh\u1ecf d\u01b0\u1edbi 15m2 nh\u01b0 ph\u00f2ng ng\u1ee7, ph\u00f2ng l\u00e0m vi\u1ec7c hay ph\u00f2ng kh\u00e1ch nh\u1ecf. S\u1ea3n ph\u1ea9m mang \u0111\u1ebfn kh\u1ea3 n\u0103ng l\u00e0m l\u1ea1nh hi\u1ec7u qu\u1ea3 v\u00e0 nhanh ch\u00f3ng, gi\u00fap c\u0103n ph\u00f2ng \u0111\u1ea1t \u0111\u01b0\u1ee3c nhi\u1ec7t \u0111\u1ed9 mong mu\u1ed1n trong th\u1eddi gian ng\u1eafn. Kh\u00f4ng ch\u1ec9 \u0111\u1ea3m b\u1ea3o hi\u1ec7u su\u1ea5t l\u00e0m l\u1ea1nh t\u1ed1i \u01b0u, \u0111i\u1ec1u h\u00f2a Toshiba c\u00f2n n\u1ed5i b\u1eadt v\u1edbi kh\u1ea3 n\u0103ng ti\u1ebft ki\u1ec7m \u0111i\u1ec7n v\u01b0\u1ee3t tr\u1ed9i. V\u1edbi m\u1ee9c ti\u00eau th\u1ee5 \u0111i\u1ec7n n\u0103ng ch\u1ec9 0.9 kW/h , s\u1ea3n ph\u1ea9m n\u00e0y gi\u00fap gi\u1ea3m thi\u1ec3u chi ph\u00ed \u0111i\u1ec7n h\u00e0ng th\u00e1ng, mang l\u1ea1i l\u1ee3i \u00edch kinh t\u1ebf l\u00e2u d\u00e0i cho ng\u01b0\u1eddi s\u1eed d\u1ee5ng. Nh\u1edd v\u00e0o c\u00f4ng ngh\u1ec7 Inverter ti\u00ean ti\u1ebfn, \u0111i\u1ec1u h\u00f2a c\u00f3 th\u1ec3 duy tr\u00ec nhi\u1ec7t \u0111\u1ed9 \u1ed5n \u0111\u1ecbnh m\u00e0 kh\u00f4ng c\u1ea7n ti\u00eau t\u1ed1n qu\u00e1 nhi\u1ec1u n\u0103ng l\u01b0\u1ee3ng, \u0111\u1ea3m b\u1ea3o s\u1ef1 tho\u1ea3i m\u00e1i v\u00e0 d\u1ec5 ch\u1ecbu trong su\u1ed1t qu\u00e1 tr\u00ecnh s\u1eed d\u1ee5ng. Kh\u1ea3 n\u0103ng l\u00e0m l\u1ea1nh nhanh v\u00e0 ti\u1ebft ki\u1ec7m \u0111i\u1ec7n c\u1ee7a \u0111i\u1ec1u h\u00f2a Toshiba Inverter 9.000 BTU (1 HP) RAS-H10Z1KCVG-V Toshiba Inverter 9.000 BTU RAS-H10Z1KCVG-V \u0111\u01b0\u1ee3c trang b\u1ecb c\u00f4ng ngh\u1ec7 l\u00e0m l\u1ea1nh nhanh Hi Power , cho ph\u00e9p l\u00e0m l\u1ea1nh t\u1ee9c th\u00ec ch\u1ec9 trong v\u00e0i ph\u00fat. C\u00f4ng ngh\u1ec7 n\u00e0y gi\u00fap \u0111i\u1ec1u h\u00f2a \u0111\u1ea1t \u0111\u01b0\u1ee3c nhi\u1ec7t \u0111\u1ed9 mong mu\u1ed1n m\u1ed9t c\u00e1ch nhanh ch\u00f3ng, mang \u0111\u1ebfn c\u1ea3m gi\u00e1c m\u00e1t m\u1ebb ngay l\u1eadp t\u1ee9c. C\u00f4ng ngh\u1ec7 Hi Power \u0111\u1eb7c bi\u1ec7t h\u1eefu \u00edch trong nh\u1eefng ng\u00e0y n\u1eafng n\u00f3ng gay g\u1eaft, b\u1ea1n s\u1ebd kh\u00f4ng ph\u1ea3i ch\u1edd \u0111\u1ee3i l\u00e2u \u0111\u1ec3 t\u1eadn h\u01b0\u1edfng kh\u00f4ng gian tho\u00e1ng \u0111\u00e3ng, d\u1ec5 ch\u1ecbu. B\u00ean c\u1ea1nh \u0111\u00f3, Toshiba c\u00f2n t\u00edch h\u1ee3p c\u00f4ng ngh\u1ec7 ti\u1ebft ki\u1ec7m \u0111i\u1ec7n Hybrid Inverter v\u00e0 ch\u1ebf \u0111\u1ed9 Eco v\u00e0o \u0111i\u1ec1u ho\u00e0 RAS-H10Z1KCVG-V, gi\u00fap t\u1ed1i \u01b0u h\u00f3a hi\u1ec7u su\u1ea5t l\u00e0m l\u1ea1nh v\u00e0 gi\u1eef m\u1ee9c ti\u00eau th\u1ee5 \u0111i\u1ec7n n\u0103ng \u1edf m\u1ee9c th\u1ea5p nh\u1ea5t. C\u00f4ng ngh\u1ec7 Hybrid Inverter \u0111i\u1ec1u ch\u1ec9nh c\u00f4ng su\u1ea5t ho\u1ea1t \u0111\u1ed9ng c\u1ee7a m\u00e1y n\u00e9n, gi\u00fap duy tr\u00ec nhi\u1ec7t \u0111\u1ed9 \u1ed5n \u0111\u1ecbnh, tr\u00e1nh g\u00e2y l\u00e3ng ph\u00ed n\u0103ng l\u01b0\u1ee3ng. Trong khi \u0111\u00f3, ch\u1ebf \u0111\u1ed9 Eco s\u1ebd t\u1ef1 \u0111\u1ed9ng \u0111i\u1ec1u ch\u1ec9nh nhi\u1ec7t \u0111\u1ed9 v\u00e0 \u0111\u1ed9 \u1ea9m trong ph\u00f2ng, gi\u1ea3m thi\u1ec3u \u0111i\u1ec7n n\u0103ng ti\u00eau th\u1ee5 nh\u01b0ng v\u1eabn \u0111\u1ea3m b\u1ea3o s\u1ef1 tho\u1ea3i m\u00e1i cho ng\u01b0\u1eddi s\u1eed d\u1ee5ng. C\u00e1c t\u00ednh n\u0103ng n\u1ed5i b\u1eadt c\u1ee7a m\u00e1y l\u1ea1nh Toshiba Inverter 9.000 BTU (1 HP) RAS-H10Z1KCVG-V \u0110i\u1ec1u h\u00f2a Toshiba RAS-H10Z1KCVG-V kh\u00f4ng ch\u1ec9 mang l\u1ea1i kh\u1ea3 n\u0103ng l\u00e0m l\u1ea1nh hi\u1ec7u qu\u1ea3 m\u00e0 c\u00f2n \u0111\u01b0\u1ee3c trang b\u1ecb h\u00e0ng lo\u1ea1t c\u00e1c t\u00ednh n\u0103ng ti\u00ean ti\u1ebfn, \u0111\u1ea3m b\u1ea3o mang \u0111\u1ebfn tr\u1ea3i nghi\u1ec7m s\u1eed d\u1ee5ng tuy\u1ec7t v\u1eddi v\u00e0 an to\u00e0n cho ng\u01b0\u1eddi d\u00f9ng. L\u1ecdc b\u1ee5i, kh\u00e1ng khu\u1ea9n, kh\u1eed m\u00f9i v\u01b0\u1ee3t tr\u1ed9i \u0110i\u1ec1u h\u00f2a Toshiba Inverter 9.000 BTU (1 HP) RAS-H10Z1KCVG-V \u0111\u01b0\u1ee3c trang b\u1ecb c\u00f4ng ngh\u1ec7 tinh l\u1ecdc kh\u00f4ng kh\u00ed Ultra Fresh , gi\u00fap lo\u1ea1i b\u1ecf b\u1ee5i m\u1ecbn v\u00e0 c\u00e1c t\u00e1c nh\u00e2n g\u00e2y d\u1ecb \u1ee9ng, mang l\u1ea1i kh\u00f4ng gian s\u1ed1ng s\u1ea1ch s\u1ebd v\u00e0 an to\u00e0n cho s\u1ee9c kh\u1ecfe. C\u00f9ng v\u1edbi \u0111\u00f3 l\u00e0 c\u00f4ng ngh\u1ec7 ch\u1ed1ng b\u00e1m b\u1ea9n Magic Coil gi\u1eef cho d\u00e0n l\u1ea1nh lu\u00f4n s\u1ea1ch s\u1ebd, ng\u0103n ng\u1eeba vi khu\u1ea9n v\u00e0 n\u1ea5m m\u1ed1c ph\u00e1t tri\u1ec3n. Toshiba c\u00f2n trang b\u1ecb th\u00eam m\u1ed9t b\u1ed9 l\u1ecdc ch\u1ed1ng n\u1ea5m m\u1ed1c cho \u0111i\u1ec1u h\u00f2a RAS-H10Z1KCVG-V \u0111\u1ec3 ti\u00eau di\u1ec7t vi khu\u1ea9n v\u00e0 kh\u1eed m\u00f9i h\u00f4i kh\u00f3 ch\u1ecbu. S\u1ef1 k\u1ebft h\u1ee3p c\u1ee7a nh\u1eefng c\u00f4ng ngh\u1ec7 hi\u1ec7n \u0111\u1ea1i n\u00e0o gi\u00fap \u0111\u1ea3m b\u1ea3o kh\u00f4ng kh\u00ed trong ph\u00f2ng lu\u00f4n trong l\u00e0nh v\u00e0 t\u01b0\u01a1i m\u1edbi. H\u1eb9n gi\u1edd b\u1eadt/t\u1eaft m\u00e1y v\u00e0 t\u1ef1 kh\u1edfi \u0111\u1ed9ng l\u1ea1i khi c\u00f3 \u0111i\u1ec7n H\u1eb9n gi\u1edd b\u1eadt/t\u1eaft m\u00e1y l\u00e0 m\u1ed9t trong nh\u1eefng t\u00ednh n\u0103ng c\u01a1 b\u1ea3n m\u00e0 h\u1ea7u nh\u01b0 chi\u1ebfc \u0111i\u1ec1u h\u00f2a n\u00e0o c\u0169ng c\u00f3. M\u00e1y l\u1ea1nh Toshiba Inverter 9.000 BTU (1 HP) RAS-H10Z1KCVG-V c\u0169ng cho ph\u00e9p ng\u01b0\u1eddi d\u00f9ng c\u00e0i \u0111\u1eb7t th\u1eddi gian b\u1eadt ho\u1eb7c t\u1eaft theo l\u1ecbch tr\u00ecnh sinh ho\u1ea1t h\u00e0ng ng\u00e0y c\u1ee7a m\u00ecnh. \u0110i\u1ec1u n\u00e0y kh\u00f4ng ch\u1ec9 gi\u00fap ti\u1ebft ki\u1ec7m \u0111i\u1ec7n n\u0103ng m\u00e0 c\u00f2n \u0111\u1ea3m b\u1ea3o kh\u00f4ng gian lu\u00f4n \u0111\u01b0\u1ee3c duy tr\u00ec \u1edf nhi\u1ec7t \u0111\u1ed9 mong mu\u1ed1n m\u00e0 kh\u00f4ng c\u1ea7n ph\u1ea3i thao t\u00e1c th\u1ee7 c\u00f4ng nhi\u1ec1u l\u1ea7n. T\u00ednh n\u0103ng h\u1eb9n gi\u1edd b\u1eadt/t\u1eaft m\u00e1y c\u0169ng mang \u0111\u1ebfn s\u1ef1 linh ho\u1ea1t v\u00e0 ti\u1ec7n l\u1ee3i cho ng\u01b0\u1eddi s\u1eed d\u1ee5ng. B\u1ea1n c\u00f3 th\u1ec3 d\u1ec5 d\u00e0ng h\u1eb9n gi\u1edd b\u1eadt tr\u01b0\u1edbc khi v\u1ec1 nh\u00e0 \u0111\u1ec3 t\u1eadn h\u01b0\u1edfng kh\u00f4ng gian m\u00e1t l\u1ea1nh h\u1eb9n gi\u1edd t\u1eaft v\u00e0o bu\u1ed5i t\u1ed1i sau khi \u0111i ng\u1ee7 \u0111\u1ec3 ti\u1ebft ki\u1ec7m \u0111i\u1ec7n. Toshiba RAS-H10Z1KCVG-V c\u00f2n c\u00f3 kh\u1ea3 n\u0103ng t\u1ef1 kh\u1edfi \u0111\u1ed9ng l\u1ea1i khi c\u00f3 \u0111i\u1ec7n. Khi x\u1ea3y ra s\u1ef1 c\u1ed1 m\u1ea5t \u0111i\u1ec7n, \u0111i\u1ec1u h\u00f2a s\u1ebd t\u1ef1 \u0111\u1ed9ng kh\u1edfi \u0111\u1ed9ng l\u1ea1i khi ngu\u1ed3n \u0111i\u1ec7n \u0111\u01b0\u1ee3c ph\u1ee5c h\u1ed3i. C\u00e1c c\u00e0i \u0111\u1eb7t nhi\u1ec7t \u0111\u1ed9 v\u00e0 ch\u1ebf \u0111\u1ed9 tr\u01b0\u1edbc \u0111\u00f3 c\u0169ng s\u1ebd \u0111\u01b0\u1ee3c kh\u00f4i ph\u1ee5c m\u00e0 kh\u00f4ng c\u1ea7n ng\u01b0\u1eddi d\u00f9ng thi\u1ebft l\u1eadp l\u1ea1i. T\u00ednh n\u0103ng n\u00e0y \u0111\u1eb7c bi\u1ec7t h\u1eefu \u00edch v\u00e0o ban \u0111\u00eam, gi\u00fap \u0111\u1ea3m b\u1ea3o kh\u00f4ng gian v\u1eabn \u0111\u01b0\u1ee3c duy tr\u00ec \u1edf nhi\u1ec7t \u0111\u1ed9 mong mu\u1ed1n m\u1ed9t c\u00e1ch li\u00ean t\u1ee5c v\u00e0 \u1ed5n \u0111\u1ecbnh. Ch\u1ee9c n\u0103ng h\u00fat \u1ea9m v\u00e0 t\u1ef1 l\u00e0m s\u1ea1ch c\u1ee7a \u0111i\u1ec1u h\u00f2a Toshiba Inverter 9.000 BTU (1 HP) RAS-H10Z1KCVG-V Ch\u1ee9c n\u0103ng h\u00fat \u1ea9m c\u1ee7a \u0111i\u1ec1u h\u00f2a Toshiba RAS-H10Z1KCVG-V l\u00e0 gi\u1ea3i ph\u00e1p l\u00fd t\u01b0\u1edfng cho nh\u1eefng ng\u00e0y th\u1eddi ti\u1ebft \u1ea9m \u01b0\u1edbt. Ch\u1ee9c n\u0103ng n\u00e0y gi\u00fap lo\u1ea1i b\u1ecf \u0111\u1ed9 \u1ea9m d\u01b0 th\u1eeba trong kh\u00f4ng kh\u00ed, l\u00e0m cho kh\u00f4ng gian tr\u1edf n\u00ean kh\u00f4 r\u00e1o v\u00e0 tho\u00e1ng m\u00e1t h\u01a1n. Vi\u1ec7c gi\u1ea3m \u0111\u1ed9 \u1ea9m kh\u00f4ng ch\u1ec9 mang l\u1ea1i c\u1ea3m gi\u00e1c d\u1ec5 ch\u1ecbu m\u00e0 c\u00f2n gi\u00fap b\u1ea3o v\u1ec7 c\u00e1c thi\u1ebft b\u1ecb \u0111i\u1ec7n t\u1eed, \u0111\u1ed3 g\u1ed7 v\u00e0 c\u00e1c v\u1eadt d\u1ee5ng kh\u00e1c trong nh\u00e0 kh\u1ecfi t\u00ecnh tr\u1ea1ng \u1ea9m m\u1ed1c. M\u00e1y l\u1ea1nh Toshiba RAS-H10Z1KCVG-V c\u00f3 kh\u1ea3 n\u0103ng t\u1ef1 l\u00e0m s\u1ea1ch gi\u00fap d\u00e0n l\u1ea1nh lu\u00f4n s\u1ea1ch s\u1ebd v\u00e0 ho\u1ea1t \u0111\u1ed9ng hi\u1ec7u qu\u1ea3. Sau m\u1ed7i l\u1ea7n t\u1eaft m\u00e1y, qu\u1ea1t gi\u00f3 s\u1ebd ti\u1ebfp t\u1ee5c ho\u1ea1t \u0111\u1ed9ng trong m\u1ed9t kho\u1ea3ng th\u1eddi gian ng\u1eafn \u0111\u1ec3 l\u00e0m kh\u00f4 d\u00e0n l\u1ea1nh, ng\u0103n ch\u1eb7n s\u1ef1 t\u00edch t\u1ee5 c\u1ee7a \u0111\u1ed9 \u1ea9m, vi khu\u1ea9n v\u00e0 n\u1ea5m m\u1ed1c. \u0110i\u1ec1u n\u00e0y kh\u00f4ng ch\u1ec9 gi\u00fap duy tr\u00ec hi\u1ec7u su\u1ea5t l\u00e0m l\u1ea1nh t\u1ed1i \u01b0u m\u00e0 c\u00f2n k\u00e9o d\u00e0i tu\u1ed5i th\u1ecd c\u1ee7a m\u00e1y, tr\u00e1nh ph\u1ea3i b\u1ea3o tr\u00ec li\u00ean t\u1ee5c. B\u00ean c\u1ea1nh \u0111\u00f3, vi\u1ec7c gi\u1eef d\u00e0n l\u1ea1nh s\u1ea1ch s\u1ebd c\u0169ng \u0111\u1ea3m b\u1ea3o kh\u00f4ng kh\u00ed \u0111\u01b0\u1ee3c l\u1ecdc qua m\u00e1y lu\u00f4n trong l\u00e0nh v\u00e0 an to\u00e0n cho s\u1ee9c kh\u1ecfe. Ch\u1ebf \u0111\u1ed9 ch\u1ec9 s\u1eed d\u1ee5ng qu\u1ea1t - Fan Only - tr\u00ean m\u00e1y l\u1ea1nh Toshiba Inverter 9.000 BTU (1 HP) RAS-H10Z1KCVG-V Ch\u1ebf \u0111\u1ed9 Fan Only tr\u00ean m\u00e1y l\u1ea1nh Toshiba Inverter 9.000 BTU (1 HP) RAS-H10Z1KCVG-V cho ph\u00e9p b\u1ea1n ch\u1ec9 s\u1eed d\u1ee5ng qu\u1ea1t \u0111\u1ec3 l\u01b0u th\u00f4ng kh\u00f4ng kh\u00ed m\u00e0 kh\u00f4ng c\u1ea7n l\u00e0m l\u1ea1nh. \u0110\u00e2y l\u00e0 l\u1ef1a ch\u1ecdn l\u00fd t\u01b0\u1edfng khi b\u1ea1n ch\u1ec9 c\u1ea7n l\u00e0m m\u00e1t nh\u1eb9 nh\u00e0ng trong nh\u1eefng ng\u00e0y th\u1eddi ti\u1ebft kh\u00f4ng qu\u00e1 n\u00f3ng. Ch\u1ebf \u0111\u1ed9 n\u00e0y gi\u00fap ti\u1ebft ki\u1ec7m \u0111i\u1ec7n n\u0103ng \u0111\u00e1ng k\u1ec3 so v\u1edbi vi\u1ec7c v\u1eadn h\u00e0nh \u0111i\u1ec1u h\u00f2a \u1edf ch\u1ebf \u0111\u1ed9 l\u00e0m l\u1ea1nh th\u00f4ng th\u01b0\u1eddng. Ngo\u00e0i ra, Fan Only c\u0169ng gi\u00fap kh\u00f4ng kh\u00ed trong ph\u00f2ng lu\u00f4n \u0111\u01b0\u1ee3c l\u01b0u th\u00f4ng, t\u1ea1o c\u1ea3m gi\u00e1c tho\u00e1ng \u0111\u00e3ng v\u00e0 d\u1ec5 ch\u1ecbu m\u00e0 kh\u00f4ng ti\u00eau t\u1ed1n nhi\u1ec1u n\u0103ng l\u01b0\u1ee3ng. \u0110i\u1ec1u h\u00f2a Toshiba Inverter 9.000 BTU (1 HP) RAS-H10Z1KCVG-V c\u00f3 gi\u00e1 bao nhi\u00eau? RAS-H10Z1KCVG-V l\u00e0 chi\u1ebfc \u0111i\u1ec1u h\u00f2a 1 chi\u1ec1u \u0111\u01b0\u1ee3c nhi\u1ec1u ng\u01b0\u1eddi y\u00eau th\u00edch c\u1ee7a Toshiba. V\u1edbi gi\u00e1 th\u00e0nh ph\u1ea3i ch\u0103ng, kh\u1ea3 n\u0103ng l\u00e0m l\u1ea1nh t\u1ed1t, s\u1ea3n ph\u1ea9m n\u00e0y ch\u1eafc ch\u1eafn l\u00e0 l\u1ef1a ch\u1ecdn ho\u00e0n h\u1ea3o cho gia \u0111\u00ecnh b\u1ea1n. N\u1ebfu b\u1ea1n mu\u1ed1n mua s\u1ea3n ph\u1ea9m th\u00ec h\u00e3y li\u00ean h\u1ec7 Ho\u00e0ng H\u00e0 Mobile \u0111\u1ec3 \u0111\u01b0\u1ee3c t\u01b0 v\u1ea5n gi\u00e1 ch\u00ednh x\u00e1c v\u00e0 c\u00e1c \u01b0u \u0111\u00e3i hi\u1ec7n c\u00f3 t\u1ea1i \u0111i\u1ec3m mua h\u00e0ng. Mua m\u00e1y l\u1ea1nh Toshiba Inverter 9.000 BTU (1 HP) RAS-H10Z1KCVG-V ch\u00ednh h\u00e3ng gi\u00e1 r\u1ebb t\u1ea1i Ho\u00e0ng H\u00e0 Mobile \u0110i\u1ec1u h\u00f2a Toshiba Inverter 9.000 BTU (1 HP) RAS-H10Z1KCVG-V l\u00e0 l\u1ef1a ch\u1ecdn tuy\u1ec7t v\u1eddi cho kh\u00f4ng gian nh\u1ecf. S\u1ea3n ph\u1ea9m n\u00e0y l\u00e0 s\u1ef1 k\u1ebft h\u1ee3p ho\u00e0n h\u1ea3o gi\u1eefa hi\u1ec7u su\u1ea5t l\u00e0m l\u1ea1nh, ti\u1ebft ki\u1ec7m \u0111i\u1ec7n n\u0103ng v\u00e0 c\u00e1c t\u00ednh n\u0103ng hi\u1ec7n \u0111\u1ea1i. V\u1edbi thi\u1ebft k\u1ebf tinh t\u1ebf, c\u00f4ng ngh\u1ec7 ti\u00ean ti\u1ebfn v\u00e0 kh\u1ea3 n\u0103ng l\u1ecdc kh\u00f4ng kh\u00ed v\u01b0\u1ee3t tr\u1ed9i, RAS-H10Z1KCVG-V kh\u00f4ng ch\u1ec9 \u0111\u00e1p \u1ee9ng nhu c\u1ea7u l\u00e0m m\u00e1t m\u00e0 c\u00f2n g\u00f3p ph\u1ea7n n\u00e2ng cao ch\u1ea5t l\u01b0\u1ee3ng cu\u1ed9c s\u1ed1ng, t\u1ea1o m\u00f4i tr\u01b0\u1eddng s\u1ed1ng trong l\u00e0nh v\u00e0 tho\u1ea3i m\u00e1i cho ng\u01b0\u1eddi s\u1eed d\u1ee5ng. Hi\u1ec7n t\u1ea1i, s\u1ea3n ph\u1ea9m \u0111ang \u0111\u01b0\u1ee3c b\u00e1n t\u1ea1i h\u1ec7 th\u1ed1ng Ho\u00e0ng H\u00e0 Mobile . Khi mua h\u00e0ng, kh\u00e1ch h\u00e0ng kh\u00f4ng ch\u1ec9 nh\u1eadn \u0111\u01b0\u1ee3c m\u1ee9c gi\u00e1 c\u00f9ng nh\u1eefng \u01b0u \u0111\u00e3i t\u1ed1t nh\u1ea5t m\u00e0 c\u00f2n \u0111\u01b0\u1ee3c mi\u1ec5n ph\u00ed v\u1eadn chuy\u1ec3n to\u00e0n qu\u1ed1c. H\u00e3y li\u00ean h\u1ec7 ngay v\u1edbi ch\u00fang t\u00f4i qua website ho\u1eb7c hotline 1900 2091 \u0111\u1ec3 c\u1eadp nh\u1eadt nh\u1eefng th\u00f4ng tin m\u1edbi nh\u1ea5t! Xem to\u00e0n b\u1ed9 b\u00e0i vi\u1ebft",
        "promotion_1": "1. Tr\u00fang 8386 qu\u00e0 - T\u1ed5ng gi\u00e1 tr\u1ecb t\u1edbi 250 TRI\u1ec6U \u0110\u1ed2NG (\u00c1p d\u1ee5ng t\u1eeb 10/01 - 02/02/2025). (Xem chi ti\u1ebft). 2. \u0110\u1eb7c bi\u1ec7t Tr\u1ea3 g\u00f3p 3 kh\u00f4ng: 0% l\u00e3i su\u1ea5t - 0 ph\u00ed chuy\u1ec3n \u0111\u1ed5i - 0 tr\u1ea3 tr\u01b0\u1edbc (\u00c1p d\u1ee5ng cho c\u00f4ng ty t\u00e0i ch\u00ednh v\u00e0 th\u1ebb t\u00edn d\u1ee5ng)",
        "promotion_2": "1. Gi\u1ea3m t\u1edbi 500.000\u0111 khi thanh to\u00e1n th\u1ebb t\u00edn d\u1ee5ng NCB. (Xem chi ti\u1ebft). 2. Gi\u1ea3m \u0111\u1ebfn 150.000\u0111 khi thanh to\u00e1n qua Muadee. (Xem chi ti\u1ebft). 3. Mi\u1ec5n ph\u00ed chuy\u1ec3n \u0111\u1ed5i tr\u1ea3 g\u00f3p ho\u1eb7c gi\u1ea3m \u0111\u1ebfn 500.000\u0111 khi m\u1edf th\u1ebb TPBank EVO. (Xem chi ti\u1ebft). 4. M\u1edf th\u1ebb t\u00edn d\u1ee5ng VIB - Nh\u1eadn Voucher 600.000\u0111. (Xem chi ti\u1ebft). 5. M\u1edf th\u1ebb HSBC - Ho\u00e0n ti\u1ec1n t\u1edbi 2 tri\u1ec7u \u0111\u1ed3ng. (Xem chi ti\u1ebft)"
    },
    {
        "title": "\u0110i\u1ec1u h\u00f2a Toshiba Inverter 12.000 BTU (1.5 HP) RAS-H13Z1KCVG-V",
        "price": "gi\u00e1 hi\u1ec7n t\u1ea1i l\u00e0 11,110,000 \u20ab nh\u01b0ng tr\u01b0\u1edbc \u0111\u00e2y n\u00f3 c\u00f3 gi\u00e1 l\u00e0 12,690,000 \u20ab",
        "colors": "Tr\u1eafng",
        "technical_specifications": [
            {
                "Lo\u1ea1i m\u00e1y": "1 chi\u1ec1u (ch\u1ec9 l\u00e0m l\u1ea1nh)"
            },
            {
                "C\u00f4ng ngh\u1ec7 inverter": "M\u00e1y l\u1ea1nh Inverter"
            },
            {
                "C\u00f4ng su\u1ea5t l\u00e0m l\u1ea1nh": "1.5 HP - 12.000 BTU"
            },
            {
                "Ph\u1ea1m vi l\u00e0m l\u1ea1nh hi\u1ec7u qu\u1ea3": "T\u1eeb 15 - 20m\u00b2 (t\u1eeb 40 \u0111\u1ebfn 60 m\u00b3)"
            },
            {
                "Nh\u00e3n n\u0103ng l\u01b0\u1ee3ng": "5 sao (Hi\u1ec7u su\u1ea5t n\u0103ng l\u01b0\u1ee3ng 4.48)"
            }
        ],
        "description": "\u0110i\u1ec1u h\u00f2a Toshiba Inverter 12.000 BTU (1.5 HP) RAS-H13Z1KCVG-V s\u1edf h\u1eefu thi\u1ebft k\u1ebf hi\u1ec7n \u0111\u1ea1i c\u00f9ng c\u00f4ng su\u1ea5t 1.5 HP - 12.000 BTU m\u1ea1nh m\u1ebd, mang l\u1ea1i hi\u1ec7u qu\u1ea3 l\u00e0m l\u1ea1nh nhanh ch\u00f3ng v\u00e0 t\u1ed1i \u01b0u. V\u1edbi c\u00f4ng ngh\u1ec7 l\u00e0m l\u1ea1nh nhanh Hi Power c\u00f9ng c\u00f4ng ngh\u1ec7 Hybrid Inverter , s\u1ea3n ph\u1ea9m kh\u00f4ng ch\u1ec9 \u0111\u1ea3m b\u1ea3o hi\u1ec7u su\u1ea5t l\u00e0m l\u1ea1nh \u1ed5n \u0111\u1ecbnh m\u00e0 c\u00f2n ti\u1ebft ki\u1ec7m \u0111i\u1ec7n n\u0103ng m\u1ed9t c\u00e1ch hi\u1ec7u qu\u1ea3. T\u00ednh n\u0103ng h\u00fat \u1ea9m k\u1ebft h\u1ee3p c\u00f9ng c\u00f4ng ngh\u1ec7 tinh l\u1ecdc kh\u00f4ng kh\u00ed Ultra Fresh gi\u00fap duy tr\u00ec b\u1ea7u kh\u00f4ng kh\u00ed lu\u00f4n trong l\u00e0nh v\u00e0 s\u1ea1ch s\u1ebd, gi\u00fap n\u00e2ng cao ch\u1ea5t l\u01b0\u1ee3ng m\u00f4i tr\u01b0\u1eddng s\u1ed1ng v\u00e0 b\u1ea3o v\u1ec7 s\u1ee9c kh\u1ecfe c\u1ee7a c\u00e1c th\u00e0nh vi\u00ean trong gia \u0111\u00ecnh. \u0110\u1eb7c \u0111i\u1ec3m n\u1ed5i b\u1eadt C\u00f4ng su\u1ea5t m\u1ea1nh m\u1ebd 1.5 HP - 12.000 BTU cho hi\u1ec7u qu\u1ea3 l\u00e0m m\u00e1t t\u1ed1i \u01b0u trong kh\u00f4ng gian c\u00f3 di\u1ec7n t\u00edch d\u01b0\u1edbi 20m2. T\u00edch h\u1ee3p c\u00f4ng ngh\u1ec7 l\u00e0m l\u1ea1nh nhanh Hi Power mang l\u1ea1i kh\u00f4ng gian d\u1ecbu m\u00e1t ch\u1ec9 trong th\u1eddi gian ng\u1eafn. \u0110\u1ed9 \u1ed3n th\u1ea5p, dao \u0111\u1ed9ng kho\u1ea3ng 24 - 43/48 dB, kh\u00f4ng g\u00e2y \u1ea3nh h\u01b0\u1edfng \u0111\u1ebfn gi\u1ea5c ng\u1ee7 v\u00e0 c\u00e1c ho\u1ea1t \u0111\u1ed9ng kh\u00e1c. C\u00f4ng ngh\u1ec7 Hybrid Inverter gi\u1ea3m ti\u00eau hao \u0111\u1ebfn h\u01a1n 50% \u0111i\u1ec7n n\u0103ng, h\u1ea1n ch\u1ebf ti\u1ebfng \u1ed3n, gi\u00fap thi\u1ebft b\u1ecb v\u1eadn h\u00e0nh \u00eam \u00e1i v\u00e0 \u1ed5n \u0111\u1ecbnh. T\u00ednh n\u0103ng h\u00fat \u1ea9m mang l\u1ea1i kh\u00f4ng gian tho\u1ea3i m\u00e1i, kh\u00f4 tho\u00e1ng, ng\u0103n ch\u1eb7n s\u1ef1 h\u00ecnh th\u00e0nh c\u1ee7a vi khu\u1ea9n, n\u1ea5m m\u1ed1c. Ki\u1ec3m so\u00e1t th\u1eddi gian s\u1eed d\u1ee5ng m\u1ed9t c\u00e1ch d\u1ec5 d\u00e0ng v\u1edbi t\u00ednh n\u0103ng h\u1eb9n gi\u1edd, tr\u00e1nh l\u00e3ng ph\u00ed \u0111i\u1ec7n. B\u1ea3ng th\u00f4ng s\u1ed1 k\u1ef9 thu\u1eadt c\u1ee7a m\u00e1y l\u1ea1nh Toshiba Inverter 12.000 BTU (1.5 HP) RAS-H13Z1KCVG-V Th\u00f4ng s\u1ed1 Chi ti\u1ebft Lo\u1ea1i m\u00e1y 1 chi\u1ec1u (ch\u1ec9 l\u00e0m l\u1ea1nh) C\u00f4ng su\u1ea5t l\u00e0m l\u1ea1nh 1.5 HP - 12.000 BTU Ph\u1ea1m vi l\u00e0m l\u1ea1nh hi\u1ec7u qu\u1ea3 T\u1eeb 15 - 20m2 (t\u1eeb 40 \u0111\u1ebfn 60m3) K\u00edch th\u01b0\u1edbc v\u00e0 tr\u1ecdng l\u01b0\u1ee3ng d\u00e0n l\u1ea1nh D\u00e0i 77cm - Cao 28.8 cm - D\u00e0y 22.5 cm N\u1eb7ng 9 kg K\u00edch th\u01b0\u1edbc v\u00e0 tr\u1ecdng l\u01b0\u1ee3ng d\u00e0n n\u00f3ng D\u00e0i 66.6 cm - Cao 53 cm - D\u00e0y 24 cm N\u1eb7ng 21 kg \u0110\u1ed9 \u1ed3n trung b\u00ecnh 24 - 43/48 dB Lo\u1ea1i gas R-32 C\u00f4ng su\u1ea5t ti\u00eau th\u1ee5 \u0111i\u1ec7n 1.18 kW/h C\u00f4ng ngh\u1ec7 ti\u1ebft ki\u1ec7m \u0111i\u1ec7n Hybrid Inverter Eco C\u00f4ng ngh\u1ec7 l\u00e0m l\u1ea1nh nhanh Hi Power Kh\u1ea3 n\u0103ng l\u1ecdc b\u1ee5i, kh\u00e1ng khu\u1ea9n, kh\u1eed m\u00f9i C\u00f4ng ngh\u1ec7 Ultra Fresh tinh l\u1ecdc kh\u00f4ng kh\u00ed C\u00f4ng ngh\u1ec7 Magic Coil ch\u1ed1ng b\u00e1m b\u1ea9n B\u1ed9 l\u1ecdc ch\u1ed1ng n\u1ea5m m\u1ed1c Ch\u1ebf \u0111\u1ed9 gi\u00f3 \u0110i\u1ec1u khi\u1ec3n l\u00ean xu\u1ed1ng t\u1ef1 \u0111\u1ed9ng, tr\u00e1i ph\u1ea3i t\u00f9y ch\u1ec9nh tay Ti\u1ec7n \u00edch T\u1ef1 kh\u1edfi \u0111\u1ed9ng l\u1ea1i khi c\u00f3 \u0111i\u1ec7n Ch\u1ee9c n\u0103ng h\u00fat \u1ea9m H\u1eb9n gi\u1edd b\u1eadt/t\u1eaft m\u00e1y Ch\u1ebf \u0111\u1ed9 ch\u1ec9 s\u1eed d\u1ee5ng qu\u1ea1t Fan Only - ch\u1ec9 l\u00e0m m\u00e1t, kh\u00f4ng l\u00e0m l\u1ea1nh Ch\u1ee9c n\u0103ng t\u1ef1 l\u00e0m s\u1ea1ch D\u00f2ng \u0111i\u1ec7n v\u00e0o D\u00e0n n\u00f3ng ho\u1eb7c d\u00e0n l\u1ea1nh D\u00f2ng \u0111i\u1ec7n ho\u1ea1t \u0111\u1ed9ng 1 pha S\u1ed1 l\u01b0\u1ee3ng k\u1ebft n\u1ed1i d\u00e0n l\u1ea1nh t\u1ed1i \u0111a 1 \u0110\u00e1nh gi\u00e1 chi ti\u1ebft v\u1ec1 s\u1ea3n ph\u1ea9m \u0111i\u1ec1u h\u00f2a Toshiba Inverter 12.000 BTU (1.5 HP) RAS-H13Z1KCVG-V S\u1edf h\u1eefu nhi\u1ec1u c\u1ea3i ti\u1ebfn v\u1ec1 t\u00ednh n\u0103ng c\u0169ng nh\u01b0 \u0111\u01b0\u1ee3c t\u00edch h\u1ee3p nh\u1eefng c\u00f4ng ngh\u1ec7 h\u00e0ng \u0111\u1ea7u, m\u00e1y l\u1ea1nh Toshiba Inverter 12.000 BTU (1.5 HP) RAS-H13Z1KCVG-V h\u1ee9a h\u1eb9n s\u1ebd l\u00e0 m\u1ed9t s\u1ef1 l\u1ef1a ch\u1ecdn s\u00e1ng gi\u00e1, gi\u00fap kh\u00f4ng gian s\u1ed1ng c\u1ee7a gia \u0111\u00ecnh b\u1ea1n \u0111\u01b0\u1ee3c n\u00e2ng l\u00ean m\u1ed9t t\u1ea7m cao m\u1edbi. H\u00e3y c\u00f9ng Ho\u00e0ng H\u00e0 Mobile t\u00ecm hi\u1ec3u nh\u1eefng \u01b0u \u0111i\u1ec3m n\u1ed5i b\u1eadt c\u1ee7a s\u1ea3n ph\u1ea9m \u0111i\u1ec1u h\u00f2a l\u00e0m m\u00e1t n\u00e0y th\u00f4ng qua b\u00e0i vi\u1ebft d\u01b0\u1edbi \u0111\u00e2y. Thi\u1ebft k\u1ebf trang nh\u00e3 v\u00e0 tinh t\u1ebf, t\u1ea1o \u0111i\u1ec3m nh\u1ea5n cho kh\u00f4ng gian n\u1ed9i th\u1ea5t M\u00e1y l\u1ea1nh Toshiba Inverter 12.000 BTU (1.5 HP) RAS-H13Z1KCVG-V \u0111\u01b0\u1ee3c thi\u1ebft k\u1ebf theo d\u1ea1ng kh\u1ed1i ch\u1eef nh\u1eadt ngang ph\u1ed5 bi\u1ebfn, c\u00e1c c\u1ea1nh vi\u1ec1n \u0111\u01b0\u1ee3c bo tr\u00f2n m\u1ec1m m\u1ea1i t\u1ea1o n\u00ean t\u1ed5ng th\u1ec3 sang tr\u1ecdng v\u00e0 tinh t\u1ebf. S\u1ea3n ph\u1ea9m s\u1eed d\u1ee5ng t\u00f4ng m\u00e0u tr\u1eafng ch\u1ee7 \u0111\u1ea1o, c\u00f3 th\u1ec3 ph\u1ed1i h\u1ee3p h\u00e0i h\u00f2a v\u1edbi m\u1ecdi kh\u00f4ng gian n\u1ed9i th\u1ea5t v\u1edbi phong c\u00e1ch kh\u00e1c nhau, t\u1eeb ph\u00f2ng kh\u00e1ch, ph\u00f2ng ng\u1ee7 cho \u0111\u1ebfn v\u0103n ph\u00f2ng l\u00e0m vi\u1ec7c, l\u1edbp h\u1ecdc,.\u2026 D\u00e0n n\u00f3ng c\u1ee7a \u0111i\u1ec1u h\u00f2a \u0111\u01b0\u1ee3c ho\u00e0n thi\u1ec7n v\u1edbi l\u1edbp v\u1ecf ngo\u00e0i c\u1ee9ng c\u00e1p v\u00e0 d\u00e0y d\u1eb7n, gi\u00fap b\u1ea3o v\u1ec7 v\u00e0 che ch\u1eafn cho c\u00e1c linh ki\u1ec7n b\u00ean trong lu\u00f4n \u0111\u01b0\u1ee3c an to\u00e0n, \u0111\u1eb7c bi\u1ec7t l\u00e0 trong nh\u1eefng \u0111i\u1ec1u ki\u1ec7n kh\u1eafc nghi\u1ec7t c\u1ee7a th\u1eddi ti\u1ebft v\u00e0 kh\u00ed h\u1eadu. S\u1ea3n ph\u1ea9m \u0111\u01b0\u1ee3c trang b\u1ecb h\u1ec7 th\u1ed1ng \u1ed1ng d\u1eabn gas b\u1eb1ng \u0111\u1ed3ng v\u00e0 l\u00e1 t\u1ea3n nhi\u1ec7t l\u00e0m t\u1eeb ch\u1ea5t li\u1ec7u nh\u00f4m, \u0111\u1ea3m b\u1ea3o s\u1ef1 b\u1ec1n b\u1ec9 v\u00e0 k\u00e9o d\u00e0i tu\u1ed5i th\u1ecd cho thi\u1ebft b\u1ecb, h\u1ea1n ch\u1ebf t\u00ecnh tr\u1ea1ng oxy h\u00f3a ch\u1ed1ng \u0103n m\u00f2n, mang l\u1ea1i hi\u1ec7u su\u1ea5t l\u00e0m l\u1ea1nh t\u1ed1i \u01b0u nh\u1ea5t. \u0110i\u1ec1u h\u00f2a Toshiba Inverter 12.000 BTU (1.5 HP) RAS-H13Z1KCVG-V l\u00e0m l\u1ea1nh nhanh ch\u00f3ng v\u1edbi c\u00f4ng ngh\u1ec7 Hi Power M\u00e1y l\u1ea1nh Toshiba s\u1edf h\u1eefu c\u00f4ng su\u1ea5t m\u1ea1nh m\u1ebd 12.000 BTU (t\u01b0\u01a1ng \u0111\u01b0\u01a1ng 1.5 HP), ph\u00f9 h\u1ee3p \u0111\u1ec3 l\u1eafp \u0111\u1eb7t v\u00e0 s\u1eed d\u1ee5ng trong nh\u1eefng kh\u00f4ng gian d\u01b0\u1edbi 20m2 (t\u1eeb 40 \u0111\u1ebfn 60m3)\u200b. S\u1ea3n ph\u1ea9m c\u00f2n \u0111\u01b0\u1ee3c t\u00edch h\u1ee3p ch\u1ebf \u0111\u1ed9 l\u00e0m l\u1ea1nh nhanh Hi Power. Khi k\u00edch ho\u1ea1t ch\u1ebf \u0111\u1ed9 n\u00e0y, c\u00f4ng su\u1ea5t c\u1ee7a m\u00e1y s\u1ebd \u0111\u01b0\u1ee3c \u0111\u1ea9y l\u00ean cao h\u01a1n b\u00ecnh th\u01b0\u1eddng \u0111\u1ec3 gi\u1ea3m nhi\u1ec7t \u0111\u1ed9 m\u1ed9t c\u00e1ch nhanh ch\u00f3ng. C\u00e1nh \u0111\u1ea3o gi\u00f3 h\u01b0\u1edbng xu\u1ed1ng v\u1edbi t\u1ed1c \u0111\u1ed9 qu\u1ea1t \u0111\u1ea1t m\u1ee9c t\u1ed1i \u0111a, \u0111\u1ea3m b\u1ea3o \u0111\u1ea1t \u0111\u01b0\u1ee3c m\u1ee9c nhi\u1ec7t \u0111\u1ed9 m\u00e0 ng\u01b0\u1eddi d\u00f9ng mong mu\u1ed1n ch\u1ec9 trong th\u1eddi gian ng\u1eafn. \u0110\u1ed9 \u1ed3n c\u1ee7a thi\u1ebft b\u1ecb khi ho\u1ea1t \u0111\u1ed9ng c\u0169ng ch\u1ec9 dao \u0111\u1ed9ng trong kho\u1ea3ng t\u1eeb 24 - 43/48 dB, t\u01b0\u01a1ng \u0111\u01b0\u01a1ng v\u1edbi \u00e2m thanh ti\u1ebfng m\u01b0a r\u01a1i v\u1eeba ph\u1ea3i hay ti\u1ebfng n\u00f3i chuy\u1ec7n th\u00ec th\u1ea7m. \u0110i\u1ec1u n\u00e0y mang \u0111\u1ebfn kh\u00f4ng gian y\u00ean t\u0129nh v\u00e0 th\u01b0 gi\u00e3n, kh\u00f4ng g\u00e2y \u1ea3nh h\u01b0\u1edfng \u0111\u1ebfn gi\u1ea5c ng\u1ee7 hay nh\u1eefng ho\u1ea1t \u0111\u1ed9ng sinh ho\u1ea1t kh\u00e1c trong gia \u0111\u00ecnh. C\u01a1 ch\u1ebf th\u1ed5i gi\u00f3 th\u00f4ng minh M\u00e1y l\u1ea1nh Toshiba Inverter 12.000 BTU (1.5 HP) RAS-H13Z1KCVG-V \u0111\u01b0\u1ee3c t\u00edch h\u1ee3p c\u01a1 ch\u1ebf th\u1ed5i gi\u00f3 th\u00f4ng minh v\u1edbi t\u00ednh n\u0103ng t\u1ef1 \u0111\u1ed9ng \u0111i\u1ec1u khi\u1ec3n l\u00ean xu\u1ed1ng, \u0111i\u1ec1u ch\u1ec9nh tr\u00e1i - ph\u1ea3i b\u1eb1ng tay. Trong qu\u00e1 tr\u00ecnh ho\u1ea1t \u0111\u1ed9ng, s\u1ea3n ph\u1ea9m s\u1ebd th\u1ed5i ra lu\u1ed3ng kh\u00f4ng kh\u00ed l\u1ea1nh lan t\u1ecfa kh\u1eafp kh\u00f4ng gian m\u1ed9t c\u00e1ch \u0111\u1ed3ng \u0111\u1ec1u. D\u00f9 \u0111\u1ee9ng \u1edf b\u1ea5t c\u1ee9 v\u1ecb tr\u00ed n\u00e0o trong ph\u00f2ng, ng\u01b0\u1eddi d\u00f9ng \u0111\u1ec1u c\u00f3 th\u1ec3 c\u1ea3m nh\u1eadn \u0111\u01b0\u1ee3c s\u1ef1 m\u00e1t m\u1ebb v\u00e0 d\u1ec5 ch\u1ecbu. Ti\u1ebft ki\u1ec7m \u0111i\u1ec7n n\u0103ng khi s\u1eed d\u1ee5ng m\u00e1y l\u1ea1nh Toshiba Inverter 12.000 BTU (1.5 HP) RAS-H13Z1KCVG-V M\u00e1y l\u1ea1nh Toshiba \u0111\u1ea1t m\u1ee9c c\u00f4ng su\u1ea5t ti\u00eau th\u1ee5 \u0111i\u1ec7n n\u0103ng l\u00e0 1.18 kW/h, k\u1ebft h\u1ee3p c\u00f9ng c\u00f4ng ngh\u1ec7 Hybrid Inverter v\u1edbi 2 module \u0111i\u1ec1u khi\u1ec3n \u0111\u1ed9c l\u1eadp gi\u00fap gi\u1ea3m ti\u00eau hao \u0111i\u1ec7n n\u0103ng \u0111\u1ebfn h\u01a1n 50%. Kh\u00f4ng nh\u1eefng v\u1eady, c\u00f4ng ngh\u1ec7 n\u00e0y c\u00f2n gi\u00fap thi\u1ebft b\u1ecb v\u1eadn h\u00e0nh m\u1ed9t c\u00e1ch \u00eam \u00e1i v\u00e0 \u1ed5n \u0111\u1ecbnh, duy tr\u00ec \u0111\u1ed9 l\u1ea1nh v\u00e0 gi\u1ea3m ti\u1ebfng \u1ed3n. V\u1edbi ch\u1ebf \u0111\u1ed9 Eco, nhi\u1ec7t \u0111\u1ed9 c\u1ee7a m\u00e1y lu\u00f4n \u0111\u01b0\u1ee3c duy tr\u00ec \u1edf m\u1ee9c \u1ed5n \u0111\u1ecbnh trong khi v\u1eabn \u0111\u1ea3m b\u1ea3o ti\u1ebft ki\u1ec7m \u0111i\u1ec7n n\u0103ng l\u00ean t\u1edbi 25%. Ng\u01b0\u1eddi d\u00f9ng c\u00f3 th\u1ec3 y\u00ean t\u00e2m ch\u00ecm v\u00e0o gi\u1ea5c ng\u1ee7 s\u00e2u m\u00e0 kh\u00f4ng ph\u1ea3i lo l\u1eafng r\u1eb1ng c\u01a1 th\u1ec3 s\u1ebd b\u1ecb qu\u00e1 n\u00f3ng ho\u1eb7c qu\u00e1 l\u1ea1nh, gi\u1ea3m thi\u1ec3u t\u1ed1i \u0111a nh\u1eefng nguy c\u01a1 g\u00e2y c\u1ea3m l\u1ea1nh, ho,.\u2026 Thanh l\u1ecdc kh\u00f4ng kh\u00ed v\u1edbi c\u00f4ng ngh\u1ec7 Ultra Fresh ti\u00ean ti\u1ebfn \u0110i\u1ec1u h\u00f2a Toshiba Inverter 12.000 BTU (1.5 HP) RAS-H13Z1KCVG-V \u0111\u01b0\u1ee3c trang b\u1ecb c\u00f4ng ngh\u1ec7 tinh l\u1ecdc kh\u00f4ng kh\u00ed Ultra Fresh - m\u1ed9t trong nh\u1eefng c\u00f4ng ngh\u1ec7 kh\u00e1ng khu\u1ea9n h\u00e0ng \u0111\u1ea7u \u0111\u01b0\u1ee3c s\u1eed d\u1ee5ng tr\u00ean c\u00e1c s\u1ea3n ph\u1ea9m m\u00e1y l\u1ea1nh c\u1ee7a Toshiba. B\u1ed9 l\u1ecdc Toshiba IAQ bao g\u1ed3m 2 th\u00e0nh ph\u1ea7n l\u00e0 tinh th\u1ec3 b\u1ea1c v\u00e0 leuconostoc enzyme c\u00f3 kh\u1ea3 n\u0103ng \u1ee9c ch\u1ebf s\u1ef1 ph\u00e1t tri\u1ec3n c\u1ee7a c\u00e1c lo\u1ea1i vi khu\u1ea9n c\u00f3 h\u1ea1i, gi\u00fap b\u1ea7u kh\u00f4ng kh\u00ed lu\u00f4n t\u01b0\u01a1i m\u00e1t v\u00e0 trong l\u00e0nh, b\u1ea3o v\u1ec7 s\u1ee9c kh\u1ecfe h\u00f4 h\u1ea5p c\u1ee7a ng\u01b0\u1eddi d\u00f9ng m\u1ed9t c\u00e1ch t\u1ed1i \u0111a. L\u01b0\u1edbi l\u1ecdc ch\u1ed1ng n\u1ea5m m\u1ed1c c\u00f3 kh\u1ea3 n\u0103ng l\u1ecdc s\u1ea1ch b\u1ee5i b\u1ea9n v\u00e0 c\u00e1c ch\u1ea5t g\u00e2y k\u00edch \u1ee9ng trong kh\u00f4ng kh\u00ed, \u0111\u1ea3m b\u1ea3o kh\u00f4ng gian s\u1ed1ng lu\u00f4n s\u1ea1ch s\u1ebd v\u00e0 tinh khi\u1ebft. Ph\u1ea7n l\u01b0\u1edbi l\u1ecdc c\u0169ng r\u1ea5t ti\u1ec7n d\u1ee5ng, ng\u01b0\u1eddi d\u00f9ng c\u00f3 th\u1ec3 d\u1ec5 d\u00e0ng th\u00e1o ra \u0111\u1ec3 v\u1ec7 sinh \u0111\u1ecbnh k\u1ef3. T\u1ed1i \u01b0u hi\u1ec7u qu\u1ea3 l\u00e0m l\u1ea1nh, ti\u1ebft ki\u1ec7m chi ph\u00ed v\u1edbi c\u00f4ng ngh\u1ec7 ch\u1ed1ng b\u00e1m b\u1ea9n Magic Coil D\u00e0n l\u1ea1nh c\u1ee7a m\u00e1y l\u1ea1nh Toshiba Inverter 12.000 BTU (1.5 HP) RAS-H13Z1KCVG-V \u0111\u01b0\u1ee3c bao ph\u1ee7 m\u1ed9t l\u1edbp ph\u1ee7 \u0111\u1eb7c bi\u1ec7t mang t\u00ean Magic Coil. L\u1edbp ph\u1ee7 \u0111\u1eb7c bi\u1ec7t n\u00e0y c\u00f3 t\u00e1c d\u1ee5ng h\u1ea1n ch\u1ebf s\u1ef1 t\u00edch t\u1ee5 c\u1ee7a b\u1ee5i b\u1ea9n, n\u1ea5m m\u1ed1c b\u00e1m tr\u00ean b\u1ec1 m\u1eb7t d\u00e0n l\u1ea1nh trong qu\u00e1 tr\u00ecnh s\u1eed d\u1ee5ng. Nh\u1edd \u0111\u00f3, thi\u1ebft b\u1ecb s\u1ebd mang l\u1ea1i hi\u1ec7u qu\u1ea3 l\u00e0m l\u1ea1nh t\u1ed1t h\u01a1n, gi\u00fap n\u00e2ng cao ch\u1ea5t l\u01b0\u1ee3ng kh\u00f4ng kh\u00ed c\u0169ng nh\u01b0 k\u00e9o d\u00e0i tu\u1ed5i th\u1ecd cho s\u1ea3n ph\u1ea9m, \u0111\u1ed3ng th\u1eddi gia\u0309m thi\u1ec3u chi phi\u0301 v\u1ec7 sinh, b\u1ea3o d\u01b0\u1ee1ng \u0111\u1ecbnh k\u1ef3 h\u00e0ng th\u00e1ng. T\u00f9y ch\u1ecdn c\u00f4ng su\u1ea5t ho\u1ea1t \u0111\u1ed9ng tr\u00ean \u0111i\u1ec1u h\u00f2a Toshiba Inverter 12.000 BTU (1.5 HP) RAS-H13Z1KCVG-V M\u00e1y l\u1ea1nh Toshiba cho ph\u00e9p ng\u01b0\u1eddi d\u00f9ng \u0111i\u1ec1u ch\u1ec9nh c\u00f4ng su\u1ea5t ho\u1ea1t \u0111\u1ed9ng c\u1ee7a m\u00e1y t\u00f9y theo s\u1ed1 l\u01b0\u1ee3ng ng\u01b0\u1eddi trong ph\u00f2ng, v\u1edbi 3 m\u1ee9c 50%, 75% v\u00e0 100%. \u0110i\u1ec1u n\u00e0y gi\u00fap thi\u1ebft b\u1ecb c\u00f3 th\u1ec3 ch\u1ee7 \u0111\u1ed9ng ki\u1ec3m so\u00e1t \u0111\u01b0\u1ee3c d\u00f2ng \u0111i\u1ec7n c\u0169ng nh\u01b0 h\u1ea1n ch\u1ebf x\u1ea3y ra tr\u01b0\u1eddng h\u1ee3p m\u1ea5t \u0111i\u1ec7n \u0111\u1ed9t ng\u1ed9t do qu\u00e1 t\u1ea3i, \u0111\u1ed3ng th\u1eddi gi\u00fap ti\u1ebft ki\u1ec7m \u0111i\u1ec7n n\u0103ng ti\u00eau th\u1ee5, t\u0103ng \u0111\u1ed9 b\u1ec1n c\u1ee7a m\u00e1y v\u00e0 gi\u1ea3m ti\u1ebfng \u1ed3n t\u1eeb d\u00e0n n\u00f3ng. T\u00ednh n\u0103ng t\u1ef1 \u0111\u1ed9ng l\u00e0m s\u1ea1ch \u0110i\u1ec1u h\u00f2a Toshiba Inverter 12.000 BTU (1.5 HP) RAS-H13Z1KCVG-V \u0111\u01b0\u1ee3c trang b\u1ecb t\u00ednh n\u0103ng t\u1ef1 \u0111\u1ed9ng l\u00e0m s\u1ea1ch. Khi thi\u1ebft b\u1ecb ng\u1eebng ho\u1ea1t \u0111\u1ed9ng, c\u00e1nh qu\u1ea1t b\u00ean trong s\u1ebd \u0111\u01b0\u1ee3c k\u00edch ho\u1ea1t \u0111\u1ec3 gi\u1ea3m \u0111\u1ed9 \u1ea9m b\u00ean trong m\u00e1y v\u00e0 hong kh\u00f4 ho\u00e0n to\u00e0n d\u00e0n l\u1ea1nh. \u0110i\u1ec1u n\u00e0y s\u1ebd gi\u00fap thi\u1ebft b\u1ecb lu\u00f4n duy tr\u00ec \u0111\u01b0\u1ee3c s\u1ef1 s\u1ea1ch s\u1ebd, h\u1ea1n ch\u1ebf h\u00ecnh th\u00e0nh n\u1ea5m m\u1ed1c v\u00e0 g\u00e2y m\u00f9i kh\u00f3 ch\u1ecbu. M\u1ed9t s\u1ed1 t\u00ednh n\u0103ng ti\u1ec7n \u00edch c\u1ee7a m\u00e1y l\u1ea1nh Toshiba Inverter 12.000 BTU (1.5 HP) RAS-H13Z1KCVG-V Trong nh\u1eefng ng\u00e0y \u0111\u1ed9 \u1ea9m kh\u00f4ng kh\u00ed t\u0103ng cao, t\u00ednh n\u0103ng h\u00fat \u1ea9m c\u1ee7a thi\u1ebft b\u1ecb s\u1ebd gi\u00fap lo\u1ea1i b\u1ecf l\u01b0\u1ee3ng h\u01a1i \u1ea9m d\u01b0 th\u1eeba, mang l\u1ea1i b\u1ea7u kh\u00f4ng kh\u00ed kh\u00f4 tho\u00e1ng v\u00e0 s\u1ea1ch s\u1ebd, gi\u00fap ng\u01b0\u1eddi d\u00f9ng c\u1ea3m th\u1ea5y d\u1ec5 ch\u1ecbu h\u01a1n. V\u1edbi ch\u1ebf \u0111\u1ed9 h\u1eb9n gi\u1edd b\u1eadt/t\u1eaft m\u00e1y, ng\u01b0\u1eddi d\u00f9ng c\u00f3 th\u1ec3 ch\u1ee7 \u0111\u1ed9ng ki\u1ec3m so\u00e1t th\u1eddi gian s\u1eed d\u1ee5ng m\u00e1y, tr\u00e1nh t\u00ecnh tr\u1ea1ng l\u00e3ng ph\u00ed \u0111i\u1ec7n n\u0103ng do qu\u00ean t\u1eaft m\u00e1y khi ra ngo\u00e0i. Ch\u1ebf \u0111\u1ed9 Fan Only cho ph\u00e9p thi\u1ebft b\u1ecb ho\u1ea1t \u0111\u1ed9ng nh\u01b0 m\u1ed9t chi\u1ebfc qu\u1ea1t th\u00f4ng th\u01b0\u1eddng, t\u1ea1o ra b\u1ea7u kh\u00f4ng kh\u00ed d\u1ecbu m\u00e1t trong ph\u00f2ng m\u00e0 kh\u00f4ng l\u00e0m l\u1ea1nh, th\u00edch h\u1ee3p v\u1edbi nh\u1eefng ng\u00e0y th\u1eddi ti\u1ebft m\u00e1t m\u1ebb, kh\u00f4ng qu\u00e1 n\u00f3ng. Gi\u00e1 b\u00e1n tham kh\u1ea3o c\u1ee7a s\u1ea3n ph\u1ea9m \u0111i\u1ec1u h\u00f2a Toshiba Inverter 12.000 BTU (1.5 HP) RAS-H13Z1KCVG-V M\u00e1y l\u1ea1nh Toshiba Inverter 12.000 BTU (1.5 HP) RAS-H13Z1KCVG-V l\u00e0 m\u1ed9t s\u1ea3n ph\u1ea9m \u0111i\u1ec1u h\u00f2a kh\u00f4ng kh\u00ed n\u1eb1m trong ph\u00e2n kh\u00fac gi\u00e1 t\u1ea7m trung. V\u1edbi nh\u1eefng c\u00f4ng ngh\u1ec7 hi\u1ec7n \u0111\u1ea1i m\u00e0 nh\u00e0 s\u1ea3n xu\u1ea5t Toshiba mang \u0111\u1ebfn c\u00f9ng v\u1edbi m\u1ee9c gi\u00e1 c\u1ef1c k\u00ec \u01b0u \u0111\u00e3i, s\u1ea3n ph\u1ea9m n\u00e0y ch\u1eafc ch\u1eafn s\u1ebd kh\u00f4ng l\u00e0m b\u1ea1n th\u1ea5t v\u1ecdng. Hi\u1ec7n t\u1ea1i, s\u1ea3n ph\u1ea9m \u0111i\u1ec1u h\u00f2a Toshiba \u0111ang \u0111\u01b0\u1ee3c ph\u00e2n ph\u1ed1i ch\u00ednh h\u00e3ng t\u1ea1i c\u00e1c c\u1eeda h\u00e0ng Ho\u00e0ng H\u00e0 Mobile tr\u00ean to\u00e0n qu\u1ed1c (l\u01b0u \u00fd, gi\u00e1 b\u00e1n c\u1ee7a s\u1ea3n ph\u1ea9m c\u00f3 th\u1ec3 thay \u0111\u1ed5i t\u1ea1i t\u1eebng th\u1eddi \u0111i\u1ec3m). N\u1ebfu c\u00f3 nhu c\u1ea7u mua h\u00e0ng hay c\u1ea7n \u0111\u01b0\u1ee3c h\u1ed7 tr\u1ee3, kh\u00e1ch h\u00e0ng c\u00f3 th\u1ec3 \u0111\u1ebfn ngay chi nh\u00e1nh Ho\u00e0ng H\u00e0 Mobile g\u1ea7n nh\u1ea5t ho\u1eb7c li\u00ean h\u1ec7 qua t\u1ed5ng \u0111\u00e0i 1900 2091 \u0111\u1ec3 \u0111\u01b0\u1ee3c t\u01b0 v\u1ea5n. S\u1edf h\u1eefu s\u1ea3n ph\u1ea9m m\u00e1y l\u1ea1nh Toshiba Inverter 12.000 BTU (1.5 HP) RAS-H13Z1KCVG-V ch\u00ednh h\u00e3ng gi\u00e1 t\u1ed1t t\u1ea1i Ho\u00e0ng H\u00e0 Mobile \u0110i\u1ec1u h\u00f2a Toshiba Inverter 12.000 BTU (1.5 HP) RAS-H13Z1KCVG-V s\u1edf h\u1eefu nhi\u1ec1u t\u00ednh n\u0103ng ti\u1ec7n \u00edch nh\u01b0 c\u00f4ng ngh\u1ec7 Hybrid Inverter v\u00e0 ch\u1ebf \u0111\u1ed9 Eco gi\u00fap ti\u1ebft ki\u1ec7m \u0111i\u1ec7n n\u0103ng, ch\u1ebf \u0111\u1ed9 l\u00e0m l\u1ea1nh nhanh Hi Power th\u00f4ng minh, c\u00f4ng ngh\u1ec7 Ultra Fresh k\u1ebft h\u1ee3p c\u00f9ng c\u00f4ng ngh\u1ec7 Magic Coil v\u00e0 b\u1ed9 l\u1ecdc ch\u1ed1ng n\u1ea5m m\u1ed1c gi\u00fap tinh l\u1ecdc kh\u00f4ng kh\u00ed. Thi\u1ebft b\u1ecb h\u1ee9a h\u1eb9n mang \u0111\u1ebfn b\u1ea7u kh\u00f4ng kh\u00ed s\u1ea1ch s\u1ebd v\u00e0 tinh khi\u1ebft, ph\u00f2ng tr\u00e1nh c\u00e1c c\u0103n b\u1ec7nh v\u1ec1 \u0111\u01b0\u1eddng h\u00f4 h\u1ea5p. M\u1ed9t thi\u1ebft b\u1ecb l\u00e0m m\u00e1t th\u00f4ng minh gi\u00fap n\u00e2ng c\u1ea5p kh\u00f4ng gian s\u1ed1ng c\u00f3 ph\u1ea3i l\u00e0 th\u1ee9 m\u00e0 b\u1ea1n \u0111ang t\u00ecm ki\u1ebfm? V\u1eady th\u00ec \u0111\u1eebng b\u1ecf qua chi\u1ebfc m\u00e1y l\u1ea1nh Inverter 1.5 HP RAS-H13Z1KCVG-V c\u1ee7a Toshiba! H\u00e3y \u0111\u1ebfn ngay Ho\u00e0ng H\u00e0 Mobile \u0111\u1ec3 nhanh tay s\u1edf h\u1eefu s\u1ea3n ph\u1ea9m tuy\u1ec7t v\u1eddi n\u00e0y v\u1edbi m\u1ee9c gi\u00e1 t\u1ed1t ch\u01b0a t\u1eebng c\u00f3 v\u00e0 nh\u1eadn v\u1ec1 nh\u1eefng ph\u1ea7n qu\u00e0 c\u00f3 gi\u00e1 tr\u1ecb. Xem to\u00e0n b\u1ed9 b\u00e0i vi\u1ebft",
        "promotion_1": "1. Tr\u00fang 8386 qu\u00e0 - T\u1ed5ng gi\u00e1 tr\u1ecb t\u1edbi 250 TRI\u1ec6U \u0110\u1ed2NG (\u00c1p d\u1ee5ng t\u1eeb 10/01 - 02/02/2025). (Xem chi ti\u1ebft). 2. \u0110\u1eb7c bi\u1ec7t Tr\u1ea3 g\u00f3p 3 kh\u00f4ng: 0% l\u00e3i su\u1ea5t - 0 ph\u00ed chuy\u1ec3n \u0111\u1ed5i - 0 tr\u1ea3 tr\u01b0\u1edbc (\u00c1p d\u1ee5ng cho c\u00f4ng ty t\u00e0i ch\u00ednh v\u00e0 th\u1ebb t\u00edn d\u1ee5ng)",
        "promotion_2": "1. Gi\u1ea3m t\u1edbi 500.000\u0111 khi thanh to\u00e1n th\u1ebb t\u00edn d\u1ee5ng NCB. (Xem chi ti\u1ebft). 2. Gi\u1ea3m \u0111\u1ebfn 150.000\u0111 khi thanh to\u00e1n qua Muadee. (Xem chi ti\u1ebft). 3. Mi\u1ec5n ph\u00ed chuy\u1ec3n \u0111\u1ed5i tr\u1ea3 g\u00f3p ho\u1eb7c gi\u1ea3m \u0111\u1ebfn 500.000\u0111 khi m\u1edf th\u1ebb TPBank EVO. (Xem chi ti\u1ebft). 4. M\u1edf th\u1ebb t\u00edn d\u1ee5ng VIB - Nh\u1eadn Voucher 600.000\u0111. (Xem chi ti\u1ebft). 5. M\u1edf th\u1ebb HSBC - Ho\u00e0n ti\u1ec1n t\u1edbi 2 tri\u1ec7u \u0111\u1ed3ng. (Xem chi ti\u1ebft)"
    },
    {
        "title": "\u0110i\u1ec1u h\u00f2a Toshiba Inverter 17.000 BTU (2 HP) RAS-H18S4KCV2G-V",
        "price": "gi\u00e1 hi\u1ec7n t\u1ea1i l\u00e0 16,900,000 \u20ab nh\u01b0ng tr\u01b0\u1edbc \u0111\u00e2y n\u00f3 c\u00f3 gi\u00e1 l\u00e0 19,790,000 \u20ab",
        "colors": "Tr\u1eafng",
        "technical_specifications": [
            {
                "Lo\u1ea1i m\u00e1y": "1 chi\u1ec1u (ch\u1ec9 l\u00e0m l\u1ea1nh)"
            },
            {
                "C\u00f4ng ngh\u1ec7 inverter": "M\u00e1y l\u1ea1nh Inverter"
            },
            {
                "C\u00f4ng su\u1ea5t l\u00e0m l\u1ea1nh": "2 HP - 17.000 BTU"
            },
            {
                "Ph\u1ea1m vi l\u00e0m l\u1ea1nh hi\u1ec7u qu\u1ea3": "T\u1eeb 20 - 30m\u00b2 (t\u1eeb 60 \u0111\u1ebfn 80m\u00b3)"
            },
            {
                "Nh\u00e3n n\u0103ng l\u01b0\u1ee3ng": "5 sao (Hi\u1ec7u su\u1ea5t n\u0103ng l\u01b0\u1ee3ng 4.85)"
            }
        ],
        "description": "\u0110i\u1ec1u h\u00f2a Toshiba Inverter 17.000 BTU (2 HP) RAS-H18S4KCV2G-V l\u00e0 m\u1ed9t trong nh\u1eefng m\u1eabu thi\u1ebft b\u1ecb \u0111i\u1ec7n t\u1eed l\u00e0m m\u00e1y m\u1ed9t chi\u1ec1u ti\u1ebft ki\u1ec7m \u0111i\u1ec7n n\u0103ng do th\u01b0\u01a1ng hi\u1ec7u Toshiba s\u1ea3n xu\u1ea5t. B\u00ean c\u1ea1nh thi\u1ebft k\u1ebf trang nh\u00e3 tinh t\u1ebf nh\u01b0 nhi\u1ec1u d\u00f2ng \u0111i\u1ec1u h\u00f2a kh\u00e1c tr\u00ean th\u1ecb tr\u01b0\u1eddng, s\u1ea3n ph\u1ea9m n\u00e0y c\u00f2n s\u1edf h\u1eefu h\u00e0ng lo\u1ea1t \u01b0u \u0111i\u1ec3m n\u1ed5i b\u1eadt v\u1edbi c\u00f4ng su\u1ea5t l\u00e0m l\u1ea1nh 2 HP - 17.000 BTU . C\u00f4ng ngh\u1ec7 Hybrid Inverter v\u00e0 Eco ti\u1ebft ki\u1ec7m \u0111i\u1ec7n n\u0103ng ti\u00eau th\u1ee5 \u0111\u1ec3 b\u1ea1n tho\u1ea3i m\u00e1i s\u1eed d\u1ee5ng su\u1ed1t m\u00f9a h\u00e8. M\u00e1y \u0111\u01b0\u1ee3c t\u00edch h\u1ee3p c\u00f4ng ngh\u1ec7 Ultra Fresh \u0111\u1ec3 \u0111\u1ea3m b\u1ea3o lu\u1ed3ng kh\u00f4ng kh\u00ed \u0111\u00e3 \u0111\u01b0\u1ee3c tinh l\u1ecdc k\u1ef9 c\u00e0ng tr\u01b0\u1edbc khi t\u1ecfa ra m\u1ed9t c\u00e1ch trong l\u00e0nh, m\u00e1t m\u1ebb. C\u00f4ng ngh\u1ec7 Hi Power l\u00e0m m\u00e1t kh\u00f4ng gian ngay t\u1ee9c th\u00ec. \u0110\u1eb7c \u0111i\u1ec3m n\u1ed5i b\u1eadt: Ti\u1ebft ki\u1ec7m \u0111i\u1ec7n n\u0103ng t\u1ed1i \u01b0u l\u00ean t\u1edbi 25% v\u1edbi ch\u1ebf \u0111\u1ed9 Hybrid Inverter v\u00e0 Eco th\u01b0\u1eddng ch\u1ec9 c\u00f3 tr\u00ean c\u00e1c m\u1eabu \u0111i\u1ec1u h\u00f2a uy t\u00edn, cao c\u1ea5p. C\u00f4ng su\u1ea5t l\u00e0m l\u1ea1nh c\u1ee7a thi\u1ebft b\u1ecb l\u00e0 2 HP - 17.000 BTU ph\u00f9 h\u1ee3p v\u1edbi kh\u00f4ng gian s\u1ed1ng c\u1ee7a m\u1ecdi nh\u00e0. C\u00f4ng ngh\u1ec7 tinh l\u1ecdc kh\u00f4ng kh\u00ed Ultra Fresh, lo\u1ea1i b\u1ecf n\u1ea5m m\u1ed1c b\u1ee5i b\u1ea9n \u0111\u1ec3 mang t\u1edbi lu\u1ed3ng kh\u00f4ng kh\u00ed m\u00e1t m\u1ebb, tho\u00e1ng \u0111\u00e3ng. T\u00ednh n\u0103ng Hi Power gi\u00fap nhi\u1ec7t \u0111\u1ed9 nhanh ch\u00f3ng gi\u1ea3m s\u00e2u, m\u00e1t ngay t\u1ee9c th\u00ec sau khi b\u1eadt m\u00e1y l\u1ea1nh. C\u01a1 ch\u1ebf th\u1ed5i gi\u00f3 \u0111i\u1ec1u ch\u1ec9nh t\u1ef1 \u0111\u1ed9ng, c\u00f3 ch\u1ee9c n\u0103ng h\u00fat \u1ea9m t\u1ed1t \u0111\u1ec3 \u0111\u1ea3m b\u1ea3o an to\u00e0n s\u1ee9c kh\u1ecfe cho c\u1ea3 tr\u1ebb nh\u1ecf. B\u1ea3ng th\u00f4ng s\u1ed1 k\u1ef9 thu\u1eadt c\u1ee7a m\u00e1y l\u1ea1nh Toshiba Inverter 17.000 BTU (2 HP) RAS-H18S4KCV2G-V T\u00ecm hi\u1ec3u c\u00e1c th\u00f4ng s\u1ed1 k\u1ef9 thu\u1eadt m\u00e0 nh\u00e0 s\u1ea3n xu\u1ea5t \u0111\u00e3 trang b\u1ecb cho chi\u1ebfc m\u00e1y l\u1ea1nh Toshiba Inverter n\u00e0y nh\u00e9! Th\u00f4ng s\u1ed1 Chi ti\u1ebft Th\u00f4ng tin s\u1ea3n ph\u1ea9m Lo\u1ea1i m\u00e1y l\u1ea1nh 1 chi\u1ec1u (ch\u1ec9 l\u00e0m l\u1ea1nh) C\u00f4ng su\u1ea5t l\u00e0m l\u1ea1nh 2 HP - 17.000 BTU Ph\u1ea1m vi thi\u1ebft\u00a0 b\u1ecb c\u00f3 th\u1ec3 l\u00e0m l\u1ea1nh T\u1eeb 20 - 30m\u00b2 (t\u1eeb 60 \u0111\u1ebfn 80m\u00b3) C\u00f4ng ngh\u1ec7 Inverter M\u00e1y l\u1ea1nh Inverter \u0110\u1ed9 \u1ed3n trung b\u00ecnh 35/38/40/43/45 dB Ch\u1ea5t li\u1ec7u d\u00e0n t\u1ea3n nhi\u1ec7t \u1ed0ng d\u1eabn gas b\u1eb1ng \u0110\u1ed3ng - L\u00e1 t\u1ea3n nhi\u1ec7t b\u1eb1ng Nh\u00f4m Lo\u1ea1i Gas R-32 M\u1ee9c ti\u00eau th\u1ee5 \u0111i\u1ec7n n\u0103ng Kh\u1ea3 n\u0103ng ti\u00eau th\u1ee5 \u0111i\u1ec7n 1.66 kW/h Nh\u00e3n n\u0103ng l\u01b0\u1ee3ng 5 sao (Hi\u1ec7u su\u1ea5t n\u0103ng l\u01b0\u1ee3ng 4.48) C\u00f4ng ngh\u1ec7 ti\u1ebft ki\u1ec7m \u0111i\u1ec7n Hybrid Inverter Eco Kh\u1ea3 n\u0103ng l\u1ecdc kh\u00f4ng kh\u00ed L\u1ecdc b\u1ee5i, kh\u00e1ng khu\u1ea9n, kh\u1eed m\u00f9i C\u00f4ng ngh\u1ec7 tinh l\u1ecdc kh\u00f4ng kh\u00ed Ultra Fresh C\u00f4ng ngh\u1ec7 ch\u1ed1ng b\u00e1m b\u1ea9n Magic Coil B\u1ed9 l\u1ecdc ch\u1ed1ng n\u1ea5m m\u1ed1c C\u00f4ng ngh\u1ec7 l\u00e0m l\u1ea1nh Ch\u1ebf \u0111\u1ed9 gi\u00f3 \u0110i\u1ec1u khi\u1ec3n l\u00ean xu\u1ed1ng t\u1ef1 \u0111\u1ed9ng, tr\u00e1i ph\u1ea3i t\u00f9y ch\u1ec9nh tay C\u00f4ng ngh\u1ec7 l\u00e0m l\u1ea1nh nhanh Hi Power Ti\u1ec7n \u00edch Ti\u1ec7n \u00edch T\u1ef1 kh\u1edfi \u0111\u1ed9ng l\u1ea1i khi c\u00f3 \u0111i\u1ec7n H\u1eb9n gi\u1edd t\u1eaft m\u00e1y Ch\u1ee9c n\u0103ng h\u00fat \u1ea9m Ch\u1ebf \u0111\u1ed9 ch\u1ec9 s\u1eed d\u1ee5ng qu\u1ea1t Fan Only - ch\u1ec9 l\u00e0m m\u00e1t, kh\u00f4ng l\u00e0m l\u1ea1nh Ch\u1ee9c n\u0103ng t\u1ef1 l\u00e0m s\u1ea1ch Th\u00f4ng s\u1ed1 k\u00edch th\u01b0\u1edbc/l\u1eafp \u0111\u1eb7t K\u00edch th\u01b0\u1edbc - Kh\u1ed1i l\u01b0\u1ee3ng d\u00e0n l\u1ea1nh D\u00e0i 79.8cm - Cao 29.3cm - D\u00e0y 23 cm - N\u1eb7ng 9kg K\u00edch th\u01b0\u1edbc - Kh\u1ed1i l\u01b0\u1ee3ng d\u00e0n n\u00f3ng D\u00e0i 78 cm - Cao 55cm - D\u00e0y 29 cm - N\u1eb7ng 33kg Chi\u1ec1u d\u00e0i l\u1eafp \u0111\u1eb7t \u1ed1ng \u0111\u1ed3ng T\u1ed1i thi\u1ec3u 3m - T\u1ed1i \u0111a 20m Chi\u1ec1u cao l\u1eafp \u0111\u1eb7t t\u1ed1i \u0111a gi\u1eefa c\u1ee5c n\u00f3ng v\u1edbi c\u1ee5c l\u1ea1nh 12m D\u00f2ng \u0111i\u1ec7n v\u00e0o D\u00e0n n\u00f3ng ho\u1eb7c d\u00e0n l\u1ea1nh D\u00f2ng \u0111i\u1ec7n ho\u1ea1t \u0111\u1ed9ng 1 pha K\u00edch th\u01b0\u1edbc \u1ed1ng \u0111\u1ed3ng 6/12 S\u1ed1 l\u01b0\u1ee3ng k\u1ebft n\u1ed1i d\u00e0n l\u1ea1nh t\u1ed1i \u0111a 1 D\u00f2ng s\u1ea3n ph\u1ea9m 2024 S\u1ea3n xu\u1ea5t t\u1ea1i Th\u00e1i Lan Th\u1eddi gian b\u1ea3o h\u00e0nh c\u1ee5c l\u1ea1nh 2 n\u0103m Th\u1eddi gian b\u1ea3o h\u00e0nh c\u1ee5c n\u00f3ng M\u00e1y n\u00e9n 5 n\u0103m Th\u01b0\u01a1ng hi\u1ec7u Toshiba \u0110\u00e1nh gi\u00e1 chi ti\u1ebft nh\u1eefng \u0111\u1eb7c \u0111i\u1ec3m n\u1ed5i b\u1eadt c\u1ee7a \u0111i\u1ec1u h\u00f2a Toshiba Inverter 17.000 BTU (2 HP) RAS-H18S4KCV2G-V \u0110i\u1ec1u h\u00f2a th\u01b0\u01a1ng hi\u1ec7u Toshiba n\u00f3i chung v\u00e0 Toshiba Inverter 17.000 BTU (2 HP) RAS-H18S4KCV2G-V n\u00f3i ri\u00eang l\u00e0 m\u1ed9t thi\u1ebft b\u1ecb kh\u00f4ng th\u1ec3 thi\u1ebfu n\u1ebfu b\u1ea1n mu\u1ed1n cu\u1ed9c s\u1ed1ng c\u1ee7a gia \u0111\u00ecnh trong nh\u1eefng ng\u00e0y h\u00e8 oi b\u1ee9c tr\u1edf n\u00ean m\u00e1t m\u1ebb v\u00e0 d\u1ec5 ch\u1ecbu h\u01a1n b\u1ea5t c\u1ee9 l\u00fac n\u00e0o. V\u1edbi h\u00e0ng lo\u1ea1t c\u00f4ng ngh\u1ec7 cao c\u1ea5p, hi\u1ec7n \u0111\u1ea1i, s\u1ea3n ph\u1ea9m n\u00e0y c\u00f3 th\u1ec3 \u0111\u00e1p \u1ee9ng \u0111\u01b0\u1ee3c y\u00eau c\u1ea7u c\u1ee7a m\u1ecdi ng\u01b0\u1eddi ng\u01b0\u1eddi d\u00f9ng, h\u1ed9 gia \u0111\u00ecnh. C\u00f9ng \u0111i v\u00e0o t\u00ecm hi\u1ec3u nh\u1eefng t\u00ednh n\u0103ng c\u1ed1t l\u00f5i t\u1ea1o n\u00ean gi\u00e1 tr\u1ecb \u0111\u1eb1ng sau chi\u1ebfc \u0111i\u1ec1u h\u00f2a n\u00e0y ngay nh\u00e9! C\u00f4ng ngh\u1ec7 Hybrid Inverter v\u00e0 Eco gi\u00fap ti\u1ebft ki\u1ec7m \u0111i\u1ec7n n\u0103ng cho ng\u01b0\u1eddi d\u00f9ng M\u00e1y l\u1ea1nh Toshiba Inverter 17.000 BTU (2 HP) RAS-H18S4KCV2G-V ho\u00e0n to\u00e0n \u0111\u00e1p \u1ee9ng \u0111\u01b0\u1ee3c nhu c\u1ea7u ti\u1ebft ki\u1ec7m \u0111i\u1ec7n n\u0103ng c\u1ee7a m\u1ecdi nhu c\u1ea7u khi ch\u1ecdn mua s\u1ea3n ph\u1ea9m. C\u00f4ng ngh\u1ec7 Hybrid Inverter l\u00e0 m\u1ed9t b\u01b0\u1edbc ti\u1ebfn \u0111\u00e1ng k\u1ec3 trong l\u0129nh v\u1ef1c l\u00e0m m\u00e1t, mang \u0111\u1ebfn nhi\u1ec1u \u01b0u \u0111i\u1ec3m v\u01b0\u1ee3t tr\u1ed9i so v\u1edbi c\u00e1c c\u00f4ng ngh\u1ec7 truy\u1ec1n th\u1ed1ng. \u0110\u00e2y l\u00e0 s\u1ef1 k\u1ebft h\u1ee3p th\u00f4ng minh gi\u1eefa hai c\u00f4ng ngh\u1ec7 \u0111i\u1ec1u khi\u1ec3n g\u1ed3m. PAM (Pulse Amplitude Modulation): Cung c\u1ea5p n\u0103ng l\u01b0\u1ee3ng m\u1ea1nh m\u1ebd gi\u00fap m\u00e1y l\u1ea1nh nhanh ch\u00f3ng \u0111\u1ea1t \u0111\u1ebfn nhi\u1ec7t \u0111\u1ed9 c\u00e0i \u0111\u1eb7t. PWM (Pulse Width Modulation): \u0110i\u1ec1u ch\u1ec9nh c\u00f4ng su\u1ea5t ho\u1ea1t \u0111\u1ed9ng m\u1ed9t c\u00e1ch ch\u00ednh x\u00e1c, gi\u00fap ti\u1ebft ki\u1ec7m n\u0103ng l\u01b0\u1ee3ng v\u00e0 duy tr\u00ec nhi\u1ec7t \u0111\u1ed9 \u1ed5n \u0111\u1ecbnh. K\u1ebft h\u1ee3p th\u00eam v\u1edbi c\u00f4ng ngh\u1ec7 Eco gi\u00fap m\u00e1y l\u1ea1nh t\u1ef1 \u0111\u1ed9ng \u0111i\u1ec1u ch\u1ec9nh c\u00e1c c\u00e0i \u0111\u1eb7t \u0111\u1ec3 gi\u1ea3m thi\u1ec3u ti\u00eau th\u1ee5 \u0111i\u1ec7n n\u0103ng, n\u00ean ng\u01b0\u1eddi d\u00f9ng s\u1ebd ti\u1ebft ki\u1ec7m ti\u1ec1n \u0111i\u1ec7n h\u00e0ng th\u00e1ng cho gia \u0111\u00ecnh h\u01a1n so v\u1edbi c\u00e1c lo\u1ea1i m\u00e1y l\u1ea1nh th\u00f4ng th\u01b0\u1eddng kh\u00e1c. M\u1eb7t kh\u00e1c, thi\u1ebft b\u1ecb v\u1eabn \u0111\u1ea3m b\u1ea3o kh\u00f4ng gian s\u1ed1ng c\u1ee7a b\u1ea1n lu\u00f4n m\u00e1t m\u1ebb v\u00e0 d\u1ec5 ch\u1ecbu. \u0110i\u1ec1u h\u00f2a Toshiba Inverter 17.000 BTU (2 HP) RAS-H18S4KCV2G-V c\u00f3 c\u00f4ng su\u1ea5t l\u00e0m l\u1ea1nh l\u1edbn Thi\u1ebft b\u1ecb n\u00e0y c\u1ee7a th\u01b0\u01a1ng hi\u1ec7u Toshiba c\u00f3 c\u00f4ng su\u1ea5t l\u00e0m l\u1ea1nh \u0111\u1ea1t 2 HP (17.000 BTU). \u0110\u00e2y l\u00e0 m\u1ed9t trong nh\u1eefng c\u00f4ng su\u1ea5t ph\u1ed5 bi\u1ebfn \u0111\u01b0\u1ee3c s\u1eed d\u1ee5ng cho \u0111i\u1ec1u h\u00f2a kh\u00f4ng kh\u00ed hi\u1ec7n nay, th\u01b0\u1eddng ph\u00f9 h\u1ee3p v\u1edbi c\u00e1c ph\u00f2ng c\u00f3 di\u1ec7n t\u00edch t\u1eeb 20 - 30m\u00b2 (t\u1eeb 60 \u0111\u1ebfn 80 m3) . \u0110i k\u00e8m v\u1edbi \u0111\u00f3 l\u00e0 kh\u1ea3 n\u0103ng l\u00e0m l\u1ea1nh c\u0103n ph\u00f2ng m\u1ed9t c\u00e1ch nhanh ch\u00f3ng. K\u1ebft h\u1ee3p v\u1edbi c\u00f4ng ngh\u1ec7 Inverter hi\u1ec7n \u0111\u1ea1i, m\u1ee9c ti\u00eau th\u1ee5 \u0111i\u1ec7n n\u0103ng \u0111\u00e3 \u0111\u01b0\u1ee3c c\u1ea3i thi\u1ec7n \u0111\u00e1ng k\u1ec3 m\u00e0 kh\u00f4ng c\u1ea7n lo l\u1eafng s\u1ebd qu\u00e1 t\u1ed1n \u0111i\u1ec7n. V\u00ec th\u1ebf, kh\u00e1ch h\u00e0ng c\u00f3 th\u1ec3 mua s\u1ea3n ph\u1ea9m v\u1ec1 \u0111\u1ec3 s\u1eed d\u1ee5ng trong ph\u00f2ng l\u00e0m vi\u1ec7c, ph\u00f2ng ng\u1ee7 hay b\u1ea5t c\u1ee9 m\u00f4i tr\u01b0\u1eddng n\u00e0o c\u1ea7n l\u00e0m m\u00e1t h\u00e0ng ng\u00e0y. \u0110\u1ea3m b\u1ea3o kh\u00f4ng kh\u00ed m\u00e1t l\u00e0nh, b\u1ea3o v\u1ec7 s\u1ee9c kh\u1ecfe v\u1edbi c\u00f4ng ngh\u1ec7 Ultra Fresh v\u00e0 Magic Coil M\u1ed9t \u0111i\u1ec3m n\u1ed5i b\u1eadt kh\u00f4ng th\u1ec3 kh\u00f4ng k\u1ec3 \u0111\u1ebfn tr\u00ean m\u00e1y l\u1ea1nh Toshiba Inverter 17.000 BTU (2 HP) RAS-H18S4KCV2G-V l\u00e0 c\u00f4ng ngh\u1ec7 tinh l\u1ecdc kh\u00f4ng kh\u00ed Ultra Fresh. B\u1ed9 l\u1ecdc Ultra Fresh v\u1edbi 3 l\u1edbp l\u1ecdc th\u00f4ng minh \u0111\u01b0\u1ee3c ch\u1ee9ng nh\u1eadn b\u1edfi Trung t\u00e2m Ki\u1ec3m so\u00e1t v\u00e0 Ph\u00f2ng ng\u1eeba D\u1ecbch b\u1ec7nh Hoa K\u1ef3 (CDC), c\u00f3 kh\u1ea3 n\u0103ng l\u1ecdc v\u00e0 lo\u1ea1i b\u1ecf \u0111\u1ebfn 15 lo\u1ea1i vi khu\u1ea9n nguy hi\u1ec3m, nh\u01b0 n\u1ea5m m\u1ed1c, b\u1ee5i b\u1ea9n, vi sinh v\u1eadt trong kh\u00f4ng gian m\u00e0 m\u1eaft th\u01b0\u1eddng kh\u00f3 nh\u00ecn th\u1ea5y \u0111\u01b0\u1ee3c,... \u0110\u1ed3ng th\u1eddi ph\u00e2n h\u1ee7y \u0111\u01b0\u1ee3c m\u00f9i h\u00f4i, \u1ea9m m\u1ed1c kh\u00f3 ch\u1ecbu. Ngo\u00e0i ra, l\u01b0\u1edbi l\u1ecdc c\u00f3 th\u1ec3 d\u1ec5 d\u00e0ng th\u00e1o ra \u0111\u1ec3 v\u1ec7 sinh khi c\u1ea7n c\u1ef1c ti\u1ec7n l\u1ee3i. Nh\u1edd v\u1eady gi\u00fap ch\u00fang ta gi\u1ea3m thi\u1ec3u nguy c\u01a1 m\u1eafc c\u00e1c b\u1ec7nh v\u1ec1 \u0111\u01b0\u1eddng h\u00f4 h\u1ea5p ho\u1eb7c d\u1ecb \u1ee9ng hi\u1ec7u qu\u1ea3. \u0110\u1eb7c bi\u1ec7t v\u1edbi c\u00e1c gia \u0111\u00ecnh c\u00f3 tr\u1ebb nh\u1ecf ng\u01b0\u1eddi gi\u00e0 v\u00e0 nh\u1eefng ng\u01b0\u1eddi c\u00f3 h\u1ec7 h\u00f4 h\u1ea5p nh\u1ea1y c\u1ea3m th\u00ec \u0111\u00e2y l\u00e0 c\u00f4ng ngh\u1ec7 v\u00f4 c\u00f9ng h\u1eefu \u00edch. B\u00ean c\u1ea1nh \u0111\u00f3, \u0111i\u1ec1u h\u00f2a c\u00f2n \u0111i k\u00e8m c\u00f4ng ngh\u1ec7 ch\u1ed1ng b\u00e1m b\u1ea9n Magic Coil. Hi\u1ec3u \u0111\u01a1n gi\u1ea3n, b\u1ec1 m\u1eb7t c\u1ee7a d\u00e0n l\u1ea1nh \u0111\u01b0\u1ee3c ph\u1ee7 s\u1eb5n m\u1ed9t l\u1edbp ph\u1ee7 \u0111\u1eb7c bi\u1ec7t c\u00f3 t\u00ean g\u1ecdi l\u00e0 Aqua. L\u1edbp ph\u1ee7 n\u00e0y c\u00f3 kh\u1ea3 n\u0103ng \u0111\u1ea9y l\u00f9i n\u01b0\u1edbc v\u00e0 c\u00e1c h\u1ea1t b\u1ee5i b\u1ea9n, ng\u0103n ch\u1eb7n ch\u00fang b\u00e1m v\u00e0o b\u1ec1 m\u1eb7t l\u00e1 nh\u00f4m c\u1ee7a d\u00e0n l\u1ea1nh. Khi d\u00e0n l\u1ea1nh lu\u00f4n s\u1ea1ch s\u1ebd, kh\u00e1ng khu\u1ea9n t\u1ed1t th\u00ec kh\u1ea3 n\u0103ng trao \u0111\u1ed5i nhi\u1ec7t \u0111\u01b0\u1ee3c c\u1ea3i thi\u1ec7n, gi\u00fap m\u00e1y l\u1ea1nh l\u00e0m l\u1ea1nh nhanh h\u01a1n v\u00e0 hi\u1ec7u qu\u1ea3 h\u01a1n. C\u00f4ng ngh\u1ec7 Magic Coil v\u00e0 Ultra Fresh ch\u00ednh l\u00e0 nh\u1eefng gi\u1ea3i ph\u00e1p hi\u1ec7u qu\u1ea3 \u0111\u1ec3 l\u00e0m s\u1ea1ch kh\u00f4ng kh\u00ed v\u00e0 b\u1ea3o v\u1ec7 s\u1ee9c kh\u1ecfe cho gia \u0111\u00ecnh b\u1ea1n khi ng\u1ed3i ph\u00f2ng m\u00e1y l\u1ea1nh su\u1ed1t c\u1ea3 ng\u00e0y. L\u00e0m m\u00e1t t\u1ee9c th\u00ec v\u1edbi c\u00f4ng ngh\u1ec7 Hi Power Hi Power l\u00e0 c\u00f4ng ngh\u1ec7 \u0111\u1ed9c quy\u1ec1n th\u01b0\u1eddng th\u1ea5y tr\u00ean m\u00e1y l\u1ea1nh hi\u1ec7n \u0111\u1ea1i c\u1ee7a Toshiba, v\u00e0 m\u1eabu \u0111i\u1ec1u h\u00f2a Toshiba Inverter 17.000 BTU (2 HP) RAS-H18S4KCV2G-V c\u0169ng c\u00f3. Khi k\u00edch ho\u1ea1t ch\u1ebf \u0111\u1ed9 Hi Power tr\u00ean remote, m\u00e1y n\u00e9n v\u00e0 qu\u1ea1t gi\u00f3 s\u1ebd ho\u1ea1t \u0111\u1ed9ng \u1edf c\u00f4ng su\u1ea5t t\u1ed1i \u0111a \u0111\u1ec3 ph\u00e2n kh\u1ed1i kh\u00ed l\u1ea1nh lan t\u1ecfa trong kh\u00f4ng gian, t\u1eeb \u0111\u00f3 gi\u1ea3m nhi\u1ec7t \u0111\u1ed9 ph\u00f2ng m\u1ed9t c\u00e1ch nhanh ch\u00f3ng. K\u1ebft h\u1ee3p v\u1edbi c\u00f4ng su\u1ea5t l\u00e0m l\u1ea1nh m\u1ea1nh m\u1ebd c\u1ee7a thi\u1ebft b\u1ecb, b\u1ea1n s\u1ebd c\u1ea3m nh\u1eadn \u0111\u01b0\u1ee3c lu\u1ed3ng kh\u00f4ng kh\u00ed m\u00e1t m\u1ebb \u0111\u00fang nh\u01b0 nhi\u1ec7t \u0111\u1ed9 mong mu\u1ed1n \u1edf tr\u00ean \u0111i\u1ec1u khi\u1ec3n, xua tan c\u00e1i n\u00f3ng t\u1ee9c th\u00ec v\u00e0 tr\u1ea3 l\u1ea1i s\u1ef1 tho\u1ea3i m\u00e1i, trong l\u00e0nh. \u0110\u00e2y l\u00e0 m\u1ed9t t\u00ednh n\u0103ng kh\u00e1 c\u1ea7n thi\u1ebft, \u0111\u1eb7c bi\u1ec7t h\u1eefu \u00edch trong nh\u1eefng ng\u00e0y th\u1eddi ti\u1ebft n\u1eafng n\u00f3ng \u0111\u1ec9nh \u0111i\u1ec3m ho\u1eb7c khi b\u1ea1n v\u1eeba v\u1ec1 nh\u00e0 sau khi \u0111i l\u00e0m ho\u1eb7c t\u1eadp th\u1ec3 d\u1ee5c. Ngo\u00e0i ra, m\u00e1y l\u1ea1nh Toshiba 2 HP Inverter RAS-H18C4KCVG-V c\u0169ng ho\u1ea1t \u0111\u1ed9ng v\u1edbi c\u01a1 ch\u1ebf \u0111i\u1ec1u khi\u1ec3n l\u00ean xu\u1ed1ng t\u1ef1 \u0111\u1ed9ng, tr\u00e1i ph\u1ea3i t\u00f9y ch\u1ec9nh khi b\u1eadt. Nh\u1edd v\u1eady, to\u00e0n b\u1ed9 kh\u00f4ng gian n\u01a1i \u0111\u1eb7t thi\u1ebft b\u1ecb l\u00e0m m\u00e1t b\u00ean trong \u0111\u1ec1u c\u00f3 kh\u00ed l\u1ea1nh lan t\u1ecfa, \u0111\u1ec3 b\u1ea1n v\u00e0 c\u00e1c th\u00e0nh vi\u00ean kh\u00e1c d\u00f9 ho\u1ea1t \u0111\u1ed9ng \u1edf v\u1ecb tr\u00ed n\u00e0o c\u0169ng c\u1ea3m nh\u1eadn \u0111\u01b0\u1ee3c s\u1ef1 khoan kho\u00e1i, d\u1ec5 ch\u1ecbu t\u1ee9c th\u00ec. C\u00e1c ti\u1ec7n \u00edch kh\u00e1c c\u1ee7a m\u00e1y l\u1ea1nh Toshiba Inverter 17.000 BTU (2 HP) RAS-H18S4KCV2G-V Ngo\u00e0i nh\u1eefng c\u00f4ng ngh\u1ec7 n\u1ed5i tr\u1ed9i k\u1ec3 tr\u00ean, thi\u1ebft b\u1ecb m\u00e1y l\u1ea1nh c\u1ee7a th\u01b0\u01a1ng hi\u1ec7u Toshiba c\u0169ng \u0111i k\u00e8m h\u00e0ng lo\u1ea1t ti\u1ec7n \u00edch kh\u00e1c, mang l\u1ea1i tr\u1ea3i nghi\u1ec7m s\u1eed d\u1ee5ng t\u1ed1t nh\u1ea5t cho kh\u00e1ch h\u00e0ng. Ch\u1eb3ng h\u1ea1n nh\u01b0, khi b\u1ea1n \u0111\u00e3 c\u1ea3m th\u1ea5y nhi\u1ec7t \u0111\u1ed9 ph\u00f2ng \u0111\u1ee7 m\u00e1t sau m\u1ed9t th\u1eddi gian b\u1eadt \u0111i\u1ec1u h\u00f2a c\u00f3 th\u1ec3 chuy\u1ec3n qua ch\u1ebf \u0111\u1ed9 Fan Only (ch\u1ec9 qu\u1ea1t). L\u00fac n\u00e0y, \u0111i\u1ec1u h\u00f2a Toshiba Inverter 17.000 BTU (2 HP) RAS-H18S4KCV2G-V s\u1ebd ho\u1ea1t \u0111\u1ed9ng nh\u01b0 m\u1ed9t chi\u1ebfc qu\u1ea1t th\u00f4ng th\u01b0\u1eddng, c\u00f2n m\u00e1y n\u00e9n (b\u1ed9 ph\u1eadn l\u00e0m l\u1ea1nh) s\u1ebd t\u1ea1m ng\u1eebng ho\u1ea1t \u0111\u1ed9ng. Vi\u1ec7c n\u00e0y gi\u00fap ti\u1ebft ki\u1ec7m \u0111i\u1ec7n n\u0103ng \u0111\u00e1ng k\u1ec3, \u0111\u1eb7c bi\u1ec7t h\u1eefu \u00edch trong nh\u1eefng ng\u00e0y th\u1eddi ti\u1ebft m\u00e1t m\u1ebb ho\u1eb7c khi b\u1ea1n mu\u1ed1n th\u00f4ng tho\u00e1ng ph\u00f2ng m\u00e0 kh\u00f4ng c\u1ea7n l\u00e0m l\u1ea1nh s\u00e2u. Ngo\u00e0i ra, trong qu\u00e1 tr\u00ecnh s\u1eed d\u1ee5ng thi\u1ebft b\u1ecb, ch\u00fang ta c\u00f2n c\u00f3 th\u1ec3 h\u1eb9n gi\u1edd t\u1eaft m\u00e1y theo nhu c\u1ea7u ho\u1eb7c t\u1ef1 kh\u1edfi \u0111\u1ed9ng l\u1ea1i thi\u1ebft b\u1ecb khi c\u00f3 \u0111i\u1ec7n v\u1edbi nhi\u1ec7t \u0111\u1ed9 \u0111\u00fang nh\u01b0 c\u00e0i \u0111\u1eb7t t\u1eeb tr\u01b0\u1edbc. \u0110\u00e2y l\u00e0 nh\u1eefng ti\u1ec7n \u00edch tuy nh\u1ecf nh\u01b0ng cho tr\u1ea3i nghi\u1ec7m h\u00e0ng ng\u00e0y tuy\u1ec7t v\u1eddi h\u01a1n. Tham kh\u1ea3o gi\u00e1 c\u1ee7a \u0111i\u1ec1u h\u00f2a Toshiba Inverter 17.000 BTU (2 HP) RAS-H18S4KCV2G-V Gi\u1eefa th\u1ecb tr\u01b0\u1eddng m\u00e1y l\u1ea1nh v\u00f4 c\u00f9ng \u0111a d\u1ea1ng hi\u1ec7n nay, \u0111\u00e2y l\u00e0 thi\u1ebft b\u1ecb thu\u1ed9c h\u00e0ng c\u00f3 c\u00f4ng su\u1ea5t l\u1edbn l\u00ean t\u1edbi 2.5 HP nh\u01b0ng thi\u1ebft k\u1ebf kh\u00e1 nh\u1ecf g\u1ecdn v\u00e0 cao c\u1ea5p. S\u1ea3n ph\u1ea9m Toshiba Inverter 17.000 BTU (2 HP) RAS-H18S4KCV2G-V hi\u1ec7n c\u00f3 m\u1ee9c gi\u00e1 \u01b0u \u0111\u00e3i t\u1ea1i Ho\u00e0ng H\u00e0 Mobile. Chi\u1ebfc \u0111i\u1ec1u h\u00f2a n\u00e0y ph\u00f9 h\u1ee3p v\u1edbi h\u1ea7u h\u1ebft c\u00e1c kh\u00f4ng gian ph\u00f2ng kh\u00e1ch l\u1edbn, ph\u00f2ng ng\u1ee7 cho gia \u0111\u00ecnh \u0111\u00f4ng ng\u01b0\u1eddi v\u00e0 c\u0169ng r\u1ea5t ph\u00f9 h\u1ee3p \u0111\u1ec3 l\u1eafp \u0111\u1eb7t t\u1ea1i c\u00e1c \u0111\u1ecba \u0111i\u1ec3m kinh doanh m\u00e0 kh\u00f4ng chi\u1ebfm nhi\u1ec1u di\u1ec7n t\u00edch, mang l\u1ea1i kh\u00f4ng kh\u00ed m\u00e1t m\u1ebb cho m\u1ecdi\u00a0 ng\u01b0\u1eddi. V\u1ec1 m\u1ee9c gi\u00e1, qu\u00fd kh\u00e1ch vui l\u00f2ng li\u00ean h\u1ec7 v\u1edbi Ho\u00e0ng H\u00e0 Mobile \u0111\u1ec3 \u0111\u01b0\u1ee3c t\u01b0 v\u1ea5n ch\u00ednh x\u00e1c nh\u1ea5t t\u1ea1i th\u1eddi \u0111i\u1ec3m mua h\u00e0ng! Mua m\u00e1y l\u1ea1nh Toshiba Inverter 17.000 BTU (2 HP) RAS-H18S4KCV2G-V ch\u00ednh h\u00e3ng t\u1ea1i Ho\u00e0ng H\u00e0 Mobile T\u1ea1i th\u1ecb tr\u01b0\u1eddng Vi\u1ec7t Nam, Ho\u00e0ng H\u00e0 Mobile h\u00e2n h\u1ea1nh tr\u1edf th\u00e0nh \u0111\u01a1n v\u1ecb chuy\u00ean ph\u00e2n ph\u1ed1i v\u00e0 b\u00e1n l\u1ebb c\u00e1c s\u1ea3n ph\u1ea9m \u0111i\u1ec7n t\u1eed, \u0111i\u1ec7n l\u1ea1nh ch\u00ednh h\u00e3ng t\u1eeb Toshiba. Th\u01b0\u01a1ng hi\u1ec7u n\u00e0y c\u0169ng r\u1ea5t uy t\u00edn v\u00e0 \u0111\u00e3 \u0111\u01b0\u1ee3c \u0111\u00f4ng \u0111\u1ea3o ng\u01b0\u1eddi d\u00f9ng Vi\u1ec7t \u01b0a chu\u1ed9ng su\u1ed1t h\u00e0ng ch\u1ee5c n\u0103m qua. Mua c\u00e1c s\u1ea3n ph\u1ea9m m\u00e1y l\u1ea1nh, \u0111i\u1ec1u h\u00f2a kh\u00f4ng kh\u00ed\u2026 t\u1ea1i Ho\u00e0ng H\u00e0 Mobile, kh\u00e1ch h\u00e0ng s\u1ebd nh\u1eadn \u0111\u01b0\u1ee3c nh\u1eefng t\u01b0 v\u1ea5n t\u1eadn t\u00ecnh v\u00e0 chuy\u00ean nghi\u1ec7p nh\u1ea5t. C\u00f9ng v\u1edbi \u0111\u00f3 l\u00e0 ch\u00ednh s\u00e1ch gi\u00e1 ph\u00f9 h\u1ee3p, ch\u00ednh s\u00e1ch b\u1ea3o h\u00e0nh ch\u00ednh h\u00e3ng v\u00e0 ch\u00ednh s\u00e1ch \u0111\u1ed5i tr\u1ea3 \u0111\u1ea3m b\u1ea3o ch\u1ea5t l\u01b0\u1ee3ng. Ngo\u00e0i ra c\u00f2n h\u1ed7 tr\u1ee3 tr\u1ea3 g\u00f3p linh ho\u1ea1t cho kh\u00e1ch h\u00e0ng c\u00f3 nhu c\u1ea7u. \u0110\u01a1n v\u1ecb b\u00e1n h\u00e0ng c\u1ee7a Ho\u00e0ng H\u00e0 Mobile v\u1edbi h\u01a1n 100 \u0111\u1ea1i l\u00fd tr\u00ean to\u00e0n qu\u1ed1c c\u0169ng th\u01b0\u1eddng xuy\u00ean tri\u1ec3n khai c\u00e1c ho\u1ea1t \u0111\u1ed9ng khuy\u1ebfn m\u00e3i v\u00e0 qu\u00e0 t\u1eb7ng tri \u00e2n kh\u00e1ch h\u00e0ng v\u00f4 c\u00f9ng h\u1ea5p d\u1eabn. Nhanh tay \u0111\u1eb7t h\u00e0ng ngay h\u00f4m nay \u0111\u1ec3 kh\u00f4ng b\u1ecf l\u1ee1 nh\u1eefng \u01b0u \u0111\u00e3i hi\u1ec7n c\u00f3 th\u00f4ng qua hotline 1900.2091 ho\u1eb7c website b\u00e1n h\u00e0ng tr\u1ef1c tuy\u1ebfn hoanghamobile. Xem to\u00e0n b\u1ed9 b\u00e0i vi\u1ebft",
        "promotion_1": "1. Tr\u00fang 8386 qu\u00e0 - T\u1ed5ng gi\u00e1 tr\u1ecb t\u1edbi 250 TRI\u1ec6U \u0110\u1ed2NG (\u00c1p d\u1ee5ng t\u1eeb 10/01 - 02/02/2025). (Xem chi ti\u1ebft). 2. \u0110\u1eb7c bi\u1ec7t Tr\u1ea3 g\u00f3p 3 kh\u00f4ng: 0% l\u00e3i su\u1ea5t - 0 ph\u00ed chuy\u1ec3n \u0111\u1ed5i - 0 tr\u1ea3 tr\u01b0\u1edbc (\u00c1p d\u1ee5ng cho c\u00f4ng ty t\u00e0i ch\u00ednh v\u00e0 th\u1ebb t\u00edn d\u1ee5ng)",
        "promotion_2": "1. Gi\u1ea3m t\u1edbi 500.000\u0111 khi thanh to\u00e1n th\u1ebb t\u00edn d\u1ee5ng NCB. (Xem chi ti\u1ebft). 2. Gi\u1ea3m \u0111\u1ebfn 150.000\u0111 khi thanh to\u00e1n qua Muadee. (Xem chi ti\u1ebft). 3. Mi\u1ec5n ph\u00ed chuy\u1ec3n \u0111\u1ed5i tr\u1ea3 g\u00f3p ho\u1eb7c gi\u1ea3m \u0111\u1ebfn 500.000\u0111 khi m\u1edf th\u1ebb TPBank EVO. (Xem chi ti\u1ebft). 4. M\u1edf th\u1ebb t\u00edn d\u1ee5ng VIB - Nh\u1eadn Voucher 600.000\u0111. (Xem chi ti\u1ebft). 5. M\u1edf th\u1ebb HSBC - Ho\u00e0n ti\u1ec1n t\u1edbi 2 tri\u1ec7u \u0111\u1ed3ng. (Xem chi ti\u1ebft)"
    },
    {
        "title": "\u0110i\u1ec1u h\u00f2a Toshiba Inverter 9.000 BTU (1 HP) RAS-H10E2KCVG-V",
        "price": "gi\u00e1 hi\u1ec7n t\u1ea1i l\u00e0 10,820,000 \u20ab nh\u01b0ng tr\u01b0\u1edbc \u0111\u00e2y n\u00f3 c\u00f3 gi\u00e1 l\u00e0 12,490,000 \u20ab",
        "colors": "Tr\u1eafng",
        "technical_specifications": [
            {
                "Lo\u1ea1i m\u00e1y": "1 chi\u1ec1u (ch\u1ec9 l\u00e0m l\u1ea1nh)"
            },
            {
                "C\u00f4ng ngh\u1ec7 inverter": "M\u00e1y l\u1ea1nh Inverter"
            },
            {
                "C\u00f4ng su\u1ea5t l\u00e0m l\u1ea1nh": "1 HP - 9.000 BTU"
            },
            {
                "Ph\u1ea1m vi l\u00e0m l\u1ea1nh hi\u1ec7u qu\u1ea3": "D\u01b0\u1edbi 15m\u00b2 (t\u1eeb 30 \u0111\u1ebfn 45m\u00b3)"
            },
            {
                "Nh\u00e3n n\u0103ng l\u01b0\u1ee3ng": "5 sao (Hi\u1ec7u su\u1ea5t n\u0103ng l\u01b0\u1ee3ng 5.04)"
            }
        ],
        "description": "Toshiba Inverter 1 HP RAS-H10E2KCVG-V l\u00e0 m\u1ed9t trong nh\u1eefng d\u00f2ng m\u00e1y l\u1ea1nh v\u1edbi thi\u1ebft k\u1ebf nguy\u00ean kh\u1ed1i \u0111\u1eb9p m\u1eaft v\u1edbi c\u00e1c \u0111\u01b0\u1eddng n\u00e9t tinh t\u1ebf v\u00e0 ki\u1ec3u d\u00e1ng hi\u1ec7n \u0111\u1ea1i. M\u00e1y c\u00f3 tr\u1ecdng l\u01b0\u1ee3ng nh\u1ecf g\u1ecdn, d\u1ec5 d\u00e0ng di chuy\u1ec3n, l\u1eafp \u0111\u1eb7t v\u1edbi ph\u1ea1m vi l\u00e0m m\u00e1t t\u1ed1i \u0111a l\u00e0 15m2 , th\u00edch h\u1ee3p cho ng\u01b0\u1eddi d\u00f9ng c\u00e1 nh\u00e2n ho\u1eb7c kh\u00f4ng gian gia \u0111\u00ecnh. Nh\u00e0 s\u1ea3n xu\u1ea5t \u0111\u00e3 trang b\u1ecb c\u00f4ng ngh\u1ec7 Inverter v\u00e0 ECO ti\u1ebft ki\u1ec7m \u0111i\u1ec7n n\u0103ng hi\u1ec7u qu\u1ea3. C\u00f9ng v\u1edbi \u0111\u00f3, thi\u1ebft b\u1ecb s\u1edf h\u1eefu c\u00f4ng ngh\u1ec7 l\u00e0m l\u1ea1nh Hi Power , l\u1ecdc kh\u00f4ng kh\u00ed v\u1edbi IAQ & Plasma Ion, di\u1ec7t khu\u1ea9n Ultra Pure v\u00e0 ch\u1ed1ng b\u00e1m b\u1ea9n Magic Coil . M\u00e1y l\u1ea1nh nh\u00e0 Toshiba c\u0169ng \u0111i k\u00e8m v\u1edbi nhi\u1ec1u ti\u1ec7n \u00edch v\u00e0 c\u00e1c ch\u1ebf \u0111\u1ed9 nh\u01b0 Fan Only (ch\u1ec9 d\u00f9ng qu\u1ea1t), ch\u1ebf \u0111\u1ed9 Sleep , ch\u1ebf \u0111\u1ed9 Hada Care b\u1ea3o v\u1ec7 da t\u1eeb vi\u1ec7c c\u00e2n b\u1eb1ng \u0111\u1ed9 \u1ea9m. \u0110\u1eb7c \u0111i\u1ec3m n\u1ed5i b\u1eadt: Thi\u1ebft k\u1ebf nguy\u00ean kh\u1ed1i cao c\u1ea5p, hi\u1ec7n \u0111\u1ea1i, tinh t\u1ebf, ch\u1ebf \u0111\u1ed9 l\u00e0m l\u1ea1nh 1 chi\u1ec1u. C\u00f4ng su\u1ea5t l\u00e0m l\u1ea1nh 1HP, k\u1ebft h\u1ee3p v\u1edbi c\u00f4ng ngh\u1ec7 Hi Power \u0111i\u1ec1u ch\u1ec9nh linh ho\u1ea1t nhi\u1ec7t \u0111\u1ed9 v\u00e0 t\u1ed1c \u0111\u1ed9 gi\u00f3 \u0111\u1ec3 \u0111\u1ea3m b\u1ea3o nhi\u1ec7t \u0111\u1ed9 l\u00e0m l\u1ea1nh nhanh h\u01a1n trong ph\u1ea1m vi 15m2. C\u00f4ng ngh\u1ec7 l\u1ecdc kh\u00f4ng kh\u00ed Plasma Ion, ng\u0103n ng\u1eeba vi khu\u1ea9n Magic Coil, v\u00e0 di\u1ec7t khu\u1ea9n UltraPure cho b\u1ea1n kh\u00f4ng gian c\u0103n ph\u00f2ng s\u1ea1ch s\u1ebd, b\u1ea3o v\u1ec7 s\u1ee9c kho\u1ebb. Ti\u1ebft ki\u1ec7m 25% \u0111i\u1ec7n n\u0103ng ti\u00eau th\u1ee5 v\u1edbi c\u00f4ng ngh\u1ec7 Inverter v\u00e0 ch\u1ebf \u0111\u1ed9 Eco linh ho\u1ea1t. Ho\u1ea1t \u0111\u1ed9ng v\u1eadn h\u00e0nh \u00eam \u00e1i, lu\u1ed3ng gi\u00f3 th\u1ed5i d\u1ec5 ch\u1ecbu b\u1ea3o v\u1ec7 l\u00e0n da c\u1ee7a b\u1ea1n v\u1edbi c\u00f4ng ngh\u1ec7 Hada Care. Ti\u1ec7n \u00edch \u0111a d\u1ea1ng v\u00e0 c\u00e1c ch\u1ebf \u0111\u1ed9 h\u1eefu \u00edch, \u0111i\u1ec1u ch\u1ec9nh d\u1ec5 d\u00e0ng t\u1eeb xa. B\u1ea3ng th\u00f4ng s\u1ed1 k\u1ef9 thu\u1eadt c\u1ee7a \u0111i\u1ec1u h\u00f2a Toshiba Inverter 1 HP RAS-H10E2KCVG-V Th\u00f4ng s\u1ed1 Chi ti\u1ebft Lo\u1ea1i m\u00e1y 1 chi\u1ec1u (ch\u1ec9 l\u00e0m l\u1ea1nh) K\u00edch th\u01b0\u1edbc - kh\u1ed1i l\u01b0\u1ee3ng d\u00e0n l\u1ea1nh 80 x 29.3 x 22.6 cm - Kh\u1ed1i l\u01b0\u1ee3ng 9 kg K\u00edch th\u01b0\u1edbc, kh\u1ed1i l\u01b0\u1ee3ng d\u00e0n n\u00f3ng 69.8 x 53 x 20 cm - Kh\u1ed1i l\u01b0\u1ee3ng 18 kg Chi\u1ec1u d\u00e0i l\u1eafp \u0111\u1eb7t \u1ed1ng \u0111\u1ed3ng T\u1ed1i \u0111a 15m Chi\u1ec1u cao l\u1eafp \u0111\u1eb7t gi\u1eefa c\u1ee5c n\u00f3ng - l\u1ea1nh 12m C\u00f4ng su\u1ea5t l\u00e0m l\u1ea1nh 1 HP - 9000 BTU Ph\u1ea1m vi l\u00e0m l\u1ea1nh hi\u1ec7u qu\u1ea3 D\u01b0\u1edbi 15 m2 (t\u1eeb 30 \u0111\u1ebfn 45 m3) C\u00f4ng ngh\u1ec7 l\u1ecdc b\u1ee5i, kh\u00e1ng khu\u1ea9n, kh\u1eed m\u00f9i C\u00f4ng ngh\u1ec7 tinh l\u1ecdc kh\u00f4ng kh\u00ed Plasma Ion C\u00f4ng ngh\u1ec7 ch\u1ed1ng b\u00e1m b\u1ea9n Magic Coil C\u00f4ng ngh\u1ec7 di\u1ec7t khu\u1ea9n UltraPure C\u00f4ng ngh\u1ec7 ti\u1ebft ki\u1ec7m \u0111i\u1ec7n n\u0103ng Hybrid Inverter Eco Ti\u1ec7n \u00edch T\u1ef1 kh\u1edfi \u0111\u1ed9ng l\u1ea1i khi c\u00f3 \u0111i\u1ec7n Lu\u1ed3ng gi\u00f3 th\u1ed1i d\u1ec5 ch\u1ecbu, b\u1ea3o v\u1ec7 da Hada Care Ch\u1ee9c n\u0103ng t\u1ef1 ch\u1ea9n \u0111o\u00e1n l\u1ed7i Ch\u1ee9c n\u0103ng Comfort Sleep ng\u1ee7 d\u1ec5 ch\u1ecbu Ch\u1ebf \u0111\u1ed9 si\u00eau \u00eam Quiet Ch\u1ee9c n\u0103ng h\u00fat \u1ea9m, t\u1ea1o Ion l\u1ecdc kh\u00f4ng kh\u00ed H\u1eb9n gi\u1edd b\u1eadt, t\u1eaft m\u00e1y l\u1ea1nh Ch\u1ebf \u0111\u1ed9 Fan Only: ch\u1ec9 s\u1eed d\u1ee5ng qu\u1ea1t l\u00e0m m\u00e1t, kh\u00f4ng l\u00e0m l\u1ea1nh. Ch\u1ee9c n\u0103ng t\u1ef1 l\u00e0m s\u1ea1ch Lo\u1ea1i Gas R-32 M\u1ee9c ti\u00eau th\u1ee5 \u0111i\u1ec7n 0.76 kW/h D\u00f2ng \u0111i\u1ec7n v\u00e0o D\u00e0n l\u1ea1nh D\u00f2ng \u0111i\u1ec7n ho\u1ea1t \u0111\u1ed9ng 1 pha S\u1ed1 l\u01b0\u1ee3ng k\u1ebft n\u1ed1i d\u00e0n l\u1ea1nh t\u1ed1i \u0111a 1 N\u0103m s\u1ea3n xu\u1ea5t 2021 \u0110\u00e1nh gi\u00e1 chi ti\u1ebft c\u00e1c t\u00ednh n\u0103ng c\u1ee7a m\u00e1y l\u1ea1nh Toshiba Inverter 1 HP RAS-H10E2KCVG-V Toshiba l\u00e0 m\u1ed9t trong nh\u1eefng t\u1eadp \u0111o\u00e0n c\u00f4ng ngh\u1ec7 \u0111a qu\u1ed1c gia n\u1ed5i ti\u1ebfng \u0111\u1ebfn t\u1eeb Nh\u1eadt B\u1ea3n. \u0110\u00e2y l\u00e0 m\u1ed9t trong nh\u1eefng c\u00f4ng ty h\u00e0ng \u0111\u1ea7u trong l\u0129nh v\u1ef1c \u0111i\u1ec7n t\u1eed, n\u0103ng l\u01b0\u1ee3ng v\u00e0 c\u00e1c thi\u1ebft b\u1ecb c\u00f4ng ngh\u1ec7 kh\u00e1c. C\u00e1c s\u1ea3n ph\u1ea9m c\u1ee7a Toshiba \u0111\u01b0\u1ee3c \u0111\u00e1nh gi\u00e1 cao v\u1ec1 ch\u1ea5t l\u01b0\u1ee3ng c\u0169ng nh\u01b0 r\u1ea5t th\u00e2n thi\u1ec7n v\u1edbi m\u00f4i tr\u01b0\u1eddng. Inverter 1 HP RAS-H10E2KCVG-V l\u00e0 m\u1ed9t trong nh\u1eefng s\u1ea3n ph\u1ea9m m\u1edbi \u0111\u01b0\u1ee3c gi\u1edbi thi\u1ec7u v\u00e0o n\u0103m 2021. Thi\u1ebft k\u1ebf nguy\u00ean kh\u1ed1i hi\u1ec7n \u0111\u1ea1i, sang tr\u1ecdng, c\u00f4ng su\u1ea5t ph\u00f9 h\u1ee3p v\u1edbi ph\u00f2ng kho\u1ea3ng 15m2 Hi\u1ec7n nay, tr\u00ean th\u1ecb tr\u01b0\u1eddng c\u00f3 \u0111a d\u1ea1ng m\u1eabu m\u00e3, ki\u1ec3u d\u00e1ng m\u00e1y \u0111i\u1ec1u ho\u00e0 cho ng\u01b0\u1eddi d\u00f9ng l\u1ef1a ch\u1ecdn tu\u1ef3 theo nhu c\u1ea7u s\u1eed d\u1ee5ng v\u00e0 di\u1ec7n t\u00edch kh\u00f4ng gian. N\u1ebfu b\u1ea1n \u0111ang t\u00ecm ki\u1ebfm m\u1ed9t thi\u1ebft b\u1ecb nh\u1ecf g\u1ecdn, d\u00f9ng cho c\u00e1c c\u0103n ph\u00f2ng t\u1ea1i nh\u00e0 th\u00ec Toshiba Inverter 1 HP RAS-H10E2KCVG-V l\u00e0 m\u1ed9t l\u1ef1a ch\u1ecdn \u0111\u00e1ng c\u00e2n nh\u1eafc. \u0110i\u1ec1u ho\u00e0 c\u00f3 thi\u1ebft k\u1ebf nguy\u00ean kh\u1ed1i, ki\u1ec3u d\u00e1ng hi\u1ec7n \u0111\u1ea1i v\u1edbi b\u1ec1 m\u1eb7t ph\u1eb3ng v\u00e0 c\u00e1c \u0111\u01b0\u1eddng n\u00e9t tinh x\u1ea3o. \u0110\u00e2y kh\u00f4ng ch\u1ec9 l\u00e0 m\u1ed9t thi\u1ebft b\u1ecb \u0111i\u1ec7n t\u1eed cho gia \u0111\u00ecnh m\u00e0 c\u00f2n l\u00e0 \u0111\u1ed3 v\u1eadt trang tr\u00ed cho kh\u00f4ng gian n\u1ed9i th\u1ea5t. Inverter 1 HP RAS-H10E2KCVG-V l\u00e0 m\u00e1y l\u1ea1nh 1 chi\u1ec1u, ch\u1ec9 l\u00e0m l\u1ea1nh. \u0110i\u1ec1u ho\u00e0 c\u00f3 th\u1ec3 l\u00e0m l\u1ea1nh t\u1ed1t trong kh\u00f4ng gian t\u1ed1i \u0111a l\u00e0 15 m2, ph\u00f9 h\u1ee3p v\u1edbi c\u1ea3 ph\u00f2ng kh\u00e1ch ho\u1eb7c ph\u00f2ng ng\u1ee7. Ngo\u00e0i ra, tr\u1ecdng l\u01b0\u1ee3ng d\u00e0n l\u1ea1nh l\u00e0 9kg v\u00e0 d\u00e0n n\u00f3ng l\u00e0 18kg n\u00ean vi\u1ec7c di chuy\u1ec3n, l\u1eafp \u0111\u1eb7t c\u0169ng d\u1ec5 d\u00e0ng h\u01a1n. Ng\u01b0\u1eddi d\u00f9ng c\u00f3 th\u1ec3 t\u00ecm \u0111\u01b0\u1ee3c nhi\u1ec1u v\u1ecb tr\u00ed \u0111\u1ec3 l\u1eafp m\u00e1y l\u1ea1nh trong ph\u00f2ng m\u00e0 kh\u00f4ng \u1ea3nh h\u01b0\u1edfng qu\u00e1 nhi\u1ec1u \u0111\u1ebfn kh\u00f4ng gian. \u0110i\u1ec1u ho\u00e0 Toshiba Inverter 1 HP RAS-H10E2KCVG-V ti\u1ebft ki\u1ec7m \u0111i\u1ec7n n\u0103ng, v\u1eadn h\u00e0nh \u00eam \u00e1i \u0110i\u1ec1u ho\u00e0 n\u00e0y c\u1ee7a Toshiba ho\u1ea1t \u0111\u1ed9ng v\u1edbi c\u00f4ng su\u1ea5t 1 HP - 9000 BTU. Nh\u00e0 s\u1ea3n xu\u1ea5t \u0111\u00e3 trang b\u1ecb cho m\u00e1y c\u00f4ng ngh\u1ec7 Hybrid Inverter th\u1ebf h\u1ec7 m\u1edbi. C\u00f4ng ngh\u1ec7 bi\u1ebfn t\u1ea7n n\u00e0y gi\u00fap m\u00e1y l\u1ea1nh v\u1eadn h\u00e0nh \u00eam \u00e1i, kh\u00f4ng t\u1ea1o ra ti\u1ebfng \u1ed3n l\u1edbn, duy tr\u00ec nhi\u1ec7t \u0111\u1ed9 ph\u00f2ng \u1edf m\u1ee9c \u1ed5n \u0111\u1ecbnh nh\u01b0ng v\u1eabn \u0111\u1ea3m b\u1ea3o ti\u1ebft ki\u1ec7m \u0111i\u1ec7n n\u0103ng t\u1ed1i \u0111a t\u1edbi 60% so v\u1edbi c\u00e1c m\u00e1y l\u1ea1nh c\u00f3 s\u1edf h\u1eefu Inverter th\u00f4ng th\u01b0\u1eddng. Ngo\u00e0i ra, m\u00e1y l\u1ea1nh n\u00e0y c\u1ee7a Toshiba c\u00f2n c\u00f3 ch\u1ebf \u0111\u1ed9 ti\u1ebft ki\u1ec7m \u0111i\u1ec7n Eco Mode. Khi ng\u01b0\u1eddi d\u00f9ng ch\u1ecdn ch\u1ebf \u0111\u1ed9 n\u00e0y, \u0111i\u1ec1u ho\u00e0 c\u00f3 th\u1ec3 gi\u1ea3m th\u00eam 25% m\u1ee9c ti\u00eau th\u1ee5 n\u0103ng l\u01b0\u1ee3ng. \u0110i\u1ec1u n\u00e0y s\u1ebd \u0111\u1eb7c bi\u1ec7t h\u1eefu \u00edch cho c\u00e1c gia \u0111\u00ecnh khi s\u1eed d\u1ee5ng \u0111i\u1ec1u h\u00f2a trong m\u00f9a n\u00f3ng. Khi ch\u1ecdn ch\u1ebf \u0111\u1ed9 Quiet, m\u00e1y \u0111i\u1ec1u ho\u00e0 s\u1ebd gi\u1ea3m \u0111\u1ed9 \u1ed3n h\u01a1n 3 dB v\u00e0 t\u1ed1c \u0111\u1ed9 qu\u1ea1t c\u1ef1c th\u1ea5p, \u0111\u1ec3 ng\u01b0\u1eddi d\u00f9ng s\u1ebd c\u00f3 nh\u1eefng gi\u1ea5c ng\u1ee7 ngon, tho\u1ea3i m\u00e1i. L\u1ecdc s\u1ea1ch kh\u00f4ng kh\u00ed v\u1edbi c\u00f4ng ngh\u1ec7 \u0111\u1ed9c quy\u1ec1n, b\u1ea3o v\u1ec7 s\u1ee9c kh\u1ecfe c\u1ea3 gia \u0111\u00ecnh Ngo\u00e0i \u01b0u \u0111i\u1ec3m l\u00e0 ti\u1ebft ki\u1ec7m \u0111i\u1ec7n n\u0103ng, m\u00e1y l\u1ea1nh Toshiba Inverter 1 HP RAS-H10E2KCVG-V c\u00f2n s\u1edf h\u1eefu b\u1ed9 ba c\u00f4ng ngh\u1ec7 l\u1ecdc kh\u00f4ng kh\u00ed ti\u00ean ti\u1ebfn nh\u1ea5t: C\u00f4ng ngh\u1ec7 Plasma Ion v\u00e0 IQA l\u1ecdc kh\u00f4ng kh\u00ed Nh\u00e0 s\u1ea3n xu\u1ea5t Toshiba \u0111\u00e3 trang b\u1ecb cho \u0111i\u1ec1u ho\u00e0 Inverter 1 HP RAS-H10E2KCVG-V c\u00f4ng ngh\u1ec7 l\u1ecdc kh\u00f4ng kh\u00ed Plasma Icon. C\u00f4ng ngh\u1ec7 n\u00e0y ho\u1ea1t \u0111\u1ed9ng s\u1ebd t\u1ea1o ra c\u00e1c ion \u0111i\u1ec7n t\u00edch \u00e2m c\u00f3 t\u00e1c d\u1ee5ng h\u00fat, ph\u00e2n hu\u1ef7 c\u00e1c y\u1ebfu t\u1ed1 g\u00e2y m\u00f9i h\u00f4i, \u00f4 nhi\u1ec5m ho\u1eb7c b\u1ee5i b\u1ea9n trong kh\u00f4ng kh\u00ed, tr\u1ea3 l\u1ea1i cho b\u1ea1n b\u1ea7u kh\u00f4ng kh\u00ed trong l\u00e0nh. N\u00f3 c\u0169ng c\u00f3 th\u1ec3 t\u1ea1o \u0111\u1ed9 \u1ea9m t\u1ea1i nh\u1eefng n\u01a1i kh\u00f4ng kh\u00ed thi\u1ebfu \u0111\u1ed9 \u1ea9m t\u1ed1i thi\u1ec3u c\u1ea7n thi\u1ebft. Ngo\u00e0i ra, m\u00e1y l\u1ea1nh n\u00e0y c\u1ee7a Toshiba c\u00f2n c\u00f3 c\u00f4ng ngh\u1ec7 IAQ, g\u1ed3m m\u00e0ng l\u1ecdc b\u1ee5i PM2.5, lo\u1ea1i b\u1ecf 99% c\u00e1c h\u1ea1t b\u1ee5i m\u1ecbn trong kh\u00f4ng kh\u00ed, c\u00e1c virus g\u00e2y b\u1ec7nh,... g\u00e2y \u1ea3nh h\u01b0\u1edfng \u0111\u1ebfn s\u1ee9c kh\u1ecfe \u0111\u01b0\u1eddng h\u00f4 h\u1ea5p. Leuconostoc enzyme v\u00e0 tinh th\u1ec3 b\u1ea1c Ag+ c\u0169ng c\u00f3 kh\u1ea3 n\u0103ng kh\u00e1ng khu\u1ea9n v\u00e0 kh\u1eed m\u00f9i hi\u1ec7u qu\u1ea3. \u0110i\u1ec1u h\u00f2a th\u00edch h\u1ee3p \u0111\u1ec3 l\u1eafp \u0111\u1eb7t t\u1ea1i c\u00e1c ph\u00f2ng ng\u1ee7 cho con v\u00e0 nh\u1eefng ng\u01b0\u1eddi th\u00e2n trong gia \u0111\u00ecnh. Ph\u1ea7n l\u01b0\u1edbi l\u1ecdc kh\u00f4ng kh\u00ed sau m\u1ed9t th\u1eddi gian s\u1eed d\u1ee5ng b\u1ecb b\u00e1m b\u1ea9n nh\u01b0ng b\u1ea1n c\u00f3 th\u1ec3 th\u00e1o r\u1eddi d\u1ec5 d\u00e0ng v\u00e0 v\u1ec7 sinh. C\u00f4ng ngh\u1ec7 kh\u1eed n\u1ea5m m\u1ed1c v\u00e0 b\u1ea3o v\u1ec7 d\u00e0n l\u1ea1nh Magic Coil D\u00e0n l\u1ea1nh c\u1ee7a \u0111i\u1ec1u ho\u00e0 Toshiba Inverter 1 HP RAS-H10E2KCVG-V c\u00f3 m\u1ed9t l\u1edbp ph\u1ee7 \u0111\u1eb7c bi\u1ec7t v\u00e0 c\u00f4ng ngh\u1ec7 Magic Coil. H\u1ec7 th\u1ed1ng trao \u0111\u1ed5i nhi\u1ec7t s\u1ebd h\u1ea5p th\u1ee5 v\u00e0 lo\u1ea1i b\u1ecf b\u1ee5i b\u1ea9n, vi khu\u1ea9n tr\u00f4i theo n\u01b0\u1edbc th\u1ea3i c\u1ee7a m\u00e1y ra b\u00ean ngo\u00e0i. C\u00f4ng ngh\u1ec7 n\u00e0y \u0111\u00e3 t\u1ed1i \u01b0u kh\u1ea3 n\u0103ng l\u1ecdc kh\u00f4ng kh\u00ed \u0111\u1ed3ng th\u1eddi l\u00e0m l\u1ea1nh nhanh h\u01a1n. B\u00ean c\u1ea1nh \u0111\u00f3, Magic Coil c\u00f2n c\u00f3 kh\u1ea3 n\u0103ng ng\u0103n ch\u1eb7n b\u1ee5i b\u1ea9n b\u00e1m tr\u00ean b\u1ec1 m\u1eb7t ngo\u00e0i c\u1ee7a l\u00e1 nh\u00f4m. C\u00e1c vi khu\u1ea9n, n\u1ea5m m\u1ed1c s\u1ebd kh\u00f4ng th\u1ec3 b\u00e1m l\u00ean v\u00e0 theo lu\u1ed3ng kh\u00f4ng kh\u00ed lan trong c\u1ea3 c\u0103n ph\u00f2ng. V\u1edbi kh\u1ea3 n\u0103ng t\u1ef1 lo\u1ea1i b\u1ecf b\u1ee5i b\u1ea9n, b\u1ea3o v\u1ec7 d\u00e0n l\u1ea1nh th\u00ec c\u00f4ng ngh\u1ec7 n\u00e0y c\u0169ng gi\u00fap ng\u01b0\u1eddi d\u00f9ng gi\u1ea3m \u0111\u01b0\u1ee3c chi ph\u00ed b\u1ea3o tr\u00ec c\u0169ng nh\u01b0 s\u1ed1 l\u1ea7n v\u1ec7 sinh m\u00e1y l\u1ea1nh \u0111\u1ecbnh k\u1ef3. M\u00e1y l\u1ea1nh Toshiba Inverter 1 HP RAS-H10E2KCVG-V Ki\u1ec3m so\u00e1t \u0111\u1ed9 \u1ea9m, b\u1ea3o v\u1ec7 l\u00e0n da v\u1edbi Hada Care M\u1ed9t s\u1ed1 gia \u0111\u00ecnh khi s\u1eed d\u1ee5ng \u0111i\u1ec1u h\u00f2a trong m\u00f9a n\u00f3ng th\u01b0\u1eddng lo l\u1eafng v\u00ec kh\u00f4ng kh\u00ed kh\u00f4 trong ph\u00f2ng s\u1ebd g\u00e2y ra c\u00e1c b\u1ec7nh v\u1ec1 h\u00f4 h\u1ea5p. \u0110\u1eb7c bi\u1ec7t v\u1edbi tr\u1ebb em khi n\u1eb1m \u0111i\u1ec1u ho\u00e0 nhi\u1ec1u c\u00f3 th\u1ec3 b\u1ecb kh\u00f4 da, kh\u00f4 m\u0169i, vi\u00eam h\u1ecdng,... Tuy nhi\u00ean, v\u1edbi \u0111i\u1ec1u ho\u00e0 Inverter 1 HP RAS-H10E2KCVG-V, b\u1ed1 m\u1eb9 s\u1ebd kh\u00f4ng c\u1ea7n qu\u00e1 lo l\u1eafng. V\u00ec m\u00e1y l\u1ea1nh c\u00f3 c\u00f4ng ngh\u1ec7 Hada Care v\u00e0 ch\u1ebf \u0111\u1ed9 c\u00e2n b\u1eb1ng \u0111\u1ed9 \u1ea9m kh\u00f4ng kh\u00ed. Hada Care t\u1ea1o ra c\u00e1c lu\u1ed3ng gi\u00f3 l\u1ea1nh th\u1ed5i h\u01b0\u1edbng l\u00ean cao v\u00e0 ra xa. Nh\u1edd \u0111\u00f3, thi\u1ebft b\u1ecb c\u00f3 th\u1ec3 l\u00e0m m\u00e1t kh\u00f4ng gian r\u1ed9ng v\u00e0 \u0111\u1ec1u h\u01a1n. So v\u1edbi m\u1ed9t s\u1ed1 lo\u1ea1i \u0111i\u1ec1u ho\u00e0 th\u1ed5i h\u01a1i l\u1ea1nh tr\u1ef1c ti\u1ebfp v\u00e0o ng\u01b0\u1eddi th\u00ec lu\u1ed3ng gi\u00f3 t\u1eeb \u0111i\u1ec1u ho\u00e0 Toshiba n\u00e0y mang l\u1ea1i c\u1ea3m gi\u00e1c d\u1ec5 ch\u1ecbu h\u01a1n. L\u00e0m l\u1ea1nh c\u1ef1c nhanh v\u1edbi c\u00f4ng ngh\u1ec7 Hi-Power M\u1ed9t trong nh\u1eefng l\u00fd do khi\u1ebfn Toshiba Inverter 1 HP RAS-H10E2KCVG-V \u0111\u01b0\u1ee3c nhi\u1ec1u ng\u01b0\u1eddi d\u00f9ng l\u1ef1a ch\u1ecdn \u0111\u00f3 l\u00e0 c\u00f4ng ngh\u1ec7 Hi Power. M\u00e1y l\u1ea1nh s\u1ebd t\u1ef1 \u0111\u1ed9ng gi\u1ea3m nhi\u1ec7t th\u1ea5p h\u01a1n nhi\u1ec7t \u0111\u1ed9 c\u00e0i \u0111\u1eb7t kho\u1ea3ng 3 \u0111\u1ed9 C. Ph\u1ea7n c\u00e1nh qu\u1ea1t \u0111\u1ea3o gi\u00f3 c\u0169ng s\u1ebd ho\u1ea1t \u0111\u1ed9ng linh ho\u1ea1t \u0111\u1ec3 ph\u00f2ng c\u00f3 th\u1ec3 \u0111\u1ea1t \u0111\u01b0\u1ee3c nhi\u1ec7t \u0111\u1ed9 c\u00e0i \u0111\u1eb7t nhanh ch\u00f3ng. Ngo\u00e0i ra, n\u1ebfu b\u1ea1n kh\u00f4ng mu\u1ed1n s\u1eed d\u1ee5ng ch\u1ebf \u0111\u1ed9 l\u00e0m l\u1ea1nh th\u00ec c\u00f3 th\u1ec3 ch\u1ecdn Fan Only Mode. M\u00e1y l\u1ea1nh s\u1ebd ch\u1ec9 \u0111i\u1ec1u ch\u1ec9nh t\u1ed1c \u0111\u1ed9 qu\u1ea1t gi\u00f3 \u0111\u1ec3 l\u00e0m m\u00e1t. Ch\u1ebf \u0111\u1ed9 n\u00e0y s\u1ebd th\u00edch h\u1ee3p \u0111\u1ec3 s\u1eed d\u1ee5ng v\u00e0o bu\u1ed5i \u0111\u00eam khi c\u0103n ph\u00f2ng \u0111\u1ea1t \u0111\u01b0\u1ee3c nhi\u1ec7t \u0111\u1ed9 v\u1eeba ph\u1ea3i, qu\u1ea1t gi\u00f3 ho\u1ea1t \u0111\u1ed9ng \u0111\u1ec3 ng\u01b0\u1eddi d\u00f9ng c\u00f3 gi\u1ea5c ng\u1ee7 \u00eam \u00e1i, ngon gi\u1ea5c h\u01a1n. \u0110i\u1ec1u ho\u00e0 Toshiba Inverter 1 HP RAS-H10E2KCVG-V \u0111a ti\u1ec7n \u00edch, \u0111i\u1ec1u khi\u1ec3n t\u1eeb xa d\u1ec5 d\u00e0ng M\u00e1y l\u1ea1nh c\u1ee7a Toshiba \u0111i k\u00e8m v\u1edbi r\u1ea5t nhi\u1ec1u ti\u1ec7n \u00edch cho ng\u01b0\u1eddi d\u00f9ng. Trong qu\u00e1 tr\u00ecnh s\u1eed d\u1ee5ng, n\u1ebfu m\u00e1y l\u1ea1nh b\u1ecb m\u1ea5t \u0111i\u1ec7n gi\u1eefa ch\u1eebng th\u00ec khi c\u00f3 ngu\u1ed3n \u0111i\u1ec7n k\u1ebft n\u1ed1i tr\u1edf l\u1ea1i, m\u00e1y s\u1ebd ghi nh\u1edb c\u00e1c c\u00e0i \u0111\u1eb7t v\u00e0 t\u1ef1 kh\u1edfi \u0111\u1ed9ng l\u1ea1i b\u00ecnh th\u01b0\u1eddng. Nh\u01b0 v\u1eady, ng\u01b0\u1eddi d\u00f9ng s\u1ebd kh\u00f4ng m\u1ea5t c\u00f4ng b\u1eadt l\u1ea1i c\u00e1c c\u00e0i \u0111\u1eb7t hay th\u1ee9c d\u1eady \u0111i\u1ec1u ch\u1ec9nh n\u1eefa. B\u00ean c\u1ea1nh \u0111\u00f3, ng\u01b0\u1eddi d\u00f9ng c\u0169ng c\u00f3 th\u1ec3 \u0111i\u1ec1u khi\u1ec3n thi\u1ebft b\u1ecb n\u00e0y t\u1eeb xa. M\u1ed9t s\u1ed1 t\u00ednh n\u0103ng ng\u01b0\u1eddi d\u00f9ng c\u00f3 th\u1ec3 \u0111i\u1ec1u ch\u1ec9nh nh\u01b0 l\u00e0: thay \u0111\u1ed5i t\u1ed1c \u0111\u1ed9 qu\u1ea1t, gi\u1ea3m ti\u1ebfng \u1ed3n, ch\u1ebf \u0111\u1ed9 ho\u1ea1t \u0111\u1ed9ng ban \u0111\u00eam (Comfort Sleep), ch\u1ebf \u0111\u1ed9 h\u1eb9n gi\u1edd t\u1eaft/ b\u1eadt, \u0111i\u1ec1u ch\u1ec9nh h\u01b0\u1edbng gi\u00f3,... \u0110i\u1ec1u ho\u00e0 s\u1eed d\u1ee5ng Gas R32 th\u00e2n thi\u1ec7n v\u1edbi m\u00f4i tr\u01b0\u1eddng Cu\u1ed1i c\u00f9ng, m\u00e1y l\u1ea1nh Toshiba Inverter 1 HP RAS-H10E2KCVG-V s\u1eed d\u1ee5ng Gas R32. \u0110\u00e2y l\u00e0 lo\u1ea1i gas \u0111\u1ea1t ti\u00eau chu\u1ea9n kh\u00ed th\u1ea3i GWP (550) n\u00ean trong qu\u00e1 tr\u00ecnh m\u00e1y ho\u1ea1t \u0111\u1ed9ng, l\u01b0\u1ee3ng kh\u00ed th\u1ea3i ra m\u00f4i tr\u01b0\u1eddng \u0111\u01b0\u1ee3c gi\u1ea3m t\u1edbi 75%. Thi\u1ebft b\u1ecb n\u00e0y kh\u00f4ng ch\u1ec9 ho\u1ea1t \u0111\u1ed9ng hi\u1ec7u su\u1ea5t m\u00e0 c\u00f2n \u0111\u1ea3m b\u1ea3o th\u00e2n thi\u00ean m\u00f4i tr\u01b0\u1eddng, h\u1ea1n ch\u1ebf g\u00e2y ra hi\u1ec7u \u1ee9ng nh\u00e0 k\u00ednh. \u0110i\u1ec1u ho\u00e0 c\u1ee7a Toshiba \u0111\u01b0\u1ee3c \u0111\u00e1nh gi\u00e1 t\u1ed1t v\u1ec1 \u0111\u1ed9 b\u1ec1n, tu\u1ed5i th\u1ecd s\u1ea3n ph\u1ea9m c\u00f3 th\u1ec3 s\u1eed d\u1ee5ng trong nhi\u1ec1u n\u0103m. \u0110\u00e2y s\u1ebd l\u00e0 \u0111i\u1ec1u ho\u00e0 \u0111\u00e1p \u1ee9ng nhu c\u1ea7u s\u1eed d\u1ee5ng cho gia \u0111\u00ecnh b\u1ea1n. Gi\u00e1 b\u00e1n tham kh\u1ea3o c\u1ee7a \u0111i\u1ec1u h\u00f2a Toshiba Inverter 1 HP RAS-H10E2KCVG-V M\u00e1y \u0111i\u1ec1u ho\u00e0 Panasonic Inverter 2 HP CU/CS-XU18ZKH-8 \u0111ang \u0111\u01b0\u1ee3c b\u00e1n tr\u00ean h\u1ec7 th\u1ed1ng c\u1ee7a Ho\u00e0ng H\u00e0 Mobile. \u0110\u00e2y s\u1ebd l\u00e0 s\u1ea3n ph\u1ea9m \u0111\u00e1p \u1ee9ng \u0111\u01b0\u1ee3c nhu c\u1ea7u s\u1eed d\u1ee5ng c\u1ee7a c\u1ea3 gia \u0111\u00ecnh b\u1ea1n trong t\u1ea7m gi\u00e1 h\u1ee3p l\u00fd. N\u1ebfu b\u1ea1n \u0111ang t\u00ecm ki\u1ebfm m\u1ed9t chi\u1ebfc \u0111i\u1ec1u ho\u00e0 c\u00f3 hi\u1ec7u n\u0103ng tuy\u1ec7t v\u1eddi v\u00e0 ti\u1ebft ki\u1ec7m n\u0103ng l\u01b0\u1ee3ng th\u00ec h\u00e3y li\u00ean h\u1ec7 v\u1edbi Ho\u00e0ng H\u00e0 Mobile nh\u00e9. \u0110i\u1ec1u h\u00f2a Toshiba Inverter RAS-H10E2KCVG-V \u0111ang \u0111\u01b0\u1ee3c b\u00e1n tr\u00ean h\u1ec7 th\u1ed1ng c\u1ee7a Ho\u00e0ng H\u00e0 Mobile v\u1edbi m\u1ee9c gi\u00e1 b\u00e1n \u01b0u \u0111\u00e3i v\u00e0 r\u1ea5t nhi\u1ec1u khuy\u1ebfn m\u00e3i h\u1ea5p d\u1eabn. S\u1ea3n ph\u1ea9m n\u00e0y kh\u00f4ng ch\u1ec9 \u0111\u00e1p \u1ee9ng nhu c\u1ea7u s\u1eed d\u1ee5ng m\u00e0 c\u00f2n r\u1ea5t t\u1ed1i \u01b0u v\u1ec1 m\u1ee9c ti\u00eau th\u1ee5 \u0111i\u1ec7n n\u0103ng v\u00e0 \u0111\u1ea3m b\u1ea3o ho\u1ea1t \u0111\u1ed9ng b\u1ec1n b\u1ec9. V\u1edbi m\u1ee9c gi\u00e1 h\u1ee3p l\u00fd, \u0111\u00e2y s\u1ebd l\u00e0 m\u1ed9t trong nh\u1eefng thi\u1ebft b\u1ecb b\u1ea1n c\u00f3 th\u1ec3 c\u00e2n nh\u1eafc \u0111\u1ebfn \u0111ang t\u00ecm ki\u1ebfm m\u1ed9t chi\u1ebfc \u0111i\u1ec1u ho\u00e0 cho gia \u0111\u00ecnh. L\u01b0u \u00fd, m\u1ee9c gi\u00e1 s\u1ea3n ph\u1ea9m c\u00f3 th\u1ec3 thay \u0111\u1ed5i t\u00f9y v\u00e0o th\u1eddi \u0111i\u1ec3m mua h\u00e0ng. Vui l\u00f2ng li\u00ean h\u1ec7 v\u1edbi ch\u00fang t\u00f4i \u0111\u1ec3 c\u00f3 th\u00f4ng tin ch\u00ednh x\u00e1c nh\u1ea5t! V\u00ec sao b\u1ea1n n\u00ean mua m\u00e1y l\u1ea1nh Toshiba Inverter 1 HP RAS-H10E2KCVG-V t\u1ea1i Ho\u00e0ng H\u00e0 Mobile? Ho\u00e0ng H\u00e0 Mobile l\u00e0 \u0111\u1ea1i l\u00fd ph\u00e2n ph\u1ed1i c\u00e1c s\u1ea3n ph\u1ea9m c\u00f4ng ngh\u1ec7 ch\u00ednh h\u00e3ng c\u1ee7a Toshiba c\u0169ng nh\u01b0 nhi\u1ec1u th\u01b0\u01a1ng hi\u1ec7u l\u1edbn kh\u00e1c. Kh\u00e1ch h\u00e0ng c\u00f3 th\u1ec3 y\u00ean t\u00e2m mua s\u1eafm s\u1ea3n ph\u1ea9m v\u1edbi ngu\u1ed3n g\u1ed1c \u0111\u1ea3m b\u1ea3o, ch\u1ea5t l\u01b0\u1ee3ng v\u00e0 ch\u1ebf \u0111\u1ed9 b\u1ea3o h\u00e0nh ch\u00ednh h\u00e3ng. Trong qu\u00e1 tr\u00ecnh s\u1eed d\u1ee5ng n\u1ebfu g\u1eb7p c\u00e1c v\u1ea5n \u0111\u1ec1 qu\u00fd kh\u00e1ch c\u00f3 th\u1ec3 li\u00ean h\u1ec7 \u0111\u1ec3 \u0111\u01b0\u1ee3c h\u1ed7 tr\u1ee3 t\u1ed1t nh\u1ea5t. Ho\u00e0ng H\u00e0 Mobile c\u0169ng c\u00f3 r\u1ea5t nhi\u1ec1u ch\u01b0\u01a1ng tr\u00ecnh \u01b0u \u0111\u00e3i v\u1ec1 gi\u00e1, khuy\u1ebfn m\u00e3i, tr\u1ea3 g\u00f3p 0% \u0111\u1ec3 kh\u00e1ch h\u00e0ng mua s\u1ea3n ph\u1ea9m v\u1edbi gi\u00e1 t\u1ed1t. S\u1ea3n ph\u1ea9m m\u00e1y \u0111i\u1ec1u ho\u00e0 Toshiba Inverter 1 HP RAS-H10E2KCVG-V l\u00e0 l\u1ef1a ch\u1ecdn ph\u00f9 h\u1ee3p trong t\u1ea7m gi\u00e1. N\u1ebfu b\u1ea1n quan t\u00e2m h\u00e3y li\u00ean h\u1ec7 ngay \u0111\u1ec3 \u0111\u01b0\u1ee3c t\u01b0 v\u1ea5n nh\u00e9. Xem to\u00e0n b\u1ed9 b\u00e0i vi\u1ebft",
        "promotion_1": "1. Tr\u00fang 8386 qu\u00e0 - T\u1ed5ng gi\u00e1 tr\u1ecb t\u1edbi 250 TRI\u1ec6U \u0110\u1ed2NG (\u00c1p d\u1ee5ng t\u1eeb 10/01 - 02/02/2025). (Xem chi ti\u1ebft). 2. \u0110\u1eb7c bi\u1ec7t Tr\u1ea3 g\u00f3p 3 kh\u00f4ng: 0% l\u00e3i su\u1ea5t - 0 ph\u00ed chuy\u1ec3n \u0111\u1ed5i - 0 tr\u1ea3 tr\u01b0\u1edbc (\u00c1p d\u1ee5ng cho c\u00f4ng ty t\u00e0i ch\u00ednh v\u00e0 th\u1ebb t\u00edn d\u1ee5ng)",
        "promotion_2": "1. Gi\u1ea3m t\u1edbi 500.000\u0111 khi thanh to\u00e1n th\u1ebb t\u00edn d\u1ee5ng NCB. (Xem chi ti\u1ebft). 2. Gi\u1ea3m \u0111\u1ebfn 150.000\u0111 khi thanh to\u00e1n qua Muadee. (Xem chi ti\u1ebft). 3. Mi\u1ec5n ph\u00ed chuy\u1ec3n \u0111\u1ed5i tr\u1ea3 g\u00f3p ho\u1eb7c gi\u1ea3m \u0111\u1ebfn 500.000\u0111 khi m\u1edf th\u1ebb TPBank EVO. (Xem chi ti\u1ebft). 4. M\u1edf th\u1ebb t\u00edn d\u1ee5ng VIB - Nh\u1eadn Voucher 600.000\u0111. (Xem chi ti\u1ebft). 5. M\u1edf th\u1ebb HSBC - Ho\u00e0n ti\u1ec1n t\u1edbi 2 tri\u1ec7u \u0111\u1ed3ng. (Xem chi ti\u1ebft)"
    },
    {
        "title": "\u0110i\u1ec1u h\u00f2a Toshiba Inverter 20.400 BTU (2.5 HP) RAS-H24S4KCV2G-V",
        "price": "gi\u00e1 hi\u1ec7n t\u1ea1i l\u00e0 20,890,000 \u20ab nh\u01b0ng tr\u01b0\u1edbc \u0111\u00e2y n\u00f3 c\u00f3 gi\u00e1 l\u00e0 22,990,000 \u20ab",
        "colors": "Tr\u1eafng",
        "technical_specifications": [
            {
                "Lo\u1ea1i m\u00e1y": "1 chi\u1ec1u (ch\u1ec9 l\u00e0m l\u1ea1nh)"
            },
            {
                "C\u00f4ng ngh\u1ec7 inverter": "M\u00e1y l\u1ea1nh Inverter"
            },
            {
                "C\u00f4ng su\u1ea5t l\u00e0m l\u1ea1nh": "2.5 HP - 20.400 BTU"
            },
            {
                "Ph\u1ea1m vi l\u00e0m l\u1ea1nh hi\u1ec7u qu\u1ea3": "T\u1eeb 30 - 40m\u00b2 (t\u1eeb 80 \u0111\u1ebfn 120m\u00b3)"
            },
            {
                "Nh\u00e3n n\u0103ng l\u01b0\u1ee3ng": "5 sao (Hi\u1ec7u su\u1ea5t n\u0103ng l\u01b0\u1ee3ng 4.55)"
            }
        ],
        "description": "\u0110i\u1ec1u h\u00f2a Toshiba Inverter 2.5 HP RAS-H24S4KCV2G-V n\u1ed5i b\u1eadt nh\u01b0 m\u1ed9t gi\u1ea3i ph\u00e1p l\u00e0m m\u00e1t hi\u1ec7u qu\u1ea3 v\u00e0 ti\u1ebft ki\u1ec7m n\u0103ng l\u01b0\u1ee3ng cho kh\u00f4ng gian r\u1ed9ng t\u1eeb 30 \u0111\u1ebfn 40m\u00b2 . Thi\u1ebft k\u1ebf hi\u1ec7n \u0111\u1ea1i, m\u00e0u s\u1eafc trang nh\u00e3 c\u00f9ng c\u00f4ng su\u1ea5t l\u00e0m l\u1ea1nh m\u1ea1nh m\u1ebd 2.5HP \u0111\u00e1p \u1ee9ng t\u1ed1t nhu c\u1ea7u l\u00e0m m\u00e1t nhanh ch\u00f3ng. C\u00f4ng ngh\u1ec7 Hybrid Inverter ti\u00ean ti\u1ebfn kh\u00f4ng ch\u1ec9 gi\u00fap ti\u1ebft ki\u1ec7m \u0111i\u1ec7n n\u0103ng m\u00e0 c\u00f2n v\u1eadn h\u00e0nh \u00eam \u00e1i, mang l\u1ea1i kh\u00f4ng gian y\u00ean t\u0129nh. M\u00e1y l\u1ea1nh c\u00f2n \u0111\u01b0\u1ee3c trang b\u1ecb nhi\u1ec1u t\u00ednh n\u0103ng th\u00f4ng minh nh\u01b0 ch\u1ebf \u0111\u1ed9 Hi Power l\u00e0m l\u1ea1nh nhanh, c\u00f4ng ngh\u1ec7 Magic Coil ch\u1ed1ng b\u00e1m b\u1ea9n v\u00e0 b\u1ed9 l\u1ecdc Ultra Fresh b\u1ea3o v\u1ec7 s\u1ee9c kh\u1ecfe ng\u01b0\u1eddi d\u00f9ng. \u0110\u1eb7c \u0111i\u1ec3m n\u1ed5i b\u1eadt: Thi\u1ebft k\u1ebf nguy\u00ean kh\u1ed1i sang tr\u1ecdng v\u1edbi c\u00e1c \u0111\u01b0\u1eddng n\u00e9t h\u00e0i h\u00f2a, s\u1eafc s\u1ea3o, b\u1ec1 m\u1eb7t ph\u1eb3ng d\u1ec5 d\u00e0ng v\u1ec7 sinh. Hybrid Inverter ti\u1ebft ki\u1ec7m \u0111i\u1ec7n v\u1eadn h\u00e0nh \u00eam \u00e1i, b\u1ec1n b\u1ec9 v\u00e0 ti\u1ebft ki\u1ec7m \u0111i\u1ec7n n\u0103ng t\u1ed1i \u01b0u. Magic Coil ch\u1ed1ng b\u00e1m b\u1ea9n gi\u00fap ng\u0103n ch\u1eb7n b\u1ee5i b\u1ea9n, vi khu\u1ea9n v\u00e0 n\u1ea5m m\u1ed1c b\u00e1m v\u00e0o d\u00e0n l\u1ea1nh, gi\u00fap m\u00e1y ho\u1ea1t \u0111\u1ed9ng hi\u1ec7u qu\u1ea3 v\u00e0 ti\u1ebft ki\u1ec7m n\u0103ng l\u01b0\u1ee3ng h\u01a1n. T\u1ef1 l\u00e0m s\u1ea1ch (Self Clean) gi\u00fap lo\u1ea1i b\u1ecf b\u1ee5i b\u1ea9n v\u00e0 vi khu\u1ea9n tr\u00ean d\u00e0n l\u1ea1nh, gi\u1ea3m thi\u1ec3u th\u1eddi gian v\u00e0 c\u00f4ng s\u1ee9c v\u1ec7 sinh m\u00e1y. C\u00f4ng su\u1ea5t 2.5HP (20.400 BTU) ph\u00f9 h\u1ee3p cho kh\u00f4ng gian t\u1eeb 30 - 40m\u00b2, l\u00fd t\u01b0\u1edfng cho ph\u00f2ng kh\u00e1ch, ph\u00f2ng ng\u1ee7 l\u1edbn ho\u1eb7c v\u0103n ph\u00f2ng. B\u1ea3ng th\u00f4ng s\u1ed1 k\u1ef9 thu\u1eadt c\u1ee7a m\u00e1y l\u1ea1nh Toshiba Inverter 2.5 HP RAS-H24S4KCV2G-V Th\u00f4ng tin s\u1ea3n ph\u1ea9m Lo\u1ea1i m\u00e1y 1 chi\u1ec1u (ch\u1ec9 l\u00e0m l\u1ea1nh) C\u00f4ng su\u1ea5t l\u00e0m l\u1ea1nh 2.5 HP - 20.400 BTU Ph\u1ea1m vi l\u00e0m l\u1ea1nh hi\u1ec7u qu\u1ea3 T\u1eeb 30 - 40m\u00b2 (t\u1eeb 80 \u0111\u1ebfn 120m\u00b3) C\u00f4ng ngh\u1ec7 Inverter M\u00e1y l\u1ea1nh Inverter \u0110\u1ed9 \u1ed3n trung b\u00ecnh 35-45/52 dB Th\u1eddi gian b\u1ea3o h\u00e0nh c\u1ee5c l\u1ea1nh 2 n\u0103m Th\u1eddi gian b\u1ea3o h\u00e0nh c\u1ee5c n\u00f3ng M\u00e1y n\u00e9n 2 n\u0103m Ch\u1ea5t li\u1ec7u d\u00e0n t\u1ea3n nhi\u1ec7t \u1ed0ng d\u1eabn gas b\u1eb1ng \u0110\u1ed3ng - L\u00e1 t\u1ea3n nhi\u1ec7t b\u1eb1ng Nh\u00f4m Lo\u1ea1i Gas R - 32 M\u1ee9c ti\u00eau th\u1ee5 \u0111i\u1ec7n n\u0103ng Ti\u00eau th\u1ee5 \u0111i\u1ec7n 1.18 kW/h Nh\u00e3n n\u0103ng l\u01b0\u1ee3ng 5 sao (Hi\u1ec7u su\u1ea5t n\u0103ng l\u01b0\u1ee3ng 4.55) C\u00f4ng ngh\u1ec7 ti\u1ebft ki\u1ec7m \u0111i\u1ec7n Hybrid Inverter Eco Kh\u1ea3 n\u0103ng l\u1ecdc kh\u00f4ng kh\u00ed L\u1ecdc b\u1ee5i, kh\u00e1ng khu\u1ea9n, kh\u1eed m\u00f9i C\u00f4ng ngh\u1ec7 tinh l\u1ecdc kh\u00f4ng kh\u00ed Ultra Fresh C\u00f4ng ngh\u1ec7 ch\u1ed1ng b\u00e1m b\u1ea9n Magic Coil B\u1ed9 l\u1ecdc ch\u1ed1ng n\u1ea5m m\u1ed1c C\u00f4ng ngh\u1ec7 l\u00e0m l\u1ea1nh Ch\u1ebf \u0111\u1ed9 gi\u00f3 \u0110i\u1ec1u khi\u1ec3n l\u00ean xu\u1ed1ng t\u1ef1 \u0111\u1ed9ng, tr\u00e1i ph\u1ea3i t\u00f9y ch\u1ec9nh tay C\u00f4ng ngh\u1ec7 l\u00e0m l\u1ea1nh nhanh Hi Power Ti\u1ec7n \u00edch Ti\u1ec7n \u00edch T\u1ef1 kh\u1edfi \u0111\u1ed9ng l\u1ea1i khi c\u00f3 \u0111i\u1ec7n H\u1eb9n gi\u1edd t\u1eaft m\u00e1y Ch\u1ee9c n\u0103ng h\u00fat \u1ea9m Ch\u1ebf \u0111\u1ed9 ch\u1ec9 s\u1eed d\u1ee5ng qu\u1ea1t Fan Only - ch\u1ec9 l\u00e0m m\u00e1t, kh\u00f4ng l\u00e0m l\u1ea1nh Ch\u1ee9c n\u0103ng t\u1ef1 l\u00e0m s\u1ea1ch Th\u00f4ng s\u1ed1 k\u00edch th\u01b0\u1edbc/l\u1eafp \u0111\u1eb7t K\u00edch th\u01b0\u1edbc - Kh\u1ed1i l\u01b0\u1ee3ng d\u00e0n l\u1ea1nh D\u00e0i 105cm - Cao 32cm - D\u00e0y 25cm - N\u1eb7ng 14kg K\u00edch th\u01b0\u1edbc - Kh\u1ed1i l\u01b0\u1ee3ng d\u00e0n n\u00f3ng D\u00e0i 84.7 cm - Cao 55cm - D\u00e0y 31cm - N\u1eb7ng 33kg Chi\u1ec1u d\u00e0i l\u1eafp \u0111\u1eb7t \u1ed1ng \u0111\u1ed3ng T\u1ed1i thi\u1ec3u 3m - T\u1ed1i \u0111a 20m Chi\u1ec1u cao l\u1eafp \u0111\u1eb7t t\u1ed1i \u0111a gi\u1eefa c\u1ee5c n\u00f3ng - l\u1ea1nh 12m D\u00f2ng \u0111i\u1ec7n v\u00e0o D\u00e0n n\u00f3ng ho\u1eb7c d\u00e0n l\u1ea1nh D\u00f2ng \u0111i\u1ec7n ho\u1ea1t \u0111\u1ed9ng 1 pha K\u00edch th\u01b0\u1edbc \u1ed1ng \u0111\u1ed3ng 6/12 S\u1ed1 l\u01b0\u1ee3ng k\u1ebft n\u1ed1i d\u00e0n l\u1ea1nh t\u1ed1i \u0111a 1 \u0110\u00e1nh gi\u00e1 chi ti\u1ebft v\u1ec1 c\u00e1c t\u00ednh n\u0103ng c\u1ee7a \u0111i\u1ec1u h\u00f2a Toshiba Inverter 2.5 HP RAS-H24S4KCV2G-V \u0110i\u1ec1u h\u00f2a Toshiba Inverter RAS-H24S4KCV2G-V l\u00e0 m\u1ed9t gi\u1ea3i ph\u00e1p l\u00e0m m\u00e1t ho\u00e0n h\u1ea3o cho kh\u00f4ng gian r\u1ed9ng t\u1eeb 30 \u0111\u1ebfn 40m\u00b2. V\u1edbi nh\u1eefng \u01b0u \u0111i\u1ec3m v\u01b0\u1ee3t tr\u1ed9i, \u0111\u00e2y ch\u1eafc ch\u1eafn l\u00e0 m\u1ed9t s\u1ef1 l\u1ef1a ch\u1ecdn \u0111\u00e1ng c\u00e2n nh\u1eafc cho nh\u1eefng ai \u0111ang t\u00ecm ki\u1ebfm m\u1ed9t chi\u1ebfc \u0111i\u1ec1u h\u00f2a ch\u1ea5t l\u01b0\u1ee3ng cao v\u00e0 ti\u1ebft ki\u1ec7m \u0111i\u1ec7n. Toshiba Inverter 2.5 HP RAS-H24S4KCV2G-V v\u1edbi thi\u1ebft k\u1ebf tinh t\u1ebf v\u00e0 hi\u1ec7n \u0111\u1ea1i \u0110i\u1ec1u h\u00f2a Inverter 2.5 HP RAS-H24S4KCV2G-V s\u1edf h\u1eefu thi\u1ebft k\u1ebf thanh l\u1ecbch v\u00e0 hi\u1ec7n \u0111\u1ea1i, d\u1ec5 d\u00e0ng h\u00f2a h\u1ee3p v\u1edbi m\u1ecdi kh\u00f4ng gian n\u1ed9i th\u1ea5t. Gam m\u00e0u tr\u1eafng ch\u1ee7 \u0111\u1ea1o mang \u0111\u1ebfn c\u1ea3m gi\u00e1c tinh t\u1ebf, sang tr\u1ecdng, \u0111\u1ed3ng th\u1eddi t\u1ea1o \u0111i\u1ec3m nh\u1ea5n nh\u1eb9 nh\u00e0ng cho c\u0103n ph\u00f2ng. D\u00e0n l\u1ea1nh v\u1edbi ki\u1ec3u d\u00e1ng \u0111\u01a1n gi\u1ea3n nh\u01b0ng kh\u00f4ng k\u00e9m ph\u1ea7n tinh t\u1ebf, d\u00e0n l\u1ea1nh c\u00f3 c\u00e1c \u0111\u01b0\u1eddng n\u00e9t bo tr\u00f2n m\u1ec1m m\u1ea1i, t\u1ea1o n\u00ean v\u1ebb ngo\u00e0i thanh tho\u00e1t, hi\u1ec7n \u0111\u1ea1i. B\u1ec1 m\u1eb7t ph\u1eb3ng, tr\u01a1n l\u00e1ng kh\u00f4ng ch\u1ec9 g\u00f3p ph\u1ea7n n\u00e2ng cao t\u00ednh th\u1ea9m m\u1ef9 m\u00e0 c\u00f2n gi\u00fap vi\u1ec7c v\u1ec7 sinh tr\u1edf n\u00ean d\u1ec5 d\u00e0ng h\u01a1n. C\u00e1c chi ti\u1ebft tr\u00ean d\u00e0n l\u1ea1nh \u0111\u01b0\u1ee3c s\u1eafp x\u1ebfp h\u1ee3p l\u00fd, t\u1ea1o c\u1ea3m gi\u00e1c g\u1ecdn g\u00e0ng v\u00e0 h\u00e0i h\u00f2a. \u0110\u1eb7c bi\u1ec7t, m\u00e0n h\u00ecnh LED hi\u1ec3n th\u1ecb nhi\u1ec7t \u0111\u1ed9 \u0111\u01b0\u1ee3c t\u00edch h\u1ee3p kh\u00e9o l\u00e9o tr\u00ean m\u1eb7t tr\u01b0\u1edbc, gi\u00fap ng\u01b0\u1eddi d\u00f9ng d\u1ec5 d\u00e0ng quan s\u00e1t v\u00e0 \u0111i\u1ec1u ch\u1ec9nh. D\u00e0n n\u00f3ng c\u1ee7a m\u00e1y l\u1ea1nh Toshiba Inverter 2.5 HP RAS-H24S4KCV2G-V \u0111\u01b0\u1ee3c thi\u1ebft k\u1ebf ch\u1eafc ch\u1eafn v\u1edbi l\u1edbp v\u1ecf ngo\u00e0i b\u1eb1ng kim lo\u1ea1i c\u1ee9ng c\u00e1p, \u0111\u1ea3m b\u1ea3o \u0111\u1ed9 b\u1ec1n b\u1ec9 v\u00e0 kh\u1ea3 n\u0103ng ch\u1ecbu \u0111\u1ef1ng c\u00e1c t\u00e1c \u0111\u1ed9ng t\u1eeb m\u00f4i tr\u01b0\u1eddng b\u00ean ngo\u00e0i. C\u00e1c l\u00e1 t\u1ea3n nhi\u1ec7t \u0111\u01b0\u1ee3c s\u1eafp x\u1ebfp khoa h\u1ecdc, t\u1ed1i \u01b0u h\u00f3a hi\u1ec7u qu\u1ea3 trao \u0111\u1ed5i nhi\u1ec7t, gi\u00fap m\u00e1y ho\u1ea1t \u0111\u1ed9ng \u1ed5n \u0111\u1ecbnh v\u00e0 ti\u1ebft ki\u1ec7m n\u0103ng l\u01b0\u1ee3ng. B\u00ean c\u1ea1nh \u0111\u00f3, vi\u1ec7c s\u1eed d\u1ee5ng v\u1eadt li\u1ec7u ch\u1ed1ng \u0103n m\u00f2n gi\u00fap b\u1ea3o v\u1ec7 d\u00e0n n\u00f3ng kh\u1ecfi t\u00e1c \u0111\u1ed9ng c\u1ee7a th\u1eddi ti\u1ebft, k\u00e9o d\u00e0i tu\u1ed5i th\u1ecd s\u1ea3n ph\u1ea9m. \u0110i\u1ec1u h\u00f2a Toshiba Inverter RAS-H24S4KCV2G-V kh\u00f4ng ch\u1ec9 l\u00e0 m\u1ed9t thi\u1ebft b\u1ecb l\u00e0m m\u00e1t hi\u1ec7u qu\u1ea3 m\u00e0 c\u00f2n l\u00e0 m\u1ed9t \u0111i\u1ec3m nh\u1ea5n th\u1ea9m m\u1ef9 cho kh\u00f4ng gian s\u1ed1ng. S\u1ef1 k\u1ebft h\u1ee3p h\u00e0i h\u00f2a gi\u1eefa thi\u1ebft k\u1ebf hi\u1ec7n \u0111\u1ea1i, ch\u1ea5t li\u1ec7u cao c\u1ea5p v\u00e0 c\u00f4ng ngh\u1ec7 ti\u00ean ti\u1ebfn h\u1ee9a h\u1eb9n \u0111\u00e1p \u1ee9ng c\u1ea3 nhu c\u1ea7u l\u00e0m m\u00e1t v\u00e0 t\u00ednh th\u1ea9m m\u1ef9 c\u1ee7a ng\u01b0\u1eddi d\u00f9ng. Tr\u1ea3i nghi\u1ec7m l\u00e0m l\u1ea1nh v\u01b0\u1ee3t tr\u1ed9i tr\u00ean \u0111i\u1ec1u h\u00f2a Toshiba Inverter 2.5 HP RAS-H24S4KCV2G-V M\u00e1y l\u1ea1nh Toshiba Inverter RAS-H24S4KCV2G-V mang \u0111\u1ebfn tr\u1ea3i nghi\u1ec7m l\u00e0m l\u1ea1nh v\u01b0\u1ee3t tr\u1ed9i, \u0111\u00e1p \u1ee9ng nhu c\u1ea7u l\u00e0m m\u00e1t hi\u1ec7u qu\u1ea3 cho kh\u00f4ng gian r\u1ed9ng t\u1eeb 30 \u0111\u1ebfn 40m2. V\u1edbi c\u00f4ng su\u1ea5t l\u00e0m l\u1ea1nh 2.5 HP v\u00e0 c\u00f4ng ngh\u1ec7 Hybrid Inverter, chi\u1ebfc \u0111i\u1ec1u h\u00f2a n\u00e0y kh\u00f4ng ch\u1ec9 l\u00e0m l\u1ea1nh nhanh ch\u00f3ng m\u00e0 c\u00f2n ti\u1ebft ki\u1ec7m \u0111i\u1ec7n n\u0103ng \u0111\u00e1ng k\u1ec3. C\u00f4ng ngh\u1ec7 Hi Power \u0111\u01b0\u1ee3c t\u00edch h\u1ee3p gi\u00fap \u0111i\u1ec1u h\u00f2a \u0111\u1ea1t \u0111\u1ebfn nhi\u1ec7t \u0111\u1ed9 c\u00e0i \u0111\u1eb7t m\u1ed9t c\u00e1ch nhanh ch\u00f3ng, mang l\u1ea1i c\u1ea3m gi\u00e1c m\u00e1t l\u1ea1nh t\u1ee9c th\u00ec ngay khi v\u1eeba b\u01b0\u1edbc v\u00e0o ph\u00f2ng. \u0110i\u1ec1u n\u00e0y \u0111\u1eb7c bi\u1ec7t h\u1eefu \u00edch trong nh\u1eefng ng\u00e0y n\u1eafng n\u00f3ng oi b\u1ee9c, khi b\u1ea1n c\u1ea7n l\u00e0m m\u00e1t kh\u00f4ng gian m\u1ed9t c\u00e1ch nhanh ch\u00f3ng. Kh\u00f4ng ch\u1ec9 l\u00e0m l\u1ea1nh nhanh, \u0111i\u1ec1u h\u00f2a Toshiba RAS-H24S4KCV2G-V c\u00f2n duy tr\u00ec nhi\u1ec7t \u0111\u1ed9 \u1ed5n \u0111\u1ecbnh nh\u1edd c\u00f4ng ngh\u1ec7 Inverter. M\u00e1y n\u00e9n bi\u1ebfn t\u1ea7n ho\u1ea1t \u0111\u1ed9ng linh ho\u1ea1t, \u0111i\u1ec1u ch\u1ec9nh c\u00f4ng su\u1ea5t l\u00e0m l\u1ea1nh ph\u00f9 h\u1ee3p v\u1edbi nhi\u1ec7t \u0111\u1ed9 ph\u00f2ng, tr\u00e1nh t\u00ecnh tr\u1ea1ng qu\u00e1 l\u1ea1nh ho\u1eb7c qu\u00e1 n\u00f3ng, mang l\u1ea1i c\u1ea3m gi\u00e1c tho\u1ea3i m\u00e1i d\u1ec5 ch\u1ecbu su\u1ed1t c\u1ea3 ng\u00e0y. Ch\u1ebf \u0111\u1ed9 Eco k\u1ebft h\u1ee3p c\u00f9ng Inverter gi\u00fap ti\u1ebft ki\u1ec7m \u0111i\u1ec7n n\u0103ng t\u1ed1i \u01b0u. \u0110i\u1ec1u h\u00f2a s\u1ebd t\u1ef1 \u0111\u1ed9ng \u0111i\u1ec1u ch\u1ec9nh c\u00f4ng su\u1ea5t l\u00e0m l\u1ea1nh \u0111\u1ec3 duy tr\u00ec nhi\u1ec7t \u0111\u1ed9 mong mu\u1ed1n m\u00e0 kh\u00f4ng ti\u00eau t\u1ed1n qu\u00e1 nhi\u1ec1u \u0111i\u1ec7n n\u0103ng. \u0110i\u1ec1u n\u00e0y gi\u00fap gi\u1ea3m thi\u1ec3u chi ph\u00ed \u0111i\u1ec7n h\u00e0ng th\u00e1ng, \u0111\u1eb7c bi\u1ec7t l\u00e0 trong nh\u1eefng th\u00e1ng h\u00e8 n\u1eafng n\u00f3ng. Ngo\u00e0i ra, thi\u1ebft k\u1ebf d\u00e0n l\u1ea1nh Magic Coil gi\u00fap ng\u0103n ng\u1eeba b\u1ee5i b\u1ea9n v\u00e0 vi khu\u1ea9n b\u00e1m v\u00e0o, \u0111\u1ea3m b\u1ea3o lu\u1ed3ng kh\u00f4ng kh\u00ed lu\u00f4n trong l\u00e0nh v\u00e0 s\u1ea1ch s\u1ebd. Nh\u1edd \u0111\u00f3, ng\u01b0\u1eddi d\u00f9ng c\u00f3 th\u1ec3 y\u00ean t\u00e2m t\u1eadn h\u01b0\u1edfng kh\u00f4ng gian m\u00e1t l\u1ea1nh m\u00e0 kh\u00f4ng lo \u1ea3nh h\u01b0\u1edfng \u0111\u1ebfn s\u1ee9c kh\u1ecfe. Tuy nhi\u00ean, v\u1edbi c\u00f4ng su\u1ea5t 2.5 HP, chi\u1ebfc \u0111i\u1ec1u h\u00f2a n\u00e0y c\u00f3 th\u1ec3 h\u01a1i qu\u00e1 m\u1ea1nh \u0111\u1ed1i v\u1edbi nh\u1eefng c\u0103n ph\u00f2ng nh\u1ecf h\u01a1n 30m2. M\u00e1y l\u1ea1nh Toshiba Inverter 2.5 HP RAS-H24S4KCV2G-V l\u00e0 m\u1ed9t l\u1ef1a ch\u1ecdn tuy\u1ec7t v\u1eddi cho nh\u1eefng ai \u0111ang t\u00ecm ki\u1ebfm m\u1ed9t chi\u1ebfc \u0111i\u1ec1u h\u00f2a l\u00e0m l\u1ea1nh nhanh, ti\u1ebft ki\u1ec7m \u0111i\u1ec7n v\u00e0 mang l\u1ea1i kh\u00f4ng gian s\u1ed1ng trong l\u00e0nh. V\u1edbi nh\u1eefng t\u00ednh n\u0103ng v\u01b0\u1ee3t tr\u1ed9i v\u00e0 c\u00f4ng ngh\u1ec7 ti\u00ean ti\u1ebfn, chi\u1ebfc \u0111i\u1ec1u h\u00f2a n\u00e0y ch\u1eafc ch\u1eafn s\u1ebd l\u00e0m h\u00e0i l\u00f2ng nh\u1eefng kh\u00e1ch h\u00e0ng kh\u00f3 t\u00ednh nh\u1ea5t. Kh\u1ea3 n\u0103ng ti\u1ebft ki\u1ec7m \u0111i\u1ec7n n\u0103ng v\u01b0\u1ee3t tr\u1ed9i mang \u0111\u1ebfn nhi\u1ec1u l\u1ee3i \u00edch cho ng\u01b0\u1eddi d\u00f9ng \u0110i\u1ec1u h\u00f2a Toshiba Inverter RAS-H24S4KCV2G-V kh\u00f4ng ch\u1ec9 g\u00e2y \u1ea5n t\u01b0\u1ee3ng b\u1edfi kh\u1ea3 n\u0103ng l\u00e0m l\u1ea1nh nhanh ch\u00f3ng v\u00e0 hi\u1ec7u qu\u1ea3 m\u00e0 c\u00f2n n\u1ed5i b\u1eadt v\u1edbi kh\u1ea3 n\u0103ng ti\u1ebft ki\u1ec7m \u0111i\u1ec7n v\u01b0\u1ee3t tr\u1ed9i. \u0110\u01b0\u1ee3c trang b\u1ecb c\u00f4ng ngh\u1ec7 Hybrid Inverter ti\u00ean ti\u1ebfn, \u0111i\u1ec1u h\u00f2a n\u00e0y t\u1ed1i \u01b0u h\u00f3a kh\u1ea3 n\u0103ng v\u1eadn h\u00e0nh b\u1eb1ng c\u00e1ch \u0111i\u1ec1u ch\u1ec9nh c\u00f4ng su\u1ea5t m\u00e1y n\u00e9n linh ho\u1ea1t theo nhi\u1ec7t \u0111\u1ed9 ph\u00f2ng. Nh\u1edd \u0111\u00f3, m\u00e1y n\u00e9n kh\u00f4ng c\u1ea7n ph\u1ea3i li\u00ean t\u1ee5c b\u1eadt t\u1eaft nh\u01b0 c\u00e1c d\u00f2ng \u0111i\u1ec1u h\u00f2a th\u00f4ng th\u01b0\u1eddng, gi\u00fap gi\u1ea3m thi\u1ec3u hao ph\u00ed \u0111i\u1ec7n n\u0103ng \u0111\u00e1ng k\u1ec3. B\u00ean c\u1ea1nh \u0111\u00f3, ch\u1ebf \u0111\u1ed9 Eco t\u00edch h\u1ee3p tr\u00ean \u0111i\u1ec1u h\u00f2a Toshiba Inverter 2.5 HP RAS-H24S4KCV2G-V c\u0169ng \u0111\u00f3ng g\u00f3p l\u1edbn v\u00e0o vi\u1ec7c ti\u1ebft ki\u1ec7m \u0111i\u1ec7n. Khi k\u00edch ho\u1ea1t, ch\u1ebf \u0111\u1ed9 n\u00e0y s\u1ebd t\u1ef1 \u0111\u1ed9ng \u0111i\u1ec1u ch\u1ec9nh nhi\u1ec7t \u0111\u1ed9 v\u00e0 t\u1ed1c \u0111\u1ed9 qu\u1ea1t \u0111\u1ec3 duy tr\u00ec m\u1ee9c l\u00e0m l\u1ea1nh tho\u1ea3i m\u00e1i m\u00e0 v\u1eabn \u0111\u1ea3m b\u1ea3o ti\u00eau th\u1ee5 \u0111i\u1ec7n n\u0103ng \u1edf m\u1ee9c th\u1ea5p nh\u1ea5t. Theo th\u00f4ng tin t\u1eeb nh\u00e0 s\u1ea3n xu\u1ea5t, ch\u1ebf \u0111\u1ed9 Eco c\u00f3 th\u1ec3 gi\u00fap ti\u1ebft ki\u1ec7m \u0111\u1ebfn 25% \u0111i\u1ec7n n\u0103ng so v\u1edbi ch\u1ebf \u0111\u1ed9 l\u00e0m l\u1ea1nh th\u00f4ng th\u01b0\u1eddng. C\u00f4ng ngh\u1ec7 Magic Coil c\u0169ng l\u00e0 m\u1ed9t \u0111i\u1ec3m c\u1ed9ng \u0111\u00e1ng ch\u00fa \u00fd v\u1ec1 kh\u1ea3 n\u0103ng ti\u1ebft ki\u1ec7m \u0111i\u1ec7n c\u1ee7a s\u1ea3n ph\u1ea9m n\u00e0y. L\u1edbp ph\u1ee7 \u0111\u1eb7c bi\u1ec7t tr\u00ean d\u00e0n l\u1ea1nh gi\u00fap ng\u0103n ch\u1eb7n b\u1ee5i b\u1ea9n v\u00e0 vi khu\u1ea9n b\u00e1m v\u00e0o, t\u1eeb \u0111\u00f3 duy tr\u00ec hi\u1ec7u su\u1ea5t trao \u0111\u1ed5i nhi\u1ec7t t\u1ed1i \u01b0u v\u00e0 gi\u1ea3m t\u1ea3i cho m\u00e1y n\u00e9n. \u0110i\u1ec1u n\u00e0y \u0111\u1ed3ng ngh\u0129a v\u1edbi vi\u1ec7c \u0111i\u1ec1u h\u00f2a s\u1ebd ti\u00eau th\u1ee5 \u00edt \u0111i\u1ec7n n\u0103ng h\u01a1n \u0111\u1ec3 \u0111\u1ea1t \u0111\u01b0\u1ee3c hi\u1ec7u qu\u1ea3 l\u00e0m l\u1ea1nh mong mu\u1ed1n. Th\u1ef1c t\u1ebf s\u1eed d\u1ee5ng cho th\u1ea5y, \u0111i\u1ec1u h\u00f2a Toshiba Inverter RAS-H24S4KCV2G-V ho\u1ea1t \u0111\u1ed9ng \u00eam \u00e1i v\u00e0 ti\u1ebft ki\u1ec7m \u0111i\u1ec7n n\u0103ng \u0111\u00e1ng k\u1ec3 so v\u1edbi c\u00e1c d\u00f2ng \u0111i\u1ec1u h\u00f2a th\u00f4ng th\u01b0\u1eddng kh\u00e1c. Ng\u01b0\u1eddi d\u00f9ng c\u00f3 th\u1ec3 y\u00ean t\u00e2m t\u1eadn h\u01b0\u1edfng kh\u00f4ng gian m\u00e1t l\u1ea1nh m\u00e0 kh\u00f4ng ph\u1ea3i lo l\u1eafng v\u1ec1 h\u00f3a \u0111\u01a1n ti\u1ec1n \u0111i\u1ec7n t\u0103ng cao. V\u1edbi nh\u1eefng \u01b0u \u0111i\u1ec3m v\u01b0\u1ee3t tr\u1ed9i v\u1ec1 kh\u1ea3 n\u0103ng ti\u1ebft ki\u1ec7m \u0111i\u1ec7n, \u0111\u00e2y ch\u1eafc ch\u1eafn l\u00e0 m\u1ed9t s\u1ef1 l\u1ef1a ch\u1ecdn s\u00e1ng gi\u00e1 cho nh\u1eefng ai \u0111ang t\u00ecm ki\u1ebfm m\u1ed9t gi\u1ea3i ph\u00e1p l\u00e0m m\u00e1t hi\u1ec7u qu\u1ea3 v\u00e0 kinh t\u1ebf cho gia \u0111\u00ecnh m\u00ecnh. M\u00e1y l\u1ea1nh Toshiba Inverter 2.5 HP RAS-H24S4KCV2G-V s\u1edf h\u1eefu b\u1ed9 ti\u1ec7n \u00edch \u0111a d\u1ea1ng, n\u00e2ng cao tr\u1ea3i nghi\u1ec7m cho ng\u01b0\u1eddi d\u00f9ng \u0110i\u1ec1u h\u00f2a Toshiba Inverter RAS-H24S4KCV2G-V kh\u00f4ng ch\u1ec9 l\u00e0m m\u00e1t hi\u1ec7u qu\u1ea3 m\u00e0 c\u00f2n s\u1edf h\u1eefu b\u1ed9 ti\u1ec7n \u00edch \u0111a d\u1ea1ng, n\u00e2ng cao tr\u1ea3i nghi\u1ec7m ng\u01b0\u1eddi d\u00f9ng v\u00e0 t\u1ed1i \u01b0u h\u00f3a kh\u1ea3 n\u0103ng v\u1eadn h\u00e0nh. T\u1ef1 kh\u1edfi \u0111\u1ed9ng l\u1ea1i khi c\u00f3 \u0111i\u1ec7n: T\u00ednh n\u0103ng n\u00e0y v\u00f4 c\u00f9ng h\u1eefu \u00edch trong nh\u1eefng ng\u00e0y h\u00e8 n\u1eafng n\u00f3ng khi s\u1ef1 c\u1ed1 m\u1ea5t \u0111i\u1ec7n x\u1ea3y ra th\u01b0\u1eddng xuy\u00ean. B\u1ea1n s\u1ebd kh\u00f4ng ph\u1ea3i lo l\u1eafng v\u1ec1 vi\u1ec7c ph\u1ea3i c\u00e0i \u0111\u1eb7t l\u1ea1i \u0111i\u1ec1u h\u00f2a m\u1ed7i khi c\u00f3 \u0111i\u1ec7n, gi\u00fap duy tr\u00ec kh\u00f4ng gian s\u1ed1ng lu\u00f4n m\u00e1t m\u1ebb v\u00e0 tho\u1ea3i m\u00e1i. H\u1eb9n gi\u1edd t\u1eaft m\u00e1y: V\u1edbi kh\u1ea3 n\u0103ng h\u1eb9n gi\u1edd t\u1eaft m\u00e1y, b\u1ea1n c\u00f3 th\u1ec3 ch\u1ee7 \u0111\u1ed9ng ki\u1ec3m so\u00e1t th\u1eddi gian ho\u1ea1t \u0111\u1ed9ng c\u1ee7a \u0111i\u1ec1u h\u00f2a, \u0111\u1eb7c bi\u1ec7t l\u00e0 v\u00e0o ban \u0111\u00eam. N\u00f3 kh\u00f4ng ch\u1ec9 gi\u00fap ti\u1ebft ki\u1ec7m \u0111i\u1ec7n n\u0103ng m\u00e0 c\u00f2n \u0111\u1ea3m b\u1ea3o gi\u1ea5c ng\u1ee7 ngon v\u00e0 s\u00e2u gi\u1ea5c h\u01a1n, tr\u00e1nh t\u00ecnh tr\u1ea1ng b\u1ecb l\u1ea1nh qu\u00e1 m\u1ee9c khi ng\u1ee7 qu\u00ean kh\u00f4ng t\u1eaft \u0111i\u1ec1u h\u00f2a. Ch\u1ee9c n\u0103ng h\u00fat \u1ea9m: Trong nh\u1eefng ng\u00e0y th\u1eddi ti\u1ebft n\u1ed3m \u1ea9m, \u0111\u1ed9 \u1ea9m cao g\u00e2y kh\u00f3 ch\u1ecbu v\u00e0 \u1ea3nh h\u01b0\u1edfng \u0111\u1ebfn s\u1ee9c kh\u1ecfe, ch\u1ee9c n\u0103ng h\u00fat \u1ea9m c\u1ee7a \u0111i\u1ec1u h\u00f2a Toshiba Inverter 2.5 HP RAS-H24S4KCV2G-V s\u1ebd l\u00e0 gi\u1ea3i ph\u00e1p l\u00fd t\u01b0\u1edfng. B\u1eb1ng c\u00e1ch gi\u1ea3m \u0111\u1ed9 \u1ea9m trong kh\u00f4ng kh\u00ed, c\u0103n ph\u00f2ng s\u1ebd tr\u1edf n\u00ean kh\u00f4 r\u00e1o, tho\u00e1ng \u0111\u00e3ng v\u00e0 d\u1ec5 ch\u1ecbu h\u01a1n. Ch\u1ebf \u0111\u1ed9 ch\u1ec9 s\u1eed d\u1ee5ng qu\u1ea1t Fan Only: V\u00e0o nh\u1eefng ng\u00e0y th\u1eddi ti\u1ebft m\u00e1t m\u1ebb, kh\u00f4ng c\u1ea7n l\u00e0m l\u1ea1nh s\u00e2u, ch\u1ebf \u0111\u1ed9 Fan Only cho ph\u00e9p b\u1ea1n t\u1eadn d\u1ee5ng kh\u1ea3 n\u0103ng l\u01b0u th\u00f4ng kh\u00f4ng kh\u00ed c\u1ee7a \u0111i\u1ec1u h\u00f2a. \u0110i\u1ec1u n\u00e0y gi\u00fap ti\u1ebft ki\u1ec7m \u0111i\u1ec7n n\u0103ng \u0111\u00e1ng k\u1ec3 so v\u1edbi vi\u1ec7c s\u1eed d\u1ee5ng ch\u1ebf \u0111\u1ed9 l\u00e0m l\u1ea1nh th\u00f4ng th\u01b0\u1eddng. Ch\u1ee9c n\u0103ng t\u1ef1 l\u00e0m s\u1ea1ch: Vi\u1ec7c v\u1ec7 sinh \u0111i\u1ec1u h\u00f2a th\u01b0\u1eddng xuy\u00ean l\u00e0 r\u1ea5t quan tr\u1ecdng \u0111\u1ec3 \u0111\u1ea3m b\u1ea3o hi\u1ec7u su\u1ea5t l\u00e0m vi\u1ec7c v\u00e0 ch\u1ea5t l\u01b0\u1ee3ng kh\u00f4ng kh\u00ed trong l\u00e0nh. Ch\u1ee9c n\u0103ng t\u1ef1 l\u00e0m s\u1ea1ch c\u1ee7a m\u00e1y l\u1ea1nh Toshiba Inverter RAS-H24S4KCV2G-V gi\u00fap b\u1ea1n ti\u1ebft ki\u1ec7m th\u1eddi gian v\u00e0 c\u00f4ng s\u1ee9c v\u1ec7 sinh, \u0111\u1ed3ng th\u1eddi k\u00e9o d\u00e0i tu\u1ed5i th\u1ecd c\u1ee7a s\u1ea3n ph\u1ea9m. V\u1edbi nh\u1eefng ti\u1ec7n \u00edch v\u01b0\u1ee3t tr\u1ed9i tr\u00ean, \u0111i\u1ec1u h\u00f2a Toshiba Inverter RAS-H24S4KCV2G-V s\u1ebd l\u00e0 ng\u01b0\u1eddi b\u1ea1n \u0111\u1ed3ng h\u00e0nh \u0111\u00e1ng tin c\u1eady, mang \u0111\u1ebfn kh\u00f4ng gian s\u1ed1ng ti\u1ec7n nghi, tho\u1ea3i m\u00e1i v\u00e0 ti\u1ebft ki\u1ec7m n\u0103ng l\u01b0\u1ee3ng cho gia \u0111\u00ecnh b\u1ea1n. Gi\u00e1 tham kh\u1ea3o c\u1ee7a m\u00e1y l\u1ea1nh Toshiba Inverter 2.5 HP RAS-H24S4KCV2G-V Hi\u1ec7n nay, s\u1ea3n ph\u1ea9m m\u00e1y l\u1ea1nh Inverter 2.5 HP RAS-H24S4KCV2G-V c\u1ee7a th\u01b0\u01a1ng hi\u1ec7u Toshiba \u0111\u01b0\u1ee3c b\u00e1n t\u1ea1i Ho\u00e0ng H\u00e0 Mobile v\u1edbi m\u1ee9c gi\u00e1 \u01b0u \u0111\u00e3i c\u00f9ng nhi\u1ec1u ch\u01b0\u01a1ng tr\u00ecnh h\u1ea5p d\u1eabn . \u0110\u00e2y l\u00e0 m\u1ed9t thi\u1ebft b\u1ecb l\u00e0m l\u1ea1nh \u0111\u01b0\u1ee3c nhi\u1ec1u ng\u01b0\u1eddi \u0111\u00e1nh gi\u00e1 v\u1edbi c\u00e1c t\u00ednh n\u0103ng v\u01b0\u1ee3t tr\u1ed9i. Tuy nhi\u00ean, t\u00f9y v\u00e0o t\u1eebng th\u1eddi \u0111i\u1ec3m m\u00e0 m\u1ee9c gi\u00e1 c\u1ee7a s\u1ea3n ph\u1ea9m s\u1ebd c\u00f3 s\u1ef1 thay \u0111\u1ed5i. Do \u0111\u00f3, n\u1ebfu b\u1ea1n mu\u1ed1n bi\u1ebft ch\u00ednh x\u00e1c m\u1ee9c gi\u00e1 c\u1ee7a \u0111i\u1ec1u h\u00f2a Inverter 2.5 HP RAS-H24S4KCV2G-V, h\u00e3y li\u00ean h\u1ec7 tr\u1ef1c ti\u1ebfp v\u1edbi ch\u00fang t\u00f4i ho\u1eb7c truy c\u1eadp v\u00e0o c\u00e1c trang ch\u00ednh th\u1ee9c c\u1ee7a Ho\u00e0ng H\u00e0 Mobile \u0111\u1ec3 \u0111\u01b0\u1ee3c t\u01b0 v\u1ea5n nhanh ch\u00f3ng. V\u00ec sao n\u00ean mua \u0111i\u1ec1u h\u00f2a Toshiba Inverter 2.5 HP RAS-H24S4KCV2G-V t\u1ea1i Ho\u00e0ng H\u00e0 Mobile ? M\u00e1y l\u1ea1nh Toshiba Inverter RAS-H24S4KCV2G-V l\u00e0 m\u1ed9t l\u1ef1a ch\u1ecdn \u0111\u00e1ng c\u00e2n nh\u1eafc cho nh\u1eefng ai \u0111ang t\u00ecm ki\u1ebfm gi\u1ea3i ph\u00e1p l\u00e0m m\u00e1t hi\u1ec7u qu\u1ea3 v\u00e0 ti\u1ebft ki\u1ec7m \u0111i\u1ec7n n\u0103ng cho kh\u00f4ng gian r\u1ed9ng t\u1eeb 30 \u0111\u1ebfn 40 m\u00e9t vu\u00f4ng. V\u00e0 Ho\u00e0ng H\u00e0 Mobile ch\u00ednh l\u00e0 \u0111i\u1ec3m \u0111\u1ebfn l\u00fd t\u01b0\u1edfng \u0111\u1ec3 s\u1edf h\u1eefu s\u1ea3n ph\u1ea9m n\u00e0y v\u1edbi nh\u1eefng \u01b0u \u0111i\u1ec3m v\u01b0\u1ee3t tr\u1ed9i. \u0110\u1ea7u ti\u00ean, Ho\u00e0ng H\u00e0 Mobile l\u00e0 m\u1ed9t trong nh\u1eefng nh\u00e0 b\u00e1n l\u1ebb \u0111i\u1ec7n m\u00e1y uy t\u00edn h\u00e0ng \u0111\u1ea7u t\u1ea1i Vi\u1ec7t Nam, cam k\u1ebft cung c\u1ea5p s\u1ea3n ph\u1ea9m ch\u00ednh h\u00e3ng v\u1edbi gi\u00e1 c\u1ea3 c\u1ea1nh tranh. Khi mua m\u00e1y l\u1ea1nh Toshiba Inverter RAS-H24S4KCV2G-V t\u1ea1i \u0111\u00e2y, b\u1ea1n ho\u00e0n to\u00e0n y\u00ean t\u00e2m v\u1ec1 ch\u1ea5t l\u01b0\u1ee3ng s\u1ea3n ph\u1ea9m c\u0169ng nh\u01b0 ch\u1ebf \u0111\u1ed9 b\u1ea3o h\u00e0nh chu \u0111\u00e1o. B\u00ean c\u1ea1nh \u0111\u00f3, Ho\u00e0ng H\u00e0 Mobile c\u00f2n th\u01b0\u1eddng xuy\u00ean tri\u1ec3n khai c\u00e1c ch\u01b0\u01a1ng tr\u00ecnh khuy\u1ebfn m\u00e3i h\u1ea5p d\u1eabn, gi\u00fap b\u1ea1n ti\u1ebft ki\u1ec7m chi ph\u00ed khi mua s\u1eafm. \u0110\u1ed9i ng\u0169 nh\u00e2n vi\u00ean t\u01b0 v\u1ea5n chuy\u00ean nghi\u1ec7p v\u00e0 nhi\u1ec7t t\u00ecnh s\u1ebd h\u1ed7 tr\u1ee3 b\u1ea1n l\u1ef1a ch\u1ecdn s\u1ea3n ph\u1ea9m ph\u00f9 h\u1ee3p v\u1edbi nhu c\u1ea7u v\u00e0 ng\u00e2n s\u00e1ch. Kh\u00f4ng ch\u1ec9 d\u1eebng l\u1ea1i \u1edf \u0111\u00f3, Ho\u00e0ng H\u00e0 Mobile c\u00f2n cung c\u1ea5p d\u1ecbch v\u1ee5 giao h\u00e0ng v\u00e0 l\u1eafp \u0111\u1eb7t t\u1eadn n\u01a1i nhanh ch\u00f3ng, \u0111\u1ea3m b\u1ea3o s\u1ef1 ti\u1ec7n l\u1ee3i v\u00e0 tho\u1ea3i m\u00e1i cho kh\u00e1ch h\u00e0ng. \u0110\u1eb7c bi\u1ec7t, v\u1edbi ch\u00ednh s\u00e1ch h\u1eadu m\u00e3i t\u1eadn t\u00e2m, Ho\u00e0ng H\u00e0 Mobile lu\u00f4n s\u1eb5n s\u00e0ng h\u1ed7 tr\u1ee3 v\u00e0 gi\u1ea3i \u0111\u00e1p m\u1ecdi th\u1eafc m\u1eafc c\u1ee7a b\u1ea1n trong qu\u00e1 tr\u00ecnh s\u1eed d\u1ee5ng s\u1ea3n ph\u1ea9m. M\u00e1y l\u1ea1nh Toshiba Inverter 2.5 HP RAS-H24S4KCV2G-V s\u1edf h\u1eefu nh\u1eefng t\u00ednh n\u0103ng n\u1ed5i b\u1eadt nh\u01b0 c\u00f4ng ngh\u1ec7 Inverter ti\u1ebft ki\u1ec7m \u0111i\u1ec7n, kh\u1ea3 n\u0103ng l\u1ecdc kh\u00f4ng kh\u00ed ti\u00ean ti\u1ebfn, ch\u1ebf \u0111\u1ed9 l\u00e0m l\u1ea1nh nhanh v\u00e0 v\u1eadn h\u00e0nh \u00eam \u00e1i. Khi k\u1ebft h\u1ee3p v\u1edbi nh\u1eefng \u01b0u \u0111i\u1ec3m t\u1eeb Ho\u00e0ng H\u00e0 Mobile, \u0111\u00e2y ch\u1eafc ch\u1eafn l\u00e0 s\u1ef1 l\u1ef1a ch\u1ecdn ho\u00e0n h\u1ea3o cho gia \u0111\u00ecnh b\u1ea1n. N\u1ebfu b\u1ea1n \u0111ang t\u00ecm ki\u1ebfm m\u1ed9t chi\u1ebfc m\u00e1y l\u1ea1nh ch\u1ea5t l\u01b0\u1ee3ng, ti\u1ebft ki\u1ec7m \u0111i\u1ec7n v\u00e0 \u0111i k\u00e8m v\u1edbi d\u1ecbch v\u1ee5 t\u1ed1t nh\u1ea5t, h\u00e3y \u0111\u1ebfn Ho\u00e0ng H\u00e0 Mobile v\u00e0 tr\u1ea3i nghi\u1ec7m s\u1ef1 kh\u00e1c bi\u1ec7t Xem to\u00e0n b\u1ed9 b\u00e0i vi\u1ebft",
        "promotion_1": "1. Tr\u00fang 8386 qu\u00e0 - T\u1ed5ng gi\u00e1 tr\u1ecb t\u1edbi 250 TRI\u1ec6U \u0110\u1ed2NG (\u00c1p d\u1ee5ng t\u1eeb 10/01 - 02/02/2025). (Xem chi ti\u1ebft). 2. \u0110\u1eb7c bi\u1ec7t Tr\u1ea3 g\u00f3p 3 kh\u00f4ng: 0% l\u00e3i su\u1ea5t - 0 ph\u00ed chuy\u1ec3n \u0111\u1ed5i - 0 tr\u1ea3 tr\u01b0\u1edbc (\u00c1p d\u1ee5ng cho c\u00f4ng ty t\u00e0i ch\u00ednh v\u00e0 th\u1ebb t\u00edn d\u1ee5ng)",
        "promotion_2": "1. Gi\u1ea3m t\u1edbi 500.000\u0111 khi thanh to\u00e1n th\u1ebb t\u00edn d\u1ee5ng NCB. (Xem chi ti\u1ebft). 2. Gi\u1ea3m \u0111\u1ebfn 150.000\u0111 khi thanh to\u00e1n qua Muadee. (Xem chi ti\u1ebft). 3. Mi\u1ec5n ph\u00ed chuy\u1ec3n \u0111\u1ed5i tr\u1ea3 g\u00f3p ho\u1eb7c gi\u1ea3m \u0111\u1ebfn 500.000\u0111 khi m\u1edf th\u1ebb TPBank EVO. (Xem chi ti\u1ebft). 4. M\u1edf th\u1ebb t\u00edn d\u1ee5ng VIB - Nh\u1eadn Voucher 600.000\u0111. (Xem chi ti\u1ebft). 5. M\u1edf th\u1ebb HSBC - Ho\u00e0n ti\u1ec1n t\u1edbi 2 tri\u1ec7u \u0111\u1ed3ng. (Xem chi ti\u1ebft)"
    },
    {
        "title": "\u0110i\u1ec1u h\u00f2a Toshiba Inverter 12.200 BTU (1.5 HP) RAS-H13E2KCVG-V",
        "price": "gi\u00e1 hi\u1ec7n t\u1ea1i l\u00e0 13,010,000 \u20ab nh\u01b0ng tr\u01b0\u1edbc \u0111\u00e2y n\u00f3 c\u00f3 gi\u00e1 l\u00e0 14,690,000 \u20ab",
        "colors": "Tr\u1eafng",
        "technical_specifications": [
            {
                "Lo\u1ea1i m\u00e1y": "1 chi\u1ec1u (ch\u1ec9 l\u00e0m l\u1ea1nh)"
            },
            {
                "C\u00f4ng ngh\u1ec7 inverter": "M\u00e1y l\u1ea1nh Inverter"
            },
            {
                "C\u00f4ng su\u1ea5t l\u00e0m l\u1ea1nh": "1.5 HP - 12.200 BTU"
            },
            {
                "Ph\u1ea1m vi l\u00e0m l\u1ea1nh hi\u1ec7u qu\u1ea3": "T\u1eeb 15 - 20m\u00b2 (t\u1eeb 40 \u0111\u1ebfn 60 m\u00b3)"
            },
            {
                "Nh\u00e3n n\u0103ng l\u01b0\u1ee3ng": "5 sao (Hi\u1ec7u su\u1ea5t n\u0103ng l\u01b0\u1ee3ng 5.10)"
            }
        ],
        "description": "M\u00e1y \u0111i\u1ec1u h\u00f2a kh\u00f4ng kh\u00ed Toshiba Inverter 1.5 HP RAS-H13E2KCVG-V l\u00e0 m\u1ed9t ph\u01b0\u01a1ng ph\u00e1p thanh l\u1ecdc kh\u00f4ng kh\u00ed to\u00e0n di\u1ec7n cho kh\u00f4ng gian nh\u00e0 c\u1ee7a b\u1ea1n v\u1edbi c\u00f4ng su\u1ea5t \u0111\u1ebfn 1.5 Hp c\u00f9ng nhi\u1ec1u c\u00f4ng ngh\u1ec7 di\u1ec7t khu\u1ea9n v\u00e0 thanh l\u1ecdc kh\u00f4ng kh\u00ed nh\u01b0 c\u00f4ng ngh\u1ec7 Plasma Ion , UltraPure b\u1ea3o v\u1ec7 s\u1ee9c kh\u1ecfe h\u00f4 h\u1ea5p. M\u00e1y l\u1ea1nh c\u0169ng c\u00f3 kh\u1ea3 n\u0103ng l\u00e0m l\u1ea1nh nhanh \u1ea5n t\u01b0\u1ee3ng nh\u1edd c\u00f4ng ngh\u1ec7 Hi Power nh\u01b0ng v\u1eabn c\u00f3 kh\u1ea3 n\u0103ng ti\u1ebft ki\u1ec7m n\u0103ng l\u01b0\u1ee3ng v\u00e0 b\u1ea3o v\u1ec7 m\u00f4i tr\u01b0\u1eddng nh\u1edd ch\u1ebf \u0111\u1ed9 Eco v\u00e0 c\u00f4ng ngh\u1ec7 Hybrid Inverter . \u0110\u1eb7c bi\u1ec7t, ng\u01b0\u1eddi d\u00f9ng s\u1ebd \u0111\u01b0\u1ee3c tr\u1ea3i nghi\u1ec7m c\u00f4ng ngh\u1ec7 ch\u1ed1ng b\u00e1m b\u1ea9n \u0111\u1ed9c quy\u1ec1n th\u01b0\u01a1ng hi\u1ec7u c\u1ee7a Toshiba - Magic Coil . \u0110\u1eb7c \u0111i\u1ec3m n\u1ed5i b\u1eadt: M\u00e1y l\u1ea1nh \u0111\u01b0\u1ee3c trang b\u1ecb c\u00e1c c\u00f4ng ngh\u1ec7 di\u1ec7t khu\u1ea9n v\u00e0 thanh l\u1ecdc kh\u00f4ng kh\u00ed gi\u00fap b\u1ea3o v\u1ec7 s\u1ee9c kh\u1ecfe h\u00f4 h\u1ea5p c\u1ee7a ng\u01b0\u1eddi d\u00f9ng g\u1ed3m Plasma Ion, UltraPure. C\u00f3 c\u00e1c t\u00ednh n\u0103ng th\u00f4ng minh nh\u01b0 Magic Coil - C\u00f4ng ngh\u1ec7 ch\u1ed1ng b\u00e1m b\u1ea9n \u0111\u1ed9c quy\u1ec1n c\u1ee7a th\u01b0\u01a1ng hi\u1ec7u Toshiba. H\u1ec7 th\u1ed1ng l\u00e0m m\u00e1t hi\u1ec7u qu\u1ea3 v\u00e0 nhanh ch\u00f3ng ch\u1ec9 trong 3 ph\u00fat nh\u1edd c\u00f4ng ngh\u1ec7 Hi Power. M\u00e1y c\u00f3 \u0111\u1ed9 b\u1ec1n t\u1ed1t, ho\u1ea1t \u0111\u1ed9ng \u00eam \u00e1i v\u00e0 \u1ed5n \u0111\u1ecbnh. Th\u00f4ng s\u1ed1 k\u1ef9 thu\u1eadt c\u1ee7a \u0111i\u1ec1u h\u00f2a Toshiba Inverter 1.5 HP RAS-H13E2KCVG-V Xem th\u00eam v\u1ec1 c\u00e1c th\u00f4ng s\u1ed1 k\u1ef9 thu\u1eadt c\u1ee7a chi\u1ebfc \u0111i\u1ec1u h\u00f2a kh\u00f4ng kh\u00ed 1.5 Hp n\u00e0y c\u1ee7a Toshiba \u0111\u1ec3 hi\u1ec3u r\u00f5 h\u01a1n v\u1ec1 s\u1ea3n ph\u1ea9m. Th\u00f4ng s\u1ed1 Chi ti\u1ebft Th\u00f4ng tin s\u1ea3n ph\u1ea9m Lo\u1ea1i m\u00e1y M\u00e1y l\u1ea1nh 1 chi\u1ec1u (ch\u1ec9 l\u00e0m l\u1ea1nh) C\u00f4ng su\u1ea5t l\u00e0m l\u1ea1nh 1.5 HP - 12.200 BTU Ph\u1ea1m vi l\u00e0m l\u1ea1nh hi\u1ec7u qu\u1ea3 D\u01b0\u1edbi 15 - 20 m2 (t\u1eeb 40 \u0111\u1ebfn 60 m3) C\u00f4ng ngh\u1ec7 Inverter M\u00e1y l\u1ea1nh Inverter \u0110\u1ed9 \u1ed3n trung b\u00ecnh 23/30/36/41/45 dB D\u00f2ng s\u1ea3n ph\u1ea9m 2021 S\u1ea3n xu\u1ea5t t\u1ea1i Th\u00e1i Lan Th\u1eddi gian b\u1ea3o h\u00e0nh c\u1ee5c l\u1ea1nh 2 n\u0103m Th\u1eddi gian b\u1ea3o h\u00e0nh c\u1ee5c n\u00f3ng M\u00e1y n\u00e9n 2 n\u0103m Ch\u1ea5t li\u1ec7u d\u00e0n t\u1ea3n nhi\u1ec7t \u1ed0ng d\u1eabn gas b\u1eb1ng \u0110\u1ed3ng - L\u00e1 t\u1ea3n nhi\u1ec7t b\u1eb1ng Nh\u00f4m ph\u1ee7 l\u1edbp ch\u1ed1ng \u0103n m\u00f2n Golden Coating Lo\u1ea1i Gas R-32 M\u1ee9c ti\u00eau th\u1ee5 \u0111i\u1ec7n n\u0103ng Ti\u00eau th\u1ee5 \u0111i\u1ec7n 1.05 kW/h Nh\u00e3n n\u0103ng l\u01b0\u1ee3ng 5 sao (Hi\u1ec7u su\u1ea5t n\u0103ng l\u01b0\u1ee3ng 6.75) C\u00f4ng ngh\u1ec7 ti\u1ebft ki\u1ec7m \u0111i\u1ec7n Hybrid Inverter Eco Kh\u1ea3 n\u0103ng l\u1ecdc kh\u00f4ng kh\u00ed L\u1ecdc b\u1ee5i, kh\u00e1ng khu\u1ea9n, kh\u1eed m\u00f9i C\u00f4ng ngh\u1ec7 tinh l\u1ecdc kh\u00f4ng kh\u00ed Plasma ion C\u00f4ng ngh\u1ec7 ch\u1ed1ng b\u00e1m b\u1ea9n Magic Coil B\u1ed9 l\u1ecdc ch\u1ed1ng n\u1ea5m m\u1ed1c C\u00f4ng ngh\u1ec7 di\u1ec7t khu\u1ea9n UltraPure C\u00f4ng ngh\u1ec7 l\u00e0m l\u1ea1nh Ch\u1ebf \u0111\u1ed9 gi\u00f3 \u0110i\u1ec1u khi\u1ec3n l\u00ean xu\u1ed1ng t\u1ef1 \u0111\u1ed9ng C\u00f4ng ngh\u1ec7 l\u00e0m l\u1ea1nh nhanh Hi Power Ti\u1ec7n \u00edch Ti\u1ec7n \u00edch T\u1ef1 kh\u1edfi \u0111\u1ed9ng l\u1ea1i khi c\u00f3 \u0111i\u1ec7n Lu\u1ed3ng gi\u00f3 th\u1ed5i d\u1ec5 ch\u1ecbu b\u1ea3o v\u1ec7 da Hada Care Ch\u1ee9c n\u0103ng ng\u1ee7 d\u1ec5 ch\u1ecbu Comfort Sleep T\u1ea1o ion l\u1ecdc kh\u00f4ng kh\u00ed Ghi nh\u1edb ch\u1ebf \u0111\u1ed9 l\u00e0m l\u1ea1nh \u01b0a th\u00edch Ho\u1ea1t \u0111\u1ed9ng si\u00eau \u00eam Quiet Ch\u1ee9c n\u0103ng h\u00fat \u1ea9m H\u1eb9n gi\u1edd b\u1eadt t\u1eaft m\u00e1y Ch\u1ebf \u0111\u1ed9 ch\u1ec9 s\u1eed d\u1ee5ng qu\u1ea1t Fan Only - ch\u1ec9 l\u00e0m m\u00e1t, kh\u00f4ng l\u00e0m l\u1ea1nh Ch\u1ee9c n\u0103ng t\u1ef1 l\u00e0m s\u1ea1ch Th\u00f4ng s\u1ed1 k\u00edch th\u01b0\u1edbc/l\u1eafp \u0111\u1eb7t K\u00edch th\u01b0\u1edbc - Kh\u1ed1i l\u01b0\u1ee3ng d\u00e0n l\u1ea1nh D\u00e0i 80 cm - Cao 29.3 cm - D\u00e0y 22.6 cm - N\u1eb7ng 10 kg K\u00edch th\u01b0\u1edbc - Kh\u1ed1i l\u01b0\u1ee3ng d\u00e0n n\u00f3ng D\u00e0i 66 cm - Cao 53 cm - D\u00e0y 24 cm - N\u1eb7ng 22 kg Chi\u1ec1u d\u00e0i l\u1eafp \u0111\u1eb7t \u1ed1ng \u0111\u1ed3ng T\u1ed1i \u0111a 15m Chi\u1ec1u cao l\u1eafp \u0111\u1eb7t t\u1ed1i \u0111a gi\u1eefa c\u1ee5c n\u00f3ng - l\u1ea1nh 12m D\u00f2ng \u0111i\u1ec7n v\u00e0o D\u00e0n l\u1ea1nh D\u00f2ng \u0111i\u1ec7n ho\u1ea1t \u0111\u1ed9ng 1 pha K\u00edch th\u01b0\u1edbc \u1ed1ng \u0111\u1ed3ng 6/10 S\u1ed1 l\u01b0\u1ee3ng k\u1ebft n\u1ed1i d\u00e0n l\u1ea1nh t\u1ed1i \u0111a 1 \u0110\u00e1nh gi\u00e1 chi ti\u1ebft c\u00e1c t\u00ednh n\u0103ng c\u1ee7a m\u00e1y l\u1ea1nh Toshiba Inverter 1.5 HP RAS-H13E2KCVG-V \u0110\u00e2y l\u00e0 m\u1ed9t d\u00f2ng m\u00e1y l\u1ea1nh c\u00f3 c\u00f4ng su\u1ea5t cao, t\u1ed1c \u0111\u1ed9 l\u00e0m l\u1ea1nh nhanh th\u00f4ng qua c\u00f4ng ngh\u1ec7 Hi Power, \u0111\u01b0\u1ee3c trang b\u1ecb c\u00f4ng ngh\u1ec7 l\u1ecdc kh\u00f4ng kh\u00ed v\u00e0 c\u00e1c t\u00ednh n\u0103ng th\u00f4ng minh \u0111\u1ed9c quy\u1ec1n c\u1ee7a Toshiba. \u0110\u1ed3ng th\u1eddi c\u0169ng l\u00e0 m\u1ed9t s\u1ea3n ph\u1ea9m c\u00f3 thi\u1ebft k\u1ebf \u0111\u1eb9p, h\u00e0i h\u00f2a v\u1edbi kh\u00f4ng gian n\u1ed9i th\u1ea5t, \u0111\u1ed9 b\u1ec1n t\u1ed1t, ho\u1ea1t \u0111\u1ed9ng \u00eam \u00e1i v\u00e0 \u1ed5n \u0111\u1ecbnh. L\u00e0 m\u1ed9t d\u00f2ng s\u1ea3n ph\u1ea9m c\u00f3 thi\u1ebft k\u1ebf d\u00e2n d\u1ee5ng Toshiba \u0111\u00e3 ph\u00e1t tri\u1ec3n nhi\u1ec1u lo\u1ea1i m\u00e1y \u0111i\u1ec1u h\u00f2a kh\u00f4ng kh\u00ed ph\u00f9 h\u1ee3p v\u1edbi ng\u00f4i nh\u00e0 c\u1ee7a b\u1ea1n. B\u1ea1n c\u00f3 th\u1ec3 t\u00ecm th\u1ea5y c\u00f4ng ngh\u1ec7 bi\u1ebfn t\u1ea7n - Inverter t\u00edch h\u1ee3p trong c\u00e1c m\u1eabu m\u00e1y cung c\u1ea5p kh\u00f4ng kh\u00ed s\u1ea1ch v\u1edbi ho\u1ea1t \u0111\u1ed9ng \u00eam h\u01a1n v\u00e0 gi\u1ea3m m\u1ee9c ti\u00eau th\u1ee5 \u0111i\u1ec7n n\u0103ng. \u0110i\u1ec1u \u0111\u00f3 c\u0169ng th\u1ec3 hi\u1ec7n qua ng\u00f4n ng\u1eef thi\u1ebft k\u1ebf \u0111i\u1ec1u h\u00f2a c\u1ee7a th\u01b0\u01a1ng hi\u1ec7u. Inverter 1.5 HP RAS-H13E2KCVG-V l\u00e0 m\u1ed9t thi\u1ebft b\u1ecb \u0111\u01b0\u1ee3c thi\u1ebft k\u1ebf nguy\u00ean kh\u1ed1i v\u1edbi m\u00e0u tr\u1eafng ch\u1ee7 \u0111\u1ea1o. D\u00e0n l\u1ea1nh v\u00e0 d\u00e0n n\u00f3ng c\u1ee7a m\u00e1y l\u00e0 hai ph\u1ea7n t\u00e1ch r\u1eddi v\u1edbi k\u00edch th\u01b0\u1edbc t\u01b0\u01a1ng \u0111\u1ed1i nh\u1ecf g\u1ecdn, kh\u00f4ng chi\u1ebfm nhi\u1ec1u di\u1ec7n t\u00edch t\u01b0\u1eddng v\u00e0 d\u1ec5 d\u00e0ng l\u1eafp \u0111\u1eb7t. C\u1ee5 th\u1ec3: K\u00edch th\u01b0\u1edbc d\u00e0n n\u00f3ng: D\u00e0i 66 cm - Cao 53 cm - D\u00e0y 24 cm - N\u1eb7ng 22 kg. K\u00edch th\u01b0\u1edbc d\u00e0n l\u1ea1nh: D\u00e0i 80 cm - Cao 29.3 cm - D\u00e0y 22.6 cm - N\u1eb7ng 10 kg. M\u00e1y c\u0169ng c\u00f3 \u0111\u01b0\u1ee3c s\u1ef1 h\u00e0i h\u00f2a v\u1edbi c\u00e1c kh\u00f4ng gian n\u1ed9i th\u1ea5t kh\u00e1c nhau v\u00e0 ph\u00f9 h\u1ee3p cho nh\u1eefng c\u0103n ph\u00f2ng c\u00f3 di\u1ec7n t\u00edch t\u1eeb 15 \u0111\u1ebfn 20 m\u00e9t vu\u00f4ng v\u1edbi c\u00f4ng su\u1ea5t l\u00e0m l\u1ea1nh 1.5 HP . Kh\u1ea3 n\u0103ng l\u00e0m m\u00e1t hi\u1ec7u qu\u1ea3 c\u1ee7a m\u00e1y l\u1ea1nh Toshiba Inverter 1.5 HP RAS-H13E2KCVG-V nh\u1edd Hi Power C\u00f4ng ngh\u1ec7 Hi Power t\u1eeb Toshiba Aircon s\u1ebd gi\u1ea3m thi\u1ec3u th\u1eddi gian l\u00e0m l\u1ea1nh c\u1ee7a m\u00e1y m\u1ed9t c\u00e1ch t\u1ed1i \u01b0u, t\u1eeb \u0111\u00f3 gi\u00fap c\u0103n ph\u00f2ng nhanh ch\u00f3ng \u0111\u1ea1t \u0111\u01b0\u1ee3c nhi\u1ec7t \u0111\u1ed9 mong mu\u1ed1n. B\u1ea1n ph\u1ea3i s\u1eed d\u1ee5ng t\u00ednh n\u0103ng n\u00e0y ngay t\u1eeb \u0111\u1ea7u, khi m\u1edbi b\u1eadt m\u00e1y l\u1ea1nh v\u00e0 khi nhi\u1ec7t \u0111\u1ed9 b\u00ecnh th\u01b0\u1eddng c\u1ee7a c\u0103n ph\u00f2ng l\u1edbn h\u01a1n ho\u1eb7c b\u1eb1ng nhi\u1ec7t \u0111\u1ed9 c\u00e0i \u0111\u1eb7t l\u00e0 3,5 \u0111\u1ed9 C. \u0110\u1ec3 t\u1ed1i \u01b0u h\u01a1n kh\u1ea3 n\u0103ng l\u00e0m m\u00e1t \u0111\u1ed3ng th\u1eddi b\u1ea3o v\u1ec7 s\u1ee9c kh\u1ecfe l\u00e0n da c\u1ee7a b\u1ea1n, m\u00e1y c\u00f2n c\u00f3 kh\u1ea3 n\u0103ng t\u1ef1 \u0111\u1ed9ng \u0111i\u1ec1u ch\u1ec9nh c\u00e1nh \u0111\u1ea9y gi\u00f3 l\u00ean xu\u1ed1ng sau khi ng\u01b0\u1eddi d\u00f9ng thi\u1ebft l\u1eadp ch\u1ebf \u0111\u1ed9 t\u1eeb \u0111i\u1ec1u khi\u1ec3n. V\u1edbi c\u00e1ch n\u00e0y, gi\u00f3 t\u1eeb thi\u1ebft b\u1ecb s\u1ebd l\u01b0u th\u00f4ng l\u00ean xu\u1ed1ng bao ph\u1ee7 to\u00e0n b\u1ed9 kh\u00f4ng gian nh\u00e0 c\u1ee7a b\u1ea1n \u0111\u1ec3 mang \u0111\u1ebfn l\u00e0n kh\u00f4ng kh\u00ed m\u00e1t m\u1ebb tr\u1ecdn v\u1eb9n nh\u1ea5t. C\u00f9ng v\u1edbi \u0111\u00f3 l\u00e0 c\u00f4ng ngh\u1ec7 Hada Care - c\u00f4ng ngh\u1ec7 gi\u00fap c\u00e1c lu\u1ed3ng gi\u00f3 kh\u00f4ng th\u1ed5i tr\u1ef1c ti\u1ebfp v\u00e0o da m\u1eb7t c\u1ee7a ng\u01b0\u1eddi d\u00f9ng \u0111\u1ec3 tr\u00e1nh l\u00e0m kh\u00f4 v\u00e0 t\u1ed5n th\u01b0\u01a1ng da trong qu\u00e1 tr\u00ecnh s\u1eed d\u1ee5ng. \u0110\u1ed9 b\u1ec1n cao v\u00e0 kh\u1ea3 n\u0103ng ti\u1ebft ki\u1ec7m \u0111i\u1ec7n Toshiba c\u0169ng l\u00e0 m\u1ed9t trong th\u01b0\u01a1ng hi\u1ec7u \u0111\u01b0\u1ee3c \u0111\u00f4ng \u0111\u1ea3o ng\u01b0\u1eddi d\u00f9ng t\u00edn nhi\u1ec7m v\u00e0 \u0111\u00e1nh gi\u00e1 c\u00e1c s\u1ea3n ph\u1ea9m c\u00f3 \u0111\u1ed9 b\u1ec1n t\u1ed1t, ho\u1ea1t \u0111\u1ed9ng \u00eam \u00e1i v\u00e0 \u1ed5n \u0111\u1ecbnh. Toshiba Inverter 1.5 HP RAS-H13E2KCVG-V \u0111\u01b0\u1ee3c \u0111\u00e1nh gi\u00e1 cao v\u1ec1 kh\u1ea3 n\u0103ng ti\u1ebft ki\u1ec7m \u0111i\u1ec7n. C\u00e1c c\u00f4ng ngh\u1ec7 ti\u00ean ti\u1ebfn n\u1ed5i b\u1eadt c\u1ee7a Toshiba gi\u00fap t\u0103ng c\u01b0\u1eddng t\u00ednh n\u0103ng n\u00e0y l\u00e0 c\u00f4ng ngh\u1ec7 Inverter, Hybrid Inverter, ch\u1ebf \u0111\u1ed9 Eco v\u00e0 ch\u1ee9c n\u0103ng Power Selection. C\u1ee5 th\u1ec3, m\u00e1y l\u1ea1nh c\u1ee7a Toshiba c\u00f3 c\u00f4ng ngh\u1ec7 bi\u1ebfn t\u1ea7n (Inverter), m\u1ed9t t\u00ednh n\u0103ng quan tr\u1ecdng cho ph\u00e9p h\u1ec7 th\u1ed1ng \u0111i\u1ec1u h\u00f2a kh\u00f4ng kh\u00ed \u0111i\u1ec1u ch\u1ec9nh c\u00f4ng su\u1ea5t \u0111\u1ea7u ra \u0111\u1ec3 ph\u00f9 h\u1ee3p ch\u00ednh x\u00e1c v\u1edbi nhu c\u1ea7u th\u1ef1c t\u1ebf v\u1ec1 nhi\u1ec7t \u0111\u1ed9 trong ph\u00f2ng c\u1ee7a b\u1ea1n. C\u00f4ng ngh\u1ec7 Inverter kh\u00f4ng ch\u1ec9 ti\u1ebft ki\u1ec7m n\u0103ng l\u01b0\u1ee3ng m\u00e0 c\u00f2n \u0111\u1ea3m b\u1ea3o s\u1ef1 tho\u1ea3i m\u00e1i nh\u1ea5t qu\u00e1n b\u1eb1ng c\u00e1ch tr\u00e1nh c\u00e1c chu k\u1ef3 kh\u1edfi \u0111\u1ed9ng - d\u1eebng th\u00f4ng th\u01b0\u1eddng c\u1ee7a c\u00e1c h\u1ec7 th\u1ed1ng th\u00f4ng th\u01b0\u1eddng. C\u00f3 th\u1ec3 \u0111\u00e1nh gi\u00e1 Toshiba l\u00e0 th\u01b0\u01a1ng hi\u1ec7u ti\u00ean phong trong c\u00f4ng ngh\u1ec7 bi\u1ebfn t\u1ea7n \u0111\u1ec3 t\u1ea1o ra c\u00e1c s\u1ea3n ph\u1ea9m mang l\u1ea1i hi\u1ec7u qu\u1ea3 c\u1ea3i thi\u1ec7n so v\u1edbi c\u00e1c h\u1ec7 th\u1ed1ng truy\u1ec1n th\u1ed1ng. Toshiba Inverter 1.5 HP RAS-H13E2KCVG-V \u0111\u01b0\u1ee3c trang b\u1ecb nhi\u1ec1u t\u00ednh n\u0103ng th\u00f4ng minh v\u00e0 n\u1ed5i b\u1eadt Magic Coil l\u00e0 m\u1ed9t trong nh\u1eefng c\u00f4ng ngh\u1ec7 ch\u1ed1ng b\u00e1m b\u1ea9n th\u00f4ng minh \u0111\u1ed9c quy\u1ec1n c\u1ee7a Toshiba, l\u00e0m n\u1ed5i b\u1eadt d\u00f2ng s\u1ea3n ph\u1ea9m \u0111i\u1ec1u h\u00f2a kh\u00f4ng kh\u00ed cao c\u1ea5p c\u1ee7a th\u01b0\u01a1ng hi\u1ec7u n\u00e0y. B\u1ec1 m\u1eb7t c\u1ee7a m\u00e1y l\u1ea1nh \u0111\u01b0\u1ee3c ph\u1ee7 m\u1ed9t l\u1edbp ph\u1ee7 \u0111\u1eb7c bi\u1ec7t g\u1ecdi l\u00e0 Aqua. L\u1edbp ph\u1ee7 n\u00e0y c\u00f3 t\u00e1c d\u1ee5ng ng\u0103n b\u1ee5i b\u00e1m v\u00e0o b\u1ec1 m\u1eb7t ngo\u00e0i c\u1ee7a l\u00e1 nh\u00f4m \u0111\u1ec3 c\u00e1c d\u00e0n l\u1ea1nh \u0111\u01b0\u1ee3c b\u1ea3o v\u1ec7 kh\u1ecfi c\u00e1c t\u00e1c nh\u00e2n g\u00e2y h\u1ea1i v\u00e0 \u00f4 nhi\u1ec5m. Kh\u00f4ng ch\u1ec9 v\u1eady, nh\u1edd c\u00f4ng ngh\u1ec7 Magic Clean Air m\u00e1y c\u00f2n c\u00f3 kh\u1ea3 n\u0103ng t\u1ef1 \u0111\u1ed9ng lo\u1ea1i b\u1ecf c\u00e1c b\u1ee5i b\u1ea9n thu \u0111\u01b0\u1ee3c trong qu\u00e1 tr\u00ecnh ho\u1ea1t \u0111\u1ed9ng th\u00f4ng qua \u0111\u01b0\u1eddng \u1ed1ng tho\u00e1t n\u01b0\u1edbc v\u1eeba gi\u00fap ti\u1ebft ki\u1ec7m th\u1eddi gian v\u00e0 ti\u1ec1n b\u1ea1c cho nh\u1eefng s\u1eeda ch\u1eefa v\u00e0 chi ph\u00ed kh\u00f4ng c\u1ea7n thi\u1ebft. Kh\u1ea3 n\u0103ng t\u1ef1 \u0111\u1ed9ng l\u00e0m s\u1ea1ch v\u00e0 kh\u1edfi \u0111\u1ed9ng sau khi m\u1ea5t \u0111i\u1ec7n linh ho\u1ea1t T\u00ednh n\u0103ng t\u1ef1 \u0111\u1ed9ng l\u00e0m s\u1ea1ch c\u1ee7a m\u00e1y c\u0169ng \u0111\u01b0\u1ee3c thi\u1ebft l\u1eadp \u0111\u1ec3 sau khi ng\u01b0\u1eddi d\u00f9ng t\u1eaft k\u00edch ho\u1ea1t \u0111i\u1ec1u h\u00f2a. Thi\u1ebft b\u1ecb v\u1eabn s\u1ebd ti\u1ebfp t\u1ee5c ho\u1ea1t \u0111\u1ed9ng trong \u00edt ph\u00fat \u0111\u1ec3 t\u1ef1 th\u1ef1c hi\u1ec7n c\u01a1 ch\u1ebf l\u00e0m s\u1ea1ch 3 b\u01b0\u1edbc c\u00f3 s\u1eb5n. Th\u00f4ng qua \u0111\u00f3, m\u00e1y s\u1ebd l\u00e0m s\u1ea1ch d\u00e0n l\u1ea1nh, n\u00e2ng cao hi\u1ec7u su\u1ea5t, b\u1ea3o v\u1ec7 m\u00e1y v\u00e0 n\u00e2ng cao tu\u1ed5i th\u1ecd s\u1eed d\u1ee5ng c\u1ee7a thi\u1ebft b\u1ecb. M\u1ed9t t\u00ednh n\u0103ng kh\u00e1c g\u00e2y \u1ea5n t\u01b0\u1ee3ng v\u00e0 \u0111\u1ea7y ti\u1ec7n d\u1ee5ng l\u00e0 vi\u1ec7c m\u00e1y l\u1ea1nh c\u00f3 th\u1ec3 t\u1ef1 \u0111\u1ed9ng kh\u1edfi \u0111\u1ed9ng l\u1ea1i sau khi m\u1ea5t \u0111i\u1ec7n v\u00e0 ti\u1ebfp t\u1ee5c ho\u1ea1t \u0111\u1ed9ng v\u1edbi c\u00e1c c\u00e0i \u0111\u1eb7t \u0111\u00e3 \u0111\u01b0\u1ee3c thi\u1ebft l\u1eadp s\u1eb5n tr\u01b0\u1edbc \u0111\u00f3. \u0110i\u1ec1u n\u00e0y ti\u1ebft ki\u1ec7m cho ng\u01b0\u1eddi d\u00f9ng m\u1ed9t kho\u1ea3ng th\u1eddi gian v\u00e0 c\u00f4ng s\u1ee9c khi kh\u00f4ng c\u1ea7n ph\u1ea3i kh\u1edfi \u0111\u1ed9ng l\u1ea1i m\u00e1y v\u00e0 thi\u1ebft l\u1ea1i l\u1ea1i c\u00e1c c\u00e0i \u0111\u1eb7t y\u00eau th\u00edch c\u1ee7a m\u00ecnh. \u0110\u1ed3ng th\u1eddi, b\u1ea1n c\u0169ng kh\u00f4ng ph\u1ea3i ch\u1edd \u0111\u1ee3i qu\u00e1 l\u00e2u \u0111\u1ec3 c\u00f3 kh\u00f4ng kh\u00ed m\u00e1t tr\u1edf l\u1ea1i. C\u00f4ng ngh\u1ec7 l\u1ecdc kh\u00f4ng kh\u00ed v\u00e0 l\u00e0m s\u1ea1ch ch\u1ea5t l\u01b0\u1ee3ng c\u1ee7a \u0111i\u1ec1u h\u00f2a Toshiba Inverter 1.5 HP RAS-H13E2KCVG-V H\u1ea7u h\u1ebft c\u00e1c s\u1ea3n ph\u1ea9m m\u00e1y l\u1ea1nh Toshiba \u0111\u1ec1u \u0111\u01b0\u1ee3c trang b\u1ecb b\u1ed9 l\u1ecdc ch\u1ed1ng n\u1ea5m m\u1ed1c gi\u00fap l\u1ecdc b\u1ee5i v\u00e0 n\u1ea5m m\u1ed1c gi\u00fap h\u1ea1n ch\u1ebf s\u1ef1 ph\u00e1t tri\u1ec3n c\u1ee7a c\u00e1c t\u00e1c nh\u00e2n g\u00e2y h\u1ea1i cho s\u1ee9c kh\u1ecfe gia \u0111\u00ecnh b\u1ea1n. B\u1ed9 l\u1ecdc n\u00e0y c\u0169ng c\u00f3 th\u1ec3 th\u00e1o r\u1eddi, d\u1ec5 d\u00e0ng thay th\u1ebf v\u00e0 v\u1ec7 sinh. S\u1ea3n ph\u1ea9m n\u00e0y c\u1ee7a th\u01b0\u01a1ng hi\u1ec7u c\u0169ng c\u00f3 b\u1ed9 l\u1ecdc s\u1eed d\u1ee5ng c\u00f4ng ngh\u1ec7 kh\u00e1ng khu\u1ea9n Ultra Pure lo\u1ea1i b\u1ecf \u0111\u1ebfn 99% vi khu\u1ea9n, b\u1ee5i b\u1ea9n v\u00e0 n\u1ea5m m\u1ed1c, bao g\u1ed3m c\u1ea3 vi-r\u00fat H5N1. Ultra Pure l\u00e0 s\u1ef1 k\u1ebft h\u1ee3p c\u1ee7a tinh th\u1ec3 b\u1ea1c (Ag) v\u00e0 Enzyme Leuconostoc, c\u00f3 hi\u1ec7u qu\u1ea3 ti\u00eau di\u1ec7t m\u00f4i tr\u01b0\u1eddng sinh s\u00f4i c\u1ee7a vi-r\u00fat, vi khu\u1ea9n v\u00e0 kh\u1eed m\u00f9i hi\u1ec7u qu\u1ea3. H\u1ec7 th\u1ed1ng l\u1ecdc kh\u00f4ng kh\u00ed Ultra Pure ho\u1ea1t \u0111\u1ed9ng b\u1eb1ng c\u00e1ch t\u1ea1o ra c\u00e1c ion t\u00edch \u0111i\u1ec7n. C\u00e1c ion n\u00e0y s\u1ebd thu h\u00fat c\u00e1c h\u1ea1t c\u00f3 h\u1ea1i v\u00e0o m\u00e0ng l\u1ecdc; sau \u0111\u00f3, ch\u00fang \u0111\u01b0\u1ee3c lo\u1ea1i b\u1ecf b\u1eb1ng \u0111\u01b0\u1eddng \u1ed1ng tho\u00e1t n\u01b0\u1edbc. V\u1edbi c\u00f4ng ngh\u1ec7 n\u00e0y, m\u00e1y l\u1ea1nh Toshiba c\u00f3 th\u1ec3 l\u1ecdc 99% c\u00e1c ph\u00e2n t\u1eed g\u00e2y d\u1ecb \u1ee9ng nh\u01b0 b\u1ee5i m\u1ecbn, 95% vi khu\u1ea9n c\u00f3 h\u1ea1i v\u00e0 85% c\u00e1c lo\u1ea1i vi-r\u00fat kh\u00e1c. C\u00f4ng ngh\u1ec7 ion plasma c\u0169ng c\u00f3 th\u1ec3 gi\u00fap lo\u1ea1i b\u1ecf m\u00f9i h\u00f4i do n\u1ea5m m\u1ed1c, m\u00f9i thu\u1ed1c l\u00e1 v\u00e0 m\u00f9i th\u1ee9c \u0103n. Tham kh\u1ea3o gi\u00e1 c\u1ee7a m\u00e1y l\u1ea1nh Toshiba Inverter 1.5 HP RAS-H13E2KCVG-V L\u00e0 m\u1ed9t d\u00f2ng s\u1ea3n ph\u1ea9m h\u1ed9i t\u1ee5 nhi\u1ec1u t\u00ednh n\u0103ng v\u00e0 c\u00f4ng ngh\u1ec7 n\u1ed5i tr\u1ed9i nh\u01b0ng Toshiba v\u1eabn l\u00e0m t\u1ed1t c\u00e2u chuy\u1ec7n c\u00e2n \u0111\u1ed1i gi\u1eefa gi\u00e1 th\u00e0nh v\u00e0 ch\u1ea5t l\u01b0\u1ee3ng. Do \u0111\u00f3, ng\u01b0\u1eddi d\u00f9ng c\u00f3 th\u1ec3 s\u1edf h\u1eefu cho ng\u00f4i nh\u00e0 c\u1ee7a m\u00ecnh m\u1ed9t chi\u1ebfc m\u00e1y l\u1ea1nh ch\u1ea5t l\u01b0\u1ee3ng nh\u01b0 Inverter 1.5 HP RAS-H13E2KCVG-V c\u1ee7a Toshiba v\u1edbi gi\u00e1 c\u1ea3 r\u1ea5t ph\u1ea3i ch\u0103ng v\u00e0 ph\u00f9 h\u1ee3p t\u00fai ti\u1ec1n. \u0110\u1eb7c bi\u1ec7t khi mua c\u00e1c s\u1ea3n ph\u1ea9m Toshiba t\u1ea1i Ho\u00e0ng H\u00e0 Mobile , qu\u00fd kh\u00e1ch h\u00e0ng c\u00f2n c\u00f3 c\u01a1 h\u1ed9i s\u1edf h\u1eefu s\u1ea3n ph\u1ea9m v\u1edbi m\u1ee9c gi\u00e1 \u01b0u \u0111\u00e3i h\u01a1n . Mua \u0111i\u1ec1u h\u00f2a Toshiba Inverter 1.5 HP RAS-H13E2KCVG-V t\u1ea1i Ho\u00e0ng H\u00e0 Mobile v\u1edbi nhi\u1ec1u \u01b0u \u0111\u00e3i \u0110\u1ec3 mua h\u00e0ng, qu\u00fd kh\u00e1ch c\u00f3 th\u1ec3 gh\u00e9 \u0111\u1ebfn c\u1eeda h\u00e0ng Ho\u00e0ng H\u00e0 Mobile g\u1ea7n m\u00ecnh nh\u1ea5t ho\u1eb7c \u0111\u1eb7t h\u00e0ng online t\u1ea1i website hoanghamobile \u0111\u1ec3 \u0111\u01b0\u1ee3c giao h\u00e0ng t\u1eadn nh\u00e0 mi\u1ec5n ph\u00ed v\u1eadn chuy\u1ec3n. T\u1ea5t c\u1ea3 c\u00e1c s\u1ea3n ph\u1ea9m \u0111i\u1ec1u h\u00f2a, m\u00e1y l\u1ea1nh c\u1ee7a th\u01b0\u01a1ng hi\u1ec7u Toshiba hi\u1ec7n \u0111ang \u0111\u01b0\u1ee3c ph\u00e2n ph\u1ed1i v\u00e0 b\u00e1n l\u1ebb t\u1ea1i c\u1eeda h\u00e0ng c\u1ee7a ch\u00fang t\u00f4i \u0111\u1ec1u \u0111\u01b0\u1ee3c c am k\u1ebft v\u1ec1 ch\u1ea5t l\u01b0\u1ee3ng v\u00e0 th\u1eddi gian b\u1ea3o h\u00e0nh s\u1ea3n ph\u1ea9m ch\u00ednh h\u00e3ng . Qu\u00fd kh\u00e1ch h\u00e0ng c\u0169ng s\u1ebd c\u00f3 30 ng\u00e0y \u0111\u1ec3 \u0111\u1ed5i tr\u1ea3 mi\u1ec5n ph\u00ed n\u1ebfu ph\u00e1t sinh l\u1ed7i n\u00e0o t\u1eeb nh\u00e0 s\u1ea3n xu\u1ea5t. V\u00e0 t\u1ea5t nhi\u00ean, kh\u00f4ng th\u1ec3 b\u1ecf qua c\u00e1c ch\u01b0\u01a1ng tr\u00ecnh khuy\u1ebfn m\u00e3i si\u00eau h\u1ea5p d\u1eabn \u0111ang ch\u1edd \u0111\u00f3n khi tham gia mua h\u00e0ng t\u1ea1i Ho\u00e0ng H\u00e0 Mobile. C\u00f9ng ch\u00ednh s\u00e1ch tr\u1ea3 g\u00f3p t\u1eeb 0% \u0111\u01b0\u1ee3c \u0111\u00f4ng \u0111\u1ea3o kh\u00e1ch h\u00e0ng l\u1ef1a ch\u1ecdn. Li\u00ean h\u1ec7 ngay 1900.2091 \u0111\u1ec3 \u0111\u01b0\u1ee3c t\u01b0 v\u1ea5n v\u00e0 h\u1ed7 tr\u1ee3 mi\u1ec5n ph\u00ed ngay h\u00f4m nay. Xem to\u00e0n b\u1ed9 b\u00e0i vi\u1ebft",
        "promotion_1": "1. Tr\u00fang 8386 qu\u00e0 - T\u1ed5ng gi\u00e1 tr\u1ecb t\u1edbi 250 TRI\u1ec6U \u0110\u1ed2NG (\u00c1p d\u1ee5ng t\u1eeb 10/01 - 02/02/2025). (Xem chi ti\u1ebft). 2. \u0110\u1eb7c bi\u1ec7t Tr\u1ea3 g\u00f3p 3 kh\u00f4ng: 0% l\u00e3i su\u1ea5t - 0 ph\u00ed chuy\u1ec3n \u0111\u1ed5i - 0 tr\u1ea3 tr\u01b0\u1edbc (\u00c1p d\u1ee5ng cho c\u00f4ng ty t\u00e0i ch\u00ednh v\u00e0 th\u1ebb t\u00edn d\u1ee5ng)",
        "promotion_2": "1. Gi\u1ea3m t\u1edbi 500.000\u0111 khi thanh to\u00e1n th\u1ebb t\u00edn d\u1ee5ng NCB. (Xem chi ti\u1ebft). 2. Gi\u1ea3m \u0111\u1ebfn 150.000\u0111 khi thanh to\u00e1n qua Muadee. (Xem chi ti\u1ebft). 3. Mi\u1ec5n ph\u00ed chuy\u1ec3n \u0111\u1ed5i tr\u1ea3 g\u00f3p ho\u1eb7c gi\u1ea3m \u0111\u1ebfn 500.000\u0111 khi m\u1edf th\u1ebb TPBank EVO. (Xem chi ti\u1ebft). 4. M\u1edf th\u1ebb t\u00edn d\u1ee5ng VIB - Nh\u1eadn Voucher 600.000\u0111. (Xem chi ti\u1ebft). 5. M\u1edf th\u1ebb HSBC - Ho\u00e0n ti\u1ec1n t\u1edbi 2 tri\u1ec7u \u0111\u1ed3ng. (Xem chi ti\u1ebft)"
    },
    {
        "title": "\u0110i\u1ec1u h\u00f2a Toshiba Inverter 18.000 BTU (2 HP) RAS-H18E2KCVG-V",
        "price": "gi\u00e1 hi\u1ec7n t\u1ea1i l\u00e0 18,900,000 \u20ab nh\u01b0ng tr\u01b0\u1edbc \u0111\u00e2y n\u00f3 c\u00f3 gi\u00e1 l\u00e0 20,890,000 \u20ab",
        "colors": "Tr\u1eafng",
        "technical_specifications": [
            {
                "Lo\u1ea1i m\u00e1y": "1 chi\u1ec1u (ch\u1ec9 l\u00e0m l\u1ea1nh)"
            },
            {
                "C\u00f4ng ngh\u1ec7 inverter": "M\u00e1y l\u1ea1nh Inverter"
            },
            {
                "C\u00f4ng su\u1ea5t l\u00e0m l\u1ea1nh": "2 HP - 18.000 BTU"
            },
            {
                "Ph\u1ea1m vi l\u00e0m l\u1ea1nh hi\u1ec7u qu\u1ea3": "T\u1eeb 20 - 30m\u00b2 (t\u1eeb 60 \u0111\u1ebfn 80m\u00b3)"
            },
            {
                "Nh\u00e3n n\u0103ng l\u01b0\u1ee3ng": "5 sao (Hi\u1ec7u su\u1ea5t n\u0103ng l\u01b0\u1ee3ng 6.06)"
            }
        ],
        "description": "Toshiba Inverter 2 HP RAS-H18E2KCVG-V l\u00e0 m\u1ed9t chi\u1ebfc m\u00e1y l\u1ea1nh c\u00f3 c\u00f4ng su\u1ea5t \u1ea5n t\u01b0\u1ee3ng \u0111\u1ebfn 18.000 BTU v\u00e0 \u0111\u01b0\u1ee3c trang b\u1ecb nhi\u1ec1u c\u00f4ng ngh\u1ec7 c\u0169ng nh\u01b0 t\u00ednh n\u0103ng ti\u00eau bi\u1ec3u. N\u1ebfu b\u1ea1n \u0111ang t\u00ecm ki\u1ebfm m\u1ed9t chi\u1ebfc m\u00e1y l\u1ea1nh kh\u00f4ng ch\u1ec9 c\u00f3 kh\u1ea3 n\u0103ng l\u00e0m m\u00e1t m\u00e0 c\u00f2n h\u01a1n th\u1ebf th\u00ec kh\u00f4ng n\u00ean b\u1ecf qua m\u1eabu n\u00e0y. B\u1edfi m\u00e1y t\u00edch h\u1ee3p c\u00e1c c\u00f4ng ngh\u1ec7 di\u1ec7t khu\u1ea9n v\u00e0 ch\u1ed1ng b\u00e1m b\u1ee5i nh\u01b0 Plasma Ion, Magic Coil, Ultra Care \u2026 V\u00e0 \u0111\u00e2y c\u0169ng s\u1ebd l\u00e0 s\u1ef1 l\u1ef1a ch\u1ecdn ho\u00e0n h\u1ea3o \u0111\u1ec3 b\u1ea3o v\u1ec7 c\u01a1 th\u1ec3 v\u1edbi ch\u1ebf \u0111\u1ed9 Hada Care \u0111\u1ed3ng th\u1eddi si\u00eau ti\u1ebft ki\u1ec7m \u0111i\u1ec7n n\u0103ng nh\u1edd c\u00f4ng ngh\u1ec7 Hybrid Inverter . \u0110\u1eb7c \u0111i\u1ec3m n\u1ed5i b\u1eadt: C\u00f4ng su\u1ea5t \u1ea5n t\u01b0\u1ee3ng 18.000 BTU v\u1edbi kh\u1ea3 n\u0103ng l\u00e0m l\u1ea1nh nhanh nh\u1edd s\u1eed d\u1ee5ng c\u00f4ng ngh\u1ec7 Hi Power. N\u00e2ng cao ch\u1ea5t l\u01b0\u1ee3ng kh\u00f4ng gian s\u1ed1ng v\u1edbi m\u1eabu \u0111i\u1ec1u h\u00f2a c\u00f3 thi\u1ebft k\u1ebf tinh t\u1ebf v\u00e0 hi\u1ec7n \u0111\u1ea1i. B\u1ea3o v\u1ec7 s\u1ee9c kh\u1ecfe t\u1ed1t h\u01a1n v\u1edbi kh\u1ea3 n\u0103ng di\u1ec7t khu\u1ea9n Plasma Ion v\u00e0 tinh l\u1ecdc kh\u00f4ng kh\u00ed th\u00f4ng qua UltraPure. L\u00e0m s\u1ea1ch d\u1ec5 d\u00e0ng h\u01a1n v\u1edbi ch\u1ebf \u0111\u1ed9 t\u1ef1 \u0111\u1ed9ng l\u00e0m s\u1ea1ch k\u1ebft h\u1ee3p c\u00f4ng ngh\u1ec7 ch\u1ed1ng b\u00e1m b\u1ee5i \u0111\u1ed9c quy\u1ec1n Magic Coil. Tho\u1ea3i m\u00e1i s\u1eed d\u1ee5ng m\u00e0 kh\u00f4ng lo v\u1ec1 l\u01b0\u1ee3ng \u0111i\u1ec7n n\u0103ng ti\u00eau th\u1ee5 v\u1edbi ch\u1ebf \u0111\u1ed9 ECO th\u00e2n thi\u1ec7n v\u1edbi m\u00f4i tr\u01b0\u1eddng v\u00e0 ch\u1ebf \u0111\u1ed9 si\u00eau ti\u1ebft ki\u1ec7m \u0111i\u1ec7n Hybrid Inverter. B\u1ea3ng th\u00f4ng s\u1ed1 k\u1ef9 thu\u1eadt c\u1ee7a \u0111i\u1ec1u h\u00f2a Toshiba Inverter 2 HP RAS-H18E2KCVG-V Tham kh\u1ea3o c\u00e1c th\u00f4ng s\u1ed1 k\u1ef9 thu\u1eadt chi ti\u1ebft c\u1ee7a \u0111i\u1ec1u h\u00f2a Inverter 2 HP RAS-H18E2KCVG-V, \u0111\u1eb7c bi\u1ec7t l\u00e0 c\u00e1c th\u00f4ng s\u1ed1 v\u1ec1 k\u00edch th\u01b0\u1edbc v\u00e0 c\u00f4ng ngh\u1ec7 \u1ee9ng d\u1ee5ng \u0111\u1ec3 c\u00f3 \u0111\u01b0\u1ee3c l\u1ef1a ch\u1ecdn ph\u00f9 h\u1ee3p cho kh\u00f4ng gian s\u1ed1ng c\u1ee7a gia \u0111\u00ecnh b\u1ea1n. Th\u00f4ng s\u1ed1 Chi ti\u1ebft Th\u00f4ng tin s\u1ea3n ph\u1ea9m Lo\u1ea1i m\u00e1y M\u00e1y l\u1ea1nh 1 chi\u1ec1u (ch\u1ec9 l\u00e0m l\u1ea1nh) C\u00f4ng su\u1ea5t l\u00e0m l\u1ea1nh 2 HP - 18.000 BTU Ph\u1ea1m vi l\u00e0m l\u1ea1nh hi\u1ec7u qu\u1ea3 D\u01b0\u1edbi 20 - 30 m2 (t\u1eeb 60 \u0111\u1ebfn 80 m3) C\u00f4ng ngh\u1ec7 Inverter M\u00e1y l\u1ea1nh Inverter \u0110\u1ed9 \u1ed3n trung b\u00ecnh 32/36/39/42/45 dB D\u00f2ng s\u1ea3n ph\u1ea9m 2021 S\u1ea3n xu\u1ea5t t\u1ea1i Th\u00e1i Lan Th\u1eddi gian b\u1ea3o h\u00e0nh c\u1ee5c l\u1ea1nh 2 n\u0103m Th\u1eddi gian b\u1ea3o h\u00e0nh c\u1ee5c n\u00f3ng M\u00e1y n\u00e9n 2 n\u0103m Ch\u1ea5t li\u1ec7u d\u00e0n t\u1ea3n nhi\u1ec7t \u1ed0ng d\u1eabn gas b\u1eb1ng \u0110\u1ed3ng - L\u00e1 t\u1ea3n nhi\u1ec7t b\u1eb1ng Nh\u00f4m ph\u1ee7 l\u1edbp ch\u1ed1ng \u0103n m\u00f2n Golden Coating Lo\u1ea1i Gas R-32 M\u1ee9c ti\u00eau th\u1ee5 \u0111i\u1ec7n n\u0103ng Ti\u00eau th\u1ee5 \u0111i\u1ec7n 1.57 kW/h Nh\u00e3n n\u0103ng l\u01b0\u1ee3ng 5 sao (Hi\u1ec7u su\u1ea5t n\u0103ng l\u01b0\u1ee3ng 6.75) C\u00f4ng ngh\u1ec7 ti\u1ebft ki\u1ec7m \u0111i\u1ec7n Hybrid Inverter Eco Kh\u1ea3 n\u0103ng l\u1ecdc kh\u00f4ng kh\u00ed L\u1ecdc b\u1ee5i, kh\u00e1ng khu\u1ea9n, kh\u1eed m\u00f9i C\u00f4ng ngh\u1ec7 tinh l\u1ecdc kh\u00f4ng kh\u00ed Plasma ion C\u00f4ng ngh\u1ec7 ch\u1ed1ng b\u00e1m b\u1ea9n Magic Coil B\u1ed9 l\u1ecdc ch\u1ed1ng n\u1ea5m m\u1ed1c C\u00f4ng ngh\u1ec7 di\u1ec7t khu\u1ea9n UltraPure C\u00f4ng ngh\u1ec7 l\u00e0m l\u1ea1nh Ch\u1ebf \u0111\u1ed9 gi\u00f3 \u0110i\u1ec1u khi\u1ec3n l\u00ean xu\u1ed1ng t\u1ef1 \u0111\u1ed9ng C\u00f4ng ngh\u1ec7 l\u00e0m l\u1ea1nh nhanh Hi Power Ti\u1ec7n \u00edch Ti\u1ec7n \u00edch T\u1ef1 kh\u1edfi \u0111\u1ed9ng l\u1ea1i khi c\u00f3 \u0111i\u1ec7n Lu\u1ed3ng gi\u00f3 th\u1ed5i d\u1ec5 ch\u1ecbu b\u1ea3o v\u1ec7 da Hada Care Ch\u1ee9c n\u0103ng ng\u1ee7 d\u1ec5 ch\u1ecbu Comfort Sleep T\u1ea1o ion l\u1ecdc kh\u00f4ng kh\u00ed Ghi nh\u1edb ch\u1ebf \u0111\u1ed9 l\u00e0m l\u1ea1nh \u01b0a th\u00edch Ho\u1ea1t \u0111\u1ed9ng si\u00eau \u00eam Quiet Ch\u1ee9c n\u0103ng h\u00fat \u1ea9m H\u1eb9n gi\u1edd b\u1eadt t\u1eaft m\u00e1y Ch\u1ebf \u0111\u1ed9 ch\u1ec9 s\u1eed d\u1ee5ng qu\u1ea1t Fan Only - ch\u1ec9 l\u00e0m m\u00e1t, kh\u00f4ng l\u00e0m l\u1ea1nh Ch\u1ee9c n\u0103ng t\u1ef1 l\u00e0m s\u1ea1ch Th\u00f4ng s\u1ed1 k\u00edch th\u01b0\u1edbc/l\u1eafp \u0111\u1eb7t K\u00edch th\u01b0\u1edbc - Kh\u1ed1i l\u01b0\u1ee3ng d\u00e0n l\u1ea1nh D\u00e0i 105 cm - Cao 32 cm - D\u00e0y 25 cm - N\u1eb7ng 14 kg K\u00edch th\u01b0\u1edbc - Kh\u1ed1i l\u01b0\u1ee3ng d\u00e0n n\u00f3ng D\u00e0i 78 cm - Cao 55 cm - D\u00e0y 29 cm - N\u1eb7ng 34 kg Chi\u1ec1u d\u00e0i l\u1eafp \u0111\u1eb7t \u1ed1ng \u0111\u1ed3ng T\u1ed1i \u0111a 20m Chi\u1ec1u cao l\u1eafp \u0111\u1eb7t t\u1ed1i \u0111a gi\u1eefa c\u1ee5c n\u00f3ng - l\u1ea1nh 10m D\u00f2ng \u0111i\u1ec7n v\u00e0o D\u00e0n l\u1ea1nh D\u00f2ng \u0111i\u1ec7n ho\u1ea1t \u0111\u1ed9ng 1 pha K\u00edch th\u01b0\u1edbc \u1ed1ng \u0111\u1ed3ng 6/12 S\u1ed1 l\u01b0\u1ee3ng k\u1ebft n\u1ed1i d\u00e0n l\u1ea1nh t\u1ed1i \u0111a 1 \u0110\u00e1nh gi\u00e1 c\u00e1c \u0111i\u1ec3m n\u1ed5i b\u1eadt c\u1ee7a \u0111i\u1ec1u h\u00f2a Toshiba Inverter 2 HP RAS-H18E2KCVG-V Inverter 2 HP RAS-H18E2KCVG-V l\u00e0 m\u1ed9t chi\u1ebfc m\u00e1y l\u1ea1nh c\u00f3 thi\u1ebft k\u1ebf \u0111\u1eb9p m\u1eaft, t\u00edch h\u1ee3p nhi\u1ec1u t\u00ednh n\u0103ng v\u00e0 c\u00f4ng ngh\u1ec7 hi\u1ec7n. V\u1edbi gi\u00e1 th\u00e0nh c\u1ef1c k\u1ef3 h\u1ee3p t\u00fai ti\u1ec1n, \u0111\u00e2y s\u1ebd l\u00e0 m\u1eabu m\u00e1y l\u1ea1nh b\u1ea1n n\u00ean s\u1edf h\u1eefu \u0111\u1ec3 gi\u1ea3i nhi\u1ec7t trong nh\u1eefng ng\u00e0y h\u00e8 n\u1eafng n\u00f3ng cho gia \u0111\u00ecnh v\u00e0 ng\u01b0\u1eddi th\u00e2n. Toshiba Inverter 2 HP RAS-H18E2KCVG-V v\u1edbi thi\u1ebft k\u1ebf nguy\u00ean kh\u1ed1i tinh t\u1ebf v\u00e0 hi\u1ec7n \u0111\u1ea1i M\u1eabu \u0111i\u1ec1u h\u00f2a Inverter 2 HP RAS-H18E2KCVG-V c\u1ee7a Toshiba c\u00f3 thi\u1ebft k\u1ebf nguy\u00ean kh\u1ed1i kh\u00f4ng v\u1ebft c\u1eaft v\u1edbi m\u00e0u tr\u1eafng ch\u1ee7 \u0111\u1ea1o c\u00f9ng m\u1eb7t tr\u01b0\u1edbc s\u00e1ng b\u00f3ng v\u00e0 \u0111\u01b0\u1ee3c trang tr\u00ed th\u00eam b\u1edfi m\u1ed9t \u0111\u01b0\u1eddng k\u1ebb ngang t\u1ea1o n\u00ean v\u1ebb ngo\u00e0i tinh t\u1ebf v\u00e0 hi\u1ec7n \u0111\u1ea1i. K\u00edch th\u01b0\u1edbc chi ti\u1ebft c\u1ee7a chi\u1ebfc m\u00e1y l\u1ea1nh n\u00e0y g\u1ed3m: D\u00e0n l\u1ea1nh: D\u00e0i 105 cm - Cao 32 cm - D\u00e0y 25 cm - N\u1eb7ng 14 kg D\u00e0n n\u00f3ng: D\u00e0i 78 cm - Cao 55 cm - D\u00e0y 29 cm - N\u1eb7ng 34 kg Toshiba Inverter 2 HP RAS-H18E2KCVG-V r\u1ea5t ti\u1ebft ki\u1ec7m \u0111i\u1ec7n n\u0103ng V\u1edbi nh\u1eefng l\u0103n t\u0103n chung c\u1ee7a ng\u01b0\u1eddi d\u00f9ng khi s\u1eed d\u1ee5ng l\u00e0 v\u1ea5n \u0111\u1ec1 ti\u00eau th\u1ee5 \u0111i\u1ec7n n\u0103ng, Toshiba g\u1ea7n nh\u01b0 \u0111\u00e3 gi\u1ea3i quy\u1ebft r\u1ea5t t\u1ed1t c\u00e2u chuy\u1ec7n n\u00e0y nh\u1edd c\u00f4ng ngh\u1ec7 Hybrid Inverter. \u0110\u00e2y l\u00e0 m\u1ed9t c\u00f4ng ngh\u1ec7 v\u01b0\u1ee3t tr\u1ed9i d\u1ef1a tr\u00ean c\u00f4ng ngh\u1ec7 bi\u1ebfn t\u1ea7n th\u00f4ng th\u01b0\u1eddng m\u00e0 c\u00e1c \u0111i\u1ec1u h\u00f2a Inverter th\u00f4ng th\u01b0\u1eddng hay s\u1eed d\u1ee5ng. N\u00f3i chi ti\u1ebft v\u1ec1 c\u00f4ng ngh\u1ec7 Hybrid Inverter. \u0110\u00e2y l\u00e0 c\u00f4ng ngh\u1ec7 bao g\u1ed3m hai module \u0111i\u1ec1u khi\u1ec3n l\u00e0 PAM - Model kh\u1edfi \u0111\u1ed9ng c\u00f3 c\u00f4ng su\u1ea5t l\u00e0m l\u1ea1nh cao v\u00e0 PWM - Modul duy tr\u00ec gi\u00fap hi\u1ec7u su\u1ea5t l\u00e0m l\u1ea1nh cao. S\u1ef1 k\u1ebft h\u1ee3p hai module k\u1ec3 tr\u00ean v\u1eeba gi\u00fap c\u0103n ph\u00f2ng c\u1ee7a b\u1ea1n \u0111\u1ea1t \u0111\u01b0\u1ee3c m\u1ee9c nhi\u1ec7t nhanh nh\u1ea5t \u0111\u1ed3ng th\u1eddi \u1ed5n \u0111\u1ecbnh m\u1ee9c nhi\u1ec7t l\u00fd t\u01b0\u1edfng \u0111\u1ec3 ng\u01b0\u1eddi d\u00f9ng c\u1ea3m nh\u1eadn \u0111\u01b0\u1ee3c s\u1ef1 tho\u1ea3i m\u00e1i v\u00e0 d\u1ec5 ch\u1ecbu nh\u01b0ng v\u1eabn ti\u1ebft ki\u1ec7m \u0111\u01b0\u1ee3c m\u1ee9c n\u0103ng l\u01b0\u1ee3ng ti\u00eau th\u1ee5 \u0111\u1ebfn m\u1ee9c t\u1ed1i \u0111a. B\u00ean c\u1ea1nh \u0111\u00f3, c\u0169ng ph\u1ea3i n\u00f3i \u0111\u1ebfn vi\u1ec7c c\u00f4ng ngh\u1ec7 Hybrid Inverter c\u00f2n cho ph\u00e9p c\u00e1c \u0111\u1ed9ng c\u01a1 c\u1ee7a m\u00e1y l\u1ea1nh bi\u1ebfn thi\u00ean t\u1ea7n s\u1ed1 \u0111\u1ebfn 0,1 Hz trong khi c\u00e1c m\u1eabu \u0111i\u1ec1u h\u00f2a th\u00f4ng th\u01b0\u1eddng \u0111\u1ea1t \u0111\u1ebfn 1 Hz. \u0110\u00e2y c\u0169ng l\u00e0 l\u00fd do \u0111i\u1ec1u h\u00f2a Inverter 2 HP RAS-H18E2KCVG-V c\u1ee7a Toshiba c\u00f3 th\u1ec3 v\u1eadn h\u00e0nh m\u1ed9t c\u00e1ch \u00eam \u00e1i v\u1edbi \u0111\u1ed9 \u1ed3n th\u1ea5p v\u00e0 ti\u1ebft ki\u1ec7m \u0111i\u1ec7n n\u0103ng c\u0169ng nh\u01b0 \u0111\u1ed9 \u1ed5n \u0111\u1ecbnh c\u0169ng \u0111\u01b0\u1ee3c n\u00e2ng cao h\u01a1n c\u00e1c d\u00f2ng \u0111i\u1ec1u h\u00f2a Inverter th\u00f4ng th\u01b0\u1eddng kh\u00e1c. C\u00f4ng ngh\u1ec7 kh\u00e1ng khu\u1ea9n \u0111\u1ed9c quy\u1ec1n Magic Coil C\u00f4ng ngh\u1ec7 Magic Coil \u0111\u01b0\u1ee3c Toshiba t\u1ef1 h\u00e0o l\u00e0 c\u00f4ng ngh\u1ec7 ch\u1ed1ng b\u00e1m b\u1ea9n th\u00f4ng minh \u0111\u1ed9c quy\u1ec1n c\u1ee7a th\u01b0\u01a1ng hi\u1ec7u n\u00e0y. Magic Coil l\u00e0 h\u1ec7 th\u1ed1ng ch\u1ed1ng b\u00e1m b\u1ea9n th\u00f4ng minh c\u1ee7a Toshiba Inverter 2 HP RAS-H18E2KCVG-V v\u1edbi b\u1ec1 m\u1eb7t \u0111\u01b0\u1ee3c tr\u00e1ng ph\u1ee7 m\u1ed9t l\u1edbp Aqua tr\u00ean l\u00e1 nh\u00f4m \u0111\u1ec3 mang \u0111\u1ebfn kh\u1ea3 n\u0103ng t\u1ef1 lo\u1ea1i b\u1ecf b\u1ee5i b\u1ea9n v\u00e0 c\u00e1c ch\u1ea5t g\u00e2y \u00f4 nhi\u1ec5m qua \u0111\u01b0\u1eddng tho\u00e1t n\u01b0\u1edbc. \u0110i\u1ec3m c\u1ed9ng c\u1ee7a c\u00f4ng ngh\u1ec7 ch\u1ed1ng b\u00e1m b\u1ea9n th\u00f4ng minh n\u00e0y l\u00e0 gi\u00fap ng\u0103n ng\u1eeba c\u00e1c lo\u1ea1i n\u1ea5m m\u1ed1c, vi khu\u1ea9n b\u00e1m v\u00e0o d\u00e0n l\u1ea1nh. T\u1eeb \u0111\u00f3 gi\u00fap m\u00e1y l\u1ea1nh ho\u1ea1t \u0111\u1ed9ng b\u1ec1n b\u1ec9 c\u0169ng nh\u01b0 ti\u1ebft ki\u1ec7m th\u1eddi gian m\u00e0 ng\u01b0\u1eddi d\u00f9ng c\u1ea7n \u0111\u1ec3 th\u1ef1c hi\u1ec7n v\u1ec7 sinh \u0111\u1ecbnh k\u1ef3 cho m\u00e1y. T\u00edch h\u1ee3p c\u00f4ng ngh\u1ec7 di\u1ec7t khu\u1ea9n Ultra Pure b\u1ea3o v\u1ec7 s\u1ee9c kh\u1ecfe gia \u0111\u00ecnh b\u1ea1n B\u00ean c\u1ea1nh c\u00e1c c\u00f4ng ngh\u1ec7 k\u1ec3 tr\u00ean, m\u00e1y l\u1ea1nh c\u00f2n \u0111\u01b0\u1ee3c trang b\u1ecb c\u00f4ng ngh\u1ec7 di\u1ec7t khu\u1ea9n Ultra Pure. C\u00f4ng ngh\u1ec7 n\u00e0y ch\u1ee9a hai t\u00e1c nh\u00e2n g\u1ed3m Leuconostoc Enzym v\u00e0 tinh th\u1ec3 b\u1ea1c gi\u00fap l\u00e0m gi\u1ea3m m\u00f4i tr\u01b0\u1eddng \u0111\u1ec3 vi khu\u1ea9n v\u00e0 vi r\u00fat c\u00f3 ph\u00e1t tri\u1ec3n sinh s\u00f4i. \u0110\u1ed3ng th\u1eddi c\u00f3 kh\u1ea3 n\u0103ng kh\u00e1ng khu\u1ea9n l\u00ean \u0111\u1ebfn 99.9% v\u00e0 c\u00f3 kh\u1ea3 n\u0103ng kh\u1eed \u0111\u01b0\u1ee3c c\u00e1c m\u00f9i nh\u01b0 kh\u00f3i, Amoniac, th\u1ef1c ph\u1ea9m\u2026 \u0110\u1eb7c bi\u1ec7t, \u0111i\u1ec1u h\u00f2a c\u00f2n c\u00f3 kh\u1ea3 n\u0103ng lo\u1ea1i b\u1ecf t\u1ea5t c\u1ea3 c\u00e1c lo\u1ea1i b\u1ee5i b\u1ea9n m\u1ed9t c\u00e1ch \u1ea5n t\u01b0\u1ee3ng, k\u1ec3 c\u1ea3 b\u1ee5i m\u1ecbn PM 2.5. Kh\u00f4ng kh\u00ed s\u1ea1ch h\u01a1n v\u00e0 an to\u00e0n v\u1edbi c\u00f4ng ngh\u1ec7 tinh l\u1ecdc Plasma Ion V\u1edbi c\u00f4ng ngh\u1ec7 n\u00e0y, nh\u1eefng g\u00ec x\u1ea3y ra trong t\u1ef1 nhi\u00ean \u0111\u01b0\u1ee3c m\u00f4 ph\u1ecfng trong Toshiba Inverter 2 HP RAS-H18E2KCVG-V : B\u1eb1ng c\u00e1ch cung c\u1ea5p \u0111i\u1ec7n, thi\u1ebft b\u1ecb t\u1ea1o ra \u0111i\u1ec7n \u00e1p cao gi\u1eefa hai t\u1ea5m kim lo\u1ea1i v\u00e0 t\u1ea1o ra plasma. C\u00e1c ion oxy t\u00edch \u0111i\u1ec7n \u00e2m \u0111\u01b0\u1ee3c h\u00ecnh th\u00e0nh v\u00e0 gi\u1ea3i ph\u00f3ng v\u00e0o ph\u00f2ng. N\u1ebfu c\u00e1c ion n\u00e0y g\u1eb7p virus, vi khu\u1ea9n, ph\u1ea5n hoa, vi khu\u1ea9n ho\u1eb7c c\u00e1c h\u1ea1t t\u01b0\u01a1ng t\u1ef1, ch\u00fang s\u1ebd ph\u00e2n t\u00e1ch c\u00e1c ch\u1ea5t kh\u00f4ng mong mu\u1ed1n th\u00e0nh c\u00e1c th\u00e0nh ph\u1ea7n v\u00f4 h\u1ea1i v\u00e0 do \u0111\u00f3 \u0111\u1ea3m b\u1ea3o kh\u00f4ng kh\u00ed th\u1edf s\u1ea1ch. \u0110\u1ed3ng th\u1eddi, \u0111i\u1ec7n t\u00edch \u00e2m li\u00ean k\u1ebft c\u00e1c h\u1ea1t b\u1ee5i l\u1ea1i v\u1edbi nhau \u0111\u1ec3 ch\u00fang k\u1ebft l\u1ea1i, ch\u00ecm xu\u1ed1ng v\u00e0 kh\u00f4ng th\u1ec3 h\u00edt v\u00e0o \u0111\u01b0\u1ee3c n\u1eefa. Trang b\u1ecb nhi\u1ec1u t\u00ednh n\u0103ng n\u1ed5i b\u1eadt C\u00e1c t\u00ednh n\u0103ng n\u1ed5i b\u1eadt nh\u1ea5t c\u1ee7a chi\u1ebfc \u0111i\u1ec1u h\u00f2a mang th\u01b0\u01a1ng hi\u1ec7u Toshiba n\u00e0y c\u00f3 th\u1ec3 \u0111\u01b0\u1ee3c t\u00ecm th\u1ea5y tr\u00ean m\u1ed9t chi\u1ebfc \u0111i\u1ec1u khi\u1ec3n nh\u1ecf g\u1ecdn, bao g\u1ed3m: T\u00ednh n\u0103ng Hi Power: M\u1ed9t ch\u1ebf \u0111\u1ed9 gi\u00fap \u0111i\u1ec1u h\u00f2a l\u00e0m l\u1ea1nh nhanh ch\u00f3ng khi k\u00edch ho\u1ea1t. Ch\u1ebf \u0111\u1ed9 ECO: Ch\u1ebf \u0111\u1ed9 gi\u00fap \u0111i\u1ec1u h\u00f2a ho\u1ea1t \u0111\u1ed9ng m\u1ed9t c\u00e1ch ti\u1ebft ki\u1ec7m \u0111i\u1ec7n nh\u1ea5t. T\u00ednh n\u0103ng s\u1eed d\u1ee5ng qu\u1ea1t - FAN: Khi k\u00edch ho\u1ea1t \u0111i\u1ec1u h\u00f2a s\u1ebd th\u1ed5i h\u01a1i ra nh\u01b0 d\u00f9ng qu\u1ea1t \u0111i\u1ec7n. T\u1ef1 l\u00e0m s\u1ea1ch \u0111i\u1ec1u h\u00f2a: \u0110\u00e2y l\u00e0 m\u1ed9t ch\u1ee9c n\u0103ng v\u00f4 c\u00f9ng \u1ea5n t\u01b0\u1ee3ng c\u1ee7a c\u00e1c \u0111i\u1ec1u h\u00f2a kh\u00f4ng kh\u00ed \u0111\u1ebfn t\u1eeb Toshiba. M\u00e1y s\u1ebd cho qu\u1ea1t v\u1eadn h\u00e0nh th\u00eam 20 ph\u00fat sau khi t\u1eaft \u0111\u1ec3 l\u00e0m kh\u00f4 d\u00e0n l\u1ea1nh tr\u00e1nh l\u00e0m m\u1ed1c. Nh\u1eefng \u01b0u \u0111i\u1ec3m c\u1ee7a Toshiba Inverter 2 HP RAS-H18E2KCVG-V khi t\u00edch h\u1ee3p c\u00e1c c\u00f4ng ngh\u1ec7 hi\u1ec7n \u0111\u1ea1i V\u1edbi s\u1ef1 trang b\u1ecb nh\u1eefng c\u00f4ng ngh\u1ec7 hi\u1ec7n \u0111\u1ea1i b\u1eadc nh\u1ea5t th\u1ecb tr\u01b0\u1eddng, b\u1ea1n s\u1ebd nh\u1eadn \u0111\u01b0\u1ee3c nhi\u1ec1u l\u1ee3i \u00edch khi s\u1edf h\u1eefu chi\u1ebfc \u0111i\u1ec1u h\u00f2a Inverter 2 HP RAS-H18E2KCVG-V c\u1ee7a Toshiba: Thay v\u00ec ch\u1ec9 l\u1ecdc b\u1ecf c\u00e1c lo\u1ea1i s\u00e2u b\u1ec7nh, h\u1ec7 th\u1ed1ng s\u1ebd ti\u00eau di\u1ec7t ch\u00fang ho\u00e0n to\u00e0n v\u00e0 ph\u00e2n h\u1ee7y ch\u00fang th\u00e0nh c\u00e1c ch\u1ea5t v\u00f4 h\u1ea1i. Kh\u00f4ng gi\u1ed1ng nh\u01b0 b\u1ed9 l\u1ecdc HEPA v\u00e0 \u0111\u00e8n UV, kh\u00f4ng kh\u00ed kh\u00f4ng ph\u1ea3i \u0111i qua b\u1ed9 l\u1ecdc Plasma Ion v\u00e0 \u0111\u01b0\u1ee3c x\u1eed l\u00fd trong thi\u1ebft b\u1ecb tr\u01b0\u1edbc khi \u0111\u01b0\u1ee3c l\u00e0m s\u1ea1ch, nh\u1edd \u0111\u00f3 m\u00e0 kh\u00f4ng kh\u00ed \u0111\u01b0\u1ee3c l\u01b0u th\u00f4ng li\u00ean t\u1ee5c kh\u1eafp ph\u00f2ng. M\u00e1y l\u1ea1nh c\u00f3 kh\u1ea3 n\u0103ng lo\u1ea1i b\u1ecf \u0111\u00e1ng tin c\u1eady 99,9% vi r\u00fat c\u0169ng nh\u01b0 vi khu\u1ea9n, m\u1ea7m b\u1ec7nh v\u00e0 ch\u1ea5t g\u00e2y d\u1ecb \u1ee9ng nh\u01b0 ph\u1ea5n hoa. Ngay c\u1ea3 m\u00f9i h\u00f4i c\u0169ng \u0111\u01b0\u1ee3c trung h\u00f2a. \u0110i\u1ec1u n\u00e0y l\u00e0m cho thi\u1ebft b\u1ecb tr\u1edf th\u00e0nh gi\u1ea3i ph\u00e1p ho\u00e0n h\u1ea3o cho nhi\u1ec1u \u0111\u1ecba \u0111i\u1ec3m v\u00e0 kh\u00f4ng gian kh\u00e1c nhau. V\u00ec ch\u1ec9 c\u1ea7n \u0111i\u1ec7n \u0111\u1ec3 v\u1ec7 sinh n\u00ean h\u1ec7 th\u1ed1ng kh\u00f4ng c\u1ea7n b\u1ed9 l\u1ecdc hay b\u1ea3o d\u01b0\u1ee1ng th\u01b0\u1eddng xuy\u00ean. Sau khi l\u1eafp \u0111\u1eb7t, h\u1ec7 th\u1ed1ng ho\u1ea1t \u0111\u1ed9ng m\u00e0 kh\u00f4ng c\u1ea7n can thi\u1ec7p th\u00eam. M\u1eb7c d\u00f9 c\u00f3 hi\u1ec7u su\u1ea5t m\u1ea1nh m\u1ebd, nh\u01b0ng m\u00e1y v\u1eabn ho\u1ea1t \u0111\u1ed9ng r\u1ea5t \u00eam, kh\u00f4ng g\u00e2y ti\u1ebfng \u1ed3n, gi\u00fap nh\u00e2n vi\u00ean trong v\u0103n ph\u00f2ng c\u00f3 th\u1ec3 t\u1eadp trung v\u00e0o c\u00f4ng vi\u1ec7c m\u00e0 kh\u00f4ng b\u1ecb ph\u00e2n t\u00e2m. Tham kh\u1ea3o gi\u00e1 c\u1ee7a \u0111i\u1ec1u h\u00f2a Toshiba Inverter 2 HP RAS-H18E2KCVG-V Hi\u1ec7n nay, \u0111i\u1ec1u h\u00f2a Inverter 2 HP RAS-H18E2KCVG-V \u0111ang \u0111\u01b0\u1ee3c b\u00e1n v\u1edbi m\u1ee9c gi\u00e1 h\u1ea5p d\u1eabn t\u1ea1i Ho\u00e0ng H\u00e0 Mobile (m\u1ee9c gi\u00e1 c\u00f3 th\u1ec3 thay \u0111\u1ed5i t\u00f9y v\u00e0o ch\u01b0\u01a1ng tr\u00ecnh \u01b0u \u0111\u00e3i). \u0110\u00e2y l\u00e0 m\u1ee9c gi\u00e1 h\u1ee3p l\u00fd \u0111\u1ec3 s\u1edf h\u1eefu m\u1ed9t chi\u1ebfc \u0111i\u1ec1u h\u00f2a c\u00f3 c\u00f4ng su\u1ea5t \u1ea5n t\u01b0\u1ee3ng, kh\u1ea3 n\u0103ng l\u00e0m l\u1ea1nh nhanh, ti\u1ebft ki\u1ec7m n\u0103ng l\u01b0\u1ee3ng v\u00e0 t\u00edch h\u1ee3p \u0111\u1ea7y \u0111\u1ee7 c\u00e1c c\u00f4ng ngh\u1ec7 \u0111\u1ec3 thanh l\u1ecdc kh\u00f4ng kh\u00ed, l\u00e0m s\u1ea1ch kh\u00f4ng gian s\u1ed1ng c\u1ee7a b\u1ea1n. Mua \u0111i\u1ec1u h\u00f2a Toshiba Inverter 2 HP RAS-H18E2KCVG-V t\u1ea1i Ho\u00e0ng H\u00e0 Mobile v\u1edbi nhi\u1ec1u \u01b0u \u0111\u00e3i Ho\u00e0ng H\u00e0 Mobile h\u1eadn h\u00e0nh l\u00e0 \u0111i\u1ec3m \u0111\u1ebfn c\u1ee7a qu\u00fd kh\u00e1ch h\u00e0ng khi ch\u1ecdn mua c\u00e1c s\u1ea3n ph\u1ea9m \u0111i\u1ec7n m\u00e1y, \u0111i\u1ec7n l\u1ea1nh c\u1ee7a th\u01b0\u01a1ng hi\u1ec7u Toshiba, \u0111\u1eb7c bi\u1ec7t l\u00e0 \u0111i\u1ec1u h\u00f2a kh\u00f4ng kh\u00ed Inverter 2 HP RAS-H18E2KCVG-V. \u0110\u1ec3 mua h\u00e0ng qu\u00fd kh\u00e1ch h\u00e0ng vui l\u00f2ng gh\u00e9 \u0111\u1ebfn chi nh\u00e1nh c\u1ee7a Ho\u00e0ng H\u00e0 Mobile g\u1ea7n m\u00ecnh nh\u1ea5t. Ho\u1eb7c mua s\u1eafm online tr\u00ean trang web hoanghamobile v\u00e0 \u0111\u01b0\u1ee3c mi\u1ec5n ph\u00ed v\u1eadn chuy\u1ec3n giao h\u00e0ng t\u1eadn nh\u00e0. V\u1edbi m\u1ed7i s\u1ea3n ph\u1ea9m mua t\u1ea1i Ho\u00e0ng H\u00e0 Mobile, qu\u00fd kh\u00e1ch h\u00e0ng s\u1ebd \u0111\u01b0\u1ee3c b\u1ea3o \u0111\u1ea3m v\u1ec1 ch\u1ea5t l\u01b0\u1ee3ng v\u00e0 xu\u1ea5t x\u1ee9 c\u1ee7a s\u1ea3n ph\u1ea9m v\u1edbi \u0111\u1ea7y \u0111\u1ee7 c\u00e1c ch\u00ednh s\u00e1ch b\u1ea3o h\u00e0nh ch\u00ednh h\u00e3ng v\u00e0 th\u1eddi gian \u0111\u1ed5i tr\u1ea3 mi\u1ec5n ph\u00ed v\u1edbi c\u00e1c l\u1ed7i t\u1eeb ph\u00eda nh\u00e0 s\u1ea3n xu\u1ea5t. C\u00f9ng v\u1edbi \u0111\u00f3, chu\u1ed7i c\u1eeda h\u00e0ng c\u1ee7a ch\u00fang t\u00f4i c\u0169ng \u0111ang h\u1ed7 tr\u1ee3 kh\u00e1ch h\u00e0ng mua tr\u1ea3 g\u00f3p t\u1eeb 0% c\u00f9ng nhi\u1ec1u \u01b0u \u0111\u00e3i v\u00e0 khuy\u1ebfn m\u00e3i h\u1ea5p d\u1eabn khi mua s\u1eafm tr\u1ef1c ti\u1ebfp ho\u1eb7c online. Nhanh tay mua h\u00e0ng ngay h\u00f4m nay ho\u1eb7c li\u00ean h\u1ec7 1900.2091 \u0111\u1ec3 \u0111\u01b0\u1ee3c t\u01b0 v\u1ea5n c\u00e1c v\u1ea5n \u0111\u1ec1 b\u1ea1n \u0111ang th\u1eafc m\u1eafc ho\u00e0n to\u00e0n mi\u1ec5n ph\u00ed. Xem to\u00e0n b\u1ed9 b\u00e0i vi\u1ebft",
        "promotion_1": "1. Tr\u00fang 8386 qu\u00e0 - T\u1ed5ng gi\u00e1 tr\u1ecb t\u1edbi 250 TRI\u1ec6U \u0110\u1ed2NG (\u00c1p d\u1ee5ng t\u1eeb 10/01 - 02/02/2025). (Xem chi ti\u1ebft). 2. \u0110\u1eb7c bi\u1ec7t Tr\u1ea3 g\u00f3p 3 kh\u00f4ng: 0% l\u00e3i su\u1ea5t - 0 ph\u00ed chuy\u1ec3n \u0111\u1ed5i - 0 tr\u1ea3 tr\u01b0\u1edbc (\u00c1p d\u1ee5ng cho c\u00f4ng ty t\u00e0i ch\u00ednh v\u00e0 th\u1ebb t\u00edn d\u1ee5ng)",
        "promotion_2": "1. Gi\u1ea3m t\u1edbi 500.000\u0111 khi thanh to\u00e1n th\u1ebb t\u00edn d\u1ee5ng NCB. (Xem chi ti\u1ebft). 2. Gi\u1ea3m \u0111\u1ebfn 150.000\u0111 khi thanh to\u00e1n qua Muadee. (Xem chi ti\u1ebft). 3. Mi\u1ec5n ph\u00ed chuy\u1ec3n \u0111\u1ed5i tr\u1ea3 g\u00f3p ho\u1eb7c gi\u1ea3m \u0111\u1ebfn 500.000\u0111 khi m\u1edf th\u1ebb TPBank EVO. (Xem chi ti\u1ebft). 4. M\u1edf th\u1ebb t\u00edn d\u1ee5ng VIB - Nh\u1eadn Voucher 600.000\u0111. (Xem chi ti\u1ebft). 5. M\u1edf th\u1ebb HSBC - Ho\u00e0n ti\u1ec1n t\u1edbi 2 tri\u1ec7u \u0111\u1ed3ng. (Xem chi ti\u1ebft)"
    },
    {
        "title": "\u0110i\u1ec1u h\u00f2a Toshiba Inverter 20.400 BTU (2.5 HP) RAS-H24E2KCVG-V",
        "price": "gi\u00e1 hi\u1ec7n t\u1ea1i l\u00e0 23,650,000 \u20ab nh\u01b0ng tr\u01b0\u1edbc \u0111\u00e2y n\u00f3 c\u00f3 gi\u00e1 l\u00e0 25,890,000 \u20ab",
        "colors": "Tr\u1eafng",
        "technical_specifications": [
            {
                "Lo\u1ea1i m\u00e1y": "1 chi\u1ec1u (ch\u1ec9 l\u00e0m l\u1ea1nh)"
            },
            {
                "C\u00f4ng ngh\u1ec7 inverter": "M\u00e1y l\u1ea1nh Inverter"
            },
            {
                "C\u00f4ng su\u1ea5t l\u00e0m l\u1ea1nh": "2.5 HP - 20.400 BTU"
            },
            {
                "Ph\u1ea1m vi l\u00e0m l\u1ea1nh hi\u1ec7u qu\u1ea3": "T\u1eeb 30 - 40m\u00b2 (t\u1eeb 80 \u0111\u1ebfn 120m\u00b3)"
            },
            {
                "Nh\u00e3n n\u0103ng l\u01b0\u1ee3ng": "5 sao (Hi\u1ec7u su\u1ea5t n\u0103ng l\u01b0\u1ee3ng 6.24)"
            }
        ],
        "description": "\u0110i\u1ec1u h\u00f2a Toshiba Inverter 20.400 BTU (2.5 HP) RAS-H24E2KCVG-V l\u00e0 m\u1ed9t chi\u1ebfc m\u00e1y l\u1ea1nh \u0111\u1ebfn t\u1eeb th\u01b0\u01a1ng hi\u1ec7u Toshiba - m\u1ed9t th\u01b0\u01a1ng hi\u1ec7u \u0111i\u1ec7n m\u00e1y \u0111\u01b0\u1ee3c r\u1ea5t nhi\u1ec1u ng\u01b0\u1eddi d\u00f9ng Vi\u1ec7t \u01b0a chu\u1ed9ng. M\u00e1y l\u1ea1nh c\u00f3 thi\u1ebft k\u1ebf hi\u1ec7n \u0111\u1ea1i v\u1edbi m\u00e0u tr\u1eafng sang tr\u1ecdng, h\u00e0i h\u00f2a v\u1edbi m\u1ecdi kh\u00f4ng gian. C\u00f4ng ngh\u1ec7 tinh l\u1ecdc kh\u00f4ng kh\u00ed Plasma Ion c\u00f9ng c\u00f4ng ngh\u1ec7 di\u1ec7t khu\u1ea9n UltraPure s\u1ebd mang \u0111\u1ebfn cho ng\u00f4i nh\u00e0 c\u1ee7a b\u1ea1n kh\u00f4ng kh\u00ed trong l\u00e0nh v\u00e0 gi\u1ea3m thi\u1ec3u c\u00e1c b\u1ec7nh v\u1ec1 \u0111\u01b0\u1eddng h\u00f4 h\u1ea5p. Ngo\u00e0i ra, s\u1ef1 k\u1ebft h\u1ee3p c\u1ee7a b\u1ed9 l\u1ecdc ch\u1ed1ng n\u1ea5m m\u1ed1c v\u00e0 c\u00f4ng ngh\u1ec7 ch\u1ed1ng b\u00e1m b\u1ea9n Magic Coil \u0111\u1ed9c quy\u1ec1n gi\u00fap gi\u1ea3m thi\u1ec3u t\u00ecnh tr\u1ea1ng b\u1ee5i b\u1ea9n t\u00edch t\u1ee5, ti\u1ebft ki\u1ec7m th\u1eddi gian v\u00e0 chi ph\u00ed b\u1ea3o tr\u00ec, v\u1ec7 sinh m\u00e1y. \u0110\u1eb7c \u0111i\u1ec3m n\u1ed5i b\u1eadt Thi\u1ebft k\u1ebf nh\u1ecf g\u1ecdn v\u1edbi c\u00f4ng su\u1ea5t l\u1edbn 2.5 HP - 20.400 BTU v\u00e0 c\u00f4ng ngh\u1ec7 l\u00e0m l\u1ea1nh nhanh Hi Power. Kh\u1ea3 n\u0103ng thanh l\u1ecdc kh\u00f4ng kh\u00ed t\u1ed1i \u01b0u v\u1edbi c\u00f4ng ngh\u1ec7 tinh l\u1ecdc kh\u00f4ng kh\u00ed Plasma Ion v\u00e0 c\u00f4ng ngh\u1ec7 di\u1ec7t khu\u1ea9n UltraPure. D\u1ec5 d\u00e0ng l\u00e0m s\u1ea1ch v\u1edbi t\u00ednh n\u0103ng t\u1ef1 \u0111\u1ed9ng l\u00e0m s\u1ea1ch c\u00f9ng c\u00f4ng ngh\u1ec7 \u0111\u1ed9c quy\u1ec1n Magic Coil ch\u1ed1ng b\u00e1m b\u1ea9n c\u1ee7a d\u00e0n l\u1ea1nh. Si\u00eau ti\u1ebft ki\u1ec7m \u0111i\u1ec7n v\u1edbi c\u00f4ng ngh\u1ec7 Hybrid Inverter v\u00e0 Eco. B\u1ea3o v\u1ec7 l\u00e0n da c\u1ee7a ng\u01b0\u1eddi th\u00e2n trong gia \u0111\u00ecnh khi s\u1eed d\u1ee5ng ch\u1ebf \u0111\u1ed9 Hada Care. Th\u00f4ng s\u1ed1 chi ti\u1ebft c\u1ee7a \u0111i\u1ec1u h\u00f2a Toshiba Inverter 20.400 BTU (2.5 HP) RAS-H24E2KCVG-V Th\u00f4ng s\u1ed1 Chi ti\u1ebft Lo\u1ea1i m\u00e1y 1 chi\u1ec1u (ch\u1ec9 l\u00e0m l\u1ea1nh) C\u00f4ng su\u1ea5t l\u00e0m l\u1ea1nh 2.5 HP - 20.400 BTU Ph\u1ea1m vi l\u00e0m l\u1ea1nh hi\u1ec7u qu\u1ea3 T\u1eeb 30 - 40m2 (t\u1eeb 80 \u0111\u1ebfn 120m3) K\u00edch th\u01b0\u1edbc v\u00e0 tr\u1ecdng l\u01b0\u1ee3ng d\u00e0n l\u1ea1nh D\u00e0i 105 cm - Cao 32 cm - D\u00e0y 25 cm N\u1eb7ng 14 kg K\u00edch th\u01b0\u1edbc v\u00e0 tr\u1ecdng l\u01b0\u1ee3ng d\u00e0n n\u00f3ng D\u00e0i 78 cm - Cao 55 cm - D\u00e0y 29 cm N\u1eb7ng 33 kg \u0110\u1ed9 \u1ed3n trung b\u00ecnh 35/38/40/43/45 dB Lo\u1ea1i gas R-32 Ti\u00eau th\u1ee5 \u0111i\u1ec7n 1.85 kW/h C\u00f4ng ngh\u1ec7 ti\u1ebft ki\u1ec7m \u0111i\u1ec7n Hybrid Inverter Eco Kh\u1ea3 n\u0103ng l\u1ecdc b\u1ee5i, kh\u00e1ng khu\u1ea9n, kh\u1eed m\u00f9i C\u00f4ng ngh\u1ec7 tinh l\u1ecdc kh\u00f4ng kh\u00ed Plasma Ion C\u00f4ng ngh\u1ec7 ch\u1ed1ng b\u00e1m b\u1ea9n Magic Coil B\u1ed9 l\u1ecdc ch\u1ed1ng n\u1ea5m m\u1ed1c C\u00f4ng ngh\u1ec7 di\u1ec7t khu\u1ea9n UltraPure Ch\u1ebf \u0111\u1ed9 gi\u00f3 \u0110i\u1ec1u khi\u1ec3n l\u00ean xu\u1ed1ng t\u1ef1 \u0111\u1ed9ng C\u00f4ng ngh\u1ec7 l\u00e0m l\u1ea1nh nhanh Hi Power Ti\u1ec7n \u00edch T\u1ef1 kh\u1edfi \u0111\u1ed9ng l\u1ea1i khi c\u00f3 \u0111i\u1ec7n Lu\u1ed3ng gi\u00f3 th\u1ed5i d\u1ec5 ch\u1ecbu b\u1ea3o v\u1ec7 da Hada Care Ch\u1ee9c n\u0103ng ng\u1ee7 d\u1ec5 ch\u1ecbu Comfort Sleep T\u1ea1o ion l\u1ecdc kh\u00f4ng kh\u00ed Ghi nh\u1edb ch\u1ebf \u0111\u1ed9 l\u00e0m l\u1ea1nh \u01b0a th\u00edch Ho\u1ea1t \u0111\u1ed9ng si\u00eau \u00eam Quiet Ch\u1ee9c n\u0103ng h\u00fat \u1ea9m H\u1eb9n gi\u1edd b\u1eadt t\u1eaft m\u00e1y Ch\u1ebf \u0111\u1ed9 ch\u1ec9 s\u1eed d\u1ee5ng qu\u1ea1t Fan Only - ch\u1ec9 l\u00e0m m\u00e1t, kh\u00f4ng l\u00e0m l\u1ea1nh Ch\u1ee9c n\u0103ng t\u1ef1 l\u00e0m s\u1ea1ch D\u00f2ng \u0111i\u1ec7n v\u00e0o D\u00e0n l\u1ea1nh D\u00f2ng \u0111i\u1ec7n ho\u1ea1t \u0111\u1ed9ng 1 pha S\u1ed1 l\u01b0\u1ee3ng k\u1ebft n\u1ed1i d\u00e0n l\u1ea1nh t\u1ed1i \u0111a 1 \u0110\u00e1nh gi\u00e1 chi ti\u1ebft \u0111i\u1ec1u h\u00f2a Toshiba Inverter 20.400 BTU (2.5 HP) RAS-H24E2KCVG-V S\u1edf h\u1eefu Inverter 2.5 HP RAS-H24E2KCVG-V c\u1ee7a Toshiba l\u00e0 b\u1ea1n \u0111ang s\u1edf h\u1eefu m\u1ed9t chi\u1ebfc \u0111i\u1ec1u h\u00f2a c\u00f3 thi\u1ebft sang tr\u1ecdng, hi\u1ec7n \u0111\u1ea1i \u0111i c\u00f9ng v\u1edbi c\u00f4ng su\u1ea5t ho\u1ea1t \u0111\u1ed9ng l\u1edbn \u0111\u00e1ng \u1ea5n t\u01b0\u1ee3ng v\u00e0 t\u00edch h\u1ee3p nhi\u1ec1u c\u00f4ng ngh\u1ec7 cao c\u1ea5p \u0111\u1ec3 b\u1ea3o v\u1ec7 t\u1ed1t nh\u1ea5t m\u00f4i tr\u01b0\u1eddng s\u1ed1ng c\u1ee7a gia \u0111\u00ecnh b\u1ea1n. Thi\u1ebft k\u1ebf \u1ea5n t\u01b0\u1ee3ng hi\u1ec7n \u0111\u1ea1i v\u00e0 sang tr\u1ecdng \u0110i\u1ec3m \u1ea5n t\u01b0\u1ee3ng \u0111\u1ea7u ti\u00ean c\u1ee7a chi\u1ebfc \u0111i\u1ec1u h\u00f2a Toshiba n\u00e0y ch\u00ednh l\u00e0 k\u00edch th\u01b0\u1edbc, b\u1edfi m\u00e1y l\u1ea1nh c\u00f3 c\u00f4ng su\u1ea5t l\u1edbn \u0111\u1ebfn 2.5 HP - 20.400 BTU nh\u01b0ng l\u1ea1i c\u00f3 thi\u1ebft k\u1ebf t\u01b0\u01a1ng \u0111\u1ed1i nh\u1ecf g\u1ecdn. D\u00e0n l\u1ea1nh c\u00f3 k\u00edch th\u01b0\u1edbc \u0111\u1ed9 d \u00e0i 105 cm - cao 32 cm - d\u00e0y 25 cm v\u00e0 n\u1eb7ng 14 kg c\u00f9ng d\u00e0n n\u00f3ng c\u00f3 k\u00edch th\u01b0\u1edbc \u0111\u1ed9 d\u00e0i 78 cm - cao 55 cm - d\u00e0y 29 cm v\u00e0 n\u1eb7ng 33 kg . V\u1edbi thi\u1ebft k\u1ebf nguy\u00ean kh\u1ed1i, \u0111i\u1ec1u h\u00f2a kh\u00f4ng t\u1ea1o c\u1ea3m gi\u00e1c th\u00f4 khi treo l\u00ean t\u01b0\u1eddng, m\u00e0 c\u00f2n r\u1ea5t tinh t\u1ebf v\u1edbi \u0111\u01b0\u1eddng n\u00e9t thi\u1ebft k\u1ebf quen thu\u1ed9c c\u1ee7a th\u01b0\u01a1ng hi\u1ec7u Toshiba. M\u00e1y tr\u00f4ng s\u1ebd c\u1ee9ng c\u00e1p h\u01a1n v\u1edbi c\u00e1c \u0111\u01b0\u1eddng n\u00e9t vu\u00f4ng v\u1ee9c k\u1ebft h\u1ee3p v\u1edbi tone m\u00e0u tr\u1eafng s\u1eefa gi\u00fap chi\u1ebfc \u0111i\u1ec1u h\u00f2a n\u00e0y d\u1ec5 h\u00e0i h\u00f2a v\u1edbi m\u1ecdi thi\u1ebft k\u1ebf n\u1ed9i th\u1ea5t trong kh\u00f4ng gian c\u0103n ph\u00f2ng c\u1ee7a b\u1ea1n. D\u00e0n n\u00f3ng l\u00e0 b\u1ed9 ph\u1eadn ngo\u00e0i tr\u1eddi c\u00f3 thi\u1ebft k\u1ebf ch\u1eafc ch\u1eafn v\u1edbi v\u1ecf ngo\u00e0i v\u00e0 ch\u00e2n \u0111\u1ebf ph\u00f9 h\u1ee3p \u0111\u1ec3 l\u1eafp \u0111\u1eb7t \u1edf ngo\u00e0i tr\u1eddi v\u1edbi kh\u1ea3 n\u0103ng ch\u1ed1ng ch\u1ecbu t\u1ed1t v\u1edbi c\u00e1c \u0111i\u1ec1u ki\u1ec7n th\u1eddi ti\u1ebft kh\u1eafc nghi\u1ec7t kh\u00e1c nhau. Kh\u1ea3 n\u0103ng t\u00f9y ch\u1ec9nh c\u00e1nh \u0111\u1ea3o gi\u00f3 v\u00e0 c\u00f4ng ngh\u1ec7 Hada Care C\u00e1nh \u0111\u1ea3o l\u00ean xu\u1ed1ng c\u1ee7a m\u00e1y l\u1ea1nh Inverter 2.5 HP RAS-H24E2KCVG-V c\u1ee7a Toshiba c\u00f3 th\u1ec3 \u0111i\u1ec1u ch\u1ec9nh t\u1ef1 \u0111\u1ed9ng b\u1eb1ng remote, ng\u01b0\u1eddi d\u00f9ng c\u0169ng c\u00f3 th\u1ec3 ch\u1ecdn g\u00f3c \u0111\u1ed9 th\u00f4i \u0111\u00fang v\u1edbi \u00fd mu\u1ed1n th\u00f4ng qua Remote. C\u00f2n v\u1edbi c\u00e1nh \u0111\u1ea3o tr\u00e1i ph\u1ea3i ch\u1ec9 c\u00f3 th\u1ec3 ch\u1ec9nh b\u1eb1ng tay. C\u00f4ng ngh\u1ec7 Hada Care c\u0169ng \u0111\u01b0\u1ee3c Toshiba t\u1ef1 h\u00e0o gi\u1edbi thi\u1ec7u v\u1edbi kh\u1ea3 n\u0103ng lan t\u1ecfa h\u01a1i l\u1ea1nh m\u1ed9t c\u00e1ch \u0111\u1ed3ng \u0111\u1ec1u, tr\u00e1nh cho h\u01a1i l\u1ea1nh th\u1ed5i tr\u1ef1c ti\u1ebfp v\u00e0o ng\u01b0\u1eddi d\u00f9ng v\u00e0 tr\u00e1nh g\u00e2y ra c\u00e1c hi\u1ec7n t\u01b0\u1ee3ng kh\u00f4 da, mang l\u1ea1i c\u1ea3m gi\u00e1c d\u1ec5 ch\u1ecbu trong qu\u00e1 tr\u00ecnh s\u1eed d\u1ee5ng. \u0110\u1ea7y \u0111\u1ee7 c\u00e1c t\u00ednh n\u0103ng ho\u1ea1t \u0111\u1ed9ng c\u1ee7a m\u00e1y l\u1ea1nh Toshiba Inverter 20.400 BTU (2.5 HP) RAS-H24E2KCVG-V M\u00e1y l\u1ea1nh c\u00f3 \u0111\u1ea7y \u0111\u1ee7 c\u00e1c t\u00ednh n\u0103ng bao g\u1ed3m t\u1ef1 \u0111\u1ed9ng - l\u00e0m kh\u00f4 - l\u00e0m m\u00e1t v\u00e0 ch\u1ec9 qu\u1ea1t . T\u00f9y v\u00e0o nhu c\u1ea7u s\u1eed d\u1ee5ng c\u1ee7a m\u00ecnh, ng\u01b0\u1eddi d\u00f9ng c\u00f3 th\u1ec3 l\u1ef1a ch\u1ecdn \u0111i\u1ec1u khi\u1ec3n c\u00e1c ch\u1ebf \u0111\u1ed9 n\u00f3i tr\u00ean d\u1ec5 d\u00e0ng tr\u00ean remote. M\u00e1y c\u00f2n \u0111\u01b0\u1ee3c trang b\u1ecb c\u00f4ng ngh\u1ec7 l\u00e0m l\u1ea1nh nhanh Hi Power gi\u00fap kh\u00f4ng kh\u00ed c\u00f3 th\u1ec3 \u0111\u01b0\u1ee3c l\u00e0m m\u00e1t nhanh ch\u00f3ng h\u01a1n. V\u00e0 khi nhi\u1ec7t \u0111\u1ed9 \u0111\u00e3 \u0111\u1ea1t \u0111\u1ebfn m\u1ee9c m\u00e0 ng\u01b0\u1eddi d\u00f9ng mong mu\u1ed1n th\u00ec c\u00f3 th\u1ec3 \u0111i\u1ec1u ch\u1ec9nh qua ch\u1ebf \u0111\u1ed9 Eco \u0111\u1ec3 l\u00e0m m\u00e1t d\u1ec5 ch\u1ecbu v\u00e0 ti\u1ebft ki\u1ec7m \u0111i\u1ec7n \u0111\u1ebfn 25%, \u0111\u1ed3ng th\u1eddi \u0111\u00e2y c\u0169ng l\u00e0 m\u1ed9t ch\u1ebf \u0111\u1ed9 th\u00e2n thi\u1ec7n v\u1edbi m\u00f4i tr\u01b0\u1eddng. N\u00f3i th\u00eam v\u1ec1 c\u00f4ng ngh\u1ec7 ti\u1ebft ki\u1ec7m \u0111i\u1ec7n, ch\u1eafc ch\u1eafn kh\u00f4ng th\u1ec3 b\u1ecf qua c\u00f4ng ngh\u1ec7 Hybrid Inverter gi\u00fap m\u00e1y v\u1eadn h\u00e0nh \u00eam \u00e1i v\u00e0 ti\u1ebft ki\u1ec7m \u0111i\u1ec7n t\u1ed1i \u0111a l\u00ean \u0111\u1ebfn 60% \u0111i\u1ec7n n\u0103ng ti\u00eau th\u1ee5. M\u00e1y l\u1ea1nh Toshiba Inverter 20.400 BTU (2.5 HP) RAS-H24E2KCVG-V c\u00f3 kh\u1ea3 n\u0103ng lo\u1ea1i b\u1ecf c\u00e1c h\u1ea1t b\u1ee5i nh\u1ecf nh\u1ea5t v\u1edbi Plasma Ion \u0110i\u1ec1u h\u00f2a c\u1ee7a Toshiba \u0111\u01b0\u1ee3c trang b\u1ecb b\u1ed9 l\u1ecdc ch\u1ed1ng th\u1ea5m n\u01b0\u1edbc k\u1ebft h\u1ee3p v\u1edbi c\u00f4ng ngh\u1ec7 tinh l\u1ecdc kh\u00f4ng kh\u00ed Plasma Ion . B\u1ed9 l\u1ecdc Plasma Ion s\u1ebd h\u1ea5p th\u1ee5 v\u00e0 trung h\u00f2a c\u00e1c h\u1ea1t c\u00f3 k\u00edch th\u01b0\u1edbc nh\u1ecf h\u01a1n 0.001 \u03bcm nh\u01b0 b\u1ee5i m\u1ecbn, ph\u1ea5n hoa, b\u00e0o t\u1eed n\u1ea5m m\u1ed1c v\u00e0 virus \u0111\u1ed3ng th\u1eddi t\u1ea1o ra c\u00e1c ion b\u1ea1c v\u1edbi kh\u1ea3 n\u0103ng kh\u00e1ng khu\u1ea9n m\u1ea1nh. Toshiba cho bi\u1ebft c\u00f4ng ngh\u1ec7 Plasma Ion m\u1ea1nh m\u1ebd c\u1ee7a h\u1ecd c\u00f3 kh\u1ea3 n\u0103ng t\u0103ng t\u1ed1c hi\u1ec7u qu\u1ea3 khi thu gi\u1eef c\u00e1c t\u1ea1p ch\u1ea5t l\u01a1 l\u1eedng trong kh\u00f4ng kh\u00ed b\u1eb1ng c\u00e1ch t\u1ea1o ra ozone (O3). Khi c\u00e1c ch\u1ea5t g\u00e2y \u00f4 nhi\u1ec5m nh\u01b0 vi khu\u1ea9n ho\u1eb7c virus ti\u1ebfp x\u00fac v\u1edbi ozone, cu\u1ed1i c\u00f9ng ch\u00fang s\u1ebd b\u1ecb v\u00f4 hi\u1ec7u h\u00f3a th\u00f4ng qua qu\u00e1 tr\u00ecnh oxy h\u00f3a. Sau \u0111\u00f3, ozone v\u1ec1 c\u01a1 b\u1ea3n tr\u1edf l\u1ea1i th\u00e0nh oxy (O2), khi\u1ebfn n\u00f3 tr\u1edf th\u00e0nh ch\u1ea5t oxy h\u00f3a r\u1ea5t th\u00e2n thi\u1ec7n v\u1edbi m\u00f4i tr\u01b0\u1eddng. K\u1ebft qu\u1ea3 l\u00e0 m\u1ed9t m\u00f4i tr\u01b0\u1eddng s\u1ea1ch s\u1ebd, trong l\u00e0nh v\u00e0 l\u00e0nh m\u1ea1nh, gi\u00e0u c\u00e1c ph\u00e2n t\u1eed oxy, kh\u00f4ng c\u00f3 b\u1ea5t k\u1ef3 m\u00f9i h\u00f4i n\u00e0o. H\u1ec7 th\u1ed1ng l\u1ecdc \u0111i\u1ec7n hi\u1ec7u qu\u1ea3 n\u00e0y c\u00f3 th\u1ec3 \u0111\u01b0\u1ee3c k\u00edch ho\u1ea1t ch\u1ec9 b\u1eb1ng m\u1ed9t n\u00fat b\u1ea5m v\u00e0 ho\u1ea1t \u0111\u1ed9ng theo ba giai \u0111o\u1ea1n: B\u1ed9 s\u1ea1c ion b\u1ed5 sung \u0111i\u1ec7n t\u00edch d\u01b0\u01a1ng cho c\u00e1c t\u1ea1p ch\u1ea5t trong kh\u00f4ng kh\u00ed trong ph\u00f2ng \u0111\u01b0\u1ee3c h\u00fat v\u00e0o sau b\u1ed9 l\u1ecdc b\u1ee5i. C\u00e1c ion t\u00edch \u0111i\u1ec7n \u00e2m trong b\u1ed9 thu s\u1ebd thu h\u00fat c\u00e1c ch\u1ea5t \u00f4 nhi\u1ec5m t\u00edch \u0111i\u1ec7n d\u01b0\u01a1ng l\u1edbn h\u01a1n. C\u00e1c h\u1ea1t c\u00f2n l\u1ea1i \u0111\u01b0\u1ee3c thu th\u1eadp th\u00f4ng qua \u0111i\u1ec7n t\u00edch d\u01b0\u01a1ng trong b\u1ed9 thu th\u1ee9 hai. Cu\u1ed1i c\u00f9ng, c\u00e1c h\u1ea1t trung h\u00f2a \u0111\u01b0\u1ee3c h\u1ea5p th\u1ee5 tr\u00ean b\u1ed9 trao \u0111\u1ed5i nhi\u1ec7t \u0111\u01b0\u1ee3c ph\u1ee7 m\u1ed9t l\u1edbp \u0111\u1eb7c bi\u1ec7t \u0111\u01b0\u1ee3c d\u1eabn \u0111i c\u00f9ng v\u1edbi qu\u00e1 tr\u00ecnh ng\u01b0ng t\u1ee5. M\u1ed9t l\u01b0u \u00fd l\u00e0 b\u1ea3n th\u00e2n b\u1ed9 l\u1ecdc Plasma Ion c\u0169ng c\u1ea7n \u0111\u01b0\u1ee3c v\u1ec7 sinh: Sau kho\u1ea3ng 1000 gi\u1edd ho\u1ea1t \u0111\u1ed9ng, c\u1ea7n th\u00e1o b\u1ed9 l\u1ecdc ra kh\u1ecfi thi\u1ebft b\u1ecb \u0111\u00e3 t\u1eaft v\u00e0 kh\u00f4ng c\u00f3 d\u00f2ng \u0111i\u1ec7n r\u1ed3i v\u1ec7 sinh b\u1eb1ng n\u01b0\u1edbc n\u00f3ng. M\u00e1y l\u1ea1nh Toshiba Inverter 20.400 BTU (2.5 HP) RAS-H24E2KCVG-V di\u1ec7t khu\u1ea9n t\u1ed1t h\u01a1n v\u1edbi c\u00f4ng ngh\u1ec7 UltraPure M\u00e1y l\u1ea1nh Inverter 2.5 HP RAS-H24E2KCVG-V c\u00f2n c\u00f3 kh\u1ea3 n\u0103ng cung c\u1ea5p b\u1ea7u kh\u00f4ng kh\u00ed s\u1ea1ch, kh\u00f4ng b\u1ee5i, kh\u00f4ng m\u00f9i, kh\u00f4ng vi sinh v\u1eadt v\u00e0 c\u00e1c h\u1ea1t m\u1ecbn nh\u1edd s\u1ef1 trang b\u1ecb b\u1ed9 l\u1ecdc UltraPure c\u00f3 kh\u1ea3 n\u0103ng l\u1ecdc s\u1ea1ch t\u1edbi 94% PM2.5. PM2.5 l\u00e0 c\u00e1c h\u1ea1t v\u1eadt ch\u1ea5t t\u1eeb \u200b\u200b\u00f4 nhi\u1ec5m kh\u00ed quy\u1ec3n c\u00f3 \u0111\u01b0\u1eddng k\u00ednh nh\u1ecf h\u01a1n 2.5 micromet (\u03bcm). C\u00e1c nghi\u00ean c\u1ee9u \u0111\u00e3 t\u00ecm th\u1ea5y m\u1ed1i li\u00ean h\u1ec7 ch\u1eb7t ch\u1ebd gi\u1eefa vi\u1ec7c ti\u1ebfp x\u00fac v\u1edbi c\u00e1c h\u1ea1t m\u1ecbn v\u00e0 b\u1ec7nh ph\u1ed5i ho\u1eb7c l\u00e0m tr\u1ea7m tr\u1ecdng th\u00eam b\u1ec7nh m\u00e3n t\u00ednh. B\u1ed9 l\u1ecdc Toshiba UltraPure thu \u0111\u01b0\u1ee3c t\u1edbi 94% PM2.5, t\u1ea1o ra kh\u00f4ng gian s\u1ed1ng l\u00e0nh m\u1ea1nh t\u1ea1i nh\u00e0. D\u00e0n l\u1ea1nh \u0111\u01b0\u1ee3c trang b\u1ecb c\u00f4ng ngh\u1ec7 ch\u1ed1ng b\u00e1m b\u1ea9n Magic Coil B\u1ec1 m\u1eb7t d\u00e0n l\u1ea1nh \u0111\u00e3 \u0111\u01b0\u1ee3c gia c\u00f4ng \u0111\u1eb7c bi\u1ec7t \u0111\u1ec3 gi\u1ea3m \u0111\u1ed9 ma s\u00e1t t\u1ed1i \u0111a. Trong qu\u00e1 tr\u00ecnh ho\u1ea1t \u0111\u1ed9ng, b\u1ee5i b\u1ea9n c\u00f3 xu h\u01b0\u1edbng b\u00e1m l\u00ean tr\u00ean b\u1ec1 m\u1eb7t c\u1ee7a d\u00e0n l\u1ea1nh, m\u00e0 nhi\u1ec7t \u0111\u1ed9 c\u1ee7a gi\u00e0n l\u1ea1nh l\u1ea1i l\u00fd t\u01b0\u1edfng \u0111\u1ec3 ng\u01b0ng t\u1ee5 h\u01a1i n\u01b0\u1edbc. Khi n\u01b0\u1edbc ng\u01b0ng t\u1ee5 th\u00e0nh gi\u1ecdt v\u00e0 ch\u1ea3y xu\u1ed1ng s\u1ebd cu\u1ed1n theo t\u1ea5t c\u1ea3 b\u1ee5i b\u1ea9n b\u00e1m \u1edf tr\u00ean \u0111\u00f3. T\u1eeb \u0111\u00f3, thi\u1ebft b\u1ecb gi\u00fap cho ho\u1ea1t \u0111\u1ed9ng c\u1ee7a m\u00e1y l\u1ea1nh Inverter 2.5 HP RAS-H24E2KCVG-V \u1ed5n \u0111\u1ecbnh v\u00e0 l\u00e2u d\u00e0i h\u01a1n. \u0110\u1ed3ng th\u1eddi c\u0169ng gi\u00fap h\u1ea1n ch\u1ebf c\u00e1c b\u1ec7nh v\u1ec1 \u0111\u01b0\u1eddng h\u00f4 h\u1ea5p \u0111\u1ed1i v\u1edbi ng\u01b0\u1eddi d\u00f9ng. \u0110i\u1ec1u h\u00f2a Toshiba Inverter 20.400 BTU (2.5 HP) RAS-H24E2KCVG-V c\u00f3 kh\u1ea3 n\u0103ng t\u1ef1 l\u00e0m s\u1ea1ch Qu\u1ea1t c\u1ee7a \u0111i\u1ec1u h\u00f2a v\u1eabn ti\u1ebfp t\u1ee5c ch\u1ea1y trong v\u00e0i ph\u00fat sau khi qu\u00e1 tr\u00ecnh v\u1eadn h\u00e0nh k\u1ebft th\u00fac, \u0111\u1ec3 l\u00e0m kh\u00f4 b\u1ed9 trao \u0111\u1ed5i nhi\u1ec7t trong d\u00e0n l\u1ea1nh. \u0110i\u1ec1u n\u00e0y gi\u00fap lo\u1ea1i b\u1ecf m\u00f9i kh\u00f3 ch\u1ecbu. \u0110\u1ed3ng th\u1eddi m\u00e1y c\u0169ng g\u00e2y \u1ea5n t\u01b0\u1ee3ng v\u1edbi ch\u1ee9c n\u0103ng v\u1ec7 sinh b\u1ed5 sung - g\u1ea7n nh\u01b0 th\u1ee5 \u0111\u1ed9ng: C\u00e1c l\u1edbp ph\u1ee7 \u0111\u1eb7c bi\u1ec7t tr\u00ean c\u00e1c c\u00e1nh t\u1ea3n nhi\u1ec7t gi\u00fap d\u1ec5 d\u00e0ng r\u1eeda s\u1ea1ch c\u00e1c ch\u1ea5t g\u00e2y \u00f4 nhi\u1ec5m c\u1ee9ng \u0111\u1ea7u \u0111\u01b0\u1ee3c l\u1ecdc ra kh\u1ecfi kh\u00f4ng kh\u00ed b\u1eb1ng c\u00e1ch ng\u01b0ng t\u1ee5 t\u1ea1o ra trong ch\u1ebf \u0111\u1ed9 l\u00e0m m\u00e1t - m\u1ed9t gi\u1ea3i ph\u00e1p th\u00f4ng minh v\u00e0 h\u1ee3p v\u1ec7 sinh. Tham kh\u1ea3o gi\u00e1 c\u1ee7a \u0111i\u1ec1u h\u00f2a Toshiba Inverter 20.400 BTU (2.5 HP) RAS-H24E2KCVG-V \u0110\u00e2y l\u00e0 m\u1ed9t chi\u1ebfc m\u00e1y l\u1ea1nh c\u00f3 c\u00f4ng su\u1ea5t l\u1edbn l\u00ean t\u1edbi 2.5 Hp v\u00e0 c\u00f3 thi\u1ebft k\u1ebf nh\u1ecf g\u1ecdn ch\u1ec9n chu, hi\u1ec7n c\u00f3 m\u1ee9c gi\u00e1 \u01b0u \u0111\u00e3i t\u1ea1i Ho\u00e0ng H\u00e0 Mobile. Chi\u1ebfc m\u00e1y l\u1ea1nh n\u00e0y ph\u00f9 h\u1ee3p v\u1edbi c\u00e1c kh\u00f4ng gian ph\u00f2ng kh\u00e1ch l\u1edbn v\u00e0 c\u0169ng r\u1ea5t ph\u00f9 h\u1ee3p \u0111\u1ec3 l\u1eafp \u0111\u1eb7t t\u1ea1i c\u00e1c \u0111\u1ecba \u0111i\u1ec3m kinh doanh m\u00e0 kh\u00f4ng chi\u1ebfm nhi\u1ec1u di\u1ec7n t\u00edch t\u01b0\u1eddng v\u1edbi d\u00e0n l\u1ea1nh \u0111\u01b0\u1ee3c gia c\u00f4ng \u0111\u1eb7c bi\u1ec7t, h\u1ea1n ch\u1ebf ch\u1ed1ng b\u00e1m b\u1ea9n. Mua m\u00e1y l\u1ea1nh Toshiba Inverter 20.400 BTU (2.5 HP) RAS-H24E2KCVG-V ch\u00ednh h\u00e3ng t\u1ea1i Ho\u00e0ng H\u00e0 Mobile T\u1ea1i th\u1ecb tr\u01b0\u1eddng Vi\u1ec7t Nam, Ho\u00e0ng H\u00e0 Mobile h\u1eadn h\u00e0nh l\u00e0 \u0111\u01a1n v\u1ecb chuy\u00ean ph\u00e2n ph\u1ed1i v\u00e0 b\u00e1n l\u1ebb c\u00e1c s\u1ea3n ph\u1ea9m \u0111i\u1ec7n t\u1eed, \u0111i\u1ec7n l\u1ea1nh ch\u00ednh h\u00e3ng t\u1eeb Toshiba v\u00e0 \u0111\u01b0\u1ee3c \u0111\u00f4ng \u0111\u1ea3o ng\u01b0\u1eddi d\u00f9ng tin t\u01b0\u1edfng l\u1ef1a ch\u1ecdn. Mua c\u00e1c s\u1ea3n ph\u1ea9m m\u00e1y l\u1ea1nh, \u0111i\u1ec1u h\u00f2a kh\u00f4ng kh\u00ed,\u2026 t\u1ea1i Ho\u00e0ng H\u00e0 Mobile, kh\u00e1ch h\u00e0ng s\u1ebd nh\u1eadn \u0111\u01b0\u1ee3c nh\u1eefng t\u01b0 v\u1ea5n t\u1eadn t\u00ecnh v\u00e0 chuy\u00ean nghi\u1ec7p nh\u1ea5t. C\u00f9ng v\u1edbi \u0111\u00f3 l\u00e0 ch\u00ednh s\u00e1ch gi\u00e1 ph\u00f9 h\u1ee3p, ch\u00ednh s\u00e1ch b\u1ea3o h\u00e0nh ch\u00ednh h\u00e3ng v\u00e0 ch\u00ednh s\u00e1ch \u0111\u1ed5i tr\u1ea3 \u0111\u1ea3m b\u1ea3o ch\u1ea5t l\u01b0\u1ee3ng. C\u00f9ng v\u1edbi \u0111\u00f3, \u0111\u01a1n v\u1ecb b\u00e1n h\u00e0ng c\u1ee7a ch\u00fang t\u00f4i c\u0169ng th\u01b0\u1eddng xuy\u00ean tri\u1ec3n khai c\u00e1c ho\u1ea1t \u0111\u1ed9ng khuy\u1ebfn m\u00e3i v\u00e0 qu\u00e0 t\u1eb7ng tri \u00e2n kh\u00e1ch h\u00e0ng v\u00f4 c\u00f9ng h\u1ea5p d\u1eabn. Nhanh tay \u0111\u1eb7t h\u00e0ng ngay h\u00f4m nay \u0111\u1ec3 kh\u00f4ng b\u1ecf l\u1ee1 nh\u1eefng \u01b0u \u0111\u00e3i hi\u1ec7n c\u00f3 th\u00f4ng qua hotline 1900 2091 ho\u1eb7c website b\u00e1n h\u00e0ng tr\u1ef1c tuy\u1ebfn! Xem to\u00e0n b\u1ed9 b\u00e0i vi\u1ebft",
        "promotion_1": "1. Tr\u00fang 8386 qu\u00e0 - T\u1ed5ng gi\u00e1 tr\u1ecb t\u1edbi 250 TRI\u1ec6U \u0110\u1ed2NG (\u00c1p d\u1ee5ng t\u1eeb 10/01 - 02/02/2025). (Xem chi ti\u1ebft). 2. \u0110\u1eb7c bi\u1ec7t Tr\u1ea3 g\u00f3p 3 kh\u00f4ng: 0% l\u00e3i su\u1ea5t - 0 ph\u00ed chuy\u1ec3n \u0111\u1ed5i - 0 tr\u1ea3 tr\u01b0\u1edbc (\u00c1p d\u1ee5ng cho c\u00f4ng ty t\u00e0i ch\u00ednh v\u00e0 th\u1ebb t\u00edn d\u1ee5ng)",
        "promotion_2": "1. Gi\u1ea3m t\u1edbi 500.000\u0111 khi thanh to\u00e1n th\u1ebb t\u00edn d\u1ee5ng NCB. (Xem chi ti\u1ebft). 2. Gi\u1ea3m \u0111\u1ebfn 150.000\u0111 khi thanh to\u00e1n qua Muadee. (Xem chi ti\u1ebft). 3. Mi\u1ec5n ph\u00ed chuy\u1ec3n \u0111\u1ed5i tr\u1ea3 g\u00f3p ho\u1eb7c gi\u1ea3m \u0111\u1ebfn 500.000\u0111 khi m\u1edf th\u1ebb TPBank EVO. (Xem chi ti\u1ebft). 4. M\u1edf th\u1ebb t\u00edn d\u1ee5ng VIB - Nh\u1eadn Voucher 600.000\u0111. (Xem chi ti\u1ebft). 5. M\u1edf th\u1ebb HSBC - Ho\u00e0n ti\u1ec1n t\u1edbi 2 tri\u1ec7u \u0111\u1ed3ng. (Xem chi ti\u1ebft)"
    }
]