[
    {
        "title": "\u0110i\u1ec1u h\u00f2a Comfee Inverter 9.500 BTU (1 HP) CFS-10VDGF-V",
        "price": "gi\u00e1 hi\u1ec7n t\u1ea1i l\u00e0 6,070,000 \u20ab nh\u01b0ng tr\u01b0\u1edbc \u0111\u00e2y n\u00f3 c\u00f3 gi\u00e1 l\u00e0 7,390,000 \u20ab",
        "colors": "Tr\u1eafng",
        "technical_specifications": [
            {
                "Lo\u1ea1i m\u00e1y": "1 chi\u1ec1u (ch\u1ec9 l\u00e0m l\u1ea1nh)"
            },
            {
                "C\u00f4ng ngh\u1ec7 inverter": "M\u00e1y l\u1ea1nh Inverter"
            },
            {
                "C\u00f4ng su\u1ea5t l\u00e0m l\u1ea1nh": "1 HP - 9.500 BTU"
            },
            {
                "Ph\u1ea1m vi l\u00e0m l\u1ea1nh hi\u1ec7u qu\u1ea3": "D\u01b0\u1edbi 15m\u00b2 (t\u1eeb 30 \u0111\u1ebfn 45m\u00b3)"
            },
            {
                "Nh\u00e3n n\u0103ng l\u01b0\u1ee3ng": "5 sao (Hi\u1ec7u su\u1ea5t n\u0103ng l\u01b0\u1ee3ng 4.37)"
            }
        ],
        "description": "\u0110i\u1ec1u h\u00f2a Comfee Inverter 9.500 BTU (1 HP) CFS-10VDGF-V l\u00e0 s\u1ea3n ph\u1ea9m thu\u1ed9c d\u00f2ng m\u00e1y l\u1ea1nh 1 chi\u1ec1u, \u0111\u01b0\u1ee3c trang b\u1ecb c\u00f4ng ngh\u1ec7 Inverter v\u00e0 b\u1ed9 vi x\u1eed l\u00fd E-Max gi\u00fap ti\u1ebft ki\u1ec7m \u0111i\u1ec7n n\u0103ng t\u1ed1i \u01b0u. S\u1ea3n ph\u1ea9m \u0111\u01b0\u1ee3c t\u00edch h\u1ee3p m\u00e0ng l\u1ecdc k\u00e9p Dual v\u1edbi kh\u1ea3 n\u0103ng l\u1ecdc b\u1ee5i v\u00e0 kh\u00e1ng khu\u1ea9n t\u1ed1t, mang l\u1ea1i s\u1ef1 trong l\u00e0nh v\u00e0 s\u1ea1ch s\u1ebd cho b\u1ea7u kh\u00f4ng kh\u00ed. Ngo\u00e0i ra, s\u1ea3n ph\u1ea9m c\u00f2n \u0111\u01b0\u1ee3c trang b\u1ecb nh\u1eefng t\u00ednh n\u0103ng v\u00e0 c\u00f4ng ngh\u1ec7 hi\u1ec7n \u0111\u1ea1i h\u00e0ng \u0111\u1ea7u nh\u01b0 ch\u1ebf \u0111\u1ed9 l\u00e0m l\u1ea1nh Hyper Tech , t\u00ednh n\u0103ng Follow Me ,... kh\u00f4ng nh\u1eefng l\u00e0m m\u00e1t hi\u1ec7u qu\u1ea3 m\u00e0 \u0111\u1ed3ng th\u1eddi c\u00f2n b\u1ea3o v\u1ec7 s\u1ee9c kh\u1ecfe c\u1ee7a ng\u01b0\u1eddi d\u00f9ng. \u0110\u00e2y ch\u1eafc ch\u1eafn s\u1ebd l\u00e0 s\u1ef1 l\u1ef1a ch\u1ecdn s\u00e1ng gi\u00e1 d\u00e0nh cho nh\u1eefng c\u0103n ph\u00f2ng c\u00f3 di\u1ec7n t\u00edch nh\u1ecf v\u00e0 v\u1eeba, t\u1ea1o ra m\u1ed9t kh\u00f4ng gian s\u1ed1ng trong l\u00e0nh v\u00e0 tho\u1ea3i m\u00e1i. \u0110\u1eb7c \u0111i\u1ec3m n\u1ed5i b\u1eadt C\u00f4ng su\u1ea5t ho\u1ea1t \u0111\u1ed9ng 1 HP cho hi\u1ec7u qu\u1ea3 l\u00e0m m\u00e1t t\u1ed1i \u01b0u trong nh\u1eefng kh\u00f4ng gian d\u01b0\u1edbi 15m2. C\u00f4ng ngh\u1ec7 Inverter k\u1ebft h\u1ee3p v\u1edbi b\u1ed9 vi x\u1eed l\u00fd E-Max gi\u00fap ti\u1ebft ki\u1ec7m \u0111i\u1ec7n hi\u1ec7u qu\u1ea3, \u0111\u1ea3m b\u1ea3o qu\u00e1 tr\u00ecnh v\u1eadn h\u00e0nh b\u1ec1n b\u1ec9 v\u00e0 \u00eam \u00e1i. C\u00f4ng ngh\u1ec7 m\u00e0ng l\u1ecdc k\u00e9p Dual gi\u00fap thanh l\u1ecdc kh\u00f4ng kh\u00ed v\u00e0 kh\u1eed khu\u1ea9n, b\u1ea3o v\u1ec7 s\u1ee9c kh\u1ecfe \u0111\u01b0\u1eddng h\u00f4 h\u1ea5p. L\u00e0m l\u1ea1nh si\u00eau t\u1ed1c trong th\u1eddi gian ng\u1eafn v\u1edbi c\u00f4ng ngh\u1ec7 Hyper Tech. \u0110i\u1ec1u khi\u1ec3n b\u1eb1ng gi\u1ecdng n\u00f3i ti\u1ec7n l\u1ee3i th\u00f4ng qua c\u00f4ng ngh\u1ec7 AI Cool. B\u1ea3ng th\u00f4ng s\u1ed1 k\u1ef9 thu\u1eadt c\u1ee7a m\u00e1y l\u1ea1nh Comfee Inverter 9.500 BTU (1 HP) CFS-10VDGF-V Th\u00f4ng s\u1ed1 Chi ti\u1ebft Lo\u1ea1i m\u00e1y 1 chi\u1ec1u (ch\u1ec9 l\u00e0m l\u1ea1nh) C\u00f4ng su\u1ea5t l\u00e0m l\u1ea1nh 1 HP - 9.500 BTU Ph\u1ea1m vi l\u00e0m l\u1ea1nh hi\u1ec7u qu\u1ea3 D\u01b0\u1edbi 15m2 (t\u1eeb 30 \u0111\u1ebfn 45m3) K\u00edch th\u01b0\u1edbc v\u00e0 tr\u1ecdng l\u01b0\u1ee3ng d\u00e0n l\u1ea1nh D\u00e0i 72.6 cm - Cao 29.1 cm - D\u00e0y 21 cm N\u1eb7ng 8.2 kg K\u00edch th\u01b0\u1edbc v\u00e0 tr\u1ecdng l\u01b0\u1ee3ng d\u00e0n n\u00f3ng D\u00e0i 79.5 cm - Cao 49.5 cm - D\u00e0y 26 cm N\u1eb7ng 21.7 kg \u0110\u1ed9 \u1ed3n trung b\u00ecnh 40.5/34/32 dB Lo\u1ea1i gas R-32 Ti\u00eau th\u1ee5 \u0111i\u1ec7n 0.745 kW/h C\u00f4ng ngh\u1ec7 ti\u1ebft ki\u1ec7m \u0111i\u1ec7n Eco Bi\u1ebfn t\u1ea7n Inverter v\u1edbi b\u1ed9 vi x\u1eed l\u00fd E-Max Kh\u1ea3 n\u0103ng l\u1ecdc b\u1ee5i, kh\u00e1ng khu\u1ea9n, kh\u1eed m\u00f9i M\u00e0ng l\u1ecdc k\u00e9p Dual: L\u1ecdc b\u1ee5i 0.7mm, l\u1ecdc m\u00f9i Ch\u1ebf \u0111\u1ed9 gi\u00f3 \u0110i\u1ec1u khi\u1ec3n l\u00ean xu\u1ed1ng t\u1ef1 \u0111\u1ed9ng, tr\u00e1i ph\u1ea3i t\u00f9y ch\u1ec9nh tay C\u00f4ng ngh\u1ec7 l\u00e0m l\u1ea1nh nhanh Hyper Tech Ti\u1ec7n \u00edch T\u1ef1 kh\u1edfi \u0111\u1ed9ng l\u1ea1i khi c\u00f3 \u0111i\u1ec7n Remote c\u00f3 \u0111\u00e8n LED Follow Me - ch\u1ee9c n\u0103ng c\u00e0i \u0111\u1eb7t nhi\u1ec7t \u0111\u1ed9 t\u1ea1i v\u1ecb tr\u00ed remote Ch\u1ee9c n\u0103ng t\u1ef1 ch\u1ea9n \u0111o\u00e1n l\u1ed7i Ch\u1ebf \u0111\u1ed9 t\u1ef1 l\u00e0m s\u1ea1ch Active-Clean Ch\u1ebf \u0111\u1ed9 ti\u1ebft ki\u1ec7m ch\u1ee7 \u0111\u1ed9ng Gear Mode Ch\u1ebf \u0111\u1ed9 ng\u1ee7 \u0111\u00eam Sleep cho ng\u01b0\u1eddi gi\u00e0, tr\u1ebb nh\u1ecf M\u00e0n h\u00ecnh hi\u1ec3n th\u1ecb nhi\u1ec7t \u0111\u1ed9 tr\u00ean d\u00e0n l\u1ea1nh Ch\u1ee9c n\u0103ng h\u00fat \u1ea9m H\u1eb9n gi\u1edd b\u1eadt/t\u1eaft m\u00e1y Ch\u1ebf \u0111\u1ed9 ch\u1ec9 s\u1eed d\u1ee5ng qu\u1ea1t Fan Only - ch\u1ec9 l\u00e0m m\u00e1t, kh\u00f4ng l\u00e0m l\u1ea1nh C\u00f4ng ngh\u1ec7 AI Cool - \u0111i\u1ec1u khi\u1ec3n thi\u1ebft b\u1ecb b\u1eb1ng smartphone Ch\u1ebf \u0111\u1ed9 Avoid Me (Breeze Away) D\u00f2ng \u0111i\u1ec7n v\u00e0o D\u00e0n l\u1ea1nh D\u00f2ng \u0111i\u1ec7n ho\u1ea1t \u0111\u1ed9ng 1 pha S\u1ed1 l\u01b0\u1ee3ng k\u1ebft n\u1ed1i d\u00e0n l\u1ea1nh t\u1ed1i \u0111a 1 \u0110\u00e1nh gi\u00e1 chi ti\u1ebft s\u1ea3n ph\u1ea9m \u0111i\u1ec1u h\u00f2a Comfee Inverter 9.500 BTU (1 HP) CFS-10VDGF-V M\u00e1y l\u1ea1nh Comfee CFS-10VDGF-V l\u00e0 m\u1ed9t trong nh\u1eefng s\u1ea3n ph\u1ea9m m\u00e1y l\u1ea1nh cao c\u1ea5p c\u1ee7a th\u01b0\u01a1ng hi\u1ec7u Comfee, \u0111\u01b0\u1ee3c thi\u1ebft k\u1ebf nh\u1eb1m mang l\u1ea1i kh\u00f4ng gian s\u1ed1ng m\u00e1t m\u1ebb, d\u1ec5 ch\u1ecbu c\u0169ng nh\u01b0 \u0111\u1ea3m b\u1ea3o an to\u00e0n cho s\u1ee9c kh\u1ecfe c\u1ee7a ng\u01b0\u1eddi d\u00f9ng. V\u1edbi h\u00e0ng lo\u1ea1t c\u00e1c t\u00ednh n\u0103ng hi\u1ec7n \u0111\u1ea1i h\u00e0ng \u0111\u1ea7u, s\u1ea3n ph\u1ea9m kh\u00f4ng ch\u1ec9 \u0111\u00e1p \u1ee9ng t\u1ed1t nhu c\u1ea7u l\u00e0m m\u00e1t m\u00e0 c\u00f2n g\u00f3p ph\u1ea7n t\u1ea1o ra m\u1ed9t m\u00f4i tr\u01b0\u1eddng s\u1ed1ng tho\u1ea3i m\u00e1i, trong l\u00e0nh cho m\u1ecdi th\u00e0nh vi\u00ean trong gia \u0111\u00ecnh. Ki\u1ec3u d\u00e1ng t\u1ed1i gi\u1ea3n ph\u00f9 h\u1ee3p v\u1edbi m\u1ecdi kh\u00f4ng gian v\u00e0 phong c\u00e1ch n\u1ed9i th\u1ea5t V\u1edbi phong c\u00e1ch thi\u1ebft k\u1ebf t\u1ed1i gi\u1ea3n, s\u1eed d\u1ee5ng t\u00f4ng m\u00e0u tr\u1eafng l\u00e0m ch\u1ee7 \u0111\u1ea1o, m\u00e1y l\u1ea1nh Comfee Inverter 9.500 BTU (1 HP) CFS-10VDGF-V ph\u00f9 h\u1ee3p \u0111\u1ec3 l\u1eafp \u0111\u1eb7t trong nhi\u1ec1u kh\u00f4ng gian n\u1ed9i th\u1ea5t kh\u00e1c nhau. S\u1ea3n ph\u1ea9m \u0111\u01b0\u1ee3c ho\u00e0n thi\u1ec7n v\u1edbi nh\u1eefng \u0111\u01b0\u1eddng n\u00e9t kh\u00e1 tinh t\u1ebf nh\u01b0ng v\u1eabn mang l\u1ea1i c\u1ea3m gi\u00e1c hi\u1ec7n \u0111\u1ea1i, th\u1eddi th\u01b0\u1ee3ng cho kh\u00f4ng gian ph\u00f2ng. V\u1edbi c\u00f4ng su\u1ea5t ho\u1ea1t \u0111\u1ed9ng 1 HP, chi\u1ebfc \u0111i\u1ec1u h\u00f2a c\u1ee7a Comfee s\u1ebd mang l\u1ea1i hi\u1ec7u qu\u1ea3 l\u00e0m m\u00e1t t\u1ed1i \u01b0u nh\u1ea5t cho nh\u1eefng c\u0103n ph\u00f2ng nh\u1ecf d\u01b0\u1edbi 15m2 nh\u01b0 ph\u00f2ng l\u00e0m vi\u1ec7c c\u00e1 nh\u00e2n, ph\u00f2ng ng\u1ee7,.... Ph\u1ea7n van \u0111i\u1ec1u ti\u1ebft v\u00e0 c\u00e1nh qu\u1ea1t t\u1ea3n nhi\u1ec7t c\u1ee7a d\u00e0n n\u00f3ng tr\u00ean \u0111i\u1ec1u h\u00f2a Comfee CFS-10VWGF-V \u0111\u00e3 \u0111\u01b0\u1ee3c c\u1ea3i ti\u1ebfn \u0111\u1ec3 n\u00e2ng cao hi\u1ec7u qu\u1ea3 ti\u1ebft ki\u1ec7m \u0111i\u1ec7n l\u00ean \u0111\u1ebfn 30%. \u0110\u00e2y c\u0169ng l\u00e0 m\u1ee5c ti\u00eau m\u00e0 th\u01b0\u01a1ng hi\u1ec7u Comfee mu\u1ed1n h\u01b0\u1edbng \u0111\u1ebfn tr\u00ean t\u1ea5t c\u1ea3 c\u00e1c s\u1ea3n ph\u1ea9m \u0111i\u1ec1u h\u00f2a c\u1ee7a m\u00ecnh, \u0111\u00f3 l\u00e0 gi\u1ea3m ti\u00eau hao \u0111i\u1ec7n n\u0103ng v\u00e0 b\u1ea3o v\u1ec7 m\u00f4i tr\u01b0\u1eddng. To\u00e0n b\u1ed9 h\u1ec7 th\u1ed1ng l\u00e1 nh\u00f4m t\u1ea3n nhi\u1ec7t tr\u00ean d\u00e0n n\u00f3ng v\u00e0 d\u00e0n l\u1ea1nh \u0111\u1ec1u \u0111\u01b0\u1ee3c bao b\u1ecdc b\u1eb1ng m\u1ed9t l\u1edbp ph\u1ee7 Golden Coating nh\u1eb1m h\u1ea1n ch\u1ebf t\u1ed1i \u0111a qu\u00e1 tr\u00ecnh oxy h\u00f3a tr\u01b0\u1edbc nh\u1eefng t\u00e1c \u0111\u1ed9ng c\u1ee7a m\u00f4i tr\u01b0\u1eddng b\u00ean ngo\u00e0i. V\u1edbi l\u1edbp ph\u1ee7 cao c\u1ea5p n\u00e0y, thi\u1ebft b\u1ecb s\u1ebd \u0111\u01b0\u1ee3c b\u1ea3o v\u1ec7 v\u00e0 s\u1eb5n s\u00e0ng ch\u1ed1ng ch\u1ecdi tr\u01b0\u1edbc m\u1ecdi \u0111i\u1ec1u ki\u1ec7n kh\u1eafc nghi\u1ec7t c\u1ee7a m\u00f4i tr\u01b0\u1eddng, \u0111\u1ea3m b\u1ea3o lu\u00f4n ho\u1ea1t \u0111\u1ed9ng b\u1ec1n b\u1ec9 theo th\u1eddi gian. Kh\u1ea3 n\u0103ng ti\u1ebft ki\u1ec7m \u0111i\u1ec7n c\u1ee7a \u0111i\u1ec1u h\u00f2a Comfee Inverter 9.500 BTU (1 HP) CFS-10VDGF-V T\u01b0\u01a1ng t\u1ef1 nh\u01b0 \u0111a s\u1ed1 c\u00e1c s\u1ea3n ph\u1ea9m \u0111i\u1ec1u h\u00f2a kh\u00f4ng kh\u00ed hi\u1ec7n nay, \u0111i\u1ec1u h\u00f2a Comfee CFS-10VDGF-V s\u1eed d\u1ee5ng c\u00f4ng ngh\u1ec7 Inverter v\u1edbi m\u00e1y n\u00e9n ho\u1ea1t \u0111\u1ed9ng li\u00ean t\u1ee5c \u1edf t\u1ed1c \u0111\u1ed9 12Hz c\u1ef1c th\u1ea5p, gi\u00fap thi\u1ebft b\u1ecb v\u1eadn h\u00e0nh \u00eam \u00e1i, b\u1ec1n b\u1ec9 v\u00e0 gi\u1ea3m hao ph\u00ed \u0111i\u1ec7n n\u0103ng \u0111\u1ebfn 16 l\u1ea7n so v\u1edbi nh\u1eefng d\u00f2ng s\u1ea3n ph\u1ea9m ti\u1ec1n nhi\u1ec7m. B\u00ean c\u1ea1nh \u0111\u00f3 kh\u00f4ng th\u1ec3 kh\u00f4ng nh\u1eafc \u0111\u1ebfn ch\u1ebf \u0111\u1ed9 Eco gi\u00fap thi\u1ebft b\u1ecb ho\u1ea1t \u0111\u1ed9ng v\u1edbi m\u1ee9c ti\u00eau th\u1ee5 \u0111i\u1ec7n n\u0103ng si\u00eau ti\u1ebft ki\u1ec7m. Khi ho\u1ea1t \u0111\u1ed9ng \u1edf ch\u1ebf \u0111\u1ed9 n\u00e0y, thi\u1ebft b\u1ecb c\u00f3 th\u1ec3 ti\u1ebft ki\u1ec7m \u0111\u1ebfn 71% \u0111i\u1ec7n n\u0103ng ti\u00eau th\u1ee5 so v\u1edbi nh\u1eefng s\u1ea3n ph\u1ea9m \u0111i\u1ec1u h\u00f2a th\u00f4ng th\u01b0\u1eddng m\u00e0 v\u1eabn \u0111\u1ea3m b\u1ea3o mang \u0111\u1ebfn s\u1ef1 m\u00e1t m\u1ebb, tho\u1ea3i m\u00e1i cho ng\u01b0\u1eddi d\u00f9ng. Gi\u1edd \u0111\u00e2y, ng\u01b0\u1eddi d\u00f9ng s\u1ebd kh\u00f4ng c\u00f2n ph\u1ea3i lo l\u1eafng v\u1ec1 g\u00e1nh n\u1eb7ng chi ph\u00ed ti\u1ec1n \u0111i\u1ec7n m\u1ed7i th\u00e1ng n\u1eefa. Ngo\u00e0i ra, chi\u1ebfc m\u00e1y l\u1ea1nh Comfee n\u00e0y c\u00f2n cho ph\u00e9p ng\u01b0\u1eddi d\u00f9ng l\u1ef1a ch\u1ecdn 3 m\u1ee9c c\u00f4ng su\u1ea5t ho\u1ea1t \u0111\u1ed9ng: 50%, 70% v\u00e0 100%. T\u00f9y theo nhu c\u1ea7u v\u00e0 m\u1ee5c \u0111\u00edch s\u1eed d\u1ee5ng, ng\u01b0\u1eddi d\u00f9ng c\u00f3 th\u1ec3 ch\u1ee7 \u0111\u1ed9ng \u0111i\u1ec1u ch\u1ec9nh m\u1ee9c c\u00f4ng su\u1ea5t sao cho ph\u00f9 h\u1ee3p, tr\u00e1nh l\u00e3ng ph\u00ed \u0111i\u1ec7n n\u0103ng. Tr\u1ea3i nghi\u1ec7m s\u1eed d\u1ee5ng ti\u1ec7n l\u1ee3i v\u1edbi t\u00ednh n\u0103ng \u0111i\u1ec1u khi\u1ec3n b\u1eb1ng gi\u1ecdng n\u00f3i AI Cool M\u00e1y l\u1ea1nh Comfee Inverter 9.500 BTU (1 HP) CFS-10VDGF-V \u0111\u01b0\u1ee3c trang b\u1ecb kh\u1ea3 n\u0103ng k\u1ebft n\u1ed1i Wi-Fi. Th\u00f4ng qua \u1ee9ng d\u1ee5ng SmartHome, ng\u01b0\u1eddi d\u00f9ng c\u00f3 th\u1ec3 \u0111i\u1ec1u khi\u1ec3n thi\u1ebft b\u1ecb t\u1eeb xa b\u1eb1ng \u0111i\u1ec7n tho\u1ea1i th\u00f4ng minh ho\u1eb7c \u0111i\u1ec1u khi\u1ec3n b\u1eb1ng gi\u1ecdng n\u00f3i v\u1edbi t\u00ednh n\u0103ng AI Cool ti\u1ec7n l\u1ee3i. T\u00ednh n\u0103ng \u0111i\u1ec1u khi\u1ec3n b\u1eb1ng gi\u1ecdng n\u00f3i mang l\u1ea1i nh\u1eefng tr\u1ea3i nghi\u1ec7m s\u1eed d\u1ee5ng c\u1ef1c k\u1ef3 h\u1eefu \u00edch, \u0111\u1eb7c bi\u1ec7t l\u00e0 khi ng\u01b0\u1eddi d\u00f9ng kh\u00f4ng r\u1ea3nh tay, ch\u1ec9 c\u1ea7n \u0111\u1ecdc c\u00e1c c\u00e2u l\u1ec7nh l\u00e0 \u0111\u00e3 c\u00f3 th\u1ec3 \u0111i\u1ec1u khi\u1ec3n m\u1ecdi t\u00ednh n\u0103ng tr\u00ean thi\u1ebft b\u1ecb. Trong khi \u0111\u00f3, t\u00ednh n\u0103ng \u0111i\u1ec1u khi\u1ec3n t\u1eeb xa b\u1eb1ng smartphone s\u1ebd gi\u00fap ng\u01b0\u1eddi d\u00f9ng ch\u1ee7 \u0111\u1ed9ng \u0111i\u1ec1u khi\u1ec3n thi\u1ebft b\u1ecb \u1edf b\u1ea5t c\u1ee9 \u0111\u00e2u m\u00e0 kh\u00f4ng c\u1ea7n \u0111\u1ebfn remote. V\u1edbi t\u00ednh n\u0103ng n\u00e0y, ng\u01b0\u1eddi d\u00f9ng c\u00f3 th\u1ec3 t\u1eaft \u0111i\u1ec1u h\u00f2a khi \u0111\u00e3 ra kh\u1ecfi nh\u00e0 khi ch\u1eb3ng may qu\u00ean m\u1ea5t, ho\u1eb7c b\u1eadt m\u00e1y l\u1ea1nh tr\u01b0\u1edbc khi v\u1ec1 nh\u00e0 \u0111\u1ec3 ngay l\u1eadp t\u1ee9c t\u1eadn h\u01b0\u1edfng s\u1ef1 m\u00e1t m\u1ebb, d\u1ec5 ch\u1ecbu khi v\u1eeba b\u01b0\u1edbc v\u00e0o ph\u00f2ng. Ch\u1ebf \u0111\u1ed9 l\u00e0m l\u1ea1nh nhanh Hyper Tech \u0111em l\u1ea1i c\u1ea3m gi\u00e1c m\u00e1t l\u1ea1nh t\u1ee9c th\u00ec Khi k\u00edch ho\u1ea1t ch\u1ebf \u0111\u1ed9 n\u00e0y, m\u00e1y n\u00e9n s\u1ebd ngay l\u1eadp t\u1ee9c chuy\u1ec3n sang c\u01a1 ch\u1ebf ho\u1ea1t \u0111\u1ed9ng v\u1edbi hi\u1ec7u su\u1ea5t cao, gi\u00fap thi\u1ebft b\u1ecb nhanh ch\u00f3ng \u0111\u1ea1t \u0111\u1ebfn m\u1ee9c nhi\u1ec7t m\u00e0 ng\u01b0\u1eddi d\u00f9ng mong mu\u1ed1n. Ch\u1ec9 sau 40 gi\u00e2y m\u1edf m\u00e1y, nhi\u1ec7t \u0111\u1ed9 c\u1ee7a d\u00e0n l\u1ea1nh \u0111\u00e3 c\u00f3 th\u1ec3 \u0111\u1ea1t \u0111\u1ebfn m\u1ee9c 23 \u0111\u1ed9 C. Trong nh\u1eefng ng\u00e0y th\u1eddi ti\u1ebft n\u00f3ng b\u1ee9c, ng\u01b0\u1eddi d\u00f9ng c\u00f3 th\u1ec3 t\u1eadn h\u01b0\u1edfng kh\u00f4ng gian m\u00e1t m\u1ebb, th\u01b0 gi\u00e3n m\u00e0 kh\u00f4ng c\u1ea7n ph\u1ea3i ch\u1edd \u0111\u1ee3i qu\u00e1 l\u00e2u. \u0110i\u1ec1u h\u00f2a Comfee Inverter 9.500 BTU (1 HP) CFS-10VDGF-V c\u00f3 kh\u1ea3 n\u0103ng kh\u00e1ng khu\u1ea9n v\u00e0 thanh l\u1ecdc kh\u00f4ng kh\u00ed M\u00e1y l\u1ea1nh Comfee CFS-10VDGF-V \u0111\u01b0\u1ee3c trang b\u1ecb b\u1ed9 l\u1ecdc k\u00e9p Dual Filtration c\u00f3 kh\u1ea3 n\u0103ng thanh l\u1ecdc kh\u00f4ng kh\u00ed v\u00e0 kh\u00e1ng khu\u1ea9n t\u1ed1i \u01b0u. Kh\u00f4ng kh\u00ed t\u1eeb b\u00ean ngo\u00e0i khi \u0111i qua m\u00e0ng l\u1ecdc s\u1ebd \u0111\u01b0\u1ee3c lo\u1ea1i b\u1ecf g\u1ea7n nh\u01b0 ho\u00e0n to\u00e0n c\u00e1c h\u1ea1t b\u1ee5i c\u00f3 k\u00edch th\u01b0\u1edbc t\u1eeb 0.7 - 0.75 mm. Ti\u1ebfp \u0111\u00f3, kh\u00f4ng kh\u00ed s\u1ebd \u0111i qua l\u1edbp l\u1ecdc kh\u1eed m\u00f9i than ho\u1ea1t t\u00ednh, c\u00f3 kh\u1ea3 n\u0103ng h\u1ea5p th\u1ee5 v\u00e0 ph\u00e2n h\u1ee7y c\u00e1c ch\u1ea5t \u0111\u1ed9c trong kh\u00f4ng kh\u00ed nh\u01b0 formaldehyde, benzen v\u00e0 amoniac, g\u00f3p ph\u1ea7n gi\u1ea3m thi\u1ec3u nguy c\u01a1 g\u00e2y d\u1ecb \u1ee9ng. \u0110i\u1ec1u n\u00e0y s\u1ebd gi\u00fap ph\u00f2ng ng\u1eeba nh\u1eefng c\u0103n b\u1ec7nh v\u1ec1 \u0111\u01b0\u1eddng h\u00f4 h\u1ea5p, ng\u01b0\u1eddi d\u00f9ng c\u00f3 th\u1ec3 y\u00ean t\u00e2m h\u00edt th\u1edf b\u1ea7u kh\u00f4ng kh\u00ed s\u1ea1ch s\u1ebd v\u00e0 trong l\u00e0nh m\u1ed7i ng\u00e0y. M\u00e1y l\u1ea1nh Comfee Inverter 9.500 BTU (1 HP) CFS-10VDGF-V t\u1ed1i \u01b0u \u0111i\u1ec7n n\u0103ng ti\u00eau th\u1ee5 v\u1edbi b\u1ed9 vi x\u1eed l\u00fd E-Max Comfee Inverter 1 HP CFS-10VDGF-V \u0111\u01b0\u1ee3c trang b\u1ecb b\u1ed9 vi x\u1eed l\u00fd E-Max hi\u1ec7n \u0111\u1ea1i, \u0111\u1ea3m b\u1ea3o s\u1ef1 \u1ed5n \u0111\u1ecbnh c\u1ee7a m\u00e1y n\u00e9n trong qu\u00e1 tr\u00ecnh v\u1eadn h\u00e0nh. Ch\u00ednh s\u1ef1 \u1ed5n \u0111\u1ecbnh n\u00e0y s\u1ebd gi\u00fap thi\u1ebft b\u1ecb ti\u00eau hao \u00edt nhi\u00ean li\u1ec7u h\u01a1n trong qu\u00e1 tr\u00ecnh ho\u1ea1t \u0111\u1ed9ng, v\u1eadn h\u00e0nh \u00eam \u00e1i v\u00e0 b\u1ec1n b\u1ec9 h\u01a1n g\u1ea5p 16 l\u1ea7n so v\u1edbi c\u00e1c lo\u1ea1i m\u00e1y l\u1ea1nh th\u00f4ng th\u01b0\u1eddng. D\u00e3y \u0111i\u1ec7n \u00e1p r\u1ed9ng duy tr\u00ec ho\u1ea1t \u0111\u1ed9ng \u1ed5n \u0111\u1ecbnh \u0110\u1ed1i v\u1edbi nh\u1eefng gia \u0111\u00ecnh s\u1ed1ng trong nh\u1eefng khu v\u1ef1c c\u00f3 \u0111i\u1ec7n \u00e1p kh\u00f4ng \u1ed5n \u0111\u1ecbnh th\u00ec m\u00e1y l\u1ea1nh Comfee Inverter 9.500 BTU (1 HP) CFS-10VDGF-V s\u1ebd l\u00e0 m\u1ed9t s\u1ef1 l\u1ef1a ch\u1ecdn c\u1ef1c k\u1ef3 l\u00fd t\u01b0\u1edfng. S\u1ea3n ph\u1ea9m \u0111\u01b0\u1ee3c trang b\u1ecb bo m\u1ea1ch ngu\u1ed3n (PCB) c\u1ea3i ti\u1ebfn, c\u00f3 kh\u1ea3 n\u0103ng t\u01b0\u01a1ng th\u00edch v\u1edbi nhi\u1ec1u m\u1ee9c \u0111i\u1ec7n \u00e1p kh\u00e1c nhau, dao \u0111\u1ed9ng t\u1eeb 150 - 260V. Nh\u1edd \u0111\u00f3, thi\u1ebft b\u1ecb v\u1eabn c\u00f3 th\u1ec3 duy tr\u00ec ho\u1ea1t \u0111\u1ed9ng \u1ed5n \u0111\u1ecbnh m\u00e0 kh\u00f4ng c\u1ea7n trang b\u1ecb \u1ed5n \u00e1p ri\u00eang. M\u00e1y l\u1ea1nh Comfee Inverter 9.500 BTU (1 HP) CFS-10VDGF-V c\u00f3 kh\u1ea3 n\u0103ng t\u1ef1 \u0111\u1ed9ng l\u00e0m s\u1ea1ch V\u1edbi t\u00ednh n\u0103ng t\u1ef1 \u0111\u1ed9ng l\u00e0m s\u1ea1ch Active Clean, d\u00e0n l\u1ea1nh c\u1ee7a thi\u1ebft b\u1ecb s\u1ebd lu\u00f4n gi\u1eef \u0111\u01b0\u1ee3c s\u1ef1 kh\u00f4 tho\u00e1ng, s\u1ea1ch s\u1ebd \u0111\u1ec3 th\u1ed5i ra lu\u1ed3ng kh\u00ed trong l\u00e0nh, tinh khi\u1ebft. C\u1ee5 th\u1ec3, c\u00f4ng ngh\u1ec7 n\u00e0y s\u1eed d\u1ee5ng h\u01a1i n\u01b0\u1edbc ng\u01b0ng t\u1ee5 t\u1ea1i d\u00e0n l\u1ea1nh \u0111\u1ec3 \u0111\u00f3ng b\u0103ng c\u00e1c lo\u1ea1i n\u1ea5m m\u1ed1c, b\u1ee5i b\u1ea9n t\u00edch t\u1ee5 l\u00e2u ng\u00e0y tr\u00ean b\u1ec1 m\u1eb7t d\u00e0n t\u1ea3n nhi\u1ec7t. Ti\u1ebfp theo, thi\u1ebft b\u1ecb s\u1ebd t\u0103ng nhi\u1ec7t \u0111\u1ed9 \u0111\u1ed9t ng\u1ed9t \u0111\u1ec3 l\u00e0m tan b\u0103ng, cu\u1ed1n tr\u00f4i nh\u1eefng ch\u1ea5t b\u1ea9n theo d\u00f2ng n\u01b0\u1edbc, sau \u0111\u00f3 th\u1ef1c hi\u1ec7n s\u1ea5y kh\u00f4 \u0111\u1ec3 tr\u1ea3 l\u1ea1i s\u1ef1 s\u1ea1ch s\u1ebd nh\u01b0 l\u00fac ban \u0111\u1ea7u. Nh\u1eefng t\u00ednh n\u0103ng ti\u1ec7n \u00edch kh\u00e1c c\u1ee7a \u0111i\u1ec1u h\u00f2a Comfee Inverter 9.500 BTU (1 HP) CFS-10VDGF-V Chi\u1ebfc m\u00e1y l\u1ea1nh CFS-10VDGF-V c\u1ee7a Comfee \u0111\u01b0\u1ee3c t\u00edch h\u1ee3p r\u1ea5t nhi\u1ec1u t\u00ednh n\u0103ng ti\u1ec7n \u00edch v\u00e0 th\u00f4ng minh, mang \u0111\u1ebfn cho ng\u01b0\u1eddi d\u00f9ng nh\u1eefng ph\u00fat gi\u00e2y th\u01b0 gi\u00e3n v\u00e0 nh\u1eefng tr\u1ea3i nghi\u1ec7m s\u1eed d\u1ee5ng tr\u1ecdn v\u1eb9n nh\u1ea5t. Ch\u1ebf \u0111\u1ed9 Breeze Away (Avoid Me) : Ch\u1ebf \u0111\u1ed9 n\u00e0y cho ph\u00e9p ng\u01b0\u1eddi d\u00f9ng t\u00f9y ch\u1ec9nh h\u01b0\u1edbng gi\u00f3, tr\u00e1nh lu\u1ed3ng kh\u00ed l\u1ea1nh th\u1ed5i tr\u1ef1c ti\u1ebfp v\u00e0o c\u01a1 th\u1ec3 g\u00e2y \u1ea3nh h\u01b0\u1edfng \u0111\u1ebfn s\u1ee9c kh\u1ecfe. Ch\u1ebf \u0111\u1ed9 h\u00fat \u1ea9m : T\u00ednh n\u0103ng n\u00e0y gi\u00fap gi\u1ea3m \u0111\u1ed9 \u1ea9m trong kh\u00f4ng kh\u00ed trong nh\u1eefng ng\u00e0y th\u1eddi ti\u1ebft \u1ea9m \u01b0\u1edbt, mang \u0111\u1ebfn s\u1ef1 kh\u00f4 r\u00e1o v\u00e0 tho\u00e1ng \u0111\u00e3ng. T\u00ednh n\u0103ng h\u1eb9n gi\u1edd b\u1eadt/t\u1eaft : Mang l\u1ea1i s\u1ef1 thu\u1eadn ti\u1ec7n trong qu\u00e1 tr\u00ecnh s\u1eed d\u1ee5ng, gi\u00fap ng\u01b0\u1eddi d\u00f9ng d\u1ec5 d\u00e0ng qu\u1ea3n l\u00fd th\u1eddi gian ho\u1ea1t \u0111\u1ed9ng c\u1ee7a thi\u1ebft b\u1ecb m\u1ed9t c\u00e1ch hi\u1ec7u qu\u1ea3. Ch\u1ebf \u0111\u1ed9 Sleep : \u1ede ch\u1ebf \u0111\u1ed9 n\u00e0y, thi\u1ebft b\u1ecb s\u1ebd v\u1eadn h\u00e0nh \u00eam \u00e1i v\u1edbi \u0111\u1ed9 \u1ed3n c\u1ef1c th\u1ea5p (ch\u1ec9 20dB), kh\u00f4ng l\u00e0m phi\u1ec1n \u0111\u1ebfn gi\u1ea5c ng\u1ee7 c\u1ee7a ng\u01b0\u1eddi d\u00f9ng. T\u1ef1 ch\u1ea9n \u0111o\u00e1n l\u1ed7i th\u00f4ng minh : T\u00ednh n\u0103ng n\u00e0y gi\u00fap ng\u01b0\u1eddi d\u00f9ng nhanh ch\u00f3ng ph\u00e1t hi\u1ec7n khi thi\u1ebft b\u1ecb x\u1ea3y ra s\u1ef1 c\u1ed1 v\u00e0 c\u00f3 bi\u1ec7n ph\u00e1p kh\u1eafc ph\u1ee5c k\u1ecbp th\u1eddi. M\u00e1y l\u1ea1nh Comfee Inverter 9.500 BTU (1 HP) CFS-10VDGF-V c\u00f3 gi\u00e1 bao nhi\u00eau? Hi\u1ec7n t\u1ea1i s\u1ea3n ph\u1ea9m \u0111i\u1ec1u h\u00f2a Comfee CFS-10VDGF-V \u0111ang \u0111\u01b0\u1ee3c ni\u00eam y\u1ebft v\u1edbi m\u1ee9c gi\u00e1 c\u1ef1c k\u1ef3 \u01b0u \u0111\u00e3i, \u0111i k\u00e8m nhi\u1ec1u qu\u00e0 t\u1eb7ng h\u1ea5p d\u1eabn t\u1ea1i Ho\u00e0ng H\u00e0 Mobile. Kh\u00f4ng ch\u1ec9 \u201cghi \u0111i\u1ec3m\u201d v\u1edbi m\u1ee9c gi\u00e1 h\u1ee3p t\u00fai ti\u1ec1n, \u0111\u00e2y c\u00f2n l\u00e0 m\u1ed9t thi\u1ebft b\u1ecb l\u00e0m m\u00e1t \u0111\u00e1p \u1ee9ng m\u1ecdi nhu c\u1ea7u c\u1ee7a ng\u01b0\u1eddi d\u00f9ng nh\u01b0 ti\u1ebft ki\u1ec7m \u0111i\u1ec7n, l\u00e0m l\u1ea1nh nhanh, kh\u1eed khu\u1ea9n v\u00e0 thanh l\u1ecdc kh\u00f4ng kh\u00ed,.\u2026 Ngo\u00e0i ra, c\u00f2n c\u00f3 c\u1ea3 nh\u1eefng t\u00ednh n\u0103ng th\u00f4ng minh nh\u01b0 Follow me, \u0111i\u1ec1u khi\u1ec3n b\u1eb1ng gi\u1ecdng n\u00f3i AI Cool, t\u1ef1 \u0111\u1ed9ng l\u00e0m s\u1ea1ch,.... S\u1ea3n ph\u1ea9m \u0111\u01b0\u1ee3c ho\u00e0n thi\u1ec7n t\u1eeb nh\u1eefng v\u1eadt li\u1ec7u c\u1ee9ng c\u00e1p c\u00f9ng l\u1edbp ph\u1ee7 b\u1ea3o v\u1ec7 ch\u1ed1ng \u0103n m\u00f2n, ng\u01b0\u1eddi d\u00f9ng c\u00f3 th\u1ec3 ho\u00e0n to\u00e0n y\u00ean t\u00e2m s\u1eed d\u1ee5ng trong th\u1eddi gian d\u00e0i. S\u1edf h\u1eefu s\u1ea3n ph\u1ea9m \u0111i\u1ec1u h\u00f2a Comfee Inverter 9.500 BTU (1 HP) CFS-10VDGF-V ch\u00ednh h\u00e3ng t\u1ea1i Ho\u00e0ng H\u00e0 Mobile Ho\u00e0ng H\u00e0 Mobile l\u00e0 m\u1ed9t \u0111\u1ecba ch\u1ec9 \u0111\u00e1ng tin c\u1eady tr\u00ean th\u1ecb tr\u01b0\u1eddng \u0111\u1ed3 c\u00f4ng ngh\u1ec7, chuy\u00ean cung c\u1ea5p nh\u1eefng s\u1ea3n ph\u1ea9m m\u00e1y l\u1ea1nh ch\u00ednh h\u00e3ng c\u1ee7a th\u01b0\u01a1ng hi\u1ec7u Comfee c\u0169ng nh\u01b0 nh\u1eefng th\u01b0\u01a1ng hi\u1ec7u \u0111\u00ecnh \u0111\u00e1m kh\u00e1c. V\u1edbi nh\u1eefng n\u00e2ng c\u1ea5p c\u1ea3 v\u1ec1 thi\u1ebft k\u1ebf v\u00e0 t\u00ednh n\u0103ng, s\u1ea3n ph\u1ea9m m\u00e1y l\u1ea1nh Comfee CFS-10VDGF-V ch\u1eafc ch\u1eafn s\u1ebd l\u00e0 m\u1ed9t s\u1ef1 l\u1ef1a ch\u1ecdn m\u00e0 ng\u01b0\u1eddi d\u00f9ng kh\u00f4ng n\u00ean b\u1ecf qua. H\u00e3y \u0111\u1ebfn ngay Ho\u00e0ng H\u00e0 Mobile \u0111\u1ec3 s\u1edf h\u1eefu \u201csi\u00eau ph\u1ea9m\u201d n\u00e0y v\u1edbi m\u1ee9c gi\u00e1 \u201csi\u00eau h\u1eddi\u201d v\u00e0 nh\u1eadn v\u1ec1 v\u00f4 s\u1ed1 qu\u00e0 t\u1eb7ng v\u00f4 c\u00f9ng h\u1ea5p d\u1eabn. Xem to\u00e0n b\u1ed9 b\u00e0i vi\u1ebft",
        "promotion_1": "1. Tr\u00fang 8386 qu\u00e0 - T\u1ed5ng gi\u00e1 tr\u1ecb t\u1edbi 250 TRI\u1ec6U \u0110\u1ed2NG (\u00c1p d\u1ee5ng t\u1eeb 10/01 - 02/02/2025). (Xem chi ti\u1ebft). 2. \u0110\u1eb7c bi\u1ec7t Tr\u1ea3 g\u00f3p 3 kh\u00f4ng: 0% l\u00e3i su\u1ea5t - 0 ph\u00ed chuy\u1ec3n \u0111\u1ed5i - 0 tr\u1ea3 tr\u01b0\u1edbc (\u00c1p d\u1ee5ng cho c\u00f4ng ty t\u00e0i ch\u00ednh v\u00e0 th\u1ebb t\u00edn d\u1ee5ng)",
        "promotion_2": "1. Gi\u1ea3m t\u1edbi 500.000\u0111 khi thanh to\u00e1n th\u1ebb t\u00edn d\u1ee5ng NCB. (Xem chi ti\u1ebft). 2. Gi\u1ea3m \u0111\u1ebfn 150.000\u0111 khi thanh to\u00e1n qua Muadee. (Xem chi ti\u1ebft). 3. Mi\u1ec5n ph\u00ed chuy\u1ec3n \u0111\u1ed5i tr\u1ea3 g\u00f3p ho\u1eb7c gi\u1ea3m \u0111\u1ebfn 500.000\u0111 khi m\u1edf th\u1ebb TPBank EVO. (Xem chi ti\u1ebft). 4. M\u1edf th\u1ebb t\u00edn d\u1ee5ng VIB - Nh\u1eadn Voucher 600.000\u0111. (Xem chi ti\u1ebft). 5. M\u1edf th\u1ebb HSBC - Ho\u00e0n ti\u1ec1n t\u1edbi 2 tri\u1ec7u \u0111\u1ed3ng. (Xem chi ti\u1ebft)"
    },
    {
        "title": "\u0110i\u1ec1u h\u00f2a Comfee Inverter 12.000 BTU (1.5 HP) CFS-13VDGF-V",
        "price": "gi\u00e1 hi\u1ec7n t\u1ea1i l\u00e0 7,020,000 \u20ab nh\u01b0ng tr\u01b0\u1edbc \u0111\u00e2y n\u00f3 c\u00f3 gi\u00e1 l\u00e0 8,390,000 \u20ab",
        "colors": "Tr\u1eafng",
        "technical_specifications": [
            {
                "Lo\u1ea1i m\u00e1y": "1 chi\u1ec1u (ch\u1ec9 l\u00e0m l\u1ea1nh)"
            },
            {
                "C\u00f4ng ngh\u1ec7 inverter": "M\u00e1y l\u1ea1nh Inverter"
            },
            {
                "C\u00f4ng su\u1ea5t l\u00e0m l\u1ea1nh": "1.5 HP - 12.000 BTU"
            },
            {
                "Ph\u1ea1m vi l\u00e0m l\u1ea1nh hi\u1ec7u qu\u1ea3": "T\u1eeb 15 - 20m\u00b2 (t\u1eeb 40 \u0111\u1ebfn 60 m\u00b3)"
            },
            {
                "Nh\u00e3n n\u0103ng l\u01b0\u1ee3ng": "5 sao (Hi\u1ec7u su\u1ea5t n\u0103ng l\u01b0\u1ee3ng 4.68)"
            }
        ],
        "description": "\u0110i\u1ec1u h\u00f2a Comfee Inverter 12.000 BTU (1.5 HP) CFS-13VDGF-V l\u00e0 m\u1ed9t s\u1ea3n ph\u1ea9m m\u00e1y l\u1ea1nh 1 chi\u1ec1u th\u1ebf h\u1ec7 m\u1edbi \u0111\u1ebfn t\u1eeb th\u01b0\u01a1ng hi\u1ec7u Comfee \u0111\u00ecnh \u0111\u00e1m c\u1ee7a \u00dd. Chi\u1ebfc \u0111i\u1ec1u h\u00f2a n\u00e0y ho\u1ea1t \u0111\u1ed9ng v\u1edbi c\u00f4ng su\u1ea5t 1.5 HP , ph\u00f9 h\u1ee3p v\u1edbi nh\u1eefng kh\u00f4ng gian c\u00f3 di\u1ec7n t\u00edch d\u01b0\u1edbi 20m2 . V\u1edbi c\u00f4ng ngh\u1ec7 l\u00e0m l\u1ea1nh nhanh Hyper Tech , c\u1ea3m bi\u1ebfn nhi\u1ec7t \u0111\u1ed9 Follow Me c\u00f9ng m\u00e0ng l\u1ecdc k\u00e9p Dual , s\u1ea3n ph\u1ea9m kh\u00f4ng ch\u1ec9 mang l\u1ea1i hi\u1ec7u qu\u1ea3 l\u00e0m m\u00e1t t\u1ed1i \u01b0u m\u00e0 c\u00f2n h\u1ed7 tr\u1ee3 l\u00e0m s\u1ea1ch kh\u00f4ng kh\u00ed, b\u1ea3o v\u1ec7 s\u1ee9c kh\u1ecfe c\u1ee7a ng\u01b0\u1eddi d\u00f9ng. \u0110\u1eb7c bi\u1ec7t h\u01a1n, chi\u1ebfc m\u00e1y l\u1ea1nh n\u00e0y c\u00f2n \u0111\u01b0\u1ee3c t\u00edch h\u1ee3p t\u00ednh n\u0103ng \u0111i\u1ec1u khi\u1ec3n b\u1eb1ng gi\u1ecdng n\u00f3i th\u00f4ng qua c\u00f4ng ngh\u1ec7 AI Cool , mang \u0111\u1ebfn nh\u1eefng tr\u1ea3i nghi\u1ec7m s\u1eed d\u1ee5ng c\u1ef1c k\u1ef3 th\u00fa v\u1ecb v\u00e0 ti\u1ec7n l\u1ee3i. \u0110\u1eb7c \u0111i\u1ec3m n\u1ed5i b\u1eadt Thi\u1ebft k\u1ebf treo t\u01b0\u1eddng g\u1ecdn g\u00e0ng v\u00e0 \u0111\u1eb9p m\u1eaft, t\u00edch h\u1ee3p m\u00e0n h\u00ecnh c\u1ea3m bi\u1ebfn \u00e1nh s\u00e1ng tr\u00ean b\u1ec1 m\u1eb7t d\u00e0n l\u1ea1nh. C\u00f4ng su\u1ea5t 1.5 HP cho hi\u1ec7u qu\u1ea3 l\u00e0m m\u00e1t t\u1ed1i \u01b0u trong kh\u00f4ng gian c\u00f3 di\u1ec7n t\u00edch d\u01b0\u1edbi 20m2. C\u00f4ng ngh\u1ec7 Hyper Tech l\u00e0m l\u1ea1nh ngay t\u1ee9c th\u00ec trong th\u1eddi gian ng\u1eafn. C\u00f3 th\u1ec3 \u0111i\u1ec1u khi\u1ec3n b\u1eb1ng gi\u1ecdng n\u00f3i v\u1edbi c\u00f4ng ngh\u1ec7 AI Cool. Trang b\u1ecb m\u00e0ng l\u1ecdc k\u00e9p Dual gi\u00fap n\u00e2ng cao kh\u1ea3 n\u0103ng thanh l\u1ecdc kh\u00f4ng kh\u00ed. Ti\u1ebft ki\u1ec7m \u0111i\u1ec7n n\u0103ng v\u1edbi c\u00f4ng ngh\u1ec7 Inverter, ch\u1ebf \u0111\u1ed9 Eco v\u00e0 b\u1ed9 x\u1eed l\u00fd E-Max. B\u1ea3ng th\u00f4ng s\u1ed1 k\u1ef9 thu\u1eadt c\u1ee7a m\u00e1y l\u1ea1nh Comfee Inverter 12.000 BTU (1.5 HP) CFS-13VDGF-V Th\u00f4ng s\u1ed1 Chi ti\u1ebft Lo\u1ea1i m\u00e1y 1 chi\u1ec1u (ch\u1ec9 l\u00e0m l\u1ea1nh) C\u00f4ng su\u1ea5t l\u00e0m l\u1ea1nh 1.5 HP - 12.000 BTU Ph\u1ea1m vi l\u00e0m l\u1ea1nh hi\u1ec7u qu\u1ea3 T\u1eeb 15 - 20m2 (t\u1eeb 40 \u0111\u1ebfn 60m3) K\u00edch th\u01b0\u1edbc v\u00e0 tr\u1ecdng l\u01b0\u1ee3ng d\u00e0n l\u1ea1nh D\u00e0i 80.5 cm - Cao 29.5 cm - D\u00e0y 20.8 cm N\u1eb7ng 9 kg K\u00edch th\u01b0\u1edbc v\u00e0 tr\u1ecdng l\u01b0\u1ee3ng d\u00e0n n\u00f3ng D\u00e0i 77 cm - Cao 49.5 cm - D\u00e0y 27 cm N\u1eb7ng 21.2 kg \u0110\u1ed9 \u1ed3n trung b\u00ecnh 40/36/34 dB Lo\u1ea1i gas R-32 Ti\u00eau th\u1ee5 \u0111i\u1ec7n 1.06 kW/h C\u00f4ng ngh\u1ec7 ti\u1ebft ki\u1ec7m \u0111i\u1ec7n Eco Bi\u1ebfn t\u1ea7n Inverter v\u1edbi b\u1ed9 vi x\u1eed l\u00fd E-Max Kh\u1ea3 n\u0103ng l\u1ecdc b\u1ee5i, kh\u00e1ng khu\u1ea9n, kh\u1eed m\u00f9i M\u00e0ng l\u1ecdc k\u00e9p Dual: L\u1ecdc b\u1ee5i 0.7 mm, l\u1ecdc m\u00f9i Ch\u1ebf \u0111\u1ed9 gi\u00f3 \u0110i\u1ec1u khi\u1ec3n l\u00ean xu\u1ed1ng t\u1ef1 \u0111\u1ed9ng, tr\u00e1i ph\u1ea3i t\u00f9y ch\u1ec9nh tay C\u00f4ng ngh\u1ec7 l\u00e0m l\u1ea1nh nhanh Hyper Tech Ti\u1ec7n \u00edch T\u1ef1 kh\u1edfi \u0111\u1ed9ng l\u1ea1i khi c\u00f3 \u0111i\u1ec7n Remote c\u00f3 \u0111\u00e8n LED C\u1ea3m bi\u1ebfn nhi\u1ec7t \u0111\u1ed9 Follow Me Ch\u1ee9c n\u0103ng t\u1ef1 ch\u1ea9n \u0111o\u00e1n l\u1ed7i Ch\u1ebf \u0111\u1ed9 Active-Clean t\u1ef1 \u0111\u1ed9ng l\u00e0m s\u1ea1ch Ch\u1ebf \u0111\u1ed9 ti\u1ebft ki\u1ec7m ch\u1ee7 \u0111\u1ed9ng Gear Mode Ch\u1ebf \u0111\u1ed9 ng\u1ee7 \u0111\u00eam Sleep M\u00e0n h\u00ecnh hi\u1ec3n th\u1ecb nhi\u1ec7t \u0111\u1ed9 Ch\u1ee9c n\u0103ng h\u00fat \u1ea9m H\u1eb9n gi\u1edd b\u1eadt/t\u1eaft m\u00e1y Ch\u1ebf \u0111\u1ed9 Fan Only - ch\u1ec9 l\u00e0m m\u00e1t, kh\u00f4ng l\u00e0m l\u1ea1nh C\u00f4ng ngh\u1ec7 AI Cool - \u0111i\u1ec1u khi\u1ec3n b\u1eb1ng smartphone Ch\u1ebf \u0111\u1ed9 Avoid Me (Breeze Away) D\u00f2ng \u0111i\u1ec7n v\u00e0o D\u00e0n l\u1ea1nh D\u00f2ng \u0111i\u1ec7n ho\u1ea1t \u0111\u1ed9ng 1 pha S\u1ed1 l\u01b0\u1ee3ng k\u1ebft n\u1ed1i d\u00e0n l\u1ea1nh t\u1ed1i \u0111a 1 \u0110\u00e1nh gi\u00e1 chi ti\u1ebft s\u1ea3n ph\u1ea9m \u0111i\u1ec1u h\u00f2a Comfee Inverter 12.000 BTU (1.5 HP) CFS-13VDGF-V M\u00e1y l\u1ea1nh Comfee Inverter 12.000 BTU (1.5 HP) CFS-13VDGF-V l\u00e0 m\u1ed9t thi\u1ebft b\u1ecb l\u00e0m m\u00e1t ph\u00f9 h\u1ee3p cho nh\u1eefng kh\u00f4ng gian nh\u1ecf v\u00e0 v\u1eeba, c\u00f3 di\u1ec7n t\u00edch dao \u0111\u1ed9ng t\u1eeb 15 - 20m2. Thi\u1ebft b\u1ecb c\u00f3 kh\u1ea3 n\u0103ng l\u00e0m l\u1ea1nh nhanh trong th\u1eddi gian ng\u1eafn, n\u00ean ng\u01b0\u1eddi d\u00f9ng s\u1ebd \u0111\u01b0\u1ee3c t\u1eadn h\u01b0\u1edfng kh\u00f4ng gian tho\u1ea3i m\u00e1i, d\u1ec5 ch\u1ecbu m\u00e0 kh\u00f4ng ph\u1ea3i ch\u1edd \u0111\u1ee3i qu\u00e1 l\u00e2u. V\u1edbi h\u00e0ng lo\u1ea1t c\u00f4ng ngh\u1ec7 ti\u00ean ti\u1ebfn h\u00e0ng \u0111\u1ea7u, chi\u1ebfc m\u00e1y l\u1ea1nh Comfee gi\u00fap t\u1ed1i \u01b0u \u0111i\u1ec7n n\u0103ng ti\u00eau th\u1ee5 c\u1ef1c k\u1ef3 hi\u1ec7u qu\u1ea3, gi\u00fap gi\u1ea3m g\u00e1nh n\u1eb7ng v\u1ec1 chi ph\u00ed h\u00e0ng th\u00e1ng cho ng\u01b0\u1eddi d\u00f9ng. Ngo\u00e0i ra, nh\u1eefng t\u00ednh n\u0103ng th\u00f4ng minh v\u00e0 hi\u1ec7n \u0111\u1ea1i c\u1ee7a chi\u1ebfc \u0111i\u1ec1u h\u00f2a n\u00e0y c\u0169ng h\u1ee9a h\u1eb9n s\u1ebd mang \u0111\u1ebfn nh\u1eefng tr\u1ea3i nghi\u1ec7m v\u00f4 c\u00f9ng tuy\u1ec7t v\u1eddi. Thi\u1ebft k\u1ebf v\u1eeba \u0111\u1ea3m b\u1ea3o t\u00ednh th\u1ea9m m\u1ef9, v\u1eeba mang l\u1ea1i \u0111\u1ed9 b\u1ec1n cao M\u00e1y l\u1ea1nh Comfee Inverter 12.000 BTU (1.5 HP) CFS-13VDGF-V s\u1edf h\u1eefu nhi\u1ec1u \u01b0u \u0111i\u1ec3m n\u1ed5i b\u1eadt v\u1ec1 thi\u1ebft k\u1ebf. Ki\u1ec3u d\u00e1ng \u0111\u01a1n gi\u1ea3n v\u1edbi t\u00f4ng m\u00e0u tr\u1eafng nh\u00e3 nh\u1eb7n, k\u00edch th\u01b0\u1edbc g\u1ecdn g\u00e0ng ph\u00f9 h\u1ee3p v\u1edbi nhi\u1ec1u kh\u00f4ng gian s\u1eed d\u1ee5ng kh\u00e1c nhau. Th\u00e2n m\u00e1y \u0111\u01b0\u1ee3c bao b\u1ecdc b\u1edfi l\u1edbp v\u1ecf nh\u1ef1a l\u00e1ng b\u00f3ng, r\u1ea5t thu\u1eadn ti\u1ec7n cho vi\u1ec7c v\u1ec7 sinh. Tr\u00ean b\u1ec1 m\u1eb7t c\u1ee7a d\u00e0n l\u1ea1nh c\u00f2n \u0111\u01b0\u1ee3c t\u00edch h\u1ee3p m\u1ed9t m\u00e0n h\u00ecnh LED hi\u1ec3n th\u1ecb nhi\u1ec7t \u0111\u1ed9, m\u00e3 l\u1ed7i \u0111\u1ec3 ng\u01b0\u1eddi d\u00f9ng d\u1ec5 d\u00e0ng quan s\u00e1t v\u00e0 \u0111i\u1ec1u ch\u1ec9nh. Kh\u00f4ng nh\u1eefng v\u1eady, m\u00e0n h\u00ecnh LED n\u00e0y c\u00f2n c\u00f3 kh\u1ea3 n\u0103ng t\u1ef1 \u0111\u1ed9ng t\u0103ng, gi\u1ea3m \u0111\u1ed9 s\u00e1ng ho\u1eb7c t\u1eaft h\u1eb3n m\u00e0n h\u00ecnh d\u1ef1a theo \u00e1nh s\u00e1ng t\u1eeb m\u00f4i tr\u01b0\u1eddng b\u00ean ngo\u00e0i, mang l\u1ea1i s\u1ef1 ti\u1ec7n nghi trong qu\u00e1 tr\u00ecnh s\u1eed d\u1ee5ng. D\u00e0n n\u00f3ng c\u1ee7a m\u00e1y l\u1ea1nh \u0111\u01b0\u1ee3c thi\u1ebft k\u1ebf ch\u1eafc ch\u1eafn v\u1edbi l\u00e1 t\u1ea3n nhi\u1ec7t b\u1eb1ng nh\u00f4m, \u0111\u01b0\u1ee3c ph\u1ee7 th\u00eam m\u1ed9t l\u1edbp ch\u1ed1ng \u0103n m\u00f2n Golden Coating, gi\u00fap l\u00e0m ch\u1eadm qu\u00e1 tr\u00ecnh oxy h\u00f3a, ng\u0103n ch\u1eb7n s\u1ef1 h\u00ecnh th\u00e0nh c\u1ee7a n\u1ea5m m\u1ed1c v\u00e0 vi khu\u1ea9n, \u0111\u1eb7c bi\u1ec7t l\u00e0 t\u0103ng kh\u1ea3 n\u0103ng ch\u1ed1ng ch\u1ecbu tr\u01b0\u1edbc nh\u1eefng t\u00e1c \u0111\u1ed9ng t\u1eeb m\u00f4i tr\u01b0\u1eddng b\u00ean ngo\u00e0i. \u1ed0ng d\u1eabn gas b\u1eb1ng \u0111\u1ed3ng c\u00f3 kh\u1ea3 n\u0103ng d\u1eabn nhi\u1ec7t t\u1ed1t c\u00f9ng hi\u1ec7u su\u1ea5t l\u00e0m l\u1ea1nh nhanh ch\u00f3ng. \u0110\u1eb7c bi\u1ec7t h\u01a1n, thi\u1ebft k\u1ebf c\u1ee7a van \u0111i\u1ec1u ti\u1ebft v\u00e0 c\u00e1nh t\u1ea3n nhi\u1ec7t c\u1ee7a d\u00e0n n\u00f3ng \u0111\u01b0\u1ee3c c\u1ea3i ti\u1ebfn h\u01a1n, gi\u00fap ti\u1ebft ki\u1ec7m 30% \u0111i\u1ec7n n\u0103ng so v\u1edbi nh\u1eefng th\u1ebf h\u1ec7 tr\u01b0\u1edbc. L\u00e0m l\u1ea1nh nhanh ch\u00f3ng v\u00e0 hi\u1ec7u qu\u1ea3 v\u1edbi ch\u1ebf \u0111\u1ed9 Hyper Tech tr\u00ean \u0111i\u1ec1u h\u00f2a Comfee Inverter 12.000 BTU (1.5 HP) CFS-13VDGF-V \u0110a s\u1ed1 c\u00e1c s\u1ea3n ph\u1ea9m \u0111i\u1ec1u h\u00f2a c\u1ee7a Comfee \u0111\u1ec1u \u0111\u01b0\u1ee3c t\u00edch h\u1ee3p c\u00f4ng ngh\u1ec7 l\u00e0m l\u1ea1nh \u0111\u1eb7c tr\u01b0ng Hyper Tech v\u00e0 \u0111i\u1ec1u h\u00f2a Comfee Inverter CFS-13VDGF-V c\u0169ng kh\u00f4ng ph\u1ea3i ngo\u1ea1i l\u1ec7. Khi k\u00edch ho\u1ea1t ch\u1ebf \u0111\u1ed9 n\u00e0y, m\u00e1y n\u00e9n s\u1ebd ho\u1ea1t \u0111\u1ed9ng v\u1edbi t\u1ed1c \u0111\u1ed9 cao \u0111\u1ec3 \u0111\u1ea1t \u0111\u01b0\u1ee3c m\u1ee9c nhi\u1ec7t mong mu\u1ed1n trong th\u1eddi gian ng\u1eafn nh\u1ea5t. Nh\u1edd \u0111\u00f3, kh\u00f4ng gian trong ph\u00f2ng s\u1ebd \u0111\u01b0\u1ee3c l\u00e0m m\u00e1t m\u1ed9t c\u00e1ch nhanh ch\u00f3ng m\u00e0 ng\u01b0\u1eddi d\u00f9ng kh\u00f4ng ph\u1ea3i ch\u1edd \u0111\u1ee3i qu\u00e1 l\u00e2u. B\u00ean c\u1ea1nh \u0111\u00f3, thi\u1ebft b\u1ecb c\u00f2n c\u00f3 kh\u1ea3 n\u0103ng t\u1ef1 \u0111\u1ed9ng \u0111i\u1ec1u khi\u1ec3n h\u01b0\u1edbng gi\u00f3 l\u00ean xu\u1ed1ng, \u0111\u1ed3ng th\u1eddi cho ph\u00e9p ng\u01b0\u1eddi d\u00f9ng \u0111i\u1ec1u ch\u1ec9nh hai chi\u1ec1u tr\u00e1i ph\u1ea3i b\u1eb1ng tay \u0111\u1ec3 lan t\u1ecfa lu\u1ed3ng kh\u00ed l\u1ea1nh \u0111\u1ebfn m\u1ecdi ng\u00f3c ng\u00e1ch trong ph\u00f2ng m\u1ed9t c\u00e1ch \u0111\u1ed3ng \u0111\u1ec1u. Cho d\u00f9 ng\u1ed3i \u1edf b\u1ea5t c\u1ee9 v\u1ecb tr\u00ed n\u00e0o trong ph\u00f2ng, ng\u01b0\u1eddi d\u00f9ng c\u0169ng \u0111\u1ec1u c\u1ea3m th\u1ea5y m\u00e1t m\u1ebb v\u00e0 d\u1ec5 ch\u1ecbu. C\u01a1 ch\u1ebf th\u1ed5i gi\u00f3 linh ho\u1ea1t c\u1ee7a thi\u1ebft b\u1ecb s\u1ebd gi\u00fap h\u1ea1n ch\u1ebf t\u00ecnh tr\u1ea1ng th\u1ed5i gi\u00f3 tr\u1ef1c ti\u1ebfp v\u00e0o c\u01a1 th\u1ec3, t\u1ea1o ra tr\u1ea3i nghi\u1ec7m s\u1eed d\u1ee5ng tho\u1ea3i m\u00e1i m\u00e0 v\u1eabn \u0111\u1ea3m b\u1ea3o s\u1ee9c kh\u1ecfe cho ng\u01b0\u1eddi d\u00f9ng. \u0110i\u1ec1u khi\u1ec3n b\u1eb1ng gi\u1ecdng n\u00f3i v\u1edbi c\u00f4ng ngh\u1ec7 AI Cool th\u00f4ng minh \u0110\u00e2y l\u00e0 m\u1ed9t trong nh\u1eefng \u01b0u \u0111i\u1ec3m n\u1ed5i b\u1eadt kh\u00f4ng th\u1ec3 b\u1ecf qua khi nh\u1eafc \u0111\u1ebfn s\u1ea3n ph\u1ea9m m\u00e1y l\u1ea1nh Comfee Inverter 12.000 BTU (1.5 HP) CFS-13VDGF-V. Ch\u1ec9 b\u1eb1ng m\u1ed9t v\u00e0i thao t\u00e1c \u0111\u0103ng nh\u1eadp \u0111\u01a1n gi\u1ea3n v\u00e0 nhanh ch\u00f3ng tr\u00ean \u1ee9ng d\u1ee5ng SmartHome, ng\u01b0\u1eddi d\u00f9ng c\u00f3 th\u1ec3 \u0111i\u1ec1u khi\u1ec3n c\u00e1c t\u00ednh n\u0103ng tr\u00ean thi\u1ebft b\u1ecb b\u1eb1ng c\u00e1ch ra l\u1ec7nh b\u1eb1ng gi\u1ecdng n\u00f3i. Thi\u1ebft b\u1ecb s\u1ebd t\u1ef1 \u0111\u1ed9ng \u0111i\u1ec1u ch\u1ec9nh thay \u0111\u1ed5i nhi\u1ec7t \u0111\u1ed9 theo y\u00eau c\u1ea7u, gi\u00fap ng\u01b0\u1eddi d\u00f9ng c\u00f3 \u0111\u01b0\u1ee3c tr\u1ea3i nghi\u1ec7m s\u1eed d\u1ee5ng tho\u1ea3i m\u00e1i v\u00e0 ti\u1ec7n nghi nh\u1ea5t. M\u00e1y l\u1ea1nh Comfee Inverter 12.000 BTU (1.5 HP) CFS-13VDGF-V v\u1edbi kh\u1ea3 n\u0103ng t\u1ef1 \u0111\u1ed9ng \u0111i\u1ec1u ch\u1ec9nh nhi\u1ec7t \u0111\u1ed9 b\u1eb1ng t\u00ednh n\u0103ng Follow Me Chi\u1ebfc \u0111i\u1ec1u h\u00f2a CFS-13VDGF-V c\u1ee7a Comfee \u0111\u01b0\u1ee3c t\u00edch h\u1ee3p t\u00ednh n\u0103ng Follow Me c\u1ef1c k\u1ef3 th\u00f4ng minh. Th\u00f4ng th\u01b0\u1eddng, ng\u01b0\u1eddi d\u00f9ng s\u1ebd \u0111\u1eb7t \u0111i\u1ec1u khi\u1ec3n t\u1eeb xa (remote) c\u1ee7a \u0111i\u1ec1u h\u00f2a \u1edf v\u1ecb tr\u00ed g\u1ea7n m\u00ecnh \u0111\u1ec3 ti\u1ec7n s\u1eed d\u1ee5ng. D\u1ef1a theo th\u00f3i quen n\u00e0y, chi\u1ebfc \u0111i\u1ec1u khi\u1ec3n c\u1ee7a \u0111i\u1ec1u h\u00f2a Comfee \u0111\u00e3 \u0111\u01b0\u1ee3c t\u00edch h\u1ee3p m\u1ed9t c\u1ea3m bi\u1ebfn c\u00f3 kh\u1ea3 n\u0103ng c\u1ea3m nh\u1eadn nhi\u1ec7t \u0111\u1ed9 t\u1eeb m\u00f4i tr\u01b0\u1eddng xung quanh c\u01a1 th\u1ec3 c\u1ee7a ng\u01b0\u1eddi d\u00f9ng. Nh\u1edd \u0111\u00f3, \u0111i\u1ec1u h\u00f2a s\u1ebd t\u1ef1 \u0111\u1ed9ng \u0111i\u1ec1u ch\u1ec9nh v\u00e0 duy tr\u00ec nhi\u1ec7t \u0111\u1ed9 m\u00f4i tr\u01b0\u1eddng \u1edf m\u1ee9c nhi\u1ec7t \u0111\u00e3 c\u00e0i \u0111\u1eb7t, gi\u00fap ng\u01b0\u1eddi d\u00f9ng lu\u00f4n c\u00f3 \u0111\u01b0\u1ee3c c\u1ea3m gi\u00e1c d\u1ec5 ch\u1ecbu v\u00e0 tho\u1ea3i m\u00e1i nh\u1ea5t. Kh\u1ea3 n\u0103ng l\u1ecdc b\u1ee5i, kh\u1eed m\u00f9i m\u1ea1nh m\u1ebd v\u1edbi m\u00e0ng l\u1ecdc k\u00e9p Dual Kh\u00f4ng ch\u1ec9 mang l\u1ea1i hi\u1ec7u qu\u1ea3 l\u00e0m l\u1ea1nh nhanh ch\u00f3ng, chi\u1ebfc \u0111i\u1ec1u h\u00f2a Comfee Inverter 12.000 BTU (1.5 HP) CFS-13VDGF-V c\u00f2n c\u00f3 kh\u1ea3 n\u0103ng thanh l\u1ecdc kh\u00f4ng kh\u00ed m\u1ea1nh m\u1ebd nh\u1edd \u0111\u01b0\u1ee3c trang b\u1ecb h\u1ec7 th\u1ed1ng m\u00e0ng l\u1ecdc k\u00e9p Dual. M\u00e0ng l\u1ecdc k\u00e9p n\u00e0y c\u00f3 c\u1ea5u t\u1ea1o g\u1ed3m 2 ph\u1ea7n, bao g\u1ed3m m\u1ed9t m\u00e0ng l\u1ecdc b\u1ee5i gi\u00fap lo\u1ea1i b\u1ecf c\u00e1c lo\u1ea1i b\u1ee5i b\u1ea9n, vi khu\u1ea9n c\u00f3 h\u1ea1i trong kh\u00f4ng kh\u00ed. M\u00e0ng l\u1ecdc m\u00f9i v\u1edbi l\u1edbp than ho\u1ea1t t\u00ednh s\u1ebd gi\u00fap ph\u00e2n h\u1ee7y c\u00e1c ch\u1ea5t \u0111\u1ed9c h\u1ea1i Formaldehyde, Benzen v\u00e0 Amoniac, ph\u00f2ng ng\u1eeba nh\u1eefng t\u00e1c \u0111\u1ed9ng x\u1ea5u \u1ea3nh h\u01b0\u1edfng \u0111\u1ebfn s\u1ee9c kh\u1ecfe c\u1ee7a ng\u01b0\u1eddi d\u00f9ng, \u0111\u1ed3ng th\u1eddi lo\u1ea1i b\u1ecf nh\u1eefng m\u00f9i kh\u00f3 ch\u1ecbu trong kh\u00f4ng kh\u00ed, t\u1ea1o ra b\u1ea7u kh\u00f4ng gian tho\u00e1ng m\u00e1t, s\u1ea1ch s\u1ebd cho c\u0103n ph\u00f2ng. S\u1eed d\u1ee5ng \u0111i\u1ec1u h\u00f2a Comfee Inverter 12.000 BTU (1.5 HP) CFS-13VDGF-V gi\u00fap ti\u1ebft ki\u1ec7m \u0111i\u1ec7n n\u0103ng t\u1ed1i \u01b0u Thay v\u00ec \u0111\u01b0\u1ee3c trang b\u1ecb r\u01a1 le c\u1ea3m bi\u1ebfn nhi\u1ec7t nh\u01b0 c\u00e1c s\u1ea3n ph\u1ea9m \u0111i\u1ec1u h\u00f2a th\u00f4ng th\u01b0\u1eddng, \u0111i\u1ec1u h\u00f2a Comfee CFS-13VDGF-V s\u1eed d\u1ee5ng m\u00e1y n\u00e9n bi\u1ebfn t\u1ea7n \u0111\u1ec3 \u0111i\u1ec1u ti\u1ebft nhi\u1ec7t \u0111\u1ed9 trong ph\u00f2ng th\u00f4ng qua b\u1ed9 vi x\u1eed l\u00fd E-Max. \u0110i\u1ec1u n\u00e0y cho ph\u00e9p thi\u1ebft b\u1ecb c\u00f3 th\u1ec3 t\u1ef1 \u0111\u1ed9ng \u0111i\u1ec1u ch\u1ec9nh t\u1ed1c \u0111\u1ed9 quay c\u1ee7a m\u00e1y n\u00e9n \u0111\u1ec3 ph\u00f9 h\u1ee3p v\u1edbi c\u00f4ng su\u1ea5t l\u00e0m l\u1ea1nh, duy tr\u00ec ho\u1ea1t \u0111\u1ed9ng li\u00ean t\u1ee5c v\u00e0 \u1ed5n \u0111\u1ecbnh \u1edf t\u1ed1c \u0111\u1ed9 c\u1ef1c th\u1ea5p 12Hz. Nh\u1edd \u0111\u00f3, thi\u1ebft b\u1ecb c\u00f3 th\u1ec3 gi\u1ea3m ti\u00eau hao \u0111i\u1ec7n n\u0103ng, \u0111\u1ed3ng th\u1eddi v\u1eadn h\u00e0nh \u00eam \u00e1i v\u00e0 b\u1ec1n b\u1ec9 h\u01a1n \u0111\u1ebfn 16 l\u1ea7n so v\u1edbi nh\u1eefng th\u1ebf h\u1ec7 tr\u01b0\u1edbc. Kh\u00f4ng nh\u1eefng v\u1eady, thi\u1ebft b\u1ecb c\u00f2n \u0111\u01b0\u1ee3c t\u00edch h\u1ee3p ch\u1ebf \u0111\u1ed9 Eco Mode ti\u1ebft ki\u1ec7m \u0111i\u1ec7n th\u00f4ng minh. V\u1edbi ch\u1ebf \u0111\u1ed9 n\u00e0y, \u0111i\u1ec1u h\u00f2a s\u1ebd ti\u00eau th\u1ee5 m\u1ee9c \u0111i\u1ec7n n\u0103ng th\u1ea5p nh\u1ea5t, ti\u1ebft ki\u1ec7m \u0111\u1ebfn 71% \u0111i\u1ec7n n\u0103ng m\u00e0 v\u1eabn \u0111\u1ea3m b\u1ea3o kh\u1ea3 n\u0103ng l\u00e0m l\u1ea1nh t\u1ed1i \u01b0u. Theo c\u00f4ng b\u1ed1 c\u1ee7a h\u00e3ng, khi k\u00edch ho\u1ea1t ch\u1ebf \u0111\u1ed9 Eco, c\u00f4ng su\u1ea5t ti\u00eau th\u1ee5 \u0111i\u1ec7n c\u1ee7a \u0111i\u1ec1u h\u00f2a Comfee ch\u01b0a \u0111\u1ebfn 1 KW/h trong su\u1ed1t 8 ti\u1ebfng. B\u00ean c\u1ea1nh c\u00f4ng ngh\u1ec7 Inverter c\u00f9ng ch\u1ebf \u0111\u1ed9 Eco, m\u00e1y l\u1ea1nh Comfee Inverter 12.000 BTU (1.5 HP) CFS-13VDGF-V c\u00f2n \u0111\u01b0\u1ee3c t\u00edch h\u1ee3p ch\u1ebf \u0111\u1ed9 Gear Mode, cho ph\u00e9p ng\u01b0\u1eddi d\u00f9ng l\u1ef1a ch\u1ecdn 1 trong 3 m\u1ee9c c\u00f4ng su\u1ea5t (50%, 75% v\u00e0 100%) t\u00f9y theo nhu c\u1ea7u s\u1eed d\u1ee5ng c\u1ee7a b\u1ea3n th\u00e2n v\u00e0 di\u1ec7n t\u00edch kh\u00f4ng gian ph\u00f2ng. M\u1ee9c c\u00f4ng su\u1ea5t th\u1ea5p h\u01a1n s\u1ebd c\u00f3 hi\u1ec7u qu\u1ea3 l\u00e0m l\u1ea1nh y\u1ebfu h\u01a1n, b\u00f9 l\u1ea1i s\u1ebd ti\u1ebft ki\u1ec7m \u0111i\u1ec7n h\u01a1n. Trong khi \u0111\u00f3 m\u1ee9c c\u00f4ng su\u1ea5t cao s\u1ebd l\u00e0m m\u00e1t nhanh ch\u00f3ng v\u00e0 m\u1ea1nh m\u1ebd h\u01a1n, ph\u00f9 h\u1ee3p v\u1edbi nh\u1eefng kh\u00f4ng gian l\u1edbn ho\u1eb7c t\u1eadp trung \u0111\u00f4ng ng\u01b0\u1eddi. T\u00ednh n\u0103ng t\u1ef1 \u0111\u1ed9ng l\u00e0m s\u1ea1ch th\u00f4ng minh Active-Clean Sau m\u1ed9t th\u1eddi gian s\u1eed d\u1ee5ng, vi\u1ec7c b\u1ee5i b\u1ea9n t\u00edch t\u1ee5 tr\u00ean d\u00e0n l\u1ea1nh l\u00e0 \u0111i\u1ec1u kh\u00f4ng th\u1ec3 tr\u00e1nh kh\u1ecfi. L\u00fac n\u00e0y, ng\u01b0\u1eddi d\u00f9ng ch\u1ec9 c\u1ea7n k\u00edch ho\u1ea1t ch\u1ebf \u0111\u1ed9 Active-Clean, ngay l\u1eadp t\u1ee9c thi\u1ebft b\u1ecb s\u1ebd \u0111\u01b0\u1ee3c l\u00e0m s\u1ea1ch qua t\u1eebng b\u01b0\u1edbc. V\u1edbi t\u00ednh n\u0103ng n\u00e0y, d\u00e0n l\u1ea1nh c\u1ee7a \u0111i\u1ec1u h\u00f2a s\u1ebd lu\u00f4n \u0111\u01b0\u1ee3c \u0111\u1ea3m b\u1ea3o v\u1ec7 sinh, s\u1ea1ch s\u1ebd v\u00e0 kh\u00f4 tho\u00e1ng. Nh\u1edd v\u1eady m\u00e0 lu\u1ed3ng kh\u00ed th\u1ed5i ra c\u0169ng tr\u1edf n\u00ean trong l\u00e0nh v\u00e0 tinh khi\u1ebft h\u01a1n, \u0111\u1ea3m b\u1ea3o an to\u00e0n cho s\u1ee9c kh\u1ecfe \u0111\u01b0\u1eddng h\u00f4 h\u1ea5p c\u1ee7a c\u00e1c th\u00e0nh vi\u00ean trong gia \u0111\u00ecnh. Kh\u00f4ng nh\u1eefng v\u1eady, t\u00ednh n\u0103ng n\u00e0y c\u0169ng gi\u00fap ng\u01b0\u1eddi d\u00f9ng ti\u1ebft ki\u1ec7m chi ph\u00ed v\u1ec7 sinh \u0111\u1ecbnh k\u1ef3, \u0111\u1ed3ng th\u1eddi \u0111\u1ea3m b\u1ea3o d\u00e0n l\u1ea1nh lu\u00f4n ho\u1ea1t \u0111\u1ed9ng v\u1edbi hi\u1ec7u su\u1ea5t t\u1ed1i \u01b0u. M\u00e1y l\u1ea1nh Comfee Inverter 12.000 BTU (1.5 HP) CFS-13VDGF-V \u0111\u01b0\u1ee3c t\u00edch h\u1ee3p nhi\u1ec1u ti\u1ec7n \u00edch th\u00f4ng minh \u0110\u1ec3 \u0111\u00e1p \u1ee9ng nhu c\u1ea7u \u0111a d\u1ea1ng c\u1ee7a ng\u01b0\u1eddi d\u00f9ng, \u0111i\u1ec1u h\u00f2a Comfee CFS-13VDGF-V \u0111\u01b0\u1ee3c t\u00edch h\u1ee3p r\u1ea5t nhi\u1ec1u ti\u1ec7n \u00edch v\u00e0 c\u00e1c ch\u1ebf \u0111\u1ed9 ho\u1ea1t \u0111\u1ed9ng th\u00f4ng minh nh\u01b0: Ch\u1ebf \u0111\u1ed9 ng\u1ee7 (Sleep) : Khi k\u00edch ho\u1ea1t ch\u1ebf \u0111\u1ed9 n\u00e0y, thi\u1ebft b\u1ecb s\u1ebd v\u1eadn h\u00e0nh v\u1edbi \u0111\u1ed9 \u1ed3n c\u1ef1c th\u1ea5p (20dB), mang l\u1ea1i s\u1ef1 y\u00ean t\u0129nh, kh\u00f4ng l\u00e0m \u1ea3nh h\u01b0\u1edfng \u0111\u1ebfn gi\u1ea5c ng\u1ee7 c\u1ee7a ng\u01b0\u1eddi d\u00f9ng. Ch\u1ebf \u0111\u1ed9 h\u00fat \u1ea9m : Ch\u1ebf \u0111\u1ed9 n\u00e0y gi\u00fap gi\u1ea3m thi\u1ec3u \u0111\u1ed9 \u1ea9m trong kh\u00f4ng kh\u00ed, mang \u0111\u1ebfn kh\u00f4ng gian tho\u00e1ng \u0111\u00e3ng v\u00e0 kh\u00f4 r\u00e1o, r\u1ea5t h\u1eefu \u00edch trong nh\u1eefng ng\u00e0y th\u1eddi ti\u1ebft n\u1ed3m \u1ea9m, m\u01b0a nhi\u1ec1u. \u0110\u00e8n LED tr\u00ean remote : Gi\u00fap ng\u01b0\u1eddi d\u00f9ng d\u1ec5 d\u00e0ng \u0111i\u1ec1u khi\u1ec3n thi\u1ebft b\u1ecb trong b\u00f3ng t\u1ed1i. T\u1ef1 kh\u1edfi \u0111\u1ed9ng l\u1ea1i khi m\u1ea5t \u0111i\u1ec7n : Trong tr\u01b0\u1eddng h\u1ee3p b\u1ecb m\u1ea5t \u0111i\u1ec7n \u0111\u1ed9t ng\u1ed9t, m\u00e1y l\u1ea1nh s\u1ebd t\u1ef1 \u0111\u1ed9ng v\u1eadn h\u00e0nh khi c\u00f3 \u0111i\u1ec7n tr\u1edf l\u1ea1i v\u1edbi ch\u1ebf \u0111\u1ed9 v\u00e0 m\u1ee9c nhi\u1ec7t tr\u01b0\u1edbc \u0111\u00f3. T\u1ef1 ch\u1ea9n \u0111o\u00e1n l\u1ed7i : Khi g\u1eb7p s\u1ef1 c\u1ed1 trong qu\u00e1 tr\u00ecnh ho\u1ea1t \u0111\u1ed9ng, m\u00e0n h\u00ecnh c\u1ee7a d\u00e0n l\u1ea1nh s\u1ebd hi\u1ec3n th\u1ecb m\u00e3 l\u1ed7i \u0111\u1ec3 ng\u01b0\u1eddi d\u00f9ng k\u1ecbp th\u1eddi nh\u1eadn bi\u1ebft v\u00e0 c\u00f3 ph\u01b0\u01a1ng \u00e1n kh\u1eafc ph\u1ee5c k\u1ecbp th\u1eddi. T\u00ednh n\u0103ng n\u00e0y s\u1ebd gi\u00fap ng\u01b0\u1eddi d\u00f9ng ti\u1ebft ki\u1ec7m \u0111\u01b0\u1ee3c \u0111\u00e1ng k\u1ec3 th\u1eddi gian v\u00e0 chi ph\u00ed s\u1eeda ch\u1eefa. \u0110i\u1ec1u h\u00f2a Comfee Inverter 12.000 BTU (1.5 HP) CFS-13VDGF-V c\u00f3 gi\u00e1 bao nhi\u00eau? Hi\u1ec7n t\u1ea1i, s\u1ea3n ph\u1ea9m m\u00e1y l\u1ea1nh Inverter 1.5 HP CFS-13VDGF-V c\u1ee7a Comfee \u0111ang \u0111\u01b0\u1ee3c b\u00e0y b\u00e1n t\u1ea1i c\u00e1c c\u1eeda h\u00e0ng Ho\u00e0ng H\u00e0 Mobile tr\u00ean to\u00e0n qu\u1ed1c v\u1edbi m\u1ee9c gi\u00e1 ni\u00eam y\u1ebft si\u00eau \u01b0u \u0111\u00e3i, tuy nhi\u00ean, m\u1ee9c gi\u00e1 c\u00f3 th\u1ec3 thay \u0111\u1ed5i t\u1ea1i t\u1eebng th\u1eddi \u0111i\u1ec3m t\u00f9y theo c\u00e1c ch\u00ednh s\u00e1ch khuy\u1ebfn m\u00e3i. N\u1ebfu c\u00f3 nhu c\u1ea7u s\u1edf h\u1eefu chi\u1ebfc \u0111i\u1ec1u h\u00f2a tuy\u1ec7t v\u1eddi n\u00e0y, kh\u00e1ch h\u00e0ng c\u00f3 th\u1ec3 gh\u00e9 ngay c\u00e1c chi nh\u00e1nh Ho\u00e0ng H\u00e0 Mobile ho\u1eb7c \u0111\u1eb7t mua qua website v\u00e0 hotline 1900 2091 \u0111\u1ec3 \u0111\u01b0\u1ee3c h\u1ed7 tr\u1ee3 mi\u1ec5n ph\u00ed giao h\u00e0ng. S\u1edf h\u1eefu s\u1ea3n ph\u1ea9m m\u00e1y l\u1ea1nh Comfee Inverter 12.000 BTU (1.5 HP) CFS-13VDGF-V ch\u00ednh h\u00e3ng t\u1ea1i Ho\u00e0ng H\u00e0 Mobile Ho\u00e0ng H\u00e0 Mobile l\u00e0 h\u1ec7 th\u1ed1ng b\u00e1n l\u1ebb h\u00e0ng \u0111\u1ea7u t\u1ea1i Vi\u1ec7t Nam, chuy\u00ean ph\u00e2n ph\u1ed1i c\u00e1c s\u1ea3n ph\u1ea9m \u0111i\u1ec1u h\u00f2a kh\u00f4ng kh\u00ed ch\u00ednh h\u00e3ng \u0111\u1ebfn t\u1eeb th\u01b0\u01a1ng hi\u1ec7u Comfee c\u0169ng nh\u01b0 nh\u1eefng th\u01b0\u01a1ng hi\u1ec7u h\u00e0ng \u0111\u1ea7u kh\u00e1c. B\u1eb1ng nh\u1eefng \u01b0u \u0111i\u1ec3m v\u01b0\u1ee3t tr\u1ed9i, s\u1ea3n ph\u1ea9m m\u00e1y l\u1ea1nh Comfee Inverter 12.000 BTU (1.5 HP) CFS-13VDGF-V ch\u1eafc ch\u1eafn s\u1ebd chinh ph\u1ee5c th\u00e0nh c\u00f4ng ngay c\u1ea3 nh\u1eefng ng\u01b0\u1eddi d\u00f9ng kh\u00f3 t\u00ednh nh\u1ea5t. H\u00e3y \u0111\u1ebfn ngay Ho\u00e0ng H\u00e0 Mobile \u0111\u1ec3 tr\u1edf th\u00e0nh ch\u1ee7 nh\u00e2n c\u1ee7a chi\u1ebfc \u0111i\u1ec1u h\u00f2a n\u00e0y v\u1edbi m\u1ee9c gi\u00e1 \u01b0u \u0111\u00e3i kh\u00f4ng ng\u1edd v\u00e0 nh\u1eadn v\u1ec1 v\u00f4 s\u1ed1 qu\u00e0 t\u1eb7ng c\u00f3 gi\u00e1 tr\u1ecb. Xem to\u00e0n b\u1ed9 b\u00e0i vi\u1ebft",
        "promotion_1": "1. Tr\u00fang 8386 qu\u00e0 - T\u1ed5ng gi\u00e1 tr\u1ecb t\u1edbi 250 TRI\u1ec6U \u0110\u1ed2NG (\u00c1p d\u1ee5ng t\u1eeb 10/01 - 02/02/2025). (Xem chi ti\u1ebft). 2. \u0110\u1eb7c bi\u1ec7t Tr\u1ea3 g\u00f3p 3 kh\u00f4ng: 0% l\u00e3i su\u1ea5t - 0 ph\u00ed chuy\u1ec3n \u0111\u1ed5i - 0 tr\u1ea3 tr\u01b0\u1edbc (\u00c1p d\u1ee5ng cho c\u00f4ng ty t\u00e0i ch\u00ednh v\u00e0 th\u1ebb t\u00edn d\u1ee5ng)",
        "promotion_2": "1. Gi\u1ea3m t\u1edbi 500.000\u0111 khi thanh to\u00e1n th\u1ebb t\u00edn d\u1ee5ng NCB. (Xem chi ti\u1ebft). 2. Gi\u1ea3m \u0111\u1ebfn 150.000\u0111 khi thanh to\u00e1n qua Muadee. (Xem chi ti\u1ebft). 3. Mi\u1ec5n ph\u00ed chuy\u1ec3n \u0111\u1ed5i tr\u1ea3 g\u00f3p ho\u1eb7c gi\u1ea3m \u0111\u1ebfn 500.000\u0111 khi m\u1edf th\u1ebb TPBank EVO. (Xem chi ti\u1ebft). 4. M\u1edf th\u1ebb t\u00edn d\u1ee5ng VIB - Nh\u1eadn Voucher 600.000\u0111. (Xem chi ti\u1ebft). 5. M\u1edf th\u1ebb HSBC - Ho\u00e0n ti\u1ec1n t\u1edbi 2 tri\u1ec7u \u0111\u1ed3ng. (Xem chi ti\u1ebft)"
    },
    {
        "title": "\u0110i\u1ec1u h\u00f2a Comfee Inverter 18.000 BTU (2 HP) CFS-18VDGF-V",
        "price": "gi\u00e1 hi\u1ec7n t\u1ea1i l\u00e0 9,970,000 \u20ab nh\u01b0ng tr\u01b0\u1edbc \u0111\u00e2y n\u00f3 c\u00f3 gi\u00e1 l\u00e0 11,490,000 \u20ab",
        "colors": "Tr\u1eafng",
        "technical_specifications": [
            {
                "Lo\u1ea1i m\u00e1y": "1 chi\u1ec1u (ch\u1ec9 l\u00e0m l\u1ea1nh)"
            },
            {
                "C\u00f4ng ngh\u1ec7 inverter": "M\u00e1y l\u1ea1nh Inverter"
            },
            {
                "C\u00f4ng su\u1ea5t l\u00e0m l\u1ea1nh": "2 HP - 18.000 BTU"
            },
            {
                "Ph\u1ea1m vi l\u00e0m l\u1ea1nh hi\u1ec7u qu\u1ea3": "T\u1eeb 20 - 30m\u00b2 (t\u1eeb 60 \u0111\u1ebfn 80m\u00b3)"
            },
            {
                "Nh\u00e3n n\u0103ng l\u01b0\u1ee3ng": "5 sao (Hi\u1ec7u su\u1ea5t n\u0103ng l\u01b0\u1ee3ng 4.87)"
            }
        ],
        "description": "M\u00e1y l\u1ea1nh Comfee Inverter 2 HP CFS-18VDGF-V l\u00e0 m\u1ed9t s\u1ea3n ph\u1ea9m \u0111i\u1ec1u h\u00f2a kh\u00f4ng kh\u00ed 1 chi\u1ec1u th\u1ebf h\u1ec7 m\u1edbi \u0111\u1ebfn t\u1eeb th\u01b0\u01a1ng hi\u1ec7u Comfee l\u1eebng danh c\u1ee7a \u00dd. V\u1edbi nh\u1eefng c\u00f4ng ngh\u1ec7 l\u00e0m l\u1ea1nh h\u00e0ng \u0111\u1ea7u nh\u01b0 Hyper Tech , ch\u1ebf \u0111\u1ed9 Breeze Away , c\u00f4ng ngh\u1ec7 b\u1ee9c x\u1ea1 nhi\u1ec7t l\u1ea1nh ICE Circuit ,... k\u1ebft h\u1ee3p c\u00f9ng m\u00e0ng l\u1ecdc k\u00e9p Dual Filtration , s\u1ea3n ph\u1ea9m kh\u00f4ng nh\u1eefng mang l\u1ea1i hi\u1ec7u qu\u1ea3 l\u00e0m m\u00e1t t\u1ed1i \u01b0u m\u00e0 c\u00f2n c\u00f3 kh\u1ea3 n\u0103ng thanh l\u1ecdc kh\u00f4ng kh\u00ed, gi\u00fap c\u1ea3i thi\u1ec7n ch\u1ea5t l\u01b0\u1ee3ng kh\u00f4ng gian s\u1ed1ng. \u0110\u1eb7c bi\u1ec7t h\u01a1n, s\u1ea3n ph\u1ea9m c\u00f2n \u0111\u01b0\u1ee3c t\u00edch h\u1ee3p c\u00f4ng ngh\u1ec7 AI Cool v\u00e0 h\u1ed7 tr\u1ee3 k\u1ebft n\u1ed1i Wifi , cho ph\u00e9p ng\u01b0\u1eddi d\u00f9ng \u0111i\u1ec1u khi\u1ec3n b\u1eb1ng gi\u1ecdng n\u00f3i ho\u1eb7c th\u00f4ng qua \u1ee9ng d\u1ee5ng SmartHome , mang \u0111\u1ebfn nh\u1eefng tr\u1ea3i nghi\u1ec7m s\u1eed d\u1ee5ng ti\u1ec7n nghi v\u00e0 \u0111\u1ea7y th\u00fa v\u1ecb. \u0110\u1eb7c \u0111i\u1ec3m n\u1ed5i b\u1eadt Ki\u1ec3u d\u00e1ng g\u1ecdn g\u00e0ng v\u00e0 \u0111\u1eb9p m\u1eaft, trang b\u1ecb m\u00e0n h\u00ecnh c\u1ea3m bi\u1ebfn \u00e1nh s\u00e1ng tr\u00ean b\u1ec1 m\u1eb7t d\u00e0n l\u1ea1nh. C\u00f4ng su\u1ea5t ho\u1ea1t \u0111\u1ed9ng 2HP l\u00e0m m\u00e1t hi\u1ec7u qu\u1ea3 trong nh\u1eefng kh\u00f4ng gian d\u01b0\u1edbi 30m2. L\u00e0m l\u1ea1nh nhanh ch\u00f3ng trong th\u1eddi gian ng\u1eafn v\u1edbi c\u00f4ng ngh\u1ec7 Hyper Tech. T\u00edch h\u1ee3p c\u00f4ng ngh\u1ec7 AI Cool v\u00e0 h\u1ed7 tr\u1ee3 k\u1ebft n\u1ed1i Wifi, cho ph\u00e9p \u0111i\u1ec1u khi\u1ec3n b\u1eb1ng gi\u1ecdng n\u00f3i ho\u1eb7c qua \u1ee9ng d\u1ee5ng SmartHome. M\u00e0ng l\u1ecdc k\u00e9p Dual t\u0103ng c\u01b0\u1eddng kh\u1ea3 n\u0103ng kh\u1eed khu\u1ea9n v\u00e0 thanh l\u1ecdc kh\u00f4ng kh\u00ed. Ti\u1ebft ki\u1ec7m \u0111i\u1ec7n n\u0103ng v\u1edbi c\u00f4ng ngh\u1ec7 Inverter k\u1ebft h\u1ee3p c\u00f9ng b\u1ed9 x\u1eed l\u00fd E-Max. B\u1ea3ng th\u00f4ng s\u1ed1 k\u1ef9 thu\u1eadt c\u1ee7a m\u00e1y l\u1ea1nh Comfee Inverter 2 HP CFS-18VDGF-V Th\u00f4ng s\u1ed1 Chi ti\u1ebft Lo\u1ea1i m\u00e1y \u0110i\u1ec1u h\u00f2a 1 chi\u1ec1u (ch\u1ec9 l\u00e0m l\u1ea1nh) C\u00f4ng su\u1ea5t l\u00e0m l\u1ea1nh 2 HP - 18.000 BTU Ph\u1ea1m vi l\u00e0m l\u1ea1nh hi\u1ec7u qu\u1ea3 T\u1eeb 20 - 30m\u00b2 (t\u1eeb 60 \u0111\u1ebfn 80m\u00b3) K\u00edch th\u01b0\u1edbc v\u00e0 tr\u1ecdng l\u01b0\u1ee3ng d\u00e0n l\u1ea1nh D\u00e0i 96.9 cm - Cao 32 cm - D\u00e0y 24.1 cm - N\u1eb7ng 11.9 kg K\u00edch th\u01b0\u1edbc v\u00e0 tr\u1ecdng l\u01b0\u1ee3ng d\u00e0n n\u00f3ng D\u00e0i 76.5 cm - Cao 55.5 cm - D\u00e0y 30.3 cm - N\u1eb7ng 27.2 kg \u0110\u1ed9 \u1ed3n trung b\u00ecnh 42.5/36/32.5 dB Lo\u1ea1i gas R-32 Ti\u00eau th\u1ee5 \u0111i\u1ec7n 1.65 kW/h C\u00f4ng ngh\u1ec7 ti\u1ebft ki\u1ec7m \u0111i\u1ec7n Eco Bi\u1ebfn t\u1ea7n Inverter v\u1edbi b\u1ed9 vi x\u1eed l\u00fd E-Max Kh\u1ea3 n\u0103ng l\u1ecdc b\u1ee5i, kh\u00e1ng khu\u1ea9n, kh\u1eed m\u00f9i M\u00e0ng l\u1ecdc k\u00e9p Dual: L\u1ecdc b\u1ee5i 0.7 mm, l\u1ecdc m\u00f9i Ch\u1ebf \u0111\u1ed9 gi\u00f3 \u0110i\u1ec1u khi\u1ec3n l\u00ean xu\u1ed1ng t\u1ef1 \u0111\u1ed9ng, tr\u00e1i ph\u1ea3i t\u00f9y ch\u1ec9nh tay C\u00f4ng ngh\u1ec7 l\u00e0m l\u1ea1nh nhanh Hyper Tech Ti\u1ec7n \u00edch T\u1ef1 kh\u1edfi \u0111\u1ed9ng l\u1ea1i khi c\u00f3 \u0111i\u1ec7n Remote c\u00f3 \u0111\u00e8n LED C\u1ea3m bi\u1ebfn nhi\u1ec7t \u0111\u1ed9 Follow Me C\u00f4ng ngh\u1ec7 b\u1ee9c x\u1ea1 nhi\u1ec7t l\u1ea1nh Ice-Circuit Ch\u1ee9c n\u0103ng t\u1ef1 ch\u1ea9n \u0111o\u00e1n l\u1ed7i Ch\u1ebf \u0111\u1ed9 t\u1ef1 l\u00e0m s\u1ea1ch Active-Clean Ch\u1ebf \u0111\u1ed9 ti\u1ebft ki\u1ec7m ch\u1ee7 \u0111\u1ed9ng Gear mode Ch\u1ebf \u0111\u1ed9 ng\u1ee7 \u0111\u00eam Sleep M\u00e0n h\u00ecnh hi\u1ec3n th\u1ecb nhi\u1ec7t \u0111\u1ed9 Ch\u1ee9c n\u0103ng h\u00fat \u1ea9m H\u1eb9n gi\u1edd b\u1eadt t\u1eaft m\u00e1y Ch\u1ebf \u0111\u1ed9 ch\u1ec9 s\u1eed d\u1ee5ng qu\u1ea1t Fan Only - ch\u1ec9 l\u00e0m m\u00e1t C\u00f4ng ngh\u1ec7 AI Cool - \u0111i\u1ec1u khi\u1ec3n thi\u1ebft b\u1ecb b\u1eb1ng gi\u1ecdng n\u00f3i v\u00e0\u00a0 SmartPhone Ch\u1ebf \u0111\u1ed9 Avoid Me (Breeze Away) D\u00f2ng \u0111i\u1ec7n v\u00e0o D\u00e0n l\u1ea1nh D\u00f2ng \u0111i\u1ec7n ho\u1ea1t \u0111\u1ed9ng 1 pha S\u1ed1 l\u01b0\u1ee3ng k\u1ebft n\u1ed1i d\u00e0n l\u1ea1nh t\u1ed1i \u0111a 1 \u0110\u00e1nh gi\u00e1 chi ti\u1ebft s\u1ea3n ph\u1ea9m \u0111i\u1ec1u h\u00f2a Comfee Inverter 2 HP CFS-18VDGF-V B\u1ea1n \u0111ang t\u00ecm ki\u1ebfm m\u1ed9t thi\u1ebft b\u1ecb l\u00e0m m\u00e1t hi\u1ec7n \u0111\u1ea1i, v\u1eeba ti\u1ebft ki\u1ec7m \u0111i\u1ec7n hi\u1ec7u qu\u1ea3, v\u1eeba s\u1edf h\u1eefu nhi\u1ec1u t\u00ednh n\u0103ng h\u1eefu \u00edch v\u00e0 th\u00f4ng minh? M\u00e1y l\u1ea1nh Inverter 2 HP CFS-18VDGF-V c\u1ee7a th\u01b0\u01a1ng hi\u1ec7u Comfee ch\u00ednh l\u00e0 s\u1ef1 l\u1ef1a ch\u1ecdn l\u00fd t\u01b0\u1edfng d\u00e0nh cho b\u1ea1n. V\u1edbi ki\u1ec3u d\u00e1ng sang tr\u1ecdng, t\u00edch h\u1ee3p c\u00f4ng ngh\u1ec7 Inverter ti\u00ean ti\u1ebfn c\u00f9ng h\u00e0ng lo\u1ea1t t\u00ednh n\u0103ng \u01b0u vi\u1ec7t, s\u1ea3n ph\u1ea9m n\u00e0y s\u1ebd mang \u0111\u1ebfn cho gia \u0111\u00ecnh b\u1ea1n kh\u00f4ng gian s\u1ed1ng ti\u1ec7n nghi v\u00e0 tho\u1ea3i m\u00e1i nh\u1ea5t. M\u00e1y l\u1ea1nh Comfee Inverter 2 HP CFS-18VDGF-V s\u1edf h\u1eefu thi\u1ebft k\u1ebf t\u1ed1i gi\u1ea3n, sang tr\u1ecdng T\u01b0\u01a1ng t\u1ef1 nh\u1eefng m\u1eabu \u0111i\u1ec1u h\u00f2a trong c\u00f9ng th\u01b0\u01a1ng hi\u1ec7u, chi\u1ebfc \u0111i\u1ec1u h\u00f2a Comfee\u00a0 CFS-18VDGF-V s\u1edf h\u1eefu v\u1ebb ngo\u00e0i t\u1ed1i gi\u1ea3n, thi\u1ebft k\u1ebf d\u1ea1ng h\u00ecnh h\u1ed9p ch\u1eef nh\u1eadt n\u1eb1m ngang c\u00f9ng gam m\u00e0u tr\u1eafng trung t\u00ednh, d\u1ec5 d\u00e0ng k\u1ebft h\u1ee3p v\u1edbi nh\u1eefng s\u1ea3n ph\u1ea9m n\u1ed9i th\u1ea5t kh\u00e1c \u0111\u1ec3 t\u1ea1o n\u00ean t\u1ed5ng th\u1ec3 h\u00e0i h\u00f2a cho kh\u00f4ng gian. \u0110i\u1ec3m nh\u1ea5n n\u1ed5i b\u1eadt ch\u00ednh l\u00e0 m\u00e0n h\u00ecnh LCD hi\u1ec3n th\u1ecb nhi\u1ec7t \u0111\u1ed9 t\u00edch h\u1ee3p c\u1ea3m bi\u1ebfn \u00e1nh s\u00e1ng \u0111\u01b0\u1ee3c trang b\u1ecb tr\u00ean b\u1ec1 m\u1eb7t d\u00e0n l\u1ea1nh. Khi \u00e1nh s\u00e1ng t\u1eeb m\u00f4i tr\u01b0\u1eddng xung quanh gi\u1ea3m xu\u1ed1ng, c\u1ea3m bi\u1ebfn s\u1ebd t\u1ef1 \u0111\u1ed9ng \u0111\u01b0\u1ee3c k\u00edch ho\u1ea1t, l\u00e0m gi\u1ea3m b\u1edbt \u0111\u1ed9 s\u00e1ng ho\u1eb7c t\u1eaft h\u1eb3n m\u00e0n h\u00ecnh hi\u1ec3n th\u1ecb v\u00e0 \u00e2m thanh b\u00e1o hi\u1ec7u, mang l\u1ea1i kh\u00f4ng gian y\u00ean t\u0129nh \u0111\u1ec3 ng\u01b0\u1eddi d\u00f9ng t\u1eadp trung l\u00e0m vi\u1ec7c ho\u1eb7c ngh\u1ec9 ng\u01a1i, th\u01b0 gi\u00e3n. H\u1ec7 th\u1ed1ng l\u00e1 t\u1ea3n nhi\u1ec7t \u1edf b\u00ean trong d\u00e0n n\u00f3ng v\u00e0 d\u00e0n l\u1ea1nh \u0111\u01b0\u1ee3c bao ph\u1ee7 b\u1edfi l\u1edbp b\u1ea3o v\u1ec7 Golden Coating, c\u00f3 t\u00e1c d\u1ee5ng ch\u1ed1ng \u0103n m\u00f2n v\u00e0 l\u00e0m ch\u1eadm qu\u00e1 tr\u00ecnh oxy h\u00f3a, \u0111\u1ed3ng th\u1eddi ng\u0103n ch\u1eb7n s\u1ef1 ph\u00e1t tri\u1ec3n c\u1ee7a c\u00e1c lo\u1ea1i vi khu\u1ea9n, n\u1ea5m m\u1ed1c. Kh\u00f4ng nh\u1eefng v\u1eady, l\u1edbp v\u1ecf c\u1ee7a d\u00e0n n\u00f3ng c\u0169ng \u0111\u01b0\u1ee3c bao ph\u1ee7 3 l\u1edbp b\u1ea3o v\u1ec7 gi\u00fap t\u0103ng c\u01b0\u1eddng kh\u1ea3 n\u0103ng ch\u1ed1ng ch\u1ecdi tr\u01b0\u1edbc nh\u1eefng \u0111i\u1ec1u ki\u1ec7n m\u00f4i tr\u01b0\u1eddng kh\u1eafc nghi\u1ec7t. Qua \u0111\u00f3 \u0111\u1ea3m b\u1ea3o c\u00e1c chi ti\u1ebft linh ki\u1ec7n b\u00ean trong \u0111i\u1ec1u h\u00f2a Comfee Inverter 2 HP CFS-18VDGF-V \u0111\u01b0\u1ee3c b\u1ea3o v\u1ec7 m\u1ed9t c\u00e1ch t\u1ed1t nh\u1ea5t, gia t\u0103ng \u0111\u1ed9 b\u1ec1n b\u1ec9 v\u00e0 k\u00e9o d\u00e0i tu\u1ed5i th\u1ecd s\u1ea3n ph\u1ea9m, \u0111\u1ed3ng th\u1eddi gi\u1ea3m thi\u1ec3u nh\u1eefng kho\u1ea3n chi ph\u00ed cho vi\u1ec7c s\u1eeda ch\u1eefa v\u00e0 thay th\u1ebf. \u0110i\u1ec1u h\u00f2a Comfee CFS-18VDGF-V ho\u1ea1t \u0111\u1ed9ng v\u1edbi c\u00f4ng su\u1ea5t 2HP t\u01b0\u01a1ng \u0111\u01b0\u01a1ng 18.000 BTU, cho hi\u1ec7u qu\u1ea3 l\u00e0m m\u00e1t t\u1ed1t nh\u1ea5t trong kh\u00f4ng gian c\u00f3 ph\u1ea1m vi t\u1eeb 20 \u2013 30m\u00b2 ho\u1eb7c th\u1ec3 t\u00edch ph\u00f2ng t\u1eeb 60 - 80m\u00b3. H\u1ed7 tr\u1ee3 \u0111i\u1ec1u khi\u1ec3n t\u1eeb xa b\u1eb1ng gi\u1ecdng n\u00f3i ho\u1eb7c s\u1eed d\u1ee5ng smartphone Ch\u1ec9 b\u1eb1ng m\u1ed9t v\u00e0i thao t\u00e1c \u0111\u0103ng nh\u1eadp \u0111\u01a1n gi\u1ea3n v\u00e0 nhanh ch\u00f3ng tr\u00ean \u1ee9ng d\u1ee5ng SmartHome, chi\u1ebfc m\u00e1y l\u1ea1nh Comfee Inverter 2 HP CFS-18VDGF-V s\u1ebd hi\u1ec3u v\u00e0 cho ph\u00e9p ng\u01b0\u1eddi d\u00f9ng ho\u00e0n to\u00e0n ch\u1ee7 \u0111\u1ed9ng trong vi\u1ec7c \u0111i\u1ec1u khi\u1ec3n t\u1eeb xa th\u00f4ng qua gi\u1ecdng n\u00f3i. Ch\u1ec9 c\u1ea7n ra kh\u1ea9u l\u1ec7nh, ng\u01b0\u1eddi d\u00f9ng c\u00f3 th\u1ec3 d\u1ec5 d\u00e0ng ki\u1ec3m tra xem t\u00ecnh tr\u1ea1ng thi\u1ebft b\u1ecb \u1edf nh\u00e0 \u0111ang t\u1eaft hay m\u1edf, nhi\u1ec7t \u0111\u1ed9 \u0111ang \u1edf m\u1ee9c bao nhi\u00eau\u2026 T\u1eeb \u0111\u00f3, ng\u01b0\u1eddi d\u00f9ng c\u00f3 th\u1ec3 tho\u1ea3i m\u00e1i th\u1ef1c hi\u1ec7n c\u00e1c c\u00e2u l\u1ec7nh \u0111\u1ec3 \u0111i\u1ec1u khi\u1ec3n thi\u1ebft b\u1ecb d\u00f9 \u1edf b\u1ea5t c\u1ee9 \u0111\u00e2u. Ngo\u00e0i ra, \u0111i\u1ec1u h\u00f2a c\u00f2n h\u1ed7 tr\u1ee3 k\u1ebft n\u1ed1i Wifi, cho ph\u00e9p ng\u01b0\u1eddi d\u00f9ng k\u1ebft n\u1ed1i thi\u1ebft b\u1ecb v\u1edbi smartphone v\u00e0 \u0111i\u1ec1u khi\u1ec3n m\u1ecdi t\u00ednh n\u0103ng ngay tr\u00ean \u1ee9ng d\u1ee5ng SmartHome. \u0110i\u1ec1u n\u00e0y gi\u00fap ng\u01b0\u1eddi d\u00f9ng ch\u1ee7 \u0111\u1ed9ng h\u01a1n trong vi\u1ec7c \u0111i\u1ec1u khi\u1ec3n thi\u1ebft b\u1ecb, c\u00f3 th\u1ec3 t\u1eaft m\u00e1y khi \u0111\u00e3 ra kh\u1ecfi nh\u00e0 n\u1ebfu ch\u1eb3ng may b\u1ecb qu\u00ean, ho\u1eb7c b\u1eadt m\u00e1y tr\u01b0\u1edbc khi tr\u1edf v\u1ec1 \u0111\u1ec3 nhanh ch\u00f3ng t\u1eadn h\u01b0\u1edfng kh\u00f4ng gian m\u00e1t m\u1ebb, d\u1ec5 ch\u1ecbu ngay khi b\u01b0\u1edbc v\u00e0o ph\u00f2ng. \u0110i\u1ec1u h\u00f2a Comfee Inverter 2 HP CFS-18VDGF-V v\u1eadn h\u00e0nh b\u1ec1n b\u1ec9, ti\u1ebft ki\u1ec7m \u0111i\u1ec7n v\u1edbi c\u00f4ng ngh\u1ec7 Inverter v\u00e0 b\u1ed9 x\u1eed l\u00fd E-Max \u0110i\u1ec1u h\u00f2a Comfee CFS-18VDGF-V \u0111\u01b0\u1ee3c t\u00edch h\u1ee3p c\u00f4ng ngh\u1ec7 bi\u1ebfn t\u1ea7n Inverter, k\u1ebft h\u1ee3p c\u00f9ng b\u1ed9 vi x\u1eed l\u00fd E-Max \u0111\u1ea3m b\u1ea3o m\u00e1y n\u00e9n lu\u00f4n ho\u1ea1t \u0111\u1ed9ng li\u00ean t\u1ee5c v\u00e0 \u1ed5n \u0111\u1ecbnh \u1edf t\u1ed1c \u0111\u1ed9 c\u1ef1c th\u1ea5p ch\u1ec9 12Hz. \u0110i\u1ec1u n\u00e0y kh\u00f4ng ch\u1ec9 gi\u00fap gi\u1ea3m hao ph\u00ed \u0111i\u1ec7n n\u0103ng m\u00e0 c\u00f2n gi\u00fap m\u00e1y n\u00e9n v\u1eadn h\u00e0nh b\u1ec1n b\u1ec9 v\u00e0 \u00eam \u00e1i h\u01a1n g\u1ea5p 16 l\u1ea7n so v\u1edbi nh\u1eefng d\u00f2ng s\u1ea3n ph\u1ea9m tr\u01b0\u1edbc c\u1ee7a h\u00e3ng. Trong nh\u1eefng ng\u00e0y th\u1eddi ti\u1ebft n\u00f3ng n\u1ef1c, c\u00e1c thi\u1ebft b\u1ecb l\u00e0m l\u1ea1nh g\u1ea7n nh\u01b0 ph\u1ea3i ho\u1ea1t \u0111\u1ed9ng h\u1ebft c\u00f4ng su\u1ea5t, k\u00e9o theo \u0111\u00f3 l\u00e0 n\u1ed7i lo v\u1ec1 chi ph\u00ed ti\u1ec1n \u0111i\u1ec7n. V\u1edbi chi\u1ebfc m\u00e1y l\u1ea1nh Comfee Inverter 2 HP CFS-18VDGF-V, ng\u01b0\u1eddi d\u00f9ng c\u00f3 th\u1ec3 y\u00ean t\u00e2m t\u1eadn h\u01b0\u1edfng kh\u00f4ng kh\u00ed m\u00e1t m\u1ebb, d\u1ec5 ch\u1ecbu su\u1ed1t c\u1ea3 ng\u00e0y m\u00e0 kh\u00f4ng lo t\u1ed1n k\u00e9m chi ph\u00ed, ch\u1ec9 v\u1edbi m\u1ed9t n\u00fat nh\u1ea5n tr\u00ean remote \u0111\u1ec3 k\u00edch ho\u1ea1t ch\u1ebf \u0111\u1ed9 \"Eco\". \u1ede ch\u1ebf \u0111\u1ed9 n\u00e0y, thi\u1ebft b\u1ecb s\u1ebd t\u1ef1 \u0111\u1ed9ng \u0111i\u1ec1u ch\u1ec9nh nh\u1eefng th\u00f4ng s\u1ed1 ho\u1ea1t \u0111\u1ed9ng nh\u1eb1m t\u1ed1i \u01b0u h\u00f3a hi\u1ec7u qu\u1ea3 s\u1eed d\u1ee5ng n\u0103ng l\u01b0\u1ee3ng, gi\u00fap ti\u1ebft ki\u1ec7m \u0111\u1ebfn 71% \u0111i\u1ec7n n\u0103ng so v\u1edbi m\u00e1y l\u1ea1nh th\u00f4ng th\u01b0\u1eddng. B\u00ean c\u1ea1nh \u0111\u00f3, s\u1ea3n ph\u1ea9m c\u0169ng \u0111\u01b0\u1ee3c t\u00edch h\u1ee3p ch\u1ebf \u0111\u1ed9 Gear Mode, gi\u00fap ng\u01b0\u1eddi d\u00f9ng ch\u1ee7 \u0111\u1ed9ng h\u01a1n trong vi\u1ec7c ti\u1ebft ki\u1ec7m \u0111i\u1ec7n n\u0103ng. Ch\u1ebf \u0111\u1ed9 n\u00e0y \u0111\u01b0\u1ee3c thi\u1ebft k\u1ebf v\u1edbi 3 m\u1ee9c c\u00f4ng su\u1ea5t: 50%, 75% v\u00e0 100%. T\u00f9y theo kh\u00f4ng gian, s\u1ed1 l\u01b0\u1ee3ng ng\u01b0\u1eddi trong ph\u00f2ng c\u0169ng nh\u01b0 nhu c\u1ea7u s\u1eed d\u1ee5ng m\u00e0 ng\u01b0\u1eddi d\u00f9ng c\u00f3 th\u1ec3 l\u1ef1a ch\u1ecdn m\u1ee9c c\u00f4ng su\u1ea5t ph\u00f9 h\u1ee3p nh\u1eb1m h\u1ea1n ch\u1ebf vi\u1ec7c l\u00e3ng ph\u00ed \u0111i\u1ec7n n\u0103ng. Kh\u00e1ng khu\u1ea9n v\u00e0 kh\u1eed m\u00f9i hi\u1ec7u qu\u1ea3 v\u1edbi b\u1ed9 l\u1ecdc k\u00e9p Dual Filtration \u0110i\u1ec1u h\u00f2a Comfee Inverter 2 HP CFS-18VDGF-V \u0111\u01b0\u1ee3c trang b\u1ecb b\u1ed9 l\u1ecdc k\u00e9p Dual Filtration, bao g\u1ed3m m\u00e0ng l\u1ecdc m\u00f9i v\u00e0 m\u00e0ng l\u1ecdc b\u1ee5i, gi\u00fap thanh l\u1ecdc kh\u00f4ng kh\u00ed m\u1ed9t c\u00e1ch hi\u1ec7u qu\u1ea3. Ban \u0111\u1ea7u, khi kh\u00f4ng kh\u00ed \u0111i qua m\u00e0ng l\u1ecdc b\u1ee5i, nh\u1eefng h\u1ea1t b\u1ee5i c\u00f3 k\u00edch th\u01b0\u1edbc l\u1edbn t\u1eeb 0.7-0.75 mm s\u1ebd \u0111\u01b0\u1ee3c gi\u1eef l\u1ea1i tr\u00ean m\u00e0ng l\u1ecdc v\u00e0 lo\u1ea1i b\u1ecf tri\u1ec7t \u0111\u1ec3. Sau \u0111\u00f3, kh\u00f4ng kh\u00ed s\u1ebd ti\u1ebfp t\u1ee5c \u0111i qua l\u1edbp l\u1ecdc m\u00f9i \u0111\u01b0\u1ee3c b\u1ed5 sung tinh ch\u1ea5t than ho\u1ea1t t\u00ednh. T\u1ea1i \u0111\u00e2y, c\u00e1c ch\u1ea5t \u0111\u1ed9c h\u1ea1i s\u1ebd b\u1ecb h\u1ea5p th\u1ee5 v\u00e0 ph\u00e2n h\u1ee7y, t\u1eeb \u0111\u00f3 gi\u1ea3m thi\u1ec3u kh\u1ea3 n\u0103ng g\u00e2y d\u1ecb \u1ee9ng v\u00e0 nh\u1eefng b\u1ec7nh v\u1ec1 \u0111\u01b0\u1eddng h\u00f4 h\u1ea5p, tr\u1ea3 l\u1ea1i b\u1ea7u kh\u00f4ng kh\u00ed trong l\u00e0nh v\u00e0 s\u1ea1ch s\u1ebd cho kh\u00f4ng gian s\u1ed1ng c\u1ee7a ng\u01b0\u1eddi d\u00f9ng. C\u01a1 ch\u1ebf l\u00e0m l\u1ea1nh th\u00f4ng minh c\u1ee7a m\u00e1y l\u1ea1nh Comfee Inverter 2 HP CFS-18VDGF-V Chi\u1ebfc m\u00e1y l\u1ea1nh Comfee CFS-18VDGF-V \u0111\u01b0\u1ee3c t\u00edch h\u1ee3p nh\u1eefng c\u01a1 ch\u1ebf l\u00e0m l\u1ea1nh th\u00f4ng minh, mang l\u1ea1i cho ng\u01b0\u1eddi d\u00f9ng nh\u1eefng tr\u1ea3i nghi\u1ec7m s\u1eed d\u1ee5ng t\u1ed1i \u01b0u nh\u1ea5t. \u0110\u1ea7u ti\u00ean ph\u1ea3i k\u1ec3 \u0111\u1ebfn ch\u00ednh l\u00e0 ch\u1ebf \u0111\u1ed9 l\u00e0m l\u1ea1nh nhanh Hyper Tech. Khi ch\u1ebf \u0111\u1ed9 n\u00e0y \u0111\u01b0\u1ee3c k\u00edch ho\u1ea1t, m\u00e1y n\u00e9n s\u1ebd kh\u1edfi \u0111\u1ed9ng ngay l\u1eadp t\u1ee9c v\u1edbi t\u1ed1c \u0111\u1ed9 c\u1ef1c cao nh\u1eb1m \u0111\u1ea1t \u0111\u01b0\u1ee3c t\u1ea7n s\u1ed1 t\u1ed1i \u0111a (65Hz) trong v\u00f2ng 6 gi\u00e2y, \u0111\u1ea3m b\u1ea3o nhi\u1ec7t \u0111\u1ed9 trong ph\u00f2ng \u0111\u1ea1t \u0111\u01b0\u1ee3c m\u1ee9c nhi\u1ec7t m\u00e0 ng\u01b0\u1eddi d\u00f9ng mong mu\u1ed1n ch\u1ec9 trong 40 gi\u00e2y. Ng\u01b0\u1eddi d\u00f9ng c\u00f3 th\u1ec3 tho\u1ea3i m\u00e1i \u0111\u1eafm ch\u00ecm trong kh\u00f4ng gian tho\u00e1ng \u0111\u00e3ng v\u00e0 s\u1ea3ng kho\u00e1i m\u00e0 kh\u00f4ng ph\u1ea3i ch\u1edd \u0111\u1ee3i qu\u00e1 l\u00e2u, \u0111\u1eb7c bi\u1ec7t l\u00e0 trong nh\u1eefng ng\u00e0y kh\u00ed h\u1eadu n\u00f3ng n\u1ef1c. Ti\u1ebfp \u0111\u1ebfn l\u00e0 ch\u1ebf \u0111\u1ed9 Breeze Away cho ph\u00e9p ng\u01b0\u1eddi d\u00f9ng ch\u1ee7 \u0111\u1ed9ng \u0111i\u1ec1u ch\u1ec9nh h\u01b0\u1edbng gi\u00f3 \u0111\u1ec3 lu\u1ed3ng kh\u00ed l\u1ea1nh kh\u00f4ng th\u1ed5i tr\u1ef1c ti\u1ebfp v\u00e0o ng\u01b0\u1eddi. \u0110\u00e2y l\u00e0 m\u1ed9t t\u00ednh n\u0103ng h\u1eefu \u00edch, \u0111\u1eb7c bi\u1ec7t l\u00e0 v\u00e0o ban \u0111\u00eam, gi\u00fap h\u1ea1n ch\u1ebf t\u00ecnh tr\u1ea1ng kh\u00f4 da, h\u1ea1 th\u00e2n nhi\u1ec7t, ngh\u1eb9t m\u0169i, \u0111au \u0111\u1ea7u do b\u1ecb gi\u00f3 l\u1ea1nh th\u1ed5i tr\u1ef1c ti\u1ebfp khi ng\u1ee7, ph\u00f2ng tr\u00e1nh nguy c\u01a1 m\u1eafc c\u00e1c b\u1ec7nh v\u1ec1 \u0111\u01b0\u1eddng h\u00f4 h\u1ea5p. M\u00e1y l\u1ea1nh Comfee Inverter 2 HP CFS-18VDGF-V ho\u1ea1t \u0111\u1ed9ng v\u1edbi d\u00e3y \u0111i\u1ec7n \u00e1p 150V - 260V nh\u1edd \u0111\u01b0\u1ee3c trang b\u1ecb bo m\u1ea1ch ngu\u1ed3n (PCB) c\u1ea3i ti\u1ebfn. Do \u0111\u00f3, thi\u1ebft b\u1ecb c\u00f3 kh\u1ea3 n\u0103ng t\u01b0\u01a1ng th\u00edch linh ho\u1ea1t v\u1edbi \u0111i\u1ec7n \u00e1p cao ho\u1eb7c th\u1ea5p, duy tr\u00ec ho\u1ea1t \u0111\u1ed9ng \u1ed5n \u0111\u1ecbnh m\u00e0 kh\u00f4ng c\u1ea7n s\u1eed d\u1ee5ng \u0111\u1ebfn \u1ed5n \u00e1p ri\u00eang. Ngo\u00e0i ra, d\u00e0n n\u00f3ng c\u1ee7a m\u00e1y l\u1ea1nh Comfee CFS-18VDGF-V c\u00f2n \u0111\u01b0\u1ee3c \u1ee9ng d\u1ee5ng c\u00f4ng ngh\u1ec7 b\u1ee9c x\u1ea1 nhi\u1ec7t l\u1ea1nh ICE Circuit, gi\u00fap t\u0103ng c\u01b0\u1eddng hi\u1ec7u su\u1ea5t l\u00e0m l\u1ea1nh c\u1ee7a m\u00e1y trong nh\u1eefng m\u00f4i tr\u01b0\u1eddng c\u00f3 \u0111i\u1ec1u ki\u1ec7n kh\u1eafc nghi\u1ec7t. \u0110i\u1ec1u h\u00f2a Comfee Inverter 2 HP CFS-18VDGF-V c\u00f3 kh\u1ea3 n\u0103ng t\u1ef1 \u0111\u1ed9ng l\u00e0m s\u1ea1ch Active Clean l\u00e0 m\u1ed9t trong nh\u1eefng t\u00ednh n\u0103ng th\u00f4ng minh v\u00e0 c\u1ef1c k\u1ef3 h\u1eefu \u00edch \u0111\u01b0\u1ee3c trang b\u1ecb tr\u00ean chi\u1ebfc \u0111i\u1ec1u h\u00f2a Comfee CFS-18VDGF-V. Khi ch\u1ebf \u0111\u1ed9 n\u00e0y \u0111\u01b0\u1ee3c k\u00edch ho\u1ea1t, thi\u1ebft b\u1ecb s\u1ebd t\u0103ng c\u00f4ng su\u1ea5t l\u00e0m l\u1ea1nh \u0111\u1ebfn m\u1ee9c t\u1ed1i \u0111a trong th\u1eddi gian ng\u1eafn \u0111\u1ec3 t\u1ea1m th\u1eddi \u0111\u00f3ng b\u0103ng c\u00e1c lo\u1ea1i ch\u1ea5t b\u1ea9n v\u00e0 n\u1ea5m m\u1ed1c, sau \u0111\u00f3 s\u1ebd l\u00e0m tan b\u0103ng \u0111\u1ed9t ng\u1ed9t \u0111\u1ec3 t\u1ea1o th\u00e0nh d\u00f2ng n\u01b0\u1edbc cu\u1ed1n tr\u00f4i c\u00e1c ch\u1ea5t b\u1ea9n \u0111i ra ngo\u00e0i. Ti\u1ebfp \u0111\u1ebfn, h\u1ec7 th\u1ed1ng qu\u1ea1t b\u00ean trong d\u00e0n l\u1ea1nh s\u1ebd ti\u1ebfp t\u1ee5c ho\u1ea1t \u0111\u1ed9ng \u0111\u1ec3 hong kh\u00f4, h\u1ea1n ch\u1ebf s\u1ef1 h\u00ecnh th\u00e0nh c\u1ee7a vi khu\u1ea9n, n\u1ea5m m\u1ed1c. Nh\u1edd \u0111\u00f3, lu\u1ed3ng kh\u00ed m\u00e1t t\u1ecfa ra b\u00ean ngo\u00e0i s\u1ebd lu\u00f4n s\u1ea1ch s\u1ebd v\u00e0 \u0111\u1ea3m b\u1ea3o an to\u00e0n cho s\u1ee9c kh\u1ecfe. M\u1ed9t s\u1ed1 t\u00ednh n\u0103ng ti\u1ec7n \u00edch kh\u00e1c c\u1ee7a m\u00e1y l\u1ea1nh Comfee Inverter 2 HP CFS-18VDGF-V T\u00ednh n\u0103ng h\u00fat \u1ea9m (Dehumidification mode): T\u00ednh n\u0103ng n\u00e0y s\u1ebd gi\u00fap c\u00e2n b\u1eb1ng \u0111\u1ed9 \u1ea9m trong kh\u00f4ng kh\u00ed, \u0111\u1ea3m b\u1ea3o kh\u00f4ng gian lu\u00f4n \u0111\u01b0\u1ee3c kh\u00f4 r\u00e1o v\u00e0 tho\u00e1ng \u0111\u00e3ng. T\u1ef1 kh\u1edfi \u0111\u1ed9ng khi c\u00f3 \u0111i\u1ec7n (Auto Restart mode): T\u00ednh n\u0103ng n\u00e0y s\u1ebd gi\u00fap thi\u1ebft b\u1ecb t\u1ef1 ho\u1ea1t \u0111\u1ed9ng tr\u1edf l\u1ea1i khi ngu\u1ed3n \u0111i\u1ec7n \u0111\u01b0\u1ee3c kh\u00f4i ph\u1ee5c v\u1edbi c\u00e1c ch\u1ebf \u0111\u1ed9, nhi\u1ec7t \u0111\u1ed9 v\u00e0 lu\u1ed3ng gi\u00f3 \u0111\u00e3 \u0111\u01b0\u1ee3c thi\u1ebft l\u1eadp tr\u01b0\u1edbc khi m\u1ea5t \u0111i\u1ec7n. Ch\u1ebf \u0111\u1ed9 ng\u1ee7 \u0111\u00eam Sleep : Ng\u01b0\u1eddi d\u00f9ng s\u1ebd kh\u00f4ng ph\u1ea3i t\u1ec9nh gi\u1ea5c gi\u1eefa khuya \u0111\u1ec3 \u0111i\u1ec1u ch\u1ec9nh nhi\u1ec7t \u0111\u1ed9, thay v\u00e0o \u0111\u00f3 thi\u1ebft b\u1ecb s\u1ebd t\u1ef1 \u0111\u1ed9ng \u0111i\u1ec1u ch\u1ec9nh \u0111\u1ec3 t\u1ea1o ra m\u1ee9c nhi\u1ec7t\u00a0 l\u00fd t\u01b0\u1edfng v\u00e0o ban \u0111\u00eam, mang \u0111\u1ebfn cho ng\u01b0\u1eddi d\u00f9ng m\u1ed9t gi\u1ea5c ng\u1ee7 ngon v\u00e0 tr\u1ecdn v\u1eb9n h\u01a1n. Ch\u1ebf \u0111\u1ed9 Fan Only : Ch\u1ebf \u0111\u1ed9 n\u00e0y ho\u1ea1t \u0111\u1ed9ng t\u01b0\u01a1ng t\u1ef1 nh\u01b0 m\u1ed9t chi\u1ebfc qu\u1ea1t gi\u00f3 th\u00f4ng th\u01b0\u1eddng. Khi \u0111\u01b0\u1ee3c k\u00edch ho\u1ea1t, ch\u1ec9 c\u00f3 qu\u1ea1t gi\u00f3 c\u1ee7a d\u00e0n l\u1ea1nh \u0111\u01b0\u1ee3c ho\u1ea1t \u0111\u1ed9ng. \u0110i\u1ec1u n\u00e0y gi\u00fap th\u00fac \u0111\u1ea9y s\u1ef1 l\u01b0u th\u00f4ng kh\u00f4ng kh\u00ed v\u00e0 t\u1ea1o ra m\u1ed9t kh\u00f4ng gian tho\u00e1ng \u0111\u00e3ng h\u01a1n, \u0111\u1ed3ng th\u1eddi ti\u1ebft ki\u1ec7m \u0111\u00e1ng k\u1ec3 \u0111i\u1ec7n n\u0103ng ti\u00eau th\u1ee5. Ch\u1ebf \u0111\u1ed9 n\u00e0y r\u1ea5t th\u00edch h\u1ee3p \u0111\u1ec3 s\u1eed d\u1ee5ng trong nh\u1eefng ng\u00e0y th\u1eddi ti\u1ebft m\u00e1t m\u1ebb, kh\u00f4ng qu\u00e1 n\u00f3ng ho\u1eb7c kh\u00f4ng gian trong ph\u00f2ng \u0111\u00e3 \u0111\u01b0\u1ee3c l\u00e0m m\u00e1t t\u1eeb tr\u01b0\u1edbc. \u0110i\u1ec1u h\u00f2a Comfee Inverter 2 HP CFS-18VDGF-V c\u00f3 gi\u00e1 bao nhi\u00eau? L\u00e0 m\u1ed9t th\u01b0\u01a1ng hi\u1ec7u h\u00e0ng \u0111\u1ea7u t\u1ea1i \u00dd, \u0111\u01b0\u1ee3c bi\u1ebft \u0111\u1ebfn v\u1edbi nh\u1eefng s\u1ea3n ph\u1ea9m cao c\u1ea5p n\u1ed5i b\u1eadt v\u1ec1 thi\u1ebft k\u1ebf v\u00e0 t\u00ednh n\u0103ng, th\u1ebf nh\u01b0ng Comfee v\u1eabn duy tr\u00ec \u0111\u01b0\u1ee3c s\u1ef1 c\u00e2n b\u1eb1ng gi\u1eefa gi\u00e1 th\u00e0nh v\u00e0 ch\u1ea5t l\u01b0\u1ee3ng c\u1ee7a s\u1ea3n ph\u1ea9m. V\u1edbi m\u1ed9t m\u1ee9c gi\u00e1 c\u1ef1c k\u1ef3 ph\u1ea3i ch\u0103ng, ng\u01b0\u1eddi d\u00f9ng \u0111\u00e3 c\u00f3 th\u1ec3 trang b\u1ecb m\u1ed9t chi\u1ebfc \u0111i\u1ec1u h\u00f2a ch\u1ea5t l\u01b0\u1ee3ng nh\u01b0 Comfee Inverter 2 HP CFS-18VDGF-V cho ng\u00f4i nh\u00e0 c\u1ee7a m\u00ecnh. S\u1edf h\u1eefu s\u1ea3n ph\u1ea9m m\u00e1y l\u1ea1nh Comfee Inverter 2 HP CFS-18VDGF-V ch\u00ednh h\u00e3ng t\u1ea1i Ho\u00e0ng H\u00e0 Mobile N\u1ebfu c\u00f3 nhu c\u1ea7u s\u1edf h\u1eefu chi\u1ebfc \u0111i\u1ec1u h\u00f2a \u0111a n\u0103ng n\u00e0y c\u1ee7a th\u01b0\u01a1ng hi\u1ec7u Comfee, qu\u00fd kh\u00e1ch h\u00e0ng c\u00f3 th\u1ec3 gh\u00e9 ngay nh\u1eefng c\u1eeda h\u00e0ng Ho\u00e0ng H\u00e0 Mobile g\u1ea7n nh\u1ea5t \u0111\u1ec3 \u0111\u01b0\u1ee3c t\u01b0 v\u1ea5n tr\u1ef1c ti\u1ebfp ho\u1eb7c \u0111\u1eb7t mua online t\u1ea1i website hoanghamobile \u0111\u1ec3 \u0111\u01b0\u1ee3c h\u1ed7 tr\u1ee3 giao h\u00e0ng mi\u1ec5n ph\u00ed t\u1eadn nh\u00e0. T\u1ea5t c\u1ea3 c\u00e1c s\u1ea3n ph\u1ea9m \u0111i\u1ec1u h\u00f2a, m\u00e1y l\u1ea1nh c\u1ee7a th\u01b0\u01a1ng hi\u1ec7u Comfee \u0111\u01b0\u1ee3c ph\u00e2n ph\u1ed1i t\u1ea1i h\u1ec7 th\u1ed1ng Ho\u00e0ng H\u00e0 Mobile \u0111\u1ec1u \u0111\u01b0\u1ee3c \u0111\u1ea3m b\u1ea3o v\u1ec1 ngu\u1ed3n g\u1ed1c, ch\u1ea5t l\u01b0\u1ee3ng c\u00f9ng ch\u1ebf \u0111\u1ed9 b\u1ea3o h\u00e0nh ch\u00ednh h\u00e3ng. Qu\u00fd kh\u00e1ch h\u00e0ng c\u0169ng s\u1ebd c\u00f3 th\u1eddi h\u1ea1n \u0111\u1ed5i tr\u1ea3 mi\u1ec5n ph\u00ed trong v\u00f2ng 30 ng\u00e0y n\u1ebfu s\u1ea3n ph\u1ea9m ph\u00e1t sinh l\u1ed7i t\u1eeb nh\u00e0 s\u1ea3n xu\u1ea5t. Ngo\u00e0i ra, nh\u1eefng ch\u01b0\u01a1ng tr\u00ecnh khuy\u1ebfn m\u00e3i si\u00eau h\u1ea5p d\u1eabn c\u0169ng \u0111ang ch\u1edd \u0111\u00f3n qu\u00fd kh\u00e1ch h\u00e0ng khi mua s\u1eafm v\u00e0 s\u1eed d\u1ee5ng d\u1ecbch v\u1ee5 t\u1ea1i Ho\u00e0ng H\u00e0 Mobile. H\u00e3y nhanh tay li\u00ean h\u1ec7 \u0111\u1ebfn t\u1ed5ng \u0111\u00e0i 1900.2091 \u0111\u1ec3 \u0111\u01b0\u1ee3c t\u01b0 v\u1ea5n v\u00e0 h\u1ed7 tr\u1ee3 mi\u1ec5n ph\u00ed ngay h\u00f4m nay nh\u00e9! Xem to\u00e0n b\u1ed9 b\u00e0i vi\u1ebft",
        "promotion_1": "1. Tr\u00fang 8386 qu\u00e0 - T\u1ed5ng gi\u00e1 tr\u1ecb t\u1edbi 250 TRI\u1ec6U \u0110\u1ed2NG (\u00c1p d\u1ee5ng t\u1eeb 10/01 - 02/02/2025). (Xem chi ti\u1ebft). 2. \u0110\u1eb7c bi\u1ec7t Tr\u1ea3 g\u00f3p 3 kh\u00f4ng: 0% l\u00e3i su\u1ea5t - 0 ph\u00ed chuy\u1ec3n \u0111\u1ed5i - 0 tr\u1ea3 tr\u01b0\u1edbc (\u00c1p d\u1ee5ng cho c\u00f4ng ty t\u00e0i ch\u00ednh v\u00e0 th\u1ebb t\u00edn d\u1ee5ng)",
        "promotion_2": "1. Gi\u1ea3m t\u1edbi 500.000\u0111 khi thanh to\u00e1n th\u1ebb t\u00edn d\u1ee5ng NCB. (Xem chi ti\u1ebft). 2. Gi\u1ea3m \u0111\u1ebfn 150.000\u0111 khi thanh to\u00e1n qua Muadee. (Xem chi ti\u1ebft). 3. Mi\u1ec5n ph\u00ed chuy\u1ec3n \u0111\u1ed5i tr\u1ea3 g\u00f3p ho\u1eb7c gi\u1ea3m \u0111\u1ebfn 500.000\u0111 khi m\u1edf th\u1ebb TPBank EVO. (Xem chi ti\u1ebft). 4. M\u1edf th\u1ebb t\u00edn d\u1ee5ng VIB - Nh\u1eadn Voucher 600.000\u0111. (Xem chi ti\u1ebft). 5. M\u1edf th\u1ebb HSBC - Ho\u00e0n ti\u1ec1n t\u1edbi 2 tri\u1ec7u \u0111\u1ed3ng. (Xem chi ti\u1ebft)"
    },
    {
        "title": "\u0110i\u1ec1u h\u00f2a Comfee Inverter 12.000 BTU (1.5 HP) SIRIUS-12ED",
        "price": "gi\u00e1 hi\u1ec7n t\u1ea1i l\u00e0 6,930,000 \u20ab nh\u01b0ng tr\u01b0\u1edbc \u0111\u00e2y n\u00f3 c\u00f3 gi\u00e1 l\u00e0 8,290,000 \u20ab",
        "colors": "Tr\u1eafng",
        "technical_specifications": [
            {
                "Lo\u1ea1i m\u00e1y": "1 chi\u1ec1u (ch\u1ec9 l\u00e0m l\u1ea1nh)"
            },
            {
                "C\u00f4ng ngh\u1ec7 inverter": "M\u00e1y l\u1ea1nh Inverter"
            },
            {
                "C\u00f4ng su\u1ea5t l\u00e0m l\u1ea1nh": "1.5 HP - 12.000 BTU"
            },
            {
                "Ph\u1ea1m vi l\u00e0m l\u1ea1nh hi\u1ec7u qu\u1ea3": "T\u1eeb 15 - 20m\u00b2 (t\u1eeb 40 \u0111\u1ebfn 60 m\u00b3)"
            },
            {
                "Nh\u00e3n n\u0103ng l\u01b0\u1ee3ng": "5 sao (Hi\u1ec7u su\u1ea5t n\u0103ng l\u01b0\u1ee3ng 4.26)"
            }
        ],
        "description": "\u0110i\u1ec1u h\u00f2a Comfee Inverter 12.000 BTU (1.5 HP) SIRIUS-12ED l\u00e0 s\u1ef1 l\u1ef1a ch\u1ecdn ho\u00e0n h\u1ea3o cho nh\u1eefng ai \u0111ang t\u00ecm ki\u1ebfm m\u1ed9t s\u1ea3n ph\u1ea9m gi\u00e1 r\u1ebb v\u1eeba ti\u1ebft ki\u1ec7m \u0111i\u1ec7n n\u0103ng, v\u1eeba l\u00e0m l\u1ea1nh hi\u1ec7u qu\u1ea3, l\u1ea1i c\u00f2n s\u1edf h\u1eefu nhi\u1ec1u t\u00ednh n\u0103ng th\u00f4ng minh. C\u00e1c c\u00f4ng ngh\u1ec7 hi\u1ec7n \u0111\u1ea1i m\u00e0 thi\u1ebft b\u1ecb n\u00e0y s\u1edf h\u1eefu ph\u1ea3i k\u1ec3 \u0111\u1ebfn nh\u01b0 c\u00f4ng ngh\u1ec7 Inverter , t\u00ednh n\u0103ng l\u00e0m l\u1ea1nh nhanh ch\u00f3ng Turbo , kh\u1ea3 n\u0103ng l\u1ecdc b\u1ee5i hi\u1ec7u qu\u1ea3 v\u1edbi l\u01b0\u1edbi l\u1ecdc b\u1ee5i HD . Thi\u1ebft k\u1ebf m\u00e1y l\u1ea1nh hi\u1ec7n \u0111\u1ea1i, trang nh\u00e3, \u0111i k\u00e8m c\u00f4ng su\u1ea5t 1.5 HP - 12.000 BTU , \u0111\u00e1p \u1ee9ng \u0111\u01b0\u1ee3c nhu c\u1ea7u s\u1eed d\u1ee5ng trong nhi\u1ec1u ki\u1ec3u ph\u00f2ng kh\u00e1c nhau. N\u1ebfu b\u1ea1n \u0111ang c\u00f3 \u00fd \u0111\u1ecbnh mua \u0111i\u1ec1u h\u00f2a c\u1ee7a th\u01b0\u01a1ng hi\u1ec7u Comfee th\u00ec h\u00e3y tham kh\u1ea3o th\u00eam c\u00e1c th\u00f4ng tin v\u1ec1 s\u1ea3n ph\u1ea9m d\u01b0\u1edbi \u0111\u00e2y. \u0110\u1eb7c \u0111i\u1ec3m n\u1ed5i b\u1eadt Thi\u1ebft k\u1ebf hi\u1ec7n \u0111\u1ea1i, remote c\u00f3 \u0111\u00e8n LED c\u1ef1c ti\u1ec7n l\u1ee3i \u0111\u1ec3 \u0111i\u1ec1u khi\u1ec3n m\u00e1y l\u1ea1nh trong b\u00f3ng t\u1ed1i. C\u00f4ng su\u1ea5t 1.5 HP - 12.000 BTU th\u00edch h\u1ee3p s\u1eed d\u1ee5ng trong kh\u00f4ng gian c\u00f3 di\u1ec7n t\u00edch t\u1eeb 15 - 20m2. C\u00f4ng ngh\u1ec7 Inverter k\u1ebft h\u1ee3p Eco gi\u00fap ti\u1ebft ki\u1ec7m \u0111i\u1ec7n n\u0103ng hi\u1ec7u qu\u1ea3. C\u00f4ng ngh\u1ec7 l\u00e0m l\u1ea1nh nhanh t\u1ef1 \u0111\u1ed9ng Turbo mang l\u1ea1i h\u01a1i m\u00e1t nhanh ch\u00f3ng cho c\u0103n ph\u00f2ng. L\u01b0\u1edbi l\u1ecdc b\u1ee5i HD h\u1ea1n ch\u1ebf vi khu\u1ea9n, b\u1ee5i b\u1ea9n, mang t\u1edbi lu\u1ed3ng kh\u00f4ng kh\u00ed m\u00e1t m\u1ebb v\u00e0 d\u1ec5 ch\u1ecbu. Ch\u1ee9c n\u0103ng \u0111\u1ea3o gi\u00f3 4 chi\u1ec1u v\u00e0 h\u00fat \u1ea9m \u0111\u1ed3ng th\u1eddi gi\u00fap b\u1ea1n ng\u1ee7 s\u00e2u gi\u1ea5c trong \u0111\u00eam m\u00e0 kh\u00f4ng kh\u00f3 ch\u1ecbu. B\u1ea3ng th\u00f4ng s\u1ed1 k\u1ef9 thu\u1eadt c\u1ee7a m\u00e1y l\u1ea1nh Comfee Inverter 12.000 BTU (1.5 HP) SIRIUS-12ED Th\u00f4ng s\u1ed1 Chi ti\u1ebft Lo\u1ea1i m\u00e1y 1 chi\u1ec1u (ch\u1ec9 l\u00e0m l\u1ea1nh) C\u00f4ng su\u1ea5t l\u00e0m l\u1ea1nh 1.5 HP - 12.000 BTU Ph\u1ea1m vi l\u00e0m l\u1ea1nh hi\u1ec7u qu\u1ea3 T\u1eeb 15 - 20m2 (t\u1eeb 40 \u0111\u1ebfn 60m3) K\u00edch th\u01b0\u1edbc v\u00e0 tr\u1ecdng l\u01b0\u1ee3ng d\u00e0n l\u1ea1nh D\u00e0i 79.5 cm - Cao 28.5 cm - D\u00e0y 19.4 cm N\u1eb7ng 8.2 kg (ho\u1eb7c 8.4 kg t\u00f9y l\u00f4 h\u00e0ng) K\u00edch th\u01b0\u1edbc v\u00e0 tr\u1ecdng l\u01b0\u1ee3ng d\u00e0n n\u00f3ng D\u00e0i 79.8 cm - Cao 49.5 cm - D\u00e0y 26.5 cm N\u1eb7ng 21.7 kg (ho\u1eb7c 23.3 kg tu\u1ef3 l\u00f4 h\u00e0ng) \u0110\u1ed9 \u1ed3n trung b\u00ecnh 37/55 dB Lo\u1ea1i gas R-32 Ti\u00eau th\u1ee5 \u0111i\u1ec7n 1.17 kW/h C\u00f4ng ngh\u1ec7 ti\u1ebft ki\u1ec7m \u0111i\u1ec7n Inverter Eco Kh\u1ea3 n\u0103ng l\u1ecdc b\u1ee5i, kh\u00e1ng khu\u1ea9n, kh\u1eed m\u00f9i L\u01b0\u1edbi l\u1ecdc b\u1ee5i HD Ch\u1ebf \u0111\u1ed9 gi\u00f3 \u0110i\u1ec1u khi\u1ec3n l\u00ean xu\u1ed1ng t\u1ef1 \u0111\u1ed9ng, tr\u00e1i ph\u1ea3i t\u00f9y ch\u1ec9nh tay C\u00f4ng ngh\u1ec7 l\u00e0m l\u1ea1nh nhanh Turbo Ti\u1ec7n \u00edch \u0110\u1ea3o gi\u00f3 4 chi\u1ec1u gi\u00fap h\u01a1i l\u1ea1nh lan t\u1ecfa \u0111\u1ed3ng \u0111\u1ec1u Remote c\u00f3 \u0111\u00e8n LED Kh\u00f3a remote \u0111i\u1ec1u khi\u1ec3n Follow Me - ch\u1ee9c n\u0103ng c\u00e0i \u0111\u1eb7t nhi\u1ec7t \u0111\u1ed9 t\u1ea1i v\u1ecb tr\u00ed remote C\u00f4ng ngh\u1ec7 t\u1ea3n nhi\u1ec7t m\u1ea1 v\u00e0ng M\u00e0n h\u00ecnh hi\u1ec3n th\u1ecb nhi\u1ec7t \u0111\u1ed9 tr\u00ean d\u00e0n l\u1ea1nh Ch\u1ee9c n\u0103ng h\u00fat \u1ea9m H\u1eb9n gi\u1edd b\u1eadt/t\u1eaft m\u00e1y Ch\u1ee9c n\u0103ng t\u1ef1 l\u00e0m s\u1ea1ch D\u00f2ng \u0111i\u1ec7n v\u00e0o D\u00e0n l\u1ea1nh D\u00f2ng \u0111i\u1ec7n ho\u1ea1t \u0111\u1ed9ng 1 pha S\u1ed1 l\u01b0\u1ee3ng k\u1ebft n\u1ed1i d\u00e0n l\u1ea1nh t\u1ed1i \u0111a 1 \u0110\u00e1nh gi\u00e1 chi ti\u1ebft \u0111i\u1ec1u h\u00f2a Comfee Inverter 12.000 BTU (1.5 HP) SIRIUS-12ED Gi\u1ed1ng nh\u01b0 nhi\u1ec1u s\u1ea3n ph\u1ea9m \u0111i\u1ec7n l\u1ea1nh kh\u00e1c tr\u00ean th\u1ecb tr\u01b0\u1eddng, Comfee mang \u0111\u1ebfn cho kh\u00e1ch h\u00e0ng th\u00eam m\u1ed9t l\u1ef1a ch\u1ecdn v\u1edbi m\u1ee9c gi\u00e1 ph\u1ea3i ch\u0103ng, m\u00e0 v\u1eabn c\u00f3 th\u1ec3 tr\u1ea3i nghi\u1ec7m \u0111\u1ea7y \u0111\u1ee7 ti\u1ec7n \u00edch c\u1ea7n c\u00f3 c\u1ee7a m\u1ed9t chi\u1ebfc \u0111i\u1ec1u h\u00f2a mang l\u1ea1i. M\u00e1y l\u1ea1nh Comfee Inverter SIRIUS-12ED \u0111\u00e1p \u1ee9ng \u0111\u01b0\u1ee3c nhu c\u1ea7u s\u1eed d\u1ee5ng c\u1ee7a h\u1ea7u h\u1ebft m\u1ecdi gia \u0111\u00ecnh b\u1edfi c\u00f4ng ngh\u1ec7 ti\u1ebft ki\u1ec7m \u0111i\u1ec7n, l\u00e0m l\u1ea1nh nhanh, c\u00f9ng h\u00e0ng lo\u1ea1t t\u00ednh n\u0103ng th\u00f4ng minh kh\u00e1c t\u00edch h\u1ee3p. Thi\u1ebft k\u1ebf sang tr\u1ecdng, hi\u1ec7n \u0111\u1ea1i \u0111i k\u00e8m c\u00f4ng su\u1ea5t l\u1edbn \u0110i\u1ec1u h\u00f2a c\u1ee7a nh\u00e0 Comfee c\u00f3 thi\u1ebft k\u1ebf r\u1ea5t \u0111\u1eb7c tr\u01b0ng c\u1ee7a m\u1ed9t chi\u1ebfc m\u00e1y l\u1ea1nh th\u00f4ng th\u01b0\u1eddng. Tuy nhi\u00ean, nh\u00e0 s\u1ea3n xu\u1ea5t \u0111\u00e3 nh\u1ea5n nh\u00e1 b\u1eb1ng vi\u1ec7c thi\u1ebft k\u1ebf n\u00f3 v\u1edbi m\u1ed9t m\u1eb7t h\u01a1i cong nh\u1eb9, ch\u1ea5t li\u1ec7u ph\u1ea3n quang c\u00f9ng m\u00e0u tr\u1eafng trang nh\u00e3, thanh l\u1ecbch ph\u00f9 h\u1ee3p v\u1edbi m\u1ecdi kh\u00f4ng gian s\u1ed1ng c\u1ee7a c\u00e1c gia \u0111\u00ecnh. M\u00e0n h\u00ecnh hi\u1ec3n th\u1ecb nhi\u1ec7t \u0111\u1ed9 tr\u00ean d\u00e0n l\u1ea1nh \u0111\u1ec3 b\u1ea1n d\u1ec5 d\u00e0ng theo d\u00f5i qu\u00e1 tr\u00ecnh ho\u1ea1t \u0111\u1ed9ng h\u01a1n. M\u00e1y l\u1ea1nh Comfee Inverter 12.000 BTU (1.5 HP) SIRIUS-12ED c\u00f3 c\u00f4ng su\u1ea5t l\u00e0m l\u1ea1nh l\u00e0 1.5 HP - 12.000 BTU. M\u1ee9c n\u00e0y s\u1ebd ph\u00f9 h\u1ee3p v\u1edbi nh\u1eefng c\u0103n ph\u00f2ng c\u00f3 di\u1ec7n t\u00edch t\u1eeb 15 - 20m2, v\u1edbi kh\u1ea3 n\u0103ng l\u00e0m m\u00e1t nhanh ch\u00f3ng. Do \u0111\u00f3, b\u1ea1n c\u00f3 th\u1ec3 c\u00e2n nh\u1eafc mua s\u1ea3n ph\u1ea9m n\u00e0y \u0111\u1ec3 l\u1eafp trong ph\u00f2ng ng\u1ee7, ph\u00f2ng l\u00e0m vi\u1ec7c. \u0110i\u1ec1u h\u00f2a Comfee Inverter 12.000 BTU (1.5 HP) SIRIUS-12ED ti\u1ebft ki\u1ec7m \u0111i\u1ec7n n\u0103ng v\u1edbi c\u00f4ng ngh\u1ec7 Inverter v\u00e0 Eco C\u00f4ng ngh\u1ec7 Inverter v\u00e0 Eco l\u00e0 hai c\u00f4ng ngh\u1ec7 n\u1ed5i b\u1eadt tr\u00ean \u0111i\u1ec1u h\u00f2a Comfee n\u00f3i chung v\u00e0 Comfee Inverter SIRIUS-12ED n\u00f3i ri\u00eang. N\u00f3 gi\u00fap ng\u01b0\u1eddi d\u00f9ng ti\u1ebft ki\u1ec7m \u0111i\u1ec7n n\u0103ng m\u1ed9t c\u00e1ch hi\u1ec7u qu\u1ea3 m\u00e0 v\u1eabn \u0111\u1ea3m b\u1ea3o kh\u00f4ng gian lu\u00f4n m\u00e1t m\u1ebb. S\u1ea3n ph\u1ea9m n\u00e0y \u0111\u01b0\u1ee3c trang b\u1ecb c\u00f4ng ngh\u1ec7 Inverter - \u0110\u1ed9ng c\u01a1 bi\u1ebfn t\u1ea7n th\u00f4ng minh gi\u00fap \u0111i\u1ec1u ch\u1ec9nh t\u1ed1c \u0111\u1ed9 m\u00e1y n\u00e9n linh ho\u1ea1t, ph\u00f9 h\u1ee3p v\u1edbi nhu c\u1ea7u l\u00e0m l\u1ea1nh. Khi nhi\u1ec7t \u0111\u1ed9 ph\u00f2ng c\u1ee7a b\u1ea1n \u0111\u1ea1t \u0111\u1ebfn \u0111\u00fang m\u1ee9c c\u00e0i \u0111\u1eb7t, m\u00e1y n\u00e9n s\u1ebd gi\u1ea3m t\u1ed1c \u0111\u1ed9 ho\u1eb7c ng\u1eebng ho\u1ea1t \u0111\u1ed9ng, tr\u00e1nh t\u00ecnh tr\u1ea1ng qu\u00e1 l\u1ea1nh ho\u1eb7c qu\u00e1 n\u00f3ng. \u0110\u1ed3ng th\u1eddi, nh\u1edd v\u1eady m\u00e0 trong qu\u00e1 tr\u00ecnh b\u1eadt \u0111i\u1ec1u h\u00f2a s\u1eed d\u1ee5ng c\u1ea3 ng\u00e0y th\u00ec v\u1eabn ti\u1ebft ki\u1ec7m \u0111i\u1ec7n n\u0103ng \u0111\u00e1ng k\u1ec3 so v\u1edbi c\u00e1c lo\u1ea1i \u0111i\u1ec1u h\u00f2a th\u00f4ng th\u01b0\u1eddng. B\u00ean c\u1ea1nh \u0111\u00f3, \u0111i\u1ec1u h\u00f2a Comfee Inverter 12.000 BTU (1.5 HP) SIRIUS-12ED c\u00f2n c\u00f3 ch\u1ebf \u0111\u1ed9 Eco ti\u1ebft ki\u1ec7m \u0111i\u1ec7n t\u1ed1i \u01b0u. Khi k\u00edch ho\u1ea1t ch\u1ebf \u0111\u1ed9 Eco, m\u00e1y n\u00e9n s\u1ebd ho\u1ea1t \u0111\u1ed9ng \u1edf m\u1ee9c c\u00f4ng su\u1ea5t th\u1ea5p nh\u1ea5t, gi\u00fap ti\u1ebft ki\u1ec7m \u0111i\u1ec7n n\u0103ng t\u1ed1i \u0111a. M\u1eb7c d\u00f9 gi\u1ea3m c\u00f4ng su\u1ea5t nh\u01b0ng ch\u1ebf \u0111\u1ed9 Eco v\u1eabn \u0111\u1ea3m b\u1ea3o kh\u00f4ng gian \u0111\u1ee7 m\u00e1t \u0111\u1ec3 b\u1ea1n c\u1ea3m th\u1ea5y tho\u1ea3i m\u00e1i. Nh\u00ecn chung, s\u1ef1 k\u1ebft h\u1ee3p ho\u00e0n h\u1ea3o c\u1ee7a c\u00f4ng ngh\u1ec7 Inverter v\u00e0 ch\u1ebf \u0111\u1ed9 Eco tr\u00ean chi\u1ebfc m\u00e1y l\u1ea1nh c\u1ee7a nh\u00e0 Comfee kh\u00f4ng ch\u1ec9 gi\u1ea3m thi\u1ec3u h\u00f3a \u0111\u01a1n ti\u1ec1n \u0111i\u1ec7n m\u1ed7i th\u00e1ng m\u00e0 c\u00f2n g\u00f3p ph\u1ea7n b\u1ea3o v\u1ec7 m\u00f4i tr\u01b0\u1eddng hi\u1ec7u qu\u1ea3. M\u00e1y l\u1ea1nh Comfee Inverter 12.000 BTU (1.5 HP) SIRIUS-12ED l\u00e0m m\u00e1t c\u1ef1c nhanh v\u1edbi ch\u1ebf \u0111\u1ed9 Turbo Ch\u1ebf \u0111\u1ed9 Turbo l\u00e0 m\u1ed9t t\u00ednh n\u0103ng v\u00f4 c\u00f9ng h\u1eefu \u00edch tr\u00ean \u0111i\u1ec1u h\u00f2a, \u0111\u1eb7c bi\u1ec7t trong nh\u1eefng ng\u00e0y h\u00e8 oi b\u1ee9c. Khi k\u00edch ho\u1ea1t ch\u1ebf \u0111\u1ed9 n\u00e0y, m\u00e1y l\u1ea1nh s\u1ebd ho\u1ea1t \u0111\u1ed9ng \u1edf c\u00f4ng su\u1ea5t t\u1ed1i \u0111a, gi\u00fap l\u00e0m gi\u1ea3m nhi\u1ec7t \u0111\u1ed9 ph\u00f2ng m\u1ed9t c\u00e1ch nhanh ch\u00f3ng v\u00e0 hi\u1ec7u qu\u1ea3 nh\u1ea5t. \u01afu \u0111i\u1ec3m n\u1ed5i b\u1eadt c\u1ee7a ch\u1ebf \u0111\u1ed9 Turbo ch\u00ednh l\u00e0 l\u00e0m m\u00e1t nhanh ch\u00f3ng. N\u1ebfu b\u1ea1n v\u1eeba m\u1edbi t\u1eeb ngo\u00e0i \u0111\u01b0\u1eddng hay ch\u01a1i th\u1ec3 thao v\u1ec1, th\u00ec vi\u1ec7c b\u1eadt \u0111i\u1ec1u h\u00f2a c\u00f3 ch\u1ebf \u0111\u1ed9 m\u00e1t nhanh th\u1eadt s\u1ef1 \u0111em \u0111\u1ebfn c\u1ea3m gi\u00e1c khoan kho\u00e1i, d\u1ec5 ch\u1ecbu. T\u1eeb ph\u00f2ng kh\u00e1ch, ph\u00f2ng ng\u1ee7 \u0111\u1ebfn ph\u00f2ng l\u00e0m vi\u1ec7c, ch\u1ebf \u0111\u1ed9 Turbo \u0111\u1ec1u mang l\u1ea1i hi\u1ec7u qu\u1ea3 l\u00e0m m\u00e1t cao v\u00e0 lan t\u1ecfa kh\u1eafp c\u0103n ph\u00f2ng. C\u00e1ch k\u00edch ho\u1ea1t ch\u1ebf \u0111\u1ed9 Turbo tr\u00ean \u0111i\u1ec1u h\u00f2a c\u0169ng r\u1ea5t \u0111\u01a1n gi\u1ea3n ch\u1ec9 v\u1edbi m\u1ed9t n\u00fat b\u1ea5m tr\u00ean \u0111i\u1ec1u khi\u1ec3n. \u0110\u1ea3m b\u1ea3o ch\u1ec9 trong v\u00e0i ph\u00fat, b\u1ea1n s\u1ebd c\u1ea3m nh\u1eadn \u0111\u01b0\u1ee3c s\u1ef1 kh\u00e1c bi\u1ec7t r\u00f5 r\u1ec7t v\u1ec1 nhi\u1ec7t \u0111\u1ed9 trong ph\u00f2ng k\u00edn c\u00f3 m\u00e1y l\u1ea1nh v\u1edbi b\u00ean ngo\u00e0i. H\u1ea1n ch\u1ebf b\u1ee5i b\u1ea9n, vi khu\u1ea9n v\u1edbi kh\u1ea3 n\u0103ng l\u1ecdc hi\u1ec7u qu\u1ea3 th\u00f4ng qua l\u01b0\u1edbi l\u1ecdc b\u1ee5i HD L\u01b0\u1edbi l\u1ecdc b\u1ee5i HD l\u00e0 m\u1ed9t c\u00f4ng ngh\u1ec7 l\u1ecdc kh\u00f4ng kh\u00ed hi\u1ec7n \u0111\u1ea1i \u0111\u01b0\u1ee3c t\u00edch h\u1ee3p v\u00e0o \u0111i\u1ec1u h\u00f2a Comfee Inverter 12.000 BTU (1.5 HP) SIRIUS-12ED. V\u1edbi m\u00e0ng l\u01b0\u1edbi d\u00e0y c\u00f3 m\u1eadt \u0111\u1ed9 l\u1ecdc si\u00eau m\u1ecbn, n\u00f3 \u0111\u00f3ng vai tr\u00f2 quan tr\u1ecdng trong vi\u1ec7c lo\u1ea1i b\u1ecf c\u00f4n tr\u00f9ng, b\u1ee5i b\u1ea9n, vi khu\u1ea9n, ph\u1ea5n hoa v\u00e0 c\u00e1c h\u1ea1t si\u00eau nh\u1ecf kh\u00e1c. C\u0103n ph\u00f2ng c\u1ee7a gia \u0111\u00ecnh b\u1ea1n nh\u1edd v\u1eady m\u00e0 lu\u00f4n gi\u1eef \u0111\u01b0\u1ee3c b\u1ea7u kh\u00f4ng kh\u00ed trong l\u00e0nh, gi\u1ea3m thi\u1ec3u nguy c\u01a1 m\u1eafc c\u00e1c b\u1ec7nh v\u1ec1 \u0111\u01b0\u1eddng h\u00f4 h\u1ea5p v\u00e0 an to\u00e0n s\u1ee9c kh\u1ecfe c\u1ee7a m\u1ecdi th\u00e0nh vi\u00ean. T\u00ednh n\u0103ng n\u00e0y \u0111\u1eb7c bi\u1ec7t h\u1eefu \u00edch cho nh\u1eefng ng\u01b0\u1eddi c\u00f3 h\u1ec7 h\u00f4 h\u1ea5p nh\u1ea1y c\u1ea3m nh\u01b0 tr\u1ebb em, ng\u01b0\u1eddi gi\u00e0 v\u00e0 nh\u1eefng ng\u01b0\u1eddi b\u1ecb hen suy\u1ec5n, d\u1ecb \u1ee9ng. B\u00ean c\u1ea1nh \u0111\u00f3, \u0111i\u1ec1u h\u00f2a c\u00f2n c\u00f3 ch\u1ee9c n\u0103ng t\u1ef1 l\u00e0m s\u1ea1ch h\u1ec7 th\u1ed1ng d\u00e0n l\u1ea1nh b\u00ean trong. Trong qu\u00e1 tr\u00ecnh s\u1eed d\u1ee5ng, ch\u00fang ta s\u1ebd kh\u00f4ng s\u1ee3 thi\u1ebft b\u1ecb d\u00f9ng l\u00e2u ng\u00e0y ph\u1ea3 ra m\u00f9i h\u00f4i, \u1ea9m m\u1ed1c g\u00e2y kh\u00f3 ch\u1ecbu v\u00e0 \u00e1m v\u00e0o ch\u0103n g\u1ed1i, gi\u01b0\u1eddng n\u1ec7m,.\u2026 Ti\u1ec7n \u00edch th\u00f4ng minh kh\u00e1c c\u1ee7a m\u00e1y l\u1ea1nh Comfee Inverter 12.000 BTU (1.5 HP) SIRIUS-12ED Ngo\u00e0i c\u00f4ng d\u1ee5ng ch\u00ednh l\u00e0 \u0111\u1ec3 l\u00e0m m\u00e1t nh\u1edd \u0111\u01b0\u1ee3c t\u00edch h\u1ee3p h\u00e0ng lo\u1ea1t c\u00f4ng ngh\u1ec7 x\u1ecbn s\u00f2, thi\u1ebft b\u1ecb n\u00e0y c\u00f2n c\u00f3 r\u1ea5t nhi\u1ec1u ti\u1ec7n \u00edch kh\u00e1c gi\u00fap n\u00e2ng cao tr\u1ea3i nghi\u1ec7m c\u1ee7a ng\u01b0\u1eddi d\u00f9ng. Qu\u1ea1t gi\u00f3 \u0111\u1ea3o 4 chi\u1ec1u tr\u00ean \u0111i\u1ec1u h\u00f2a Comfee Inverter 12.000 BTU (1.5 HP) SIRIUS-12ED Qu\u1ea1t gi\u00f3 \u0111i\u1ec1u h\u00f2a \u0111\u1ea3o 4 chi\u1ec1u l\u00e0 m\u1ed9t trong nh\u1eefng c\u00f4ng ngh\u1ec7 l\u00e0m m\u00e1t hi\u1ec7n \u0111\u1ea1i m\u00e0 Comfee trang b\u1ecb cho m\u00e1y l\u1ea1nh c\u1ee7a m\u00ecnh. N\u00f3 mang \u0111\u1ebfn lu\u1ed3ng kh\u00ed m\u00e1t l\u1ea1nh ph\u00e2n b\u1ed1 \u0111\u1ec1u kh\u1eafp c\u0103n ph\u00f2ng. Nh\u1edd kh\u1ea3 n\u0103ng \u0111\u1ea3o gi\u00f3 linh ho\u1ea1t theo c\u1ea3 ph\u01b0\u01a1ng ngang v\u00e0 ph\u01b0\u01a1ng \u0111\u1ee9ng, \u0111i\u1ec1u h\u00f2a \u0111\u1ea3m b\u1ea3o kh\u00f4ng gian lu\u00f4n m\u00e1t m\u1ebb, kh\u00f4ng g\u00e2y ra c\u1ea3m gi\u00e1c l\u1ea1nh bu\u1ed1t \u1edf m\u1ed9t v\u1ecb tr\u00ed nh\u1ea5t \u0111\u1ecbnh. Khi kh\u00f4ng kh\u00ed l\u1ea1nh \u0111\u00e3 \u0111\u01b0\u1ee3c ph\u00e2n b\u1ed1 \u0111\u1ec1u to\u00e0n b\u1ed9 di\u1ec7n t\u00edch ph\u00f2ng, b\u1ea1n c\u00f3 th\u1ec3 \u0111i\u1ec1u ch\u1ec9nh nhi\u1ec7t \u0111\u1ed9 l\u00ean cao h\u01a1n m\u1ed9t ch\u00fat m\u00e0 v\u1eabn c\u1ea3m th\u1ea5y m\u00e1t m\u1ebb, gi\u00fap ti\u1ebft ki\u1ec7m \u0111i\u1ec7n n\u0103ng h\u01a1n. Remote c\u00f3 \u0111\u00e8n LED ti\u1ec7n l\u1ee3i V\u1edbi c\u00f4ng ngh\u1ec7 ng\u00e0y c\u00e0ng hi\u1ec7n \u0111\u1ea1i, nh\u00e0 s\u1ea3n xu\u1ea5t \u0111\u00e3 trang b\u1ecb th\u00eam \u0111\u00e8n LED cho remote \u0111 i\u1ec1u h\u00f2a Comfee Inverter 12.000 BTU (1.5 HP) SIRIUS-12ED , mang \u0111\u1ebfn s\u1ef1 ti\u1ec7n l\u1ee3i b\u1ea5t ng\u1edd cho ng\u01b0\u1eddi d\u00f9ng. Khi s\u1eed d\u1ee5ng trong \u0111\u00eam t\u1ed1i, b\u1ea1n s\u1ebd quan s\u00e1t c\u00e1c n\u00fat b\u1ea5m, \u0111i\u1ec1u ch\u1ec9nh nhi\u1ec7t \u0111\u1ed9 v\u00e0 c\u00e1c ch\u1ebf \u0111\u1ed9 kh\u00e1c d\u1ec5 d\u00e0ng h\u01a1n so v\u1edbi lo\u1ea1i \u0111i\u1ec1u khi\u1ec3n th\u00f4ng th\u01b0\u1eddng. Ngo\u00e0i ra, ch\u00fang ta c\u0169ng c\u00f3 th\u1ec3 d\u1ec5 d\u00e0ng \u0111i\u1ec1u khi\u1ec3n \u0111i\u1ec1u h\u00f2a th\u00f4ng qua \u1ee9ng d\u1ee5ng tr\u00ean smartphone trong m\u1ed9t s\u1ed1 tr\u01b0\u1eddng h\u1ee3p b\u1ea5t kh\u1ea3 kh\u00e1ng. Ch\u1ee9c n\u0103ng h\u1eb9n gi\u1edd c\u1ee7a m\u00e1y l\u1ea1nh Comfee Inverter 12.000 BTU (1.5 HP) SIRIUS-12ED Ch\u1ee9c n\u0103ng h\u1eb9n gi\u1edd tr\u00ean \u0111i\u1ec1u h\u00f2a l\u00e0 m\u1ed9t t\u00ednh n\u0103ng v\u00f4 c\u00f9ng h\u1eefu \u00edch, gi\u00fap b\u1ea1n ch\u1ee7 \u0111\u1ed9ng \u0111i\u1ec1u khi\u1ec3n ho\u1ea1t \u0111\u1ed9ng c\u1ee7a m\u00e1y l\u1ea1nh theo \u00fd mu\u1ed1n c\u1ee7a m\u00ecnh. Vi\u1ec7c h\u1eb9n gi\u1edd \u0111\u1ec3 \u0111i\u1ec1u h\u00f2a b\u1eaft \u0111\u1ea7u l\u00e0m m\u00e1t tr\u01b0\u1edbc khi b\u1ea1n v\u1ec1 nh\u00e0 ho\u1eb7c tr\u01b0\u1edbc khi \u0111i ng\u1ee7 gi\u00fap b\u1ea1n c\u00f3 kh\u00f4ng gian tho\u1ea3i m\u00e1i ngay l\u1eadp t\u1ee9c. Sau \u0111\u00f3, thi\u1ebft b\u1ecb s\u1ebd t\u1ef1 \u0111\u1ed9ng t\u1eaft khi \u0111\u00e3 l\u00e0m m\u00e1t c\u0103n ph\u00f2ng \u0111\u1ee7 l\u00e2u m\u00e0 ch\u00fang ta kh\u00f4ng c\u1ea7n thi\u1ebft ph\u1ea3i t\u1ec9nh d\u1eady t\u1eaft th\u1ee7 c\u00f4ng. Nh\u00ecn chung, t\u00ednh n\u0103ng n\u00e0y si\u00eau ti\u1ec7n \u00edch, \u0111\u1ea3m b\u1ea3o gi\u1ea5c ng\u1ee7 ngon kh\u00f4ng b\u1ecb gi\u00e1n \u0111o\u1ea1n, l\u1ea1i gi\u00fap ch\u00fang ta ti\u1ebft ki\u1ec7m \u0111i\u1ec7n \u0111\u00e1ng k\u1ec3. Tham kh\u1ea3o gi\u00e1 b\u00e1n c\u1ee7a \u0111i\u1ec1u h\u00f2a Comfee Inverter 12.000 BTU (1.5 HP) SIRIUS-12ED ch\u00ednh h\u00e3ng Hi\u1ec7n nay, s\u1ea3n ph\u1ea9m m\u00e1y l\u1ea1nh Comfee Inverter 12.000 BTU (1.5 HP) SIRIUS-12ED ch\u00ednh h\u00e3ng \u0111\u00e3 c\u00f3 m\u1eb7t t\u1ea1i Ho\u00e0ng H\u00e0 Mobile v\u00e0 \u0111\u01b0\u1ee3c b\u00e1n v\u1edbi m\u1ee9c gi\u00e1 h\u1ea5p d\u1eabn, \u0111i k\u00e8m nhi\u1ec1u ch\u1ebf \u0111\u1ed9 \u01b0u \u0111\u00e3i \u0111\u1eb7c bi\u1ec7t. Trong ph\u00e2n kh\u00fac m\u00e1y l\u1ea1nh hi\u1ec7n \u0111\u1ea1i t\u1ea7m trung, s\u1ea3n ph\u1ea9m n\u00e0y chi\u1ebfm nhi\u1ec1u \u01b0u th\u1ebf h\u01a1n so v\u1edbi c\u00e1c b\u00ean \u0111\u1ed1i th\u1ee7 c\u00f3 c\u00f9ng ch\u1ee9c n\u0103ng v\u00e0 c\u00f4ng su\u1ea5t. L\u01b0u \u00fd : Gi\u00e1 b\u00e1n c\u1ee7a s\u1ea3n ph\u1ea9m c\u00f3 th\u1ec3 thay \u0111\u1ed5i t\u00f9y v\u00e0o th\u1eddi \u0111i\u1ec3m mua h\u00e0ng, n\u00ean kh\u00e1ch h\u00e0ng c\u00f3 th\u1ec3 li\u00ean h\u1ec7 tr\u1ef1c ti\u1ebfp v\u1edbi ch\u00fang t\u00f4i \u0111\u1ec3 c\u00f3 th\u00f4ng tin ch\u00ednh x\u00e1c nh\u1ea5t. \u0110\u00e2y l\u00e0 s\u1ea3n ph\u1ea9m ph\u00f9 h\u1ee3p cho nhu c\u1ea7u c\u1ee7a m\u1ecdi gia \u0111\u00ecnh \u0111\u1ec3 \u0111em l\u1ea1i kh\u00f4ng gian s\u1ed1ng l\u00e0nh m\u1ea1nh, d\u1ec5 ch\u1ecbu h\u00e0ng ng\u00e0y. Mua \u0111i\u1ec1u h\u00f2a Comfee Inverter 12.000 BTU (1.5 HP) SIRIUS-12ED ch\u00ednh h\u00e3ng t\u1ea1i Ho\u00e0ng H\u00e0 Mobile Khi mua m\u00e1y l\u1ea1nh Comfee Inverter 12.000 BTU (1.5 HP) SIRIUS-12ED ch\u00ednh h\u00e3ng t\u1ea1i Ho\u00e0ng H\u00e0 Mobile, kh\u00e1ch h\u00e0ng s\u1ebd nh\u1eadn \u0111\u01b0\u1ee3c nhi\u1ec1u \u01b0u \u0111\u00e3i v\u00e0 d\u1ecbch v\u1ee5 h\u1ea5p d\u1eabn. \u0110\u1ea7u ti\u00ean, s\u1ea3n ph\u1ea9m \u0111\u01b0\u1ee3c \u0111\u1ea3m b\u1ea3o ch\u1ea5t l\u01b0\u1ee3ng ch\u00ednh h\u00e3ng, mang l\u1ea1i s\u1ef1 an t\u00e2m tuy\u1ec7t \u0111\u1ed1i cho ng\u01b0\u1eddi ti\u00eau d\u00f9ng. Ho\u00e0ng H\u00e0 Mobile c\u0169ng cung c\u1ea5p ch\u00ednh s\u00e1ch mi\u1ec5n ph\u00ed v\u1eadn chuy\u1ec3n to\u00e0n qu\u1ed1c, gi\u00fap kh\u00e1ch h\u00e0ng ti\u1ebft ki\u1ec7m chi ph\u00ed \u0111\u00e1ng k\u1ec3 v\u00e0 nh\u1eadn s\u1ea3n ph\u1ea9m m\u1ed9t c\u00e1ch thu\u1eadn ti\u1ec7n nh\u1ea5t. B\u00ean c\u1ea1nh \u0111\u00f3, ch\u00fang t\u00f4i \u0111\u01b0a ra m\u1ee9c gi\u00e1 c\u1ea3 c\u1ea1nh tranh nh\u1ea5t tr\u00ean th\u1ecb tr\u01b0\u1eddng, k\u00e8m theo \u0111\u00f3 l\u00e0 c\u00e1c ch\u01b0\u01a1ng tr\u00ecnh khuy\u1ebfn m\u00e3i v\u00e0 \u01b0u \u0111\u00e3i h\u1ea5p d\u1eabn, l\u00e0m t\u0103ng th\u00eam gi\u00e1 tr\u1ecb mua s\u1eafm cho kh\u00e1ch h\u00e0ng. \u0110\u1ed1i v\u1edbi nh\u1eefng kh\u00e1ch h\u00e0ng c\u00f3 nhu c\u1ea7u, Ho\u00e0ng H\u00e0 Mobile c\u00f2n h\u1ed7 tr\u1ee3 mua h\u00e0ng tr\u1ea3 g\u00f3p v\u1edbi l\u00e3i su\u1ea5t 0% \u0111\u1ec3 d\u1ec5 d\u00e0ng s\u1edf h\u1eefu \u0111i\u1ec1u h\u00f2a Comfee m\u00e0 kh\u00f4ng c\u1ea7n lo l\u1eafng v\u1ec1 v\u1ea5n \u0111\u1ec1 t\u00e0i ch\u00ednh. Th\u00eam v\u00e0o \u0111\u00f3, Ho\u00e0ng H\u00e0 Mobile t\u1ef1 h\u00e0o c\u00f3 \u0111\u1ed9i ng\u0169 t\u01b0 v\u1ea5n chuy\u00ean nghi\u1ec7p v\u00e0 chu \u0111\u00e1o. \u0110\u1ed9i ng\u0169 c\u1ee7a ch\u00fang t\u00f4i s\u1eb5n s\u00e0ng cung c\u1ea5p t\u1ea5t c\u1ea3 th\u00f4ng tin c\u1ea7n thi\u1ebft v\u00e0 h\u1ed7 tr\u1ee3 kh\u00e1ch h\u00e0ng l\u1ef1a ch\u1ecdn s\u1ea3n ph\u1ea9m ph\u00f9 h\u1ee3p nh\u1ea5t v\u1edbi nhu c\u1ea7u, \u0111\u1ea3m b\u1ea3o tr\u1ea3i nghi\u1ec7m mua s\u1eafm tr\u1ecdn v\u1eb9n v\u00e0 tho\u1ea3i m\u00e1i nh\u1ea5t. Xem to\u00e0n b\u1ed9 b\u00e0i vi\u1ebft",
        "promotion_1": "1. Tr\u00fang 8386 qu\u00e0 - T\u1ed5ng gi\u00e1 tr\u1ecb t\u1edbi 250 TRI\u1ec6U \u0110\u1ed2NG (\u00c1p d\u1ee5ng t\u1eeb 10/01 - 02/02/2025). (Xem chi ti\u1ebft). 2. \u0110\u1eb7c bi\u1ec7t Tr\u1ea3 g\u00f3p 3 kh\u00f4ng: 0% l\u00e3i su\u1ea5t - 0 ph\u00ed chuy\u1ec3n \u0111\u1ed5i - 0 tr\u1ea3 tr\u01b0\u1edbc (\u00c1p d\u1ee5ng cho c\u00f4ng ty t\u00e0i ch\u00ednh v\u00e0 th\u1ebb t\u00edn d\u1ee5ng)",
        "promotion_2": "1. Gi\u1ea3m t\u1edbi 500.000\u0111 khi thanh to\u00e1n th\u1ebb t\u00edn d\u1ee5ng NCB. (Xem chi ti\u1ebft). 2. Gi\u1ea3m \u0111\u1ebfn 150.000\u0111 khi thanh to\u00e1n qua Muadee. (Xem chi ti\u1ebft). 3. Mi\u1ec5n ph\u00ed chuy\u1ec3n \u0111\u1ed5i tr\u1ea3 g\u00f3p ho\u1eb7c gi\u1ea3m \u0111\u1ebfn 500.000\u0111 khi m\u1edf th\u1ebb TPBank EVO. (Xem chi ti\u1ebft). 4. M\u1edf th\u1ebb t\u00edn d\u1ee5ng VIB - Nh\u1eadn Voucher 600.000\u0111. (Xem chi ti\u1ebft). 5. M\u1edf th\u1ebb HSBC - Ho\u00e0n ti\u1ec1n t\u1edbi 2 tri\u1ec7u \u0111\u1ed3ng. (Xem chi ti\u1ebft)"
    },
    {
        "title": "\u0110i\u1ec1u h\u00f2a Comfee Inverter 10.000 BTU (1 HP) CFS-10VCB1",
        "price": "gi\u00e1 hi\u1ec7n t\u1ea1i l\u00e0 8,070,000 \u20ab nh\u01b0ng tr\u01b0\u1edbc \u0111\u00e2y n\u00f3 c\u00f3 gi\u00e1 l\u00e0 9,490,000 \u20ab",
        "colors": "Tr\u1eafng",
        "technical_specifications": [
            {
                "Lo\u1ea1i m\u00e1y": "1 chi\u1ec1u (ch\u1ec9 l\u00e0m l\u1ea1nh)"
            },
            {
                "C\u00f4ng ngh\u1ec7 inverter": "M\u00e1y l\u1ea1nh Inverter"
            },
            {
                "C\u00f4ng su\u1ea5t l\u00e0m l\u1ea1nh": "1 HP - 10.000 BTU"
            },
            {
                "Ph\u1ea1m vi l\u00e0m l\u1ea1nh hi\u1ec7u qu\u1ea3": "D\u01b0\u1edbi 15m\u00b2 (t\u1eeb 30 \u0111\u1ebfn 45m\u00b3)"
            },
            {
                "Nh\u00e3n n\u0103ng l\u01b0\u1ee3ng": "5 sao (Hi\u1ec7u su\u1ea5t n\u0103ng l\u01b0\u1ee3ng 6.01)"
            }
        ],
        "description": "M\u00e1y l\u1ea1nh Comfee Inverter 1 HP CFS-10VCB1 \u0111\u1ebfn t\u1eeb th\u01b0\u01a1ng hi\u1ec7u \u00dd, s\u1ea3n xu\u1ea5t t\u1ea1i Th\u00e1i Lan, v\u1edbi c\u00f4ng su\u1ea5t l\u00e0m l\u1ea1nh 1 HP ph\u00f9 h\u1ee3p cho kh\u00f4ng gian d\u01b0\u1edbi 15m\u00b2 . Thi\u1ebft b\u1ecb \u0111\u01b0\u1ee3c t\u00edch h\u1ee3p c\u00f4ng ngh\u1ec7 l\u00e0m l\u1ea1nh si\u00eau t\u1ed1c Cool Flash , v\u00e0 c\u00f4ng ngh\u1ec7 kh\u1eed khu\u1ea9n Ionize . K\u00e8m theo \u0111\u00f3, s\u1ea3n ph\u1ea9m s\u1eed d\u1ee5ng c\u00f4ng ngh\u1ec7 Inverter ti\u1ebft ki\u1ec7m \u0111i\u1ec7n n\u0103ng v\u00e0 k\u1ebft n\u1ed1i wifi ti\u1ec7n l\u1ee3i, mang \u0111\u1ebfn kh\u00f4ng gian s\u1ed1ng m\u00e1t m\u1ebb v\u00e0 trong l\u00e0nh cho gia \u0111\u00ecnh b\u1ea1n. \u0110\u1eb7c \u0111i\u1ec3m n\u1ed5i b\u1eadt Thi\u1ebft k\u1ebf m\u00e0u tr\u1eafng trang nh\u00e3, ph\u00f9 h\u1ee3p v\u1edbi nhi\u1ec1u phong c\u00e1ch n\u1ed9i th\u1ea5t. Kh\u1ea3 n\u0103ng l\u00e0m l\u1ea1nh nhanh ch\u00f3ng, mang l\u1ea1i s\u1ef1 tho\u1ea3i m\u00e1i t\u1ee9c th\u00ec cho ng\u01b0\u1eddi s\u1eed d\u1ee5ng. Th\u1ed5i gi\u00f3 qua 5013 l\u1ed7 nh\u1ecf, t\u1ea1o lu\u1ed3ng kh\u00f4ng kh\u00ed nh\u1eb9 nh\u00e0ng, d\u1ec5 ch\u1ecbu v\u00e0 b\u1ea3o v\u1ec7 s\u1ee9c kh\u1ecfe. C\u00f4ng ngh\u1ec7 Ionize v\u00e0 l\u1ecdc k\u00e9p Dual Filtration lo\u1ea1i b\u1ecf vi khu\u1ea9n, b\u1ee5i b\u1ea9n v\u00e0 c\u00e1c ch\u1ea5t \u0111\u1ed9c h\u1ea1i. \u0110i\u1ec1u khi\u1ec3n t\u1eeb xa qua \u1ee9ng d\u1ee5ng di \u0111\u1ed9ng, gi\u00fap qu\u1ea3n l\u00fd v\u00e0 v\u1eadn h\u00e0nh m\u00e1y l\u1ea1nh d\u1ec5 d\u00e0ng v\u00e0 ti\u1ec7n l\u1ee3i. B\u1ea3ng th\u00f4ng s\u1ed1 k\u1ef9 thu\u1eadt c\u1ee7a \u0111i\u1ec1u h\u00f2a Comfee Inverter 1 HP CFS-10VCB1 Th\u00f4ng s\u1ed1 Chi ti\u1ebft Lo\u1ea1i m\u00e1y 1 chi\u1ec1u (ch\u1ec9 l\u00e0m l\u1ea1nh) C\u00f4ng su\u1ea5t l\u00e0m l\u1ea1nh 1 HP - 10.000 BTU Ph\u1ea1m vi l\u00e0m l\u1ea1nh hi\u1ec7u qu\u1ea3 D\u01b0\u1edbi 15m\u00b2 (t\u1eeb 30 \u0111\u1ebfn 45m\u00b3) C\u00f4ng ngh\u1ec7 inverter M\u00e1y l\u1ea1nh Inverter \u0110\u1ed9 \u1ed3n trung b\u00ecnh 38.5/33/30.5 dB D\u00f2ng s\u1ea3n ph\u1ea9m 2024 S\u1ea3n xu\u1ea5t t\u1ea1i Th\u00e1i Lan Th\u1eddi gian b\u1ea3o h\u00e0nh c\u1ee5c l\u1ea1nh 2 n\u0103m Th\u1eddi gian b\u1ea3o h\u00e0nh c\u1ee5c n\u00f3ng M\u00e1y n\u00e9n 2 n\u0103m Ch\u1ea5t li\u1ec7u d\u00e0n t\u1ea3n nhi\u1ec7t \u1ed0ng d\u1eabn gas b\u1eb1ng \u0110\u1ed3ng - L\u00e1 t\u1ea3n nhi\u1ec7t b\u1eb1ng Nh\u00f4m ph\u1ee7 Golden Coating Lo\u1ea1i Gas R-32 M\u1ee9c ti\u00eau th\u1ee5 \u0111i\u1ec7n n\u0103ng 0.8 kW/h Nh\u00e3n n\u0103ng l\u01b0\u1ee3ng 5 sao (Hi\u1ec7u su\u1ea5t n\u0103ng l\u01b0\u1ee3ng 6.01) C\u00f4ng ngh\u1ec7 ti\u1ebft ki\u1ec7m \u0111i\u1ec7n Eco Gear Kh\u1ea3 n\u0103ng l\u1ecdc kh\u00f4ng kh\u00ed L\u1ecdc b\u1ee5i, kh\u00e1ng khu\u1ea9n, kh\u1eed m\u00f9i C\u00f4ng ngh\u1ec7 l\u00e0m l\u1ea1nh High Power Ti\u1ec7n \u00edch \u0110i\u1ec1u khi\u1ec3n b\u1eb1ng \u0111i\u1ec7n tho\u1ea1i, c\u00f3 wifi, Remote c\u00f3 \u0111\u00e8n LED, K\u1ebft n\u1ed1i th\u00f4ng minh IOT,... K\u00edch th\u01b0\u1edbc - Kh\u1ed1i l\u01b0\u1ee3ng d\u00e0n l\u1ea1nh D\u00e0i 81.2 cm - Cao 29.9 cm - D\u00e0y 19.9 cm - N\u1eb7ng 9.3 kg K\u00edch th\u01b0\u1edbc - Kh\u1ed1i l\u01b0\u1ee3ng d\u00e0n n\u00f3ng D\u00e0i 72 cm - Cao 49.5 cm - D\u00e0y 27 cm - N\u1eb7ng 20 kg Chi\u1ec1u d\u00e0i l\u1eafp \u0111\u1eb7t \u1ed1ng \u0111\u1ed3ng T\u1ed1i \u0111a 15m Kho\u1ea3ng c\u00e1ch gi\u1eefa c\u1ee5c n\u00f3ng v\u00e0 l\u1ea1nh T\u1ed1i \u0111a 10m D\u00f2ng \u0111i\u1ec7n v\u00e0o 1 pha K\u00edch th\u01b0\u1edbc \u1ed1ng \u0111\u1ed3ng 6.35/9.52 mm \u0110\u00e1nh gi\u00e1 chi ti\u1ebft v\u1ec1 c\u00e1c t\u00ednh n\u0103ng c\u1ee7a m\u00e1y l\u1ea1nh Comfee Inverter 1 HP CFS-10VCB1 Comfee Inverter CFS-10VCB1 \u0111\u01b0\u1ee3c thi\u1ebft k\u1ebf \u0111\u1ec3 mang l\u1ea1i s\u1ef1 tho\u1ea3i m\u00e1i t\u1ed1i \u0111a cho kh\u00f4ng gian s\u1ed1ng c\u1ee7a b\u1ea1n. V\u1edbi c\u00f4ng ngh\u1ec7 ti\u00ean ti\u1ebfn v\u00e0 c\u00e1c t\u00ednh n\u0103ng n\u1ed5i b\u1eadt, s\u1ea3n ph\u1ea9m n\u00e0y kh\u00f4ng ch\u1ec9 gi\u00fap l\u00e0m m\u00e1t hi\u1ec7u qu\u1ea3 m\u00e0 c\u00f2n ti\u1ebft ki\u1ec7m n\u0103ng l\u01b0\u1ee3ng. Thi\u1ebft k\u1ebf hi\u1ec7n \u0111\u1ea1i v\u00e0 tinh t\u1ebf \u0110i\u1ec1u h\u00f2a Comfee Inverter 1 HP CFS-10VCB1 s\u1edf h\u1eefu thi\u1ebft k\u1ebf tinh t\u1ebf v\u1edbi gam m\u00e0u tr\u1eafng trang nh\u00e3, d\u1ec5 d\u00e0ng h\u00f2a h\u1ee3p v\u1edbi nhi\u1ec1u phong c\u00e1ch n\u1ed9i th\u1ea5t kh\u00e1c nhau. V\u1ecf m\u00e1y \u0111\u01b0\u1ee3c l\u00e0m t\u1eeb nh\u1ef1a ch\u1ea5t l\u01b0\u1ee3ng cao, h\u1ea1n ch\u1ebf r\u1ea1n n\u1ee9t trong qu\u00e1 tr\u00ecnh s\u1eed d\u1ee5ng, \u0111\u1ea3m b\u1ea3o \u0111\u1ed9 b\u1ec1n b\u1ec9 theo th\u1eddi gian. \u0110\u1eb7c bi\u1ec7t, d\u00e0n l\u1ea1nh c\u1ee7a m\u00e1y \u0111\u01b0\u1ee3c t\u00edch h\u1ee3p m\u00e0n h\u00ecnh LCD hi\u1ec3n th\u1ecb nhi\u1ec7t \u0111\u1ed9 r\u00f5 r\u00e0ng, gi\u00fap ng\u01b0\u1eddi d\u00f9ng d\u1ec5 d\u00e0ng ki\u1ec3m tra v\u00e0 \u0111i\u1ec1u ch\u1ec9nh nhi\u1ec7t \u0111\u1ed9 m\u1ed9t c\u00e1ch nhanh ch\u00f3ng. B\u00ean c\u1ea1nh \u0111\u00f3, d\u00e0n n\u00f3ng c\u1ee7a m\u00e1y c\u00f3 ki\u1ec3u d\u00e1ng t\u1ed1i gi\u1ea3n nh\u01b0ng kh\u00f4ng k\u00e9m ph\u1ea7n thanh l\u1ecbch v\u1edbi s\u1eafc tr\u1eafng t\u01b0\u01a1ng t\u1ef1 d\u00e0n l\u1ea1nh. V\u1ecf ngo\u00e0i \u0111\u01b0\u1ee3c l\u00e0m t\u1eeb nh\u00f4m s\u01a1n c\u00e1ch \u0111i\u1ec7n, \u0111\u1ea3m b\u1ea3o an to\u00e0n khi ti\u1ebfp x\u00fac v\u00e0 ch\u1ecbu \u0111\u01b0\u1ee3c l\u1ef1c t\u00e1c \u0111\u1ed9ng t\u1ed1t. \u0110\u1ed3ng th\u1eddi, \u1ed1ng d\u1eabn gas b\u1eb1ng \u0111\u1ed3ng v\u00e0 c\u00e1nh t\u1ea3n nhi\u1ec7t nh\u00f4m \u0111\u01b0\u1ee3c ph\u1ee7 l\u1edbp Golden Coating gi\u00fap t\u0103ng c\u01b0\u1eddng s\u1ef1 b\u1ea3o v\u1ec7, ch\u1ed1ng l\u1ea1i s\u1ef1 \u0103n m\u00f2n, ng\u0103n ch\u1eb7n s\u1ef1 ph\u00e1t tri\u1ec3n c\u1ee7a vi khu\u1ea9n v\u00e0 n\u1ea5m m\u1ed1c, t\u1eeb \u0111\u00f3 \u0111\u1ea3m b\u1ea3o hi\u1ec7u su\u1ea5t v\u00e0 k\u00e9o d\u00e0i tu\u1ed5i th\u1ecd c\u1ee7a thi\u1ebft b\u1ecb. M\u00e1y l\u1ea1nh Comfee Inverter 1 HP CFS-10VCB1 s\u1edf h\u1eefu c\u00f4ng ngh\u1ec7 l\u00e0m l\u1ea1nh hi\u1ec7u qu\u1ea3 Comfee Inverter CFS-10VCB1 v\u1edbi c\u00f4ng su\u1ea5t l\u00e0m l\u1ea1nh 1 HP - 10.000 BTU, l\u00e0 l\u1ef1a ch\u1ecdn l\u00fd t\u01b0\u1edfng cho nh\u1eefng kh\u00f4ng gian nh\u1ecf d\u01b0\u1edbi 15m\u00b2 (t\u01b0\u01a1ng \u0111\u01b0\u01a1ng 30 \u0111\u1ebfn 45m\u00b3). S\u1ea3n ph\u1ea9m n\u00e0y ph\u00f9 h\u1ee3p cho ph\u00f2ng kh\u00e1ch nh\u1ecf, ph\u00f2ng ng\u1ee7 ho\u1eb7c ph\u00f2ng l\u00e0m vi\u1ec7c, \u0111\u1ea3m b\u1ea3o mang \u0111\u1ebfn s\u1ef1 tho\u1ea3i m\u00e1i v\u00e0 m\u00e1t m\u1ebb. M\u1ed9t trong nh\u1eefng t\u00ednh n\u0103ng n\u1ed5i b\u1eadt c\u1ee7a chi\u1ebfc m\u00e1y l\u00e0 c\u00f4ng ngh\u1ec7 l\u00e0m l\u1ea1nh nhanh High Power. C\u00f4ng ngh\u1ec7 n\u00e0y gi\u00fap m\u00e1y l\u1ea1nh t\u0103ng t\u1ed1c \u0111\u1ed9 l\u00e0m l\u1ea1nh nhanh ch\u00f3ng, mang l\u1ea1i kh\u00f4ng kh\u00ed m\u00e1t m\u1ebb ngay t\u1ee9c th\u00ec. \u0110i\u1ec1u n\u00e0y \u0111\u1eb7c bi\u1ec7t h\u1eefu \u00edch trong nh\u1eefng ng\u00e0y n\u1eafng n\u00f3ng gay g\u1eaft, khi ng\u01b0\u1eddi d\u00f9ng c\u1ea7n kh\u00f4ng gian m\u00e1t m\u1ebb nhanh ch\u00f3ng \u0111\u1ec3 sinh ho\u1ea1t v\u00e0 l\u00e0m vi\u1ec7c tho\u1ea3i m\u00e1i. Ti\u1ebft ki\u1ec7m \u0111i\u1ec7n v\u1edbi \u0111i\u1ec1u h\u00f2a Comfee Inverter 1 HP CFS-10VCB1 M\u00e1y l\u1ea1nh Comfee CFS-10VCB1 \u0111\u01b0\u1ee3c trang b\u1ecb c\u00f4ng ngh\u1ec7 bi\u1ebfn t\u1ea7n Inverter v\u1edbi b\u1ed9 vi x\u1eed l\u00fd E-max, cho ph\u00e9p m\u00e1y n\u00e9n v\u1eadn h\u00e0nh tr\u01a1n tru v\u00e0 \u1ed5n \u0111\u1ecbnh. C\u00f4ng ngh\u1ec7 n\u00e0y gi\u00fap t\u1ed1i \u01b0u hi\u1ec7u su\u1ea5t v\u00e0 h\u1ea1n ch\u1ebf hao ph\u00ed \u0111i\u1ec7n n\u0103ng v\u00e0 t\u0103ng tu\u1ed5i th\u1ecd c\u1ee7a m\u00e1y l\u1ea1nh. M\u1ed9t \u0111i\u1ec3m \u0111\u00e1ng ch\u00fa \u00fd kh\u00e1c c\u1ee7a m\u00e1y l\u1ea1nh Comfee l\u00e0 ch\u1ebf \u0111\u1ed9 Eco. Khi ch\u1ebf \u0111\u1ed9 n\u00e0y \u0111\u01b0\u1ee3c k\u00edch ho\u1ea1t, thi\u1ebft b\u1ecb s\u1ebd ho\u1ea1t \u0111\u1ed9ng v\u1edbi m\u1ee9c ti\u00eau th\u1ee5 \u0111i\u1ec7n n\u0103ng th\u1ea5p, gi\u00fap ti\u1ebft ki\u1ec7m l\u00ean t\u1edbi 71% n\u0103ng l\u01b0\u1ee3ng so v\u1edbi c\u00e1c m\u00e1y l\u1ea1nh th\u00f4ng th\u01b0\u1eddng. B\u00ean c\u1ea1nh \u0111\u00f3, m\u00e1y l\u1ea1nh Comfee c\u00f2n t\u00edch h\u1ee3p ch\u1ebf \u0111\u1ed9 Gear v\u1edbi 3 m\u1ee9c c\u00f4ng su\u1ea5t thi\u1ebft l\u1eadp: 100%, 75%, v\u00e0 50%. Ng\u01b0\u1eddi d\u00f9ng c\u00f3 th\u1ec3 d\u1ec5 d\u00e0ng t\u00f9y ch\u1ecdn m\u1ee9c c\u00f4ng su\u1ea5t ph\u00f9 h\u1ee3p v\u1edbi s\u1ed1 l\u01b0\u1ee3ng ng\u01b0\u1eddi trong ph\u00f2ng, kh\u00f4ng gian v\u00e0 nhu c\u1ea7u s\u1eed d\u1ee5ng, t\u1eeb \u0111\u00f3 tr\u00e1nh l\u00e3ng ph\u00ed \u0111i\u1ec7n n\u0103ng. C\u01a1 ch\u1ebf th\u1ed5i gi\u00f3 th\u00f4ng minh M\u00e1y l\u1ea1nh Comfee Inverter 1 HP CFS-10VCB1 n\u1ed5i b\u1eadt v\u1edbi kh\u1ea3 n\u0103ng th\u1ed5i gi\u00f3 theo c\u01a1 ch\u1ebf \u0111i\u1ec1u khi\u1ec3n l\u00ean xu\u1ed1ng t\u1ef1 \u0111\u1ed9ng, gi\u00fap lan t\u1ecfa kh\u00ed l\u1ea1nh \u0111\u1ec1u kh\u1eafp ph\u00f2ng. C\u01a1 ch\u1ebf n\u00e0y \u0111\u1ea3m b\u1ea3o m\u1ecdi ng\u00f3c ng\u00e1ch trong ph\u00f2ng \u0111\u1ec1u nh\u1eadn \u0111\u01b0\u1ee3c lu\u1ed3ng kh\u00f4ng kh\u00ed m\u00e1t m\u1ebb, mang l\u1ea1i s\u1ef1 tho\u1ea3i m\u00e1i t\u1ed1i \u0111a cho ng\u01b0\u1eddi d\u00f9ng. D\u00f9 b\u1ea1n \u0111ang l\u00e0m vi\u1ec7c, ngh\u1ec9 ng\u01a1i hay vui ch\u01a1i, b\u1ea1n s\u1ebd lu\u00f4n c\u1ea3m th\u1ea5y d\u1ec5 ch\u1ecbu v\u00e0 m\u00e1t m\u1ebb. M\u1ed9t t\u00ednh n\u0103ng \u0111\u1eb7c bi\u1ec7t kh\u00e1c c\u1ee7a m\u00e1y l\u1ea1nh Comfee l\u00e0 c\u1ea3m bi\u1ebfn nhi\u1ec7t \u0111\u1ed9 Follow Me. T\u00ednh n\u0103ng n\u00e0y cho ph\u00e9p m\u00e1y l\u1ea1nh nh\u1eadn bi\u1ebft nhi\u1ec7t \u0111\u1ed9 m\u00f4i tr\u01b0\u1eddng xung quanh remote v\u00e0 t\u1ef1 \u0111\u1ed9ng \u0111i\u1ec1u ch\u1ec9nh sao cho nhi\u1ec7t \u0111\u1ed9 quanh remote \u0111\u1ea1t m\u1ee9c \u0111\u00e3 thi\u1ebft l\u1eadp. \u0110\u1ed3ng ngh\u0129a v\u1edbi vi\u1ec7c, d\u00f9 b\u1ea1n di chuy\u1ec3n remote \u0111\u1ebfn b\u1ea5t k\u1ef3 v\u1ecb tr\u00ed n\u00e0o trong ph\u00f2ng, m\u00e1y l\u1ea1nh s\u1ebd \u0111i\u1ec1u ch\u1ec9nh nhi\u1ec7t \u0111\u1ed9 ph\u00f9 h\u1ee3p \u0111\u1ec3 \u0111\u1ea3m b\u1ea3o s\u1ef1 tho\u1ea3i m\u00e1i cho b\u1ea1n. \u0110i\u1ec1u h\u00f2a Comfee Inverter 1 HP CFS-10VCB1 gi\u00fap lo\u1ea1i b\u1ecf m\u00f9i, b\u1ee5i b\u1ea9n ra kh\u1ecfi ph\u00f2ng b\u1ea1n M\u00e1y l\u1ea1nh Comfee \u0111\u01b0\u1ee3c trang b\u1ecb c\u00f4ng ngh\u1ec7 l\u1ecdc k\u00e9p Dual Filtration, c\u00f3 kh\u1ea3 n\u0103ng lo\u1ea1i b\u1ecf b\u1ee5i b\u1ea9n, k\u1ec3 c\u1ea3 nh\u1eefng h\u1ea1t b\u1ee5i nh\u1ecf k\u00edch th\u01b0\u1edbc t\u1eeb 0.7 - 0.75 mm. B\u1ed9 l\u1ecdc n\u00e0y c\u00f2n c\u00f3 t\u00e1c d\u1ee5ng kh\u1eed m\u00f9i, gi\u1eef cho kh\u00f4ng gian ph\u00f2ng lu\u00f4n trong l\u00e0nh v\u00e0 \u0111\u1ea3m b\u1ea3o s\u1ee9c kh\u1ecfe cho c\u1ea3 gia \u0111\u00ecnh. V\u1edbi c\u00f4ng ngh\u1ec7 n\u00e0y, kh\u00f4ng kh\u00ed trong ph\u00f2ng lu\u00f4n \u0111\u01b0\u1ee3c l\u1ecdc s\u1ea1ch, mang l\u1ea1i m\u00f4i tr\u01b0\u1eddng s\u1ed1ng trong l\u00e0nh v\u00e0 tho\u1ea3i m\u00e1i. \u0110\u1eb7c bi\u1ec7t, m\u00e1y l\u1ea1nh Comfee c\u00f2n s\u1eed d\u1ee5ng c\u00f4ng ngh\u1ec7 kh\u1eed khu\u1ea9n b\u1eb1ng Ion \u00e2m Ionize, gi\u00fap t\u0103ng hi\u1ec7u qu\u1ea3 di\u1ec7t khu\u1ea9n v\u00e0 mang l\u1ea1i b\u1ea7u kh\u00f4ng kh\u00ed s\u1ea1ch s\u1ebd, tinh khi\u1ebft. C\u00f4ng ngh\u1ec7 n\u00e0y \u0111\u1eb7c bi\u1ec7t quan tr\u1ecdng trong vi\u1ec7c b\u1ea3o v\u1ec7 s\u1ee9c kh\u1ecfe ng\u01b0\u1eddi d\u00f9ng, \u0111\u1eb7c bi\u1ec7t trong nh\u1eefng m\u00f4i tr\u01b0\u1eddng c\u00f3 nhi\u1ec1u vi khu\u1ea9n v\u00e0 n\u1ea5m m\u1ed1c. Ngo\u00e0i ra, m\u00e1y l\u1ea1nh Comfee c\u00f2n t\u00edch h\u1ee3p ch\u1ebf \u0111\u1ed9 t\u1ef1 l\u00e0m s\u1ea1ch Active-Clean, gi\u00fap t\u1ef1 \u0111\u1ed9ng v\u1ec7 sinh d\u00e0n l\u1ea1nh theo m\u1ed9t quy tr\u00ecnh th\u00f4ng minh. M\u00e1y s\u1ebd t\u0103ng c\u00f4ng su\u1ea5t t\u1ed1i \u0111a trong m\u1ed9t kho\u1ea3ng th\u1eddi gian \u0111\u1ec3 \u0111\u00f3ng b\u0103ng n\u1ea5m m\u1ed1c, d\u1ea7u m\u1ee1 v\u00e0 b\u1ee5i b\u1eb7m b\u00e1m tr\u00ean d\u00e0n t\u1ea3n nhi\u1ec7t. Sau \u0111\u00f3, m\u00e1y s\u1ebd l\u00e0m tan b\u0103ng \u0111\u1ed9t ng\u1ed9t \u0111\u1ec3 c\u00e1c ch\u1ea5t b\u1ea9n b\u1ecb cu\u1ed1n \u0111i theo d\u00f2ng n\u01b0\u1edbc. Cu\u1ed1i c\u00f9ng, m\u00e1y s\u1ebd ch\u1ea1y \u1edf ch\u1ebf \u0111\u1ed9 qu\u1ea1t \u0111\u1ec3 l\u00e0m kh\u00f4 d\u00e0n l\u1ea1nh, ng\u0103n vi khu\u1ea9n v\u00e0 n\u1ea5m m\u1ed1c ph\u00e1t tri\u1ec3n tr\u1edf l\u1ea1i. Ti\u1ec7n \u00edch th\u00f4ng minh kh\u00e1c V\u1edbi s\u1ef1 k\u1ebft h\u1ee3p c\u1ee7a c\u00e1c t\u00ednh n\u0103ng hi\u1ec7n \u0111\u1ea1i, m\u00e1y l\u1ea1nh Comfee Inverter 1 HP CFS-10VCB1 h\u1ee9a h\u1eb9n s\u1ebd mang l\u1ea1i s\u1ef1 ti\u1ec7n nghi v\u00e0 tho\u1ea3i m\u00e1i t\u1ed1i \u0111a cho ng\u01b0\u1eddi d\u00f9ng. H\u1ed7 tr\u1ee3 k\u1ebft n\u1ed1i wifi, cho ph\u00e9p ng\u01b0\u1eddi d\u00f9ng \u0111i\u1ec1u khi\u1ec3n thi\u1ebft b\u1ecb t\u1eeb xa qua \u1ee9ng d\u1ee5ng Nethome Plus. \u1ee8ng d\u1ee5ng n\u00e0y cho ph\u00e9p \u0111i\u1ec1u khi\u1ec3n m\u00e1y l\u1ea1nh b\u1eb1ng gi\u1ecdng n\u00f3i, cung c\u1ea5p b\u00e1o c\u00e1o m\u1ee9c ti\u00eau th\u1ee5 \u0111i\u1ec7n, xem gi\u1edbi h\u1ea1n nhi\u1ec7t \u0111\u1ed9, c\u1ea3nh b\u00e1o hao \u0111i\u1ec7n v\u00e0 thi\u1ebft l\u1eadp nhi\u1ec7t \u0111\u1ed9 theo gi\u1ea5c ng\u1ee7. Ch\u1ebf \u0111\u1ed9 Soft Wind t\u1ea1o ra lu\u1ed3ng kh\u00ed nh\u1eb9 nh\u00e0ng th\u00f4ng qua thi\u1ebft k\u1ebf 2 c\u00e1nh gi\u00f3 v\u1edbi 5013 l\u1ed7 gi\u00f3 nh\u1ecf. T\u00ednh n\u0103ng n\u00e0y mang l\u1ea1i s\u1ef1 th\u01b0 th\u00e1i cho ng\u01b0\u1eddi d\u00f9ng khi ho\u1ea1t \u0111\u1ed9ng trong ph\u00f2ng, b\u1ea3o v\u1ec7 s\u1ee9c kh\u1ecfe v\u00e0 tr\u00e1nh hi\u1ec7n t\u01b0\u1ee3ng gi\u00f3 l\u1ea1nh th\u1ed5i tr\u1ef1c ti\u1ebfp g\u00e2y kh\u00f3 ch\u1ecbu. Remote c\u1ee7a m\u00e1y l\u1ea1nh Comfee \u0111\u01b0\u1ee3c trang b\u1ecb \u0111\u00e8n LED, gi\u00fap chi\u1ebfu s\u00e1ng r\u00f5 r\u00e0ng v\u00e0 cho ph\u00e9p ng\u01b0\u1eddi d\u00f9ng thao t\u00e1c d\u1ec5 d\u00e0ng, ch\u00ednh x\u00e1c h\u01a1n k\u1ec3 c\u1ea3 trong \u0111i\u1ec1u ki\u1ec7n thi\u1ebfu s\u00e1ng. Ch\u1ebf \u0111\u1ed9 ch\u0103m s\u00f3c gi\u1ea5c ng\u1ee7 Sleep Curve mang \u0111\u1ebfn l\u00e0n gi\u00f3 m\u00e1t d\u1ec5 ch\u1ecbu, duy tr\u00ec m\u1ee9c nhi\u1ec7t \u1ed5n \u0111\u1ecbnh su\u1ed1t \u0111\u00eam, gi\u00fap ng\u01b0\u1eddi d\u00f9ng c\u00f3 gi\u1ea5c ng\u1ee7 ngon v\u00e0 tr\u1ecdn v\u1eb9n. Gi\u00e1 tham kh\u1ea3o c\u1ee7a \u0111i\u1ec1u h\u00f2a Comfee Inverter 1 HP CFS-10VCB1 M\u00e1y l\u1ea1nh Comfee Inverter CFS-10VCB1 hi\u1ec7n \u0111ang \u0111\u01b0\u1ee3c b\u00e1n v\u1edbi m\u1ee9c gi\u00e1 h\u1ea5p d\u1eabn t\u1ea1i Ho\u00e0ng H\u00e0 Mobile. L\u01b0u \u00fd : M\u1ee9c gi\u00e1 c\u00f3 th\u1ec3 thay \u0111\u1ed5i t\u00f9y theo c\u00e1c ch\u01b0\u01a1ng tr\u00ecnh khuy\u1ebfn m\u00e3i c\u1ee7a Ho\u00e0ng H\u00e0 Mobile. Li\u00ean h\u1ec7 tr\u1ef1c ti\u1ebfp v\u1edbi ch\u00fang t\u00f4i \u0111\u1ec3 c\u00f3 th\u00f4ng tin ch\u00ednh x\u00e1c nh\u1ea5t. V\u1edbi c\u00f4ng ngh\u1ec7 Inverter ti\u00ean ti\u1ebfn, s\u1ea3n ph\u1ea9m kh\u00f4ng ch\u1ec9 gi\u00fap ti\u1ebft ki\u1ec7m \u0111i\u1ec7n n\u0103ng m\u00e0 c\u00f2n mang l\u1ea1i s\u1ef1 tho\u1ea3i m\u00e1i t\u1ed1i \u0111a cho ng\u01b0\u1eddi d\u00f9ng. V\u1edbi thi\u1ebft k\u1ebf nh\u1ecf g\u1ecdn c\u00f9ng hi\u1ec7u su\u1ea5t l\u00e0m l\u1ea1nh nhanh ch\u00f3ng, chi\u1ebfc m\u00e1y l\u1ea1nh n\u00e0y ch\u1eafc ch\u1eafn s\u1ebd l\u00e0m h\u00e0i l\u00f2ng v\u1edbi c\u1ea3 nh\u1eefng kh\u00e1ch h\u00e0ng kh\u00f3 t\u00ednh nh\u1ea5t. V\u00ec sao n\u00ean mua m\u00e1y l\u1ea1nh Comfee Inverter 1 HP CFS-10VCB1 t\u1ea1i Ho\u00e0ng H\u00e0 Mobile? Ho\u00e0ng H\u00e0 Mobile lu\u00f4n mang \u0111\u1ebfn cho kh\u00e1ch h\u00e0ng nh\u1eefng tr\u1ea3i nghi\u1ec7m mua s\u1eafm tuy\u1ec7t v\u1eddi c\u00f9ng v\u1edbi c\u00e1c \u01b0u \u0111\u00e3i h\u1ea5p d\u1eabn. Khi mua s\u1ea3n ph\u1ea9m \u0111i\u1ec1u h\u00f2a Comfee Inverter CFS-10VCB1 t\u1ea1i Ho\u00e0ng H\u00e0 Mobile, kh\u00e1ch h\u00e0ng s\u1ebd nh\u1eadn \u0111\u01b0\u1ee3c nhi\u1ec1u l\u1ee3i \u00edch \u0111\u00e1ng k\u1ec3. Gi\u00e1 c\u1ea3 c\u1ea1nh tranh: Comfee Inverter 1 \u0111ang \u0111\u01b0\u1ee3c Ho\u00e0ng H\u00e0 Mobile cung c\u1ea5p v\u1edbi m\u1ee9c gi\u00e1 t\u1ed1t nh\u1ea5t tr\u00ean th\u1ecb tr\u01b0\u1eddng. Khuy\u1ebfn m\u00e3i h\u1ea5p d\u1eabn: Ho\u00e0ng H\u00e0 Mobile th\u01b0\u1eddng xuy\u00ean c\u00f3 c\u00e1c ch\u01b0\u01a1ng tr\u00ecnh khuy\u1ebfn m\u00e3i bao g\u1ed3m gi\u1ea3m gi\u00e1 tr\u1ef1c ti\u1ebfp, t\u1eb7ng k\u00e8m qu\u00e0 h\u1ea5p d\u1eabn, ho\u1eb7c c\u00e1c \u01b0u \u0111\u00e3i kh\u00e1c \u0111\u1ec3 gia t\u0103ng gi\u00e1 tr\u1ecb cho kh\u00e1ch h\u00e0ng. H\u1ed7 tr\u1ee3 tr\u1ea3 g\u00f3p 0% l\u00e3i su\u1ea5t: \u0110\u1ec3 t\u1ea1o \u0111i\u1ec1u ki\u1ec7n thu\u1eadn l\u1ee3i cho kh\u00e1ch h\u00e0ng, Ho\u00e0ng H\u00e0 Mobile cung c\u1ea5p d\u1ecbch v\u1ee5 tr\u1ea3 g\u00f3p v\u1edbi l\u00e3i su\u1ea5t 0% khi mua s\u1ea3n ph\u1ea9m t\u1ea1i \u0111\u00e2y. Ch\u00ednh s\u00e1ch b\u1ea3o h\u00e0nh uy t\u00edn: S\u1ea3n ph\u1ea9m \u0111\u01b0\u1ee3c b\u1ea3o h\u00e0nh ch\u00ednh h\u00e3ng, \u0111\u1ea3m b\u1ea3o s\u1ef1 an t\u00e2m cho kh\u00e1ch h\u00e0ng trong qu\u00e1 tr\u00ecnh s\u1eed d\u1ee5ng. Ngo\u00e0i ra, c\u1eeda h\u00e0ng c\u00f2n c\u00f3 ch\u00ednh s\u00e1ch \u0111\u1ed5i tr\u1ea3 linh ho\u1ea1t, h\u1ed7 tr\u1ee3 kh\u00e1ch h\u00e0ng khi c\u00f3 v\u1ea5n \u0111\u1ec1 ph\u00e1t sinh. D\u1ecbch v\u1ee5 kh\u00e1ch h\u00e0ng chuy\u00ean nghi\u1ec7p: \u0110\u1ed9i ng\u0169 nh\u00e2n vi\u00ean t\u1eadn t\u00ecnh v\u00e0 chuy\u00ean nghi\u1ec7p lu\u00f4n s\u1eb5n s\u00e0ng t\u01b0 v\u1ea5n v\u00e0 h\u1ed7 tr\u1ee3 kh\u00e1ch h\u00e0ng, t\u1eeb vi\u1ec7c ch\u1ecdn l\u1ef1a s\u1ea3n ph\u1ea9m ph\u00f9 h\u1ee3p \u0111\u1ebfn vi\u1ec7c gi\u1ea3i \u0111\u00e1p c\u00e1c th\u1eafc m\u1eafc v\u1ec1 k\u1ef9 thu\u1eadt v\u00e0 s\u1eed d\u1ee5ng s\u1ea3n ph\u1ea9m. V\u1edbi nh\u1eefng \u01b0u \u0111\u00e3i v\u00e0 ch\u00ednh s\u00e1ch h\u1ea5p d\u1eabn, vi\u1ec7c mua Comfee Inverter 1 HP CFS-10VCB1 t\u1ea1i Ho\u00e0ng H\u00e0 Mobile kh\u00f4ng ch\u1ec9 gi\u00fap b\u1ea1n ti\u1ebft ki\u1ec7m chi ph\u00ed m\u00e0 c\u00f2n mang l\u1ea1i tr\u1ea3i nghi\u1ec7m mua s\u1eafm tuy\u1ec7t v\u1eddi. H\u00e3y \u0111\u1ebfn Ho\u00e0ng H\u00e0 Mobile \u0111\u1ec3 nh\u1eadn \u0111\u01b0\u1ee3c nh\u1eefng \u01b0u \u0111\u00e3i t\u1ed1t nh\u1ea5t v\u00e0 s\u1edf h\u1eefu ngay s\u1ea3n ph\u1ea9m ch\u1ea5t l\u01b0\u1ee3ng n\u00e0y nh\u00e9. Xem to\u00e0n b\u1ed9 b\u00e0i vi\u1ebft",
        "promotion_1": "1. Tr\u00fang 8386 qu\u00e0 - T\u1ed5ng gi\u00e1 tr\u1ecb t\u1edbi 250 TRI\u1ec6U \u0110\u1ed2NG (\u00c1p d\u1ee5ng t\u1eeb 10/01 - 02/02/2025). (Xem chi ti\u1ebft). 2. \u0110\u1eb7c bi\u1ec7t Tr\u1ea3 g\u00f3p 3 kh\u00f4ng: 0% l\u00e3i su\u1ea5t - 0 ph\u00ed chuy\u1ec3n \u0111\u1ed5i - 0 tr\u1ea3 tr\u01b0\u1edbc (\u00c1p d\u1ee5ng cho c\u00f4ng ty t\u00e0i ch\u00ednh v\u00e0 th\u1ebb t\u00edn d\u1ee5ng)",
        "promotion_2": "1. Gi\u1ea3m t\u1edbi 500.000\u0111 khi thanh to\u00e1n th\u1ebb t\u00edn d\u1ee5ng NCB. (Xem chi ti\u1ebft). 2. Gi\u1ea3m \u0111\u1ebfn 150.000\u0111 khi thanh to\u00e1n qua Muadee. (Xem chi ti\u1ebft). 3. Mi\u1ec5n ph\u00ed chuy\u1ec3n \u0111\u1ed5i tr\u1ea3 g\u00f3p ho\u1eb7c gi\u1ea3m \u0111\u1ebfn 500.000\u0111 khi m\u1edf th\u1ebb TPBank EVO. (Xem chi ti\u1ebft). 4. M\u1edf th\u1ebb t\u00edn d\u1ee5ng VIB - Nh\u1eadn Voucher 600.000\u0111. (Xem chi ti\u1ebft). 5. M\u1edf th\u1ebb HSBC - Ho\u00e0n ti\u1ec1n t\u1edbi 2 tri\u1ec7u \u0111\u1ed3ng. (Xem chi ti\u1ebft)"
    },
    {
        "title": "\u0110i\u1ec1u h\u00f2a Comfee Inverter 25.000 BTU (2.5 HP) CFS-25VAF",
        "price": "gi\u00e1 hi\u1ec7n t\u1ea1i l\u00e0 14,240,000 \u20ab nh\u01b0ng tr\u01b0\u1edbc \u0111\u00e2y n\u00f3 c\u00f3 gi\u00e1 l\u00e0 15,990,000 \u20ab",
        "colors": "Tr\u1eafng",
        "technical_specifications": [
            {
                "Lo\u1ea1i m\u00e1y": "1 chi\u1ec1u (ch\u1ec9 l\u00e0m l\u1ea1nh)"
            },
            {
                "C\u00f4ng ngh\u1ec7 inverter": "M\u00e1y l\u1ea1nh Inverter"
            },
            {
                "C\u00f4ng su\u1ea5t l\u00e0m l\u1ea1nh": "2.5 HP - 25.000 BTU"
            },
            {
                "Ph\u1ea1m vi l\u00e0m l\u1ea1nh hi\u1ec7u qu\u1ea3": "T\u1eeb 30 - 40m\u00b2 (t\u1eeb 80 \u0111\u1ebfn 120m\u00b3)"
            },
            {
                "Nh\u00e3n n\u0103ng l\u01b0\u1ee3ng": "5 sao (Hi\u1ec7u su\u1ea5t n\u0103ng l\u01b0\u1ee3ng 5.05)"
            }
        ],
        "description": "\u0110i\u1ec1u h\u00f2a Comfee Inverter 2.5 HP CFS-25VAF l\u00e0 gi\u1ea3i ph\u00e1p l\u00e0m m\u00e1t ho\u00e0n h\u1ea3o cho kh\u00f4ng gian s\u1ed1ng hi\u1ec7n \u0111\u1ea1i. V\u1edbi c\u00f4ng su\u1ea5t 2.5 HP , chi\u1ebfc m\u00e1y l\u1ea1nh n\u00e0y d\u1ec5 d\u00e0ng \u0111\u00e1p \u1ee9ng nhu c\u1ea7u l\u00e0m m\u00e1t cho c\u0103n ph\u00f2ng c\u00f3 di\u1ec7n t\u00edch t\u1eeb 30-40m2 . C\u00f4ng ngh\u1ec7 Inverter ti\u00ean ti\u1ebfn kh\u00f4ng ch\u1ec9 gi\u00fap ti\u1ebft ki\u1ec7m \u0111i\u1ec7n n\u0103ng hi\u1ec7u qu\u1ea3 m\u00e0 c\u00f2n mang \u0111\u1ebfn kh\u1ea3 n\u0103ng v\u1eadn h\u00e0nh \u00eam \u00e1i, b\u1ec1n b\u1ec9. \u0110i\u1ec3m n\u1ed5i b\u1eadt ch\u00ednh l\u00e0 c\u00f4ng ngh\u1ec7 l\u00e0m l\u1ea1nh nhanh Hyper Tech , gi\u00fap c\u0103n ph\u00f2ng \u0111\u1ea1t nhi\u1ec7t \u0111\u1ed9 mong mu\u1ed1n ch\u1ec9 trong th\u1eddi gian ng\u1eafn. B\u00ean c\u1ea1nh \u0111\u00f3, m\u00e1y c\u00f2n \u0111\u01b0\u1ee3c trang b\u1ecb b\u1ed9 l\u1ecdc k\u00e9p Dual Filtration gi\u00fap l\u1ecdc s\u1ea1ch kh\u00f4ng kh\u00ed, b\u1ea3o v\u1ec7 s\u1ee9c kh\u1ecfe ng\u01b0\u1eddi d\u00f9ng. \u0110\u1eb7c \u0111i\u1ec3m n\u1ed5i b\u1eadt: Ki\u1ec3u d\u00e1ng hi\u1ec7n \u0111\u1ea1i, sang tr\u1ecdng ph\u00f9 h\u1ee3p v\u1edbi nhi\u1ec1u kh\u00f4ng gian n\u1ed9i th\u1ea5t kh\u00e1c nhau. M\u00e0n h\u00ecnh hi\u1ec3n th\u1ecb nhi\u1ec7t \u0111\u1ed9 tr\u00ean d\u00e0n l\u1ea1nh gi\u00fap d\u1ec5 d\u00e0ng theo d\u00f5i v\u00e0 \u0111i\u1ec1u ch\u1ec9nh nhi\u1ec7t \u0111\u1ed9. Ch\u1ebf \u0111\u1ed9 Eco ti\u1ebft ki\u1ec7m \u0111i\u1ec7n gi\u00fap t\u1ed1i \u01b0u h\u00f3a ho\u1ea1t \u0111\u1ed9ng c\u1ee7a m\u00e1y l\u1ea1nh \u0111\u1ec3 ti\u1ebft ki\u1ec7m \u0111i\u1ec7n n\u0103ng m\u00e0 v\u1eabn \u0111\u1ea3m b\u1ea3o hi\u1ec7u qu\u1ea3 l\u00e0m m\u00e1t. C\u1ea3m bi\u1ebfn Follow me t\u1ef1 \u0111\u1ed9ng \u0111i\u1ec1u ch\u1ec9nh h\u01b0\u1edbng gi\u00f3 v\u00e0 nhi\u1ec7t \u0111\u1ed9 theo v\u1ecb tr\u00ed c\u1ee7a ng\u01b0\u1eddi d\u00f9ng, mang l\u1ea1i tr\u1ea3i nghi\u1ec7m tho\u1ea3i m\u00e1i nh\u1ea5t. Ch\u1ee9c n\u0103ng t\u1ef1 l\u00e0m s\u1ea1ch Active Clean gi\u00fap ng\u0103n ng\u1eeba s\u1ef1 h\u00ecnh th\u00e0nh v\u00e0 ph\u00e1t tri\u1ec3n c\u1ee7a n\u1ea5m m\u1ed1c, vi khu\u1ea9n tr\u00ean d\u00e0n l\u1ea1nh, \u0111\u1ea3m b\u1ea3o kh\u00f4ng kh\u00ed lu\u00f4n trong l\u00e0nh. B\u1ea3ng th\u00f4ng s\u1ed1 k\u1ef9 thu\u1eadt c\u1ee7a m\u00e1y l\u1ea1nh Comfee Inverter 2.5 HP CFS-25VAF Th\u00f4ng tin s\u1ea3n ph\u1ea9m Lo\u1ea1i m\u00e1y 1 chi\u1ec1u (ch\u1ec9 l\u00e0m l\u1ea1nh) C\u00f4ng su\u1ea5t l\u00e0m l\u1ea1nh 2.5 HP - 25.000 BTU Ph\u1ea1m vi l\u00e0m l\u1ea1nh hi\u1ec7u qu\u1ea3 T\u1eeb 30 - 40m\u00b2 (t\u1eeb 80 \u0111\u1ebfn 120m\u00b3) C\u00f4ng ngh\u1ec7 Inverter M\u00e1y l\u1ea1nh Inverter \u0110\u1ed9 \u1ed3n trung b\u00ecnh 33/40/45.5 dB Th\u1eddi gian b\u1ea3o h\u00e0nh c\u1ee5c l\u1ea1nh 2 n\u0103m Th\u1eddi gian b\u1ea3o h\u00e0nh c\u1ee5c n\u00f3ng M\u00e1y n\u00e9n 2 n\u0103m Ch\u1ea5t li\u1ec7u d\u00e0n t\u1ea3n nhi\u1ec7t \u1ed0ng d\u1eabn gas b\u1eb1ng \u0110\u1ed3ng - L\u00e1 t\u1ea3n nhi\u1ec7t b\u1eb1ng Nh\u00f4m ph\u1ee7 l\u1edbp ch\u1ed1ng \u0103n m\u00f2n Golden Coating Lo\u1ea1i Gas R - 32 M\u1ee9c ti\u00eau th\u1ee5 \u0111i\u1ec7n n\u0103ng Ti\u00eau th\u1ee5 \u0111i\u1ec7n 2.94 kW/h Nh\u00e3n n\u0103ng l\u01b0\u1ee3ng 5 sao (Hi\u1ec7u su\u1ea5t n\u0103ng l\u01b0\u1ee3ng 5.05) C\u00f4ng ngh\u1ec7 ti\u1ebft ki\u1ec7m \u0111i\u1ec7n Eco Gear Bi\u1ebfn t\u1ea7n Inverter v\u1edbi b\u1ed9 vi x\u1eed l\u00fd E-Max Kh\u1ea3 n\u0103ng l\u1ecdc kh\u00f4ng kh\u00ed L\u1ecdc b\u1ee5i, kh\u00e1ng khu\u1ea9n, kh\u1eed m\u00f9i C\u00f4ng ngh\u1ec7 l\u1ecdc k\u00e9p Dual Filtration Active Clean Mode C\u00f4ng ngh\u1ec7 l\u00e0m l\u1ea1nh Ch\u1ebf \u0111\u1ed9 gi\u00f3 \u0110i\u1ec1u khi\u1ec3n l\u00ean xu\u1ed1ng t\u1ef1 \u0111\u1ed9ng C\u00f4ng ngh\u1ec7 l\u00e0m l\u1ea1nh nhanh Hyper Tech Ti\u1ec7n \u00edch Ti\u1ec7n \u00edch \u0110i\u1ec1u khi\u1ec3n b\u1eb1ng \u0111i\u1ec7n tho\u1ea1i, c\u00f3 wifi Remote c\u00f3 \u0111\u00e8n LED K\u1ebft n\u1ed1i th\u00f4ng minh IOT Follow me - ch\u1ee9c n\u0103ng c\u00e0i \u0111\u1eb7t nhi\u1ec7t \u0111\u1ed9 t\u1ea1i v\u1ecb tr\u00ed remote Ch\u1ebf \u0111\u1ed9 t\u1ef1 l\u00e0m s\u1ea1ch Active-Clean Ch\u1ebf \u0111\u1ed9 ti\u1ebft ki\u1ec7m ch\u1ee7 \u0111\u1ed9ng Gear mode Ch\u1ebf \u0111\u1ed9 ch\u0103m s\u00f3c gi\u1ea5c ng\u1ee7 Sleep Curve M\u00e0n h\u00ecnh hi\u1ec3n th\u1ecb nhi\u1ec7t \u0111\u1ed9 tr\u00ean d\u00e0n l\u1ea1nh Ch\u1ee9c n\u0103ng h\u00fat \u1ea9m T\u1ef1 kh\u1edfi \u0111\u1ed9ng l\u1ea1i khi c\u00f3 \u0111i\u1ec7n \u0110i\u1ec1u khi\u1ec3n b\u1eb1ng gi\u1ecdng n\u00f3i Vi x\u1eed l\u00fd t\u1ed1i \u01b0u E-MAX C\u00f4ng ngh\u1ec7 AI Cool - \u0111i\u1ec1u khi\u1ec3n thi\u1ebft b\u1ecb b\u1eb1ng Smartphone Th\u00f4ng s\u1ed1 k\u00edch th\u01b0\u1edbc/l\u1eafp \u0111\u1eb7t K\u00edch th\u01b0\u1edbc - Kh\u1ed1i l\u01b0\u1ee3ng d\u00e0n l\u1ea1nh D\u00e0i 104 cm - Cao 32.7 cm - D\u00e0y 22 cm - N\u1eb7ng 12.36 kg K\u00edch th\u01b0\u1edbc - Kh\u1ed1i l\u01b0\u1ee3ng d\u00e0n n\u00f3ng D\u00e0i 89 cm - Cao 67.3 cm - D\u00e0y 34.2 cm - N\u1eb7ng 39.37 kg Chi\u1ec1u d\u00e0i l\u1eafp \u0111\u1eb7t \u1ed1ng \u0111\u1ed3ng T\u1ed1i \u0111a 20m Chi\u1ec1u cao l\u1eafp \u0111\u1eb7t t\u1ed1i \u0111a gi\u1eefa c\u1ee5c n\u00f3ng - l\u1ea1nh 12m D\u00f2ng \u0111i\u1ec7n v\u00e0o D\u00e0n l\u1ea1nh D\u00f2ng \u0111i\u1ec7n ho\u1ea1t \u0111\u1ed9ng 1 pha K\u00edch th\u01b0\u1edbc \u1ed1ng \u0111\u1ed3ng 10/16 S\u1ed1 l\u01b0\u1ee3ng k\u1ebft n\u1ed1i d\u00e0n l\u1ea1nh t\u1ed1i \u0111a 1 \u0110\u00e1nh gi\u00e1 chi ti\u1ebft v\u1ec1 c\u00e1c t\u00ednh n\u0103ng c\u1ee7a \u0111i\u1ec1u h\u00f2a Comfee Inverter 2.5 HP CFS-25VAF \u0110i\u1ec1u h\u00f2a Comfee Inverter CFS-25VAF n\u1ed5i b\u1eadt v\u1edbi nhi\u1ec1u t\u00ednh n\u0103ng hi\u1ec7n \u0111\u1ea1i, mang \u0111\u1ebfn tr\u1ea3i nghi\u1ec7m l\u00e0m m\u00e1t t\u1ed1i \u01b0u cho ng\u01b0\u1eddi d\u00f9ng. V\u1edbi c\u00e1c t\u00ednh n\u0103ng \u01b0u vi\u1ec7t, Comfee Inverter CFS-25VAF l\u00e0 m\u1ed9t s\u1ef1 l\u1ef1a ch\u1ecdn \u0111\u00e1ng gi\u00e1 v\u1edbi nh\u1eefng t\u00ednh n\u0103ng v\u01b0\u1ee3t tr\u1ed9i, \u0111\u00e1p \u1ee9ng nhu c\u1ea7u l\u00e0m m\u00e1t hi\u1ec7u qu\u1ea3 v\u00e0 ti\u1ec7n nghi cho kh\u00f4ng gian s\u1ed1ng hi\u1ec7n \u0111\u1ea1i. M\u00e1y l\u1ea1nh Comfee Inverter 2.5 HP CFS-25VAF v\u1edbi thi\u1ebft k\u1ebf tinh t\u1ebf v\u00e0 hi\u1ec7n \u0111\u1ea1i \u0110i\u1ec1u h\u00f2a Comfee Inverter CFS-25VAF s\u1edf h\u1eefu thi\u1ebft k\u1ebf hi\u1ec7n \u0111\u1ea1i, tinh t\u1ebf ph\u00f9 h\u1ee3p v\u1edbi nhi\u1ec1u kh\u00f4ng gian n\u1ed9i th\u1ea5t kh\u00e1c nhau v\u00e0 nhi\u1ec1u t\u00ednh n\u0103ng ti\u1ec7n d\u1ee5ng. V\u1edbi m\u1ed9t v\u00e0i c\u1ea3i ti\u1ebfn nh\u1ecf, \u0111\u00e2y s\u1ebd l\u00e0 l\u1ef1a ch\u1ecdn ho\u00e0n h\u1ea3o cho nh\u1eefng ai \u0111ang t\u00ecm ki\u1ebfm m\u1ed9t chi\u1ebfc \u0111i\u1ec1u h\u00f2a v\u1eeba \u0111\u1eb9p m\u1eaft v\u1eeba hi\u1ec7u qu\u1ea3. V\u1ec1 t\u1ed5ng quan, m\u00e1y l\u1ea1nh Comfee CFS-25VAF kho\u00e1c l\u00ean m\u00ecnh m\u1ed9t l\u1edbp v\u1ecf nh\u1ef1a tr\u1eafng s\u00e1ng, t\u1ea1o c\u1ea3m gi\u00e1c s\u1ea1ch s\u1ebd v\u00e0 sang tr\u1ecdng. C\u00e1c \u0111\u01b0\u1eddng n\u00e9t \u0111\u01b0\u1ee3c bo tr\u00f2n m\u1ec1m m\u1ea1i, kh\u00f4ng g\u00f3c c\u1ea1nh, mang l\u1ea1i v\u1ebb ngo\u00e0i thanh l\u1ecbch v\u00e0 hi\u1ec7n \u0111\u1ea1i. Thi\u1ebft k\u1ebf t\u1ed1i gi\u1ea3n n\u00e0y gi\u00fap \u0111i\u1ec1u h\u00f2a d\u1ec5 d\u00e0ng h\u00f2a nh\u1eadp v\u00e0o m\u1ecdi phong c\u00e1ch n\u1ed9i th\u1ea5t, t\u1eeb c\u1ed5 \u0111i\u1ec3n \u0111\u1ebfn hi\u1ec7n \u0111\u1ea1i. V\u1ecf nh\u1ef1a c\u1ee7a \u0111i\u1ec1u h\u00f2a \u0111\u01b0\u1ee3c l\u00e0m t\u1eeb ch\u1ea5t li\u1ec7u cao c\u1ea5p, c\u00f3 kh\u1ea3 n\u0103ng ch\u1ed1ng tr\u1ea7y x\u01b0\u1edbc v\u00e0 ch\u1ecbu \u0111\u01b0\u1ee3c t\u00e1c \u0111\u1ed9ng c\u1ee7a th\u1eddi ti\u1ebft. \u0110i\u1ec1u n\u00e0y gi\u00fap duy tr\u00ec v\u1ebb ngo\u00e0i m\u1edbi m\u1ebb c\u1ee7a \u0111i\u1ec1u h\u00f2a trong th\u1eddi gian d\u00e0i s\u1eed d\u1ee5ng. V\u1edbi k\u00edch th\u01b0\u1edbc kh\u00e1 nh\u1ecf g\u1ecdn so v\u1edbi c\u00e1c d\u00f2ng \u0111i\u1ec1u h\u00f2a 2.5HP kh\u00e1c, Comfee Inverter 2.5 HP CFS-25VAF kh\u00f4ng chi\u1ebfm qu\u00e1 nhi\u1ec1u di\u1ec7n t\u00edch tr\u00ean t\u01b0\u1eddng. \u0110i\u1ec1u n\u00e0y \u0111\u1eb7c bi\u1ec7t h\u1eefu \u00edch cho nh\u1eefng c\u0103n ph\u00f2ng c\u00f3 di\u1ec7n t\u00edch h\u1ea1n ch\u1ebf ho\u1eb7c nh\u1eefng ai y\u00eau th\u00edch s\u1ef1 t\u1ed1i gi\u1ea3n. Ngo\u00e0i ra, m\u1eb7t tr\u01b0\u1edbc c\u1ee7a \u0111i\u1ec1u h\u00f2a \u0111\u01b0\u1ee3c trang b\u1ecb m\u00e0n h\u00ecnh LED \u1ea9n, ch\u1ec9 hi\u1ec3n th\u1ecb khi m\u00e1y ho\u1ea1t \u0111\u1ed9ng. M\u00e0n h\u00ecnh n\u00e0y hi\u1ec3n th\u1ecb c\u00e1c th\u00f4ng s\u1ed1 nh\u01b0 nhi\u1ec7t \u0111\u1ed9, ch\u1ebf \u0111\u1ed9 ho\u1ea1t \u0111\u1ed9ng m\u1ed9t c\u00e1ch r\u00f5 r\u00e0ng, gi\u00fap ng\u01b0\u1eddi d\u00f9ng d\u1ec5 d\u00e0ng theo d\u00f5i v\u00e0 \u0111i\u1ec1u ch\u1ec9nh. D\u00e0n l\u1ea1nh c\u1ee7a CFS-25VAF \u0111\u01b0\u1ee3c thi\u1ebft k\u1ebf \u0111\u1ec3 d\u1ec5 d\u00e0ng th\u00e1o l\u1eafp v\u00e0 v\u1ec7 sinh. \u0110i\u1ec1u n\u00e0y gi\u00fap ng\u01b0\u1eddi d\u00f9ng ti\u1ebft ki\u1ec7m th\u1eddi gian v\u00e0 c\u00f4ng s\u1ee9c trong vi\u1ec7c b\u1ea3o d\u01b0\u1ee1ng \u0111\u1ecbnh k\u1ef3, \u0111\u1ea3m b\u1ea3o \u0111i\u1ec1u h\u00f2a lu\u00f4n ho\u1ea1t \u0111\u1ed9ng hi\u1ec7u qu\u1ea3 v\u00e0 kh\u00f4ng kh\u00ed trong l\u00e0nh. \u0110i k\u00e8m v\u1edbi \u0111i\u1ec1u h\u00f2a l\u00e0 chi\u1ebfc remote nh\u1ecf g\u1ecdn, v\u1eeba tay c\u1ea7m. C\u00e1c n\u00fat b\u1ea5m \u0111\u01b0\u1ee3c b\u1ed1 tr\u00ed h\u1ee3p l\u00fd, d\u1ec5 thao t\u00e1c. Remote c\u00f2n \u0111\u01b0\u1ee3c trang b\u1ecb \u0111\u00e8n n\u1ec1n, gi\u00fap ng\u01b0\u1eddi d\u00f9ng d\u1ec5 d\u00e0ng s\u1eed d\u1ee5ng trong \u0111i\u1ec1u ki\u1ec7n thi\u1ebfu s\u00e1ng. C\u00f4ng ngh\u1ec7 l\u00e0m l\u1ea1nh v\u01b0\u1ee3t tr\u1ed9i tr\u00ean \u0111i\u1ec1u h\u00f2a Comfee Inverter 2.5 HP CFS-25VAF C\u00f4ng ngh\u1ec7 l\u00e0m l\u1ea1nh c\u1ee7a \u0111i\u1ec1u h\u00f2a Comfee Inverter CFS-25VAF g\u00e2y \u1ea5n t\u01b0\u1ee3ng cho ng\u01b0\u1eddi d\u00f9ng v\u1edbi hi\u1ec7u su\u1ea5t l\u00e0m l\u1ea1nh v\u01b0\u1ee3t tr\u1ed9i, ti\u1ebft ki\u1ec7m n\u0103ng l\u01b0\u1ee3ng t\u1ed1i \u01b0u v\u00e0 tr\u1ea3i nghi\u1ec7m ng\u01b0\u1eddi d\u00f9ng tho\u1ea3i m\u00e1i. V\u1edbi nh\u1eefng t\u00ednh n\u0103ng ti\u00ean ti\u1ebfn v\u00e0 th\u00f4ng minh, s\u1ea3n ph\u1ea9m n\u00e0y x\u1ee9ng \u0111\u00e1ng l\u00e0 l\u1ef1a ch\u1ecdn h\u00e0ng \u0111\u1ea7u cho nh\u1eefng ai \u0111ang t\u00ecm ki\u1ebfm m\u1ed9t gi\u1ea3i ph\u00e1p l\u00e0m m\u00e1t hi\u1ec7u qu\u1ea3 v\u00e0 kinh t\u1ebf cho kh\u00f4ng gian s\u1ed1ng c\u1ee7a m\u00ecnh. \u0110i\u1ec3m nh\u1ea5n \u0111\u1ea7u ti\u00ean c\u1ee7a c\u00f4ng ngh\u1ec7 l\u00e0m l\u1ea1nh n\u00e0y ch\u00ednh l\u00e0 c\u00f4ng ngh\u1ec7 Inverter. Nh\u1edd v\u00e0o kh\u1ea3 n\u0103ng \u0111i\u1ec1u ch\u1ec9nh t\u1ed1c \u0111\u1ed9 m\u00e1y n\u00e9n linh ho\u1ea1t, thi\u1ebft b\u1ecb kh\u00f4ng ch\u1ec9 l\u00e0m l\u1ea1nh nhanh ch\u00f3ng m\u00e0 c\u00f2n duy tr\u00ec nhi\u1ec7t \u0111\u1ed9 \u1ed5n \u0111\u1ecbnh, tr\u00e1nh t\u00ecnh tr\u1ea1ng b\u1eadt t\u1eaft li\u00ean t\u1ee5c g\u00e2y hao ph\u00ed \u0111i\u1ec7n n\u0103ng. \u0110i\u1ec1u n\u00e0y gi\u00fap ng\u01b0\u1eddi d\u00f9ng ti\u1ebft ki\u1ec7m \u0111\u00e1ng k\u1ec3 chi ph\u00ed \u0111i\u1ec7n h\u00e0ng th\u00e1ng. B\u00ean c\u1ea1nh \u0111\u00f3, c\u00f4ng ngh\u1ec7 Hyper Tech \u0111\u1ed9c quy\u1ec1n c\u1ee7a Comfee cho ph\u00e9p m\u00e1y l\u1ea1nh Comfee Inverter 2.5 HP CFS-25VAF \u0111\u1ea1t \u0111\u1ebfn nhi\u1ec7t \u0111\u1ed9 mong mu\u1ed1n ch\u1ec9 trong th\u1eddi gian ng\u1eafn. Nh\u1edd s\u1ef1 k\u1ebft h\u1ee3p gi\u1eefa m\u00e1y n\u00e9n m\u1ea1nh m\u1ebd v\u00e0 qu\u1ea1t gi\u00f3 t\u1ed1i \u01b0u, kh\u00f4ng gian ph\u00f2ng \u0111\u01b0\u1ee3c l\u00e0m m\u00e1t nhanh ch\u00f3ng, mang l\u1ea1i c\u1ea3m gi\u00e1c tho\u1ea3i m\u00e1i t\u1ee9c th\u00ec, \u0111\u1eb7c bi\u1ec7t h\u1eefu \u00edch trong nh\u1eefng ng\u00e0y n\u1eafng n\u00f3ng. Kh\u00f4ng ch\u1ec9 l\u00e0m l\u1ea1nh nhanh, m\u00e1y l\u1ea1nh Comfee Inverter CFS-25VAF c\u00f2n \u0111\u01b0\u1ee3c trang b\u1ecb c\u1ea3m bi\u1ebfn iFeel th\u00f4ng minh. C\u1ea3m bi\u1ebfn n\u00e0y \u0111\u01b0\u1ee3c t\u00edch h\u1ee3p tr\u00ean remote, gi\u00fap \u0111i\u1ec1u h\u00f2a t\u1ef1 \u0111\u1ed9ng \u0111i\u1ec1u ch\u1ec9nh nhi\u1ec7t \u0111\u1ed9 d\u1ef1a tr\u00ean nhi\u1ec7t \u0111\u1ed9 xung quanh v\u1ecb tr\u00ed c\u1ee7a ng\u01b0\u1eddi d\u00f9ng. Nh\u1edd \u0111\u00f3, ng\u01b0\u1eddi d\u00f9ng lu\u00f4n c\u1ea3m th\u1ea5y tho\u1ea3i m\u00e1i v\u00e0 d\u1ec5 ch\u1ecbu m\u00e0 kh\u00f4ng c\u1ea7n ph\u1ea3i \u0111i\u1ec1u ch\u1ec9nh nhi\u1ec7t \u0111\u1ed9 li\u00ean t\u1ee5c. Th\u00eam v\u00e0o \u0111\u00f3, ch\u1ebf \u0111\u1ed9 Eco ti\u1ebft ki\u1ec7m \u0111i\u1ec7n n\u0103ng l\u00e0 m\u1ed9t \u0111i\u1ec3m c\u1ed9ng l\u1edbn cho c\u00f4ng ngh\u1ec7 l\u00e0m l\u1ea1nh c\u1ee7a \u0111i\u1ec1u h\u00f2a Comfee Inverter CFS-25VAF. Khi k\u00edch ho\u1ea1t ch\u1ebf \u0111\u1ed9 n\u00e0y, \u0111i\u1ec1u h\u00f2a s\u1ebd ho\u1ea1t \u0111\u1ed9ng \u1edf m\u1ee9c ti\u00eau th\u1ee5 \u0111i\u1ec7n n\u0103ng th\u1ea5p nh\u1ea5t, gi\u00fap ng\u01b0\u1eddi d\u00f9ng ti\u1ebft ki\u1ec7m \u0111i\u1ec7n n\u0103ng m\u00e0 v\u1eabn \u0111\u1ea3m b\u1ea3o hi\u1ec7u qu\u1ea3 l\u00e0m m\u00e1t. Kh\u1ea3 n\u0103ng ti\u1ebft ki\u1ec7m \u0111i\u1ec7n n\u0103ng tr\u00ean \u0111i\u1ec1u h\u00f2a Comfee Inverter 2.5 HP CFS-25VAF \u0110i\u1ec1u h\u00f2a Comfee Inverter CFS-25VAF l\u00e0 m\u1ed9t l\u1ef1a ch\u1ecdn \u0111\u00e1ng c\u00e2n nh\u1eafc cho nh\u1eefng ai \u0111ang t\u00ecm ki\u1ebfm m\u1ed9t chi\u1ebfc m\u00e1y l\u1ea1nh v\u1eeba l\u00e0m m\u00e1t hi\u1ec7u qu\u1ea3, v\u1eeba ti\u1ebft ki\u1ec7m \u0111i\u1ec7n n\u0103ng t\u1ed1i \u01b0u. V\u1edbi c\u00f4ng ngh\u1ec7 Inverter ti\u00ean ti\u1ebfn, m\u00e1y l\u1ea1nh n\u00e0y c\u00f3 kh\u1ea3 n\u0103ng \u0111i\u1ec1u ch\u1ec9nh c\u00f4ng su\u1ea5t ho\u1ea1t \u0111\u1ed9ng linh ho\u1ea1t, gi\u00fap duy tr\u00ec nhi\u1ec7t \u0111\u1ed9 \u1ed5n \u0111\u1ecbnh m\u00e0 kh\u00f4ng g\u00e2y l\u00e3ng ph\u00ed \u0111i\u1ec7n n\u0103ng nh\u01b0 c\u00e1c d\u00f2ng m\u00e1y l\u1ea1nh th\u00f4ng th\u01b0\u1eddng. M\u1ed9t \u0111i\u1ec3m c\u1ed9ng l\u1edbn c\u1ee7a thi\u1ebft b\u1ecb n\u00e0y l\u00e0 ch\u1ec9 s\u1ed1 hi\u1ec7u su\u1ea5t n\u0103ng l\u01b0\u1ee3ng (CSPF) cao, \u0111\u1ea1t t\u1edbi 4.87, t\u01b0\u01a1ng \u0111\u01b0\u01a1ng v\u1edbi m\u1ee9c 5 sao theo ti\u00eau chu\u1ea9n ti\u1ebft ki\u1ec7m n\u0103ng l\u01b0\u1ee3ng m\u1edbi c\u1ee7a Vi\u1ec7t Nam (TCVN 7830:2021). Tr\u00ean th\u1ef1c t\u1ebf, ng\u01b0\u1eddi d\u00f9ng m\u00e1y l\u1ea1nh Comfee Inverter 2.5 HP CFS-25VAF \u0111\u00e3 ghi nh\u1eadn m\u1ee9c gi\u1ea3m \u0111\u00e1ng k\u1ec3 trong h\u00f3a \u0111\u01a1n ti\u1ec1n \u0111i\u1ec7n h\u00e0ng th\u00e1ng so v\u1edbi khi s\u1eed d\u1ee5ng c\u00e1c d\u00f2ng m\u00e1y l\u1ea1nh th\u00f4ng th\u01b0\u1eddng kh\u00e1c. M\u00e1y l\u1ea1nh n\u00e0y c\u00f2n ho\u1ea1t \u0111\u1ed9ng \u00eam \u00e1i, kh\u00f4ng g\u00e2y ti\u1ebfng \u1ed3n kh\u00f3 ch\u1ecbu, \u0111\u1ed3ng th\u1eddi l\u00e0m l\u1ea1nh nhanh ch\u00f3ng v\u00e0 duy tr\u00ec nhi\u1ec7t \u0111\u1ed9 \u1ed5n \u0111\u1ecbnh, mang l\u1ea1i c\u1ea3m gi\u00e1c tho\u1ea3i m\u00e1i cho ng\u01b0\u1eddi d\u00f9ng. B\u00ean c\u1ea1nh kh\u1ea3 n\u0103ng ti\u1ebft ki\u1ec7m \u0111i\u1ec7n, \u0111i\u1ec1u h\u00f2a Comfee Inverter CFS-25VAF c\u00f2n \u0111\u01b0\u1ee3c trang b\u1ecb nhi\u1ec1u t\u00ednh n\u0103ng hi\u1ec7n \u0111\u1ea1i kh\u00e1c nh\u01b0 ch\u1ebf \u0111\u1ed9 Eco ti\u1ebft ki\u1ec7m \u0111i\u1ec7n, ch\u1ebf \u0111\u1ed9 ng\u1ee7 \u0111\u00eam, h\u1eb9n gi\u1edd b\u1eadt/t\u1eaft, t\u1ef1 kh\u1edfi \u0111\u1ed9ng l\u1ea1i khi c\u00f3 \u0111i\u1ec7n... T\u1ea5t c\u1ea3 nh\u1eefng t\u00ednh n\u0103ng n\u00e0y \u0111\u1ec1u g\u00f3p ph\u1ea7n n\u00e2ng cao tr\u1ea3i nghi\u1ec7m ng\u01b0\u1eddi d\u00f9ng v\u00e0 t\u1ed1i \u01b0u h\u00f3a kh\u1ea3 n\u0103ng ti\u1ebft ki\u1ec7m \u0111i\u1ec7n c\u1ee7a m\u00e1y l\u1ea1nh. Tuy nhi\u00ean, \u0111\u1ec3 \u0111\u1ea1t \u0111\u01b0\u1ee3c hi\u1ec7u qu\u1ea3 ti\u1ebft ki\u1ec7m \u0111i\u1ec7n t\u1ed1i \u0111a, ng\u01b0\u1eddi d\u00f9ng c\u1ea7n l\u01b0u \u00fd s\u1eed d\u1ee5ng m\u00e1y l\u1ea1nh \u0111\u00fang c\u00e1ch, ch\u1eb3ng h\u1ea1n nh\u01b0 \u0111\u1eb7t nhi\u1ec7t \u0111\u1ed9 h\u1ee3p l\u00fd (kho\u1ea3ng 25-27 \u0111\u1ed9 C), th\u01b0\u1eddng xuy\u00ean v\u1ec7 sinh l\u01b0\u1edbi l\u1ecdc b\u1ee5i, b\u1ea3o d\u01b0\u1ee1ng m\u00e1y l\u1ea1nh \u0111\u1ecbnh k\u1ef3. Kh\u1ea3 n\u0103ng l\u1ecdc kh\u00f4ng kh\u00ed, l\u1ecdc b\u1ee5i v\u00e0 kh\u1eed m\u00f9i \u1ea5n t\u01b0\u1ee3ng \u0110i\u1ec1u h\u00f2a Comfee Inverter 2.5 HP CFS-25VAF kh\u00f4ng ch\u1ec9 l\u00e0m m\u00e1t hi\u1ec7u qu\u1ea3 m\u00e0 c\u00f2n s\u1edf h\u1eefu kh\u1ea3 n\u0103ng l\u1ecdc kh\u00f4ng kh\u00ed \u0111\u00e1ng khen ng\u1ee3i, mang \u0111\u1ebfn b\u1ea7u kh\u00f4ng gian trong l\u00e0nh v\u00e0 b\u1ea3o v\u1ec7 s\u1ee9c kh\u1ecfe ng\u01b0\u1eddi d\u00f9ng. \u0110i\u1ec3m n\u1ed5i b\u1eadt \u0111\u1ea7u ti\u00ean l\u00e0 c\u00f4ng ngh\u1ec7 l\u1ecdc k\u00e9p Dual Filter, g\u1ed3m hai l\u1edbp l\u1ecdc ho\u1ea1t \u0111\u1ed9ng hi\u1ec7u qu\u1ea3. L\u1edbp l\u1ecdc b\u1ee5i \u0111\u1ea7u ti\u00ean lo\u1ea1i b\u1ecf c\u00e1c h\u1ea1t b\u1ee5i c\u00f3 k\u00edch th\u01b0\u1edbc l\u1edbn, ng\u0103n ch\u1eb7n ch\u00fang x\u00e2m nh\u1eadp v\u00e0o kh\u00f4ng kh\u00ed trong ph\u00f2ng. Ti\u1ebfp theo, l\u1edbp l\u1ecdc than ho\u1ea1t t\u00ednh s\u1ebd h\u1ea5p th\u1ee5 v\u00e0 ph\u00e2n h\u1ee7y c\u00e1c ch\u1ea5t \u0111\u1ed9c h\u1ea1i nh\u01b0 formaldehyde, amoniac v\u00e0 benzen, \u0111\u1ed3ng th\u1eddi kh\u1eed m\u00f9i h\u00f4i kh\u00f3 ch\u1ecbu, mang \u0111\u1ebfn kh\u00f4ng kh\u00ed trong l\u00e0nh v\u00e0 d\u1ec5 ch\u1ecbu h\u01a1n. B\u00ean c\u1ea1nh \u0111\u00f3, c\u00f4ng ngh\u1ec7 Active Clean t\u1ef1 \u0111\u1ed9ng l\u00e0m s\u1ea1ch d\u00e0n l\u1ea1nh c\u0169ng g\u00f3p ph\u1ea7n \u0111\u00e1ng k\u1ec3 v\u00e0o vi\u1ec7c duy tr\u00ec kh\u1ea3 n\u0103ng l\u1ecdc kh\u00f4ng kh\u00ed t\u1ed1i \u01b0u. C\u01a1 ch\u1ebf n\u00e0y ho\u1ea1t \u0111\u1ed9ng b\u1eb1ng c\u00e1ch \u0111\u00f3ng b\u0103ng b\u1ee5i b\u1ea9n, vi khu\u1ea9n v\u00e0 n\u1ea5m m\u1ed1c tr\u00ean d\u00e0n l\u1ea1nh, sau \u0111\u00f3 r\u00e3 \u0111\u00f4ng \u0111\u1ec3 cu\u1ed1n tr\u00f4i ch\u00fang theo d\u00f2ng n\u01b0\u1edbc ng\u01b0ng t\u1ee5. Nh\u1edd \u0111\u00f3, d\u00e0n l\u1ea1nh lu\u00f4n s\u1ea1ch s\u1ebd, kh\u00f4ng ch\u1ec9 \u0111\u1ea3m b\u1ea3o hi\u1ec7u qu\u1ea3 l\u00e0m m\u00e1t m\u00e0 c\u00f2n ng\u0103n ng\u1eeba s\u1ef1 ph\u00e1t tri\u1ec3n c\u1ee7a c\u00e1c t\u00e1c nh\u00e2n g\u00e2y h\u1ea1i cho s\u1ee9c kh\u1ecfe. Kh\u00f4ng ch\u1ec9 d\u1eebng l\u1ea1i \u1edf vi\u1ec7c l\u1ecdc s\u1ea1ch kh\u00f4ng kh\u00ed, \u0111i\u1ec1u h\u00f2a Comfee Inverter CFS-25VAF c\u00f2n t\u00edch h\u1ee3p t\u00ednh n\u0103ng Follow Me th\u00f4ng minh. C\u1ea3m bi\u1ebfn nhi\u1ec7t \u0111\u1ed9 \u0111\u01b0\u1ee3c t\u00edch h\u1ee3p tr\u00ean remote s\u1ebd t\u1ef1 \u0111\u1ed9ng \u0111i\u1ec1u ch\u1ec9nh h\u01b0\u1edbng gi\u00f3 v\u00e0 nhi\u1ec7t \u0111\u1ed9 \u0111\u1ec3 t\u1ea1o s\u1ef1 tho\u1ea3i m\u00e1i t\u1ed1i \u0111a cho ng\u01b0\u1eddi d\u00f9ng. \u0110i\u1ec1u n\u00e0y gi\u00fap tr\u00e1nh t\u00ecnh tr\u1ea1ng gi\u00f3 l\u1ea1nh th\u1ed5i tr\u1ef1c ti\u1ebfp v\u00e0o ng\u01b0\u1eddi, \u0111\u1eb7c bi\u1ec7t l\u00e0 \u0111\u1ed1i v\u1edbi tr\u1ebb nh\u1ecf v\u00e0 ng\u01b0\u1eddi l\u1edbn tu\u1ed5i. Tuy nhi\u00ean, ng\u01b0\u1eddi d\u00f9ng c\u1ea7n l\u01b0u \u00fd v\u1ec7 sinh v\u00e0 b\u1ea3o d\u01b0\u1ee1ng m\u00e0ng l\u1ecdc \u0111\u1ecbnh k\u1ef3 theo h\u01b0\u1edbng d\u1eabn c\u1ee7a nh\u00e0 s\u1ea3n xu\u1ea5t \u0111\u1ec3 \u0111\u1ea3m b\u1ea3o hi\u1ec7u qu\u1ea3 l\u1ecdc kh\u00f4ng kh\u00ed lu\u00f4n \u1edf m\u1ee9c t\u1ed1i \u01b0u. Gi\u00e1 tham kh\u1ea3o c\u1ee7a m\u00e1y l\u1ea1nh Comfee Inverter 2.5 HP CFS-25VAF Hi\u1ec7n nay, \u0111i\u1ec1u h\u00f2a Comfee Inverter CFS-25VAF \u0111\u01b0\u1ee3c b\u00e1n t\u1ea1i Ho\u00e0ng H\u00e0 Mobile v\u1edbi m\u1ee9c gi\u00e1 \u01b0u \u0111\u00e3i c\u00f9ng nhi\u1ec1u ch\u01b0\u01a1ng tr\u00ecnh khuy\u1ebfn m\u00e3i c\u1ef1c k\u1ef3 h\u1ea5p d\u1eabn. Tuy nhi\u00ean, t\u00f9y v\u00e0o t\u1eebng th\u1eddi \u0111i\u1ec3m m\u00e0 m\u00e1y l\u1ea1nh Comfee Inverter CFS-25VAF s\u1ebd c\u00f3 m\u1ee9c gi\u00e1 kh\u00e1c nhau. N\u1ebfu b\u1ea1n mu\u1ed1n bi\u1ebft ch\u00ednh x\u00e1c v\u1ec1 m\u1ee9c gi\u00e1 c\u1ee7a m\u00e1y l\u1ea1nh n\u00e0y, vui l\u00f2ng li\u00ean h\u1ec7 v\u1edbi Ho\u00e0ng H\u00e0 Mobile \u0111\u1ec3 \u0111\u01b0\u1ee3c t\u01b0 v\u1ea5n nhanh ch\u00f3ng v\u00e0 ch\u00ednh x\u00e1c nh\u1ea5t. S\u1ea3n ph\u1ea9m n\u00e0y l\u00e0 l\u1ef1a ch\u1ecdn s\u00e1ng gi\u00e1 cho nh\u1eefng ai \u0111ang t\u00ecm ki\u1ebfm gi\u1ea3i ph\u00e1p l\u00e0m m\u00e1t hi\u1ec7u qu\u1ea3, ti\u1ebft ki\u1ec7m \u0111i\u1ec7n v\u00e0 th\u00e2n thi\u1ec7n v\u1edbi m\u00f4i tr\u01b0\u1eddng. V\u1edbi c\u00f4ng su\u1ea5t 2.5 HP, chi\u1ebfc \u0111i\u1ec1u h\u00f2a n\u00e0y c\u00f3 th\u1ec3 l\u00e0m m\u00e1t nhanh ch\u00f3ng v\u00e0 d\u1ec5 d\u00e0ng kh\u00f4ng gian r\u1ed9ng t\u1eeb 30 \u0111\u1ebfn 40m2, ph\u00f9 h\u1ee3p cho ph\u00f2ng kh\u00e1ch, ph\u00f2ng ng\u1ee7 l\u1edbn ho\u1eb7c v\u0103n ph\u00f2ng nh\u1ecf. V\u00ec sao n\u00ean mua \u0111i\u1ec1u h\u00f2a Comfee Inverter 2.5 HP CFS-25VAF t\u1ea1i Ho\u00e0ng H\u00e0 Mobile? \u0110i\u1ec1u h\u00f2a Comfee Inverter CFS-25VAF l\u00e0 l\u1ef1a ch\u1ecdn l\u00fd t\u01b0\u1edfng cho kh\u00f4ng gian s\u1ed1ng hi\u1ec7n \u0111\u1ea1i, v\u00e0 Ho\u00e0ng H\u00e0 Mobile ch\u00ednh l\u00e0 \u0111i\u1ec3m \u0111\u1ebfn tin c\u1eady \u0111\u1ec3 s\u1edf h\u1eefu s\u1ea3n ph\u1ea9m n\u00e0y v\u1edbi nhi\u1ec1u \u01b0u \u0111\u00e3i h\u1ea5p d\u1eabn. C\u00f4ng ngh\u1ec7 Inverter ti\u00ean ti\u1ebfn gi\u00fap ti\u1ebft ki\u1ec7m \u0111i\u1ec7n n\u0103ng v\u01b0\u1ee3t tr\u1ed9i so v\u1edbi c\u00e1c d\u00f2ng \u0111i\u1ec1u h\u00f2a th\u00f4ng th\u01b0\u1eddng, \u0111\u1ed3ng th\u1eddi v\u1eadn h\u00e0nh \u00eam \u00e1i, kh\u00f4ng g\u00e2y ti\u1ebfng \u1ed3n kh\u00f3 ch\u1ecbu. B\u00ean c\u1ea1nh \u0111\u00f3, c\u00f4ng ngh\u1ec7 Hyper Tech gi\u00fap l\u00e0m l\u1ea1nh nhanh ch\u00f3ng, ch\u1ec9 trong v\u00e0i ph\u00fat, b\u1ea1n \u0111\u00e3 c\u00f3 th\u1ec3 t\u1eadn h\u01b0\u1edfng kh\u00f4ng gian m\u00e1t l\u1ea1nh s\u1ea3ng kho\u00e1i. Khi mua m\u00e1y l\u1ea1nh Comfee Inverter 2.5 HP CFS-25VAF t\u1ea1i Ho\u00e0ng H\u00e0 Mobile, b\u1ea1n s\u1ebd \u0111\u01b0\u1ee3c h\u01b0\u1edfng ch\u00ednh s\u00e1ch b\u1ea3o h\u00e0nh ch\u00ednh h\u00e3ng, d\u1ecbch v\u1ee5 giao h\u00e0ng v\u00e0 l\u1eafp \u0111\u1eb7t t\u1eadn n\u01a1i chuy\u00ean nghi\u1ec7p, c\u00f9ng nhi\u1ec1u ch\u01b0\u01a1ng tr\u00ecnh khuy\u1ebfn m\u00e3i h\u1ea5p d\u1eabn kh\u00e1c. \u0110\u1eebng b\u1ecf l\u1ee1 c\u01a1 h\u1ed9i s\u1edf h\u1eefu chi\u1ebfc \u0111i\u1ec1u h\u00f2a th\u00f4ng minh n\u00e0y v\u1edbi m\u1ee9c gi\u00e1 \u01b0u \u0111\u00e3i nh\u1ea5t! Xem to\u00e0n b\u1ed9 b\u00e0i vi\u1ebft",
        "promotion_1": "1. Tr\u00fang 8386 qu\u00e0 - T\u1ed5ng gi\u00e1 tr\u1ecb t\u1edbi 250 TRI\u1ec6U \u0110\u1ed2NG (\u00c1p d\u1ee5ng t\u1eeb 10/01 - 02/02/2025). (Xem chi ti\u1ebft). 2. \u0110\u1eb7c bi\u1ec7t Tr\u1ea3 g\u00f3p 3 kh\u00f4ng: 0% l\u00e3i su\u1ea5t - 0 ph\u00ed chuy\u1ec3n \u0111\u1ed5i - 0 tr\u1ea3 tr\u01b0\u1edbc (\u00c1p d\u1ee5ng cho c\u00f4ng ty t\u00e0i ch\u00ednh v\u00e0 th\u1ebb t\u00edn d\u1ee5ng)",
        "promotion_2": "1. Gi\u1ea3m t\u1edbi 500.000\u0111 khi thanh to\u00e1n th\u1ebb t\u00edn d\u1ee5ng NCB. (Xem chi ti\u1ebft). 2. Gi\u1ea3m \u0111\u1ebfn 150.000\u0111 khi thanh to\u00e1n qua Muadee. (Xem chi ti\u1ebft). 3. Mi\u1ec5n ph\u00ed chuy\u1ec3n \u0111\u1ed5i tr\u1ea3 g\u00f3p ho\u1eb7c gi\u1ea3m \u0111\u1ebfn 500.000\u0111 khi m\u1edf th\u1ebb TPBank EVO. (Xem chi ti\u1ebft). 4. M\u1edf th\u1ebb t\u00edn d\u1ee5ng VIB - Nh\u1eadn Voucher 600.000\u0111. (Xem chi ti\u1ebft). 5. M\u1edf th\u1ebb HSBC - Ho\u00e0n ti\u1ec1n t\u1edbi 2 tri\u1ec7u \u0111\u1ed3ng. (Xem chi ti\u1ebft)"
    },
    {
        "title": "\u0110i\u1ec1u h\u00f2a Comfee Inverter 27.000 BTU (3 HP) CFS-28VAF",
        "price": "gi\u00e1 hi\u1ec7n t\u1ea1i l\u00e0 18,040,000 \u20ab nh\u01b0ng tr\u01b0\u1edbc \u0111\u00e2y n\u00f3 c\u00f3 gi\u00e1 l\u00e0 19,990,000 \u20ab",
        "colors": "Tr\u1eafng",
        "technical_specifications": [
            {
                "Lo\u1ea1i m\u00e1y": "1 chi\u1ec1u (ch\u1ec9 l\u00e0m l\u1ea1nh)"
            },
            {
                "C\u00f4ng ngh\u1ec7 inverter": "M\u00e1y l\u1ea1nh Inverter"
            },
            {
                "C\u00f4ng su\u1ea5t l\u00e0m l\u1ea1nh": "3 HP - 27.000 BTU"
            },
            {
                "Ph\u1ea1m vi l\u00e0m l\u1ea1nh hi\u1ec7u qu\u1ea3": "T\u1eeb 40 - 50m\u00b2 (t\u1eeb 120 - 150m\u00b3)"
            },
            {
                "Nh\u00e3n n\u0103ng l\u01b0\u1ee3ng": "5 sao (Hi\u1ec7u su\u1ea5t n\u0103ng l\u01b0\u1ee3ng 4.87)"
            }
        ],
        "description": "\u0110i\u1ec1u h\u00f2a Comfee Inverter 27.000 BTU (3 HP) CFS-28VAF l\u00e0 chi\u1ebfc \u0111i\u1ec1u h\u00f2a c\u00f4ng su\u1ea5t l\u1edbn v\u00e0 ti\u1ebft ki\u1ec7m hi\u1ec7u qu\u1ea3 cho c\u00e1c h\u1ed9 gia \u0111\u00ecnh. S\u1ea3n ph\u1ea9m c\u00f3 m\u1ee9c c\u00f4ng su\u1ea5t 3 HP - 27.000 BTU , c\u00f3 th\u1ec3 l\u00e0m m\u00e1t c\u0103n ph\u00f2ng r\u1ed9ng t\u1edbi 40 - 50m2 . V\u1edbi c\u00f4ng ngh\u1ec7 l\u00e0m l\u1ea1nh nhanh Hyper Tech c\u00f9ng ch\u1ebf \u0111\u1ed9 Swing \u0111i\u1ec1u ch\u1ec9nh h\u01b0\u1edbng gi\u00f3 t\u1ef1 \u0111\u1ed9ng, ng\u01b0\u1eddi d\u00f9ng s\u1ebd c\u1ea3m nh\u1eadn \u0111\u01b0\u1ee3c kh\u00f4ng kh\u00ed m\u00e1t m\u1ebb ch\u1ec9 trong 40 gi\u00e2y lan t\u1ecfa \u0111\u1ec1u kh\u1eafp c\u0103n ph\u00f2ng. Thi\u1ebft b\u1ecb c\u00f2n \u0111em \u0111\u1ebfn kh\u1ea3 n\u0103ng ti\u1ebft ki\u1ec7m \u0111i\u1ec7n hi\u1ec7u qu\u1ea3 nh\u1edd c\u00f4ng ngh\u1ec7 bi\u1ebfn t\u1ea7n Inverter hi\u1ec7n \u0111\u1ea1i v\u1edbi vi x\u1eed l\u00fd E-Max v\u00e0 ch\u1ebf \u0111\u1ed9 Eco . Ngo\u00e0i ra, b\u1ea1n s\u1ebd lu\u00f4n \u0111\u01b0\u1ee3c h\u00edt th\u1edf b\u1ea7u kh\u00f4ng kh\u00ed tho\u00e1ng \u0111\u00e3ng, trong l\u00e0nh v\u1edbi c\u00f4ng ngh\u1ec7 l\u1ecdc k\u00e9p Dual Filter v\u00e0 ch\u1ebf \u0111\u1ed9 l\u00e0m s\u1ea1ch m\u00e1y l\u1ea1nh chuy\u00ean s\u00e2u Active Clean , gi\u00fap \u0111\u1ea3m b\u1ea3o s\u1ee9c kh\u1ecfe cho ng\u01b0\u1eddi d\u00f9ng. \u0110\u1eb7c \u0111i\u1ec3m n\u1ed5i b\u1eadt C\u00f4ng su\u1ea5t 3 HP - 27.000 BTU v\u00f4 c\u00f9ng m\u1ea1nh m\u1ebd, c\u00f3 th\u1ec3 l\u00e0m m\u00e1t c\u0103n ph\u00f2ng r\u1ed9ng t\u1edbi 40 - 50m2, ph\u00f9 h\u1ee3p v\u1edbi nhi\u1ec1u kh\u00f4ng gian. C\u00f4ng ngh\u1ec7 l\u00e0m l\u1ea1nh nhanh Hyper Tech c\u00f9ng ch\u1ebf \u0111\u1ed9 qu\u1ea1t gi\u00f3 Swing \u0111i\u1ec1u khi\u1ec3n l\u00ean xu\u1ed1ng t\u1ef1 \u0111\u1ed9ng gi\u00fap qu\u00e1 tr\u00ecnh l\u00e0m m\u00e1t nhanh h\u01a1n v\u00e0 t\u1ecfa \u0111\u1ec1u kh\u00f4ng kh\u00ed kh\u1eafp gian ph\u00f2ng. C\u00f4ng ngh\u1ec7 bi\u1ebfn t\u1ea7n Inverter v\u1edbi vi x\u1eed l\u00fd E-Max c\u00f9ng ch\u1ebf \u0111\u1ed9 Eco gi\u00fap m\u00e1y n\u00e9n lu\u00f4n ho\u1ea1t \u0111\u1ed9ng \u1ed5n \u0111\u1ecbnh, h\u1ea1n ch\u1ebf m\u1ee9c ti\u00eau hao n\u0103ng l\u01b0\u1ee3ng l\u00e3ng ph\u00ed, \u0111\u1ea3m b\u1ea3o duy tr\u00ec nhi\u1ec7t \u0111\u1ed9 ph\u00f9 h\u1ee3p, v\u1eeba ti\u1ebft ki\u1ec7m \u0111i\u1ec7n t\u1ed1t, v\u1eeba gi\u00fap thi\u1ebft b\u1ecb ho\u1ea1t \u0111\u1ed9ng \u00eam \u00e1i. Kh\u00f4ng kh\u00ed lu\u00f4n trong l\u00e0nh v\u00e0 tho\u00e1ng \u0111\u00e3ng v\u1edbi c\u00f4ng ngh\u1ec7 l\u1ecdc k\u00e9p Dual Filter gi\u00fap lo\u1ea1i b\u1ecf b\u1ee5i b\u1ea9n, n\u1ea5m m\u1ed1c c\u00f9ng ch\u1ebf \u0111\u1ed9 Active Clean l\u00e0m s\u1ea1ch chuy\u00ean s\u00e2u. B\u1ea3ng th\u00f4ng s\u1ed1 k\u1ef9 thu\u1eadt c\u1ee7a \u0111i\u1ec1u h\u00f2a Comfee Inverter 27.000 BTU (3 HP) CFS-28VAF Th\u00f4ng s\u1ed1 Chi ti\u1ebft Lo\u1ea1i m\u00e1y 1 chi\u1ec1u (ch\u1ec9 l\u00e0m l\u1ea1nh) C\u00f4ng su\u1ea5t l\u00e0m l\u1ea1nh 3 HP - 27.000 BTU Ph\u1ea1m vi l\u00e0m l\u1ea1nh hi\u1ec7u qu\u1ea3 T\u1eeb 40 - 50m2 (t\u1eeb 120 - 150m3) K\u00edch th\u01b0\u1edbc v\u00e0 tr\u1ecdng l\u01b0\u1ee3ng d\u00e0n l\u1ea1nh D\u00e0i 104 cm - Cao 32.7 cm - D\u00e0y 22 cm N\u1eb7ng 12.36 kg K\u00edch th\u01b0\u1edbc v\u00e0 tr\u1ecdng l\u01b0\u1ee3ng d\u00e0n n\u00f3ng D\u00e0i 89 cm - Cao 67.3 cm - D\u00e0y 34.2 cm N\u1eb7ng 39.37 kg \u0110\u1ed9 \u1ed3n trung b\u00ecnh 33/40/45.5 dB Lo\u1ea1i gas R-32 Ti\u00eau th\u1ee5 \u0111i\u1ec7n 2.81 kW/h C\u00f4ng ngh\u1ec7 ti\u1ebft ki\u1ec7m \u0111i\u1ec7n Eco Gear Bi\u1ebfn t\u1ea7n Inverter v\u1edbi b\u1ed9 vi x\u1eed l\u00fd E-Max Kh\u1ea3 n\u0103ng l\u1ecdc b\u1ee5i, kh\u00e1ng khu\u1ea9n, kh\u1eed m\u00f9i C\u00f4ng ngh\u1ec7 l\u1ecdc Dual Filtration Ch\u1ebf \u0111\u1ed9 Active Clean Ch\u1ebf \u0111\u1ed9 gi\u00f3 \u0110i\u1ec1u khi\u1ec3n l\u00ean xu\u1ed1ng t\u1ef1 \u0111\u1ed9ng C\u00f4ng ngh\u1ec7 l\u00e0m l\u1ea1nh nhanh Hyper Tech Ti\u1ec7n \u00edch \u0110i\u1ec1u khi\u1ec3n b\u1eb1ng \u0111i\u1ec7n tho\u1ea1i, c\u00f3 Wi-Fi Remote c\u00f3 \u0111\u00e8n LED K\u1ebft n\u1ed1i th\u00f4ng minh IoT Follow Me - ch\u1ee9c n\u0103ng c\u00e0i \u0111\u1eb7t nhi\u1ec7t \u0111\u1ed9 t\u1ea1i v\u1ecb tr\u00ed remote Ch\u1ebf \u0111\u1ed9 t\u1ef1 l\u00e0m s\u1ea1ch Active Clean Ch\u1ebf \u0111\u1ed9 ti\u1ebft ki\u1ec7m ch\u1ee7 \u0111\u1ed9ng Gear Ch\u1ebf \u0111\u1ed9 ch\u0103m s\u00f3c gi\u1ea5c ng\u1ee7 Sleep Curve M\u00e0n h\u00ecnh hi\u1ec3n th\u1ecb nhi\u1ec7t \u0111\u1ed9 tr\u00ean d\u00e0n l\u1ea1nh Ch\u1ee9c n\u0103ng h\u00fat \u1ea9m T\u1ef1 kh\u1edfi \u0111\u1ed9ng l\u1ea1i khi c\u00f3 \u0111i\u1ec7n \u0110i\u1ec1u khi\u1ec3n b\u1eb1ng gi\u1ecdng n\u00f3i Vi x\u1eed l\u00fd t\u1ed1i \u01b0u E-Max C\u00f4ng ngh\u1ec7 AI Cool - \u0111i\u1ec1u khi\u1ec3n thi\u1ebft b\u1ecb b\u1eb1ng smartphone D\u00f2ng \u0111i\u1ec7n v\u00e0o D\u00e0n l\u1ea1nh D\u00f2ng \u0111i\u1ec7n ho\u1ea1t \u0111\u1ed9ng 1 pha S\u1ed1 l\u01b0\u1ee3ng k\u1ebft n\u1ed1i d\u00e0n l\u1ea1nh t\u1ed1i \u0111a 1 \u0110\u00e1nh gi\u00e1 chi ti\u1ebft t\u00ednh n\u0103ng m\u00e1y l\u1ea1nh Comfee Inverter 27.000 BTU (3 HP) CFS-28VAF Comfee l\u00e0 m\u1ed9t trong nh\u1eefng th\u01b0\u01a1ng hi\u1ec7u \u0111i\u1ec1u h\u00f2a h\u00e0ng \u0111\u1ea7u th\u1ebf gi\u1edbi. V\u1edbi c\u00e1c d\u00f2ng thi\u1ebft b\u1ecb \u0111a d\u1ea1ng, t\u1eeb nh\u1eefng m\u1eabu c\u01a1 b\u1ea3n \u0111\u1ebfn c\u00e1c d\u00f2ng cao c\u1ea5p t\u00edch h\u1ee3p nhi\u1ec1u t\u00ednh n\u0103ng hi\u1ec7n \u0111\u1ea1i, s\u1ea3n ph\u1ea9m c\u1ee7a Comfee \u0111\u00e1p \u1ee9ng nhu c\u1ea7u c\u1ee7a nhi\u1ec1u \u0111\u1ed1i t\u01b0\u1ee3ng kh\u00e1ch h\u00e0ng. M\u1ed9t trong s\u1ed1 \u0111\u00f3 c\u00f3 th\u1ec3 k\u1ec3 \u0111\u1ebfn l\u00e0 \u0111i\u1ec1u h\u00f2a Comfee Inverter 27.000 BTU (3 HP) CFS-28VAF \u0111\u01b0\u1ee3c ra m\u1eaft n\u0103m 2024. Thi\u1ebft b\u1ecb n\u00e0y l\u00e0 s\u1ef1 k\u1ebft h\u1ee3p ho\u00e0n h\u1ea3o gi\u1eefa c\u00f4ng su\u1ea5t l\u00e0m l\u1ea1nh m\u1ea1nh m\u1ebd, nhanh ch\u00f3ng c\u00f9ng kh\u1ea3 n\u0103ng ti\u1ebft ki\u1ec7m \u0111i\u1ec7n hi\u1ec7u qu\u1ea3, h\u1ee9a h\u1eb9n mang \u0111\u1ebfn tr\u1ea3i nghi\u1ec7m h\u00e0i l\u00f2ng nh\u1ea5t cho ng\u01b0\u1eddi s\u1eed d\u1ee5ng. Thi\u1ebft k\u1ebf hi\u1ec7n \u0111\u1ea1i v\u00e0 tinh t\u1ebf, t\u1ea1o \u0111i\u1ec3m nh\u1ea5n cho gian ph\u00f2ng Chi\u1ebfc \u0111i\u1ec1u h\u00f2a n\u00e0y c\u1ee7a Comfee s\u1edf h\u1eefu v\u1ebb ngo\u00e0i h\u00ecnh h\u1ed9p ch\u1eef nh\u1eadt \u0111\u1eb7c tr\u01b0ng gi\u1ed1ng v\u1edbi nhi\u1ec1u thi\u1ebft b\u1ecb l\u00e0m m\u00e1t tr\u00ean th\u1ecb tr\u01b0\u1eddng. M\u00e1y l\u1ea1nh Comfee Inverter 27.000 BTU (3 HP) CFS-28VAF \u0111\u01b0\u1ee3c t\u1ea1o n\u00ean t\u1eeb \u0111\u01b0\u1eddng n\u00e9t s\u1eafc n\u00e9t, cho v\u1ebb ngo\u00e0i v\u1eeba ch\u1eafc ch\u1eafn v\u1eeba hi\u1ec7n \u0111\u1ea1i. Tone m\u00e0u tr\u1eafng ch\u1ee7 \u0111\u1ea1o c\u00e0ng t\u00f4n l\u00ean s\u1ef1 thanh l\u1ecbch v\u00e0 t\u00ednh th\u1ea9m m\u1ef9 cho thi\u1ebft b\u1ecb. Nh\u1edd v\u1eady, m\u00e1y l\u1ea1nh c\u00f3 th\u1ec3 d\u1ec5 d\u00e0ng h\u00e0i h\u00f2a v\u1edbi m\u1ecdi phong c\u00e1ch n\u1ed9i th\u1ea5t trong gian ph\u00f2ng, t\u1ea1o \u0111i\u1ec3m nh\u1ea5n ho\u00e0n h\u1ea3o t\u1eeb ph\u00f2ng ng\u1ee7, ph\u00f2ng kh\u00e1ch hay v\u0103n ph\u00f2ng l\u00e0m vi\u1ec7c. Thi\u1ebft b\u1ecb c\u0169ng c\u00f3 k\u00edch th\u01b0\u1edbc v\u1eeba ph\u1ea3i \u0111\u1ec3 kh\u00f4ng chi\u1ebfm qu\u00e1 nhi\u1ec1u kh\u00f4ng gian di\u1ec7n t\u00edch trong ph\u00f2ng, l\u1ea1i gi\u00fap ng\u01b0\u1eddi d\u00f9ng linh ho\u1ea1t h\u01a1n khi l\u1eafp \u0111\u1eb7t hay b\u00e0y tr\u00ed n\u1ed9i th\u1ea5t. Ngo\u00e0i ra, ng\u01b0\u1eddi d\u00f9ng c\u00f3 th\u1ec3 ho\u00e0n to\u00e0n an t\u00e2m v\u1ec1 \u0111\u1ed9 b\u1ec1n c\u1ee7a s\u1ea3n ph\u1ea9m khi Comfee \u0111\u00e3 trang b\u1ecb cho chi\u1ebfc \u0111i\u1ec1u h\u00f2a n\u00e0y \u1ed1ng d\u1eabn gas b\u1eb1ng \u0111\u1ed3ng v\u00e0 l\u00e1 t\u1ea3n nhi\u1ec7t b\u1eb1ng nh\u00f4m ph\u1ee7 l\u1edbp ch\u1ed1ng \u0103n m\u00f2n Golden Coating. S\u1ef1 k\u1ebft h\u1ee3p gi\u1eefa hai th\u00e0nh ph\u1ea7n n\u00e0y t\u1ea1o n\u00ean m\u1ed9t h\u1ec7 th\u1ed1ng l\u00e0m l\u1ea1nh hi\u1ec7u qu\u1ea3, b\u1ec1n b\u1ec9 v\u00e0 th\u00e2n thi\u1ec7n v\u1edbi m\u00f4i tr\u01b0\u1eddng. \u0110\u00e2y l\u00e0 hai th\u00e0nh ph\u1ea7n quan tr\u1ecdng trong h\u1ec7 th\u1ed1ng l\u00e0m l\u1ea1nh c\u1ee7a \u0111i\u1ec1u h\u00f2a, \u0111\u00f3ng vai tr\u00f2 kh\u00f4ng th\u1ec3 thi\u1ebfu gi\u00fap duy tr\u00ec hi\u1ec7u su\u1ea5t l\u00e0m l\u1ea1nh c\u1ee7a m\u00e1y. L\u1edbp ph\u1ee7 hi\u1ec7n \u0111\u1ea1i s\u1ebd \u0111em \u0111\u1ebfn kh\u1ea3 n\u0103ng ch\u1ed1ng \u0103n m\u00f2n, ch\u1ed1ng b\u00e1m b\u1ee5i v\u00e0 ch\u1ed1ng khu\u1ea9n hi\u1ec7u qu\u1ea3, gi\u00fap thi\u1ebft b\u1ecb b\u1ec1n b\u1ec9 h\u01a1n. M\u00e1t l\u1ea1nh nhanh ch\u00f3ng v\u1edbi \u0111i\u1ec1u h\u00f2a Comfee Inverter 27.000 BTU (3 HP) CFS-28VAF \u0110\u00e2y l\u00e0 m\u1ed9t thi\u1ebft b\u1ecb l\u00e0m m\u00e1t v\u00f4 c\u00f9ng m\u1ea1nh m\u1ebd, h\u1ee9a h\u1eb9n mang \u0111\u1ebfn nh\u1eefng tr\u1ea3i nghi\u1ec7m h\u00e0i l\u00f2ng nh\u1ea5t cho ng\u01b0\u1eddi d\u00f9ng trong nh\u1eefng ng\u00e0y h\u00e8 oi b\u1ee9c. M\u00e1y l\u1ea1nh c\u00f3 c\u00f4ng su\u1ea5t l\u00ean t\u1edbi 3 HP - 27.000 BTU, c\u00f3 kh\u1ea3 n\u0103ng cung c\u1ea5p kh\u00f4ng kh\u00ed m\u00e1t m\u1ebb cho kh\u00f4ng gian di\u1ec7n t\u00edch 40 - 50m2 r\u1ed9ng l\u1edbn. D\u00f9 l\u00e0 trong ph\u00f2ng ng\u1ee7, ph\u00f2ng kh\u00e1ch hay ph\u00f2ng l\u00e0m vi\u1ec7c, thi\u1ebft b\u1ecb \u0111\u1ec1u \u0111\u00e1p \u1ee9ng \u0111\u01b0\u1ee3c nhu c\u1ea7u s\u1eed d\u1ee5ng c\u1ee7a c\u00e1c h\u1ed9 gia \u0111\u00ecnh v\u00e0 doanh nghi\u1ec7p. \u0110\u1eb7c bi\u1ec7t, v\u1edbi \u0111\u1ed9 \u1ed3n trung b\u00ecnh 33/40/45.5 dB, thi\u1ebft b\u1ecb d\u00f9 ho\u1ea1t \u0111\u1ed9ng v\u1edbi c\u00f4ng su\u1ea5t l\u1edbn nh\u01b0ng s\u1ebd kh\u00f4ng g\u00e2y ti\u1ebfng \u1ed3n kh\u00f3 ch\u1ecbu trong su\u1ed1t qu\u00e1 tr\u00ecnh s\u1eed d\u1ee5ng, \u0111\u1ea3m b\u1ea3o gi\u1ea5c ng\u1ee7 tr\u1ecdn v\u1eb9n cho c\u1ea3 gia \u0111\u00ecnh. Ngo\u00e0i ra, m\u00e1y l\u1ea1nh Comfee n\u00e0y c\u00f2n s\u1edf h\u1eefu c\u00f4ng ngh\u1ec7 l\u00e0m l\u1ea1nh nhanh Hyper Tech. Nh\u1edd v\u1eady, c\u0103n ph\u00f2ng c\u1ee7a b\u1ea1n s\u1ebd \u0111\u01b0\u1ee3c l\u00e0m m\u00e1t nhanh ch\u00f3ng ch\u1ec9 trong kho\u1ea3nh 40 gi\u00e2y, r\u00fat ng\u1eafn th\u1eddi gian ch\u1edd \u0111\u1ee3i trong nh\u1eefng ng\u00e0y n\u1eafng n\u00f3ng. \u0110i\u1ec1u h\u00f2a c\u00f2n s\u1edf h\u1eefu ch\u1ebf \u0111\u1ed9 qu\u1ea1t gi\u00f3 Swing v\u1edbi kh\u1ea3 n\u0103ng \u0111i\u1ec1u khi\u1ec3n l\u00ean xu\u1ed1ng t\u1ef1 \u0111\u1ed9ng. Thi\u1ebft k\u1ebf n\u00e0y s\u1ebd gi\u00fap ph\u00e2n b\u1ed5 lu\u1ed3ng gi\u00f3 \u0111\u1ec1u h\u01a1n, lan t\u1ecfa nhi\u1ec7t \u0111\u1ed9 m\u00e1t m\u1ebb \u0111\u1ebfn m\u1ecdi n\u01a1i trong c\u0103n ph\u00f2ng c\u1ee7a b\u1ea1n. M\u00e1y l\u1ea1nh Comfee Inverter 27.000 BTU (3 HP) CFS-28VAF gi\u00fap ti\u1ebft ki\u1ec7m \u0111i\u1ec7n hi\u1ec7u qu\u1ea3 Thi\u1ebft b\u1ecb n\u00e0y c\u1ee7a Comfee thu\u1ed9c d\u00f2ng s\u1ea3n ph\u1ea9m \u0111i\u1ec1u h\u00f2a Inverter cao c\u1ea5p v\u1edbi kh\u1ea3 n\u0103ng ti\u1ebft ki\u1ec7m n\u0103ng l\u01b0\u1ee3ng r\u1ea5t t\u1ed1t, gi\u1ea3m thi\u1ec3u h\u00f3a \u0111\u01a1n cu\u1ed1i th\u00e1ng cho ng\u01b0\u1eddi d\u00f9ng. V\u1edbi vi x\u1eed l\u00fd E-Max ti\u00ean ti\u1ebfn, m\u00e1y n\u00e9n c\u1ee7a thi\u1ebft b\u1ecb lu\u00f4n \u0111\u01b0\u1ee3c duy tr\u00ec ho\u1ea1t \u0111\u1ed9ng \u1edf t\u1ed1c \u0111\u1ed9 th\u1ea5p m\u1ed9t c\u00e1ch \u1ed5n \u0111\u1ecbnh v\u00e0 b\u1ec1n b\u1ec9, t\u1eeb \u0111\u00f3 gi\u1ea3m ti\u00eau hao qu\u00e1 nhi\u1ec1u \u0111i\u1ec7n n\u0103ng v\u00e0 \u0111em \u0111\u1ebfn tr\u1ea3i nghi\u1ec7m \u00eam d\u1ecbu h\u01a1n cho ng\u01b0\u1eddi s\u1eed d\u1ee5ng. B\u00ean c\u1ea1nh \u0111\u00f3, b\u1ea1n c\u0169ng c\u00f3 th\u1ec3 k\u00edch ho\u1ea1t ch\u1ebf \u0111\u1ed9 Eco tr\u00ean \u0111i\u1ec1u h\u00f2a \u0111\u1ec3 gi\u1ea3m v\u1ec1 m\u1ee9c c\u00f4ng su\u1ea5t ph\u00f9 h\u1ee3p, \u0111\u1ea3m b\u1ea3o ti\u1ebft ki\u1ec7m n\u0103ng l\u01b0\u1ee3ng m\u00e0 v\u1eabn \u0111em \u0111\u1ebfn lu\u1ed3ng kh\u00f4ng kh\u00ed m\u00e1t m\u1ebb, d\u1ec5 ch\u1ecbu cho c\u0103n ph\u00f2ng. \u0110i\u1ec1u h\u00f2a Comfee Inverter 27.000 BTU (3 HP) CFS-28VAF ch\u1eafc ch\u1eafn kh\u00f4ng th\u1ec3 thi\u1ebfu c\u00f4ng ngh\u1ec7 bi\u1ebfn t\u1ea7n Inverter gi\u00fap t\u0103ng c\u01b0\u1eddng hi\u1ec7u qu\u1ea3 ti\u1ebft ki\u1ec7m \u0111i\u1ec7n. Thi\u1ebft k\u1ebf n\u00e0y mang \u0111\u1ebfn kh\u1ea3 n\u0103ng \u0111i\u1ec1u ch\u1ec9nh c\u00f4ng su\u1ea5t linh ho\u1ea1t, gi\u00fap m\u00e1y n\u00e9n ho\u1ea1t \u0111\u1ed9ng \u1edf m\u1ee9c c\u00f4ng su\u1ea5t c\u1ea7n thi\u1ebft, gi\u00fap gi\u1ea3m thi\u1ec3u ti\u00eau th\u1ee5 \u0111i\u1ec7n n\u0103ng \u0111\u00e1ng k\u1ec3. Ngo\u00e0i ra, s\u1ea3n ph\u1ea9m Inverter c\u00f2n \u0111\u1ea3m b\u1ea3o s\u1ef1 v\u1eadn h\u00e0nh \u00eam \u00e1i, k\u00e9o d\u00e0i tu\u1ed5i th\u1ecd m\u00e1y n\u00e9n v\u00e0 l\u00e0m l\u1ea1nh c\u0103n ph\u00f2ng m\u1ed9t c\u00e1ch hi\u1ec7u qu\u1ea3. B\u1ed9 l\u1ecdc hi\u1ec7n \u0111\u1ea1i gi\u00fap kh\u00f4ng kh\u00ed trong ph\u00f2ng lu\u00f4n s\u1ea1ch s\u1ebd, tho\u00e1ng \u0111\u00e3ng \u0110\u1eb7t s\u1ee9c kh\u1ecfe ng\u01b0\u1eddi d\u00f9ng l\u00e0m \u01b0u ti\u00ean h\u00e0ng \u0111\u1ea7u, Comfee \u0111\u00e3 \u0111\u1ea7u t\u01b0 cho s\u1ea3n ph\u1ea9m c\u1ee7a m\u00ecnh nh\u1eefng c\u00f4ng ngh\u1ec7 l\u1ecdc cao c\u1ea5p nh\u1ea5t. V\u1edbi c\u00f4ng ngh\u1ec7 l\u1ecdc k\u00e9p Dual Filtration, \u0111i\u1ec1u h\u00f2a c\u00f3 th\u1ec3 lo\u1ea1i b\u1ecf nh\u1eefng b\u1ee5i b\u1ea9n nh\u1ecf nh\u1ea5t trong kh\u00f4ng kh\u00ed khi t\u1ecfa ra lu\u1ed3ng gi\u00f3 m\u00e1t m\u1ebb cho c\u0103n ph\u00f2ng. C\u00f4ng ngh\u1ec7 n\u00e0y c\u00f3 th\u1ec3 l\u1ecdc s\u1ea1ch b\u1ee5i m\u1ecbn, b\u1ee5i b\u1ea9n, n\u1ea5m m\u1ed1c hay nh\u1eefng t\u00e1c nh\u00e2n c\u00f3 h\u1ea1i, \u0111\u1ea3m b\u1ea3o kh\u00f4ng gian s\u1ed1ng lu\u00f4n tho\u00e1ng \u0111\u00e3ng v\u00e0 s\u1ea1ch s\u1ebd. Ng\u01b0\u1eddi d\u00f9ng c\u0169ng c\u00f3 th\u1ec3 an t\u00e2m khi m\u00e1y l\u1ea1nh Comfee Inverter 27.000 BTU (3 HP) CFS-28VAF c\u00f3 th\u1ec3 ph\u00e2n h\u1ee7y \u0111\u01b0\u1ee3c m\u1ed9t v\u00e0i ch\u1ea5t \u0111\u1ed9c h\u1ea1i v\u00f4 h\u00ecnh, v\u1eeba \u0111\u1ea3m b\u1ea3o s\u1ee9c kh\u1ecfe h\u00f4 h\u1ea5p, v\u1eeba gi\u1ea3m thi\u1ec3u c\u00e1c m\u00f9i h\u00f4i, m\u00f9i kh\u00f3 ch\u1ecbu khi s\u1eed d\u1ee5ng. Ngo\u00e0i ra, thi\u1ebft b\u1ecb c\u00f2n c\u00f3 ch\u1ebf \u0111\u1ed9 Active Clean gi\u00fap l\u00e0m s\u1ea1ch chuy\u00ean s\u00e2u m\u00e1y l\u1ea1nh \u0111\u1ec3 \u0111\u1ea3m b\u1ea3o kh\u00f4ng kh\u00ed t\u1ecfa ra lu\u00f4n an to\u00e0n nh\u1ea5t. Khi k\u00edch ho\u1ea1t ch\u1ebf \u0111\u1ed9 n\u00e0y, thi\u1ebft b\u1ecb s\u1ebd t\u1ef1 \u0111\u1ed9ng t\u0103ng m\u1ee9c c\u00f4ng su\u1ea5t l\u00ean t\u1ed1i \u0111a trong v\u00f2ng 1 gi\u1edd \u0111\u1ec3 \u0111\u00f3ng b\u0103ng nh\u1eefng c\u1eb7n b\u1ea9n, sau \u0111\u00f3 r\u1eeda tr\u00f4i b\u1eb1ng c\u00e1ch gi\u1ea3m nhi\u1ec7t. Khi n\u00e0y, qu\u1ea1t gi\u00f3 c\u0169ng s\u1ebd \u0111\u01b0\u1ee3c k\u00edch ho\u1ea1t \u0111\u1ec3 gi\u00fap d\u00e0n l\u1ea1nh lu\u00f4n kh\u00f4 r\u00e1o v\u00e0 h\u1ea1n ch\u1ebf s\u1ef1 ph\u00e1t tri\u1ec3n c\u1ee7a vi khu\u1ea9n, n\u1ea5m m\u1ed1c g\u00e2y h\u1ea1i. \u0110i\u1ec1u h\u00f2a Comfee Inverter 27.000 BTU (3 HP) CFS-28VAF cung c\u1ea5p nhi\u1ec1u ti\u1ec7n \u00edch ti\u1ec7n l\u1ee3i Ngo\u00e0i c\u00f4ng su\u1ea5t l\u00e0m l\u1ea1nh nhanh v\u00e0 m\u1ea1nh c\u00f9ng kh\u1ea3 n\u0103ng ti\u1ebft ki\u1ec7m \u0111i\u1ec7n, l\u1ecdc kh\u00ed hi\u1ec7u qu\u1ea3, s\u1ea3n ph\u1ea9m n\u00e0y c\u00f2n s\u1edf h\u1eefu nhi\u1ec1u ti\u1ec7n \u00edch h\u1eefu \u00edch cho ng\u01b0\u1eddi s\u1eed d\u1ee5ng. B\u1ea1n c\u00f3 th\u1ec3 d\u1ec5 d\u00e0ng quan s\u00e1t nhi\u1ec7t \u0111\u1ed9 hi\u1ec3n th\u1ecb ngay tr\u00ean m\u00e0n h\u00ecnh LCD trong kh\u00f4ng gian t\u1ed1i m\u00e0 kh\u00f4ng c\u1ea7n t\u1edbi \u0111i\u1ec1u khi\u1ec3n. C\u0103n ph\u00f2ng c\u0169ng s\u1ebd lu\u00f4n kh\u00f4 tho\u00e1ng nh\u1edd ch\u1ee9c n\u0103ng h\u00fat \u1ea9m. B\u00ean c\u1ea1nh \u0111\u00f3, vi\u1ec7c t\u00f9y ch\u1ec9nh c\u00e1c th\u00f4ng s\u1ed1 hay ch\u1ebf \u0111\u1ed9 tr\u00ean m\u00e1y l\u1ea1nh c\u0169ng v\u00f4 c\u00f9ng \u0111\u01a1n gi\u1ea3n khi ng\u01b0\u1eddi d\u00f9ng c\u00f3 th\u1ec3 \u0111i\u1ec1u khi\u1ec3n b\u1eb1ng \u0111i\u1ec7n tho\u1ea1i, c\u00f3 wifi hay s\u1eed d\u1ee5ng remote c\u00f3 \u0111\u00e8n LED. S\u1ea3n ph\u1ea9m n\u00e0y c\u1ee7a Comfee s\u1ebd cung c\u1ea5p nh\u1eefng t\u00ednh n\u0103ng t\u1ed1t nh\u1ea5t cho tr\u1ea3i nghi\u1ec7m ho\u00e0n h\u1ea3o c\u1ee7a m\u1ed7i ng\u01b0\u1eddi d\u00f9ng. Gi\u00e1 b\u00e1n c\u1ee7a m\u00e1y l\u1ea1nh Comfee Inverter 27.000 BTU (3 HP) CFS-28VAF Hi\u1ec7n t\u1ea1i, chi\u1ebfc \u0111i\u1ec1u h\u00f2a n\u00e0y c\u1ee7a Comfee \u0111ang \u0111\u01b0\u1ee3c m\u1edf b\u00e1n t\u1ea1i th\u1ecb tr\u01b0\u1eddng Vi\u1ec7t Nam v\u1edbi m\u1ee9c gi\u00e1 r\u1ea5t ph\u1ea3i ch\u0103ng. \u0110\u00e2y l\u00e0 m\u1ed9t s\u1ea3n ph\u1ea9m \u0111\u1ebfn t\u1eeb Th\u00e1i Lan v\u00e0 v\u1eeba \u0111\u01b0\u1ee3c ra m\u1eaft n\u0103m 2024, \u0111\u01b0\u1ee3c nh\u00e0 s\u1ea3n xu\u1ea5t trang b\u1ecb nh\u1eefng t\u00ednh n\u0103ng v\u00e0 c\u00f4ng ngh\u1ec7 l\u00e0m m\u00e1t ti\u00ean ti\u1ebfn nh\u1ea5t. V\u1edbi s\u1ef1 k\u1ebft h\u1ee3p ho\u00e0n h\u1ea3o gi\u1eefa c\u00f4ng su\u1ea5t m\u1ea1nh m\u1ebd, kh\u1ea3 n\u0103ng ti\u1ebft ki\u1ec7m \u0111i\u1ec7n hi\u1ec7u qu\u1ea3 c\u00f9ng nhi\u1ec1u ch\u1ee9c n\u0103ng h\u1eefu \u00edch, chi\u1ebfc \u0111i\u1ec1u h\u00f2a n\u00e0y s\u1ebd l\u00e0 l\u1ef1a ch\u1ecdn kh\u00f4ng th\u1ec3 thi\u1ebfu c\u1ee7a c\u00e1c h\u1ed9 gia \u0111\u00ecnh hay v\u0103n ph\u00f2ng l\u00e0m vi\u1ec7c trong nh\u1eefng ng\u00e0y h\u00e8 n\u00f3ng b\u1ee9c. L\u01b0u \u00fd, gi\u00e1 b\u00e1n c\u1ee7a s\u1ea3n ph\u1ea9m c\u00f3 th\u1ec3 thay \u0111\u1ed5i t\u00f9y theo ch\u01b0\u01a1ng tr\u00ecnh khuy\u1ebfn m\u00e3i t\u1ea1i t\u1eebng th\u1eddi \u0111i\u1ec3m. N\u1ebfu qu\u00fd kh\u00e1ch quan t\u00e2m, h\u00e3y li\u00ean h\u1ec7 Ho\u00e0ng H\u00e0 Mobile qua hotline 1900 2091 \u0111\u1ec3 \u0111\u01b0\u1ee3c t\u01b0 v\u1ea5n ch\u00ednh x\u00e1c nh\u1ea5t. Nh\u1eefng \u01b0u \u0111\u00e3i khi mua \u0111i\u1ec1u h\u00f2a Comfee Inverter 27.000 BTU (3 HP) CFS-28VAF t\u1ea1i Ho\u00e0ng H\u00e0 Mobile M\u00e1y l\u1ea1nh Comfee Inverter 27.000 BTU (3 HP) CFS-28VAF hi\u1ec7n \u0111\u00e3 c\u00f3 m\u1eb7t t\u1ea1i Ho\u00e0ng H\u00e0 Mobile v\u1edbi m\u1ee9c gi\u00e1 c\u1ef1c k\u1ef3 \u01b0u \u0111\u00e3i. S\u1ea3n ph\u1ea9m c\u00f3 th\u1eddi h\u1ea1n b\u1ea3o h\u00e0nh c\u1ee5c l\u1ea1nh v\u00e0 c\u1ee5c n\u00f3ng l\u00ean t\u1edbi 2 n\u0103m. Ngo\u00e0i ra, khi mua s\u1ea3n ph\u1ea9m n\u00e0y, kh\u00e1ch h\u00e0ng c\u00f3 th\u1ec3 t\u1eadn h\u01b0\u1edfng v\u00f4 v\u00e0n ch\u01b0\u01a1ng tr\u00ecnh khuy\u1ebfn m\u00e3i h\u1ea5p d\u1eabn nh\u01b0 \u01b0u \u0111\u00e3i thanh to\u00e1n v\u00e0 nh\u1eefng \u01b0u \u0111\u00e3i \u0111i k\u00e8m kh\u00e1c. Kh\u00e1ch h\u00e0ng khi mua s\u1ea3n ph\u1ea9m t\u1ea1i Ho\u00e0ng H\u00e0 Mobile c\u00f2n \u0111\u01b0\u1ee3c h\u1ed7 tr\u1ee3 mi\u1ec5n ph\u00ed v\u1eadn chuy\u1ec3n to\u00e0n qu\u1ed1c v\u1edbi d\u1ecbch v\u1ee5 giao h\u00e0ng nhanh ch\u00f3ng v\u00e0 an to\u00e0n. H\u00e3y nhanh tay \u0111\u1eb7t h\u00e0ng online ho\u1eb7c \u0111\u1ebfn tr\u1ef1c ti\u1ebfp c\u1eeda h\u00e0ng Ho\u00e0ng H\u00e0 Mobile g\u1ea7n nh\u1ea5t \u0111\u1ec3 \u0111\u01b0\u1ee3c t\u01b0 v\u1ea5n chi ti\u1ebft v\u00e0 tham kh\u1ea3o th\u00eam nhi\u1ec1u thi\u1ebft b\u1ecb c\u00f4ng ngh\u1ec7 hi\u1ec7n \u0111\u1ea1i ch\u1ea5t l\u01b0\u1ee3ng cao! Xem to\u00e0n b\u1ed9 b\u00e0i vi\u1ebft",
        "promotion_1": "1. Tr\u00fang 8386 qu\u00e0 - T\u1ed5ng gi\u00e1 tr\u1ecb t\u1edbi 250 TRI\u1ec6U \u0110\u1ed2NG (\u00c1p d\u1ee5ng t\u1eeb 10/01 - 02/02/2025). (Xem chi ti\u1ebft). 2. \u0110\u1eb7c bi\u1ec7t Tr\u1ea3 g\u00f3p 3 kh\u00f4ng: 0% l\u00e3i su\u1ea5t - 0 ph\u00ed chuy\u1ec3n \u0111\u1ed5i - 0 tr\u1ea3 tr\u01b0\u1edbc (\u00c1p d\u1ee5ng cho c\u00f4ng ty t\u00e0i ch\u00ednh v\u00e0 th\u1ebb t\u00edn d\u1ee5ng)",
        "promotion_2": "1. Gi\u1ea3m t\u1edbi 500.000\u0111 khi thanh to\u00e1n th\u1ebb t\u00edn d\u1ee5ng NCB. (Xem chi ti\u1ebft). 2. Gi\u1ea3m \u0111\u1ebfn 150.000\u0111 khi thanh to\u00e1n qua Muadee. (Xem chi ti\u1ebft). 3. Mi\u1ec5n ph\u00ed chuy\u1ec3n \u0111\u1ed5i tr\u1ea3 g\u00f3p ho\u1eb7c gi\u1ea3m \u0111\u1ebfn 500.000\u0111 khi m\u1edf th\u1ebb TPBank EVO. (Xem chi ti\u1ebft). 4. M\u1edf th\u1ebb t\u00edn d\u1ee5ng VIB - Nh\u1eadn Voucher 600.000\u0111. (Xem chi ti\u1ebft). 5. M\u1edf th\u1ebb HSBC - Ho\u00e0n ti\u1ec1n t\u1edbi 2 tri\u1ec7u \u0111\u1ed3ng. (Xem chi ti\u1ebft)"
    }
]