[
    {
        "title": "\u0110i\u1ec1u h\u00f2a Midea Inverter 9.000 BTU (1 HP) MAFA-09CDN8",
        "price": "gi\u00e1 hi\u1ec7n t\u1ea1i l\u00e0 5,390,000 \u20ab nh\u01b0ng tr\u01b0\u1edbc \u0111\u00e2y n\u00f3 c\u00f3 gi\u00e1 l\u00e0 8,590,000 \u20ab",
        "colors": "Tr\u1eafng",
        "technical_specifications": [
            {
                "Lo\u1ea1i m\u00e1y": "1 chi\u1ec1u (ch\u1ec9 l\u00e0m l\u1ea1nh)"
            },
            {
                "C\u00f4ng ngh\u1ec7 inverter": "M\u00e1y l\u1ea1nh Inverter"
            },
            {
                "C\u00f4ng su\u1ea5t l\u00e0m l\u1ea1nh": "1 HP - 9.000 BTU"
            },
            {
                "Ph\u1ea1m vi l\u00e0m l\u1ea1nh hi\u1ec7u qu\u1ea3": "D\u01b0\u1edbi 15m\u00b2"
            },
            {
                "Nh\u00e3n n\u0103ng l\u01b0\u1ee3ng": "5 sao (Hi\u1ec7u su\u1ea5t n\u0103ng l\u01b0\u1ee3ng 5.06)"
            }
        ],
        "description": "\u0110i\u1ec1u h\u00f2a Midea Inverter 9.000 BTU (1 HP) MAFA-09CDN8 l\u00e0 gi\u1ea3i ph\u00e1p l\u00e0m m\u00e1t th\u00f4ng minh, ti\u1ebft ki\u1ec7m \u0111i\u1ec7n n\u0103ng d\u00e0nh cho kh\u00f4ng gian d\u01b0\u1edbi 15m2 . V\u1edbi c\u00f4ng ngh\u1ec7 Inverter ti\u00ean ti\u1ebfn, thi\u1ebft b\u1ecb c\u00f3 kh\u1ea3 n\u0103ng ho\u1ea1t \u0111\u1ed9ng \u00eam \u00e1i, l\u00e0m l\u1ea1nh nhanh v\u00e0 \u0111\u1eb7c bi\u1ec7t l\u00e0 ti\u1ebft ki\u1ec7m \u0111i\u1ec7n n\u0103ng. B\u1ed9 l\u1ecdc kh\u00f4ng kh\u00ed 2 l\u1edbp HD gi\u00fap kh\u00f4ng gian s\u1ed1ng lu\u00f4n trong l\u00e0nh v\u00e0 b\u1ea3o v\u1ec7 s\u1ee9c kh\u1ecfe cho gia \u0111\u00ecnh b\u1ea1n. Thi\u1ebft k\u1ebf hi\u1ec7n \u0111\u1ea1i, tinh t\u1ebf c\u1ee7a s\u1ea3n ph\u1ea9m ph\u00f9 h\u1ee3p v\u1edbi m\u1ecdi kh\u00f4ng gian n\u1ed9i th\u1ea5t. N\u1ebfu b\u1ea1n \u0111ang t\u00ecm ki\u1ebfm m\u1ed9t chi\u1ebfc m\u00e1y l\u1ea1nh v\u1eeba \u0111\u00e1p \u1ee9ng nhu c\u1ea7u l\u00e0m m\u00e1t hi\u1ec7u qu\u1ea3, v\u1eeba ti\u1ebft ki\u1ec7m chi ph\u00ed, Midea Inverter 9.000 BTU (1 HP) MAFA-09CDN8 ch\u1eafc ch\u1eafn l\u00e0 m\u1ed9t l\u1ef1a ch\u1ecdn ho\u00e0n h\u1ea3o. \u0110\u1eb7c \u0111i\u1ec3m n\u1ed5i b\u1eadt M\u00e1y l\u1ea1nh c\u00f3 thi\u1ebft k\u1ebf \u0111\u01a1n gi\u1ea3n, tinh t\u1ebf, ph\u00f9 h\u1ee3p v\u1edbi nhi\u1ec1u kh\u00f4ng gian n\u1ed9i th\u1ea5t kh\u00e1c nhau. Ch\u1ee9c n\u0103ng l\u00e0m l\u1ea1nh nhanh v\u1edbi c\u00f4ng ngh\u1ec7 Fast Cooling gi\u00fap c\u0103n ph\u00f2ng m\u00e1t l\u1ea1nh t\u1ee9c th\u00ec, \u0111\u1eb7c bi\u1ec7t h\u1eefu \u00edch trong nh\u1eefng ng\u00e0y h\u00e8 oi b\u1ee9c. C\u00f4ng ngh\u1ec7 Inverter gi\u00fap m\u00e1y n\u00e9n ho\u1ea1t \u0111\u1ed9ng \u1ed5n \u0111\u1ecbnh, linh ho\u1ea1t, ti\u1ebft ki\u1ec7m \u0111i\u1ec7n n\u0103ng \u0111\u00e1ng k\u1ec3 so v\u1edbi c\u00e1c m\u00e1y l\u1ea1nh th\u00f4ng th\u01b0\u1eddng. B\u1ed9 l\u1ecdc kh\u00f4ng kh\u00ed 2 l\u1edbp HD lo\u1ea1i b\u1ecf b\u1ee5i b\u1ea9n, vi khu\u1ea9n, mang \u0111\u1ebfn kh\u00f4ng kh\u00ed trong l\u00e0nh, b\u1ea3o v\u1ec7 s\u1ee9c kh\u1ecfe cho gia \u0111\u00ecnh b\u1ea1n. B\u1ea3ng th\u00f4ng s\u1ed1 k\u1ef9 thu\u1eadt c\u1ee7a \u0111i\u1ec1u h\u00f2a Midea Inverter 9.000 BTU (1 HP) MAFA-09CDN8 Th\u00f4ng s\u1ed1 Chi ti\u1ebft Lo\u1ea1i m\u00e1y 1 chi\u1ec1u (ch\u1ec9 l\u00e0m l\u1ea1nh) C\u00f4ng su\u1ea5t 1 HP - 9.000 BTU Ph\u1ea1m vi l\u00e0m l\u1ea1nh hi\u1ec7u qu\u1ea3 D\u01b0\u1edbi 15m2 K\u00edch th\u01b0\u1edbc v\u00e0 tr\u1ecdng l\u01b0\u1ee3ng d\u00e0n l\u1ea1nh D\u00e0i 71.5 cm - Cao 28.5 cm - D\u00e0y 19.4 cm N\u1eb7ng 7.4 kg K\u00edch th\u01b0\u1edbc v\u00e0 tr\u1ecdng l\u01b0\u1ee3ng d\u00e0n n\u00f3ng D\u00e0i 72 cm - Cao 46.9 cm - D\u00e0y 23.2 cm N\u1eb7ng 16.985 kg \u0110\u1ed9 \u1ed3n trung b\u00ecnh 38.5/33/27.5 dB Lo\u1ea1i gas R-32 Ti\u00eau th\u1ee5 \u0111i\u1ec7n 0.82 kW/h C\u00f4ng ngh\u1ec7 ti\u1ebft ki\u1ec7m \u0111i\u1ec7n Inverter Kh\u1ea3 n\u0103ng l\u1ecdc b\u1ee5i, kh\u00e1ng khu\u1ea9n, kh\u1eed m\u00f9i B\u1ed9 l\u1ecdc b\u1ee5i 2 l\u1edbp HD Ch\u1ebf \u0111\u1ed9 gi\u00f3 \u0110i\u1ec1u khi\u1ec3n l\u00ean xu\u1ed1ng t\u1ef1 \u0111\u1ed9ng, tr\u00e1i ph\u1ea3i t\u00f9y ch\u1ec9nh tay C\u00f4ng ngh\u1ec7 l\u00e0m l\u1ea1nh nhanh Fast Cooling Ti\u1ec7n \u00edch Kh\u00f3a remote \u0111i\u1ec1u khi\u1ec3n Ch\u1ee9c n\u0103ng b\u1eadt/t\u1eaft \u0111\u00e8n hi\u1ec3n th\u1ecb khi l\u00e0m vi\u1ec7c B\u1ed9 l\u1ecdc 2 l\u1edbp HD H\u1eb9n gi\u1edd b\u1eadt/t\u1eaft m\u00e1y D\u00f2ng \u0111i\u1ec7n v\u00e0o D\u00e0n l\u1ea1nh D\u00f2ng \u0111i\u1ec7n ho\u1ea1t \u0111\u1ed9ng 1 pha S\u1ed1 l\u01b0\u1ee3ng k\u1ebft n\u1ed1i d\u00e0n l\u1ea1nh t\u1ed1i \u0111a 1 \u0110\u00e1nh gi\u00e1 chi ti\u1ebft v\u1ec1 c\u00e1c t\u00ednh n\u0103ng c\u1ee7a m\u00e1y l\u1ea1nh Midea Inverter 9.000 BTU (1 HP) MAFA-09CDN8 B\u1ea1n \u0111ang b\u0103n kho\u0103n kh\u00f4ng bi\u1ebft n\u00ean ch\u1ecdn m\u00e1y l\u1ea1nh n\u00e0o \u0111\u1ec3 v\u1eeba l\u00e0m m\u00e1t hi\u1ec7u qu\u1ea3, v\u1eeba \u0111\u1ea3m b\u1ea3o s\u1ee9c kh\u1ecfe cho gia \u0111\u00ecnh? H\u00e3y c\u00f9ng t\u00ecm hi\u1ec3u v\u1ec1 s\u1ea3n ph\u1ea9m Midea Inverter 9.000 BTU (1 HP) MAFA-09CDN8. Chi\u1ebfc m\u00e1y l\u1ea1nh n\u00e0y kh\u00f4ng ch\u1ec9 s\u1edf h\u1eefu thi\u1ebft k\u1ebf hi\u1ec7n \u0111\u1ea1i m\u00e0 c\u00f2n \u0111\u01b0\u1ee3c trang b\u1ecb nhi\u1ec1u c\u00f4ng ngh\u1ec7 ti\u00ean ti\u1ebfn, \u0111\u00e1p \u1ee9ng m\u1ecdi nhu c\u1ea7u c\u1ee7a ng\u01b0\u1eddi d\u00f9ng. Thi\u1ebft k\u1ebf m\u00e0u tr\u1eafng thanh l\u1ecbch, hi\u1ec7n \u0111\u1ea1i c\u1ee7a m\u00e1y l\u1ea1nh Midea Inverter 9.000 BTU (1 HP) MAFA-09CDN8 Midea Inverter 9.000 BTU (1 HP) MAFA-09CDN8 s\u1edf h\u1eefu thi\u1ebft k\u1ebf tinh gi\u1ea3n, hi\u1ec7n \u0111\u1ea1i v\u1edbi m\u00e0u tr\u1eafng thanh l\u1ecbch, d\u1ec5 d\u00e0ng h\u00f2a h\u1ee3p v\u1edbi m\u1ecdi kh\u00f4ng gian s\u1ed1ng. K\u00edch th\u01b0\u1edbc g\u1ecdn g\u00e0ng, c\u00f9ng v\u1edbi v\u1eadt li\u1ec7u nh\u1ef1a ABS cao c\u1ea5p, gi\u00fap m\u00e1y v\u1eeba b\u1ec1n b\u1ec9 v\u1eeba ti\u1ebft ki\u1ec7m di\u1ec7n t\u00edch. M\u1eb7t n\u1ea1 tr\u01b0\u1edbc d\u1ec5 th\u00e1o l\u1eafp, thu\u1eadn ti\u1ec7n cho vi\u1ec7c v\u1ec7 sinh. \u0110\u00e8n hi\u1ec3n th\u1ecb nhi\u1ec7t \u0111\u1ed9 r\u00f5 r\u00e0ng gi\u00fap ng\u01b0\u1eddi d\u00f9ng d\u1ec5 d\u00e0ng quan s\u00e1t v\u00e0 \u0111i\u1ec1u khi\u1ec3n. V\u1edbi thi\u1ebft k\u1ebf t\u1ed1i gi\u1ea3n nh\u01b0ng kh\u00f4ng k\u00e9m ph\u1ea7n sang tr\u1ecdng, Midea Inverter 9.000 BTU (1 HP) MAFA-09CDN8 kh\u00f4ng ch\u1ec9 l\u00e0 m\u1ed9t thi\u1ebft b\u1ecb l\u00e0m m\u00e1t m\u00e0 c\u00f2n l\u00e0 m\u1ed9t \u0111i\u1ec3m nh\u1ea5n trang tr\u00ed cho ng\u00f4i nh\u00e0 c\u1ee7a b\u1ea1n. D\u00e0n n\u00f3ng \u0111\u01b0\u1ee3c thi\u1ebft k\u1ebf ch\u1eafc ch\u1eafn h\u01a1n, ch\u1ecbu \u0111\u01b0\u1ee3c \u0111i\u1ec1u ki\u1ec7n th\u1eddi ti\u1ebft kh\u1eafc nghi\u1ec7t h\u01a1n D\u00e0n n\u00f3ng c\u1ee7a \u0111i\u1ec1u h\u00f2a Midea Inverter 9.000 BTU (1 HP) MAFA-09CDN8 \u0111\u01b0\u1ee3c ch\u1ebf t\u1ea1o t\u1eeb ch\u1ea5t li\u1ec7u th\u00e9p cao c\u1ea5p, s\u01a1n ph\u1ee7 l\u1edbp b\u1ea3o v\u1ec7 ch\u1ed1ng \u0103n m\u00f2n, \u0111\u1ea3m b\u1ea3o \u0111\u1ed9 b\u1ec1n b\u1ec9 v\u00e0 kh\u1ea3 n\u0103ng ch\u1ecbu l\u1ef1c t\u1ed1t. Thi\u1ebft k\u1ebf ch\u1eafc ch\u1eafn v\u1edbi c\u00e1c g\u00f3c bo tr\u00f2n gi\u00fap t\u0103ng c\u01b0\u1eddng kh\u1ea3 n\u0103ng tho\u00e1t n\u01b0\u1edbc, ng\u0103n ng\u1eeba t\u00ecnh tr\u1ea1ng r\u1ec9 s\u00e9t. Nh\u1edd \u0111\u00f3, d\u00e0n n\u00f3ng c\u00f3 th\u1ec3 ho\u1ea1t \u0111\u1ed9ng \u1ed5n \u0111\u1ecbnh trong m\u1ecdi \u0111i\u1ec1u ki\u1ec7n th\u1eddi ti\u1ebft, k\u1ec3 c\u1ea3 nh\u1eefng khu v\u1ef1c c\u00f3 kh\u00ed h\u1eadu kh\u1eafc nghi\u1ec7t. So v\u1edbi c\u00e1c s\u1ea3n ph\u1ea9m c\u00f9ng ph\u00e2n kh\u00fac, d\u00e0n n\u00f3ng c\u1ee7a Midea Inverter 9.000 BTU (1 HP) MAFA-09CDN8 \u0111\u01b0\u1ee3c \u0111\u00e1nh gi\u00e1 cao v\u1ec1 \u0111\u1ed9 b\u1ec1n v\u00e0 tu\u1ed5i th\u1ecd, gi\u00fap b\u1ea1n y\u00ean t\u00e2m s\u1eed d\u1ee5ng trong nhi\u1ec1u n\u0103m. M\u00e1y l\u1ea1nh Midea Inverter 9.000 BTU (1 HP) MAFA-09CDN8 trang b\u1ecb l\u00e1 t\u1ea3n nhi\u1ec7t nh\u00f4m m\u1ea1 Hyper Grapfins L\u00e1 t\u1ea3n nhi\u1ec7t nh\u00f4m m\u1ea1 Hyper Grapfins l\u00e0 m\u1ed9t c\u00f4ng ngh\u1ec7 ti\u00ean ti\u1ebfn \u0111\u01b0\u1ee3c \u00e1p d\u1ee5ng trong s\u1ea3n xu\u1ea5t \u0111i\u1ec1u h\u00f2a kh\u00f4ng kh\u00ed, \u0111\u1eb7c bi\u1ec7t l\u00e0 c\u00e1c d\u00f2ng \u0111i\u1ec1u h\u00f2a cao c\u1ea5p. Hyper Grapfins l\u00e0 m\u1ed9t l\u1edbp ph\u1ee7 \u0111\u1eb7c bi\u1ec7t \u0111\u01b0\u1ee3c l\u00e0m t\u1eeb c\u00e1c h\u1ea1t nano si\u00eau nh\u1ecf, c\u00f3 kh\u1ea3 n\u0103ng h\u1ea5p th\u1ee5 v\u00e0 t\u1ecfa nhi\u1ec7t c\u1ef1c t\u1ed1t. Khi \u0111\u01b0\u1ee3c ph\u1ee7 l\u00ean b\u1ec1 m\u1eb7t l\u00e1 t\u1ea3n nhi\u1ec7t nh\u00f4m, l\u1edbp ph\u1ee7 n\u00e0y t\u1ea1o ra m\u1ed9t l\u1edbp m\u00e0ng b\u1ea3o v\u1ec7, \u0111\u1ed3ng th\u1eddi t\u0103ng c\u01b0\u1eddng kh\u1ea3 n\u0103ng trao \u0111\u1ed5i nhi\u1ec7t c\u1ee7a d\u00e0n l\u1ea1nh. \u0110i\u1ec1u h\u00f2a Midea Inverter 9.000 BTU (1 HP) MAFA-09CDN8 \u0111\u01b0\u1ee3c trang b\u1ecb \u1ed1ng d\u1eabn gas b\u1eb1ng \u0111\u1ed3ng nguy\u00ean ch\u1ea5t v\u00e0 l\u00e1 t\u1ea3n nhi\u1ec7t nh\u00f4m m\u1ea1 Hyper Grapfins, \u0111\u1ea3m b\u1ea3o hi\u1ec7u su\u1ea5t l\u00e0m l\u1ea1nh t\u1ed1i \u01b0u. \u1ed0ng d\u1eabn gas b\u1eb1ng \u0111\u1ed3ng gi\u00fap m\u00e1y ho\u1ea1t \u0111\u1ed9ng \u1ed5n \u0111\u1ecbnh, b\u1ec1n b\u1ec9, c\u00f2n l\u00e1 t\u1ea3n nhi\u1ec7t nh\u00f4m m\u1ea1 Hyper Grapfins t\u0103ng c\u01b0\u1eddng kh\u1ea3 n\u0103ng trao \u0111\u1ed5i nhi\u1ec7t, l\u00e0m l\u1ea1nh nhanh ch\u00f3ng. Nh\u1edd \u0111\u00f3, b\u1ea1n s\u1ebd lu\u00f4n c\u1ea3m th\u1ea5y tho\u1ea3i m\u00e1i v\u00e0 d\u1ec5 ch\u1ecbu trong kh\u00f4ng gian s\u1ed1ng c\u1ee7a m\u00ecnh. C\u00f4ng su\u1ea5t 1 HP ph\u00f9 h\u1ee3p v\u1edbi kh\u00f4ng gian c\u00f3 di\u1ec7n t\u00edch d\u01b0\u1edbi 15m2 gi\u00fap ti\u1ebft ki\u1ec7m \u0111i\u1ec7n n\u0103ng Midea Inverter 9.000 BTU (1 HP) MAFA-09CDN8 s\u1edf h\u1eefu c\u00f4ng su\u1ea5t 1 HP - 9.000 BTU , l\u00e0 l\u1ef1a ch\u1ecdn ho\u00e0n h\u1ea3o \u0111\u1ec3 l\u00e0m m\u00e1t c\u00e1c kh\u00f4ng gian c\u00f3 di\u1ec7n t\u00edch d\u01b0\u1edbi 15m2 nh\u01b0 ph\u00f2ng ng\u1ee7, ph\u00f2ng l\u00e0m vi\u1ec7c ho\u1eb7c ph\u00f2ng tr\u1ebb em. C\u00f4ng su\u1ea5t n\u00e0y v\u1eeba \u0111\u1ee7 \u0111\u1ec3 l\u00e0m l\u1ea1nh nhanh ch\u00f3ng v\u00e0 hi\u1ec7u qu\u1ea3, gi\u00fap b\u1ea1n t\u1eadn h\u01b0\u1edfng kh\u00f4ng gian s\u1ed1ng tho\u1ea3i m\u00e1i m\u00e0 kh\u00f4ng lo t\u1ed1n qu\u00e1 nhi\u1ec1u \u0111i\u1ec7n n\u0103ng. So v\u1edbi c\u00e1c thi\u1ebft b\u1ecb c\u00f3 c\u00f4ng su\u1ea5t l\u1edbn h\u01a1n, m\u00e1y l\u1ea1nh Midea Inverter 9.000 BTU (1 HP) MAFA-09CDN8 ti\u1ebft ki\u1ec7m \u0111i\u1ec7n n\u0103ng h\u01a1n, \u0111\u1ed3ng th\u1eddi v\u1eabn \u0111\u1ea3m b\u1ea3o kh\u1ea3 n\u0103ng l\u00e0m l\u1ea1nh hi\u1ec7u qu\u1ea3. So v\u1edbi c\u00e1c m\u00e1y l\u1ea1nh c\u00f9ng ph\u00e2n kh\u00fac c\u00f3 c\u00f4ng su\u1ea5t l\u1edbn h\u01a1n, Midea Inverter MAFA-09CDN8 l\u00e0 l\u1ef1a ch\u1ecdn ph\u00f9 h\u1ee3p cho ph\u00f2ng c\u00f3 di\u1ec7n t\u00edch nh\u1ecf v\u00e0 v\u1eeba. C\u00f4ng su\u1ea5t v\u1eeba ph\u1ea3i gi\u00fap m\u00e1y l\u1ea1nh ho\u1ea1t \u0111\u1ed9ng \u1ed5n \u0111\u1ecbnh, \u0111i\u1ec1u n\u00e0y kh\u00f4ng ch\u1ec9 gi\u00fap b\u1ea1n ti\u1ebft ki\u1ec7m \u0111i\u1ec7n n\u0103ng m\u00e0 c\u00f2n k\u00e9o d\u00e0i tu\u1ed5i th\u1ecd c\u1ee7a m\u00e1y. B\u00ean c\u1ea1nh \u0111\u00f3, vi\u1ec7c ch\u1ecdn \u0111\u00fang c\u00f4ng su\u1ea5t c\u00f2n gi\u00fap gi\u1ea3m thi\u1ec3u t\u00e1c \u0111\u1ed9ng \u0111\u1ebfn m\u00f4i tr\u01b0\u1eddng nh\u1edd ti\u00eau th\u1ee5 \u00edt \u0111i\u1ec7n n\u0103ng h\u01a1n. M\u00e1t m\u1ebb ngay t\u1ee9c th\u00ec v\u1edbi c\u00f4ng ngh\u1ec7 Fast Cooling tr\u00ean \u0111i\u1ec1u h\u00f2a Midea Inverter 9.000 BTU (1 HP) MAFA-09CDN8 M\u1eabu \u0111i\u1ec1u h\u00f2a Midea n\u00e0y \u0111\u01b0\u1ee3c trang b\u1ecb c\u00f4ng ngh\u1ec7 Fast Cooling , gi\u00fap l\u00e0m m\u00e1t c\u0103n ph\u00f2ng nhanh ch\u00f3ng ch\u1ec9 trong v\u00e0i ph\u00fat. Kh\u00e1c v\u1edbi c\u00e1c m\u00e1y l\u1ea1nh th\u00f4ng th\u01b0\u1eddng, c\u00f4ng ngh\u1ec7 n\u00e0y ho\u1ea1t \u0111\u1ed9ng b\u1eb1ng c\u00e1ch t\u0103ng c\u01b0\u1eddng l\u01b0u l\u01b0\u1ee3ng gi\u00f3 v\u00e0 \u0111i\u1ec1u ch\u1ec9nh nhi\u1ec7t \u0111\u1ed9 m\u1ed9t c\u00e1ch nhanh ch\u00f3ng. Nh\u1edd \u0111\u00f3, b\u1ea1n s\u1ebd kh\u00f4ng c\u00f2n ph\u1ea3i ch\u1edd \u0111\u1ee3i l\u00e2u \u0111\u1ec3 t\u1eadn h\u01b0\u1edfng kh\u00f4ng gian m\u00e1t m\u1ebb, tho\u1ea3i m\u00e1i ngay c\u1ea3 trong nh\u1eefng ng\u00e0y h\u00e8 n\u00f3ng b\u1ee9c. H\u00e3y t\u01b0\u1edfng t\u01b0\u1ee3ng sau m\u1ed9t ng\u00e0y l\u00e0m vi\u1ec7c m\u1ec7t m\u1ecfi, b\u1ea1n tr\u1edf v\u1ec1 nh\u00e0 v\u00e0 b\u1eadt \u0111i\u1ec1u h\u00f2a Midea Inverter, ch\u1ec9 v\u00e0i ph\u00fat sau, c\u0103n ph\u00f2ng \u0111\u00e3 tr\u1edf n\u00ean m\u00e1t l\u1ea1nh, gi\u00fap b\u1ea1n th\u01b0 gi\u00e3n v\u00e0 l\u1ea5y l\u1ea1i n\u0103ng l\u01b0\u1ee3ng. Gi\u1ea3m \u0111\u00e1ng k\u1ec3 h\u00f3a \u0111\u01a1n ti\u1ec1n \u0111i\u1ec7n h\u00e0ng th\u00e1ng v\u1edbi kh\u1ea3 n\u0103ng ti\u1ebft ki\u1ec7m \u0111i\u1ec7n l\u00ean \u0111\u1ebfn 30% M\u00f9a h\u00e8 n\u00f3ng b\u1ee9c khi\u1ebfn h\u00f3a \u0111\u01a1n ti\u1ec1n \u0111i\u1ec7n nh\u00e0 b\u1ea1n t\u0103ng v\u1ecdt? M\u00e1y l\u1ea1nh Midea Inverter 9.000 BTU (1 HP) MAFA-09CDN8 v\u1edbi c\u00f4ng ngh\u1ec7 Inverter ti\u00ean ti\u1ebfn kh\u00f4ng ch\u1ec9 l\u00e0m m\u00e1t hi\u1ec7u qu\u1ea3 m\u00e0 c\u00f2n gi\u00fap b\u1ea1n ti\u1ebft ki\u1ec7m \u0111\u1ebfn 30% chi ph\u00ed \u0111i\u1ec7n n\u0103ng h\u00e0ng th\u00e1ng. H\u00e3y c\u00f9ng kh\u00e1m ph\u00e1 b\u00ed quy\u1ebft ti\u1ebft ki\u1ec7m \u0111i\u1ec7n hi\u1ec7u qu\u1ea3 c\u1ee7a chi\u1ebfc m\u00e1y l\u1ea1nh n\u00e0y. C\u00f4ng ngh\u1ec7 Inverter ti\u1ebft ki\u1ec7m \u0111i\u1ec7n tr\u00ean \u0111i\u1ec1u h\u00f2a Midea Inverter 9.000 BTU (1 HP) MAFA-09CDN8 Kh\u00e1c v\u1edbi m\u00e1y l\u1ea1nh th\u00f4ng th\u01b0\u1eddng, m\u00e1y l\u1ea1nh Midea Inverter 9.000 BTU (1 HP) MAFA-09CDN8 v\u1edbi c\u00f4ng ngh\u1ec7 Inverter kh\u00f4ng ch\u1ea1y/t\u1eaft li\u00ean t\u1ee5c m\u00e0 \u0111i\u1ec1u ch\u1ec9nh t\u1ed1c \u0111\u1ed9 quay c\u1ee7a m\u00e1y n\u00e9n m\u1ed9t c\u00e1ch linh ho\u1ea1t. Nh\u1edd \u0111\u00f3, m\u00e1y l\u1ea1nh c\u00f3 th\u1ec3 duy tr\u00ec nhi\u1ec7t \u0111\u1ed9 ph\u00f2ng \u1ed5n \u0111\u1ecbnh m\u00e0 kh\u00f4ng g\u00e2y ra s\u1ef1 dao \u0111\u1ed9ng nhi\u1ec7t \u0111\u1ed9 \u0111\u1ed9t ng\u1ed9t. Nh\u1edd kh\u1ea3 n\u0103ng \u0111i\u1ec1u ch\u1ec9nh t\u1ed1c \u0111\u1ed9 linh ho\u1ea1t, m\u00e1y l\u1ea1nh ti\u00eau th\u1ee5 \u00edt \u0111i\u1ec7n n\u0103ng h\u01a1n so v\u1edbi m\u00e1y l\u1ea1nh th\u00f4ng th\u01b0\u1eddng, gi\u00fap b\u1ea1n ti\u1ebft ki\u1ec7m chi ph\u00ed ti\u1ec1n \u0111i\u1ec7n h\u00e0ng th\u00e1ng. M\u00e1y n\u00e9n ho\u1ea1t \u0111\u1ed9ng \u1ed5n \u0111\u1ecbnh, kh\u00f4ng g\u00e2y ra ti\u1ebfng \u1ed3n l\u1edbn, mang \u0111\u1ebfn kh\u00f4ng gian s\u1ed1ng y\u00ean t\u0129nh. Nh\u1edd ho\u1ea1t \u0111\u1ed9ng \u1ed5n \u0111\u1ecbnh, m\u00e1y l\u1ea1nh Inverter c\u00f3 tu\u1ed5i th\u1ecd cao h\u01a1n so v\u1edbi m\u00e1y l\u1ea1nh th\u00f4ng th\u01b0\u1eddng. Ngo\u00e0i ra c\u00f4ng ngh\u1ec7 n\u00e0y c\u00f2n g\u00f3p ph\u1ea7n l\u00e0m gi\u1ea3m l\u01b0\u1ee3ng kh\u00ed th\u1ea3i CO2, g\u00f3p ph\u1ea7n b\u1ea3o v\u1ec7 m\u00f4i tr\u01b0\u1eddng. C\u00f4ng ngh\u1ec7 iEco th\u00f4ng minh c\u1ee7a m\u00e1y l\u1ea1nh Midea Inverter 9.000 BTU (1 HP) MAFA-09CDN8 \u0110i\u1ec1u h\u00f2a Midea Inverter 9.000 BTU (1 HP) MAFA-09CDN8 \u0111\u01b0\u1ee3c trang b\u1ecb c\u00f4ng ngh\u1ec7 iEco th\u00f4ng minh, gi\u00fap ti\u1ebft ki\u1ec7m \u0111i\u1ec7n n\u0103ng l\u00ean \u0111\u1ebfn 30% . C\u00f4ng ngh\u1ec7 n\u00e0y ho\u1ea1t \u0111\u1ed9ng b\u1eb1ng c\u00e1ch t\u1ef1 \u0111\u1ed9ng \u0111i\u1ec1u ch\u1ec9nh c\u00f4ng su\u1ea5t ho\u1ea1t \u0111\u1ed9ng c\u1ee7a m\u00e1y n\u00e9n, gi\u00fap m\u00e1y l\u1ea1nh lu\u00f4n ho\u1ea1t \u0111\u1ed9ng \u1edf m\u1ee9c hi\u1ec7u qu\u1ea3 nh\u1ea5t. Nh\u1edd \u0111\u00f3, b\u1ea1n c\u00f3 th\u1ec3 gi\u1ea3m \u0111\u00e1ng k\u1ec3 ti\u1ec1n \u0111i\u1ec7n h\u00e0ng th\u00e1ng m\u00e0 v\u1eabn \u0111\u1ea3m b\u1ea3o kh\u00f4ng gian lu\u00f4n m\u00e1t m\u1ebb. B\u00ean c\u1ea1nh \u0111\u00f3, nh\u00e3n n\u0103ng l\u01b0\u1ee3ng 5 sao c\u0169ng ch\u1ee9ng t\u1ecf hi\u1ec7u su\u1ea5t n\u0103ng l\u01b0\u1ee3ng v\u01b0\u1ee3t tr\u1ed9i c\u1ee7a s\u1ea3n ph\u1ea9m (hi\u1ec7u su\u1ea5t n\u0103ng l\u01b0\u1ee3ng 5.06, 0.82 kW/h). V\u00ec th\u1ec3, v\u1edbi Midea Inverter 9.000 BTU (1 HP) MAFA-09CDN8, b\u1ea1n kh\u00f4ng ch\u1ec9 ti\u1ebft ki\u1ec7m chi ph\u00ed sinh ho\u1ea1t m\u00e0 c\u00f2n g\u00f3p ph\u1ea7n b\u1ea3o v\u1ec7 m\u00f4i tr\u01b0\u1eddng. M\u00e1y l\u1ea1nh Midea Inverter 9.000 BTU (1 HP) MAFA-09CDN8 c\u00f3 m\u00e0ng l\u1ecdc b\u1ee5i 2 l\u1edbp HD mang \u0111\u1ebfn kh\u00f4ng kh\u00ed trong l\u00e0nh M\u00e1y l\u1ea1nh \u0111\u01b0\u1ee3c trang b\u1ecb b\u1ed9 l\u1ecdc b\u1ee5i 2 l\u1edbp HD v\u00e0 m\u00e0ng l\u1ecdc ch\u1ea5t m\u00f4i l\u1ea1nh, gi\u00fap lo\u1ea1i b\u1ecf hi\u1ec7u qu\u1ea3 c\u00e1c h\u1ea1t b\u1ee5i si\u00eau nh\u1ecf PM2.5, vi khu\u1ea9n, n\u1ea5m m\u1ed1c v\u00e0 c\u00e1c ch\u1ea5t g\u00e2y d\u1ecb \u1ee9ng kh\u00e1c. T\u00ednh n\u0103ng n\u00e0y \u0111\u00f3ng vai tr\u00f2 quan tr\u1ecdng trong vi\u1ec7c l\u00e0m s\u1ea1ch kh\u00f4ng kh\u00ed, mang \u0111\u1ebfn m\u1ed9t m\u00f4i tr\u01b0\u1eddng s\u1ed1ng trong l\u00e0nh. L\u1edbp l\u1ecdc th\u00f4 b\u1eaft gi\u1eef c\u00e1c h\u1ea1t b\u1ee5i l\u1edbn, l\u00f4ng v\u1eadt nu\u00f4i v\u00e0 c\u00e1c t\u1ea1p ch\u1ea5t c\u00f3 k\u00edch th\u01b0\u1edbc l\u1edbn h\u01a1n. L\u1edbp l\u1ecdc th\u1ee9 hai v\u1edbi c\u00f4ng ngh\u1ec7 HEPA ti\u00ean ti\u1ebfn, c\u00f3 kh\u1ea3 n\u0103ng b\u1eaft gi\u1eef \u0111\u1ebfn 99% c\u00e1c h\u1ea1t b\u1ee5i si\u00eau nh\u1ecf, bao g\u1ed3m c\u1ea3 c\u00e1c h\u1ea1t b\u1ee5i PM2.5. \u0110\u00e2y l\u00e0 nh\u1eefng h\u1ea1t b\u1ee5i c\u1ef1c nh\u1ecf, g\u00e2y h\u1ea1i cho s\u1ee9c kh\u1ecfe v\u00e0 l\u00e0 nguy\u00ean nh\u00e2n ch\u00ednh g\u00e2y ra c\u00e1c b\u1ec7nh v\u1ec1 \u0111\u01b0\u1eddng h\u00f4 h\u1ea5p. M\u00e0ng l\u1ecdc ch\u1ea5t m\u00f4i l\u1ea1nh b\u1ed5 sung c\u00f2n gi\u00fap l\u00e0m s\u1ea1ch kh\u00f4ng kh\u00ed m\u1ed9t c\u00e1ch to\u00e0n di\u1ec7n. Nh\u1edd \u0111\u00f3, b\u1ea1n s\u1ebd lu\u00f4n \u0111\u01b0\u1ee3c t\u1eadn h\u01b0\u1edfng kh\u00f4ng kh\u00ed trong l\u00e0nh, s\u1ea1ch s\u1ebd, b\u1ea3o v\u1ec7 s\u1ee9c kh\u1ecfe cho c\u1ea3 gia \u0111\u00ecnh, \u0111\u1eb7c bi\u1ec7t l\u00e0 nh\u1eefng ng\u01b0\u1eddi c\u00f3 h\u1ec7 h\u00f4 h\u1ea5p nh\u1ea1y c\u1ea3m. Nh\u1eefng t\u00ednh n\u0103ng th\u00f4ng minh gi\u00fap b\u1ea1n ki\u1ec3m so\u00e1t m\u00e1y l\u1ea1nh m\u1ed9t c\u00e1ch d\u1ec5 d\u00e0ng v\u00e0 linh ho\u1ea1t \u0110i\u1ec1u h\u00f2a Midea Inverter 9.000 BTU (1 HP) MAFA-09CDN8 kh\u00f4ng ch\u1ec9 l\u00e0m m\u00e1t hi\u1ec7u qu\u1ea3 m\u00e0 c\u00f2n \u0111\u01b0\u1ee3c trang b\u1ecb nhi\u1ec1u ti\u1ec7n \u00edch th\u00f4ng minh mang \u0111\u1ebfn s\u1ef1 ti\u1ec7n l\u1ee3i cho ng\u01b0\u1eddi d\u00f9ng. Kh\u00f3a remote \u0111i\u1ec1u khi\u1ec3n : T\u00ednh n\u0103ng kh\u00f3a remote gi\u00fap b\u1ea1n y\u00ean t\u00e2m h\u01a1n khi c\u00f3 tr\u1ebb nh\u1ecf trong nh\u00e0. Vi\u1ec7c v\u00f4 t\u00ecnh nh\u1ea5n nh\u1ea7m c\u00e1c n\u00fat tr\u00ean remote s\u1ebd kh\u00f4ng l\u00e0m \u1ea3nh h\u01b0\u1edfng \u0111\u1ebfn ch\u1ebf \u0111\u1ed9 ho\u1ea1t \u0111\u1ed9ng c\u1ee7a m\u00e1y l\u1ea1nh. Ch\u1ee9c n\u0103ng b\u1eadt t\u1eaft \u0111\u00e8n hi\u1ec3n th\u1ecb : Ch\u1ee9c n\u0103ng n\u00e0y gi\u00fap b\u1ea1n \u0111i\u1ec1u ch\u1ec9nh \u00e1nh s\u00e1ng trong ph\u00f2ng ng\u1ee7 ho\u1eb7c khi mu\u1ed1n t\u1ea1o kh\u00f4ng gian y\u00ean t\u0129nh. \u00c1nh s\u00e1ng t\u1eeb m\u00e0n h\u00ecnh hi\u1ec3n th\u1ecb c\u00f3 th\u1ec3 g\u00e2y kh\u00f3 ch\u1ecbu khi ng\u1ee7 ho\u1eb7c l\u00e0m vi\u1ec7c trong b\u00f3ng t\u1ed1i. H\u1eb9n gi\u1edd b\u1eadt t\u1eaft m\u00e1y : V\u1edbi ch\u1ee9c n\u0103ng h\u1eb9n gi\u1edd, b\u1ea1n c\u00f3 th\u1ec3 thi\u1ebft l\u1eadp tr\u01b0\u1edbc th\u1eddi gian b\u1eadt/t\u1eaft m\u00e1y l\u1ea1nh \u0111\u1ec3 ti\u1ebft ki\u1ec7m \u0111i\u1ec7n n\u0103ng v\u00e0 t\u1ea1o s\u1ef1 tho\u1ea3i m\u00e1i khi th\u1ee9c d\u1eady ho\u1eb7c tr\u01b0\u1edbc khi \u0111i ng\u1ee7. V\u1edbi nh\u1eefng t\u00ednh n\u0103ng th\u00f4ng minh n\u00e0y, Midea Inverter 9.000 BTU (1 HP) MAFA-09CDN8 kh\u00f4ng ch\u1ec9 l\u00e0 m\u1ed9t thi\u1ebft b\u1ecb l\u00e0m m\u00e1t m\u00e0 c\u00f2n l\u00e0 m\u1ed9t ng\u01b0\u1eddi b\u1ea1n \u0111\u1ed3ng h\u00e0nh \u0111\u00e1ng tin c\u1eady trong ng\u00f4i nh\u00e0 c\u1ee7a b\u1ea1n. Gi\u00e1 tham kh\u1ea3o c\u1ee7a \u0111i\u1ec1u h\u00f2a Midea Inverter 9.000 BTU (1 HP) MAFA-09CDN8 Midea Inverter 9.000 BTU (1 HP) MAFA-09CDN8 \u0111\u01b0\u1ee3c \u0111\u00e1nh gi\u00e1 l\u00e0 m\u1ed9t s\u1ea3n ph\u1ea9m c\u00f3 ch\u1ea5t l\u01b0\u1ee3ng t\u1ed1t trong ph\u00e2n kh\u00fac m\u00e1y l\u1ea1nh gi\u00e1 r\u1ebb \u0111\u1ebfn trung b\u00ecnh. S\u1ea3n ph\u1ea9m n\u00e0y n\u1ed5i b\u1eadt v\u1edbi c\u00e1c t\u00ednh n\u0103ng nh\u01b0: l\u00e0m l\u1ea1nh nhanh, ti\u1ebft ki\u1ec7m \u0111i\u1ec7n, l\u1ecdc kh\u00f4ng kh\u00ed hi\u1ec7u qu\u1ea3 v\u00e0 nhi\u1ec1u ti\u1ec7n \u00edch th\u00f4ng minh kh\u00e1c. Gi\u00e1 c\u1ee7a s\u1ea3n ph\u1ea9m c\u00f3 th\u1ec3 thay \u0111\u1ed5i t\u00f9y thu\u1ed9c v\u00e0o c\u00e1c ch\u01b0\u01a1ng tr\u00ecnh khuy\u1ebfn m\u00e3i, m\u00f9a v\u1ee5. B\u1ea1n c\u00f3 th\u1ec3 tham kh\u1ea3o th\u00eam th\u00f4ng tin th\u00f4ng s\u1ed1 v\u00e0 gi\u00e1 c\u1ee7a s\u1ea3n ph\u1ea9m t\u1ea1i website c\u1ee7a Ho\u00e0ng H\u00e0 Mobile ho\u1eb7c li\u00ean h\u1ec7 s\u1ed1 hotline 1900 2091 \u0111\u1ec3 \u0111\u01b0\u1ee3c t\u01b0 v\u1ea5n k\u1ef9 h\u01a1n. V\u00ec sao n\u00ean mua m\u00e1y l\u1ea1nh Midea Inverter 9.000 BTU (1 HP) MAFA-09CDN8 t\u1ea1i Ho\u00e0ng H\u00e0 Mobile? Midea Inverter 9.000 BTU (1 HP) MAFA-09CDN8 l\u00e0 s\u1ef1 k\u1ebft h\u1ee3p ho\u00e0n h\u1ea3o gi\u1eefa c\u00f4ng ngh\u1ec7 hi\u1ec7n \u0111\u1ea1i v\u00e0 thi\u1ebft k\u1ebf tinh t\u1ebf. V\u1edbi kh\u1ea3 n\u0103ng l\u00e0m l\u1ea1nh nhanh, ti\u1ebft ki\u1ec7m \u0111i\u1ec7n, l\u1ecdc kh\u00f4ng kh\u00ed hi\u1ec7u qu\u1ea3 v\u00e0 v\u1eadn h\u00e0nh \u00eam \u00e1i, s\u1ea3n ph\u1ea9m n\u00e0y l\u00e0 l\u1ef1a ch\u1ecdn l\u00fd t\u01b0\u1edfng cho m\u1ecdi gia \u0111\u00ecnh. Khi quy\u1ebft \u0111\u1ecbnh \u0111\u1ea7u t\u01b0 v\u00e0o m\u1ed9t chi\u1ebfc m\u00e1y l\u1ea1nh, ngo\u00e0i quan t\u00e2m \u0111\u1ebfn s\u1ea3n ph\u1ea9m, b\u1ea1n c\u00f2n ph\u1ea3i t\u00ecm ki\u1ebfm m\u1ed9t \u0111\u01a1n v\u1ecb cung c\u1ea5p uy t\u00edn, \u0111\u1ea3m b\u1ea3o quy\u1ec1n l\u1ee3i cho ng\u01b0\u1eddi ti\u00eau d\u00f9ng. Ho\u00e0ng H\u00e0 Mobile ch\u00ednh l\u00e0 s\u1ef1 l\u1ef1a ch\u1ecdn ho\u00e0n h\u1ea3o d\u00e0nh cho b\u1ea1n. Ch\u00ednh h\u00e3ng, ch\u1ea5t l\u01b0\u1ee3ng \u0111\u1ea3m b\u1ea3o : M\u1ecdi s\u1ea3n ph\u1ea9m m\u00e1y l\u1ea1nh Midea Inverter 9.000 BTU (1 HP) MAFA-09CDN8 t\u1ea1i Ho\u00e0ng H\u00e0 Mobile \u0111\u1ec1u \u0111\u01b0\u1ee3c nh\u1eadp kh\u1ea9u ch\u00ednh h\u00e3ng, c\u00f3 \u0111\u1ea7y \u0111\u1ee7 gi\u1ea5y t\u1edd ch\u1ee9ng minh ngu\u1ed3n g\u1ed1c xu\u1ea5t x\u1ee9, b\u1ea1n ho\u00e0n to\u00e0n y\u00ean t\u00e2m v\u1ec1 ch\u1ea5t l\u01b0\u1ee3ng v\u00e0 tu\u1ed5i th\u1ecd c\u1ee7a s\u1ea3n ph\u1ea9m. B\u00ean c\u1ea1nh \u0111\u00f3, Ho\u00e0ng H\u00e0 Mobile \u0111\u00e3 kh\u1eb3ng \u0111\u1ecbnh \u0111\u01b0\u1ee3c v\u1ecb th\u1ebf c\u1ee7a m\u00ecnh tr\u00ean th\u1ecb tr\u01b0\u1eddng \u0111i\u1ec7n t\u1eed Vi\u1ec7t Nam v\u1edbi nhi\u1ec1u n\u0103m kinh nghi\u1ec7m. Gi\u00e1 c\u1ea3 c\u1ea1nh tranh, nhi\u1ec1u \u01b0u \u0111\u00e3i : Ho\u00e0ng H\u00e0 Mobile th\u01b0\u1eddng xuy\u00ean t\u1ed5 ch\u1ee9c c\u00e1c ch\u01b0\u01a1ng tr\u00ecnh khuy\u1ebfn m\u00e3i, gi\u1ea3m gi\u00e1 h\u1ea5p d\u1eabn, gi\u00fap b\u1ea1n s\u1edf h\u1eefu s\u1ea3n ph\u1ea9m v\u1edbi m\u1ee9c gi\u00e1 t\u1ed1t nh\u1ea5t tr\u00ean th\u1ecb tr\u01b0\u1eddng. D\u1ecbch v\u1ee5 chuy\u00ean nghi\u1ec7p, t\u1eadn t\u00e2m : \u0110\u1ed9i ng\u0169 nh\u00e2n vi\u00ean t\u01b0 v\u1ea5n nhi\u1ec7t t\u00ecnh, gi\u00e0u kinh nghi\u1ec7m s\u1ebd gi\u00fap b\u1ea1n l\u1ef1a ch\u1ecdn \u0111\u01b0\u1ee3c s\u1ea3n ph\u1ea9m ph\u00f9 h\u1ee3p v\u1edbi nhu c\u1ea7u v\u00e0 kh\u00f4ng gian. Ngo\u00e0i ra, d\u1ecbch v\u1ee5 giao h\u00e0ng, l\u1eafp \u0111\u1eb7t v\u00e0 b\u1ea3o h\u00e0nh c\u0169ng \u0111\u01b0\u1ee3c th\u1ef1c hi\u1ec7n nhanh ch\u00f3ng, chuy\u00ean nghi\u1ec7p. Ho\u00e0ng H\u00e0 Mobile l\u00e0 \u0111\u1ecba ch\u1ec9 tin c\u1eady \u0111\u1ec3 b\u1ea1n s\u1edf h\u1eefu chi\u1ebfc \u0111i\u1ec1u h\u00f2a Midea Inverter 9.000 BTU (1 HP) MAFA-09CDN8 ch\u00ednh h\u00e3ng v\u1edbi m\u1ee9c gi\u00e1 \u01b0u \u0111\u00e3i v\u00e0 d\u1ecbch v\u1ee5 ho\u00e0n h\u1ea3o. H\u00e3y \u0111\u1ebfn v\u1edbi Ho\u00e0ng H\u00e0 Mobile \u0111\u1ec3 tr\u1ea3i nghi\u1ec7m s\u1ef1 kh\u00e1c bi\u1ec7t! Xem to\u00e0n b\u1ed9 b\u00e0i vi\u1ebft",
        "promotion_1": "1. Tr\u00fang 8386 qu\u00e0 - T\u1ed5ng gi\u00e1 tr\u1ecb t\u1edbi 250 TRI\u1ec6U \u0110\u1ed2NG (\u00c1p d\u1ee5ng t\u1eeb 10/01 - 02/02/2025). (Xem chi ti\u1ebft). 2. \u0110\u1eb7c bi\u1ec7t Tr\u1ea3 g\u00f3p 3 kh\u00f4ng: 0% l\u00e3i su\u1ea5t - 0 ph\u00ed chuy\u1ec3n \u0111\u1ed5i - 0 tr\u1ea3 tr\u01b0\u1edbc (\u00c1p d\u1ee5ng cho c\u00f4ng ty t\u00e0i ch\u00ednh v\u00e0 th\u1ebb t\u00edn d\u1ee5ng)",
        "promotion_2": "1. Gi\u1ea3m t\u1edbi 500.000\u0111 khi thanh to\u00e1n th\u1ebb t\u00edn d\u1ee5ng NCB. (Xem chi ti\u1ebft). 2. Gi\u1ea3m \u0111\u1ebfn 150.000\u0111 khi thanh to\u00e1n qua Muadee. (Xem chi ti\u1ebft). 3. Mi\u1ec5n ph\u00ed chuy\u1ec3n \u0111\u1ed5i tr\u1ea3 g\u00f3p ho\u1eb7c gi\u1ea3m \u0111\u1ebfn 500.000\u0111 khi m\u1edf th\u1ebb TPBank EVO. (Xem chi ti\u1ebft). 4. M\u1edf th\u1ebb t\u00edn d\u1ee5ng VIB - Nh\u1eadn Voucher 600.000\u0111. (Xem chi ti\u1ebft). 5. M\u1edf th\u1ebb HSBC - Ho\u00e0n ti\u1ec1n t\u1edbi 2 tri\u1ec7u \u0111\u1ed3ng. (Xem chi ti\u1ebft)"
    },
    {
        "title": "\u0110i\u1ec1u h\u00f2a Midea Inverter 9.500 BTU (1 HP) MSAGA-10CRDN8",
        "price": "gi\u00e1 hi\u1ec7n t\u1ea1i l\u00e0 5,790,000 \u20ab nh\u01b0ng tr\u01b0\u1edbc \u0111\u00e2y n\u00f3 c\u00f3 gi\u00e1 l\u00e0 9,290,000 \u20ab",
        "colors": "Tr\u1eafng",
        "technical_specifications": [
            {
                "Lo\u1ea1i m\u00e1y": "1 chi\u1ec1u (ch\u1ec9 l\u00e0m l\u1ea1nh)"
            },
            {
                "C\u00f4ng ngh\u1ec7 inverter": "M\u00e1y l\u1ea1nh Inverter"
            },
            {
                "C\u00f4ng su\u1ea5t l\u00e0m l\u1ea1nh": "1 HP - 9.500 BTU"
            },
            {
                "Ph\u1ea1m vi l\u00e0m l\u1ea1nh hi\u1ec7u qu\u1ea3": "D\u01b0\u1edbi 15m\u00b2 (t\u1eeb 30 \u0111\u1ebfn 45m\u00b3)"
            },
            {
                "Nh\u00e3n n\u0103ng l\u01b0\u1ee3ng": "5 sao (Hi\u1ec7u su\u1ea5t n\u0103ng l\u01b0\u1ee3ng 4.48)"
            }
        ],
        "description": "Midea l\u00e0 th\u01b0\u01a1ng hi\u1ec7u n\u1ed5i ti\u1ebfng v\u00e0 uy t\u00edn trong l\u0129nh v\u1ef1c thi\u1ebft b\u1ecb \u0111i\u1ec7n t\u1eed gia d\u1ee5ng. \u0110i\u1ec1u h\u00f2a Midea Inverter 9.500 BTU (1 HP) MSAGA-10CRDN8 l\u00e0 m\u1ed9t trong nh\u1eefng s\u1ea3n ph\u1ea9m n\u1ed5i ti\u1ebfng c\u1ee7a th\u01b0\u01a1ng hi\u1ec7u n\u00e0y. V\u1edbi c\u00f4ng ngh\u1ec7 Inverter ti\u00ean ti\u1ebfn, \u0111i\u1ec1u h\u00f2a kh\u00f4ng ch\u1ec9 mang l\u1ea1i hi\u1ec7u qu\u1ea3 l\u00e0m l\u1ea1nh nhanh ch\u00f3ng m\u00e0 c\u00f2n gi\u00fap ti\u1ebft ki\u1ec7m \u0111i\u1ec7n n\u0103ng t\u1ed1i \u0111a. S\u1ea3n ph\u1ea9m c\u00f2n \u0111\u01b0\u1ee3c trang b\u1ecb nhi\u1ec1u t\u00ednh n\u0103ng th\u00f4ng minh nh\u01b0 c\u00e0i \u0111\u1eb7t nhi\u1ec7t \u0111\u1ed9 t\u1ea1i v\u1ecb tr\u00ed \u0111i\u1ec1u khi\u1ec3n Follow me , \u0111i\u1ec1u ch\u1ec9nh h\u01b0\u1edbng gi\u00f3 Avoid Me, h\u1eb9n gi\u1edd b\u1eadt t\u1eaft , h\u00fat \u1ea9m , t\u1ef1 l\u00e0m s\u1ea1ch . \u0110\u00e2y l\u00e0 s\u1ef1 l\u1ef1a ch\u1ecdn l\u00fd t\u01b0\u1edfng cho nh\u1eefng gia \u0111\u00ecnh c\u00f3 kh\u00f4ng gian nh\u1ecf g\u1ecdn, gi\u00fap t\u1ea1o n\u00ean m\u1ed9t m\u00f4i tr\u01b0\u1eddng s\u1ed1ng trong l\u00e0nh v\u00e0 d\u1ec5 ch\u1ecbu. \u0110\u1eb7c \u0111i\u1ec3m n\u1ed5i b\u1eadt: Ch\u1ee9c n\u0103ng c\u00e0i \u0111\u1eb7t nhi\u1ec7t \u0111\u1ed9 t\u1ea1i v\u1ecb tr\u00ed \u0111i\u1ec1u khi\u1ec3n Follow Me gi\u00fap \u0111i\u1ec1u ch\u1ec9nh nhi\u1ec7t \u0111\u1ed9 ch\u00ednh x\u00e1c t\u1ea1i v\u1ecb tr\u00ed c\u1ee7a remote, mang l\u1ea1i s\u1ef1 tho\u1ea3i m\u00e1i t\u1ed1i \u0111a. M\u00e0n h\u00ecnh hi\u1ec3n th\u1ecb nhi\u1ec7t \u0111\u1ed9 tr\u00ean d\u00e0n l\u1ea1nh gi\u00fap ng\u01b0\u1eddi d\u00f9ng d\u1ec5 d\u00e0ng theo d\u00f5i v\u00e0 \u0111i\u1ec1u ch\u1ec9nh nhi\u1ec7t \u0111\u1ed9 ph\u00f2ng. Ch\u1ee9c n\u0103ng h\u00fat \u1ea9m gi\u00fap lo\u1ea1i b\u1ecf \u0111\u1ed9 \u1ea9m d\u01b0 th\u1eeba, mang l\u1ea1i kh\u00f4ng kh\u00ed kh\u00f4 tho\u00e1ng, trong l\u00e0nh. Ch\u1ebf \u0111\u1ed9 Avoid Me (Breeze Away) \u0111i\u1ec1u ch\u1ec9nh h\u01b0\u1edbng gi\u00f3 \u0111\u1ec3 tr\u00e1nh th\u1ed5i tr\u1ef1c ti\u1ebfp v\u00e0o ng\u01b0\u1eddi, t\u1ea1o c\u1ea3m gi\u00e1c d\u1ec5 ch\u1ecbu. Th\u00f4ng s\u1ed1 k\u1ef9 thu\u1eadt chi ti\u1ebft c\u1ee7a m\u00e1y l\u1ea1nh Midea Inverter 9.500 BTU (1 HP) MSAGA-10CRDN8 Th\u00f4ng s\u1ed1 Chi ti\u1ebft Lo\u1ea1i m\u00e1y 1 chi\u1ec1u (ch\u1ec9 l\u00e0m l\u1ea1nh) C\u00f4ng su\u1ea5t l\u00e0m l\u1ea1nh 1 HP - 9.500 BTU Ph\u1ea1m vi l\u00e0m l\u1ea1nh hi\u1ec7u qu\u1ea3 D\u01b0\u1edbi 15m\u00b2 C\u00f4ng ngh\u1ec7 inverter M\u00e1y l\u1ea1nh Inverter \u0110\u1ed9 \u1ed3n trung b\u00ecnh 40.5/34/32 dB Ch\u1ea5t li\u1ec7u d\u00e0n t\u1ea3n nhi\u1ec7t \u1ed0ng d\u1eabn gas b\u1eb1ng \u0110\u1ed3ng - L\u00e1 t\u1ea3n nhi\u1ec7t b\u1eb1ng Nh\u00f4m m\u1ea1 V\u00e0ng Lo\u1ea1i Gas R-32 L\u1ecdc b\u1ee5i, kh\u00e1ng khu\u1ea9n, kh\u1eed m\u00f9i B\u1ed9 l\u1ecdc b\u1ee5i 2 l\u1edbp HD Ti\u00eau th\u1ee5 \u0111i\u1ec7n 0.75 kW/h C\u00f4ng ngh\u1ec7 ti\u1ebft ki\u1ec7m \u0111i\u1ec7n Inverter Quattro C\u00f4ng ngh\u1ec7 l\u00e0m l\u1ea1nh nhanh Boost Ch\u1ebf \u0111\u1ed9 gi\u00f3 Tu\u1ef3 ch\u1ec9nh \u0111i\u1ec1u khi\u1ec3n l\u00ean xu\u1ed1ng K\u00edch th\u01b0\u1edbc - Kh\u1ed1i l\u01b0\u1ee3ng d\u00e0n l\u1ea1nh D\u00e0i 83.5 cm - Cao 20.8 cm - D\u00e0y 29.5 cm - N\u1eb7ng 8.9 kg K\u00edch th\u01b0\u1edbc - Kh\u1ed1i l\u01b0\u1ee3ng d\u00e0n n\u00f3ng D\u00e0i 72 cm - Cao 49.5 cm - D\u00e0y 27 cm - N\u1eb7ng 21.7 kg \u0110\u00e1nh gi\u00e1 chi ti\u1ebft \u0111i\u1ec1u h\u00f2a Midea Inverter 9.500 BTU (1 HP) MSAGA-10CRDN8 \u0110i\u1ec1u h\u00f2a Midea MSAGA-10CRDN8 n\u1ed5i b\u1eadt v\u1edbi thi\u1ebft k\u1ebf g\u1ecdn nh\u1eb9, d\u1ec5 l\u1eafp \u0111\u1eb7t, d\u1ec5 v\u1ec7 sinh, l\u00e0 s\u1ef1 l\u1ef1a ch\u1ecdn l\u00fd t\u01b0\u1edfng cho kh\u00f4ng gian nh\u1ecf. Thi\u1ebft k\u1ebf g\u1ecdn nh\u1eb9, d\u1ec5 l\u1eafp \u0111\u1eb7t M\u00e1y l\u1ea1nh Midea Inverter 9.500 BTU (1 HP) MSAGA-10CRDN8 c\u00f3 k\u00edch th\u01b0\u1edbc d\u00e0i 83.5 cm, cao 29.5 cm, d\u00e0y 20.8 cm . K\u00edch th\u01b0\u1edbc n\u00e0y gi\u00fap \u0111i\u1ec1u h\u00f2a d\u1ec5 d\u00e0ng l\u1eafp \u0111\u1eb7t \u1edf ph\u00f2ng kh\u00e1ch, ph\u00f2ng ng\u1ee7 ho\u1eb7c ph\u00f2ng l\u00e0m vi\u1ec7c. V\u1edbi tr\u1ecdng l\u01b0\u1ee3ng nh\u1eb9 ch\u1ec9 8.9 kg , vi\u1ec7c l\u1eafp \u0111\u1eb7t v\u00e0 di chuy\u1ec3n \u0111i\u1ec1u h\u00f2a c\u0169ng tr\u1edf n\u00ean d\u1ec5 d\u00e0ng h\u01a1n. Thi\u1ebft k\u1ebf n\u00e0y kh\u00f4ng ch\u1ec9 ti\u1ebft ki\u1ec7m di\u1ec7n t\u00edch m\u00e0 c\u00f2n mang l\u1ea1i v\u1ebb \u0111\u1eb9p hi\u1ec7n \u0111\u1ea1i, thanh l\u1ecbch cho kh\u00f4ng gian s\u1ed1ng c\u1ee7a b\u1ea1n. D\u00e0n l\u1ea1nh c\u1ee7a \u0111i\u1ec1u h\u00f2a c\u00f3 thi\u1ebft k\u1ebf \u0111\u01a1n gi\u1ea3n, d\u1ec5 d\u00e0ng th\u00e1o r\u1eddi \u0111\u1ec3 v\u1ec7 sinh b\u00ean trong. Thi\u1ebft k\u1ebf n\u00e0y kh\u00f4ng ch\u1ec9 gi\u00fap cho vi\u1ec7c b\u1ea3o tr\u00ec tr\u1edf n\u00ean nhanh ch\u00f3ng m\u00e0 c\u00f2n \u0111\u1ea3m b\u1ea3o hi\u1ec7u su\u1ea5t ho\u1ea1t \u0111\u1ed9ng t\u1ed1i \u01b0u. Khi d\u00e0n l\u1ea1nh s\u1ea1ch s\u1ebd, \u0111i\u1ec1u h\u00f2a s\u1ebd t\u0103ng c\u01b0\u1eddng kh\u1ea3 n\u0103ng l\u00e0m l\u1ea1nh v\u00e0 ti\u1ebft ki\u1ec7m \u0111i\u1ec7n n\u0103ng h\u01a1n. \u0110i k\u00e8m v\u1edbi \u0111\u00f3 l\u00e0 d\u00e0n n\u00f3ng s\u1eed d\u1ee5ng \u1ed1ng d\u1eabn gas b\u1eb1ng \u0111\u1ed3ng v\u00e0 l\u00e1 t\u1ea3n nhi\u1ec7t b\u1eb1ng nh\u00f4m m\u1ea1 v\u00e0ng. Ch\u1ea5t li\u1ec7u \u0111\u1ed3ng gi\u00fap t\u0103ng c\u01b0\u1eddng hi\u1ec7u su\u1ea5t d\u1eabn nhi\u1ec7t, \u0111\u1ea3m b\u1ea3o qu\u00e1 tr\u00ecnh l\u00e0m l\u1ea1nh di\u1ec5n ra nhanh ch\u00f3ng v\u00e0 hi\u1ec7u qu\u1ea3. Nh\u00f4m m\u1ea1 v\u00e0ng \u1edf l\u00e1 t\u1ea3n nhi\u1ec7t kh\u00f4ng ch\u1ec9 t\u0103ng c\u01b0\u1eddng kh\u1ea3 n\u0103ng ch\u1ed1ng \u0103n m\u00f2n, k\u00e9o d\u00e0i tu\u1ed5i th\u1ecd m\u00e0 c\u00f2n gi\u00fap m\u00e1y l\u1ea1nh ho\u1ea1t \u0111\u1ed9ng \u1ed5n \u0111\u1ecbnh trong m\u1ecdi \u0111i\u1ec1u ki\u1ec7n th\u1eddi ti\u1ebft. \u0110i\u1ec1u h\u00f2a Midea Inverter 9.500 BTU (1 HP) MSAGA-10CRDN8 v\u1edbi kh\u1ea3 n\u0103ng l\u00e0m l\u1ea1nh t\u1ed1t M\u00e1y l\u1ea1nh Midea MSAGA-10CRDN8 l\u00e0 l\u1ef1a ch\u1ecdn l\u00fd t\u01b0\u1edfng cho c\u00e1c kh\u00f4ng gian nh\u1ecf. V\u1edbi c\u00f4ng su\u1ea5t 9.500 BTU , s\u1ea3n ph\u1ea9m mang l\u1ea1i kh\u1ea3 n\u0103ng l\u00e0m l\u1ea1nh nhanh ch\u00f3ng v\u00e0 \u0111\u1ed3ng \u0111\u1ec1u kh\u1eafp ph\u00f2ng, t\u1ea1o ra m\u00f4i tr\u01b0\u1eddng m\u00e1t m\u1ebb v\u00e0 tho\u1ea3i m\u00e1i cho ng\u01b0\u1eddi s\u1eed d\u1ee5ng. V\u1edbi ph\u1ea1m vi l\u00e0m l\u1ea1nh d\u01b0\u1edbi 15m\u00b2 , \u0111i\u1ec1u h\u00f2a ph\u00f9 h\u1ee3p v\u1edbi c\u00e1c kh\u00f4ng gian nh\u01b0 ph\u00f2ng ng\u1ee7, ph\u00f2ng l\u00e0m vi\u1ec7c, ph\u00f2ng kh\u00e1ch nh\u1ecf, ho\u1eb7c c\u00e1c khu v\u1ef1c sinh ho\u1ea1t c\u00e1 nh\u00e2n. C\u00f4ng ngh\u1ec7 Inverter ti\u00ean ti\u1ebfn gi\u00fap \u0111i\u1ec1u h\u00f2a ho\u1ea1t \u0111\u1ed9ng \u00eam \u00e1i, ti\u1ebft ki\u1ec7m \u0111i\u1ec7n n\u0103ng v\u00e0 duy tr\u00ec nhi\u1ec7t \u0111\u1ed9 \u1ed5n \u0111\u1ecbnh, gi\u1ea3m thi\u1ec3u chi ph\u00ed \u0111i\u1ec7n h\u00e0ng th\u00e1ng. B\u00ean c\u1ea1nh \u0111\u00f3, m\u00e1y l\u1ea1nh Midea Inverter 9.500 BTU MSAGA-10CRDN8 n\u1ed5i b\u1eadt v\u1edbi m\u1ee9c ti\u00eau th\u1ee5 \u0111i\u1ec7n n\u0103ng ch\u1ec9 0.75 kW/h . M\u1ee9c ti\u00eau th\u1ee5 \u0111i\u1ec7n n\u00e0y \u0111\u1ea3m b\u1ea3o r\u1eb1ng \u0111i\u1ec1u h\u00f2a ho\u1ea1t \u0111\u1ed9ng hi\u1ec7u qu\u1ea3 nh\u01b0ng v\u1eabn ti\u1ebft ki\u1ec7m chi ph\u00ed. \u0110\u00e2y l\u00e0 l\u1ef1a ch\u1ecdn ho\u00e0n h\u1ea3o cho nh\u1eefng ai mong mu\u1ed1n s\u1edf h\u1eefu m\u1ed9t thi\u1ebft b\u1ecb l\u00e0m l\u1ea1nh ti\u1ebft ki\u1ec7m \u0111i\u1ec7n n\u0103ng. M\u00e1y l\u1ea1nh Midea Inverter 9.500 BTU (1 HP) MSAGA-10CRDN8 trang b\u1ecb nhi\u1ec1u c\u00f4ng ngh\u1ec7 ti\u00ean ti\u1ebfn \u0110i\u1ec1u h\u00f2a Midea MSAGA-10CRDN8 \u0111\u01b0\u1ee3c trang b\u1ecb c\u00f4ng ngh\u1ec7 l\u00e0m l\u1ea1nh nhanh Boos t. C\u00f4ng ngh\u1ec7 n\u00e0y ho\u1ea1t \u0111\u1ed9ng b\u1eb1ng c\u00e1ch t\u0103ng c\u01b0\u1eddng t\u1ed1c \u0111\u1ed9 ho\u1ea1t \u0111\u1ed9ng c\u1ee7a m\u00e1y n\u00e9n, gi\u00fap lu\u1ed3ng kh\u00f4ng kh\u00ed l\u1ea1nh \u0111\u01b0\u1ee3c ph\u00e2n ph\u1ed1i \u0111\u1ec1u kh\u1eafp ph\u00f2ng m\u1ed9t c\u00e1ch nhanh ch\u00f3ng. C\u00f4ng ngh\u1ec7 Boost c\u0169ng gi\u00fap \u0111i\u1ec1u h\u00f2a \u0111\u1ea1t \u0111\u01b0\u1ee3c nhi\u1ec7t \u0111\u1ed9 mong mu\u1ed1n trong th\u1eddi gian ng\u1eafn, t\u1ea1o ra kh\u00f4ng gian m\u00e1t m\u1ebb v\u00e0 d\u1ec5 ch\u1ecbu ngay l\u1eadp t\u1ee9c. \u0110i\u1ec1u n\u00e0y \u0111\u1eb7c bi\u1ec7t h\u1eefu \u00edch trong nh\u1eefng ng\u00e0y n\u1eafng n\u00f3ng, khi b\u1ea1n c\u1ea7n l\u00e0m m\u00e1t kh\u00f4ng gian m\u1ed9t c\u00e1ch t\u1ee9c th\u00ec. V\u1edbi s\u1ef1 k\u1ebft h\u1ee3p c\u1ee7a c\u00f4ng ngh\u1ec7 Inverter Quattro ti\u00ean ti\u1ebfn, \u0111i\u1ec1u h\u00f2a kh\u00f4ng ch\u1ec9 ti\u1ebft ki\u1ec7m \u0111i\u1ec7n n\u0103ng m\u00e0 c\u00f2n \u0111\u1ea3m b\u1ea3o hi\u1ec7u su\u1ea5t l\u00e0m l\u1ea1nh t\u1ed1i \u01b0u. C\u00f4ng ngh\u1ec7 n\u00e0y ho\u1ea1t \u0111\u1ed9ng b\u1eb1ng c\u00e1ch \u0111i\u1ec1u ch\u1ec9nh t\u1ed1c \u0111\u1ed9 quay c\u1ee7a m\u00e1y n\u00e9n, gi\u00fap duy tr\u00ec nhi\u1ec7t \u0111\u1ed9 \u1ed5n \u0111\u1ecbnh trong ph\u00f2ng m\u00e0 kh\u00f4ng c\u1ea7n ph\u1ea3i t\u1eaft/m\u1edf li\u00ean t\u1ee5c nh\u01b0 c\u00e1c lo\u1ea1i \u0111i\u1ec1u h\u00f2a th\u00f4ng th\u01b0\u1eddng. T\u1eeb \u0111\u00f3 l\u00e0m gi\u1ea3m hao m\u00f2n linh ki\u1ec7n, k\u00e9o d\u00e0i tu\u1ed5i th\u1ecd v\u00e0 ti\u1ebft ki\u1ec7m \u0111i\u1ec7n n\u0103ng l\u00ean \u0111\u1ebfn 50% so v\u1edbi c\u00e1c d\u00f2ng m\u00e1y kh\u00f4ng c\u00f3 c\u00f4ng ngh\u1ec7 Inverter. C\u00f4ng ngh\u1ec7 Inverter Quattro c\u00f2n gi\u00fap \u0111i\u1ec1u h\u00f2a ho\u1ea1t \u0111\u1ed9ng \u00eam \u00e1i, h\u1ea1n ch\u1ebf ti\u1ebfng \u1ed3n, t\u1ea1o kh\u00f4ng gian y\u00ean t\u0129nh v\u00e0 tho\u1ea3i m\u00e1i cho gi\u1ea5c ng\u1ee7 v\u00e0 sinh ho\u1ea1t h\u00e0ng ng\u00e0y. C\u00f4ng ngh\u1ec7 n\u00e0y kh\u00f4ng ch\u1ec9 gi\u00fap b\u1ea1n t\u1eadn h\u01b0\u1edfng kh\u00f4ng gian m\u00e1t m\u1ebb, tho\u1ea3i m\u00e1i m\u00e0 c\u00f2n l\u00e0 gi\u1ea3i ph\u00e1p ti\u1ebft ki\u1ec7m n\u0103ng l\u01b0\u1ee3ng hi\u1ec7u qu\u1ea3, b\u1ea3o v\u1ec7 m\u00f4i tr\u01b0\u1eddng v\u00e0 n\u00e2ng cao ch\u1ea5t l\u01b0\u1ee3ng cu\u1ed9c s\u1ed1ng. C\u00e1c t\u00ednh n\u0103ng n\u1ed5i b\u1eadt c\u1ee7a \u0111i\u1ec1u h\u00f2a Midea Inverter 9.500 BTU (1 HP) MSAGA-10CRDN8 \u0110i\u1ec1u h\u00f2a Midea MSAGA-10CRDN8 \u0111\u01b0\u1ee3c trang b\u1ecb nhi\u1ec1u t\u00ednh n\u0103ng th\u00f4ng minh nh\u01b0 m\u00e0n h\u00ecnh hi\u1ec3n th\u1ecb nhi\u1ec7t \u0111\u1ed9 tr\u00ean d\u00e0n l\u1ea1nh, ch\u1ebf \u0111\u1ed9 Avoid Me (Breeze Away) Follow Me, ch\u1ebf \u0111\u1ed9 h\u00fat \u1ea9m v\u00e0 ch\u1ee9c n\u0103ng t\u1ef1 l\u00e0m s\u1ea1ch. L\u1ef1a ch\u1ecdn s\u1ea3n ph\u1ea9m n\u00e0y \u0111\u1ec3 t\u1eadn h\u01b0\u1edfng cu\u1ed9c s\u1ed1ng ti\u1ec7n nghi v\u00e0 hi\u1ec7n \u0111\u1ea1i. M\u00e0n h\u00ecnh hi\u1ec3n th\u1ecb nhi\u1ec7t \u0111\u1ed9 tr\u1ef1c quan tr\u00ean d\u00e0n l\u1ea1nh \u0110i\u1ec1u h\u00f2a Midea MSAGA-10CRDN8 trang b\u1ecb m\u00e0n h\u00ecnh hi\u1ec3n th\u1ecb nhi\u1ec7t \u0111\u1ed9 tr\u1ef1c quan tr\u00ean d\u00e0n l\u1ea1nh gi\u00fap ng\u01b0\u1eddi d\u00f9ng d\u1ec5 d\u00e0ng theo d\u00f5i v\u00e0 \u0111i\u1ec1u ch\u1ec9nh nhi\u1ec7t \u0111\u1ed9 ph\u00f2ng theo \u00fd mu\u1ed1n. V\u1edbi m\u00e0n h\u00ecnh n\u00e0y, ng\u01b0\u1eddi d\u00f9ng c\u00f3 th\u1ec3 d\u1ec5 d\u00e0ng bi\u1ebft \u0111\u01b0\u1ee3c nhi\u1ec7t \u0111\u1ed9 hi\u1ec7n t\u1ea1i trong ph\u00f2ng v\u00e0 \u0111i\u1ec1u ch\u1ec9nh sao cho ph\u00f9 h\u1ee3p. \u0110i k\u00e8m v\u1edbi \u0111\u00f3 l\u00e0 \u0111i\u1ec1u khi\u1ec3n t\u1eeb xa c\u00f3 \u0111\u00e8n LED gi\u00fap ng\u01b0\u1eddi d\u00f9ng d\u1ec5 d\u00e0ng \u0111i\u1ec1u khi\u1ec3n c\u00e1c t\u00ednh n\u0103ng ngay c\u1ea3 trong \u0111i\u1ec1u ki\u1ec7n \u00e1nh s\u00e1ng y\u1ebfu. T\u00ednh n\u0103ng kh\u00f3a \u0111i\u1ec1u khi\u1ec3n c\u0169ng gi\u00fap ng\u0103n ch\u1eb7n tr\u1ebb em ho\u1eb7c ng\u01b0\u1eddi kh\u00e1c v\u00f4 t\u00ecnh thay \u0111\u1ed5i c\u00e0i \u0111\u1eb7t c\u1ee7a m\u00e1y, b\u1ea3o v\u1ec7 c\u00e0i \u0111\u1eb7t nhi\u1ec7t \u0111\u1ed9 mong mu\u1ed1n. T\u00ednh n\u0103ng Follow Me v\u00e0 Avoid Me T\u00ednh n\u0103ng Follow Me cho ph\u00e9p m\u00e1y l\u1ea1nh Midea Inverter 9.500 BTU (1 HP) MSAGA-10CRDN8 c\u1ea3m bi\u1ebfn nhi\u1ec7t \u0111\u1ed9 t\u1ea1i v\u1ecb tr\u00ed c\u1ee7a \u0111i\u1ec1u khi\u1ec3n, t\u1eeb \u0111\u00f3 \u0111i\u1ec1u ch\u1ec9nh nhi\u1ec7t \u0111\u1ed9 sao cho ph\u00f9 h\u1ee3p v\u1edbi khu v\u1ef1c ng\u01b0\u1eddi d\u00f9ng \u0111ang ng\u1ed3i ho\u1eb7c n\u1eb1m. V\u1edbi t\u00ednh n\u0103ng n\u00e0y, \u0111i\u1ec1u khi\u1ec3n tr\u1edf th\u00e0nh trung t\u00e2m c\u1ea3m bi\u1ebfn nhi\u1ec7t \u0111\u1ed9, gi\u00fap \u0111i\u1ec1u h\u00f2a ho\u1ea1t \u0111\u1ed9ng ch\u00ednh x\u00e1c v\u00e0 ti\u1ebft ki\u1ec7m n\u0103ng l\u01b0\u1ee3ng h\u01a1n. Ch\u1ebf \u0111\u1ed9 Avoid Me (Breeze Away) l\u00e0 ch\u1ebf \u0111\u1ed9 \u0111i\u1ec1u ch\u1ec9nh h\u01b0\u1edbng gi\u00f3 \u0111\u1ec3 tr\u00e1nh th\u1ed5i tr\u1ef1c ti\u1ebfp v\u00e0o ng\u01b0\u1eddi, mang l\u1ea1i c\u1ea3m gi\u00e1c d\u1ec5 ch\u1ecbu m\u00e0 v\u1eabn \u0111\u1ea3m b\u1ea3o hi\u1ec7u qu\u1ea3 l\u00e0m l\u1ea1nh. Ch\u1ebf \u0111\u1ed9 n\u00e0y r\u1ea5t h\u1eefu \u00edch cho nh\u1eefng ai nh\u1ea1y c\u1ea3m v\u1edbi lu\u1ed3ng gi\u00f3 l\u1ea1nh tr\u1ef1c ti\u1ebfp, \u0111\u1eb7c bi\u1ec7t l\u00e0 tr\u1ebb nh\u1ecf v\u00e0 ng\u01b0\u1eddi l\u1edbn tu\u1ed5i. B\u1eb1ng c\u00e1ch ph\u00e2n ph\u1ed1i gi\u00f3 m\u1ed9t c\u00e1ch h\u1ee3p l\u00fd, Avoid Me gi\u00fap duy tr\u00ec nhi\u1ec7t \u0111\u1ed9 m\u00e1t m\u1ebb m\u00e0 kh\u00f4ng g\u00e2y kh\u00f3 ch\u1ecbu cho ng\u01b0\u1eddi s\u1eed d\u1ee5ng. B\u1ea3o v\u1ec7 s\u1ee9c kh\u1ecfe ng\u01b0\u1eddi d\u00f9ng v\u1edbi t\u00ednh n\u0103ng t\u1ef1 l\u00e0m s\u1ea1ch v\u00e0 h\u00fat \u1ea9m Ch\u1ee9c n\u0103ng t\u1ef1 l\u00e0m s\u1ea1ch c\u1ee7a \u0111i\u1ec1u h\u00f2a Midea Inverter 9.500 BTU (1 HP) MSAGA-10CRDN8 c\u00f3 c\u00f4ng d\u1ee5ng gi\u00fap lo\u1ea1i b\u1ecf b\u1ee5i b\u1ea9n v\u00e0 vi khu\u1ea9n t\u00edch t\u1ee5 b\u00ean trong d\u00e0n l\u1ea1nh, duy tr\u00ec kh\u00f4ng kh\u00ed trong l\u00e0nh v\u00e0 b\u1ea3o v\u1ec7 s\u1ee9c kh\u1ecfe cho gia \u0111\u00ecnh. Qu\u00e1 tr\u00ecnh t\u1ef1 l\u00e0m s\u1ea1ch di\u1ec5n ra t\u1ef1 \u0111\u1ed9ng, ti\u1ebft ki\u1ec7m th\u1eddi gian v\u00e0 c\u00f4ng s\u1ee9c b\u1ea3o d\u01b0\u1ee1ng. Ch\u1ee9c n\u0103ng n\u00e0y kh\u00f4ng ch\u1ec9 gi\u00fap t\u0103ng hi\u1ec7u su\u1ea5t l\u00e0m l\u1ea1nh m\u00e0 c\u00f2n k\u00e9o d\u00e0i tu\u1ed5i th\u1ecd c\u1ee7a m\u00e1y, gi\u1ea3m thi\u1ec3u s\u1ef1 c\u1ed1 v\u00e0 chi ph\u00ed s\u1eeda ch\u1eefa. M\u00e1y l\u1ea1nh c\u00f2n trang b\u1ecb t\u00ednh n\u0103ng h\u00fat \u1ea9m gi\u00fap lo\u1ea1i b\u1ecf \u0111\u1ed9 \u1ea9m d\u01b0 th\u1eeba trong kh\u00f4ng kh\u00ed, mang l\u1ea1i c\u1ea3m gi\u00e1c kh\u00f4 tho\u00e1ng v\u00e0 d\u1ec5 ch\u1ecbu. T\u00ednh n\u0103ng n\u00e0y \u0111\u1eb7c bi\u1ec7t h\u1eefu \u00edch trong nh\u1eefng ng\u00e0y m\u01b0a ho\u1eb7c th\u1eddi ti\u1ebft \u1ea9m \u01b0\u1edbt. H\u00fat \u1ea9m kh\u00f4ng ch\u1ec9 b\u1ea3o v\u1ec7 s\u1ee9c kh\u1ecfe b\u1eb1ng c\u00e1ch ng\u0103n ng\u1eeba n\u1ea5m m\u1ed1c v\u00e0 vi khu\u1ea9n ph\u00e1t tri\u1ec3n m\u00e0 c\u00f2n gi\u00fap b\u1ea3o v\u1ec7 n\u1ed9i th\u1ea5t v\u00e0 c\u00e1c thi\u1ebft b\u1ecb \u0111i\u1ec7n t\u1eed trong nh\u00e0. Ch\u1ebf \u0111\u1ed9 Fan Only ch\u1ec9 l\u00e0m m\u00e1t, kh\u00f4ng l\u00e0m l\u1ea1nh Tr\u00ean m\u00e1y l\u1ea1nh Midea Inverter 9.500 BTU (1 HP) MSAGA-10CRDN8 c\u00f2n c\u00f3 ch\u1ebf \u0111\u1ed9 Fan Only , ngh\u0129a l\u00e0 ch\u1ec9 s\u1eed d\u1ee5ng qu\u1ea1t m\u00e0 kh\u00f4ng k\u00edch ho\u1ea1t ch\u1ee9c n\u0103ng l\u00e0m l\u1ea1nh. Ch\u1ebf \u0111\u1ed9 n\u00e0y gi\u00fap l\u01b0u th\u00f4ng kh\u00f4ng kh\u00ed trong ph\u00f2ng, t\u1ea1o c\u1ea3m gi\u00e1c tho\u00e1ng \u0111\u00e3ng m\u00e0 kh\u00f4ng l\u00e0m gi\u1ea3m nhi\u1ec7t \u0111\u1ed9. Fan Only r\u1ea5t h\u1eefu \u00edch trong nh\u1eefng ng\u00e0y kh\u00f4ng qu\u00e1 n\u00f3ng, khi b\u1ea1n ch\u1ec9 c\u1ea7n m\u1ed9t lu\u1ed3ng gi\u00f3 m\u00e1t \u0111\u1ec3 c\u1ea3m th\u1ea5y d\u1ec5 ch\u1ecbu. Ch\u1ebf \u0111\u1ed9 n\u00e0y ti\u1ebft ki\u1ec7m \u0111i\u1ec7n n\u0103ng h\u01a1n so v\u1edbi ch\u1ebf \u0111\u1ed9 l\u00e0m l\u1ea1nh, \u0111\u1ed3ng th\u1eddi gi\u1ea3m \u0111\u1ed9 \u1ea9m trong kh\u00f4ng kh\u00ed, mang l\u1ea1i c\u1ea3m gi\u00e1c kh\u00f4 r\u00e1o v\u00e0 tho\u1ea3i m\u00e1i. H\u1eb9n gi\u1edd b\u1eadt t\u1eaft m\u00e1y ti\u1ec7n l\u1ee3i tr\u00ean \u0111i\u1ec1u h\u00f2a Midea Inverter 9.500 BTU (1 HP) MSAGA-10CRDN8 H\u1eb9n gi\u1edd b\u1eadt t\u1eaft m\u00e1y l\u00e0 t\u00ednh n\u0103ng cho ph\u00e9p b\u1ea1n l\u1eadp l\u1ecbch ho\u1ea1t \u0111\u1ed9ng cho \u0111i\u1ec1u h\u00f2a theo nhu c\u1ea7u s\u1eed d\u1ee5ng. B\u1ea1n c\u00f3 th\u1ec3 b\u1eadt \u0111i\u1ec1u h\u00f2a tr\u01b0\u1edbc khi v\u1ec1 nh\u00e0 ho\u1eb7c t\u1eaft khi \u0111i ng\u1ee7. T\u00ednh n\u0103ng n\u00e0y gi\u00fap ti\u1ebft ki\u1ec7m n\u0103ng l\u01b0\u1ee3ng m\u00e0 v\u1eabn \u0111\u1ea3m b\u1ea3o kh\u00f4ng gian m\u00e1t m\u1ebb, tho\u1ea3i m\u00e1i. H\u1eb9n gi\u1edd c\u0169ng b\u1ea3o v\u1ec7 m\u00e1y l\u1ea1nh, k\u00e9o d\u00e0i tu\u1ed5i th\u1ecd v\u00e0 gi\u1ea3m hao m\u00f2n do ho\u1ea1t \u0111\u1ed9ng li\u00ean t\u1ee5c. M\u00e1y l\u1ea1nh Midea Inverter 9.500 BTU (1 HP) MSAGA-10CRDN8 c\u00f3 gi\u00e1 bao nhi\u00eau? Gi\u00e1 c\u1ee7a \u0111i\u1ec1u h\u00f2a Midea MSAGA-10CRDN8 kh\u00e1 th\u1ea5p so v\u1edbi c\u00e1c s\u1ea3n ph\u1ea9m c\u00f9ng ph\u00e2n kh\u00fac. Hi\u1ec7n \u0111i\u1ec1u h\u00f2a \u0111ang \u0111\u01b0\u1ee3c b\u00e1n t\u1ea1i c\u00e1c chi nh\u00e1nh c\u1ee7a Ho\u00e0ng H\u00e0 Mobile tr\u00ean to\u00e0n qu\u1ed1c. Gi\u00e1 b\u00e1n c\u00f3 th\u1ec3 thay \u0111\u1ed5i t\u1ea1i th\u1eddi \u0111i\u1ec3m mua h\u00e0ng n\u00ean h\u00e3y li\u00ean h\u1ec7 v\u1edbi ch\u00fang t\u00f4i \u0111\u1ec3 bi\u1ebft gi\u00e1 ch\u00ednh x\u00e1c v\u00e0 c\u00e1c \u01b0u \u0111\u00e3i hi\u1ec7n c\u00f3. Mua \u0111i\u1ec1u h\u00f2a Midea Inverter 9.500 BTU (1 HP) MSAGA-10CRDN8 ch\u00ednh h\u00e3ng gi\u00e1 r\u1ebb t\u1ea1i Ho\u00e0ng H\u00e0 Mobile M\u00e1y l\u1ea1nh Midea Inverter 9.500 BTU MSAGA-10CRDN8 kh\u00f4ng ch\u1ec9 n\u1ed5i b\u1eadt v\u1edbi c\u00f4ng ngh\u1ec7 l\u00e0m l\u1ea1nh nhanh Boost v\u00e0 c\u00f4ng ngh\u1ec7 ti\u1ebft ki\u1ec7m \u0111i\u1ec7n Inverter Quattro, m\u00e0 c\u00f2n \u0111\u01b0\u1ee3c trang b\u1ecb nhi\u1ec1u t\u00ednh n\u0103ng th\u00f4ng minh nh\u01b0 Follow Me, ch\u1ebf \u0111\u1ed9 h\u00fat \u1ea9m, v\u00e0 ch\u1ee9c n\u0103ng t\u1ef1 l\u00e0m s\u1ea1ch. V\u1edbi thi\u1ebft k\u1ebf nh\u1ecf g\u1ecdn, hi\u1ec7n \u0111\u1ea1i v\u00e0 kh\u1ea3 n\u0103ng v\u1eadn h\u00e0nh \u00eam \u00e1i, s\u1ea3n ph\u1ea9m n\u00e0y mang l\u1ea1i kh\u00f4ng gian s\u1ed1ng tho\u1ea3i m\u00e1i, m\u00e1t m\u1ebb v\u00e0 ti\u1ebft ki\u1ec7m n\u0103ng l\u01b0\u1ee3ng. Mua \u0111i\u1ec1u h\u00f2a t\u1ea1i Ho\u00e0ng H\u00e0 Mobile , qu\u00fd kh\u00e1ch s\u1ebd \u0111\u01b0\u1ee3c s\u1edf h\u1eefu s\u1ea3n ph\u1ea9m ch\u00ednh h\u00e3ng v\u1edbi gi\u00e1 c\u1ef1c t\u1ed1t. Ngo\u00e0i ra, Ho\u00e0ng H\u00e0 Mobile c\u0169ng c\u00f3 r\u1ea5t nhi\u1ec1u c\u00e1c ch\u01b0\u01a1ng tr\u00ecnh \u01b0u \u0111\u00e3i d\u00e0nh cho kh\u00e1ch h\u00e0ng nh\u01b0 h\u1ed7 tr\u1ee3 tr\u1ea3 g\u00f3p v\u00e0 mi\u1ec5n ph\u00ed v\u1eadn chuy\u1ec3n to\u00e0n qu\u1ed1c. Xem to\u00e0n b\u1ed9 b\u00e0i vi\u1ebft",
        "promotion_1": "1. Tr\u00fang 8386 qu\u00e0 - T\u1ed5ng gi\u00e1 tr\u1ecb t\u1edbi 250 TRI\u1ec6U \u0110\u1ed2NG (\u00c1p d\u1ee5ng t\u1eeb 10/01 - 02/02/2025). (Xem chi ti\u1ebft). 2. \u0110\u1eb7c bi\u1ec7t Tr\u1ea3 g\u00f3p 3 kh\u00f4ng: 0% l\u00e3i su\u1ea5t - 0 ph\u00ed chuy\u1ec3n \u0111\u1ed5i - 0 tr\u1ea3 tr\u01b0\u1edbc (\u00c1p d\u1ee5ng cho c\u00f4ng ty t\u00e0i ch\u00ednh v\u00e0 th\u1ebb t\u00edn d\u1ee5ng)",
        "promotion_2": "1. Gi\u1ea3m t\u1edbi 500.000\u0111 khi thanh to\u00e1n th\u1ebb t\u00edn d\u1ee5ng NCB. (Xem chi ti\u1ebft). 2. Gi\u1ea3m \u0111\u1ebfn 150.000\u0111 khi thanh to\u00e1n qua Muadee. (Xem chi ti\u1ebft). 3. Mi\u1ec5n ph\u00ed chuy\u1ec3n \u0111\u1ed5i tr\u1ea3 g\u00f3p ho\u1eb7c gi\u1ea3m \u0111\u1ebfn 500.000\u0111 khi m\u1edf th\u1ebb TPBank EVO. (Xem chi ti\u1ebft). 4. M\u1edf th\u1ebb t\u00edn d\u1ee5ng VIB - Nh\u1eadn Voucher 600.000\u0111. (Xem chi ti\u1ebft). 5. M\u1edf th\u1ebb HSBC - Ho\u00e0n ti\u1ec1n t\u1edbi 2 tri\u1ec7u \u0111\u1ed3ng. (Xem chi ti\u1ebft)"
    },
    {
        "title": "\u0110i\u1ec1u h\u00f2a Midea Inverter 12.000 BTU (1.5 HP) MSAFA-13CRDN8",
        "price": "gi\u00e1 hi\u1ec7n t\u1ea1i l\u00e0 7,390,000 \u20ab nh\u01b0ng tr\u01b0\u1edbc \u0111\u00e2y n\u00f3 c\u00f3 gi\u00e1 l\u00e0 9,790,000 \u20ab",
        "colors": "Tr\u1eafng",
        "technical_specifications": [
            {
                "Lo\u1ea1i m\u00e1y": "1 chi\u1ec1u (ch\u1ec9 l\u00e0m l\u1ea1nh)"
            },
            {
                "C\u00f4ng ngh\u1ec7 inverter": "M\u00e1y l\u1ea1nh Inverter"
            },
            {
                "C\u00f4ng su\u1ea5t l\u00e0m l\u1ea1nh": "1.5 HP - 12.000 BTU"
            },
            {
                "Ph\u1ea1m vi l\u00e0m l\u1ea1nh hi\u1ec7u qu\u1ea3": "T\u1eeb 15 - 20m\u00b2 (t\u1eeb 40 \u0111\u1ebfn 60 m\u00b3)"
            },
            {
                "Nh\u00e3n n\u0103ng l\u01b0\u1ee3ng": "5 sao (Hi\u1ec7u su\u1ea5t n\u0103ng l\u01b0\u1ee3ng 4.50 )"
            }
        ],
        "description": "M\u00e1y l\u1ea1nh Midea Inverter 1.5 HP MSAFA-13CRDN8 l\u00e0 s\u1ea3n ph\u1ea9m \u0111i\u1ec1u h\u00f2a 1 chi\u1ec1u th\u1ebf h\u1ec7 m\u1edbi c\u1ee7a th\u01b0\u01a1ng hi\u1ec7u Midea. S\u1ea3n ph\u1ea9m s\u1edf h\u1eefu phong c\u00e1ch thi\u1ebft k\u1ebf thanh l\u1ecbch, ph\u00f9 h\u1ee3p v\u1edbi nhi\u1ec1u kh\u00f4ng gian n\u1ed9i th\u1ea5t. C\u00f4ng ngh\u1ec7 Quattro Inverters \u0111\u1ea3m b\u1ea3o qu\u00e1 tr\u00ecnh v\u1eadn h\u00e0nh b\u1ec1n b\u1ec9 v\u00e0 \u00eam \u00e1i, \u0111\u1ed3ng th\u1eddi ti\u1ebft ki\u1ec7m \u0111i\u1ec7n n\u0103ng m\u1ed9t c\u00e1ch hi\u1ec7u qu\u1ea3. B\u1ed9 l\u1ecdc k\u00e9p HD k\u1ebft h\u1ee3p c\u00f9ng b\u1ed9 t\u1ea1o Ionizer gi\u00fap lo\u1ea1i b\u1ecf b\u1ee5i b\u1ea9n v\u00e0 thanh l\u1ecdc kh\u00f4ng kh\u00ed. C\u00f4ng ngh\u1ec7 t\u1ef1 l\u00e0m s\u1ea1ch d\u00e0n l\u1ea1nh Self Cleaning gi\u00fap ng\u0103n ch\u1eb7n s\u1ef1 h\u00ecnh th\u00e0nh v\u00e0 ph\u00e1t tri\u1ec3n c\u1ee7a c\u00e1c lo\u1ea1i n\u1ea5m m\u1ed1c, vi khu\u1ea9n g\u00e2y h\u1ea1i. V\u1edbi nh\u1eefng \u01b0u \u0111i\u1ec3m tuy\u1ec7t v\u1eddi n\u00e0y, chi\u1ebfc m\u00e1y l\u1ea1nh Inverter Midea MSAFA-13CRDN8 s\u1ebd l\u00e0 s\u1ef1 l\u1ef1a ch\u1ecdn t\u1ed1i \u01b0u, mang \u0111\u1ebfn cho gia \u0111\u00ecnh b\u1ea1n m\u1ed9t kh\u00f4ng gian s\u1ed1ng ti\u1ec7n nghi v\u00e0 an to\u00e0n cho s\u1ee9c kh\u1ecfe. \u0110\u1eb7c \u0111i\u1ec3m n\u1ed5i b\u1eadt: Ki\u1ec3u d\u00e1ng hi\u1ec7n \u0111\u1ea1i v\u00e0 tinh t\u1ebf, ph\u00f9 h\u1ee3p v\u1edbi kh\u00f4ng gian t\u1eeb 15 - 20m\u00b2 v\u1edbi c\u00f4ng su\u1ea5t l\u00e0m l\u1ea1nh 1.5 HP. V\u1eadn h\u00e0nh \u00eam \u00e1i, gi\u1ea3m hao ph\u00ed \u0111i\u1ec7n n\u0103ng nh\u1edd c\u00f4ng ngh\u1ec7 Quattro Inverter. L\u00e0m m\u00e1t nhanh ch\u00f3ng, ti\u1ebft ki\u1ec7m th\u1eddi gian v\u1edbi ch\u1ebf \u0111\u1ed9 l\u00e0m l\u1ea1nh Turbo. B\u1ed9 l\u1ecdc k\u00e9p HD c\u00f3 kh\u1ea3 n\u0103ng lo\u1ea1i b\u1ecf b\u1ee5i b\u1ea9n v\u00e0 c\u00e1c t\u00e1c nh\u00e2n g\u00e2y d\u1ecb \u1ee9ng c\u00f3 trong kh\u00f4ng kh\u00ed, mang l\u1ea1i m\u1ed9t kh\u00f4ng gian trong l\u00e0nh, an to\u00e0n cho s\u1ee9c kh\u1ecfe. D\u00e0n t\u1ea3n nhi\u1ec7t m\u1ea1 v\u00e0ng Golden Fin gi\u00fap ch\u1ed1ng l\u1ea1i nh\u1eefng t\u00e1c nh\u00e2n t\u1eeb m\u00f4i tr\u01b0\u1eddng b\u00ean ngo\u00e0i nh\u01b0 kh\u00ed h\u1eadu, \u0111i\u1ec1u ki\u1ec7n th\u1eddi ti\u1ebft kh\u1eafc nghi\u1ec7t\u2026 T\u00edch h\u1ee3p nhi\u1ec1u t\u00ednh n\u0103ng ti\u1ec7n \u00edch: Ch\u1ebf \u0111\u1ed9 Sleep, ch\u1ebf \u0111\u1ed9 Follow Me, t\u00ednh n\u0103ng h\u1eb9n gi\u1edd, t\u00ednh n\u0103ng h\u00fat \u1ea9m, t\u00ednh n\u0103ng t\u1ef1 \u0111\u1ed9ng l\u00e0m s\u1ea1ch Self Cleaning\u2026 B\u1ea3ng th\u00f4ng s\u1ed1 k\u1ef9 thu\u1eadt c\u1ee7a \u0111i\u1ec1u h\u00f2a Midea Inverter 1.5 HP MSAFA-13CRDN8 Th\u00f4ng s\u1ed1 Chi ti\u1ebft Lo\u1ea1i m\u00e1y 1 chi\u1ec1u (ch\u1ec9 l\u00e0m l\u1ea1nh) C\u00f4ng su\u1ea5t l\u00e0m l\u1ea1nh 1.5 HP - 12.000 BTU Ph\u1ea1m vi l\u00e0m l\u1ea1nh hi\u1ec7u qu\u1ea3 T\u1eeb 15 - 20m\u00b2 (t\u1eeb 40 \u0111\u1ebfn 60m\u00b3) K\u00edch th\u01b0\u1edbc v\u00e0 tr\u1ecdng l\u01b0\u1ee3ng d\u00e0n l\u1ea1nh D\u00e0i 81 cm - Cao 28.5 cm - D\u00e0y 21 cm - N\u1eb7ng 8.2 kg K\u00edch th\u01b0\u1edbc v\u00e0 tr\u1ecdng l\u01b0\u1ee3ng d\u00e0n n\u00f3ng D\u00e0i 80 cm - Cao 49.5 cm - D\u00e0y 26 cm - N\u1eb7ng 21.7 kg \u0110\u1ed9 \u1ed3n trung b\u00ecnh 32.5 / 48 dB Lo\u1ea1i gas R-32 Ch\u1ea5t li\u1ec7u d\u00e0n t\u1ea3n nhi\u1ec7t \u1ed0ng d\u1eabn gas b\u1eb1ng \u0111\u1ed3ng L\u00e1 t\u1ea3n nhi\u1ec7t b\u1eb1ng nh\u00f4m m\u1ea1 v\u00e0ng Ti\u00eau th\u1ee5 \u0111i\u1ec7n 1.15 kW/h C\u00f4ng ngh\u1ec7 ti\u1ebft ki\u1ec7m \u0111i\u1ec7n Inverter Kh\u1ea3 n\u0103ng l\u1ecdc b\u1ee5i, kh\u00e1ng khu\u1ea9n, kh\u1eed m\u00f9i B\u1ed9 l\u1ecdc k\u00e9p HD Ch\u1ebf \u0111\u1ed9 gi\u00f3 \u0110i\u1ec1u khi\u1ec3n l\u00ean xu\u1ed1ng t\u1ef1 \u0111\u1ed9ng, tr\u00e1i ph\u1ea3i t\u00f9y ch\u1ec9nh tay C\u00f4ng ngh\u1ec7 l\u00e0m l\u1ea1nh nhanh Turbo Ti\u1ec7n \u00edch C\u1ea3nh b\u00e1o r\u00f2 r\u1ec9 gas \u1ed0ng tho\u00e1t n\u01b0\u1edbc 2 chi\u1ec1u ti\u1ec7n l\u1ee3i trong l\u1eafp \u0111\u1eb7t Ch\u1ebf \u0111\u1ed9 ch\u1ec9 s\u1eed d\u1ee5ng qu\u1ea1t - kh\u00f4ng l\u00e0m l\u1ea1nh Ch\u1ee9c n\u0103ng h\u00fat \u1ea9m H\u1eb9n gi\u1edd b\u1eadt t\u1eaft m\u00e1y L\u00e0m l\u1ea1nh nhanh t\u1ee9c th\u00ec T\u1ef1 \u0111\u1ed9ng l\u00e0m s\u1ea1ch Self Cleaning T\u00ednh n\u0103ng Follow Me T\u00ednh n\u0103ng Favourite Cool D\u00f2ng \u0111i\u1ec7n v\u00e0o D\u00e0n l\u1ea1nh D\u00f2ng \u0111i\u1ec7n ho\u1ea1t \u0111\u1ed9ng 1 pha S\u1ed1 l\u01b0\u1ee3ng k\u1ebft n\u1ed1i d\u00e0n l\u1ea1nh t\u1ed1i \u0111a 1 \u0110\u00e1nh gi\u00e1 chi ti\u1ebft s\u1ea3n ph\u1ea9m m\u00e1y l\u1ea1nh Midea Inverter 1.5 HP MSAFA-13CRDN8 M\u00e1y l\u1ea1nh Midea Inverter MSAFA-13CRDN8 hi\u1ec7n \u0111ang l\u00e0 d\u00f2ng s\u1ea3n ph\u1ea9m \u201c\u0103n kh\u00e1ch\u201d nh\u1ea5t tr\u00ean th\u1ecb tr\u01b0\u1eddng \u0111\u1ebfn t\u1eeb th\u01b0\u01a1ng hi\u1ec7u Midea \u0111\u00ecnh \u0111\u00e1m. M\u1eb7c d\u00f9 l\u00e0 phi\u00ean b\u1ea3n m\u1edbi nh\u1ea5t, s\u1edf h\u1eefu thi\u1ebft k\u1ebf \u0111\u1eb9p m\u1eaft c\u00f9ng nhi\u1ec1u t\u00ednh n\u0103ng ti\u00ean ti\u1ebfn, th\u1ebf nh\u01b0ng s\u1ea3n ph\u1ea9m l\u1ea1i c\u00f3 m\u1ee9c gi\u00e1 v\u00f4 c\u00f9ng ph\u1ea3i ch\u0103ng, ph\u00f9 h\u1ee3p v\u1edbi thu nh\u1eadp c\u1ee7a m\u1ecdi gia \u0111\u00ecnh. \u0110i\u1ec1u h\u00f2a Midea Inverter 1.5 HP MSAFA-13CRDN8 s\u1edf h\u1eefu v\u1ebb ngo\u00e0i \u0111\u01a1n gi\u1ea3n, tinh t\u1ebf Chi\u1ebfc \u0111i\u1ec1u h\u00f2a Midea MSAFA-13CRDN8 \u0111\u01b0\u1ee3c ho\u00e0n thi\u1ec7n v\u1edbi nh\u1eefng \u0111\u01b0\u1eddng n\u00e9t \u0111\u01a1n gi\u1ea3n, m\u1ea1nh m\u1ebd nh\u01b0ng c\u0169ng kh\u00f4ng k\u00e9m ph\u1ea7n tinh t\u1ebf v\u1edbi t\u00f4ng m\u00e0u tr\u1eafng nh\u1eb9 nh\u00e0ng. Tr\u00ean b\u1ec1 m\u1eb7t d\u00e0n l\u1ea1nh \u0111\u01b0\u1ee3c trang b\u1ecb m\u00e0n h\u00ecnh hi\u1ec3n th\u1ecb nhi\u1ec7t \u0111\u1ed9, thu\u1eadn ti\u1ec7n cho ng\u01b0\u1eddi d\u00f9ng quan s\u00e1t v\u00e0 t\u00f9y ch\u1ec9nh. V\u1edbi c\u00f4ng su\u1ea5t l\u00e0m m\u00e1t 1.5 HP t\u01b0\u01a1ng \u0111\u01b0\u01a1ng 12.000 BTU, s\u1ea3n ph\u1ea9m s\u1ebd l\u00e0 l\u1ef1a ch\u1ecdn t\u1ed1i \u01b0u cho nh\u1eefng kh\u00f4ng gian c\u00f3 di\u1ec7n t\u00edch t\u1eeb 15 - 20m\u00b2 nh\u01b0 ph\u00f2ng ng\u1ee7, ph\u00f2ng l\u00e0m vi\u1ec7c nh\u1ecf\u2026 \u0110\u1eb7c bi\u1ec7t h\u01a1n, chi\u1ebfc remote c\u1ea7m tay \u0111i k\u00e8m c\u0169ng \u0111\u01b0\u1ee3c trang b\u1ecb \u0111\u00e8n m\u00e0n h\u00ecnh, gi\u00fap ng\u01b0\u1eddi d\u00f9ng d\u1ec5 d\u00e0ng quan s\u00e1t \u0111\u01b0\u1ee3c c\u00e1c th\u00f4ng s\u1ed1 tr\u00ean m\u00e0n h\u00ecnh v\u00e0 thao t\u00e1c v\u1edbi remote m\u1ed9t c\u00e1ch ch\u00ednh x\u00e1c v\u00e0o ban \u0111\u00eam hay trong m\u00f4i tr\u01b0\u1eddng c\u00f3 \u00e1nh s\u00e1ng y\u1ebfu. V\u1eadn h\u00e0nh \u00eam \u00e1i, gi\u1ea3m hao ph\u00ed \u0111i\u1ec7n n\u0103ng v\u1edbi c\u00f4ng ngh\u1ec7 Quattro Inverter \u0110i\u1ec1u h\u00f2a Midea Inverter 1.5 HP MSAFA-13CRDN8 \u0111\u01b0\u1ee3c t\u00edch h\u1ee3p c\u00f4ng ngh\u1ec7 Inverter Quattro bi\u1ebfn t\u1ea7n. \u0110\u00e2y l\u00e0 c\u00f4ng ngh\u1ec7 bi\u1ebfn t\u1ea7n hi\u1ec7n \u0111\u1ea1i nh\u1ea5t hi\u1ec7n nay, mang l\u1ea1i hi\u1ec7u qu\u1ea3 ti\u1ebft ki\u1ec7m \u0111i\u1ec7n v\u01b0\u1ee3t tr\u1ed9i h\u01a1n r\u1ea5t nhi\u1ec1u so v\u1edbi nh\u1eefng d\u00f2ng m\u00e1y l\u1ea1nh\u00a0 kh\u00f4ng s\u1eed d\u1ee5ng c\u00f4ng ngh\u1ec7 Inverter. C\u1ee5 th\u1ec3, c\u00f4ng ngh\u1ec7 t\u0103ng t\u1ed1c t\u1ea7n s\u1ed1 cao c\u1ee7a Quattro Inverter cho ph\u00e9p \u0111\u1ed9ng c\u01a1 m\u00e1y n\u00e9n \u0111\u1ea1t c\u00f4ng su\u1ea5t t\u1ed1i \u0111a ngay khi kh\u1edfi \u0111\u1ed9ng, mang l\u1ea1i s\u1ef1 m\u00e1t m\u1ebb v\u00e0 d\u1ec5 ch\u1ecbu cho kh\u00f4ng gian ngay t\u1ee9c th\u00ec. Kh\u00f4ng nh\u1eefng v\u1eady, b\u1ed9 vi x\u1eed l\u00fd ti\u00ean ti\u1ebfn s\u1ebd v\u1eadn h\u00e0nh m\u00e1y n\u00e9n ho\u1ea1t \u0111\u1ed9ng li\u00ean t\u1ee5c \u1edf t\u1ed1c \u0111\u1ed9 c\u1ef1c th\u1ea5p 12Hz, gi\u00fap ti\u1ebft ki\u1ec7m \u0111i\u1ec7n n\u0103ng t\u1ed1i \u0111a, \u0111\u1ed3ng th\u1eddi gi\u1ea3m ti\u1ebfng \u1ed3n l\u00ean \u0111\u1ebfn 16 l\u1ea7n. \u0110i\u00ea\u0300u \u0111a\u0301ng chu\u0301 y\u0301 nh\u00e2\u0301t ch\u00ednh la\u0300 kha\u0309 n\u0103ng duy tri\u0300 nhi\u00ea\u0323t \u0111\u00f4\u0323 pho\u0300ng v\u00f4 c\u00f9ng \u00f4\u0309n \u0111i\u0323nh. M\u1ee9c nhi\u1ec7t \u0111\u01b0\u1ee3c c\u00e0i \u0111\u1eb7t s\u1eb5n tr\u00ean remote s\u1ebd lu\u00f4n \u0111\u01b0\u1ee3c duy tr\u00ec, \u0111\u1ea3m b\u1ea3o ng\u01b0\u1eddi d\u00f9ng kh\u00f4ng ca\u0309m th\u00e2\u0301y qua\u0301 no\u0301ng hay qua\u0301 la\u0323nh. Thanh l\u1ecdc kh\u00f4ng kh\u00ed v\u1edbi m\u00e1y l\u1ea1nh Midea Inverter 1.5 HP MSAFA-13CRDN8 M\u00e1y l\u1ea1nh Midea MSAFA-13CRDN8 \u0111\u01b0\u1ee3c trang b\u1ecb b\u1ed9 l\u1ecdc k\u00e9p HD, c\u00f3 kh\u1ea3 n\u0103ng lo\u1ea1i b\u1ecf tri\u1ec7t \u0111\u1ec3 c\u00e1c lo\u1ea1i b\u1ee5i b\u1ea9n v\u00e0 vi khu\u1ea9n g\u00e2y h\u1ea1i, mang \u0111\u1ebfn b\u1ea7u kh\u00f4ng kh\u00ed trong l\u00e0nh v\u00e0 s\u1ea1ch s\u1ebd, \u0111\u1ea3m b\u1ea3o an to\u00e0n cho s\u1ee9c kh\u1ecfe c\u1ee7a ng\u01b0\u1eddi d\u00f9ng. C\u1ee5 th\u1ec3, b\u1ed9 l\u1ecdc Pre Filter s\u1ebd gi\u1eef l\u1ea1i c\u00e1c lo\u1ea1i h\u1ea1t th\u00f4 trong kh\u00f4ng kh\u00ed nh\u01b0 b\u1ee5i, n\u1ea5m, ve, l\u00f4ng th\u00fa c\u01b0ng\u2026 Ti\u1ebfp \u0111\u1ebfn, kh\u00f4ng kh\u00ed s\u1ebd \u0111i qua b\u1ed9 l\u1ecdc Micro Protection Filter (b\u1ed9 l\u1ecdc vi m\u00f4) v\u00e0 lo\u1ea1i b\u1ecf nh\u1eefng th\u00e0nh ph\u1ea7n \u0111\u1ed9c h\u1ea1i \u1edf c\u1ea5p \u0111\u1ed9 vi m\u00f4 nh\u01b0 c\u00e1c lo\u1ea1i vi khu\u1ea9n, ph\u1ea5n hoa, kh\u00ed th\u1ea3i xe c\u1ed9, kh\u00f3i thu\u1ed1c, b\u1ee5i m\u1ecbn PM0.3, \u2026 Kh\u00f4ng nh\u1eefng v\u1eady, b\u1ed9 t\u1ea1o Ionizer \u0111\u01b0\u1ee3c trang b\u1ecb tr\u00ean m\u00e1y l\u1ea1nh Midea MSAFA-13CRDN8 c\u00f2n c\u00f3 kh\u1ea3 n\u0103ng t\u1ea1o ra h\u00e0ng tri\u1ec7u ion \u00e2m trong su\u1ed1t qu\u00e1 tr\u00ecnh ho\u1ea1t \u0111\u1ed9ng, gi\u00fap trung h\u00f2a t\u1ea5t c\u1ea3 c\u00e1c y\u1ebfu t\u1ed1 g\u00e2y h\u1ea1i c\u00f3 trong kh\u00f4ng kh\u00ed. T\u1eeb \u0111\u00f3, nh\u1eefng ion t\u00edch \u0111i\u1ec7n \u00e2m s\u1ebd thu h\u00fat c\u00e1c lo\u1ea1i vi khu\u1ea9n, b\u1ee5i b\u1ea9n, b\u00e0o t\u1eed n\u1ea5m m\u1ed1c, virus\u2026 v\u00e0 v\u00f4 hi\u1ec7u h\u00f3a ch\u00fang, tr\u1ea3 l\u1ea1i cho ng\u01b0\u1eddi d\u00f9ng m\u1ed9t b\u1ea7u kh\u00f4ng kh\u00ed t\u01b0\u01a1i m\u1edbi, s\u1ea1ch s\u1ebd v\u00e0 trong l\u00e0nh. Ch\u1ebf \u0111\u1ed9 Turbo l\u00e0m m\u00e1t nhanh ch\u00f3ng, ti\u1ebft ki\u1ec7m th\u1eddi gian \u0110a s\u1ed1 c\u00e1c s\u1ea3n ph\u1ea9m \u0111i\u1ec1u h\u00f2a c\u1ee7a th\u01b0\u01a1ng hi\u1ec7u Midea \u0111\u1ec1u \u0111\u01b0\u1ee3c t\u00edch h\u1ee3p ch\u1ebf \u0111\u1ed9 l\u00e0m l\u1ea1nh nhanh Turbo, v\u00e0 \u0111i\u1ec1u h\u00f2a Midea Inverter 1.5 HP MSAFA-13CRDN8 c\u0169ng v\u1eady. Khi k\u00edch ho\u1ea1t ch\u1ebf \u0111\u1ed9 Turbo, m\u00e1y n\u00e9n c\u1ee7a thi\u1ebft b\u1ecb s\u1ebd ho\u1ea1t \u0111\u1ed9ng v\u1edbi c\u00f4ng su\u1ea5t t\u1ed1i \u0111a, gi\u00fap nhi\u1ec7t \u0111\u1ed9 ph\u00f2ng gi\u1ea3m xu\u1ed1ng m\u1ed9t c\u00e1ch nhanh ch\u00f3ng trong v\u00f2ng 20-30 ph\u00fat. \u0110i\u1ec1u n\u00e0y \u0111\u1eb7c bi\u1ec7t h\u1eefu \u00edch trong nh\u1eefng ng\u00e0y h\u00e8 n\u00f3ng b\u1ee9c, khi ng\u01b0\u1eddi d\u00f9ng mu\u1ed1n nhanh ch\u00f3ng t\u1eadn h\u01b0\u1edfng kh\u00f4ng gian m\u00e1t m\u1ebb m\u00e0 kh\u00f4ng ph\u1ea3i ch\u1edd \u0111\u1ee3i qu\u00e1 l\u00e2u. \u0110i\u1ec1u h\u00f2a Midea Inverter 1.5 HP MSAFA-13CRDN8 c\u00f3 kh\u1ea3 n\u0103ng t\u1ef1 l\u00e0m s\u1ea1ch d\u00e0n l\u1ea1nh \u0110i\u1ec1u h\u00f2a Midea MSAFA-13CRDN8 \u0111\u01b0\u1ee3c trang b\u1ecb c\u00f4ng ngh\u1ec7 Self Cleaning c\u00f3 kh\u1ea3 n\u0103ng t\u1ef1 \u0111\u1ed9ng l\u00e0m s\u1ea1ch d\u00e0n l\u1ea1nh. C\u00f4ng ngh\u1ec7 n\u00e0y ho\u1ea1t \u0111\u1ed9ng v\u1edbi c\u01a1 ch\u1ebf t\u1ef1 \u0111\u1ed9ng \u0111\u00f3ng b\u0103ng, sau \u0111\u00f3 l\u00e0m tan b\u0103ng \u0111\u1ec3 cu\u1ed1n tr\u00f4i c\u00e1c lo\u1ea1i b\u1ee5i b\u1ea9n, n\u1ea5m m\u1ed1c v\u00e0 d\u1ea7u m\u1ee1 c\u00f3 th\u1ec3 g\u00e2y m\u00f9i t\u00edch t\u1ee5 l\u00e2u ng\u00e0y tr\u00ean b\u1ed9 trao \u0111\u1ed5i nhi\u1ec7t. Sau khi ho\u00e0n th\u00e0nh qu\u00e1 tr\u00ecnh r\u1eeda tr\u00f4i, b\u00e1nh xe gi\u00f3 b\u00ean trong s\u1ebd ti\u1ebfp t\u1ee5c ho\u1ea1t \u0111\u1ed9ng \u0111\u1ec3 lo\u1ea1i b\u1ecf h\u01a1i \u1ea9m v\u00e0 l\u00e0m kh\u00f4 d\u00e0n l\u1ea1nh, ng\u0103n ch\u1eb7n s\u1ef1 ph\u00e1t tri\u1ec3n c\u1ee7a vi khu\u1ea9n, n\u1ea5m m\u1ed1c v\u00e0 \u0111\u1ea3m b\u1ea3o kh\u00f4ng gian b\u00ean trong lu\u00f4n s\u1ea1ch s\u1ebd. T\u0103ng c\u01b0\u1eddng \u0111\u1ed9 b\u1ec1n cho m\u00e1y v\u1edbi d\u00e0n t\u1ea3n nhi\u1ec7t b\u1eb1ng nh\u00f4m m\u1ea1 v\u00e0ng M\u1ed9t trong nh\u1eefng \u0111i\u1ec3m nh\u1ea5n c\u1ee7a chi\u1ebfc m\u00e1y l\u1ea1nh Midea Inverter 1.5 HP MSAFA-13CRDN8 ch\u00ednh l\u00e0 d\u00e0n t\u1ea3n nhi\u1ec7t b\u1eb1ng nh\u00f4m \u0111\u01b0\u1ee3c bao ph\u1ee7 m\u1ed9t l\u1edbp b\u1ea3o v\u1ec7 ch\u1ed1ng \u0103n m\u00f2n Golden Fin. L\u1edbp ph\u1ee7 n\u00e0y c\u00f3 kh\u1ea3 n\u0103ng b\u1ea3o v\u1ec7 thi\u1ebft b\u1ecb tr\u01b0\u1edbc nh\u1eefng t\u00e1c \u0111\u1ed9ng t\u1eeb m\u00f4i tr\u01b0\u1eddng b\u00ean ngo\u00e0i nh\u01b0 axit, h\u01a1i n\u01b0\u1edbc,..., t\u1eeb \u0111\u00f3 g\u00f3p ph\u1ea7n gia t\u0103ng \u0111\u1ed9 b\u1ec1n v\u00e0 k\u00e9o d\u00e0i tu\u1ed5i th\u1ecd cho thi\u1ebft b\u1ecb. \u0110\u1ea3m b\u1ea3o an to\u00e0n v\u1edbi c\u01a1 ch\u1ebf c\u1ea3nh b\u00e1o r\u00f2 r\u1ec9 gas Nh\u1edd c\u01a1 ch\u1ebf c\u1ea3nh b\u00e1o n\u00e0y, \u0111i\u1ec1u h\u00f2a Midea Inverter 1.5 HP MSAFA-13CRDN8 s\u1ebd t\u1ef1 \u0111\u1ed9ng ng\u1eaft \u0111i\u1ec7n khi ph\u00e1t hi\u1ec7n kh\u00ed gas b\u1ecb r\u00f2 r\u1ec9 ra b\u00ean ngo\u00e0i trong tr\u01b0\u1eddng h\u1ee3p m\u00e1y n\u00e9n ho\u1ea1t \u0111\u1ed9ng qu\u00e1 t\u1ea3i. \u0110i\u1ec1u n\u00e0y gi\u00fap \u0111\u1ea3m b\u1ea3o an to\u00e0n cho ng\u01b0\u1eddi d\u00f9ng trong qu\u00e1 tr\u00ecnh s\u1eed d\u1ee5ng, k\u1ecbp th\u1eddi x\u1eed l\u00fd c\u00e1c t\u00ecnh hu\u1ed1ng kh\u1ea9n c\u1ea5p v\u00e0 ph\u00f2ng tr\u00e1nh \u0111\u01b0\u1ee3c nh\u1eefng s\u1ef1 c\u1ed1 kh\u00f4ng mong mu\u1ed1n. M\u1ed9t s\u1ed1 t\u00ednh n\u0103ng ti\u1ec7n \u00edch c\u1ee7a m\u00e1y l\u1ea1nh Midea Inverter 1.5 HP MSAFA-13CRDN8 T\u00ednh n\u0103ng h\u00fat \u1ea9m : T\u00ednh n\u0103ng h\u00fat \u1ea9m c\u00f3 t\u00e1c d\u1ee5ng c\u00e2n b\u1eb1ng \u0111\u1ed9 \u1ea9m trong kh\u00f4ng kh\u00ed, mang l\u1ea1i kh\u00f4ng gian tho\u00e1ng \u0111\u00e3ng, kh\u00f4 r\u00e1o. T\u00ednh n\u0103ng n\u00e0y th\u01b0\u1eddng \u0111\u01b0\u1ee3c s\u1eed d\u1ee5ng trong nh\u1eefng ng\u00e0y th\u1eddi ti\u1ebft \u1ea9m \u01b0\u1edbt hay khi \u0111\u1ed9 \u1ea9m trong kh\u00f4ng kh\u00ed t\u0103ng cao, kh\u00f4ng n\u00ean s\u1eed d\u1ee5ng trong nh\u1eefng ng\u00e0y n\u1eafng n\u00f3ng. T\u00ednh n\u0103ng h\u1eb9n gi\u1edd : V\u1edbi t\u00ednh n\u0103ng h\u1eb9n gi\u1edd, ng\u01b0\u1eddi d\u00f9ng s\u1ebd c\u00f3 \u0111\u01b0\u1ee3c gi\u1ea5c ng\u1ee7 s\u00e2u v\u00e0 tr\u1ecdn v\u1eb9n m\u00e0 kh\u00f4ng ph\u1ea3i th\u1ee9c gi\u1ea5c gi\u1eefa ch\u1eebng \u0111\u1ec3 t\u1eaft m\u00e1y. Ch\u1ebf \u0111\u1ed9 Fan Only : V\u1edbi ch\u1ebf \u0111\u1ed9 n\u00e0y, ng\u01b0\u1eddi d\u00f9ng c\u00f3 th\u1ec3 s\u1eed d\u1ee5ng \u0111i\u1ec1u h\u00f2a Midea MSAFA-13CRDN8 nh\u01b0 m\u1ed9t chi\u1ebfc qu\u1ea1t th\u00f4ng th\u01b0\u1eddng v\u00e0o nh\u1eefng ng\u00e0y th\u1eddi ti\u1ebft m\u00e1t m\u1ebb hay khi kh\u00f4ng c\u1ea7n l\u00e0m l\u1ea1nh. Ch\u1ebf \u0111\u1ed9 Follow Me : T\u00ednh n\u0103ng n\u00e0y cho ph\u00e9p ng\u01b0\u1eddi d\u00f9ng \u0111i\u1ec1u ch\u1ec9nh h\u01b0\u1edbng gi\u00f3 t\u1ef1 \u0111\u1ed9ng theo remote. Ng\u01b0\u1eddi d\u00f9ng ch\u1ec9 c\u1ea7n c\u1ea7m remote, t\u00ednh n\u0103ng n\u00e0y s\u1ebd nh\u1eadn bi\u1ebft v\u00e0 \u0111i\u1ec1u ch\u1ec9nh h\u01b0\u1edbng gi\u00f3 t\u1ef1 \u0111\u1ed9ng th\u1ed5i theo h\u01b0\u1edbng c\u1ee7a ng\u01b0\u1eddi d\u00f9ng \u0111ang ng\u1ed3i. Ch\u1ebf \u0111\u1ed9 Favourite Cool : V\u1edbi ch\u1ebf \u0111\u1ed9 Favorite Cool, thi\u1ebft b\u1ecb s\u1ebd ghi nh\u1edb ch\u1ebf \u0111\u1ed9 l\u00e0m l\u1ea1nh \u0111\u00e3 \u0111\u01b0\u1ee3c ng\u01b0\u1eddi d\u00f9ng c\u00e0i \u0111\u1eb7t s\u1eb5n. Trong nh\u1eefng l\u1ea7n s\u1eed d\u1ee5ng ti\u1ebfp theo, ng\u01b0\u1eddi d\u00f9ng ch\u1ec9 c\u1ea7n k\u00edch ho\u1ea1t ch\u1ebf \u0111\u1ed9 n\u00e0y \u0111\u1ec3 thi\u1ebft b\u1ecb t\u1ef1 \u0111\u1ed9ng l\u00e0m l\u1ea1nh theo ch\u1ebf \u0111\u1ed9 y\u00eau th\u00edch c\u1ee7a m\u00ecnh m\u00e0 kh\u00f4ng c\u1ea7n t\u1ed1n th\u1eddi gian \u0111\u1ec3 c\u00e0i \u0111\u1eb7t l\u1ea1i. M\u00e1y l\u1ea1nh Midea Inverter 1.5 HP MSAFA-13CRDN8 c\u00f3 gi\u00e1 bao nhi\u00eau? Hi\u1ec7n t\u1ea1i, s\u1ea3n ph\u1ea9m m\u00e1y l\u1ea1nh Midea MSAFA-13CRDN8 \u0111ang \u0111\u01b0\u1ee3c ph\u00e2n ph\u1ed1i ch\u00ednh h\u00e3ng t\u1ea1i h\u1ec7 th\u1ed1ng Ho\u00e0ng H\u00e0 Mobile tr\u00ean to\u00e0n qu\u1ed1c v\u1edbi m\u1ee9c gi\u00e1 si\u00eau h\u1ea5p d\u1eabn, t\u1eb7ng k\u00e8m nhi\u1ec1u ph\u1ea7n qu\u00e0 c\u00f3 gi\u00e1 tr\u1ecb khi mua h\u00e0ng. Qu\u00fd kh\u00e1ch h\u00e0ng xin l\u01b0u \u00fd, gi\u00e1 b\u00e1n c\u1ee7a s\u1ea3n ph\u1ea9m t\u1ea1i th\u1eddi \u0111i\u1ec3m mua h\u00e0ng s\u1ebd c\u00f3 s\u1ef1 thay \u0111\u1ed5i d\u1ef1a v\u00e0o m\u1ed9t v\u00e0i y\u1ebfu t\u1ed1. N\u1ebfu c\u00f3 nhu c\u1ea7u s\u1edf h\u1eefu s\u1ea3n ph\u1ea9m n\u00e0y, qu\u00fd kh\u00e1ch h\u00e0ng c\u00f3 th\u1ec3 \u0111\u1eb7t mua qua website tr\u1ef1c tuy\u1ebfn hoanghamobile \u0111\u1ec3 nh\u1eadn \u01b0u \u0111\u00e3i mi\u1ec5n ph\u00ed v\u1eadn chuy\u1ec3n ho\u1eb7c gh\u00e9 ngay c\u00e1c chi nh\u00e1nh Ho\u00e0ng H\u00e0 Mobile tr\u00ean to\u00e0n qu\u1ed1c \u0111\u1ec3 \u0111\u01b0\u1ee3c t\u01b0 v\u1ea5n m\u1ed9t c\u00e1ch t\u1eadn t\u00ecnh nh\u1ea5t. S\u1edf h\u1eefu s\u1ea3n ph\u1ea9m \u0111i\u1ec1u h\u00f2a Midea Inverter 1.5 HP MSAFA-13CRDN8 ch\u00ednh h\u00e3ng t\u1ea1i Ho\u00e0ng H\u00e0 Mobile Tr\u1ea3i qua nhi\u1ec1u n\u0103m ho\u1ea1t \u0111\u1ed9ng, Ho\u00e0ng H\u00e0 Mobile \u0111\u00e3 kh\u1eb3ng \u0111\u1ecbnh \u0111\u01b0\u1ee3c t\u00ean tu\u1ed5i c\u1ee7a m\u00ecnh tr\u00ean th\u1ecb tr\u01b0\u1eddng Vi\u1ec7t Nam v\u00e0 tr\u1edf th\u00e0nh \u0111i\u1ec3m \u0111\u1ebfn quen thu\u1ed9c c\u1ee7a c\u00e1c t\u00edn \u0111\u1ed3 c\u00f4ng ngh\u1ec7. \u0110\u1ebfn v\u1edbi ch\u00fang t\u00f4i, qu\u00fd kh\u00e1ch h\u00e0ng s\u1ebd lu\u00f4n c\u1ea3m th\u1ea5y h\u00e0i l\u00f2ng khi \u0111\u01b0\u1ee3c tr\u1ea3i nghi\u1ec7m nh\u1eefng s\u1ea3n ph\u1ea9m ch\u00ednh h\u00e3ng, \u0111\u1ea3m b\u1ea3o ch\u1ea5t l\u01b0\u1ee3ng v\u1edbi gi\u00e1 th\u00e0nh c\u1ea1nh tranh. V\u1edbi nh\u1eefng \u01b0u \u0111i\u1ec3m v\u01b0\u1ee3t tr\u1ed9i trong t\u1ea7m gi\u00e1, s\u1ea3n ph\u1ea9m \u0111i\u1ec1u h\u00f2a Midea Inverter 1.5 HP MSAFA-13CRDN8 ch\u1eafc ch\u1eafn s\u1ebd l\u00e0 m\u1ed9t thi\u1ebft b\u1ecb kh\u00f4ng th\u1ec3 thi\u1ebfu trong m\u1ed7i gia \u0111\u00ecnh. \u0110\u1eebng ch\u1ea7n ch\u1eeb g\u00ec n\u1eefa, h\u00e3y \u0111\u1ebfn ngay Ho\u00e0ng H\u00e0 Mobile \u0111\u1ec3 tr\u1ea3i nghi\u1ec7m v\u00e0 s\u1edf h\u1eefu chi\u1ebfc \u0111i\u1ec1u h\u00f2a \u0111a n\u0103ng n\u00e0y nh\u00e9! Xem to\u00e0n b\u1ed9 b\u00e0i vi\u1ebft",
        "promotion_1": "1. Tr\u00fang 8386 qu\u00e0 - T\u1ed5ng gi\u00e1 tr\u1ecb t\u1edbi 250 TRI\u1ec6U \u0110\u1ed2NG (\u00c1p d\u1ee5ng t\u1eeb 10/01 - 02/02/2025). (Xem chi ti\u1ebft). 2. \u0110\u1eb7c bi\u1ec7t Tr\u1ea3 g\u00f3p 3 kh\u00f4ng: 0% l\u00e3i su\u1ea5t - 0 ph\u00ed chuy\u1ec3n \u0111\u1ed5i - 0 tr\u1ea3 tr\u01b0\u1edbc (\u00c1p d\u1ee5ng cho c\u00f4ng ty t\u00e0i ch\u00ednh v\u00e0 th\u1ebb t\u00edn d\u1ee5ng)",
        "promotion_2": "1. Gi\u1ea3m t\u1edbi 500.000\u0111 khi thanh to\u00e1n th\u1ebb t\u00edn d\u1ee5ng NCB. (Xem chi ti\u1ebft). 2. Gi\u1ea3m \u0111\u1ebfn 150.000\u0111 khi thanh to\u00e1n qua Muadee. (Xem chi ti\u1ebft). 3. Mi\u1ec5n ph\u00ed chuy\u1ec3n \u0111\u1ed5i tr\u1ea3 g\u00f3p ho\u1eb7c gi\u1ea3m \u0111\u1ebfn 500.000\u0111 khi m\u1edf th\u1ebb TPBank EVO. (Xem chi ti\u1ebft). 4. M\u1edf th\u1ebb t\u00edn d\u1ee5ng VIB - Nh\u1eadn Voucher 600.000\u0111. (Xem chi ti\u1ebft). 5. M\u1edf th\u1ebb HSBC - Ho\u00e0n ti\u1ec1n t\u1edbi 2 tri\u1ec7u \u0111\u1ed3ng. (Xem chi ti\u1ebft)"
    },
    {
        "title": "\u0110i\u1ec1u h\u00f2a Midea Inverter 12.000 BTU (1.5 HP) MSAGA-13CRDN8",
        "price": "gi\u00e1 hi\u1ec7n t\u1ea1i l\u00e0 7,020,000 \u20ab nh\u01b0ng tr\u01b0\u1edbc \u0111\u00e2y n\u00f3 c\u00f3 gi\u00e1 l\u00e0 8,390,000 \u20ab",
        "colors": "Tr\u1eafng",
        "technical_specifications": [
            {
                "Lo\u1ea1i m\u00e1y": "1 chi\u1ec1u (ch\u1ec9 l\u00e0m l\u1ea1nh)"
            },
            {
                "C\u00f4ng ngh\u1ec7 inverter": "M\u00e1y l\u1ea1nh Inverter"
            },
            {
                "C\u00f4ng su\u1ea5t l\u00e0m l\u1ea1nh": "1.5 HP - 12.000 BTU"
            },
            {
                "Ph\u1ea1m vi l\u00e0m l\u1ea1nh hi\u1ec7u qu\u1ea3": "T\u1eeb 15 - 20m\u00b2 (t\u1eeb 40 \u0111\u1ebfn 60 m\u00b3)"
            },
            {
                "Nh\u00e3n n\u0103ng l\u01b0\u1ee3ng": "5 sao (Hi\u1ec7u su\u1ea5t n\u0103ng l\u01b0\u1ee3ng 4.87)"
            }
        ],
        "description": "\u0110i\u1ec1u h\u00f2a Midea Inverter 1.5 HP MSAGA-13CRDN8 l\u00e0 m\u1ed9t thi\u1ebft b\u1ecb l\u00e0m m\u00e1t hi\u1ec7n \u0111\u1ea1i v\u1edbi nhi\u1ec1u th\u00f4ng s\u1ed1 k\u1ef9 thu\u1eadt \u1ea5n t\u01b0\u1ee3ng. M\u00e1y c\u00f3 c\u00f4ng su\u1ea5t 1.5 HP , ph\u00f9 h\u1ee3p v\u1edbi c\u00e1c kh\u00f4ng gian c\u00f3 di\u1ec7n t\u00edch t\u1eeb 15 \u0111\u1ebfn 20m2 . V\u1edbi c\u00f4ng ngh\u1ec7 Inverter Quattro , s\u1ea3n ph\u1ea9m kh\u00f4ng ch\u1ec9 l\u00e0m l\u1ea1nh nhanh v\u00e0 m\u1ea1nh m\u1ebd m\u00e0 c\u00f2n r\u1ea5t ti\u1ebft ki\u1ec7m n\u0103ng l\u01b0\u1ee3ng. M\u00e1y c\u00f2n \u0111\u01b0\u1ee3c trang b\u1ecb h\u1ec7 th\u1ed1ng l\u1ecdc kh\u00f4ng kh\u00ed Dual Filtration , gi\u00fap lo\u1ea1i b\u1ecf c\u00e1c h\u1ea1t b\u1ee5i m\u1ecbn v\u00e0 c\u00e1c t\u00e1c nh\u00e2n g\u00e2y d\u1ecb \u1ee9ng, b\u1ea3o v\u1ec7 s\u1ee9c kh\u1ecfe ng\u01b0\u1eddi d\u00f9ng. B\u00ean c\u1ea1nh \u0111\u00f3, t\u00ednh n\u0103ng h\u1eb9n gi\u1edd b\u1eadt t\u1eaft v\u00e0 ch\u1ee9c n\u0103ng t\u1ef1 l\u00e0m s\u1ea1ch t\u1ef1 \u0111\u1ed9ng mang l\u1ea1i s\u1ef1 ti\u1ec7n l\u1ee3i v\u00e0 d\u1ec5 d\u00e0ng trong qu\u00e1 tr\u00ecnh s\u1eed d\u1ee5ng. \u0110\u1eb7c \u0111i\u1ec3m n\u1ed5i b\u1eadt: C\u00f4ng ngh\u1ec7 Inverter Quattro ti\u1ebft ki\u1ec7m n\u0103ng l\u01b0\u1ee3ng hi\u1ec7u qu\u1ea3 v\u1edbi kh\u1ea3 n\u0103ng \u0111i\u1ec1u ch\u1ec9nh c\u00f4ng su\u1ea5t linh ho\u1ea1t theo nhu c\u1ea7u s\u1eed d\u1ee5ng. Ch\u1ebf \u0111\u1ed9 l\u00e0m l\u1ea1nh nhanh Boost gi\u00fap l\u00e0m l\u1ea1nh kh\u00f4ng gian nhanh ch\u00f3ng, mang l\u1ea1i kh\u00f4ng kh\u00ed m\u00e1t m\u1ebb t\u1ee9c th\u00ec. H\u1ec7 th\u1ed1ng l\u1ecdc Dual Filtration lo\u1ea1i b\u1ecf b\u1ee5i b\u1ea9n v\u00e0 vi khu\u1ea9n hi\u1ec7u qu\u1ea3, c\u1ea3i thi\u1ec7n ch\u1ea5t l\u01b0\u1ee3ng kh\u00f4ng kh\u00ed trong ph\u00f2ng. Ch\u1ee9c n\u0103ng h\u1eb9n gi\u1edd b\u1eadt/t\u1eaft t\u1ed1i \u01b0u h\u00f3a vi\u1ec7c s\u1eed d\u1ee5ng \u0111i\u1ec1u h\u00f2a, gi\u00fap ti\u1ebft ki\u1ec7m \u0111i\u1ec7n v\u00e0 ph\u00f9 h\u1ee3p v\u1edbi l\u1ecbch tr\u00ecnh c\u1ee7a ng\u01b0\u1eddi d\u00f9ng. C\u1ea3m bi\u1ebfn nhi\u1ec7t \u0111\u1ed9 \"Follow me\" \u0111i\u1ec1u ch\u1ec9nh h\u01b0\u1edbng v\u00e0 c\u01b0\u1eddng \u0111\u1ed9 gi\u00f3 d\u1ef1a tr\u00ean v\u1ecb tr\u00ed c\u1ee7a remote, \u0111\u1ea3m b\u1ea3o kh\u00f4ng kh\u00ed m\u00e1t \u0111\u1ec1u xung quanh. B\u1ea3ng th\u00f4ng s\u1ed1 k\u1ef9 thu\u1eadt c\u1ee7a m\u00e1y l\u1ea1nh Midea Inverter 1.5 HP MSAGA-13CRDN8 \u0110\u1ec3 hi\u1ec3u r\u00f5 h\u01a1n v\u1ec1 s\u1ea3n ph\u1ea9m n\u00e0y, h\u00e3y c\u00f9ng theo d\u00f5i b\u1ea3ng th\u00f4ng s\u1ed1 k\u1ef9 thu\u1eadt chi ti\u1ebft sau \u0111\u00e2y. S\u1ea3n ph\u1ea9m \u0111i\u1ec1u h\u00f2a n\u00e0y \u0111\u1ebfn t\u1eeb Midea s\u1edf h\u1eefu lo\u1ea1t th\u00f4ng s\u1ed1 \u1ea5n t\u01b0\u1ee3ng trong t\u1ea7m gi\u00e1. Ti\u00eau ch\u00ed Th\u00f4ng s\u1ed1 Lo\u1ea1i m\u00e1y 1 chi\u1ec1u (ch\u1ec9 l\u00e0m l\u1ea1nh) C\u00f4ng ngh\u1ec7 inverter M\u00e1y l\u1ea1nh Inverter C\u00f4ng su\u1ea5t l\u00e0m l\u1ea1nh 1.5 HP - 12.000 BTU Ph\u1ea1m vi l\u00e0m l\u1ea1nh hi\u1ec7u qu\u1ea3 T\u1eeb 15 - 20m2 (t\u1eeb 40 \u0111\u1ebfn 60 m3) \u0110\u1ed9 \u1ed3n trung b\u00ecnh 40/36/34 dB K\u00edch th\u01b0\u1edbc - Kh\u1ed1i l\u01b0\u1ee3ng d\u00e0n l\u1ea1nh D\u00e0i 83.5 cm - Cao 29.5 cm - D\u00e0y 20.8 cm - N\u1eb7ng 9 kg K\u00edch th\u01b0\u1edbc - Kh\u1ed1i l\u01b0\u1ee3ng d\u00e0n n\u00f3ng D\u00e0i 72 cm - Cao 49.5 cm - D\u00e0y 27 cm - N\u1eb7ng 21.2 kg Chi\u1ec1u d\u00e0i l\u1eafp \u0111\u1eb7t \u1ed1ng \u0111\u1ed3ng Ti\u00eau chu\u1ea9n 5m - T\u1ed1i thi\u1ec3u 3m - T\u1ed1i \u0111a 25m Chi\u1ec1u cao l\u1eafp \u0111\u1eb7t t\u1ed1i \u0111a gi\u1eefa c\u1ee5c n\u00f3ng-l\u1ea1nh 10m D\u00f2ng \u0111i\u1ec7n v\u00e0o D\u00e0n l\u1ea1nh D\u00f2ng \u0111i\u1ec7n ho\u1ea1t \u0111\u1ed9ng 1 pha K\u00edch th\u01b0\u1edbc \u1ed1ng \u0111\u1ed3ng 6/10 S\u1ed1 l\u01b0\u1ee3ng k\u1ebft n\u1ed1i d\u00e0n l\u1ea1nh t\u1ed1i \u0111a 1 C\u00f4ng ngh\u1ec7 ti\u1ebft ki\u1ec7m \u0111i\u1ec7n Inverter Quattro Kh\u1ea3 n\u0103ng l\u1ecdc kh\u00f4ng kh\u00ed L\u1ecdc b\u1ee5i, kh\u00e1ng khu\u1ea9n, kh\u1eed m\u00f9i - B\u1ed9 l\u1ecdc b\u1ee5i 2 l\u1edbp HD C\u00f4ng ngh\u1ec7 l\u00e0m l\u1ea1nh Ch\u1ebf \u0111\u1ed9 gi\u00f3 - T\u00f9y ch\u1ec9nh \u0111i\u1ec1u khi\u1ec3n l\u00ean xu\u1ed1ng, C\u00f4ng ngh\u1ec7 l\u00e0m l\u1ea1nh nhanh Boost Ti\u1ec7n \u00edch Remote c\u00f3 \u0111\u00e8n LED Kh\u00f3a remote \u0111i\u1ec1u khi\u1ec3n Follow me H\u1eb9n gi\u1edd b\u1eadt t\u1eaft m\u00e1y Ch\u1ebf \u0111\u1ed9 ch\u1ec9 s\u1eed d\u1ee5ng qu\u1ea1t Fan Only Ch\u1ee9c n\u0103ng t\u1ef1 l\u00e0m s\u1ea1ch Ch\u1ebf \u0111\u1ed9 Avoid Me (Breeze Away) M\u00e0n h\u00ecnh hi\u1ec3n th\u1ecb nhi\u1ec7t \u0111\u1ed9 tr\u00ean d\u00e0n l\u1ea1nh Ch\u1ee9c n\u0103ng h\u00fat \u1ea9m S\u1ea3n xu\u1ea5t t\u1ea1i Th\u00e1i Lan Th\u1eddi gian b\u1ea3o h\u00e0nh c\u1ee5c l\u1ea1nh 3 n\u0103m Th\u1eddi gian b\u1ea3o h\u00e0nh c\u1ee5c n\u00f3ng M\u00e1y n\u00e9n 5 n\u0103m Ch\u1ea5t li\u1ec7u d\u00e0n t\u1ea3n nhi\u1ec7t \u1ed0ng d\u00e0n gas b\u1eb1ng \u0110\u1ed3ng - L\u00e1 t\u1ea3n nhi\u1ec7t b\u1eb1ng Nh\u00f4m m\u1ea1 V\u00e0ng Lo\u1ea1i Gas R-32 M\u1ee9c ti\u00eau th\u1ee5 \u0111i\u1ec7n n\u0103ng 1.06 kW/h Nh\u00e3n n\u0103ng l\u01b0\u1ee3ng 5 sao (Hi\u1ec7u su\u1ea5t n\u0103ng l\u01b0\u1ee3ng 4.87) \u0110\u00e1nh gi\u00e1 chi ti\u1ebft \u0111i\u1ec1u h\u00f2a Midea Inverter 1.5 HP MSAGA-13CRDN8 Trong ph\u00e2n kh\u00fac t\u1ea7m trung, s\u1ea3n ph\u1ea9m \u0111i\u1ec1u h\u00f2a MSAGA-13CRDN8 \u0111\u1ebfn t\u1eeb th\u01b0\u01a1ng hi\u1ec7u Midea l\u00e0 l\u1ef1a ch\u1ecdn ph\u00f9 h\u1ee3p cho nhi\u1ec1u h\u1ed9 gia \u0111\u00ecnh c\u0169ng nh\u01b0 v\u0103n ph\u00f2ng, c\u00f4ng ty. V\u1edbi c\u00f4ng su\u1ea5t l\u00e0m l\u1ea1nh cao c\u00f9ng nhi\u1ec1u c\u00f4ng ngh\u1ec7 hi\u1ec7n \u0111\u1ea1i, thi\u1ebft b\u1ecb h\u1ee9a h\u1eb9n s\u1ebd \u0111\u00e1p \u1ee9ng m\u1ecdi nhu c\u1ea7u c\u1ee7a kh\u00e1ch h\u00e0ng. Thi\u1ebft k\u1ebf tinh t\u1ebf v\u1edbi ch\u1ea5t li\u1ec7u nh\u1ef1a cao c\u1ea5p Midea Inverter 1.5 HP MSAGA-13CRDN8 s\u1eed d\u1ee5ng ch\u1ea5t li\u1ec7u nh\u1ef1a cao c\u1ea5p cho v\u1ecf m\u00e1y, v\u1eeba mang l\u1ea1i v\u1ebb ngo\u00e0i thanh l\u1ecbch v\u1edbi m\u00e0u tr\u1eafng tinh t\u1ebf v\u1eeba \u0111\u1ea3m b\u1ea3o \u0111\u1ed9 b\u1ec1n trong qu\u00e1 tr\u00ecnh s\u1eed d\u1ee5ng. \u0110\u1eb7c bi\u1ec7t, m\u1eb7t tr\u01b0\u1edbc c\u1ee7a d\u00e0n l\u1ea1nh \u0111\u01b0\u1ee3c t\u00edch h\u1ee3p m\u00e0n h\u00ecnh hi\u1ec3n th\u1ecb nhi\u1ec7t \u0111\u1ed9, gi\u00fap ng\u01b0\u1eddi d\u00f9ng d\u1ec5 d\u00e0ng theo d\u00f5i v\u00e0 \u0111i\u1ec1u ch\u1ec9nh nhi\u1ec7t \u0111\u1ed9 ph\u00f2ng m\u1ed9t c\u00e1ch ch\u00ednh x\u00e1c. V\u1ec1 ph\u1ea7n d\u00e0n n\u00f3ng, m\u00e1y c\u00f3 thi\u1ebft k\u1ebf h\u00ecnh h\u1ed9p ch\u1eef nh\u1eadt g\u1ecdn g\u00e0ng c\u00f9ng v\u1edbi l\u00e1 t\u1ea3n nhi\u1ec7t b\u1eb1ng nh\u00f4m v\u00e0 \u1ed1ng d\u1eabn gas b\u1eb1ng \u0111\u1ed3ng, gi\u00fap t\u1ed1i \u01b0u kh\u1ea3 n\u0103ng truy\u1ec1n nhi\u1ec7t v\u00e0 n\u00e2ng cao tu\u1ed5i th\u1ecd c\u1ee7a s\u1ea3n ph\u1ea9m. Ngo\u00e0i ra, thi\u1ebft b\u1ecb n\u00e0y c\u00f3 th\u1ec3 l\u1eafp \u0111\u1eb7t \u1ed1ng tho\u00e1t n\u01b0\u1edbc \u1edf c\u1ea3 hai b\u00ean, tr\u00e1i ho\u1eb7c ph\u1ea3i, n\u00ean kh\u00e1 thu\u1eadn ti\u1ec7n trong vi\u1ec7c l\u1eafp \u0111\u1eb7t, ph\u00f9 h\u1ee3p v\u1edbi nhi\u1ec1u kh\u00f4ng gian v\u00e0 nhu c\u1ea7u s\u1eed d\u1ee5ng kh\u00e1c nhau. M\u00e1y l\u1ea1nh Midea Inverter 1.5 HP MSAGA-13CRDN8 v\u1edbi c\u00f4ng ngh\u1ec7 l\u00e0m l\u1ea1nh ti\u00ean ti\u1ebfn \u0110i\u1ec1u h\u00f2a Midea MSAGA-13CRDN8 l\u00e0 m\u1ed9t thi\u1ebft b\u1ecb l\u00e0m m\u00e1t hi\u1ec7n \u0111\u1ea1i, ph\u00f9 h\u1ee3p v\u1edbi nhu c\u1ea7u l\u00e0m m\u00e1t cho c\u00e1c ph\u00f2ng c\u00f3 di\u1ec7n t\u00edch t\u1eeb 15 \u0111\u1ebfn 20 m\u00e9t vu\u00f4ng. S\u1ea3n ph\u1ea9m n\u00e0y s\u1edf h\u1eefu c\u00f4ng ngh\u1ec7 l\u00e0m l\u1ea1nh ti\u00ean ti\u1ebfn, cung c\u1ea5p gi\u1ea3i ph\u00e1p nhanh ch\u00f3ng v\u00e0 hi\u1ec7u qu\u1ea3 cho ng\u01b0\u1eddi d\u00f9ng trong nh\u1eefng ng\u00e0y h\u00e8 n\u00f3ng b\u1ee9c. Ch\u1ebf \u0111\u1ed9 l\u00e0m l\u1ea1nh nhanh Boost cho ph\u00e9p m\u00e1y l\u00e0m l\u1ea1nh kh\u00f4ng gian s\u1ed1ng \u0111\u1ebfn nhi\u1ec7t \u0111\u1ed9 mong mu\u1ed1n m\u1ed9t c\u00e1ch nhanh ch\u00f3ng. Ngay sau khi k\u00edch ho\u1ea1t ch\u1ebf \u0111\u1ed9 n\u00e0y, ng\u01b0\u1eddi d\u00f9ng c\u00f3 th\u1ec3 c\u1ea3m nh\u1eadn \u0111\u01b0\u1ee3c s\u1ef1 thay \u0111\u1ed5i r\u00f5 r\u1ec7t v\u1ec1 nhi\u1ec7t \u0111\u1ed9, \u0111em l\u1ea1i c\u1ea3m gi\u00e1c m\u00e1t l\u1ea1nh t\u1ee9c th\u00ec m\u00e0 kh\u00f4ng ph\u1ea3i ch\u1ecbu \u0111\u1ef1ng s\u1ef1 oi b\u1ee9c trong th\u1eddi gian d\u00e0i. Ngo\u00e0i kh\u1ea3 n\u0103ng l\u00e0m l\u1ea1nh nhanh, Midea Inverter 1.5 HP MSAGA-13CRDN8 c\u00f2n \u0111\u01b0\u1ee3c trang b\u1ecb ch\u1ee9c n\u0103ng h\u00fat \u1ea9m, r\u1ea5t th\u00edch h\u1ee3p s\u1eed d\u1ee5ng trong m\u00f4i tr\u01b0\u1eddng c\u00f3 \u0111\u1ed9 \u1ea9m cao. Ch\u1ee9c n\u0103ng n\u00e0y gi\u00fap lo\u1ea1i b\u1ecf \u0111\u1ed9 \u1ea9m th\u1eeba trong kh\u00f4ng kh\u00ed, l\u00e0m cho kh\u00f4ng gian s\u1ed1ng tr\u1edf n\u00ean kh\u00f4 tho\u00e1ng v\u00e0 d\u1ec5 ch\u1ecbu h\u01a1n, \u0111\u1ed3ng th\u1eddi ng\u0103n ch\u1eb7n s\u1ef1 ph\u00e1t tri\u1ec3n c\u1ee7a vi khu\u1ea9n v\u00e0 n\u1ea5m m\u1ed1c, \u0111\u1ea3m b\u1ea3o s\u1ee9c kh\u1ecfe cho c\u00e1c th\u00e0nh vi\u00ean trong gia \u0111\u00ecnh. \u0110\u1ed1i v\u1edbi nh\u1eefng ng\u00e0y th\u1eddi ti\u1ebft m\u00e1t m\u1ebb ho\u1eb7c khi kh\u00f4ng c\u1ea7n \u0111\u1ebfn s\u1ef1 l\u00e0m l\u1ea1nh qu\u00e1 m\u1ea1nh, ch\u1ebf \u0111\u1ed9 Fan Only l\u00e0 l\u1ef1a ch\u1ecdn ph\u00f9 h\u1ee3p. Ch\u1ebf \u0111\u1ed9 n\u00e0y cho ph\u00e9p m\u00e1y l\u1ea1nh ho\u1ea1t \u0111\u1ed9ng nh\u01b0 m\u1ed9t chi\u1ebfc qu\u1ea1t th\u00f4ng th\u01b0\u1eddng, s\u1eed d\u1ee5ng qu\u1ea1t gi\u00f3 \u0111\u1ec3 t\u1ea1o lu\u1ed3ng kh\u00ed m\u00e1t m\u00e0 kh\u00f4ng k\u00edch ho\u1ea1t b\u1ed9 ph\u1eadn l\u00e0m l\u1ea1nh. \u0110\u00e2y l\u00e0 m\u1ed9t t\u00ednh n\u0103ng h\u1eefu \u00edch gi\u00fap ti\u1ebft ki\u1ec7m n\u0103ng l\u01b0\u1ee3ng \u0111\u1ed3ng th\u1eddi v\u1eabn mang l\u1ea1i s\u1ef1 tho\u1ea3i m\u00e1i cho ng\u01b0\u1eddi s\u1eed d\u1ee5ng. C\u00f4ng ngh\u1ec7 ti\u1ebft ki\u1ec7m \u0111i\u1ec7n hi\u1ec7n \u0111\u1ea1i tr\u00ean \u0111i\u1ec1u h\u00f2a Midea Inverter 1.5 HP MSAGA-13CRDN8 \u0110i\u1ec1u h\u00f2a n\u00e0y c\u1ee7a Midea \u0111\u01b0\u1ee3c trang b\u1ecb c\u00f4ng ngh\u1ec7 Inverter Quattro, m\u1ed9t h\u1ec7 th\u1ed1ng hi\u1ec7n \u0111\u1ea1i gi\u00fap t\u1ed1i \u01b0u h\u00f3a vi\u1ec7c ti\u1ebft ki\u1ec7m n\u0103ng l\u01b0\u1ee3ng trong khi v\u1eabn duy tr\u00ec hi\u1ec7u su\u1ea5t l\u00e0m l\u1ea1nh cao. C\u00f4ng ngh\u1ec7 n\u00e0y \u0111\u1eb7c bi\u1ec7t ph\u00f9 h\u1ee3p v\u1edbi nh\u1eefng \u0111i\u1ec1u ki\u1ec7n m\u00f4i tr\u01b0\u1eddng kh\u00e1c nhau, k\u1ec3 c\u1ea3 trong \u0111i\u1ec1u ki\u1ec7n th\u1eddi ti\u1ebft kh\u1eafc nghi\u1ec7t. M\u1ed9t trong nh\u1eefng t\u00ednh n\u0103ng ch\u00ednh c\u1ee7a c\u00f4ng ngh\u1ec7 Inverter Quattro l\u00e0 kh\u1ea3 n\u0103ng \u0111i\u1ec1u ch\u1ec9nh linh ho\u1ea1t c\u00f4ng su\u1ea5t ho\u1ea1t \u0111\u1ed9ng c\u1ee7a m\u00e1y. Ch\u1ee9c n\u0103ng Gear cho ph\u00e9p ng\u01b0\u1eddi d\u00f9ng thi\u1ebft l\u1eadp c\u00f4ng su\u1ea5t ho\u1ea1t \u0111\u1ed9ng c\u1ee7a m\u00e1y theo ba m\u1ee9c \u0111\u1ed9 kh\u00e1c nhau: 50%, 75%, v\u00e0 100%, t\u00f9y theo nhu c\u1ea7u s\u1eed d\u1ee5ng v\u00e0 mong mu\u1ed1n ti\u1ebft ki\u1ec7m \u0111i\u1ec7n. Th\u00eam v\u00e0o \u0111\u00f3, ch\u1ee9c n\u0103ng iEco \u0111\u01b0\u1ee3c thi\u1ebft k\u1ebf \u0111\u1ec3 \u0111\u1ea3m b\u1ea3o m\u1ed9t gi\u1ea5c ng\u1ee7 ngon v\u00e0 kh\u00f4ng b\u1ecb gi\u00e1n \u0111o\u1ea1n trong su\u1ed1t 8 gi\u1edd \u0111\u00eam m\u00e0 v\u1eabn ti\u1ebft ki\u1ec7m \u0111\u1ebfn 60% \u0111i\u1ec7n n\u0103ng ti\u00eau th\u1ee5. N\u00f3 gi\u00fap b\u1ea3o v\u1ec7 m\u00f4i tr\u01b0\u1eddng b\u1eb1ng c\u00e1ch gi\u1ea3m l\u01b0\u1ee3ng kh\u00ed th\u1ea3i carbon, \u0111\u1ed3ng th\u1eddi gi\u00fap ng\u01b0\u1eddi d\u00f9ng gi\u1ea3m b\u1edbt chi ph\u00ed \u0111i\u1ec7n n\u0103ng h\u00e0ng th\u00e1ng. Ngo\u00e0i ra, m\u00e1y l\u1ea1nh Midea Inverter 1.5 HP MSAGA-13CRDN8 c\u0169ng \u0111\u01b0\u1ee3c \u0111\u00e1nh gi\u00e1 cao v\u1ec1 kh\u1ea3 n\u0103ng duy tr\u00ec nhi\u1ec7t \u0111\u1ed9 \u1ed5n \u0111\u1ecbnh. C\u00f4ng ngh\u1ec7 Inverter cho ph\u00e9p m\u00e1y duy tr\u00ec nhi\u1ec7t \u0111\u1ed9 ph\u00f2ng theo c\u00e0i \u0111\u1eb7t tr\u00ean \u0111i\u1ec1u khi\u1ec3n t\u1eeb xa m\u1ed9t c\u00e1ch ch\u00ednh x\u00e1c, gi\u00fap ng\u0103n ng\u1eeba s\u1ef1 b\u1ea5t ti\u1ec7n do thay \u0111\u1ed5i nhi\u1ec7t \u0111\u1ed9 \u0111\u1ed9t ng\u1ed9t. V\u1edbi \u0111i\u1ec1u n\u00e0y, ng\u01b0\u1eddi d\u00f9ng kh\u00f4ng c\u1ea3m th\u1ea5y qu\u00e1 n\u00f3ng hay qu\u00e1 l\u1ea1nh, m\u00e0 lu\u00f4n \u0111\u01b0\u1ee3c t\u1eadn h\u01b0\u1edfng b\u1ea7u kh\u00f4ng kh\u00ed d\u1ec5 ch\u1ecbu. \u0110\u1ed3ng th\u1eddi, m\u00e1y c\u0169ng ho\u1ea1t \u0111\u1ed9ng r\u1ea5t \u00eam \u00e1i, mang l\u1ea1i s\u1ef1 y\u00ean t\u0129nh t\u1ed1i \u0111a, \u0111\u1eb7c bi\u1ec7t l\u00e0 trong nh\u1eefng gi\u1edd ng\u1ee7. L\u00e0m s\u1ea1ch kh\u00f4ng kh\u00ed hi\u1ec7u qu\u1ea3 cho kh\u00f4ng gian s\u1ed1ng l\u00e0nh m\u1ea1nh \u0110i\u1ec1u h\u00f2a Midea MSAGA-13CRDN8 \u0111\u01b0\u1ee3c trang b\u1ecb c\u00f4ng ngh\u1ec7 Dual Filtration, m\u1ed9t h\u1ec7 th\u1ed1ng l\u1ecdc kh\u00f4ng kh\u00ed ti\u00ean ti\u1ebfn nh\u1eb1m c\u1ea3i thi\u1ec7n ch\u1ea5t l\u01b0\u1ee3ng kh\u00f4ng kh\u00ed trong ph\u00f2ng. H\u1ec7 th\u1ed1ng n\u00e0y bao g\u1ed3m b\u1ed9 l\u1ecdc b\u1ee5i 2 l\u1edbp HD, \u0111\u01b0\u1ee3c thi\u1ebft k\u1ebf \u0111\u1ec3 lo\u1ea1i b\u1ecf hi\u1ec7u qu\u1ea3 c\u00e1c h\u1ea1t b\u1ee5i m\u1ecbn, k\u1ec3 c\u1ea3 nh\u1eefng h\u1ea1t b\u1ee5i PM2.5, \u0111\u1ed3ng th\u1eddi gi\u1ea3m thi\u1ec3u c\u00e1c t\u00e1c nh\u00e2n g\u00e2y d\u1ecb \u1ee9ng trong kh\u00f4ng kh\u00ed. Kh\u1ea3 n\u0103ng lo\u1ea1i b\u1ecf b\u1ee5i b\u1ea9n v\u00e0 vi khu\u1ea9n c\u1ee7a h\u1ec7 th\u1ed1ng l\u1ecdc Dual Filtration \u0111\u1ea3m b\u1ea3o kh\u00f4ng kh\u00ed trong ph\u00f2ng lu\u00f4n \u0111\u01b0\u1ee3c l\u00e0m m\u1edbi v\u00e0 t\u01b0\u01a1i m\u00e1t. \u0110i\u1ec1u n\u00e0y l\u00e0 r\u1ea5t quan tr\u1ecdng \u0111\u1ed1i v\u1edbi nh\u1eefng gia \u0111\u00ecnh c\u00f3 ng\u01b0\u1eddi m\u1eafc b\u1ec7nh h\u00f4 h\u1ea5p hay c\u00e1c v\u1ea5n \u0111\u1ec1 v\u1ec1 d\u1ecb \u1ee9ng, v\u00ec n\u00f3 gi\u00fap gi\u1ea3m thi\u1ec3u c\u00e1c y\u1ebfu t\u1ed1 c\u00f3 th\u1ec3 g\u00e2y ra ho\u1eb7c l\u00e0m tr\u1ea7m tr\u1ecdng th\u00eam c\u00e1c tri\u1ec7u ch\u1ee9ng. \u0110i\u1ec1u h\u00f2a Midea Inverter 1.5 HP MSAGA-13CRDN8 s\u1edf h\u1eefu lo\u1ea1t ti\u1ec7n \u00edch th\u00f4ng minh B\u00ean c\u1ea1nh nh\u1eefng c\u00f4ng ngh\u1ec7 l\u00e0m l\u1ea1nh v\u00e0 l\u00e0m s\u1ea1ch kh\u00f4ng kh\u00ed ti\u00ean ti\u1ebfn, \u0111i\u1ec1u h\u00f2a n\u00e0y c\u1ee7a Midea c\u00f2n mang l\u1ea1i nhi\u1ec1u ti\u1ec7n \u00edch th\u00f4ng minh. S\u1ea3n ph\u1ea9m n\u00e0y t\u00edch h\u1ee3p ch\u1ee9c n\u0103ng h\u1eb9n gi\u1edd b\u1eadt t\u1eaft m\u00e1y , h\u1eefu \u00edch cho nh\u1eefng ng\u01b0\u1eddi th\u01b0\u1eddng xuy\u00ean qu\u00ean t\u1eaft thi\u1ebft b\u1ecb ho\u1eb7c mu\u1ed1n t\u1ed1i \u01b0u h\u00f3a vi\u1ec7c s\u1eed d\u1ee5ng n\u0103ng l\u01b0\u1ee3ng. Ng\u01b0\u1eddi d\u00f9ng c\u00f3 th\u1ec3 d\u1ec5 d\u00e0ng thi\u1ebft l\u1eadp th\u1eddi gian b\u1eadt ho\u1eb7c t\u1eaft m\u00e1y ph\u00f9 h\u1ee3p v\u1edbi l\u1ecbch tr\u00ecnh sinh ho\u1ea1t h\u00e0ng ng\u00e0y c\u1ee7a m\u00ecnh, \u0111\u1ea3m b\u1ea3o kh\u00f4ng gian lu\u00f4n m\u00e1t m\u1ebb khi c\u1ea7n v\u00e0 ti\u1ebft ki\u1ec7m \u0111i\u1ec7n khi kh\u00f4ng s\u1eed d\u1ee5ng. Th\u00eam v\u00e0o \u0111\u00f3, ch\u1ee9c n\u0103ng l\u00e0m s\u1ea1ch t\u1ef1 \u0111\u1ed9ng c\u1ee7a m\u00e1y \u0111i\u1ec1u h\u00f2a n\u00e0y c\u0169ng r\u1ea5t ti\u1ec7n l\u1ee3i. Ch\u1ee9c n\u0103ng n\u00e0y gi\u00fap s\u1ea5y kh\u00f4 d\u00e0n l\u1ea1nh sau m\u1ed7i l\u1ea7n s\u1eed d\u1ee5ng, ng\u0103n ng\u1eeba s\u1ef1 sinh s\u00f4i c\u1ee7a vi khu\u1ea9n v\u00e0 n\u1ea5m m\u1ed1c, t\u1eeb \u0111\u00f3 b\u1ea3o v\u1ec7 s\u1ee9c kh\u1ecfe ng\u01b0\u1eddi d\u00f9ng v\u00e0 duy tr\u00ec hi\u1ec7u qu\u1ea3 l\u00e0m m\u00e1t l\u00e2u d\u00e0i c\u1ee7a m\u00e1y. M\u1eb7c d\u00f9 thi\u1ebfu m\u00e0n h\u00ecnh LED tr\u00ean d\u00e0n l\u1ea1nh, \u0111i\u1ec1u h\u00f2a n\u00e0y v\u1eabn d\u1ec5 d\u00e0ng \u0111i\u1ec1u khi\u1ec3n nh\u1edd chi\u1ebfc remote c\u00f3 trang b\u1ecb \u0111\u00e8n n\u1ec1n, cho ph\u00e9p ng\u01b0\u1eddi d\u00f9ng d\u1ec5 d\u00e0ng thao t\u00e1c v\u00e0 \u0111\u1ecdc c\u00e1c th\u00f4ng s\u1ed1 trong \u0111i\u1ec1u ki\u1ec7n thi\u1ebfu s\u00e1ng ho\u1eb7c v\u00e0o ban \u0111\u00eam. M\u1ed9t t\u00ednh n\u0103ng n\u1ed5i b\u1eadt kh\u00e1c l\u00e0 c\u1ea3m bi\u1ebfn nhi\u1ec7t \u0111\u1ed9 \" Follow me \" tr\u00ean remote. T\u00ednh n\u0103ng n\u00e0y cho ph\u00e9p m\u00e1y l\u1ea1nh \u0111i\u1ec1u ch\u1ec9nh h\u01b0\u1edbng gi\u00f3 v\u00e0 nhi\u1ec7t \u0111\u1ed9 d\u1ef1a tr\u00ean v\u1ecb tr\u00ed c\u1ee7a remote, \u0111\u1ea3m b\u1ea3o kh\u00f4ng gian xung quanh ng\u01b0\u1eddi d\u00f9ng lu\u00f4n \u0111\u01b0\u1ee3c l\u00e0m m\u00e1t m\u1ed9t c\u00e1ch \u0111\u1ec1u \u0111\u1eb7n v\u00e0 tho\u1ea3i m\u00e1i. M\u00e1y l\u1ea1nh Midea Inverter 1.5 HP MSAGA-13CRDN8 gi\u00e1 bao nhi\u00eau? S\u1ea3n ph\u1ea9m \u0111i\u1ec1u h\u00f2a n\u00e0y c\u1ee7a Midea l\u00e0 m\u1ed9t l\u1ef1a ch\u1ecdm ph\u00f9 h\u1ee3p cho nh\u1eefng ai \u0111ang t\u00ecm ki\u1ebfm m\u1ed9t thi\u1ebft b\u1ecb l\u00e0m m\u00e1t hi\u1ec7u qu\u1ea3 v\u00e0 ti\u1ebft ki\u1ec7m n\u0103ng l\u01b0\u1ee3ng. V\u1edbi c\u00f4ng su\u1ea5t 1.5 HP, m\u00e1y c\u00f3 kh\u1ea3 n\u0103ng l\u00e0m m\u00e1t nhanh v\u00e0 \u0111\u1ec1u cho c\u00e1c kh\u00f4ng gian c\u00f3 di\u1ec7n t\u00edch t\u1eeb 15 \u0111\u1ebfn 20 m\u00e9t vu\u00f4ng. \u0110i\u1ec1u h\u00f2a n\u00e0y l\u00e0 m\u1ed9t thi\u1ebft b\u1ecb \u0111\u00e1ng gi\u00e1 v\u1edbi nh\u1eefng c\u00f4ng ngh\u1ec7 ti\u00ean ti\u1ebfn, l\u00e0m m\u00e1t hi\u1ec7u qu\u1ea3 v\u00e0 t\u1ed1i \u01b0u cho m\u1ecdi gia \u0111\u00ecnh. \u0110\u1eb7c bi\u1ec7t, s\u1ea3n ph\u1ea9m hi\u1ec7n \u0111ang \u0111\u01b0\u1ee3c b\u00e1n v\u1edbi m\u1ee9c gi\u00e1 c\u1ef1c k\u1ef3 \u01b0u \u0111\u00e3i t\u1ea1i Ho\u00e0ng H\u00e0 Mobile. L\u01b0u \u00fd: Gi\u00e1 c\u1ee7a s\u1ea3n ph\u1ea9m c\u00f3 th\u1ec3 thay \u0111\u1ed5i t\u00f9y v\u00e0o th\u1eddi \u0111i\u1ec3m mua h\u00e0ng v\u00e0 c\u00e1c ch\u01b0\u01a1ng tr\u00ecnh \u01b0u \u0111\u00e3i, khuy\u1ebfn m\u00e3i hi\u1ec7n h\u00e0nh. V\u00ec v\u1eady, \u0111\u1ec3 c\u00f3 th\u00f4ng tin ch\u00ednh x\u00e1c nh\u1ea5t, vui l\u00f2ng li\u00ean h\u1ec7 tr\u1ef1c ti\u1ebfp v\u1edbi Ho\u00e0ng H\u00e0 Mobile nh\u00e9. Mua \u0111i\u1ec1u h\u00f2a Midea Inverter 1.5 HP MSAGA-13CRDN8 ch\u00ednh h\u00e3ng t\u1ea1i Ho\u00e0ng H\u00e0 Mobile Khi mua \u0111i\u1ec1u h\u00f2a Midea Inverter MSAGA-13CRDN8 ch\u00ednh h\u00e3ng t\u1ea1i Ho\u00e0ng H\u00e0 Mobile, kh\u00e1ch h\u00e0ng s\u1ebd nh\u1eadn \u0111\u01b0\u1ee3c nhi\u1ec1u \u01b0u \u0111\u00e3i h\u1ea5p d\u1eabn. \u0110\u1ea7u ti\u00ean, s\u1ea3n ph\u1ea9m \u0111\u01b0\u1ee3c cung c\u1ea5p v\u1edbi m\u1ee9c gi\u00e1 t\u1ed1t nh\u1ea5t th\u1ecb tr\u01b0\u1eddng, \u0111\u1ea3m b\u1ea3o b\u1ea1n c\u00f3 th\u1ec3 ti\u1ebfp c\u1eadn c\u00f4ng ngh\u1ec7 l\u00e0m m\u00e1t hi\u1ec7n \u0111\u1ea1i m\u00e0 kh\u00f4ng ph\u1ea3i lo l\u1eafng v\u1ec1 chi ph\u00ed. B\u00ean c\u1ea1nh \u0111\u00f3, Ho\u00e0ng H\u00e0 Mobile cam k\u1ebft ch\u1ea5t l\u01b0\u1ee3ng ch\u00ednh h\u00e3ng cho m\u1ed7i chi\u1ebfc \u0111i\u1ec1u h\u00f2a Midea b\u00e1n ra, mang l\u1ea1i s\u1ef1 an t\u00e2m tuy\u1ec7t \u0111\u1ed1i cho kh\u00e1ch h\u00e0ng v\u1ec1 \u0111\u1ed9 b\u1ec1n v\u00e0 hi\u1ec7u su\u1ea5t c\u1ee7a s\u1ea3n ph\u1ea9m. Th\u00eam v\u00e0o \u0111\u00f3, vi\u1ec7c mua s\u1eafm t\u1ea1i Ho\u00e0ng H\u00e0 Mobile c\u00f2n \u0111\u01b0\u1ee3c h\u1ed7 tr\u1ee3 b\u1edfi ch\u00ednh s\u00e1ch mi\u1ec5n ph\u00ed v\u1eadn chuy\u1ec3n to\u00e0n qu\u1ed1c. D\u00f9 b\u1ea1n \u1edf b\u1ea5t k\u1ef3 \u0111\u00e2u, Midea Inverter 1.5 HP MSAGA-13CRDN8 s\u1ebd \u0111\u01b0\u1ee3c giao \u0111\u1ebfn t\u1eadn nh\u00e0 m\u00e0 kh\u00f4ng ph\u00e1t sinh th\u00eam chi ph\u00ed. N\u1ebfu b\u1ea1n \u0111ang t\u00ecm c\u00e1ch mua s\u1eafm ti\u1ebft ki\u1ec7m h\u01a1n, Ho\u00e0ng H\u00e0 Mobile c\u00f2n h\u1ed7 tr\u1ee3 tr\u1ea3 g\u00f3p 0% cho ph\u00e9p b\u1ea1n thanh to\u00e1n linh ho\u1ea1t m\u00e0 kh\u00f4ng lo l\u00e3i su\u1ea5t. Khi \u0111\u1ebfn v\u1edbi Ho\u00e0ng H\u00e0 Mobile, b\u1ea1n s\u1ebd \u0111\u01b0\u1ee3c t\u01b0 v\u1ea5n b\u1edfi \u0111\u1ed9i ng\u0169 nh\u00e2n vi\u00ean chuy\u00ean nghi\u1ec7p v\u00e0 chu \u0111\u00e1o. Ch\u00fang t\u00f4i s\u1eb5n s\u00e0ng gi\u1ea3i \u0111\u00e1p m\u1ecdi th\u1eafc m\u1eafc v\u00e0 cung c\u1ea5p th\u00f4ng tin chi ti\u1ebft \u0111\u1ec3 b\u1ea1n c\u00f3 th\u1ec3 l\u1ef1a ch\u1ecdn s\u1ea3n ph\u1ea9m ph\u00f9 h\u1ee3p nh\u1ea5t v\u1edbi nhu c\u1ea7u v\u00e0 \u0111i\u1ec1u ki\u1ec7n s\u1eed d\u1ee5ng. V\u1edbi t\u1ea5t c\u1ea3 nh\u1eefng \u01b0u \u0111\u00e3i n\u00e0y, Ho\u00e0ng H\u00e0 Mobile t\u1ef1 h\u00e0o l\u00e0 \u0111\u1ecba ch\u1ec9 \u0111\u00e1ng tin c\u1eady cho nhu c\u1ea7u mua \u0111i\u1ec1u h\u00f2a ch\u00ednh h\u00e3ng c\u1ee7a m\u1ecdi gia \u0111\u00ecnh. Xem to\u00e0n b\u1ed9 b\u00e0i vi\u1ebft",
        "promotion_1": "1. Tr\u00fang 8386 qu\u00e0 - T\u1ed5ng gi\u00e1 tr\u1ecb t\u1edbi 250 TRI\u1ec6U \u0110\u1ed2NG (\u00c1p d\u1ee5ng t\u1eeb 10/01 - 02/02/2025). (Xem chi ti\u1ebft). 2. \u0110\u1eb7c bi\u1ec7t Tr\u1ea3 g\u00f3p 3 kh\u00f4ng: 0% l\u00e3i su\u1ea5t - 0 ph\u00ed chuy\u1ec3n \u0111\u1ed5i - 0 tr\u1ea3 tr\u01b0\u1edbc (\u00c1p d\u1ee5ng cho c\u00f4ng ty t\u00e0i ch\u00ednh v\u00e0 th\u1ebb t\u00edn d\u1ee5ng)",
        "promotion_2": "1. Gi\u1ea3m t\u1edbi 500.000\u0111 khi thanh to\u00e1n th\u1ebb t\u00edn d\u1ee5ng NCB. (Xem chi ti\u1ebft). 2. Gi\u1ea3m \u0111\u1ebfn 150.000\u0111 khi thanh to\u00e1n qua Muadee. (Xem chi ti\u1ebft). 3. Mi\u1ec5n ph\u00ed chuy\u1ec3n \u0111\u1ed5i tr\u1ea3 g\u00f3p ho\u1eb7c gi\u1ea3m \u0111\u1ebfn 500.000\u0111 khi m\u1edf th\u1ebb TPBank EVO. (Xem chi ti\u1ebft). 4. M\u1edf th\u1ebb t\u00edn d\u1ee5ng VIB - Nh\u1eadn Voucher 600.000\u0111. (Xem chi ti\u1ebft). 5. M\u1edf th\u1ebb HSBC - Ho\u00e0n ti\u1ec1n t\u1edbi 2 tri\u1ec7u \u0111\u1ed3ng. (Xem chi ti\u1ebft)"
    },
    {
        "title": "\u0110i\u1ec1u h\u00f2a Midea Inverter 10.000 BTU (1 HP) MSAG-10CRDN8",
        "price": "gi\u00e1 hi\u1ec7n t\u1ea1i l\u00e0 8,540,000 \u20ab nh\u01b0ng tr\u01b0\u1edbc \u0111\u00e2y n\u00f3 c\u00f3 gi\u00e1 l\u00e0 9,990,000 \u20ab",
        "colors": "Tr\u1eafng",
        "technical_specifications": [
            {
                "Lo\u1ea1i m\u00e1y": "1 chi\u1ec1u (ch\u1ec9 l\u00e0m l\u1ea1nh)"
            },
            {
                "C\u00f4ng ngh\u1ec7 inverter": "M\u00e1y l\u1ea1nh Inverter"
            },
            {
                "C\u00f4ng su\u1ea5t l\u00e0m l\u1ea1nh": "1 HP - 10.000 BTU"
            },
            {
                "Ph\u1ea1m vi l\u00e0m l\u1ea1nh hi\u1ec7u qu\u1ea3": "D\u01b0\u1edbi 15m\u00b2 (t\u1eeb 30 \u0111\u1ebfn 45m\u00b3)"
            },
            {
                "Nh\u00e3n n\u0103ng l\u01b0\u1ee3ng": "5 sao (Hi\u1ec7u su\u1ea5t n\u0103ng l\u01b0\u1ee3ng 4.38)"
            }
        ],
        "description": "Midea Inverter 1 HP MSAG-10CRDN8 l\u00e0 m\u1ed9t chi\u1ebfc m\u00e1y l\u1ea1nh c\u1ee7a th\u01b0\u01a1ng hi\u1ec7u Midea c\u00f3 \u0111\u1ea7y \u0111\u1ee7 c\u00e1c t\u00ednh n\u0103ng l\u00e0m l\u1ea1nh nhanh , ti\u1ebft ki\u1ec7m \u0111i\u1ec7n . \u0110\u1ed3ng th\u1eddi, m\u00e1y c\u00f2n t\u00edch h\u1ee3p ch\u1ee9c n\u0103ng l\u1ecdc kh\u00f4ng kh\u00ed an to\u00e0n mang \u0111\u1ebfn cho ng\u01b0\u1eddi d\u00f9ng m\u1ed9t m\u00f4i tr\u01b0\u1eddng s\u1ed1ng t\u1ed1t h\u01a1n. M\u00e1y c\u00f3 c\u00f4ng su\u1ea5t 1 HP - 10.000 BTU ph\u00f9 h\u1ee3p v\u1edbi nh\u1eefng kh\u00f4ng gian c\u00f3 di\u1ec7n t\u00edch t\u1edbi 15 m\u00e9t vu\u00f4ng . \u0110\u1eb7c \u0111i\u1ec3m n\u1ed5i b\u1eadt: Ch\u1ebf \u0111\u1ed9 Follow me cho ph\u00e9p lu\u1ed3ng kh\u00f4ng kh\u00ed m\u00e1t \u0111\u01b0\u1ee3c \u0111\u01b0a tr\u1ef1c ti\u1ebfp \u0111\u1ebfn v\u1ecb tr\u00ed c\u1ee7a b\u1ea1n m\u00e0 kh\u00f4ng c\u1ea7n t\u1ed1n nhi\u1ec1u c\u00f4ng s\u1ee9c. Ch\u1ebf \u0111\u1ed9 Sleep t\u1ef1 \u0111\u1ed9ng \u0111i\u1ec1u ch\u1ec9nh nhi\u1ec7t \u0111\u1ed9 ph\u00f2ng \u0111\u1ec3 \u0111\u1ea3m b\u1ea3o kh\u00f4ng kh\u00ed kh\u00f4ng qu\u00e1 n\u00f3ng ho\u1eb7c kh\u00f4ng qu\u00e1 l\u1ea1nh, ti\u1ebft ki\u1ec7m \u0111i\u1ec7n n\u0103ng. Ch\u1ebf \u0111\u1ed9 im l\u1eb7ng gi\u00fap m\u00e1y ho\u1ea1t \u0111\u1ed9ng \u1edf m\u1ee9c \u0111\u1ed9 y\u00ean t\u0129nh ch\u1ec9 21dB \u0111\u1ec3 gi\u1ea5c ng\u1ee7 c\u1ee7a b\u1ea1n ngon h\u01a1n m\u00e0 v\u1eabn duy tr\u00ec b\u1ea7u kh\u00f4ng kh\u00ed m\u00e1t m\u1ebb. M\u00e0n h\u00ecnh LED v\u1edbi \u0111\u00e8n chi\u1ebfu s\u00e1ng gi\u00fap ng\u01b0\u1eddi d\u00f9ng d\u1ec5 theo d\u00f5i nhi\u1ec7t \u0111\u1ed9 ngay c\u1ea3 khi kh\u00f4ng kh\u00f4ng c\u00f3 \u00e1nh s\u00e1ng. B\u1ea3ng th\u00f4ng s\u1ed1 k\u1ef9 thu\u1eadt c\u1ee7a m\u00e1y l\u1ea1nh Midea Inverter 1 HP MSAG-10CRDN8 Tham kh\u1ea3o c\u00e1c th\u00f4ng s\u1ed1 k\u1ef9 thu\u1eadt c\u1ee7a chi\u1ebfc \u0111i\u1ec1u h\u00f2a nh\u00e0 Midea c\u00f3 kh\u1ea3 n\u0103ng l\u1ecdc\u00a0 kh\u00f4ng kh\u00ed c\u00f9ng nhi\u1ec1u t\u00ednh n\u0103ng n\u1ed5i b\u1eadt kh\u00e1c \u0111\u1ec3 hi\u1ec3u l\u00fd do v\u00ec sao b\u1ea1n kh\u00f4ng n\u00ean b\u1ecf qua s\u1ea3n ph\u1ea9m n\u00e0y nh\u00e9. Th\u00f4ng s\u1ed1 Chi ti\u1ebft Th\u00f4ng tin s\u1ea3n ph\u1ea9m Lo\u1ea1i m\u00e1y M\u00e1y l\u1ea1nh 1 chi\u1ec1u (ch\u1ec9 l\u00e0m l\u1ea1nh) C\u00f4ng su\u1ea5t l\u00e0m l\u1ea1nh 1 HP - 10.000 BTU Ph\u1ea1m vi l\u00e0m l\u1ea1nh hi\u1ec7u qu\u1ea3 D\u01b0\u1edbi 15m2 (t\u1eeb 30 \u0111\u1ebfn 45 m3) C\u00f4ng ngh\u1ec7 Inverter M\u00e1y l\u1ea1nh Inverter \u0110\u1ed9 \u1ed3n trung b\u00ecnh 26/45 dB D\u00f2ng s\u1ea3n ph\u1ea9m 2020 S\u1ea3n xu\u1ea5t t\u1ea1i Vi\u1ec7t Nam Th\u1eddi gian b\u1ea3o h\u00e0nh c\u1ee5c l\u1ea1nh 3 n\u0103m Th\u1eddi gian b\u1ea3o h\u00e0nh c\u1ee5c n\u00f3ng M\u00e1y n\u00e9n 5 n\u0103m Ch\u1ea5t li\u1ec7u d\u00e0n t\u1ea3n nhi\u1ec7t \u1ed0ng d\u1eabn gas b\u1eb1ng \u0110\u1ed3ng - L\u00e1 t\u1ea3n nhi\u1ec7t b\u1eb1ng Nh\u00f4m m\u1ea1 V\u00e0ng Lo\u1ea1i Gas R-32 M\u1ee9c ti\u00eau th\u1ee5 \u0111i\u1ec7n n\u0103ng Ti\u00eau th\u1ee5 \u0111i\u1ec7n 0.78 kW/h Nh\u00e3n n\u0103ng l\u01b0\u1ee3ng 5 sao (Hi\u1ec7u su\u1ea5t n\u0103ng l\u01b0\u1ee3ng 4.38) C\u00f4ng ngh\u1ec7 ti\u1ebft ki\u1ec7m \u0111i\u1ec7n Inverter Quattro Kh\u1ea3 n\u0103ng l\u1ecdc kh\u00f4ng kh\u00ed L\u1ecdc b\u1ee5i, kh\u00e1ng khu\u1ea9n, kh\u1eed m\u00f9i Fresh t\u1ea1o ion \u00e2m di\u1ec7t khu\u1ea9n l\u00e0m s\u1ea1ch kh\u00f4ng kh\u00ed B\u1ed9 l\u1ecdc b\u1ee5i 2 l\u1edbp HD C\u00f4ng ngh\u1ec7 l\u00e0m l\u1ea1nh Ch\u1ebf \u0111\u1ed9 gi\u00f3 \u0110i\u1ec1u khi\u1ec3n l\u00ean xu\u1ed1ng t\u1ef1 \u0111\u1ed9ng, tr\u00e1i ph\u1ea3i t\u00f9y ch\u1ec9nh tay C\u00f4ng ngh\u1ec7 l\u00e0m l\u1ea1nh nhanh Boost Ti\u1ec7n \u00edch Ti\u1ec7n \u00edch \u1ed0ng tho\u00e1t n\u01b0\u1edbc 2 chi\u1ec1u ti\u1ec7n l\u1ee3i trong l\u1eafp \u0111\u1eb7t Remote c\u00f3 \u0111\u00e8n LED Follow me - C\u1ea3m bi\u1ebfn nhi\u1ec7t \u0111\u1ed9 tr\u00ean remote T\u1ea1o ion l\u1ecdc kh\u00f4ng kh\u00ed M\u00e0n h\u00ecnh hi\u1ec3n th\u1ecb nhi\u1ec7t \u0111\u1ed9 tr\u00ean d\u00e0n l\u1ea1nh Ch\u1ee9c n\u0103ng h\u00fat \u1ea9m H\u1eb9n gi\u1edd b\u1eadt t\u1eaft m\u00e1y Ch\u1ebf \u0111\u1ed9 ch\u1ec9 s\u1eed d\u1ee5ng qu\u1ea1t Fan Only - ch\u1ec9 l\u00e0m m\u00e1t, kh\u00f4ng l\u00e0m l\u1ea1nh Ch\u1ee9c n\u0103ng t\u1ef1 l\u00e0m s\u1ea1ch Th\u00f4ng s\u1ed1 k\u00edch th\u01b0\u1edbc/l\u1eafp \u0111\u1eb7t K\u00edch th\u01b0\u1edbc - Kh\u1ed1i l\u01b0\u1ee3ng d\u00e0n l\u1ea1nh D\u00e0i 83.5 cm - Cao 29.5 cm - D\u00e0y 20.8 cm - N\u1eb7ng 8.9 kg K\u00edch th\u01b0\u1edbc - Kh\u1ed1i l\u01b0\u1ee3ng d\u00e0n n\u00f3ng D\u00e0i 72 cm - Cao 49.5 cm - D\u00e0y 27cm - N\u1eb7ng 21.7 kg Chi\u1ec1u d\u00e0i l\u1eafp \u0111\u1eb7t \u1ed1ng \u0111\u1ed3ng Ti\u00eau chu\u1ea9n 5m - T\u1ed1i thi\u1ec3u 3m - T\u1ed1i \u0111a 25m Chi\u1ec1u cao l\u1eafp \u0111\u1eb7t t\u1ed1i \u0111a gi\u1eefa c\u1ee5c n\u00f3ng - l\u1ea1nh 10m D\u00f2ng \u0111i\u1ec7n v\u00e0o D\u00e0n l\u1ea1nh D\u00f2ng \u0111i\u1ec7n ho\u1ea1t \u0111\u1ed9ng 1 pha K\u00edch th\u01b0\u1edbc \u1ed1ng \u0111\u1ed3ng 6/10 S\u1ed1 l\u01b0\u1ee3ng k\u1ebft n\u1ed1i d\u00e0n l\u1ea1nh t\u1ed1i \u0111a 1 \u0110\u00e1nh gi\u00e1 chi ti\u1ebft c\u00e1c t\u00ednh n\u0103ng n\u1ed5i b\u1eadt c\u1ee7a chi\u1ebfc \u0111i\u1ec1u h\u00f2a Midea Inverter 1 HP MSAG-10CRDN8 \u0110\u00e2y l\u00e0 m\u1ed9t s\u1ea3n ph\u1ea9m \u0111i\u1ec1u h\u00f2a kh\u00f4ng kh\u00ed \u0111\u00e1p \u1ee9ng nhu c\u1ea7u t\u1eeb th\u1ea5p \u0111\u1ebfn cao c\u1ee7a ng\u01b0\u1eddi d\u00f9ng v\u1edbi thi\u1ebft k\u1ebf hi\u1ec7n \u0111\u1ea1i, c\u00f4ng su\u1ea5t l\u1edbn, hi\u1ec7u su\u1ea5t l\u00e0m l\u1ea1nh nhanh, c\u00f3 kh\u1ea3 n\u0103ng l\u1ecdc b\u1ee5i b\u1ea9n trong kh\u00f4ng kh\u00ed v\u00e0 \u0111\u1eb7c bi\u1ec7t l\u00e0 r\u1ea5t ti\u1ebft ki\u1ec7m \u0111i\u1ec7n n\u0103ng. Midea Inverter 1 HP MSAG-10CRDN8 v\u1edbi thi\u1ebft k\u1ebf m\u1ec1m m\u1ea1i, ki\u1ec3u d\u00e1ng thanh l\u1ecbch M\u00e1y l\u1ea1nh Midea th\u01b0\u1eddng \u0111\u01b0\u1ee3c thi\u1ebft k\u1ebf v\u1edbi v\u1ebb ngo\u00e0i r\u1ea5t thanh l\u1ecbch v\u00e0 m\u1ec1m m\u1ea1i b\u1edfi ki\u1ec3u d\u00e1ng m\u00e1y c\u00f3 nhi\u1ec1u \u0111\u01b0\u1eddng u\u1ed1n cong, g\u1ee3n s\u00f3ng. V\u1edbi g\u00f3c nh\u00ecn nghi\u00eang, c\u00f3 th\u1ec3 th\u1ea5y r\u00f5 m\u1ed9t \u0111\u01b0\u1eddng bo cong gi\u00fap b\u1ec1 m\u1eb7t m\u00e1y t\u1ea1o th\u00e0nh h\u00ecnh ch\u1eef S m\u1ec1m m\u1ea1i. Ch\u1ea5t li\u1ec7u m\u00e1y \u0111\u01b0\u1ee3c l\u00e0m t\u1ef1 nh\u1ef1a s\u00e1ng b\u00f3ng, d\u1ec5 lau ch\u00f9i. Thi\u1ebft k\u1ebf nguy\u00ean kh\u1ed1i m\u00e0u tr\u1eafng mang l\u1ea1i s\u1ef1 s\u1ea1ch s\u1ebd, d\u1ec5 k\u1ebft h\u1ee3p v\u1edbi c\u00e1c kh\u00f4ng gian v\u00e0 \u0111\u1ed3 n\u1ed9i th\u1ea5t b\u00e0y tr\u00ed trong nh\u00e0 nh\u01b0ng v\u1eabn t\u1ea1o \u0111\u01b0\u1ee3c \u0111i\u1ec3m nh\u1ea5n, kh\u00f4ng b\u1ecb g\u00f3c c\u1ea1nh v\u00e0 t\u1ea1o c\u1ea3m gi\u00e1c kh\u00f4 c\u1ee9ng. \u1ede m\u1eb7t tr\u01b0\u1edbc, ph\u1ea7n \u0111\u00e8n LED hi\u1ec3n th\u1ecb nhi\u1ec7t \u0111\u1ed9 s\u1ebd n\u1eb1m l\u1ec7ch sang m\u1ed9t b\u00ean mang l\u1ea1i v\u1ebb ngo\u00e0i hi\u1ec7n \u0111\u1ea1i v\u00e0 d\u1ec5 theo d\u00f5i nhi\u1ec7t \u0111\u1ed9 ho\u1ea1t \u0111\u1ed9ng c\u1ee7a m\u00e1y. \u0110\u00e8n LED c\u0169ng c\u00f3 th\u1ec3 t\u1eaft d\u1ec5 d\u00e0ng v\u1edbi n\u00fat LED tr\u00ean remote n\u1ebfu b\u1ea1n l\u00e0 ng\u01b0\u1eddi nh\u1ea1y c\u1ea3m v\u1edbi \u00e1nh s\u00e1ng khi ng\u1ee7 v\u00e0o bu\u1ed5i t\u1ed1i. Remote c\u1ee7a m\u00e1y c\u0169ng \u0111\u01b0\u1ee3c t\u00edch h\u1ee3p \u0111\u00e8n n\u1ec1n \u0111\u1ec3 ng\u01b0\u1eddi d\u00f9ng thu\u1eadn ti\u1ec7n s\u1eed d\u1ee5ng v\u00e0o ban \u0111\u00eam, khi kh\u00f4ng c\u00f3 \u00e1nh s\u00e1ng. D\u00e0n l\u1ea1nh c\u1ee7a chi\u1ebfc \u0111i\u1ec1u h\u00f2a Inverter 1 HP MSAG-10CRDN8 \u0111\u01b0\u1ee3c Midea thi\u1ebft k\u1ebf v\u1edbi \u1ed1ng tho\u00e1t n\u01b0\u1edbc hai chi\u1ec1u b\u1ed1 tr\u00ed \u1edf c\u1ea3 b\u00ean ph\u1ea3i v\u00e0 b\u00ean tr\u00e1i c\u1ee7a m\u00e1y. Do \u0111\u00f3, vi\u1ec7c l\u1eafp \u0111\u1eb7t m\u00e1y tr\u1edf n\u00ean thu\u1eadn ti\u1ec7n h\u01a1n r\u1ea5t l\u00e0 nhi\u1ec1u. M\u00e1y l\u1ea1nh Midea Inverter 1 HP MSAG-10CRDN8 ti\u1ebft ki\u1ec7m \u0111i\u1ec7n n\u0103ng Chi\u1ebfc m\u00e1y l\u1ea1nh n\u00e0y c\u1ee7a Midea s\u1eed d\u1ee5ng c\u00f4ng ngh\u1ec7 Inverter Quattro - m\u1ed9t c\u00f4ng ngh\u1ec7 m\u1edbi \u0111\u01b0\u1ee3c ph\u00e1t tri\u1ec3n b\u1edfi Midea mang \u0111\u1ebfn hai kh\u1ea3 n\u0103ng bao g\u1ed3m l\u00e0m l\u1ea1nh nhanh v\u00e0 ti\u1ebft ki\u1ec7m \u0111i\u1ec7n. C\u00f4ng ngh\u1ec7 n\u00e0y cho ph\u00e9p m\u00e1y n\u00e9n \u0111\u1eb7t c\u00f4ng su\u1ea5t t\u1ed1i \u0111a trong t\u00edch t\u1eafc \u0111em l\u1ea1i hi\u1ec7u n\u0103ng l\u00e0m l\u1ea1nh m\u1ea1nh m\u1ebd. C\u00f9ng v\u1edbi c\u00f4ng ngh\u1ec7 n\u00e0y, m\u00e1y c\u00f2n \u0111\u01b0\u1ee3c t\u00edch h\u1ee3p t\u00ednh n\u0103ng iEco \u0111\u1ec3 ti\u1ebft ki\u1ec7m n\u0103ng l\u01b0\u1ee3ng. Khi t\u00ednh n\u0103ng n\u00e0y \u0111\u01b0\u1ee3c k\u00edch ho\u1ea1t, chi\u1ebfc m\u00e1y l\u1ea1nh n\u00e0y c\u00f3 th\u1ec3 l\u00e0m m\u00e1t kh\u00f4ng gian nh\u00e0 c\u1ee7a b\u1ea1n su\u1ed1t 8 ti\u1ebfng ban \u0111\u00eam m\u00e0 ch\u1ec9 ti\u00eau t\u1ed1n kho\u1ea3ng 2,2 KW \u0111i\u1ec7n, ti\u1ebft ki\u1ec7m \u0111\u1ebfn 70% \u0111i\u1ec7n n\u0103ng. N\u1ebfu t\u00ednh n\u0103ng iEco c\u1ee7a \u0111i\u1ec1u h\u00f2a Midea Inverter 1 HP MSAG-10CRDN8 ho\u1ea1t \u0111\u1ed9ng theo ch\u1ebf \u0111\u1ed9 \u0111\u00e3 c\u00e0i \u0111\u1eb7t s\u1eb5n th\u00ec t\u00ednh n\u0103ng GearShift ho\u1ea1t \u0111\u1ed9ng theo \u0111i\u1ec1u khi\u1ec3n c\u1ee7a ng\u01b0\u1eddi d\u00f9ng. Ng\u01b0\u1eddi d\u00f9ng c\u00f3 th\u1ec3 t\u00f9y ch\u1ecdn c\u00f4ng su\u1ea5t linh ho\u1ea1t \u1edf 3 m\u1ee9c 100% - 75% - 50%. Vi\u1ec7c c\u00f3 th\u1ec3 \u0111i\u1ec1u ch\u1ec9nh m\u1ee9c c\u00f4ng su\u1ea5t theo nhu c\u1ea7u s\u1eed d\u1ee5ng gi\u00fap t\u0103ng kh\u1ea3 n\u0103ng ti\u1ebft ki\u1ec7m \u0111i\u1ec7n c\u1ee7a m\u00e1y. Th\u00eam v\u00e0o \u0111\u00f3, chi\u1ebfc \u0111i\u1ec1u h\u00f2a kh\u00f4ng kh\u00ed n\u00e0y c\u00f2n s\u1eed d\u1ee5ng GAS R32 m\u1edbi nh\u1ea5t hi\u1ec7n nay gi\u00fap l\u00e0m l\u1ea1nh s\u00e2u, mang l\u1ea1i h\u01a1i l\u1ea1nh d\u1ec5 ch\u1ecbu, kh\u00f4ng ch\u1ec9 t\u1ed1t cho s\u1ee9c kh\u1ecfe m\u00e0 c\u00f2n b\u1ea3o v\u1ec7 m\u00f4i tr\u01b0\u1eddng v\u00e0 gi\u00fap ti\u1ebft ki\u1ec7m \u0111i\u1ec7n n\u0103ng t\u1ed1t h\u01a1n. L\u1ecdc kh\u00f4ng kh\u00ed t\u1ed1t h\u01a1n \u0110\u1ec3 \u0111em \u0111\u1ebfn b\u1ea7u kh\u00f4ng kh\u00ed trong l\u00e0nh v\u00e0 s\u1ea1ch s\u1ebd cho kh\u00f4ng gian ph\u00f2ng v\u00e0 ng\u00f4i nh\u00e0 c\u1ee7a ng\u01b0\u1eddi d\u00f9ng. Midea \u0111\u00e3 t\u00edch h\u1ee3p c\u00f4ng ngh\u1ec7 l\u1ecbch ion Air Magic c\u00f3 th\u1ec3 k\u00edch ho\u1ea1t th\u00f4ng qua remote. Th\u01b0\u01a1ng hi\u1ec7u cho bi\u1ebft, m\u00e1y l\u1ea1nh Midea Inverter 1 HP MSAG-10CRDN8 c\u00f3 kh\u1ea3 n\u0103ng gi\u1ea3i ph\u00f3ng \u0111\u1ebfn 2 tri\u1ec7u ion \u00e2m v\u00e0 d\u01b0\u01a1ng trong kh\u00f4ng kh\u00ed. C\u00e1c ion n\u00e0y s\u1ebd bao quanh v\u00e0 ti\u00eau di\u1ec7t vi khu\u1ea9n v\u00e0 bi\u1ebfn c\u00e1c vi khu\u1ea9n n\u00e0y th\u00e0nh ph\u00e2n t\u1eed n\u01b0\u1edbc v\u00f4 h\u1ea1i th\u00f4ng qua c\u00e1c ph\u1ea3n \u1ee9ng h\u00f3a h\u1ecdc. C\u00f9ng v\u1edbi \u0111\u00f3 l\u00e0 b\u1ed9 l\u01b0\u1edbi l\u1ecdc k\u00e9p - hay b\u1ed9 l\u1ecdc b\u1ee5i HD gi\u00fap lo\u1ea1i b\u1ecf t\u00e1c nh\u00e2n g\u00e2y b\u1ee5i v\u00e0 mang l\u1ea1i b\u1ea7u kh\u00f4ng kh\u00ed trong l\u00e0nh. B\u1ed9 l\u01b0\u1edbi l\u1ecdc ho\u1ea1t \u0111\u1ed9ng theo hai b\u01b0\u1edbc. V\u1edbi b\u01b0\u1edbc \u0111\u1ea7u ti\u00ean l\u00e0 l\u1ecdc s\u01a1 c\u1ea5p v\u1edbi l\u01b0\u1edbi l\u1ecdc m\u1eadt \u0111\u1ed9 cao lo\u1ea1i b\u1ecf \u0111\u01b0\u1ee3c b\u1ee5i b\u1eb7m, l\u00f4ng \u0111\u1ed9ng v\u1eadt, h\u1ea1t b\u1ee5i v\u00e0 c\u00e1c lo\u1ea1i n\u1ea5m m\u1ed1c. B\u01b0\u1edbc th\u1ee9 hai l\u00e0 l\u1ecdc b\u1ea3o v\u1ec7 kh\u1ecfi vi h\u1ea1t nh\u01b0 l\u00e0 ph\u1ea5n hoa, m\u00f9i h\u00f4i kh\u00f3 ch\u1ecbu, v\u00e0 \u0111\u1eb7c bi\u1ec7t l\u00e0 vi b\u1ee5i v\u00e0 vi khu\u1ea9n. \u0110i\u1ec1u h\u00f2a Midea Inverter 1 HP MSAG-10CRDN8 c\u00f3 \u0111\u1ed9 b\u1ec1n theo th\u1eddi gian Ngo\u00e0i nh\u1eefng t\u1ea5m l\u1ecdc, d\u00e0n l\u1ea1nh v\u00e0 d\u00e0n n\u00f3ng c\u1ee7a m\u00e1y c\u00f2n \u0111\u01b0\u1ee3c b\u1ea3o v\u1ec7 b\u1edfi m\u1ed9t l\u1edbp s\u01a1n ph\u1ee7 - PrimeGuard - gi\u00fap ph\u1ee7 m\u1ed9t l\u1edbp c\u00f3 kh\u1ea3 n\u0103ng ch\u1ed1ng oxy h\u00f3a v\u00e0 \u0103n m\u00f2n cao h\u01a1n. L\u1edbp ph\u1ee7 mang l\u1ea1i m\u1ed9t m\u00f4i tr\u01b0\u1eddng ho\u1ea1t \u0111\u1ed9ng \u1ed5n \u0111\u1ecbnh v\u00e0 l\u00e2u d\u00e0i cho h\u1ec7 th\u1ed1ng b\u00ean trong m\u00e1y \u0111\u1ed3ng th\u1eddi ng\u0103n ch\u1eb7n s\u1ef1 sinh s\u00f4i c\u1ee7a c\u00e1c vi khu\u1ea9n v\u00e0 n\u00e2ng cao kh\u1ea3 n\u0103ng ch\u1ed1ng ch\u1ecbu v\u1edbi c\u00e1c t\u00e1c nh\u00e2n \u0103n m\u00f2n. L\u1edbp v\u1ecf si\u00eau c\u1ee9ng b\u00ean ngo\u00e0i c\u0169ng gi\u00fap b\u1ea3o v\u1ec7 m\u00e1y v\u00e0 ch\u1ed1ng l\u1ea1i s\u1ef1 t\u1ea5n c\u00f4ng c\u1ee7a c\u00e1c y\u1ebfu t\u1ed1 b\u00ean ngo\u00e0i nh\u01b0 mu\u1ed1i, c\u00e1t axit, v\u1ec7t d\u1ea7u, n\u01b0\u1edbc\u2026 ph\u00f9 h\u1ee3p v\u1edbi nhi\u1ec1u m\u00f4i tr\u01b0\u1eddng kh\u00e1c nhau. \u0110\u1eb7c bi\u1ec7t l\u00e0 c\u00e1c lo\u1ea1i \u1ed1c v\u00edt c\u1ea5u t\u1ea1o m\u00e1y \u0111\u1ec1u \u0111\u01b0\u1ee3c l\u00e0m t\u1eeb th\u00e9p kh\u00f4ng g\u1ec9, c\u00f3 kh\u1ea3 n\u0103ng ch\u1ed1ng \u1ea9m, ki\u1ec1m v\u00e0 \u0103n m\u00f2n h\u01a1n c\u00e1c lo\u1ea1i \u1ed1c v\u00edt th\u00f4ng th\u01b0\u1eddng, t\u1eeb \u0111\u00f3 gi\u00fap t\u0103ng \u0111\u1ed9 b\u1ec1n c\u1ee7a m\u00e1y theo th\u1eddi gian. Nhi\u1ec1u t\u00ednh n\u0103ng th\u00f4ng minh t\u00edch h\u1ee3p tr\u00ean remote Kh\u00f4ng d\u1eebng l\u1ea1i \u1edf nh\u1eefng \u0111i\u1ec3m n\u1ed5i b\u1eadt v\u1ec1 c\u00f4ng ngh\u1ec7 m\u00e0 ch\u00fang ta \u0111\u00e3 t\u00ecm hi\u1ec3u \u1edf tr\u00ean, Midea c\u00f2n t\u00edch h\u1ee3p m\u1ed9t lo\u1ea1i c\u00e1c t\u00ednh n\u0103ng th\u00f4ng minh kh\u00e1c tr\u00ean chi\u1ebfc remote \u0111i\u1ec1u khi\u1ec3n c\u1ee7a m\u00e1y l\u1ea1nh Midea Inverter 1 HP MSAG-10CRDN8 . Boost l\u00e0m l\u1ea1nh nhanh: \u1ede ch\u1ebf \u0111\u1ed9 n\u00e0y, m\u00e1y s\u1ebd ho\u1ea1t \u0111\u1ed9ng v\u1edbi c\u00f4ng su\u1ea5t cao \u0111\u1ebfn 10.000 BTU mang \u0111\u1ebfn hi\u1ec7u qu\u1ea3 l\u00e0m l\u1ea1nh v\u01b0\u1ee3t tr\u1ed9i h\u01a1n. C\u00e1nh \u0111\u1ea3o gi\u00f3 m\u1edf r\u1ed9ng \u0111\u1ebfn 80 \u0111\u1ed9: Gi\u00fap gia t\u0103ng l\u01b0u l\u01b0\u1ee3ng gi\u00f3 th\u1ed5i ra, mang h\u01a1i l\u1ea1nh lan t\u1ecfa xa, \u0111\u1ec1u v\u00e0 r\u1ed9ng h\u01a1n bao ph\u1ee7 to\u00e0n b\u1ed9 kh\u00f4ng gian ph\u00f2ng. Ch\u1ebf \u0111\u1ed9 h\u00fat \u1ea9m Dry: C\u00e2n b\u1eb1ng \u0111\u1ed9 \u1ea9m trong kh\u00f4ng kh\u00ed v\u00e0o nh\u1eefng ng\u00e0y m\u01b0a, \u1ea9m. \u0110i\u1ec1u ch\u1ec9nh c\u00e1nh \u0111\u1ea3o gi\u00f3 t\u1ef1 \u0111\u1ed9ng l\u00ean xu\u1ed1ng v\u1edbi SWING tr\u00ean remote. V\u00e0 \u0111i\u1ec1u khi\u1ec3n b\u1eb1ng tay khi c\u1ea7n \u0111\u1ea3o gi\u00f3 qua tr\u00e1i ho\u1eb7c qua ph\u1ea3i. Ch\u1ee9c n\u0103ng Follow me: Khi \u0111\u1ec3 remote g\u1ea7n v\u1ecb tr\u00ed c\u1ee7a b\u1ea1n, m\u00e1y l\u1ea1nh s\u1ebd t\u1eadp trung gi\u00f3 m\u00e1t \u0111\u1ebfn v\u1ecb tr\u00ed c\u1ee7a b\u1ea1n d\u00f9 \u1edf b\u1ea5t k\u1ef3 \u0111\u00e2u. Ch\u1ebf \u0111\u1ed9 ng\u1ee7 Sleep: Sau khi k\u00edch ho\u1ea1t, c\u1ee9 sau m\u1ed7i m\u1ed9t ti\u1ebfng \u0111\u1ed3ng h\u1ed3, m\u00e1y s\u1ebd t\u1ef1 \u0111\u1ed9ng t\u0103ng nhi\u1ec7t \u0111\u1ed9 l\u00ean 1 \u0111\u1ed9 C, ch\u1ebf \u0111\u1ed9 s\u1ebd d\u1eebng sau 8 ti\u1ebfng v\u00e0 m\u00e1y ti\u1ebfp t\u1ee5c ho\u1ea1t \u0111\u1ed9ng theo c\u00e0i \u0111\u1eb7t cu\u1ed1i c\u00f9ng. Qua \u0111\u00f3 \u0111\u1ea3m b\u1ea3o nhi\u1ec7t \u0111\u1ed9 trong ph\u00f2ng kh\u00f4ng qu\u00e1 th\u1ea5p ho\u1eb7c qu\u00e1 cao \u1ea3nh h\u01b0\u1edfng \u0111\u1ebfn gi\u1ea5c ng\u1ee7 v\u00e0 s\u1ee9c kh\u1ecfe c\u1ee7a b\u1ea1n. H\u1eb9n gi\u1edd b\u1eadt t\u1eaft t\u1ed1i \u0111a trong 24 ti\u1ebfng d\u1ec5 d\u00e0ng c\u00e0i \u0111\u1eb7t. T\u1ef1 \u0111\u1ed9ng l\u00e0m s\u1ea1ch d\u00e0n l\u1ea1nh khi b\u1eadt Clean tr\u00ean Remote. M\u00e1y s\u1ebd ch\u1ee7 \u0111\u1ed9ng r\u1eeda s\u1ea1ch b\u1ee5i b\u1ea9n b\u1eb1ng c\u00e1ch ch\u1ee7 \u0111\u1ed9ng \u0111\u00f3ng b\u0103ng v\u00e0 r\u00e3 \u0111\u00f4ng ngay sau \u0111\u00f3 v\u00e0 ti\u1ebfp t\u1ee5c ho\u1ea1t \u0111\u1ed9ng \u0111\u1ec3 s\u1ea5y kh\u00f4 d\u00e0n l\u1ea1nh. T\u1eeb \u0111\u00f3 ng\u0103n ng\u1eeba s\u1ef1 ph\u00e1t sinh c\u1ee7a n\u1ea5m m\u1ed1c v\u00e0 vi khu\u1ea9n. M\u00e1y l\u1ea1nh Midea Inverter 1 HP MSAG-10CRDN8 hi\u1ec7n c\u00f3 gi\u00e1 nh\u01b0 th\u1ebf n\u00e0o? Thi\u1ebft b\u1ecb \u0111ang \u0111\u01b0\u1ee3c b\u00e1n v\u1edbi gi\u00e1 c\u1ef1c k\u1ef3 \u01b0u \u0111\u00e3i c\u00f9ng nhi\u1ec1u qu\u00e0 t\u1eb7ng h\u1ea5p d\u1eabn t\u1ea1i Ho\u00e0ng H\u00e0 Mobile. Kh\u00f4ng ch\u1ec9 c\u00f3 m\u1ee9c gi\u00e1 ph\u00f9 h\u1ee3p t\u00fai ti\u1ec1n, \u0111\u00e2y c\u00f2n l\u00e0 thi\u1ebft b\u1ecb l\u00e0m m\u00e1t kh\u00f4ng kh\u00ed \u0111\u00e1p \u1ee9ng nhu c\u1ea7u t\u1eeb c\u01a1 b\u1ea3n \u0111\u1ebfn n\u00e2ng cao c\u1ee7a ng\u01b0\u1eddi d\u00f9ng nh\u01b0 l\u00e0m l\u1ea1nh nhanh, ti\u1ebft ki\u1ec7m \u0111i\u1ec7n, l\u1ecdc kh\u00f4ng kh\u00ed. Ngo\u00e0i ra, c\u00f2n c\u00f3 c\u1ea3 c\u00e1c t\u00ednh n\u0103ng th\u00f4ng minh nh\u01b0 Follow me, t\u1ef1 \u0111\u1ed9ng l\u00e0m s\u1ea1ch. Thi\u1ebft b\u1ecb c\u00f2n c\u00f3 d\u00e0n n\u00f3ng \u0111\u01b0\u1ee3c thi\u1ebft k\u1ebf c\u1ee9ng c\u00e1p t\u1ea1o s\u1ef1 b\u1ec1n b\u1ec9 v\u1edbi \u1ed1c kh\u00f4ng g\u1ec9, l\u1edbp b\u1ea3o v\u1ec7 ch\u1ed1ng \u0103n m\u00f2n theo th\u1eddi gian. Mua \u0111i\u1ec1u h\u00f2a kh\u00f4ng kh\u00ed Midea Inverter 1 HP MSAG-10CRDN8 ch\u00ednh h\u00e3ng nhi\u1ec1u \u01b0u \u0111\u00e3i t\u1ea1i Ho\u00e0ng H\u00e0 Mobile \u0110\u1ec3 mua c\u00e1c s\u1ea3n ph\u1ea9m \u0111i\u1ec1u h\u00f2a, m\u00e1y l\u1ea1nh c\u1ee7a th\u01b0\u01a1ng hi\u1ec7u Midea t\u1ea1i Vi\u1ec7t Nam th\u00ec Ho\u00e0ng H\u00e0 Mobile l\u00e0 \u0111i\u1ec3m \u0111\u1ebfn b\u1ea1n kh\u00f4ng th\u1ec3 b\u1ecf l\u1ee1. V\u1edbi ch\u00ednh s\u00e1ch gi\u00e1 \u0111\u1ea7y \u01b0u \u0111\u00e3i, qu\u00fd kh\u00e1ch h\u00e0ng s\u1ebd l\u1ef1a ch\u1ecdn \u0111\u01b0\u1ee3c m\u1ed9t s\u1ea3n ph\u1ea9m h\u1ee3p t\u00fai ti\u1ec1n, nhi\u1ec1u c\u00f4ng n\u0103ng hi\u1ec7n \u0111\u1ea1i v\u00e0 \u0111\u01b0\u1ee3c \u0111\u1ea3m b\u1ea3o v\u1ec1 ch\u1ea5t l\u01b0\u1ee3ng c\u0169ng nh\u01b0 xu\u1ea5t x\u1ee9 c\u1ee7a s\u1ea3n ph\u1ea9m. \u0110\u1ec3 mua h\u00e0ng, b\u1ea1n c\u00f3 th\u1ec3 gh\u00e9 \u0111\u1ebfn c\u1eeda h\u00e0ng c\u1ee7a Ho\u00e0ng H\u00e0 Mobile g\u1ea7n m\u00ecnh nh\u1ea5t ho\u1eb7c truy c\u1eadp website hoanghamobile \u0111\u1ec3 mua s\u1eafm online v\u00e0 nh\u1eadn h\u00e0ng t\u1ea1i nh\u00e0 kh\u00f4ng m\u1ea5t ph\u00ed v\u1eadn chuy\u1ec3n v\u00e0 th\u1eddi gian \u0111i l\u1ea1i. B\u1ea1n c\u0169ng s\u1ebd \u0111\u01b0\u1ee3c tham gia \u0111\u1ea7y \u0111\u1ee7 c\u00e1c ch\u00ednh s\u00e1ch b\u1ea3o h\u00e0nh ch\u00ednh h\u00e3ng , tho\u1ea3i m\u00e1i s\u1eed d\u1ee5ng s\u1ea3n ph\u1ea9m m\u00e0 kh\u00f4ng lo v\u1ec1 ch\u1ea5t l\u01b0\u1ee3ng v\u1edbi 30 ng\u00e0y \u0111\u1ed5i tr\u1ea3 mi\u1ec5n ph\u00ed . C\u00f9ng v\u1edbi \u0111\u00f3 l\u00e0 h\u00e0ng lo\u1ea1t c\u00e1c ch\u01b0\u01a1ng tr\u00ecnh khuy\u1ebfn m\u00e3i nh\u1eb1m tri \u00e2n kh\u00e1ch h\u00e0ng th\u01b0\u1eddng xuy\u00ean \u0111\u01b0\u1ee3c t\u1ed5 ch\u1ee9c. \u0110\u1ed3ng th\u1eddi, Ho\u00e0ng H\u00e0 Mobile c\u0169ng \u0111ang h\u1ed7 tr\u1ee3 kh\u00e1ch h\u00e0ng mua s\u1ea3n ph\u1ea9m tr\u1ea3 g\u00f3p t\u1eeb 0% v\u1edbi nhi\u1ec1u \u01b0u \u0111\u00e3i c\u1ef1c h\u1ea5p d\u1eabn. M\u1ecdi th\u00f4ng tin chi ti\u1ebft xin li\u00ean h\u1ec7 1900.2091 \u0111\u1ec3 \u0111\u01b0\u1ee3c gi\u1ea3i \u0111\u00e1p v\u00e0 t\u01b0 v\u1ea5n mi\u1ec5n ph\u00ed. Xem to\u00e0n b\u1ed9 b\u00e0i vi\u1ebft",
        "promotion_1": "1. Tr\u00fang 8386 qu\u00e0 - T\u1ed5ng gi\u00e1 tr\u1ecb t\u1edbi 250 TRI\u1ec6U \u0110\u1ed2NG (\u00c1p d\u1ee5ng t\u1eeb 10/01 - 02/02/2025). (Xem chi ti\u1ebft). 2. \u0110\u1eb7c bi\u1ec7t Tr\u1ea3 g\u00f3p 3 kh\u00f4ng: 0% l\u00e3i su\u1ea5t - 0 ph\u00ed chuy\u1ec3n \u0111\u1ed5i - 0 tr\u1ea3 tr\u01b0\u1edbc (\u00c1p d\u1ee5ng cho c\u00f4ng ty t\u00e0i ch\u00ednh v\u00e0 th\u1ebb t\u00edn d\u1ee5ng)",
        "promotion_2": "1. Gi\u1ea3m t\u1edbi 500.000\u0111 khi thanh to\u00e1n th\u1ebb t\u00edn d\u1ee5ng NCB. (Xem chi ti\u1ebft). 2. Gi\u1ea3m \u0111\u1ebfn 150.000\u0111 khi thanh to\u00e1n qua Muadee. (Xem chi ti\u1ebft). 3. Mi\u1ec5n ph\u00ed chuy\u1ec3n \u0111\u1ed5i tr\u1ea3 g\u00f3p ho\u1eb7c gi\u1ea3m \u0111\u1ebfn 500.000\u0111 khi m\u1edf th\u1ebb TPBank EVO. (Xem chi ti\u1ebft). 4. M\u1edf th\u1ebb t\u00edn d\u1ee5ng VIB - Nh\u1eadn Voucher 600.000\u0111. (Xem chi ti\u1ebft). 5. M\u1edf th\u1ebb HSBC - Ho\u00e0n ti\u1ec1n t\u1edbi 2 tri\u1ec7u \u0111\u1ed3ng. (Xem chi ti\u1ebft)"
    }
]