[
    {
        "title": "M\u00e1y t\u00ednh b\u1ea3ng Honor Pad X8a (4+128GB) - Ch\u00ednh h\u00e3ng",
        "price": "gi\u00e1 hi\u1ec7n t\u1ea1i l\u00e0 4,690,000 \u20ab",
        "colors": "X\u00e1m",
        "technical_specifications": [
            {
                "Chip x\u1eed l\u00fd (CPU)": "Snapdragon 680 8 nh\u00e2n"
            },
            {
                "Chip \u0111\u1ed3 ho\u1ea1 (GPU)": "\u0110ang c\u1eadp nh\u1eadt"
            },
            {
                "RAM": "4 GB"
            },
            {
                "WiFi": "Dual-band"
            },
            {
                "H\u1ec7 \u0111i\u1ec1u h\u00e0nh": "MagicOS 8.0 (Android 14)"
            },
            {
                "T\u1ed1c \u0111\u1ed9 CPU": "Octa-core (4*Cortex-A73@2.4GHz + 4*Cortex-A53@1.9GHz)"
            },
            {
                "B\u1ed9 nh\u1edb trong": "128GB"
            },
            {
                "Bluetooth": "v5.1"
            },
            {
                "C\u00f4ng ngh\u1ec7 m\u00e0n h\u00ecnh": "TFT LCD (IPS)"
            },
            {
                "K\u00edch th\u01b0\u1edbc": "256,91 x 168,46 x 7,25 mm"
            },
            {
                "Tr\u1ecdng l\u01b0\u1ee3ng": "495 g"
            }
        ],
        "description": "M\u00e1y t\u00ednh b\u1ea3ng Honor Pad X8a (4GB/128GB) t\u1eeb th\u01b0\u01a1ng hi\u1ec7u Honor \u0111\u01b0\u1ee3c thi\u1ebft k\u1ebf \u0111\u1ec3 \u0111\u00e1p \u1ee9ng nhu c\u1ea7u c\u00f4ng vi\u1ec7c v\u00e0 gi\u1ea3i tr\u00ed ng\u00e0y c\u00e0ng t\u0103ng c\u1ee7a ng\u01b0\u1eddi d\u00f9ng hi\u1ec7n \u0111\u1ea1i. V\u1edbi thi\u1ebft k\u1ebf g\u1ecdn nh\u1eb9, hi\u1ec7u n\u0103ng m\u1ea1nh m\u1ebd v\u1edbi Snapdragon 680 v\u00e0 h\u00e0ng lo\u1ea1t t\u00ednh n\u0103ng ti\u1ec7n \u00edch, Honor Pad X8a h\u1ee9a h\u1eb9n mang l\u1ea1i m\u1ed9t tr\u1ea3i nghi\u1ec7m v\u1edbi m\u00e0n h\u00ecnh 11 inch TFT LCD s\u1eed d\u1ee5ng v\u01b0\u1ee3t tr\u1ed9i trong t\u1ea7m gi\u00e1. S\u1ea3n ph\u1ea9m n\u00e0y kh\u00f4ng ch\u1ec9 ph\u00f9 h\u1ee3p cho c\u00e1c t\u00e1c v\u1ee5 h\u00e0ng ng\u00e0y nh\u01b0 l\u01b0\u1edbt web, xem video, m\u00e0 c\u00f2n \u0111\u00e1p \u1ee9ng t\u1ed1t c\u00e1c nhu c\u1ea7u l\u00e0m vi\u1ec7c v\u00e0 h\u1ecdc t\u1eadp tr\u1ef1c tuy\u1ebfn c\u00f9ng dung l\u01b0\u1ee3ng RAM 4GB . \u0110\u1eb7c \u0111i\u1ec3m n\u1ed5i b\u1eadt: M\u00e0n h\u00ecnh TFT LCD (IPS) 11 inch v\u1edbi \u0111\u1ed9 ph\u00e2n gi\u1ea3i 1200 x 1920 Pixels, mang l\u1ea1i h\u00ecnh \u1ea3nh s\u1eafc n\u00e9t, m\u00e0u s\u1eafc trung th\u1ef1c. B\u1ed9 vi x\u1eed l\u00fd Snapdragon 680 8 nh\u00e2n, \u0111\u1ea3m b\u1ea3o hi\u1ec7u n\u0103ng m\u01b0\u1ee3t m\u00e0 trong c\u00e1c t\u00e1c v\u1ee5 \u0111a nhi\u1ec7m. Dung l\u01b0\u1ee3ng pin 8300 mAh, h\u1ed7 tr\u1ee3 s\u1eed d\u1ee5ng l\u00e2u d\u00e0i, ph\u00f9 h\u1ee3p cho c\u1ea3 ng\u00e0y l\u00e0m vi\u1ec7c ho\u1eb7c gi\u1ea3i tr\u00ed. T\u00ednh n\u0103ng \u00e2m thanh Hi-Res Audio c\u00f9ng h\u1ec7 th\u1ed1ng 4 loa, mang l\u1ea1i tr\u1ea3i nghi\u1ec7m \u00e2m thanh s\u1ed1ng \u0111\u1ed9ng. H\u1ec7 \u0111i\u1ec1u h\u00e0nh MagicOS 8.0 (Android 14) m\u1edbi nh\u1ea5t, cung c\u1ea5p giao di\u1ec7n th\u00e2n thi\u1ec7n v\u00e0 t\u00ednh n\u0103ng hi\u1ec7n \u0111\u1ea1i. B\u1ea3ng th\u00f4ng s\u1ed1 chi ti\u1ebft k\u1ef9 thu\u1eadt m\u00e1y t\u00ednh b\u1ea3ng Honor Pad X8A (4GB/128GB) Danh m\u1ee5c Chi ti\u1ebft M\u00e0n h\u00ecnh TFT LCD (IPS), 11 inch, \u0111\u1ed9 ph\u00e2n gi\u1ea3i 1200 x 1920 Pixels CPU Snapdragon 680, Octa-core (4x Cortex-A73 @ 2.4GHz + 4x Cortex-A53 @ 1.9GHz) RAM 4GB B\u1ed9 nh\u1edb trong 128GB Camera sau 5MP, kh\u1ea9u \u0111\u1ed9 f/2.2, h\u1ed7 tr\u1ee3 HDR, ch\u1ee5p time-lapse, ch\u1ebf \u0111\u1ed9 Beauty Camera tr\u01b0\u1edbc 5MP, kh\u1ea9u \u0111\u1ed9 f/2.2, h\u1ed7 tr\u1ee3 selfie v\u1edbi b\u1ed9 l\u1ecdc v\u00e0 ch\u1ebf \u0111\u1ed9 h\u1eb9n gi\u1edd Pin Lithium-ion 8300 mAh C\u00f4ng su\u1ea5t s\u1ea1c t\u1ed1i \u0111a 10W H\u1ec7 \u0111i\u1ec1u h\u00e0nh MagicOS 8.0 (d\u1ef1a tr\u00ean Android 14) \u00c2m thanh Hi-Res Audio, 4 loa K\u1ebft n\u1ed1i WiFi dual-band, Bluetooth v5.1, OTG C\u1ed5ng k\u1ebft n\u1ed1i Type-C (s\u1ea1c v\u00e0 tai nghe) Tr\u1ecdng l\u01b0\u1ee3ng 495 g K\u00edch th\u01b0\u1edbc 256,91 x 168,46 x 7,25 mm \u0110\u00e1nh gi\u00e1 chi ti\u1ebft t\u00ednh n\u0103ng n\u1ed5i b\u1eadt c\u1ee7a M\u00e1y t\u00ednh b\u1ea3ng Honor Pad X8a (4GB/128GB) Honor Pad X8a l\u00e0 m\u1ed9t thi\u1ebft b\u1ecb \u0111\u00e1ng ch\u00fa \u00fd trong ph\u00e2n kh\u00fac m\u00e1y t\u00ednh b\u1ea3ng nh\u1edd s\u1ef1 c\u00e2n b\u1eb1ng ho\u00e0n h\u1ea3o gi\u1eefa thi\u1ebft k\u1ebf, hi\u1ec7u n\u0103ng, v\u00e0 c\u00e1c t\u00ednh n\u0103ng n\u1ed5i b\u1eadt. Thi\u1ebft k\u1ebf m\u00e0n h\u00ecnh 11 inch hi\u1ec3n th\u1ecb h\u00ecnh \u1ea3nh r\u00f5 n\u00e9t c\u00f9ng \u0111\u1ed9 ph\u00e2n gi\u1ea3i 1200 x 1920 pixels mang l\u1ea1i m\u00e0u s\u1eafc ch\u00e2n th\u1ef1c. Chipset x\u1eed l\u00fd hi\u1ec7u n\u0103ng v\u01b0\u1ee3t tr\u1ed9i \u0111a d\u1ea1ng c\u00e1c t\u00e1c v\u1ee5 kh\u00e1c nhau gi\u1eefa c\u00f4ng vi\u1ec7c v\u00e0 gi\u1ea3i tr\u00ed t\u1ed1i \u01b0u. N\u1ebfu b\u1ea1n c\u1ea7n m\u1ed9t s\u1ea3n ph\u1ea9m c\u00f3 th\u1ec3 \u0111\u00e1p \u1ee9ng t\u1ed1t c\u1ea3 nhu c\u1ea7u l\u00e0m vi\u1ec7c l\u1eabn gi\u1ea3i tr\u00ed, th\u00ec Honor Pad X8a ch\u1eafc ch\u1eafn s\u1ebd l\u00e0 m\u1ed9t l\u1ef1a ch\u1ecdn \u0111\u00e1ng gi\u00e1. Thi\u1ebft k\u1ebf m\u00e0n h\u00ecnh cao c\u1ea5p mang \u0111\u1ebfn hi\u1ec3n th\u1ecb h\u00ecnh \u1ea3nh m\u00e0u s\u1eafc ch\u00e2n th\u1ef1c Honor Pad X8a \u0111\u01b0\u1ee3c trang b\u1ecb m\u00e0n h\u00ecnh TFT LCD (IPS) k\u00edch th\u01b0\u1edbc 11 inch, cung c\u1ea5p kh\u00f4ng gian hi\u1ec3n th\u1ecb l\u1edbn cho c\u00e1c ho\u1ea1t \u0111\u1ed9ng t\u1eeb gi\u1ea3i tr\u00ed \u0111\u1ebfn c\u00f4ng vi\u1ec7c. C\u00f4ng ngh\u1ec7 TFT LCD gi\u00fap t\u00e1i hi\u1ec7n h\u00ecnh \u1ea3nh s\u1eafc n\u00e9t v\u1edbi \u0111\u1ed9 ph\u00e2n gi\u1ea3i 1200 x 1920 Pixels, t\u1ef7 l\u1ec7 m\u00e0n h\u00ecnh t\u1ed1i \u01b0u h\u00f3a cho vi\u1ec7c xem video ho\u1eb7c \u0111\u1ecdc t\u00e0i li\u1ec7u. M\u00e0n h\u00ecnh n\u00e0y c\u00f2n \u0111\u01b0\u1ee3c thi\u1ebft k\u1ebf \u0111\u1ec3 gi\u1ea3m thi\u1ec3u hi\u1ec7n t\u01b0\u1ee3ng m\u1ecfi m\u1eaft nh\u1edd v\u00e0o c\u00f4ng ngh\u1ec7 l\u1ecdc \u00e1nh s\u00e1ng xanh, \u0111\u1ea3m b\u1ea3o ng\u01b0\u1eddi d\u00f9ng c\u00f3 th\u1ec3 s\u1eed d\u1ee5ng trong th\u1eddi gian d\u00e0i m\u00e0 kh\u00f4ng g\u1eb7p kh\u00f3 ch\u1ecbu. V\u1edbi \u0111\u1ed9 s\u00e1ng t\u1ed1i \u01b0u (\u0111ang c\u1eadp nh\u1eadt th\u00f4ng s\u1ed1 chi ti\u1ebft), Honor Pad X8a c\u0169ng ho\u1ea1t \u0111\u1ed9ng t\u1ed1t ngay c\u1ea3 trong \u0111i\u1ec1u ki\u1ec7n \u00e1nh s\u00e1ng m\u1ea1nh, mang l\u1ea1i tr\u1ea3i nghi\u1ec7m th\u1ecb gi\u00e1c v\u01b0\u1ee3t tr\u1ed9i. M\u00e1y t\u00ednh b\u1ea3ng Honor Pad X8a \u0111\u01b0\u1ee3c trang b\u1ecb b\u1ed9 x\u1eed l\u00fd Snapdragon 680 x\u1eed l\u00fd nhanh ch\u00f3ng v\u00e0 ti\u1ebft ki\u1ec7m \u0111i\u1ec7n n\u0103ng Honor Pad X8a v\u1eadn h\u00e0nh tr\u00ean n\u1ec1n t\u1ea3ng MagicOS 8.0 d\u1ef1a tr\u00ean Android 14 m\u1edbi nh\u1ea5t, mang \u0111\u1ebfn giao di\u1ec7n tr\u1ef1c quan v\u00e0 hi\u1ec7n \u0111\u1ea1i. MagicOS kh\u00f4ng ch\u1ec9 c\u1ea3i thi\u1ec7n t\u1ed1c \u0111\u1ed9 x\u1eed l\u00fd m\u00e0 c\u00f2n t\u00edch h\u1ee3p nhi\u1ec1u t\u00ednh n\u0103ng th\u00f4ng minh nh\u01b0 t\u1ed1i \u01b0u h\u00f3a t\u00e0i nguy\u00ean, t\u0103ng c\u01b0\u1eddng b\u1ea3o m\u1eadt v\u00e0 h\u1ed7 tr\u1ee3 \u0111a nhi\u1ec7m m\u01b0\u1ee3t m\u00e0. B\u1ed9 vi x\u1eed l\u00fd Snapdragon 680 v\u1edbi 8 nh\u00e2n, g\u1ed3m 4 l\u00f5i hi\u1ec7u n\u0103ng Cortex-A73 ch\u1ea1y \u1edf t\u1ed1c \u0111\u1ed9 2.4GHz v\u00e0 4 l\u00f5i ti\u1ebft ki\u1ec7m \u0111i\u1ec7n Cortex-A53 \u1edf t\u1ed1c \u0111\u1ed9 1.9GHz, mang l\u1ea1i kh\u1ea3 n\u0103ng x\u1eed l\u00fd nhanh ch\u00f3ng v\u00e0 ti\u1ebft ki\u1ec7m n\u0103ng l\u01b0\u1ee3ng. Nh\u1edd v\u1eady, thi\u1ebft b\u1ecb c\u00f3 th\u1ec3 ch\u1ea1y m\u01b0\u1ee3t m\u00e0 nhi\u1ec1u \u1ee9ng d\u1ee5ng \u0111\u1ed3ng th\u1eddi, t\u1eeb c\u00e1c tr\u00f2 ch\u01a1i n\u1eb7ng \u0111\u1ebfn c\u00e1c \u1ee9ng d\u1ee5ng ch\u1ec9nh s\u1eeda \u1ea3nh hay video. D\u00f9 ch\u01b0a \u0111\u01b0\u1ee3c c\u1eadp nh\u1eadt th\u00f4ng s\u1ed1 GPU, kh\u1ea3 n\u0103ng x\u1eed l\u00fd \u0111\u1ed3 h\u1ecda c\u1ee7a m\u00e1y c\u0169ng \u0111\u1ee7 \u0111\u00e1p \u1ee9ng c\u00e1c nhu c\u1ea7u t\u1eeb c\u01a1 b\u1ea3n \u0111\u1ebfn trung c\u1ea5p. M\u00e1y t\u00ednh b\u1ea3ng Honor Pad X8a c\u00f3 dung l\u01b0\u1ee3ng b\u1ed9 nh\u1edb l\u1edbn \u0111\u1ea3m b\u1ea3o l\u01b0u tr\u1eef d\u1eef li\u1ec7u to\u00e0n di\u1ec7n Honor Pad X8a s\u1edf h\u1eefu RAM 4GB, \u0111\u1ee7 d\u00f9ng cho c\u00e1c t\u00e1c v\u1ee5 \u0111a nhi\u1ec7m nh\u01b0 duy\u1ec7t web, xem video v\u00e0 s\u1eed d\u1ee5ng \u0111\u1ed3ng th\u1eddi nhi\u1ec1u \u1ee9ng d\u1ee5ng. V\u1edbi b\u1ed9 nh\u1edb trong 128GB, ng\u01b0\u1eddi d\u00f9ng c\u00f3 kh\u00f4ng gian l\u01b0u tr\u1eef tho\u1ea3i m\u00e1i cho t\u00e0i li\u1ec7u, h\u00ecnh \u1ea3nh, video v\u00e0 \u1ee9ng d\u1ee5ng. N\u1ebfu nhu c\u1ea7u l\u01b0u tr\u1eef cao h\u01a1n, thi\u1ebft b\u1ecb c\u00f3 kh\u1ea3 n\u0103ng h\u1ed7 tr\u1ee3 th\u1ebb nh\u1edb ngo\u00e0i (\u0111ang c\u1eadp nh\u1eadt chi ti\u1ebft), gi\u00fap m\u1edf r\u1ed9ng dung l\u01b0\u1ee3ng m\u00e0 kh\u00f4ng ph\u1ea3i lo l\u1eafng v\u1ec1 vi\u1ec7c x\u00f3a b\u1edbt d\u1eef li\u1ec7u. \u0110\u1eb7c bi\u1ec7t, Honor Pad X8a c\u00f2n t\u00edch h\u1ee3p c\u00f4ng ngh\u1ec7 m\u1edf r\u1ed9ng RAM \u1ea3o, s\u1eed d\u1ee5ng b\u1ed9 nh\u1edb trong \u0111\u1ec3 t\u1ea1o th\u00eam dung l\u01b0\u1ee3ng RAM khi c\u1ea7n thi\u1ebft, c\u1ea3i thi\u1ec7n hi\u1ec7u su\u1ea5t khi ch\u1ea1y c\u00e1c \u1ee9ng d\u1ee5ng n\u1eb7ng. H\u1ec7 th\u1ed1ng camera chuy\u00ean nghi\u1ec7p v\u1edbi nhi\u1ec1u t\u00ednh n\u0103ng h\u1ed7 tr\u1ee3 ch\u1ee5p \u1ea3nh \u0111a d\u1ea1ng M\u00e1y t\u00ednh b\u1ea3ng Honor Pad X8a \u0111\u01b0\u1ee3c trang b\u1ecb camera sau v\u00e0 tr\u01b0\u1edbc \u0111\u1ec1u c\u00f3 \u0111\u1ed9 ph\u00e2n gi\u1ea3i 5MP, \u0111\u1ee7 \u0111\u1ec3 \u0111\u00e1p \u1ee9ng nhu c\u1ea7u ch\u1ee5p \u1ea3nh c\u01a1 b\u1ea3n v\u00e0 g\u1ecdi video. Camera sau h\u1ed7 tr\u1ee3 c\u00e1c ch\u1ebf \u0111\u1ed9 nh\u01b0 HDR, ch\u1ee5p time-lapse v\u00e0 ch\u1ebf \u0111\u1ed9 Beauty, gi\u00fap ng\u01b0\u1eddi d\u00f9ng t\u1ea1o ra nh\u1eefng b\u1ee9c \u1ea3nh v\u00e0 video \u0111\u1eb9p m\u1eaft ngay c\u1ea3 trong \u0111i\u1ec1u ki\u1ec7n \u00e1nh s\u00e1ng kh\u00f4ng l\u00fd t\u01b0\u1edfng. Camera tr\u01b0\u1edbc c\u0169ng kh\u00f4ng k\u00e9m ph\u1ea7n n\u1ed5i b\u1eadt v\u1edbi c\u00e1c t\u00ednh n\u0103ng nh\u01b0 h\u1eb9n gi\u1edd ch\u1ee5p \u1ea3nh v\u00e0 ph\u1ea3n chi\u1ebfu selfie, l\u00fd t\u01b0\u1edfng cho nh\u1eefng ng\u01b0\u1eddi th\u00edch ch\u1ee5p \u1ea3nh t\u1ef1 s\u01b0\u1edbng ho\u1eb7c tham gia c\u00e1c cu\u1ed9c h\u1ecdp tr\u1ef1c tuy\u1ebfn. M\u1eb7c d\u00f9 kh\u00f4ng t\u1eadp trung v\u00e0o nhi\u1ebfp \u1ea3nh chuy\u00ean nghi\u1ec7p, Honor Pad X8a v\u1eabn \u0111\u00e1p \u1ee9ng t\u1ed1t nhu c\u1ea7u quay phim, ch\u1ee5p \u1ea3nh h\u00e0ng ng\u00e0y v\u1edbi ch\u1ea5t l\u01b0\u1ee3ng \u1ed5n \u0111\u1ecbnh. C\u00e1c k\u1ebft n\u1ed1i ti\u00eau chu\u1ea9n \u0111a d\u1ea1ng v\u00e0 th\u1eddi l\u01b0\u1ee3ng pin v\u01b0\u1ee3t tr\u1ed9i Dung l\u01b0\u1ee3ng pin \u1ea5n t\u01b0\u1ee3ng 8300 mAh l\u00e0 m\u1ed9t trong nh\u1eefng \u01b0u \u0111i\u1ec3m n\u1ed5i b\u1eadt c\u1ee7a Honor Pad X8a. V\u1edbi vi\u00ean pin n\u00e0y, thi\u1ebft b\u1ecb c\u00f3 th\u1ec3 ho\u1ea1t \u0111\u1ed9ng li\u00ean t\u1ee5c trong c\u1ea3 ng\u00e0y d\u00e0i, ph\u00f9 h\u1ee3p cho nh\u1eefng ng\u01b0\u1eddi th\u01b0\u1eddng xuy\u00ean di chuy\u1ec3n ho\u1eb7c kh\u00f4ng c\u00f3 \u0111i\u1ec1u ki\u1ec7n s\u1ea1c th\u01b0\u1eddng xuy\u00ean. Theo \u0111\u00e1nh gi\u00e1, m\u00e1y t\u00ednh b\u1ea3ng Honor Pad X8a c\u00f3 th\u1ec3 \u0111\u00e1p \u1ee9ng kho\u1ea3ng 10-12 gi\u1edd xem video li\u00ean t\u1ee5c ho\u1eb7c h\u01a1n 7 gi\u1edd s\u1eed d\u1ee5ng c\u00e1c t\u00e1c v\u1ee5 h\u1ed7n h\u1ee3p. Honor Pad X8a c\u00f2n h\u1ed7 tr\u1ee3 c\u00f4ng ngh\u1ec7 s\u1ea1c t\u1ed1i \u0111a 10W, gi\u00fap ng\u01b0\u1eddi d\u00f9ng nhanh ch\u00f3ng n\u1ea1p l\u1ea1i n\u0103ng l\u01b0\u1ee3ng m\u00e0 kh\u00f4ng c\u1ea7n ch\u1edd \u0111\u1ee3i qu\u00e1 l\u00e2u. Lo\u1ea1i pin Lithium-ion kh\u00f4ng ch\u1ec9 b\u1ec1n b\u1ec9 m\u00e0 c\u00f2n \u0111\u1ea3m b\u1ea3o an to\u00e0n trong qu\u00e1 tr\u00ecnh s\u1ea1c, gi\u00fap thi\u1ebft b\u1ecb duy tr\u00ec hi\u1ec7u su\u1ea5t l\u00e2u d\u00e0i. Honor Pad X8a \u0111i k\u00e8m v\u1edbi c\u00e1c k\u1ebft n\u1ed1i hi\u1ec7n \u0111\u1ea1i nh\u01b0 WiFi dual-band, h\u1ed7 tr\u1ee3 c\u1ea3 b\u0103ng t\u1ea7n 2.4GHz v\u00e0 5GHz, mang l\u1ea1i t\u1ed1c \u0111\u1ed9 m\u1ea1ng \u1ed5n \u0111\u1ecbnh cho c\u00e1c ho\u1ea1t \u0111\u1ed9ng tr\u1ef1c tuy\u1ebfn nh\u01b0 xem video, h\u1ecdc t\u1eadp v\u00e0 h\u1ecdp tr\u1ef1c tuy\u1ebfn. Bluetooth v5.1 cho ph\u00e9p k\u1ebft n\u1ed1i nhanh ch\u00f3ng v\u1edbi c\u00e1c thi\u1ebft b\u1ecb ngo\u1ea1i vi nh\u01b0 tai nghe, loa ho\u1eb7c b\u00e0n ph\u00edm kh\u00f4ng d\u00e2y. Ngo\u00e0i ra, m\u00e1y c\u00f2n h\u1ed7 tr\u1ee3 OTG (On-The-Go), gi\u00fap k\u1ebft n\u1ed1i d\u1ec5 d\u00e0ng v\u1edbi USB ho\u1eb7c c\u00e1c thi\u1ebft b\u1ecb l\u01b0u tr\u1eef kh\u00e1c \u0111\u1ec3 truy\u1ec1n d\u1eef li\u1ec7u nhanh ch\u00f3ng. C\u1ed5ng Type-C \u0111a n\u0103ng kh\u00f4ng ch\u1ec9 ph\u1ee5c v\u1ee5 s\u1ea1c m\u00e0 c\u00f2n t\u00edch h\u1ee3p ch\u1ee9c n\u0103ng k\u1ebft n\u1ed1i tai nghe, thay th\u1ebf cho jack 3.5mm truy\u1ec1n th\u1ed1ng. \u0110i\u1ec1u n\u00e0y gi\u00fap m\u00e1y v\u1eeba hi\u1ec7n \u0111\u1ea1i v\u1eeba \u0111\u00e1p \u1ee9ng t\u1ed1t nhu c\u1ea7u s\u1eed d\u1ee5ng \u0111a d\u1ea1ng. M\u00e1y t\u00ednh b\u1ea3ng Honor Pad X8a s\u1edf h\u1eefu thi\u1ebft k\u1ebf g\u1ecdn nh\u1eb9 c\u00f9ng nhi\u1ec1u t\u00ednh n\u0103ng ti\u1ec7n \u00edch n\u00e2ng cao Thi\u1ebft k\u1ebf c\u1ee7a Honor Pad X8a \u0111\u01b0\u1ee3c t\u1ed1i \u01b0u h\u00f3a \u0111\u1ec3 mang l\u1ea1i tr\u1ea3i nghi\u1ec7m s\u1eed d\u1ee5ng tho\u1ea3i m\u00e1i nh\u1ea5t. V\u1edbi k\u00edch th\u01b0\u1edbc 256,91 x 168,46 x 7,25 mm v\u00e0 tr\u1ecdng l\u01b0\u1ee3ng ch\u1ec9 495 g, m\u00e1y nh\u1eb9 v\u00e0 d\u1ec5 c\u1ea7m n\u1eafm, ph\u00f9 h\u1ee3p cho ng\u01b0\u1eddi d\u00f9ng th\u01b0\u1eddng xuy\u00ean di chuy\u1ec3n. L\u1edbp v\u1ecf ngo\u00e0i \u0111\u01b0\u1ee3c ho\u00e0n thi\u1ec7n t\u1ec9 m\u1ec9 v\u1edbi ch\u1ea5t li\u1ec7u cao c\u1ea5p, kh\u00f4ng ch\u1ec9 mang l\u1ea1i c\u1ea3m gi\u00e1c ch\u1eafc ch\u1eafn m\u00e0 c\u00f2n t\u0103ng t\u00ednh th\u1ea9m m\u1ef9. V\u1edbi s\u1ef1 k\u1ebft h\u1ee3p gi\u1eefa thi\u1ebft k\u1ebf tinh t\u1ebf v\u00e0 tr\u1ecdng l\u01b0\u1ee3ng nh\u1eb9, Honor Pad X8a d\u1ec5 d\u00e0ng tr\u1edf th\u00e0nh ng\u01b0\u1eddi b\u1ea1n \u0111\u1ed3ng h\u00e0nh l\u00fd t\u01b0\u1edfng trong m\u1ecdi ho\u1ea1t \u0111\u1ed9ng h\u00e0ng ng\u00e0y. Honor Pad X8a kh\u00f4ng ch\u1ec9 s\u1edf h\u1eefu c\u1ea5u h\u00ecnh m\u1ea1nh m\u1ebd m\u00e0 c\u00f2n \u0111i k\u00e8m v\u1edbi nhi\u1ec1u t\u00ednh n\u0103ng \u0111\u1ed9c \u0111\u00e1o. H\u1ec7 th\u1ed1ng \u00e2m thanh Hi-Res Audio v\u1edbi 4 loa mang l\u1ea1i tr\u1ea3i nghi\u1ec7m \u00e2m thanh s\u1ed1ng \u0111\u1ed9ng, l\u00fd t\u01b0\u1edfng cho nh\u1eefng ng\u01b0\u1eddi y\u00eau th\u00edch nghe nh\u1ea1c, xem phim ho\u1eb7c ch\u01a1i game. T\u00ednh n\u0103ng \u0111a c\u1eeda s\u1ed5 cho ph\u00e9p ng\u01b0\u1eddi d\u00f9ng ch\u1ea1y song song nhi\u1ec1u \u1ee9ng d\u1ee5ng, h\u1ed7 tr\u1ee3 t\u1ed1i \u0111a trong c\u00f4ng vi\u1ec7c v\u00e0 h\u1ecdc t\u1eadp. Ngo\u00e0i ra, Google Kids Space \u0111\u01b0\u1ee3c t\u00edch h\u1ee3p s\u1eb5n, t\u1ea1o m\u00f4i tr\u01b0\u1eddng h\u1ecdc t\u1eadp v\u00e0 gi\u1ea3i tr\u00ed an to\u00e0n cho tr\u1ebb nh\u1ecf. \u0110\u00e2y l\u00e0 l\u1ef1a ch\u1ecdn l\u00fd t\u01b0\u1edfng cho c\u00e1c gia \u0111\u00ecnh c\u00f3 tr\u1ebb em c\u1ea7n m\u1ed9t thi\u1ebft b\u1ecb c\u00f4ng ngh\u1ec7 v\u1eeba hi\u1ec7n \u0111\u1ea1i v\u1eeba an to\u00e0n. Nh\u00ecn chung, m\u00e1y t\u00ednh b\u1ea3ng Honor Pad X8a l\u00e0 m\u1ed9t s\u1ea3n ph\u1ea9m to\u00e0n di\u1ec7n v\u1edbi m\u1ee9c gi\u00e1 ph\u1ea3i ch\u0103ng, ph\u00f9 h\u1ee3p cho nhi\u1ec1u \u0111\u1ed1i t\u01b0\u1ee3ng ng\u01b0\u1eddi d\u00f9ng t\u1eeb h\u1ecdc sinh, sinh vi\u00ean \u0111\u1ebfn nh\u00e2n vi\u00ean v\u0103n ph\u00f2ng. V\u1edbi m\u00e0n h\u00ecnh l\u1edbn, hi\u1ec7u n\u0103ng m\u1ea1nh m\u1ebd v\u00e0 dung l\u01b0\u1ee3ng pin \u1ea5n t\u01b0\u1ee3ng, s\u1ea3n ph\u1ea9m n\u00e0y kh\u00f4ng ch\u1ec9 \u0111\u00e1p \u1ee9ng t\u1ed1t nhu c\u1ea7u c\u00f4ng vi\u1ec7c m\u00e0 c\u00f2n mang l\u1ea1i tr\u1ea3i nghi\u1ec7m gi\u1ea3i tr\u00ed v\u01b0\u1ee3t tr\u1ed9i. N\u1ebfu b\u1ea1n \u0111ang t\u00ecm ki\u1ebfm m\u1ed9t chi\u1ebfc m\u00e1y t\u00ednh b\u1ea3ng hi\u1ec7n \u0111\u1ea1i, \u0111a n\u0103ng v\u00e0 \u0111\u00e1ng tin c\u1eady, Honor Pad X8a ch\u1eafc ch\u1eafn l\u00e0 m\u1ed9t l\u1ef1a ch\u1ecdn kh\u00f4ng th\u1ec3 b\u1ecf qua. Th\u1eddi \u0111i\u1ec3m ra m\u1eaft M\u00e1y t\u00ednh b\u1ea3ng Honor Pad X8a (4GB/128GB) Honor Pad X8A (4GB/128GB) \u0111\u01b0\u1ee3c c\u00f4ng b\u1ed1 ch\u00ednh th\u1ee9c v\u00e0o ng\u00e0y th\u00e1ng 12 n\u0103m 2024 , \u0111\u00e1nh d\u1ea5u m\u1ed9t b\u01b0\u1edbc ti\u1ebfn \u0111\u1ed9t ph\u00e1 cho d\u00f2ng m\u00e1y t\u00ednh \u0111\u1ec3 b\u00e0n v\u1edbi thi\u1ebft k\u1ebf nh\u1ecf g\u1ecdn nh\u01b0ng m\u1ea1nh m\u1ebd. Ngo\u00e0i chip Snapdragon 680 v\u1edbi 8 nh\u00e2n ti\u00ean ti\u1ebfn c\u00f9ng c\u00e1c t\u00ednh n\u0103ng ch\u1ee5p \u1ea3nh hi\u1ec7n \u0111\u1ea1i, thi\u1ebft b\u1ecb n\u00e0y c\u00f2n t\u00edch h\u1ee3p b\u1ed9 nh\u1edb 128GB, mang \u0111\u1ebfn hi\u1ec7u n\u0103ng v\u01b0\u1ee3t tr\u1ed9i v\u00e0 kh\u1ea3 n\u0103ng x\u1eed l\u00fd m\u01b0\u1ee3t m\u00e0, \u0111\u1eb7c bi\u1ec7t l\u00fd t\u01b0\u1edfng cho c\u00e1c t\u00e1c v\u1ee5 \u0111\u1ed3 h\u1ecda v\u00e0 s\u00e1ng t\u1ea1o n\u1ed9i dung. Gi\u00e1 b\u00e1n tham kh\u1ea3o c\u1ee7a M\u00e1y t\u00ednh b\u1ea3ng Honor Pad X8a (4GB/128GB) Hi\u1ec7n t\u1ea1i, Honor Pad X8A (4GB/128GB) \u0111ang \u0111\u01b0\u1ee3c ph\u00e2n ph\u1ed1i t\u1ea1i Ho\u00e0ng H\u00e0 Mobile v\u1edbi m\u1ee9c gi\u00e1 h\u1ea5p d\u1eabn (l\u01b0u \u00fd r\u1eb1ng gi\u00e1 b\u00e1n c\u00f3 th\u1ec3 thay \u0111\u1ed5i t\u00f9y thu\u1ed9c v\u00e0o th\u1eddi \u0111i\u1ec3m ho\u1eb7c c\u00e1c ch\u01b0\u01a1ng tr\u00ecnh khuy\u1ebfn m\u00e3i hi\u1ec7n h\u00e0nh). S\u1ea3n ph\u1ea9m s\u1edf h\u1eefu c\u1ea5u h\u00ecnh v\u01b0\u1ee3t tr\u1ed9i, \u0111\u00e1p \u1ee9ng hi\u1ec7u qu\u1ea3 c\u1ea3 nhu c\u1ea7u c\u00f4ng vi\u1ec7c l\u1eabn gi\u1ea3i tr\u00ed, mang \u0111\u1ebfn hi\u1ec7u su\u1ea5t \u1ea5n t\u01b0\u1ee3ng trong m\u1ed9t thi\u1ebft k\u1ebf nh\u1ecf g\u1ecdn, ph\u00f9 h\u1ee3p cho t\u00e1c v\u1ee5 l\u00e0m vi\u1ec7c hi\u1ec7n \u0111\u1ea1i. V\u1edbi phong c\u00e1ch tinh t\u1ebf c\u00f9ng hi\u1ec7u n\u0103ng xu\u1ea5t s\u1eafc, \u0111\u00e2y l\u00e0 l\u1ef1a ch\u1ecdn l\u00fd t\u01b0\u1edfng cho ng\u01b0\u1eddi d\u00f9ng c\u1ea7n m\u1ed9t chi\u1ebfc tablet ch\u1ea5t l\u01b0\u1ee3ng cao, \u0111\u1ee7 m\u1ea1nh m\u1ebd \u0111\u1ec3 x\u1eed l\u00fd t\u1eeb c\u00e1c t\u00e1c v\u1ee5 \u0111\u01a1n gi\u1ea3n \u0111\u1ebfn ph\u1ee9c t\u1ea1p. \u0110\u1ec3 bi\u1ebft th\u00eam chi ti\u1ebft ho\u1eb7c c\u1eadp nh\u1eadt c\u00e1c ch\u01b0\u01a1ng tr\u00ecnh \u01b0u \u0111\u00e3i m\u1edbi nh\u1ea5t, kh\u00e1ch h\u00e0ng c\u00f3 th\u1ec3 li\u00ean h\u1ec7 v\u1edbi Ho\u00e0ng H\u00e0 Mobile qua hotline 1900 2091. Mua M\u00e1y t\u00ednh b\u1ea3ng Honor Pad X8a (4GB/128GB) ch\u00ednh h\u00e3ng t\u1ea1i Ho\u00e0ng H\u00e0 Mobile Honor Pad X8a l\u00e0 m\u1ed9t s\u1ea3n ph\u1ea9m v\u01b0\u1ee3t tr\u1ed9i v\u1edbi hi\u1ec7u n\u0103ng m\u1ea1nh m\u1ebd, t\u00ednh linh ho\u1ea1t cao v\u00e0 thi\u1ebft k\u1ebf hi\u1ec7n \u0111\u1ea1i. \u0110\u00e2y l\u00e0 thi\u1ebft b\u1ecb l\u00fd t\u01b0\u1edfng kh\u00f4ng ch\u1ec9 cho c\u00f4ng vi\u1ec7c v\u00e0 h\u1ecdc t\u1eadp m\u00e0 c\u00f2n mang l\u1ea1i tr\u1ea3i nghi\u1ec7m gi\u1ea3i tr\u00ed tuy\u1ec7t v\u1eddi, tr\u1edf th\u00e0nh l\u1ef1a ch\u1ecdn h\u00e0ng \u0111\u1ea7u cho nh\u1eefng ng\u01b0\u1eddi y\u00eau th\u00edch c\u00f4ng ngh\u1ec7. Ho\u00e0ng H\u00e0 Mobile, m\u1ed9t trong nh\u1eefng nh\u00e0 b\u00e1n l\u1ebb c\u00f4ng ngh\u1ec7 uy t\u00edn t\u1ea1i Vi\u1ec7t Nam, cung c\u1ea5p s\u1ea3n ph\u1ea9m m\u00e1y t\u00ednh b\u1ea3ng Honor Pad X8a (4GB/128GB) ch\u00ednh h\u00e3ng v\u1edbi nhi\u1ec1u \u01b0u \u0111\u00e3i h\u1ea5p d\u1eabn. Kh\u00e1ch h\u00e0ng khi mua s\u1ea3n ph\u1ea9m t\u1ea1i \u0111\u00e2y s\u1ebd \u0111\u01b0\u1ee3c h\u01b0\u1edfng c\u00e1c quy\u1ec1n l\u1ee3i v\u01b0\u1ee3t tr\u1ed9i, bao g\u1ed3m ch\u00ednh s\u00e1ch b\u1ea3o h\u00e0nh t\u1eadn t\u00e2m v\u00e0 \u0111\u00e1ng tin c\u1eady, cam k\u1ebft s\u1ea3n ph\u1ea9m 100% ch\u00ednh h\u00e3ng, d\u1ecbch v\u1ee5 giao h\u00e0ng mi\u1ec5n ph\u00ed tr\u00ean to\u00e0n qu\u1ed1c, c\u00f9ng h\u1ed7 tr\u1ee3 tr\u1ea3 g\u00f3p v\u1edbi l\u00e3i su\u1ea5t \u01b0u \u0111\u00e3i v\u00e0 k\u1ef3 h\u1ea1n linh ho\u1ea1t. \u0110\u1ed9i ng\u0169 t\u01b0 v\u1ea5n vi\u00ean chuy\u00ean nghi\u1ec7p v\u00e0 nhi\u1ec7t t\u00ecnh lu\u00f4n s\u1eb5n s\u00e0ng h\u1ed7 tr\u1ee3 kh\u00e1ch h\u00e0ng t\u1eeb kh\u00e2u l\u1ef1a ch\u1ecdn s\u1ea3n ph\u1ea9m \u0111\u1ebfn h\u1eadu m\u00e3i. V\u1edbi s\u1ee9 m\u1ec7nh mang \u0111\u1ebfn s\u1ea3n ph\u1ea9m v\u00e0 d\u1ecbch v\u1ee5 ch\u1ea5t l\u01b0\u1ee3ng cao, Ho\u00e0ng H\u00e0 Mobile kh\u00f4ng ng\u1eebng c\u1ea3i thi\u1ec7n tr\u1ea3i nghi\u1ec7m mua s\u1eafm \u0111\u1ec3 \u0111\u00e1p \u1ee9ng t\u1ed1i \u0111a nhu c\u1ea7u c\u1ee7a ng\u01b0\u1eddi ti\u00eau d\u00f9ng trong l\u0129nh v\u1ef1c c\u00f4ng ngh\u1ec7. Xem to\u00e0n b\u1ed9 b\u00e0i vi\u1ebft",
        "promotion_1": "1. Tr\u00fang 8386 qu\u00e0 - T\u1ed5ng gi\u00e1 tr\u1ecb t\u1edbi 250 TRI\u1ec6U \u0110\u1ed2NG (\u00c1p d\u1ee5ng t\u1eeb 10/01 - 02/02/2025). (Xem chi ti\u1ebft). 2. \u0110\u1eb7c bi\u1ec7t Tr\u1ea3 g\u00f3p 3 kh\u00f4ng: 0% l\u00e3i su\u1ea5t - 0 ph\u00ed chuy\u1ec3n \u0111\u1ed5i - 0 tr\u1ea3 tr\u01b0\u1edbc (\u00c1p d\u1ee5ng cho c\u00f4ng ty t\u00e0i ch\u00ednh v\u00e0 th\u1ebb t\u00edn d\u1ee5ng)",
        "promotion_2": "1. Thu c\u0169 \u0111\u1ed5i m\u1edbi l\u00ean \u0111\u1eddi \u0111i\u1ec7n tho\u1ea1i Android & M\u00e1y t\u00ednh b\u1ea3ng, ti\u1ebft ki\u1ec7m t\u1edbi 20 tri\u1ec7u \u0111\u1ed3ng. (Xem chi ti\u1ebft). 2. Gi\u1ea3m 50% t\u1ed1i \u0111a 700.000\u0111 khi m\u1edf th\u1ebb t\u00edn d\u1ee5ng Vpbank tr\u00ean SenID. (Xem chi ti\u1ebft). 3. Gi\u1ea3m t\u1edbi 500.000\u0111 khi thanh to\u00e1n th\u1ebb t\u00edn d\u1ee5ng NCB. (Xem chi ti\u1ebft). 4. Gi\u1ea3m \u0111\u1ebfn 150.000\u0111 khi thanh to\u00e1n qua Muadee. (Xem chi ti\u1ebft). 5. Mi\u1ec5n ph\u00ed chuy\u1ec3n \u0111\u1ed5i tr\u1ea3 g\u00f3p ho\u1eb7c gi\u1ea3m \u0111\u1ebfn 500.000\u0111 khi m\u1edf th\u1ebb TPBank EVO. (Xem chi ti\u1ebft). 6. M\u1edf th\u1ebb t\u00edn d\u1ee5ng VIB - Nh\u1eadn Voucher 600.000\u0111. (Xem chi ti\u1ebft). 7. Gi\u1ea3m th\u00eam t\u1edbi 1 tri\u1ec7u \u0111\u1ed9ng khi tham gia Thu c\u0169 - L\u00ean \u0111\u1eddi \u0111i\u1ec7n tho\u1ea1i Android. (Xem chi ti\u1ebft). 8. Gi\u1ea3m th\u00eam 100.000\u0111 cho t\u1ea5t c\u1ea3 c\u00e1c s\u1ea3n ph\u1ea9m m\u00e0n h\u00ecnh khi mua k\u00e8m Laptop, MacBook, M\u00e1y t\u00ednh b\u1ea3ng v\u00e0 \u0110i\u1ec7n tho\u1ea1i.. 9. T\u1eb7ng mi\u1ec5n ph\u00ed ph\u00f4i sim khi mua \u0111i\u1ec7n tho\u1ea1i, m\u00e1y t\u00ednh b\u1ea3ng, laptop ho\u1eb7c ph\u1ee5 ki\u1ec7n t\u1ea1i Ho\u00e0ng H\u00e0 Mobile. (Xem chi ti\u1ebft). 10. M\u1edf th\u1ebb HSBC - Ho\u00e0n ti\u1ec1n t\u1edbi 2 tri\u1ec7u \u0111\u1ed3ng. (Xem chi ti\u1ebft)"
    },
    {
        "title": "Honor Pad X9 (4+128GB) - Ch\u00ednh h\u00e3ng",
        "price": "gi\u00e1 hi\u1ec7n t\u1ea1i l\u00e0 3,890,000 \u20ab nh\u01b0ng tr\u01b0\u1edbc \u0111\u00e2y n\u00f3 c\u00f3 gi\u00e1 l\u00e0 4,990,000 \u20ab",
        "colors": "X\u00e1m",
        "technical_specifications": [
            {
                "C\u00f4ng ngh\u1ec7 m\u00e0n h\u00ecnh": "TFT LCD"
            },
            {
                "H\u1ec7 \u0111i\u1ec1u h\u00e0nh": "Android 13"
            },
            {
                "Chip x\u1eed l\u00fd (CPU)": "Snapdragon 685 8 nh\u00e2n"
            },
            {
                "T\u1ed1c \u0111\u1ed9 CPU": "4 nh\u00e2n 2.8 GHz & 4 nh\u00e2n 1.9 GHz"
            },
            {
                "Chip \u0111\u1ed3 ho\u1ea1 (GPU)": "Adreno 610"
            },
            {
                "RAM": "4 GB"
            },
            {
                "WiFi": "Wi-Fi 802.11 a/b/g/n/ac. Dual-band"
            },
            {
                "Bluetooth": "v5.1"
            },
            {
                "K\u00edch th\u01b0\u1edbc": "267.3 x 167.4 x 6.9 mm"
            },
            {
                "Tr\u1ecdng l\u01b0\u1ee3ng": "495 g"
            },
            {
                "B\u1ed9 nh\u1edb trong": "128GB"
            },
            {
                "B\u1ed9 nh\u1edb c\u00f2n l\u1ea1i (kh\u1ea3 d\u1ee5ng)": "115 GB"
            }
        ],
        "description": "HONOR Pad X9 l\u00e0 chi\u1ebfc m\u00e1y t\u00ednh b\u1ea3ng hi\u1ec7n \u0111\u1ea1i v\u1edbi thi\u1ebft k\u1ebf tinh t\u1ebf, t\u00edch h\u1ee3p nhi\u1ec1u t\u00ednh n\u0103ng v\u01b0\u1ee3t tr\u1ed9i ph\u00f9 h\u1ee3p cho c\u1ea3 c\u00f4ng vi\u1ec7c v\u00e0 gi\u1ea3i tr\u00ed. \u0110i\u1ec3m nh\u1ea5n c\u1ee7a HONOR Pad X9 ch\u00ednh l\u00e0 m\u00e0n h\u00ecnh 11.5 inch , h\u1ec7 \u0111i\u1ec1u h\u00e0nh Android 13 v\u00e0 kh\u1ea3 n\u0103ng x\u1eed l\u00fd m\u1ea1nh m\u1ebd nh\u1edd chip Snapdragon 685 . Ngo\u00e0i ra, s\u1ea3n ph\u1ea9m n\u00e0y c\u00f2n s\u1edf h\u1eefu dung l\u01b0\u1ee3ng pin l\u1edbn 7250mAh c\u00f9ng c\u00f4ng ngh\u1ec7 s\u1ea1c nhanh , mang \u0111\u1ebfn th\u1eddi gian s\u1eed d\u1ee5ng l\u00e2u d\u00e0i v\u00e0 thu\u1eadn ti\u1ec7n. V\u1edbi m\u1ee9c gi\u00e1 h\u1ee3p l\u00fd, s\u1ea3n ph\u1ea9m n\u00e0y h\u01b0\u1edbng \u0111\u1ebfn \u0111\u1ed1i t\u01b0\u1ee3ng ng\u01b0\u1eddi d\u00f9ng mong mu\u1ed1n m\u1ed9t thi\u1ebft b\u1ecb m\u1ea1nh m\u1ebd nh\u01b0ng v\u1eabn gi\u1eef \u0111\u01b0\u1ee3c s\u1ef1 ti\u1ec7n l\u1ee3i v\u00e0 linh ho\u1ea1t. \u0110\u1eb7c \u0111i\u1ec3m n\u1ed5i b\u1eadt M\u00e0n h\u00ecnh l\u1edbn 11.5 inch hi\u1ec3n th\u1ecb s\u1eafc n\u00e9t v\u1edbi \u0111\u1ed9 ph\u00e2n gi\u1ea3i 2K, t\u1ea7n s\u1ed1 qu\u00e9t 120Hz v\u00e0 \u0111\u1ea1t chu\u1ea9n Fullview Display. Hi\u1ec7u n\u0103ng m\u1ea1nh m\u1ebd t\u1eeb chip Snapdragon 685 k\u1ebft h\u1ee3p RAM 4GB v\u00e0 b\u1ed9 nh\u1edb trong 128GB. Camera tr\u01b0\u1edbc v\u00e0 sau \u0111\u1ec1u c\u00f3 \u0111\u1ed9 ph\u00e2n gi\u1ea3i 5MP, h\u1ed7 tr\u1ee3 quay video FullHD. \u00c2m thanh s\u1ed1ng \u0111\u1ed9ng nh\u1edd h\u1ec7 th\u1ed1ng 6 loa c\u00f9ng c\u00f4ng ngh\u1ec7 HONOR Histen mang l\u1ea1i tr\u1ea3i nghi\u1ec7m \u00e2m thanh tuy\u1ec7t v\u1eddi. Pin kh\u1ee7ng 7250mAh c\u00f9ng h\u1ed7 tr\u1ee3 s\u1ea1c nhanh 22.5W, \u0111\u1ea3m b\u1ea3o th\u1eddi l\u01b0\u1ee3ng s\u1eed d\u1ee5ng d\u00e0i l\u00e2u. B\u1ea3ng th\u00f4ng s\u1ed1 c\u1ea5u h\u00ecnh c\u1ee7a m\u00e1y t\u00ednh b\u1ea3ng HONOR Pad X9 HONOR Pad X9 l\u00e0 m\u1ed9t l\u1ef1a ch\u1ecdn tuy\u1ec7t v\u1eddi cho nh\u1eefng ai t\u00ecm ki\u1ebfm m\u1ed9t chi\u1ebfc tablet v\u1edbi hi\u1ec7u n\u0103ng \u1ed5n \u0111\u1ecbnh, m\u00e0n h\u00ecnh s\u1eafc n\u00e9t v\u00e0 th\u1eddi l\u01b0\u1ee3ng pin d\u00e0i. S\u1ea3n ph\u1ea9m ph\u00f9 h\u1ee3p cho c\u1ea3 ng\u01b0\u1eddi d\u00f9ng c\u00e1 nh\u00e2n l\u1eabn doanh nghi\u1ec7p nh\u1edd s\u1ef1 k\u1ebft h\u1ee3p gi\u1eefa t\u00ednh n\u0103ng ti\u1ec7n \u00edch v\u00e0 thi\u1ebft k\u1ebf tinh t\u1ebf. Th\u00f4ng s\u1ed1 Chi ti\u1ebft M\u00e0n h\u00ecnh K\u00edch th\u01b0\u1edbc 11.5 inch \u0110\u1ed9 ph\u00e2n gi\u1ea3i 2K (2000x1200) T\u00ednh n\u0103ng Fullview Display TFT LCD (IPS) \u0110\u1ed9 s\u00e1ng t\u1ed1i \u0111a 400 nit T\u1ea7n s\u1ed1 qu\u00e9t 120Hz Hi\u1ec3n th\u1ecb 100%sRGB v\u00e0 1.07 t\u1ef7 m\u00e0u s\u1eafc \u0110\u01b0\u1ee3c ch\u1ee9ng nh\u1eadn T\u00dcV Rheinland v\u1ec1 t\u00ednh n\u0103ng ch\u1ed1ng nh\u1ea5p nh\u00e1y, \u00e1nh s\u00e1ng xanh th\u1ea5p Camera sau \u0110\u1ed9 ph\u00e2n gi\u1ea3i 5MP (f/2.2) Quay phim HD 720p@30fps FullHD 1080p@30fps T\u00ednh n\u0103ng B\u1ed9 l\u1ecdc m\u00e0u Zoom k\u1ef9 thu\u1eadt s\u1ed1 X\u00f3a ph\u00f4ng Tua nhanh th\u1eddi gian (Time\u2011lapse) Qu\u00e9t t\u00e0i li\u1ec7u Qu\u00e9t m\u00e3 QR L\u00e0m \u0111\u1eb9p HDR Ch\u1ee5p h\u1eb9n gi\u1edd Camera tr\u01b0\u1edbc \u0110\u1ed9 ph\u00e2n gi\u1ea3i 5MP (f/2.2) Quay phim HD 720p@30fps FullHD 1080p@30fps H\u1ec7 \u0111i\u1ec1u h\u00e0nh & CPU H\u1ec7 \u0111i\u1ec1u h\u00e0nh Android 13 Chipset Snapdragon 685 (6nm) CPU 8 nh\u00e2n (4 x 2.8GHz Cortex-A73 & 4 x 1.9GHz Cortex-A53) GPU Adreno 610 B\u1ed9 nh\u1edb & L\u01b0u tr\u1eef RAM 4GB B\u1ed9 nh\u1edb trong 128GB Th\u00f4ng s\u1ed1 kh\u00e1c \u00c2m thanh 1 micro 6 loa Hi\u1ec7u \u1ee9ng \u00e2m thanh HONOR Histen Ti\u1ec7n \u00edch kh\u00e1c \u0110a c\u1eeda s\u1ed5: C\u00f3 th\u1ec3 m\u1edf 4 \u1ee9ng d\u1ee5ng c\u00f9ng l\u00fac tr\u00ean m\u1ed9t m\u00e0n h\u00ecnh HONOR Connect: \u0110\u1ed3ng b\u1ed9 m\u00e0n h\u00ecnh v\u00e0 chia s\u1ebb tin nh\u1eafn tr\u00ean \u0111i\u1ec7n tho\u1ea1i v\u00e0 m\u00e1y t\u00ednh b\u1ea3ng \u0110\u00e1nh d\u1ea5u trang nhanh: Vu\u1ed1t nhanh xu\u1ed1ng b\u1eb1ng ba ng\u00f3n tay \u0111\u1ec3 \u0111\u00e1nh d\u1ea5u trang hi\u1ec7n t\u1ea1i K\u1ebft n\u1ed1i C\u1ed5ng k\u1ebft n\u1ed1i/s\u1ea1c USB Type-C Wi-Fi Wi-Fi 5, 802.11 a/b/g/n/ac Bluetooth 5.1 Thi\u1ebft k\u1ebf & Tr\u1ecdng l\u01b0\u1ee3ng Ch\u1ea5t li\u1ec7u Nh\u00f4m K\u00edch th\u01b0\u1edbc 267.3 x 167.4 x 6.9 mm Tr\u1ecdng l\u01b0\u1ee3ng 495g Pin & S\u1ea1c Lo\u1ea1i pin Li-Po Dung l\u01b0\u1ee3ng 7250mAh C\u00f4ng ngh\u1ec7 S\u1ea1c pin nhanh Ti\u1ebft ki\u1ec7m pin H\u1ed7 tr\u1ee3 s\u1ea1c t\u1ed1i \u0111a 22.5W \u0110\u00e1nh gi\u00e1 nh\u1eefng \u0111i\u1ec3m n\u1ed5i b\u1eadt c\u1ee7a m\u00e1y t\u00ednh b\u1ea3ng HONOR Pad X9 T\u1eebng chi ti\u1ebft trong thi\u1ebft k\u1ebf v\u00e0 t\u00ednh n\u0103ng c\u1ee7a HONOR Pad X9 \u0111\u1ec1u \u0111\u01b0\u1ee3c t\u1ed1i \u01b0u \u0111\u1ec3 mang l\u1ea1i s\u1ef1 h\u00e0i l\u00f2ng cao nh\u1ea5t cho ng\u01b0\u1eddi d\u00f9ng. S\u1ea3n ph\u1ea9m kh\u00f4ng ch\u1ec9 \u0111\u00e1p \u1ee9ng t\u1ed1t nhu c\u1ea7u c\u01a1 b\u1ea3n m\u00e0 c\u00f2n mang l\u1ea1i c\u00e1c tr\u1ea3i nghi\u1ec7m cao c\u1ea5p trong ph\u00e2n kh\u00fac m\u00e1y t\u00ednh b\u1ea3ng gi\u00e1 r\u1ebb. M\u00e0n h\u00ecnh s\u1eafc n\u00e9t v\u1edbi t\u1ea7n s\u1ed1 qu\u00e9t cao tr\u00ean HONOR Pad X9 HONOR Pad X9 n\u1ed5i b\u1eadt v\u1edbi m\u00e0n h\u00ecnh TFT LCD k\u00edch th\u01b0\u1edbc 11.5 inch , \u0111\u1ed9 ph\u00e2n gi\u1ea3i 2K (2000x1200) . \u0110i\u1ec1u n\u00e0y mang l\u1ea1i tr\u1ea3i nghi\u1ec7m h\u00ecnh \u1ea3nh ch\u1ea5t l\u01b0\u1ee3ng cao, v\u1edbi \u0111\u1ed9 s\u1eafc n\u00e9t v\u01b0\u1ee3t tr\u1ed9i, ph\u00f9 h\u1ee3p cho vi\u1ec7c xem phim, \u0111\u1ecdc t\u00e0i li\u1ec7u ho\u1eb7c ch\u1ec9nh s\u1eeda \u1ea3nh. T\u1ea7n s\u1ed1 qu\u00e9t 120Hz l\u00e0 m\u1ed9t \u0111i\u1ec3m s\u00e1ng trong ph\u00e2n kh\u00fac m\u00e1y t\u00ednh b\u1ea3ng gi\u00e1 r\u1ebb, gi\u00fap h\u00ecnh \u1ea3nh v\u00e0 chuy\u1ec3n \u0111\u1ed9ng tr\u00ean m\u00e0n h\u00ecnh tr\u1edf n\u00ean m\u01b0\u1ee3t m\u00e0 h\u01a1n, \u0111\u1eb7c bi\u1ec7t l\u00e0 khi ch\u01a1i game ho\u1eb7c l\u01b0\u1edbt web. M\u00e0n h\u00ecnh c\u00f2n \u0111\u01b0\u1ee3c t\u1ed1i \u01b0u h\u00f3a v\u1edbi \u0111\u1ed9 s\u00e1ng t\u1ed1i \u0111a 400 nit , \u0111\u1ee7 \u0111\u1ec3 hi\u1ec3n th\u1ecb t\u1ed1t trong c\u00e1c \u0111i\u1ec1u ki\u1ec7n \u00e1nh s\u00e1ng kh\u00e1c nhau, k\u1ec3 c\u1ea3 d\u01b0\u1edbi \u00e1nh s\u00e1ng m\u1ea1nh. \u0110\u1eb7c bi\u1ec7t, HONOR Pad X9 \u0111\u01b0\u1ee3c ch\u1ee9ng nh\u1eadn b\u1edfi T\u00dcV Rheinland v\u1ec1 kh\u1ea3 n\u0103ng ch\u1ed1ng nh\u1ea5p nh\u00e1y v\u00e0 gi\u1ea3m \u00e1nh s\u00e1ng xanh . \u0110\u00e2y l\u00e0 m\u1ed9t l\u1ee3i th\u1ebf l\u1edbn khi b\u1ea1n c\u1ea7n s\u1eed d\u1ee5ng m\u00e1y t\u00ednh b\u1ea3ng trong th\u1eddi gian d\u00e0i m\u00e0 kh\u00f4ng lo v\u1ec1 c\u00e1c v\u1ea5n \u0111\u1ec1 s\u1ee9c kh\u1ecfe li\u00ean quan \u0111\u1ebfn m\u1eaft. Ngo\u00e0i ra, kh\u1ea3 n\u0103ng hi\u1ec3n th\u1ecb 100% d\u1ea3i m\u00e0u sRGB v\u00e0 h\u1ed7 tr\u1ee3 1.07 t\u1ef7 m\u00e0u s\u1eafc gi\u00fap h\u00ecnh \u1ea3nh ch\u00e2n th\u1ef1c, s\u1ed1ng \u0111\u1ed9ng, ph\u00f9 h\u1ee3p cho c\u00e1c c\u00f4ng vi\u1ec7c \u0111\u00f2i h\u1ecfi \u0111\u1ed9 ch\u00ednh x\u00e1c m\u00e0u cao nh\u01b0 ch\u1ec9nh s\u1eeda \u1ea3nh ho\u1eb7c video. Hi\u1ec7u n\u0103ng v\u01b0\u1ee3t tr\u1ed9i v\u1edbi chip Snapdragon 685 S\u1ee9c m\u1ea1nh x\u1eed l\u00fd c\u1ee7a HONOR Pad X9 \u0111\u1ebfn t\u1eeb chip Snapdragon 685 , \u0111\u01b0\u1ee3c s\u1ea3n xu\u1ea5t tr\u00ean ti\u1ebfn tr\u00ecnh 6nm ti\u00ean ti\u1ebfn. CPU 8 nh\u00e2n c\u1ee7a m\u00e1y g\u1ed3m 4 l\u00f5i Cortex-A73 m\u1ea1nh m\u1ebd (xung nh\u1ecbp 2.8GHz) v\u00e0 4 l\u00f5i Cortex-A53 ti\u1ebft ki\u1ec7m n\u0103ng l\u01b0\u1ee3ng (xung nh\u1ecbp 1.9GHz), \u0111\u1ea3m b\u1ea3o c\u00e2n b\u1eb1ng gi\u1eefa hi\u1ec7u n\u0103ng v\u00e0 ti\u1ebft ki\u1ec7m n\u0103ng l\u01b0\u1ee3ng. GPU Adreno 610 mang l\u1ea1i kh\u1ea3 n\u0103ng x\u1eed l\u00fd \u0111\u1ed3 h\u1ecda t\u1ed1t, ph\u00f9 h\u1ee3p cho c\u00e1c t\u1ef1a game ph\u1ed5 th\u00f4ng ho\u1eb7c c\u00e1c t\u00e1c v\u1ee5 \u0111\u1ed3 h\u1ecda nh\u1eb9. B\u1ed9 nh\u1edb RAM 4GB h\u1ed7 tr\u1ee3 kh\u1ea3 n\u0103ng \u0111a nhi\u1ec7m hi\u1ec7u qu\u1ea3, trong khi dung l\u01b0\u1ee3ng l\u01b0u tr\u1eef 128GB cung c\u1ea5p kh\u00f4ng gian r\u1ed9ng r\u00e3i cho vi\u1ec7c l\u01b0u tr\u1eef d\u1eef li\u1ec7u, \u1ee9ng d\u1ee5ng v\u00e0 n\u1ed9i dung gi\u1ea3i tr\u00ed. H\u1ec7 \u0111i\u1ec1u h\u00e0nh Android 13 \u0111\u01b0\u1ee3c c\u00e0i s\u1eb5n tr\u00ean HONOR Pad X9 kh\u00f4ng ch\u1ec9 mang \u0111\u1ebfn giao di\u1ec7n tr\u1ef1c quan m\u00e0 c\u00f2n t\u1ed1i \u01b0u h\u00f3a hi\u1ec7u n\u0103ng v\u00e0 b\u1ea3o m\u1eadt. Nh\u1eefng b\u1ea3n c\u1eadp nh\u1eadt li\u00ean t\u1ee5c t\u1eeb HONOR gi\u00fap thi\u1ebft b\u1ecb duy tr\u00ec s\u1ef1 \u1ed5n \u0111\u1ecbnh v\u00e0 h\u1ed7 tr\u1ee3 l\u00e2u d\u00e0i. H\u1ec7 th\u1ed1ng \u00e2m thanh \u0111\u1ec9nh cao v\u1edbi 6 loa c\u1ee7a HONOR Pad X9 M\u1ed9t trong nh\u1eefng t\u00ednh n\u0103ng n\u1ed5i b\u1eadt c\u1ee7a HONOR Pad X9 l\u00e0 h\u1ec7 th\u1ed1ng \u00e2m thanh v\u1edbi 6 loa t\u00edch h\u1ee3p . C\u00f4ng ngh\u1ec7 \u00e2m thanh HONOR Histen mang l\u1ea1i ch\u1ea5t l\u01b0\u1ee3ng \u00e2m thanh s\u1ed1ng \u0111\u1ed9ng, v\u1edbi d\u1ea3i \u00e2m tr\u1ea7m s\u00e2u v\u00e0 \u00e2m cao r\u00f5 n\u00e9t. \u0110i\u1ec1u n\u00e0y l\u00e0m cho s\u1ea3n ph\u1ea9m tr\u1edf th\u00e0nh l\u1ef1a ch\u1ecdn l\u00fd t\u01b0\u1edfng \u0111\u1ec3 xem phim, nghe nh\u1ea1c ho\u1eb7c tham gia c\u00e1c cu\u1ed9c h\u1ecdp tr\u1ef1c tuy\u1ebfn. V\u1edbi thi\u1ebft k\u1ebf loa \u0111a h\u01b0\u1edbng, \u00e2m thanh \u0111\u01b0\u1ee3c ph\u00e2n b\u1ed1 \u0111\u1ed3ng \u0111\u1ec1u, mang l\u1ea1i tr\u1ea3i nghi\u1ec7m \u00e2m thanh v\u00f2m ch\u00e2n th\u1ef1c. K\u1ebft h\u1ee3p c\u00f9ng micro t\u00edch h\u1ee3p, HONOR Pad X9 kh\u00f4ng ch\u1ec9 \u0111\u00e1p \u1ee9ng t\u1ed1t nhu c\u1ea7u gi\u1ea3i tr\u00ed m\u00e0 c\u00f2n h\u1ed7 tr\u1ee3 c\u00e1c t\u00e1c v\u1ee5 li\u00ean quan \u0111\u1ebfn c\u00f4ng vi\u1ec7c nh\u01b0 g\u1ecdi video hay ghi \u00e2m. Camera linh ho\u1ea1t v\u00e0 t\u00edch h\u1ee3p nhi\u1ec1u t\u00ednh n\u0103ng D\u00f9 kh\u00f4ng ph\u1ea3i l\u00e0 \u0111i\u1ec3m nh\u1ea5n m\u1ea1nh m\u1ebd nh\u1ea5t c\u1ee7a s\u1ea3n ph\u1ea9m, camera c\u1ee7a HONOR Pad X9 v\u1eabn \u0111\u00e1p \u1ee9ng t\u1ed1t c\u00e1c nhu c\u1ea7u s\u1eed d\u1ee5ng c\u01a1 b\u1ea3n. Camera sau 5MP v\u1edbi kh\u1ea9u \u0111\u1ed9 f/2.2 cung c\u1ea5p c\u00e1c t\u00ednh n\u0103ng nh\u01b0 HDR, x\u00f3a ph\u00f4ng, tua nhanh th\u1eddi gian (time-lapse) v\u00e0 l\u00e0m \u0111\u1eb9p, gi\u00fap b\u1ea1n d\u1ec5 d\u00e0ng ch\u1ee5p \u1ea3nh v\u00e0 quay video v\u1edbi ch\u1ea5t l\u01b0\u1ee3ng \u1ed5n \u0111\u1ecbnh. Camera tr\u01b0\u1edbc 5MP kh\u00f4ng ch\u1ec9 ph\u1ee5c v\u1ee5 t\u1ed1t cho c\u00e1c cu\u1ed9c g\u1ecdi video m\u00e0 c\u00f2n h\u1ed7 tr\u1ee3 ch\u1ee5p \u1ea3nh selfie s\u1eafc n\u00e9t. C\u1ea3 hai camera \u0111\u1ec1u c\u00f3 kh\u1ea3 n\u0103ng quay video FullHD 1080p@30fps , mang l\u1ea1i ch\u1ea5t l\u01b0\u1ee3ng h\u00ecnh \u1ea3nh t\u1ed1t cho vi\u1ec7c ghi l\u1ea1i c\u00e1c kho\u1ea3nh kh\u1eafc quan tr\u1ecdng ho\u1eb7c t\u1ea1o n\u1ed9i dung tr\u1ef1c tuy\u1ebfn. Pin dung l\u01b0\u1ee3ng l\u1edbn v\u00e0 s\u1ea1c nhanh ti\u1ec7n l\u1ee3i V\u1edbi vi\u00ean pin dung l\u01b0\u1ee3ng l\u1edbn 7250mAh , HONOR Pad X9 c\u00f3 th\u1ec3 ho\u1ea1t \u0111\u1ed9ng li\u00ean t\u1ee5c su\u1ed1t ng\u00e0y d\u00e0i m\u00e0 kh\u00f4ng c\u1ea7n s\u1ea1c l\u1ea1i. \u0110i\u1ec1u n\u00e0y r\u1ea5t ph\u00f9 h\u1ee3p v\u1edbi nh\u1eefng ng\u01b0\u1eddi d\u00f9ng th\u01b0\u1eddng xuy\u00ean di chuy\u1ec3n ho\u1eb7c l\u00e0m vi\u1ec7c \u1edf ngo\u00e0i. Th\u00eam v\u00e0o \u0111\u00f3, c\u00f4ng ngh\u1ec7 s\u1ea1c nhanh 22.5W gi\u00fap b\u1ea1n ti\u1ebft ki\u1ec7m th\u1eddi gian khi s\u1ea1c pin, \u0111\u1eb7c bi\u1ec7t h\u1eefu \u00edch trong nh\u1eefng tr\u01b0\u1eddng h\u1ee3p kh\u1ea9n c\u1ea5p. Pin c\u1ee7a HONOR Pad X9 \u0111\u01b0\u1ee3c t\u1ed1i \u01b0u h\u00f3a \u0111\u1ec3 mang l\u1ea1i hi\u1ec7u su\u1ea5t t\u1ed1t nh\u1ea5t m\u00e0 v\u1eabn gi\u1eef \u0111\u01b0\u1ee3c tu\u1ed5i th\u1ecd l\u00e2u d\u00e0i, gi\u00fap b\u1ea1n s\u1eed d\u1ee5ng thi\u1ebft b\u1ecb trong nhi\u1ec1u n\u0103m m\u00e0 kh\u00f4ng lo b\u1ecb chai pin nhanh ch\u00f3ng. C\u00e1c t\u00ednh n\u0103ng th\u00f4ng minh kh\u00e1c tr\u00ean HONOR Pad X9 HONOR Pad X9 h\u1ed7 tr\u1ee3 \u0111a c\u1eeda s\u1ed5 , cho ph\u00e9p ng\u01b0\u1eddi d\u00f9ng m\u1edf \u0111\u1ebfn 4 \u1ee9ng d\u1ee5ng c\u00f9ng l\u00fac tr\u00ean m\u1ed9t m\u00e0n h\u00ecnh. \u0110i\u1ec1u n\u00e0y r\u1ea5t h\u1eefu \u00edch khi b\u1ea1n c\u1ea7n l\u00e0m vi\u1ec7c \u0111a nhi\u1ec7m, ch\u1eb3ng h\u1ea1n v\u1eeba so\u1ea1n email, v\u1eeba tham kh\u1ea3o t\u00e0i li\u1ec7u ho\u1eb7c th\u1ef1c hi\u1ec7n c\u00e1c cu\u1ed9c g\u1ecdi video. T\u00ednh n\u0103ng HONOR Connect cho ph\u00e9p \u0111\u1ed3ng b\u1ed9 h\u00f3a gi\u1eefa m\u00e1y t\u00ednh b\u1ea3ng v\u00e0 \u0111i\u1ec7n tho\u1ea1i ho\u1eb7c m\u00e1y t\u00ednh, gi\u00fap b\u1ea1n chia s\u1ebb n\u1ed9i dung nhanh ch\u00f3ng m\u00e0 kh\u00f4ng c\u1ea7n k\u1ebft n\u1ed1i ph\u1ee9c t\u1ea1p. Thao t\u00e1c \u0111\u00e1nh d\u1ea5u trang nhanh b\u1eb1ng c\u00e1ch vu\u1ed1t ba ng\u00f3n tay l\u00e0 m\u1ed9t ti\u1ec7n \u00edch th\u00f4ng minh, gi\u00fap b\u1ea1n d\u1ec5 d\u00e0ng l\u01b0u l\u1ea1i n\u1ed9i dung quan tr\u1ecdng ch\u1ec9 trong t\u00edch t\u1eafc. HONOR Pad X9 ra m\u1eaft khi n\u00e0o? HONOR Pad X9 ch\u00ednh th\u1ee9c ra m\u1eaft v\u00e0o ng\u00e0y 6 th\u00e1ng 7 n\u0103m 2023 v\u00e0 nhanh ch\u00f3ng c\u00f3 m\u1eb7t tr\u00ean nhi\u1ec1u th\u1ecb tr\u01b0\u1eddng qu\u1ed1c t\u1ebf. M\u00e1y t\u00ednh b\u1ea3ng n\u00e0y s\u1edf h\u1eefu m\u00e0n h\u00ecnh l\u1edbn 11.5 inch, trang b\u1ecb vi x\u1eed l\u00fd Snapdragon 685 m\u1ea1nh m\u1ebd v\u00e0 vi\u00ean pin dung l\u01b0\u1ee3ng 7250mAh h\u1ed7 tr\u1ee3 s\u1ea1c nhanh 22.5W. B\u00ean c\u1ea1nh \u0111\u00f3, c\u00e1c t\u00ednh n\u0103ng k\u1ebft n\u1ed1i ti\u00ean ti\u1ebfn nh\u01b0 Wi-Fi 5 v\u00e0 Bluetooth 5.1 \u0111\u1ea3m b\u1ea3o hi\u1ec7u su\u1ea5t v\u01b0\u1ee3t tr\u1ed9i, \u0111\u00e1p \u1ee9ng t\u1ed1t nhu c\u1ea7u c\u00f4ng vi\u1ec7c l\u1eabn gi\u1ea3i tr\u00ed c\u1ee7a ng\u01b0\u1eddi d\u00f9ng. HONOR Pad X9 c\u00f3 gi\u00e1 nh\u01b0 th\u1ebf n\u00e0o? HONOR Pad X9 l\u00e0 m\u1ed9t chi\u1ebfc m\u00e1y t\u00ednh b\u1ea3ng HONOR n\u1ed5i b\u1eadt v\u1edbi nhi\u1ec1u c\u1ea3i ti\u1ebfn v\u01b0\u1ee3t tr\u1ed9i. S\u1ea3n ph\u1ea9m c\u00f3 hi\u1ec7u su\u1ea5t m\u1ea1nh m\u1ebd \u0111i c\u00f9ng c\u00e1c t\u00ednh n\u0103ng \u1ea5n t\u01b0\u1ee3ng, v\u1eady n\u00ean \u0111\u00e2y l\u00e0 m\u1ed9t l\u1ef1a ch\u1ecdn l\u00fd t\u01b0\u1edfng cho nhu c\u1ea7u c\u00f4ng vi\u1ec7c, h\u1ecdc t\u1eadp v\u00e0 gi\u1ea3i tr\u00ed c\u1ee7a b\u1ea1n. \u0110\u1ec3 c\u1eadp nh\u1eadt th\u00f4ng tin v\u1ec1 gi\u00e1 b\u00e1n v\u00e0 c\u00e1c ch\u01b0\u01a1ng tr\u00ecnh khuy\u1ebfn m\u00e3i m\u1edbi nh\u1ea5t, h\u00e3y li\u00ean h\u1ec7 ngay v\u1edbi Ho\u00e0ng H\u00e0 Mobile qua hotline 1900 2091 \u0111\u1ec3 \u0111\u01b0\u1ee3c t\u01b0 v\u1ea5n chi ti\u1ebft. Xin l\u01b0u \u00fd, gi\u00e1 c\u1ea3 c\u00f3 th\u1ec3 thay \u0111\u1ed5i t\u00f9y thu\u1ed9c v\u00e0o t\u1eebng th\u1eddi \u0111i\u1ec3m v\u00e0 c\u00e1c \u01b0u \u0111\u00e3i \u0111\u1eb7c bi\u1ec7t. So s\u00e1nh HONOR Pad X9 v\u1edbi HONOR Pad X8 D\u01b0\u1edbi \u0111\u00e2y l\u00e0 b\u1ea3ng so s\u00e1nh chi ti\u1ebft gi\u1eefa hai s\u1ea3n ph\u1ea9m m\u00e1y t\u00ednh b\u1ea3ng HONOR Pad X9 v\u00e0 HONOR Pad X8 d\u1ef1a tr\u00ean c\u00e1c y\u1ebfu t\u1ed1 quan tr\u1ecdng. Th\u00f4ng s\u1ed1 HONOR Pad X9 HONOR Pad X8 M\u00e0n h\u00ecnh K\u00edch th\u01b0\u1edbc 11.5 inch 10.1 inch \u0110\u1ed9 ph\u00e2n gi\u1ea3i 2K (2000x1200) WUXGA (1920x1200) T\u00ednh n\u0103ng Fullview Display TFT LCD (IPS) \u0110\u1ed9 s\u00e1ng t\u1ed1i \u0111a 400 nit T\u1ea7n s\u1ed1 qu\u00e9t 120Hz Hi\u1ec3n th\u1ecb 100%sRGB v\u00e0 1.07 t\u1ef7 m\u00e0u s\u1eafc \u0110\u01b0\u1ee3c ch\u1ee9ng nh\u1eadn T\u00dcV Rheinland v\u1ec1 t\u00ednh n\u0103ng ch\u1ed1ng nh\u1ea5p nh\u00e1y, \u00e1nh s\u00e1ng xanh th\u1ea5p Fullview Display TFT LCD Hi\u1ec3n th\u1ecb 16.7 tri\u1ec7u m\u00e0u \u0110\u01b0\u1ee3c ch\u1ee9ng nh\u1eadn T\u00dcV Rheinland v\u1ec1 t\u00ednh n\u0103ng \u00e1nh s\u00e1ng xanh th\u1ea5p Camera sau \u0110\u1ed9 ph\u00e2n gi\u1ea3i 5MP 5MP Quay phim HD 720p@30fps FullHD 1080p@30fps HD 720p@30fps FullHD 1080p@30fps Camera tr\u01b0\u1edbc \u0110\u1ed9 ph\u00e2n gi\u1ea3i 5MP 2MP Quay phim HD 720p@30fps FullHD 1080p@30fps Kh\u00f4ng r\u00f5 th\u00f4ng tin H\u1ec7 \u0111i\u1ec1u h\u00e0nh & CPU CPU Snapdragon 685 8 nh\u00e2n MediaTek MT8786 8 nh\u00e2n GPU Adreno 610 Mali-G52 B\u1ed9 nh\u1edb & L\u01b0u tr\u1eef RAM 4GB 4GB B\u1ed9 nh\u1edb trong 128GB 64GB (c\u00f3 h\u1ed7 tr\u1ee3 th\u1ebb nh\u1edb microSDXC) Th\u00f4ng s\u1ed1 kh\u00e1c \u00c2m thanh 1 micro 6 loa Hi\u1ec7u \u1ee9ng \u00e2m thanh HONOR Histen 1 micro 2 loa Hi\u1ec7u \u1ee9ng \u00e2m thanh HONOR Histen K\u1ebft n\u1ed1i C\u1ed5ng k\u1ebft n\u1ed1i/s\u1ea1c USB Type-C USB Type-C Wi-Fi Wi-Fi 802.11 a/b/g/n/ac Wi-Fi 802.11 a/b/g/n/ac Bluetooth 5.1 5.1 Thi\u1ebft k\u1ebf & Tr\u1ecdng l\u01b0\u1ee3ng K\u00edch th\u01b0\u1edbc 267.3 x 167.4 x 6.9 mm 240.2 x 159 x 7.6 mm Tr\u1ecdng l\u01b0\u1ee3ng 495g 460g Pin & S\u1ea1c Lo\u1ea1i pin Li-Po Li-Po Dung l\u01b0\u1ee3ng 7250mAh 5100mAh V\u1ec1 m\u00e0n h\u00ecnh c\u1ee7a HONOR Pad X9 v\u00e0 HONOR Pad X8 HONOR Pad X9 c\u00f3 m\u00e0n h\u00ecnh TFT LCD 11.5 inch v\u1edbi \u0111\u1ed9 ph\u00e2n gi\u1ea3i 2K (2000x1200) cung c\u1ea5p h\u00ecnh \u1ea3nh s\u1eafc n\u00e9t, chi ti\u1ebft, ph\u00f9 h\u1ee3p cho c\u1ea3 c\u00f4ng vi\u1ec7c v\u00e0 gi\u1ea3i tr\u00ed. T\u1ea7n s\u1ed1 qu\u00e9t 120Hz \u0111\u1ea3m b\u1ea3o chuy\u1ec3n \u0111\u1ed9ng m\u01b0\u1ee3t m\u00e0, gi\u1ea3m hi\u1ec7n t\u01b0\u1ee3ng gi\u1eadt lag khi xem video ho\u1eb7c ch\u01a1i game. \u0110\u1ed9 s\u00e1ng t\u1ed1i \u0111a 400 nit v\u00e0 kh\u1ea3 n\u0103ng hi\u1ec3n th\u1ecb 100% d\u1ea3i m\u00e0u sRGB, c\u00f9ng v\u1edbi h\u1ed7 tr\u1ee3 1.07 t\u1ef7 m\u00e0u , mang l\u1ea1i tr\u1ea3i nghi\u1ec7m m\u00e0u s\u1eafc s\u1ed1ng \u0111\u1ed9ng, ch\u00e2n th\u1ef1c. \u0110\u01b0\u1ee3c ch\u1ee9ng nh\u1eadn T\u00dcV Rheinland v\u1edbi t\u00ednh n\u0103ng ch\u1ed1ng nh\u1ea5p nh\u00e1y v\u00e0 gi\u1ea3m \u00e1nh s\u00e1ng xanh , gi\u00fap b\u1ea3o v\u1ec7 m\u1eaft khi s\u1eed d\u1ee5ng trong th\u1eddi gian d\u00e0i. Trong khi \u0111\u00f3, HONOR Pad X8 c\u00f3 m\u00e0n h\u00ecnh TFT LCD 10.1 inch v\u1edbi \u0111\u1ed9 ph\u00e2n gi\u1ea3i WUXGA (1920x1200) , cung c\u1ea5p ch\u1ea5t l\u01b0\u1ee3ng h\u00ecnh \u1ea3nh t\u1ed1t nh\u01b0ng k\u00e9m s\u1eafc n\u00e9t h\u01a1n X9. Kh\u1ea3 n\u0103ng hi\u1ec3n th\u1ecb 16.7 tri\u1ec7u m\u00e0u th\u1ea5p h\u01a1n so v\u1edbi X9, d\u1eabn \u0111\u1ebfn m\u00e0u s\u1eafc hi\u1ec3n th\u1ecb kh\u00f4ng phong ph\u00fa b\u1eb1ng. Ch\u1ee9ng nh\u1eadn T\u00dcV Rheinland ch\u1ec9 \u0111\u1ea3m b\u1ea3o kh\u1ea3 n\u0103ng gi\u1ea3m \u00e1nh s\u00e1ng xanh , kh\u00f4ng c\u00f3 ch\u1ed1ng nh\u1ea5p nh\u00e1y. V\u1ec1 hi\u1ec7u n\u0103ng HONOR Pad X9 trang b\u1ecb vi x\u1eed l\u00fd Snapdragon 685 v\u1edbi 8 nh\u00e2n, bao g\u1ed3m 4 l\u00f5i Cortex-A73 m\u1ea1nh m\u1ebd (xung nh\u1ecbp 2.8GHz) v\u00e0 4 l\u00f5i Cortex-A53 ti\u1ebft ki\u1ec7m n\u0103ng l\u01b0\u1ee3ng (xung nh\u1ecbp 1.9GHz). \u0110i\u1ec1u n\u00e0y mang l\u1ea1i s\u1ef1 c\u00e2n b\u1eb1ng gi\u1eefa hi\u1ec7u su\u1ea5t v\u00e0 hi\u1ec7u qu\u1ea3 n\u0103ng l\u01b0\u1ee3ng. GPU Adreno 610 h\u1ed7 tr\u1ee3 x\u1eed l\u00fd \u0111\u1ed3 h\u1ecda m\u01b0\u1ee3t m\u00e0, ph\u00f9 h\u1ee3p cho c\u1ea3 ch\u01a1i game v\u00e0 c\u00e1c t\u00e1c v\u1ee5 \u0111\u1ed3 h\u1ecda nh\u1eb9. K\u1ebft h\u1ee3p v\u1edbi RAM 4GB , X9 c\u00f3 th\u1ec3 \u0111\u00e1p \u1ee9ng t\u1ed1t c\u00e1c t\u00e1c v\u1ee5 \u0111a nhi\u1ec7m v\u00e0 ch\u1ea1y \u1ed5n \u0111\u1ecbnh c\u00e1c \u1ee9ng d\u1ee5ng \u0111\u00f2i h\u1ecfi cao. HONOR Pad X8 c\u00f9ng vi x\u1eed l\u00fd MediaTek MT8786 (8 nh\u00e2n) t\u1eadp trung v\u00e0o hi\u1ec7u su\u1ea5t c\u01a1 b\u1ea3n, ph\u00f9 h\u1ee3p cho c\u00e1c t\u00e1c v\u1ee5 nh\u1eb9 nh\u00e0ng nh\u01b0 xem phim, l\u01b0\u1edbt web ho\u1eb7c l\u00e0m vi\u1ec7c v\u0103n ph\u00f2ng. GPU Mali-G52 , tuy \u0111\u1ee7 \u0111\u1ec3 x\u1eed l\u00fd c\u00e1c t\u00e1c v\u1ee5 \u0111\u1ed3 h\u1ecda c\u01a1 b\u1ea3n, nh\u01b0ng kh\u00f4ng m\u1ea1nh b\u1eb1ng Adreno 610 c\u1ee7a X9. RAM 4GB gi\u00fap \u0111\u1ea3m b\u1ea3o hi\u1ec7u su\u1ea5t \u0111a nhi\u1ec7m \u1ed5n \u0111\u1ecbnh trong c\u00e1c \u0111i\u1ec1u ki\u1ec7n s\u1eed d\u1ee5ng th\u00f4ng th\u01b0\u1eddng. V\u1ec1 b\u1ed9 nh\u1edb v\u00e0 l\u01b0u tr\u1eef HONOR Pad X9 v\u1edbi b\u1ed9 nh\u1edb trong 128GB mang l\u1ea1i kh\u00f4ng gian l\u01b0u tr\u1eef r\u1ed9ng r\u00e3i, ph\u00f9 h\u1ee3p cho ng\u01b0\u1eddi d\u00f9ng l\u01b0u tr\u1eef \u1ee9ng d\u1ee5ng, t\u1ec7p tin l\u1edbn v\u00e0 n\u1ed9i dung gi\u1ea3i tr\u00ed. Tuy nhi\u00ean, X9 kh\u00f4ng h\u1ed7 tr\u1ee3 th\u1ebb nh\u1edb microSD, \u0111i\u1ec1u n\u00e0y c\u00f3 th\u1ec3 h\u1ea1n ch\u1ebf v\u1edbi ng\u01b0\u1eddi d\u00f9ng c\u1ea7n m\u1edf r\u1ed9ng b\u1ed9 nh\u1edb. Trong khi \u0111\u00f3, HONOR Pad X8 v\u1edbi b\u1ed9 nh\u1edb trong 64GB , th\u1ea5p h\u01a1n \u0111\u00e1ng k\u1ec3 so v\u1edbi X9, c\u00f3 th\u1ec3 g\u1eb7p h\u1ea1n ch\u1ebf khi l\u01b0u tr\u1eef nhi\u1ec1u d\u1eef li\u1ec7u. H\u1ed7 tr\u1ee3 th\u1ebb nh\u1edb microSDXC gi\u00fap t\u0103ng t\u00ednh linh ho\u1ea1t, cho ph\u00e9p m\u1edf r\u1ed9ng dung l\u01b0\u1ee3ng l\u01b0u tr\u1eef l\u00ean \u0111\u1ebfn v\u00e0i tr\u0103m GB. V\u1ec1 camera tr\u00ean HONOR Pad X9 v\u00e0 HONOR Pad X8 HONOR Pad X9 s\u1edf h\u1eefu camera tr\u01b0\u1edbc v\u00e0 sau \u0111\u1ec1u c\u00f3 \u0111\u1ed9 ph\u00e2n gi\u1ea3i 5MP , h\u1ed7 tr\u1ee3 quay video FullHD 1080p@30fps . \u0110i\u1ec1u n\u00e0y gi\u00fap \u0111\u1ea3m b\u1ea3o ch\u1ea5t l\u01b0\u1ee3ng h\u00ecnh \u1ea3nh t\u1ed1t cho c\u1ea3 ch\u1ee5p \u1ea3nh v\u00e0 g\u1ecdi video. C\u00e1c t\u00ednh n\u0103ng h\u1ed7 tr\u1ee3 nh\u01b0 HDR, l\u00e0m \u0111\u1eb9p v\u00e0 ch\u1ebf \u0111\u1ed9 quay video \u0111a d\u1ea1ng l\u00e0 \u0111i\u1ec3m c\u1ed9ng. C\u00f2n HONOR Pad X8 th\u00ec s\u1edf h\u1eefu camera sau t\u01b0\u01a1ng t\u1ef1 X9 v\u1edbi \u0111\u1ed9 ph\u00e2n gi\u1ea3i 5MP , quay video FullHD 1080p@30fps . Camera tr\u01b0\u1edbc ch\u1ec9 c\u00f3 \u0111\u1ed9 ph\u00e2n gi\u1ea3i 2MP , ch\u1ea5t l\u01b0\u1ee3ng k\u00e9m h\u01a1n, kh\u00f4ng l\u00fd t\u01b0\u1edfng cho c\u00e1c cu\u1ed9c g\u1ecdi video ho\u1eb7c ch\u1ee5p \u1ea3nh selfie. V\u1ec1 \u00e2m thanh HONOR Pad X9 c\u00f3 h\u1ec7 th\u1ed1ng 6 loa t\u00edch h\u1ee3p c\u00f4ng ngh\u1ec7 \u00e2m thanh HONOR Histen mang l\u1ea1i ch\u1ea5t l\u01b0\u1ee3ng \u00e2m thanh v\u01b0\u1ee3t tr\u1ed9i, v\u1edbi d\u1ea3i \u00e2m r\u1ed9ng v\u00e0 s\u1ed1ng \u0111\u1ed9ng, ph\u00f9 h\u1ee3p cho gi\u1ea3i tr\u00ed nh\u01b0 xem phim, nghe nh\u1ea1c. HONOR Pad X8 ch\u1ec9 c\u00f3 2 loa , tuy v\u1eabn s\u1eed d\u1ee5ng c\u00f4ng ngh\u1ec7 HONOR Histen nh\u01b0ng kh\u00f4ng th\u1ec3 mang l\u1ea1i tr\u1ea3i nghi\u1ec7m \u00e2m thanh m\u1ea1nh m\u1ebd v\u00e0 phong ph\u00fa nh\u01b0 X9. V\u1ec1 dung l\u01b0\u1ee3ng pin c\u1ee7a HONOR Pad X9 v\u00e0 HONOR Pad X8 HONOR Pad X9 v\u1edbi dung l\u01b0\u1ee3ng pin l\u1edbn 7250mAh cho th\u1eddi gian s\u1eed d\u1ee5ng k\u00e9o d\u00e0i c\u1ea3 ng\u00e0y. Ngo\u00e0i ra, thi\u1ebft b\u1ecb c\u00f2n h\u1ed7 tr\u1ee3 s\u1ea1c nhanh 25W , gi\u00fap r\u00fat ng\u1eafn th\u1eddi gian s\u1ea1c. HONOR Pad X8 v\u1edbi dung l\u01b0\u1ee3ng pin 5100mAh , th\u1ea5p h\u01a1n \u0111\u00e1ng k\u1ec3 so v\u1edbi X9, c\u00f3 th\u1ec3 kh\u00f4ng \u0111\u00e1p \u1ee9ng \u0111\u01b0\u1ee3c nhu c\u1ea7u s\u1eed d\u1ee5ng li\u00ean t\u1ee5c. Ch\u01b0a k\u1ec3 \u0111\u1ebfn, th\u00f4ng tin v\u1ec1 kh\u1ea3 n\u0103ng s\u1ea1c nhanh c\u1ee7a thi\u1ebft b\u1ecb n\u00e0y hi\u1ec7n v\u1eabn \u0111ang kh\u00f4ng r\u00f5 r\u00e0ng. Mua HONOR Pad X9 ch\u00ednh h\u00e3ng t\u1ea1i Ho\u00e0ng H\u00e0 Mobile N\u1ebfu b\u1ea1n \u0111ang t\u00ecm ki\u1ebfm m\u1ed9t \u0111\u1ecba ch\u1ec9 uy t\u00edn \u0111\u1ec3 s\u1edf h\u1eefu m\u00e1y t\u00ednh b\u1ea3ng HONOR Pad X9, Ho\u00e0ng H\u00e0 Mobile ch\u00ednh l\u00e0 s\u1ef1 l\u1ef1a ch\u1ecdn l\u00fd t\u01b0\u1edfng. L\u00e0 h\u1ec7 th\u1ed1ng b\u00e1n l\u1ebb h\u00e0ng \u0111\u1ea7u t\u1ea1i Vi\u1ec7t Nam, Ho\u00e0ng H\u00e0 Mobile chuy\u00ean cung c\u1ea5p c\u00e1c s\u1ea3n ph\u1ea9m c\u00f4ng ngh\u1ec7 ch\u00ednh h\u00e3ng v\u1edbi nhi\u1ec1u ch\u01b0\u01a1ng tr\u00ecnh \u01b0u \u0111\u00e3i h\u1ea5p d\u1eabn. Khi mua s\u1eafm t\u1ea1i \u0111\u00e2y, b\u1ea1n s\u1ebd \u0111\u01b0\u1ee3c h\u01b0\u1edfng: Ch\u00ednh s\u00e1ch b\u1ea3o h\u00e0nh tin c\u1eady, minh b\u1ea1ch Cam k\u1ebft s\u1ea3n ph\u1ea9m 100% ch\u00ednh h\u00e3ng Mi\u1ec5n ph\u00ed v\u1eadn chuy\u1ec3n tr\u00ean to\u00e0n qu\u1ed1c H\u1ed7 tr\u1ee3 tr\u1ea3 g\u00f3p v\u1edbi l\u00e3i su\u1ea5t \u01b0u \u0111\u00e3i \u0110\u1ed9i ng\u0169 t\u01b0 v\u1ea5n vi\u00ean t\u1ea1i Ho\u00e0ng H\u00e0 Mobile lu\u00f4n t\u1eadn t\u00e2m, chuy\u00ean nghi\u1ec7p, \u0111\u1ea3m b\u1ea3o mang \u0111\u1ebfn cho kh\u00e1ch h\u00e0ng tr\u1ea3i nghi\u1ec7m mua s\u1eafm ho\u00e0n h\u1ea3o nh\u1ea5t. H\u00e3y gh\u00e9 ngay c\u1eeda h\u00e0ng g\u1ea7n nh\u1ea5t ho\u1eb7c truy c\u1eadp website ch\u00ednh th\u1ee9c c\u1ee7a Ho\u00e0ng H\u00e0 Mobile \u0111\u1ec3 s\u1edf h\u1eefu ngay HONOR Pad X9 c\u00f9ng nhi\u1ec1u \u01b0u \u0111\u00e3i \u0111\u1eb7c bi\u1ec7t! Xem to\u00e0n b\u1ed9 b\u00e0i vi\u1ebft",
        "promotion_1": "1. Tr\u00fang 8386 qu\u00e0 - T\u1ed5ng gi\u00e1 tr\u1ecb t\u1edbi 250 TRI\u1ec6U \u0110\u1ed2NG (\u00c1p d\u1ee5ng t\u1eeb 10/01 - 02/02/2025). (Xem chi ti\u1ebft). 2. \u0110\u1eb7c bi\u1ec7t Tr\u1ea3 g\u00f3p 3 kh\u00f4ng: 0% l\u00e3i su\u1ea5t - 0 ph\u00ed chuy\u1ec3n \u0111\u1ed5i - 0 tr\u1ea3 tr\u01b0\u1edbc (\u00c1p d\u1ee5ng cho c\u00f4ng ty t\u00e0i ch\u00ednh v\u00e0 th\u1ebb t\u00edn d\u1ee5ng)",
        "promotion_2": "1. Thu c\u0169 \u0111\u1ed5i m\u1edbi l\u00ean \u0111\u1eddi \u0111i\u1ec7n tho\u1ea1i Android & M\u00e1y t\u00ednh b\u1ea3ng, ti\u1ebft ki\u1ec7m t\u1edbi 20 tri\u1ec7u \u0111\u1ed3ng. (Xem chi ti\u1ebft). 2. Gi\u1ea3m 50% t\u1ed1i \u0111a 700.000\u0111 khi m\u1edf th\u1ebb t\u00edn d\u1ee5ng Vpbank tr\u00ean SenID. (Xem chi ti\u1ebft). 3. Gi\u1ea3m t\u1edbi 500.000\u0111 khi thanh to\u00e1n th\u1ebb t\u00edn d\u1ee5ng NCB. (Xem chi ti\u1ebft). 4. Gi\u1ea3m \u0111\u1ebfn 150.000\u0111 khi thanh to\u00e1n qua Muadee. (Xem chi ti\u1ebft). 5. Mi\u1ec5n ph\u00ed chuy\u1ec3n \u0111\u1ed5i tr\u1ea3 g\u00f3p ho\u1eb7c gi\u1ea3m \u0111\u1ebfn 500.000\u0111 khi m\u1edf th\u1ebb TPBank EVO. (Xem chi ti\u1ebft). 6. M\u1edf th\u1ebb t\u00edn d\u1ee5ng VIB - Nh\u1eadn Voucher 600.000\u0111. (Xem chi ti\u1ebft). 7. Gi\u1ea3m th\u00eam 100.000\u0111 cho t\u1ea5t c\u1ea3 c\u00e1c s\u1ea3n ph\u1ea9m m\u00e0n h\u00ecnh khi mua k\u00e8m Laptop, MacBook, M\u00e1y t\u00ednh b\u1ea3ng v\u00e0 \u0110i\u1ec7n tho\u1ea1i.. 8. T\u1eb7ng mi\u1ec5n ph\u00ed ph\u00f4i sim khi mua \u0111i\u1ec7n tho\u1ea1i, m\u00e1y t\u00ednh b\u1ea3ng, laptop ho\u1eb7c ph\u1ee5 ki\u1ec7n t\u1ea1i Ho\u00e0ng H\u00e0 Mobile. (Xem chi ti\u1ebft). 9. M\u1edf th\u1ebb HSBC - Ho\u00e0n ti\u1ec1n t\u1edbi 2 tri\u1ec7u \u0111\u1ed3ng. (Xem chi ti\u1ebft)"
    }
]