[
    {
        "title": " Laptop M-SMART MBOOK 1409A (Celeron-N4000/4GB/128GB/14\" HD/Win10/Ba\u0323c) - Chi\u0301nh ha\u0303ng",
        "price": "gi\u00e1 hi\u1ec7n t\u1ea1i l\u00e0 2,990,000 \u20ab nh\u01b0ng tr\u01b0\u1edbc \u0111\u00e2y n\u00f3 c\u00f3 gi\u00e1 l\u00e0 4,990,000 \u20ab",
        "colors": "B\u1ea1c",
        "technical_specifications": [
            {
                "Xung nh\u1ecbp c\u01a1 b\u1ea3n": "1.1 GHz"
            },
            {
                "Lo\u1ea1i RAM": "LPDDR3"
            },
            {
                "H\u1ec7 \u0111i\u1ec1u h\u00e0nh": "Win 10"
            },
            {
                "Kh\u1ea3 n\u0103ng n\u00e2ng c\u1ea5p RAM": "Kh\u00f4ng h\u1ed7 tr\u1ee3 n\u00e2ng c\u1ea5p"
            },
            {
                "C\u00f4ng ngh\u1ec7 CPU": "Intel Celeron"
            },
            {
                "S\u1ed1 hi\u1ec7u CPU": "N4000"
            },
            {
                "RAM": "4GB"
            },
            {
                "\u1ed4 c\u1ee9ng m\u1eb7c \u0111\u1ecbnh": "128GB SSD"
            },
            {
                "Card \u0111\u1ed3 ho\u1ea1 r\u1eddi": "GPU t\u00edch h\u1ee3p"
            },
            {
                "K\u00edch th\u01b0\u1edbc m\u00e0n h\u00ecnh": "14 inch"
            },
            {
                "\u0110\u1ed9 ph\u00e2n gi\u1ea3i": "1280 x 720"
            }
        ],
        "description": "Laptop M-SMART MBOOK 1409A l\u00e0 m\u1ed9t m\u1eabu m\u00e1y t\u00ednh x\u00e1ch tay gi\u00e1 r\u1ebb, ph\u00f9 h\u1ee3p v\u1edbi nh\u1eefng \u0111\u1ed1i t\u01b0\u1ee3ng ng\u01b0\u1eddi d\u00f9ng c\u00f3 ng\u00e2n s\u00e1ch h\u1ea1n ch\u1ebf nh\u01b0 h\u1ecdc sinh ph\u1ed5 th\u00f4ng hay d\u00e2n v\u0103n ph\u00f2ng. S\u1ea3n ph\u1ea9m \u0111\u01b0\u1ee3c trang b\u1ecb con chip Intel Celeron N4000 , card \u0111\u1ed3 h\u1ecda Intel GMA UHD 600 k\u1ebft h\u1ee3p c\u00f9ng RAM 4GB LPDDR3 v\u00e0 \u1ed5 c\u1ee9ng SSD 128GB , \u0111\u00e1p \u1ee9ng t\u1ed1t nh\u1eefng nhu c\u1ea7u s\u1eed d\u1ee5ng c\u01a1 b\u1ea3n nh\u01b0 h\u1ecdc t\u1eadp hay x\u1eed l\u00fd nh\u1eefng t\u00e1c v\u1ee5 v\u0103n ph\u00f2ng. M\u00e0n h\u00ecnh 14 inch v\u1edbi \u0111\u1ed9 ph\u00e2n gi\u1ea3i HD (1280 x 720 pixels) cho ch\u1ea5t l\u01b0\u1ee3ng h\u00ecnh \u1ea3nh r\u00f5 n\u00e9t. N\u1ebfu b\u1ea1n \u0111ang t\u00ecm ki\u1ebfm m\u1ed9t chi\u1ebfc laptop v\u1edbi nh\u1eefng y\u00eau c\u1ea7u kh\u00f4ng qu\u00e1 cao th\u00ec M-SMART MBOOK 1409A s\u1ebd l\u00e0 m\u1ed9t s\u1ef1 l\u1ef1a ch\u1ecdn \u0111\u00e1ng c\u00e2n nh\u1eafc. \u0110\u1eb7c \u0111i\u1ec3m n\u1ed5i b\u1eadt: T\u00edch h\u1ee3p b\u1ed9 vi x\u1eed l\u00fd Intel Celeron N4000 c\u00f9ng RAM 4GB LPDDR3, x\u1eed l\u00fd m\u01b0\u1ee3t m\u00e0 nh\u1eefng t\u00e1c v\u1ee5 c\u01a1 b\u1ea3n nh\u01b0 h\u1ecdc t\u1eadp, l\u01b0\u1edbt web, nghe nh\u1ea1c, xem phim... \u1ed4 c\u1ee9ng SSD 128GB gi\u00fap t\u1ed1i \u01b0u t\u1ed1c \u0111\u1ed9 kh\u1edfi \u0111\u1ed9ng m\u00e1y v\u00e0 truy c\u1eadp \u1ee9ng d\u1ee5ng nhanh ch\u00f3ng. Hi\u1ec3n th\u1ecb m\u1ecdi n\u1ed9i dung m\u1ed9t c\u00e1ch r\u00f5 r\u00e0ng v\u00e0 s\u1eafc n\u00e9t, m\u00e0u s\u1eafc trung th\u1ef1c v\u1edbi m\u00e0n h\u00ecnh HD. K\u00edch th\u01b0\u1edbc nh\u1ecf g\u1ecdn v\u1edbi tr\u1ecdng l\u01b0\u1ee3ng 1,46kg, r\u1ea5t thu\u1eadn ti\u1ec7n \u0111\u1ec3 mang theo b\u00ean m\u00ecnh khi di chuy\u1ec3n. M\u1ee9c gi\u00e1 ph\u1ea3i ch\u0103ng, l\u00e0 s\u1ef1 l\u1ef1a ch\u1ecdn h\u1ee3p l\u00fd v\u00e0 kinh t\u1ebf d\u00e0nh cho h\u1ecdc sinh, sinh vi\u00ean hay ng\u01b0\u1eddi m\u1edbi \u0111i l\u00e0m, mu\u1ed1n ti\u1ebft ki\u1ec7m ng\u00e2n s\u00e1ch. B\u1ea3ng th\u00f4ng s\u1ed1 k\u1ef9 thu\u1eadt c\u1ee7a laptop M-SMART MBOOK 1409A Th\u00f4ng s\u1ed1 Chi ti\u1ebft Lo\u1ea1i m\u00e1y Notebook Tr\u1ecdng l\u01b0\u1ee3ng 1,46kg K\u00edch th\u01b0\u1edbc 329 x 220 x 21 mm K\u00edch th\u01b0\u1edbc m\u00e0n h\u00ecnh 14 inch T\u1ec9 l\u1ec7 m\u00e0n h\u00ecnh 16:9 \u0110\u1ed9 ph\u00e2n gi\u1ea3i HD (1280 x 720\u00a0 pixels) Pin Lithium - ion 5000mAh Th\u1eddi l\u01b0\u1ee3ng s\u1eed d\u1ee5ng 6 - 8 ti\u1ebfng CPU Intel Celeron N4000 T\u1ed1c \u0111\u1ed9 xung nh\u1ecbp 1.1 - 2.6 Ghz S\u1ed1 nh\u00e2n 2 S\u1ed1 lu\u1ed3ng 2 B\u1ed9 nh\u1edb \u0111\u1ec7m 4MB RAM 4GB LPDDR3 \u1ed4 c\u1ee9ng 128GB SSD Card m\u00e0n h\u00ecnh Intel GMA UHD 600 C\u1ed5ng k\u1ebft n\u1ed1i 1 \u00d7 HDMI 1.4 2 \u00d7 USB 3.0 1 x 3.5mm 1 x th\u1ebb SD K\u1ebft n\u1ed1i kh\u00f4ng d\u00e2y Wifi 802.11 ac/a/b/g/n + BT Webcam HD 1MP Ki\u1ec3u b\u00e0n ph\u00edm B\u00e0n ph\u00edm ti\u00eau chu\u1ea9n Touchpad Multi-touch touchpad H\u1ec7 \u0111i\u1ec1u h\u00e0nh Windows 10 \u0110\u00e1nh gi\u00e1 chi ti\u1ebft v\u1ec1 laptop M-SMART MBOOK 1409A M-SMART MBOOK 1409A l\u00e0 m\u1ed9t m\u1eabu m\u00e1y t\u00ednh x\u00e1ch tay c\u00f3 k\u00edch th\u01b0\u1edbc nh\u1ecf g\u1ecdn c\u00f9ng m\u1ee9c c\u1ea5u h\u00ecnh c\u01a1 b\u1ea3n, ph\u00f9 h\u1ee3p v\u1edbi nh\u1eefng ng\u01b0\u1eddi d\u00f9ng ph\u1ed5 th\u00f4ng c\u00f3 y\u00eau c\u1ea7u kh\u00f4ng qu\u00e1 cao. Chi\u1ebfc laptop gi\u00e1 r\u1ebb n\u00e0y h\u1ee9a h\u1eb9n s\u1ebd mang \u0111\u1ebfn cho ng\u01b0\u1eddi d\u00f9ng nh\u1eefng tr\u1ea3i nghi\u1ec7m s\u1eed d\u1ee5ng h\u00e0i l\u00f2ng nh\u1ea5t, x\u1ee9ng \u0111\u00e1ng v\u1edbi m\u1ee9c chi ph\u00ed b\u1ecf ra. Ki\u1ec3u d\u00e1ng hi\u1ec7n \u0111\u1ea1i, k\u00edch th\u01b0\u1edbc nh\u1ecf g\u1ecdn d\u1ec5 d\u00e0ng mang theo khi di chuy\u1ec3n \u1ea4n t\u01b0\u1ee3ng ban \u0111\u1ea7u v\u1ec1 chi\u1ebfc laptop M-SMART MBOOK 1409A l\u00e0 thi\u1ebft k\u1ebf t\u1ed1i gi\u1ea3n nh\u01b0ng v\u1eabn hi\u1ec7n \u0111\u1ea1i v\u1edbi t\u00f4ng m\u00e0u b\u1ea1c thanh l\u1ecbch. S\u1ea3n ph\u1ea9m \u0111\u01b0\u1ee3c bao ph\u1ee7 b\u1edfi l\u1edbp v\u1ecf nh\u1ef1a c\u1ee9ng c\u00e1p, ph\u00eda d\u01b0\u1edbi l\u00e0 ph\u1ea7n b\u1ea3n l\u1ec1 \u0111\u01b0\u1ee3c ho\u00e0n thi\u1ec7n ch\u1eafc ch\u1eafn mang l\u1ea1i \u0111\u1ed9 b\u1ec1n cao. K\u00edch th\u01b0\u1edbc c\u1ef1c k\u1ef3 g\u1ecdn nh\u1eb9 v\u1edbi \u0111\u1ed9 m\u1ecfng ch\u1ec9 21mm c\u00f9ng tr\u1ecdng l\u01b0\u1ee3ng 1.46kg v\u00f4 c\u00f9ng l\u00fd t\u01b0\u1edfng, c\u00f3 th\u1ec3 \u0111\u1eb7t g\u1ecdn g\u00e0ng trong t\u00fai x\u00e1ch, balo \u0111\u1ec3 d\u1ec5 d\u00e0ng mang theo, ph\u00f9 h\u1ee3p v\u1edbi nh\u1eefng ng\u01b0\u1eddi th\u01b0\u1eddng xuy\u00ean ph\u1ea3i di chuy\u1ec3n \u0111\u1ebfn nhi\u1ec1u \u0111\u1ecba \u0111i\u1ec3m kh\u00e1c nhau. M\u1eb7c d\u00f9 ph\u1ea7n khung vi\u1ec1n xung quanh m\u00e0n h\u00ecnh \u0111\u01b0\u1ee3c l\u00e0m kh\u00e1 d\u00e0y nh\u01b0ng \u0111\u00e2y l\u1ea1i l\u00e0 m\u1ed9t \u01b0u \u0111i\u1ec3m v\u1ec1 m\u1eb7t thi\u1ebft k\u1ebf. Trong qu\u00e1 tr\u00ecnh s\u1eed d\u1ee5ng v\u00e0 di chuy\u1ec3n, vi\u1ec7c x\u1ea3y ra nh\u1eefng va ch\u1ea1m hay t\u00e1c \u0111\u1ed9ng m\u1ea1nh l\u00e0 \u0111i\u1ec1u kh\u00f3 c\u00f3 th\u1ec3 tr\u00e1nh kh\u1ecfi. Do \u0111\u00f3, ph\u1ea7n khung vi\u1ec1n d\u00e0y s\u1ebd h\u1ea1n ch\u1ebf \u0111\u01b0\u1ee3c ph\u1ea7n n\u00e0o nh\u1eefng nguy c\u01a1 g\u00e2y h\u01b0 h\u1ea1i \u0111\u1ebfn m\u00e0n h\u00ecnh. Ph\u1ea7n b\u1ea3n l\u1ec1 c\u0169ng \u0111\u01b0\u1ee3c thi\u1ebft k\u1ebf v\u00e0 ho\u00e0n thi\u1ec7n d\u01b0\u1edbi d\u1ea1ng Ergolift gi\u1ed1ng nh\u01b0 nh\u1eefng m\u1eabu laptop v\u0103n ph\u00f2ng kh\u00e1c, v\u1eeba gi\u00fap c\u1ed1 \u0111\u1ecbnh m\u00e0n h\u00ecnh \u1edf m\u1ed9t g\u00f3c \u0111\u1ed9 v\u1eeba t\u1ea7m nh\u00ecn, v\u1eeba n\u00e2ng cao b\u00e0n ph\u00edm h\u01a1n \u0111\u1ec3 ng\u01b0\u1eddi d\u00f9ng d\u1ec5 d\u00e0ng thao t\u00e1c trong nh\u1eefng \u0111i\u1ec1u ki\u1ec7n v\u00e0 m\u00f4i tr\u01b0\u1eddng s\u1eed d\u1ee5ng kh\u00e1c nhau. D\u1ec5 d\u00e0ng thao t\u00e1c v\u1edbi b\u00e0n ph\u00edm ti\u00eau chu\u1ea9n tr\u00ean laptop M-SMART MBOOK 1409A B\u1ed9 b\u00e0n ph\u00edm tr\u00ean M-SMART MBOOK 1409A mang \u0111\u1ebfn cho ng\u01b0\u1eddi d\u00f9ng tr\u1ea3i nghi\u1ec7m g\u00f5 m\u01b0\u1ee3t m\u00e0, \u00eam \u00e1i v\u1edbi h\u00e0nh tr\u00ecnh ph\u00edm t\u01b0\u01a1ng \u0111\u1ed1i s\u00e2u. Kho\u1ea3ng c\u00e1ch gi\u1eefa c\u00e1c ph\u00edm \u0111\u01b0\u1ee3c s\u1eafp x\u1ebfp h\u1ee3p l\u00fd, kh\u00f4ng b\u1ecb d\u00ednh v\u00e0o nhau, \u0111\u1ed9 n\u1ea3y t\u1ed1t, kh\u00f4ng ph\u00e1t ra \u00e2m thanh qu\u00e1 l\u1edbn khi g\u00f5. V\u1edbi k\u00edch th\u01b0\u1edbc t\u1ed5ng th\u1ec3 kh\u00e1 nh\u1ecf g\u1ecdn n\u00ean s\u1ea3n ph\u1ea9m kh\u00f4ng \u0111\u01b0\u1ee3c trang b\u1ecb d\u00e3y ph\u00edm s\u1ed1 \u1edf b\u00ean ph\u1ea3i, \u0111\u1ed3ng th\u1eddi b\u00e0n ph\u00edm c\u0169ng kh\u00f4ng \u0111\u01b0\u1ee3c t\u00edch h\u1ee3p \u0111\u00e8n LED n\u1ec1n. Khu v\u1ef1c touchpad b\u00ean d\u01b0\u1edbi c\u00f3 b\u1ec1 m\u1eb7t nh\u1eb5n m\u1ecbn mang l\u1ea1i s\u1ef1 m\u01b0\u1ee3t m\u00e0, tr\u01a1n tru trong t\u1eebng thao t\u00e1c di chu\u1ed9t. Ph\u1ea7n touchpad n\u00e0y c\u0169ng c\u00f3 di\u1ec7n t\u00edch kh\u00e1 l\u1edbn, c\u00f3 th\u1ec3 nh\u1eadn di\u1ec7n \u0111\u01b0\u1ee3c t\u1ea5t c\u1ea3 c\u00e1c c\u1eed ch\u1ec9 \u0111i\u1ec1u h\u01b0\u1edbng tr\u00ean tay c\u1ee7a ng\u01b0\u1eddi d\u00f9ng. Laptop M-SMART MBOOK 1409A cho tr\u1ea3i nghi\u1ec7m h\u00ecnh \u1ea3nh v\u00e0 \u00e2m thanh tr\u1ecdn v\u1eb9n M-SMART MBOOK 1409A s\u1edf h\u1eefu m\u00e0n h\u00ecnh v\u1edbi k\u00edch th\u01b0\u1edbc 14 inch c\u00f9ng \u0111\u1ed9 ph\u00e2n gi\u1ea3i HD (1280 x 720 pixels), mang \u0111\u1ebfn kh\u00f4ng gian hi\u1ec3n th\u1ecb r\u1ed9ng l\u1edbn, h\u1ee9a h\u1eb9n s\u1ebd \u0111em l\u1ea1i cho ng\u01b0\u1eddi d\u00f9ng nh\u1eefng tr\u1ea3i nghi\u1ec7m h\u00ecnh \u1ea3nh \u1ea5n t\u01b0\u1ee3ng nh\u1ea5t. Kh\u00f4ng nh\u1eefng v\u1eady, \u1edf ngay ph\u00eda tr\u00ean m\u00e0n h\u00ecnh c\u00f2n \u0111\u01b0\u1ee3c t\u00edch h\u1ee3p m\u1ed9t webcam c\u00f3 \u0111\u1ed9 ph\u00e2n gi\u1ea3i 1MP, r\u1ea5t thu\u1eadn ti\u1ec7n \u0111\u1ec3 ng\u01b0\u1eddi d\u00f9ng th\u1ef1c hi\u1ec7n nh\u1eefng cu\u1ed9c g\u1ecdi qua video, h\u1ecdc t\u1eadp tr\u1ef1c tuy\u1ebfn hay l\u00e0m vi\u1ec7c, h\u1ecdp h\u00e0nh t\u1eeb xa. H\u1ec7 th\u1ed1ng loa stereo k\u00e9p n\u1eb1m gi\u1eefa m\u00e0n h\u00ecnh v\u00e0 b\u00e0n ph\u00edm t\u00e1i t\u1ea1o hi\u1ec7u \u1ee9ng \u00e2m thanh n\u1ed5i v\u00f4 c\u00f9ng \u0111\u1eb7c s\u1eafc, mang \u0111\u1ebfn nh\u1eefng tr\u1ea3i nghi\u1ec7m nghe c\u1ef1c k\u1ef3 r\u00f5 r\u00e0ng v\u00e0 ch\u00e2n th\u1ef1c, gi\u00fap ng\u01b0\u1eddi d\u00f9ng d\u1ec5 d\u00e0ng ti\u1ebfp nh\u1eadn m\u1ecdi n\u1ed9i dung \u0111\u01b0\u1ee3c truy\u1ec1n t\u1ea3i m\u1ed9t c\u00e1ch tr\u1ecdn v\u1eb9n. Laptop M-SMART MBOOK 1409A cung c\u1ea5p th\u1eddi l\u01b0\u1ee3ng pin b\u1ec1n b\u1ec9, kh\u00f4ng l\u00e0m gi\u00e1n \u0111o\u1ea1n qu\u00e1 tr\u00ecnh s\u1eed d\u1ee5ng \u0110\u1ec3 kh\u00f4ng l\u00e0m gi\u00e1n \u0111o\u1ea1n qu\u00e1 tr\u00ecnh s\u1eed d\u1ee5ng c\u0169ng nh\u01b0 \u0111\u00e1p \u1ee9ng nhu c\u1ea7u h\u1ecdc t\u1eadp, l\u00e0m vi\u1ec7c m\u1ecdi l\u00fac m\u1ecdi n\u01a1i, chi\u1ebfc m\u00e1y t\u00ednh M-SMART MBOOK 1409A \u0111\u00e3 \u0111\u01b0\u1ee3c trang b\u1ecb vi\u00ean pin v\u1edbi dung l\u01b0\u1ee3ng 5000 mAh. V\u1edbi vi\u00ean pin n\u00e0y, s\u1ea3n ph\u1ea9m c\u00f3 th\u1ec3 v\u1eadn h\u00e0nh v\u00e0 \u0111\u00e1p \u1ee9ng nhu c\u1ea7u s\u1eed d\u1ee5ng trong v\u00f2ng t\u1eeb 6 \u0111\u1ebfn 8 ti\u1ebfng \u0111\u1ed3ng h\u1ed3 ch\u1ec9 v\u1edbi m\u1ed9t l\u1ea7n s\u1ea1c, ph\u00f9 h\u1ee3p v\u1edbi nh\u1eefng ng\u01b0\u1eddi c\u00f3 c\u01b0\u1eddng \u0111\u1ed9 l\u00e0m vi\u1ec7c cao trong th\u1eddi gian d\u00e0i. C\u1ea5u h\u00ecnh \u1ed5n \u0111\u1ecbnh, x\u1eed l\u00fd t\u1ed1t c\u00e1c t\u00e1c v\u1ee5 h\u1ecdc t\u1eadp v\u00e0 l\u00e0m vi\u1ec7c v\u0103n ph\u00f2ng Cung c\u1ea5p s\u1ee9c m\u1ea1nh hi\u1ec7u n\u0103ng cho laptop M-SMART MBOOK 1409A l\u00e0 b\u1ed9 vi x\u1eed l\u00fd Intel Celeron N4000 \u0111i k\u00e8m card t\u00edch h\u1ee3p Intel GMA UHD 600 , \u0111\u00e1p \u1ee9ng t\u1ed1t nh\u1eefng nhu c\u1ea7u s\u1eed d\u1ee5ng ph\u1ed5 th\u00f4ng h\u00e0ng ng\u00e0y, x\u1eed l\u00fd m\u01b0\u1ee3t m\u00e0 nh\u1eefng t\u00e1c v\u1ee5 h\u1ecdc t\u1eadp v\u00e0 l\u00e0m vi\u1ec7c v\u0103n ph\u00f2ng c\u01a1 b\u1ea3n nh\u01b0 nh\u1eadp li\u1ec7u, so\u1ea1n th\u1ea3o v\u0103n b\u1ea3n, t\u00ednh to\u00e1n, tr\u00ecnh chi\u1ebfu\u2026, \u0111\u1ed3ng th\u1eddi ph\u1ee5c v\u1ee5 nh\u1eefng nhu c\u1ea7u gi\u1ea3i tr\u00ed nh\u01b0 l\u01b0\u1edbt web, xem phim, nghe nh\u1ea1c\u2026 S\u1ea3n ph\u1ea9m \u0111\u01b0\u1ee3c trang b\u1ecb RAM 4GB LPDDR3, ng\u01b0\u1eddi d\u00f9ng c\u00f3 th\u1ec3 m\u1edf c\u00f9ng l\u00fac nhi\u1ec1u tab tr\u00ecnh duy\u1ec7t hay c\u00e1c \u1ee9ng d\u1ee5ng l\u00e0m vi\u1ec7c m\u00e0 kh\u00f4ng c\u1ea7n lo ng\u1ea1i v\u1ec1 t\u00ecnh tr\u1ea1ng gi\u1eadt, lag. So v\u1edbi nh\u1eefng lo\u1ea1i \u1ed5 c\u1ee9ng HDD truy\u1ec1n th\u1ed1ng, \u1ed5 c\u1ee9ng SSD 128GB c\u1ee7a thi\u1ebft b\u1ecb c\u0169ng cung c\u1ea5p t\u1ed1c \u0111\u1ed9 x\u1eed l\u00fd nhanh ch\u00f3ng h\u01a1n, \u0111\u1ed3ng th\u1eddi cho ph\u00e9p ng\u01b0\u1eddi d\u00f9ng tho\u1ea3i m\u00e1i l\u01b0u tr\u1eef d\u1eef li\u1ec7u v\u1edbi s\u1ed1 l\u01b0\u1ee3ng l\u1edbn. B\u00ean c\u1ea1nh \u0111\u00f3, chi\u1ebfc m\u00e1y t\u00ednh M-SMART MBOOK 1409A c\u0169ng \u0111\u01b0\u1ee3c c\u00e0i \u0111\u1eb7t s\u1eb5n h\u1ec7 \u0111i\u1ec1u h\u00e0nh Windows 10, gi\u00fap ng\u01b0\u1eddi d\u00f9ng d\u1ec5 d\u00e0ng truy c\u1eadp v\u00e0 s\u1eed d\u1ee5ng m\u1ecdi \u1ee9ng d\u1ee5ng m\u1ed9t c\u00e1ch thu\u1eadn ti\u1ec7n. Ngo\u00e0i ra, ng\u01b0\u1eddi d\u00f9ng c\u0169ng c\u00f3 th\u1ec3 tr\u1ef1c ti\u1ebfp truy c\u1eadp v\u00e0o Microsoft Store \u0111\u1ec3 t\u1ea3i v\u1ec1 c\u00e1c \u1ee9ng d\u1ee5ng c\u1ea7n thi\u1ebft, ph\u1ee5c v\u1ee5 cho nhu c\u1ea7u h\u1ecdc t\u1eadp v\u00e0 l\u00e0m vi\u1ec7c c\u1ee7a m\u00ecnh. Laptop M-SMART MBOOK 1409A h\u1ed7 tr\u1ee3 k\u1ebft n\u1ed1i t\u1ed1c \u0111\u1ed9 cao \u0110\u1ec3 ph\u1ee5c v\u1ee5 nhu c\u1ea7u s\u1eed d\u1ee5ng c\u1ee7a ng\u01b0\u1eddi d\u00f9ng m\u1ed9t c\u00e1ch t\u1ed1i \u01b0u nh\u1ea5t, s\u1ea3n ph\u1ea9m c\u0169ng \u0111\u01b0\u1ee3c t\u00edch h\u1ee3p \u0111\u1ea7y \u0111\u1ee7 c\u00e1c c\u1ed5ng k\u1ebft n\u1ed1i v\u1eadt l\u00fd c\u01a1 b\u1ea3n v\u00e0 ph\u1ed5 bi\u1ebfn nh\u1ea5t nh\u01b0 c\u1ed5ng HDMI, c\u1ed5ng USB 3.0, jack audio 3,5mm v\u00e0 khe \u0111\u1ecdc th\u1ebb SD. B\u00ean c\u1ea1nh \u0111\u00f3, thi\u1ebft b\u1ecb c\u0169ng t\u01b0\u01a1ng th\u00edch v\u1edbi Wifi 802.11 ac/a/b/g/n v\u00e0 h\u1ed7 tr\u1ee3 k\u1ebft n\u1ed1i Bluetooth , do \u0111\u00f3, ng\u01b0\u1eddi d\u00f9ng c\u00f3 th\u1ec3 k\u1ebft n\u1ed1i thi\u1ebft b\u1ecb v\u1edbi nh\u1eefng ph\u1ee5 ki\u1ec7n kh\u00f4ng d\u00e2y b\u00ean ngo\u00e0i s\u1eed d\u1ee5ng hai chu\u1ea9n n\u00e0y. Th\u1eddi \u0111i\u1ec3m ra m\u1eaft c\u1ee7a laptop M-SMART MBOOK 1409A M-SMART MBOOK 1409A l\u00e0 m\u1ed9t trong nh\u1eefng m\u1eabu laptop gi\u00e1 r\u1ebb \u0111\u01b0\u1ee3c ra m\u1eaft trong n\u0103m 2023 v\u00e0 \u0111\u00e3 ngay l\u1eadp t\u1ee9c nh\u1eadn \u0111\u01b0\u1ee3c s\u1ef1 ch\u00fa \u00fd t\u1eeb \u0111\u00f4ng \u0111\u1ea3o ng\u01b0\u1eddi d\u00f9ng. V\u1edbi thi\u1ebft k\u1ebf tr\u1ebb trung v\u00e0 hi\u1ec7n \u0111\u1ea1i, c\u1ea5u h\u00ecnh \u1ed5n \u0111\u1ecbnh c\u00f9ng m\u1ee9c gi\u00e1 ph\u1ea3i ch\u0103ng, s\u1ea3n ph\u1ea9m \u0111\u01b0\u1ee3c \u0111\u00e1nh gi\u00e1 kh\u00e1 cao so v\u1edbi nh\u1eefng \u201c\u0111\u1ed1i th\u1ee7\u201d ngang t\u1ea7m tr\u00ean th\u1ecb tr\u01b0\u1eddng. N\u1ebfu b\u1ea1n \u0111ang t\u00ecm ki\u1ebfm m\u1ed9t chi\u1ebfc laptop c\u01a1 b\u1ea3n v\u1edbi nh\u1eefng y\u00eau c\u1ea7u kh\u00f4ng qu\u00e1 cao th\u00ec \u0111\u1eebng b\u1ecf qua \u201csi\u00eau ph\u1ea9m\u201d gi\u00e1 b\u00ecnh d\u00e2n n\u00e0y nh\u00e9! Laptop M-SMART MBOOK 1409A c\u00f3 gi\u00e1 bao nhi\u00eau? Th\u1ea5u hi\u1ec3u t\u00e2m l\u00fd mua s\u1eafm c\u1ee7a ph\u1ea7n l\u1edbn ng\u01b0\u1eddi d\u00f9ng t\u1ea1i Vi\u1ec7t Nam, chi\u1ebfc m\u00e1y t\u00ednh M-SMART MBOOK 1409A \u0111\u00e3 \u0111\u01b0\u1ee3c \u201ctr\u00ecnh l\u00e0ng\u201d v\u1edbi m\u1ee9c gi\u00e1 c\u1ef1c k\u1ef3 h\u1ea5p d\u1eabn. V\u1edbi m\u1ee9c gi\u00e1 ch\u1ec9 ngang ng\u1eeda m\u1ed9t chi\u1ebfc smartphone ph\u1ed5 th\u00f4ng, d\u1ec5 d\u00e0ng ti\u1ebfp c\u1eadn \u0111\u1ebfn m\u1ecdi \u0111\u1ed1i t\u01b0\u1ee3ng kh\u00e1ch h\u00e0ng, \u0111\u00e2y s\u1ebd l\u00e0 s\u1ef1 l\u1ef1a ch\u1ecdn l\u00fd t\u01b0\u1edfng d\u00e0nh cho nh\u1eefng ng\u01b0\u1eddi c\u00f3 h\u1ea1n ch\u1ebf v\u1ec1 ng\u00e2n s\u00e1ch. L\u01b0u \u00fd, m\u1ee9c gi\u00e1 c\u1ee7a chi\u1ebfc laptop n\u00e0y c\u00f3 th\u1ec3 thay \u0111\u1ed5i theo t\u1eebng th\u1eddi \u0111i\u1ec3m kh\u00e1c nhau. N\u1ebfu c\u00f3 nhu c\u1ea7u bi\u1ebft th\u00eam th\u00f4ng tin v\u1ec1 s\u1ea3n ph\u1ea9m n\u00e0y, qu\u00fd kh\u00e1ch h\u00e0ng c\u00f3 th\u1ec3 \u0111\u1ebfn ngay c\u00e1c c\u01a1 s\u1edf Ho\u00e0ng H\u00e0 Mobile tr\u00ean to\u00e0n qu\u1ed1c ho\u1eb7c li\u00ean h\u1ec7 \u0111\u1ebfn s\u1ed1 hotline 1900.2091 \u0111\u1ec3 \u0111\u01b0\u1ee3c t\u01b0 v\u1ea5n m\u1ed9t c\u00e1ch t\u1eadn t\u00ecnh nh\u1ea5t. So s\u00e1nh Laptop M-SMART MBOOK 1409A v\u00e0 Laptop Masstel E116 M-SMART MBOOK 1409A v\u00e0 Masstel E116 l\u00e0 hai m\u1eabu laptop nh\u1eadn \u0111\u01b0\u1ee3c nhi\u1ec1u s\u1ef1 ch\u00fa \u00fd trong ph\u00e2n kh\u00fac gi\u00e1 r\u1ebb. Gi\u1eefa hai chi\u1ebfc laptop n\u00e0y c\u00f3 s\u1ef1 t\u01b0\u01a1ng \u0111\u1ed3ng v\u00e0 kh\u00e1c bi\u1ec7t nh\u01b0 th\u1ebf n\u00e0o? H\u00e3y c\u00f9ng Ho\u00e0ng H\u00e0 Mobile t\u00ecm hi\u1ec3u v\u00e0 so s\u00e1nh hai s\u1ea3n ph\u1ea9m n\u00e0y qua m\u1ed9t v\u00e0i th\u00f4ng s\u1ed1 d\u01b0\u1edbi \u0111\u00e2y: Th\u00f4ng s\u1ed1 M-SMART MBOOK 1409A Masstel E116 Tr\u1ecdng l\u01b0\u1ee3ng 1,46kg 0,92kg K\u00edch th\u01b0\u1edbc 329 x 220 x 21 mm 227 x 188.6 x 18.6 mm K\u00edch th\u01b0\u1edbc m\u00e0n h\u00ecnh 14 inch 11.6 inch T\u1ec9 l\u1ec7 m\u00e0n h\u00ecnh 16:9 16:9 \u0110\u1ed9 ph\u00e2n gi\u1ea3i HD (1366 x 768 pixels) HD (1366 x 768 pixels) Pin Lithium - ion 5000mAh 2-cell Li-Po, 30.4 Wh Th\u1eddi l\u01b0\u1ee3ng s\u1eed d\u1ee5ng 6 - 8 ti\u1ebfng 5 - 7 ti\u1ebfng CPU Intel Celeron N4000 Intel Celeron N4020 T\u1ed1c \u0111\u1ed9 xung nh\u1ecbp 1.1 - 2.6 Ghz 1.1 - 2.8 Ghz S\u1ed1 nh\u00e2n 2 2 S\u1ed1 lu\u1ed3ng 2 2 B\u1ed9 nh\u1edb \u0111\u1ec7m 4MB 4MB RAM 4GB LPDDR3 4GB DDR4 \u1ed4 c\u1ee9ng 128GB SSD 128GB eMMC Card m\u00e0n h\u00ecnh Intel GMA UHD 600 Intel HD Graphics 600 C\u1ed5ng k\u1ebft n\u1ed1i 1 \u00d7 HDMI 1.4 2 \u00d7 USB 3.0 1 x 3.5mm 1 x th\u1ebb SD Mini HDMI Jack 3.5 mm 2 x USB 3.0 K\u1ebft n\u1ed1i kh\u00f4ng d\u00e2y Wifi 802.11 ac/a/b/g/n + BT Wi-Fi 802.11 a/b/g/n, Bluetooth 4.0 Webcam HD 1MP HD 2MP Ki\u1ec3u b\u00e0n ph\u00edm B\u00e0n ph\u00edm ti\u00eau chu\u1ea9n B\u00e0n ph\u00edm ti\u00eau chu\u1ea9n Touchpad Multi-touch touchpad Multi-touch touchpad H\u1ec7 \u0111i\u1ec1u h\u00e0nh Windows 10 Windows 10 Pro V\u1ec1 thi\u1ebft k\u1ebf V\u1ec1 thi\u1ebft k\u1ebf t\u1ed5ng th\u1ec3, c\u1ea3 hai chi\u1ebfc laptop \u0111\u1ec1u \u201cghi \u0111i\u1ec3m\u201d v\u1edbi ng\u01b0\u1eddi d\u00f9ng nh\u1edd k\u00edch th\u01b0\u1edbc nh\u1ecf g\u1ecdn c\u00f9ng ph\u1ea7n th\u00e2n m\u00e1y si\u00eau m\u1ecfng hi\u1ec7n \u0111\u1ea1i. Tr\u1ecdng l\u01b0\u1ee3ng nh\u1eb9 th\u1ec3 hi\u1ec7n t\u00ednh di \u0111\u1ed9ng cao, kh\u00f4ng g\u00e2y kh\u00f3 kh\u0103n hay tr\u1edf ng\u1ea1i khi mang theo b\u00ean m\u00ecnh. Hai s\u1ea3n ph\u1ea9m \u0111\u1ec1u \u0111\u01b0\u1ee3c ho\u00e0n thi\u1ec7n v\u1edbi nh\u1eefng t\u00f4ng m\u00e0u trung t\u00ednh l\u00e0 b\u1ea1c v\u00e0 x\u00e1m, ph\u00f9 h\u1ee3p v\u1edbi nhi\u1ec1u \u0111\u1ed1i t\u01b0\u1ee3ng ng\u01b0\u1eddi d\u00f9ng \u1edf m\u1ecdi \u0111\u1ed9 tu\u1ed5i, gi\u1edbi t\u00ednh hay phong c\u00e1ch. Ngo\u00e0i ra, c\u1ea3 laptop M-SMART MBOOK 1409A v\u00e0 Masstel E116 \u0111\u1ec1u \u0111\u01b0\u1ee3c trang b\u1ecb b\u00e0n ph\u00edm ti\u00eau chu\u1ea9n v\u1edbi ph\u1ea7n touchpad kh\u00e1 l\u1edbn, cho tr\u1ea3i nghi\u1ec7m g\u00f5 \u00eam \u00e1i v\u00e0 tho\u1ea3i m\u00e1i trong qu\u00e1 tr\u00ecnh nh\u1eadp li\u1ec7u. S\u1ef1 kh\u00e1c bi\u1ec7t c\u00f3 th\u1ec3 th\u1ea5y ch\u00ednh l\u00e0 c\u00e1c ph\u00edm b\u1ea5m c\u1ee7a Masstel E116 \u0111\u01b0\u1ee3c thi\u1ebft k\u1ebf bo tr\u00f2n, t\u1ea1o \u0111i\u1ec3m nh\u1ea5n \u0111\u1ed9c \u0111\u00e1o v\u00e0 th\u00fa v\u1ecb h\u01a1n. V\u1ec1 m\u00e0n h\u00ecnh S\u1ef1 ch\u00eanh l\u1ec7ch d\u1ec5 th\u1ea5y nh\u1ea5t gi\u1eefa laptop M-SMART MBOOK 1409A v\u00e0 laptop Masstel E116 ch\u00ednh l\u00e0 k\u00edch th\u01b0\u1edbc m\u00e0n h\u00ecnh. Masstel E116 \u0111\u01b0\u1ee3c trang b\u1ecb m\u00e0n h\u00ecnh c\u00f3 k\u00edch th\u01b0\u1edbc 11.6 inch, trong khi \u0111\u00f3 M-SMART MBOOK 1409A \u201cnh\u1ec9nh\u201d h\u01a1n m\u1ed9t ch\u00fat v\u1edbi m\u00e0n h\u00ecnh 14 inch. \u0110i\u1ec1u n\u00e0y mang l\u1ea1i cho ng\u01b0\u1eddi d\u00f9ng kh\u00f4ng gian hi\u1ec3n th\u1ecb r\u1ed9ng l\u1edbn v\u00e0 tho\u1ea3i m\u00e1i h\u01a1n. M\u1eb7c d\u00f9 c\u00f3 s\u1ef1 kh\u00e1c bi\u1ec7t v\u1ec1 k\u00edch th\u01b0\u1edbc, tuy nhi\u00ean, m\u00e0n h\u00ecnh c\u1ee7a c\u1ea3 hai chi\u1ebfc laptop n\u00e0y l\u1ea1i c\u00f3 chung \u0111\u1ed9 ph\u00e2n gi\u1ea3i HD (1280 x 720 pixels). \u0110\u00e2y l\u00e0 m\u1ee9c th\u00f4ng s\u1ed1 th\u01b0\u1eddng th\u1ea5y tr\u00ean nh\u1eefng s\u1ea3n ph\u1ea9m laptop gi\u00e1 r\u1ebb, m\u1eb7c d\u00f9 kh\u00f4ng qu\u00e1 xu\u1ea5t s\u1eafc nh\u01b0ng v\u1eabn \u0111\u1ea3m b\u1ea3o ch\u1ea5t l\u01b0\u1ee3ng hi\u1ec3n th\u1ecb r\u00f5 r\u00e0ng, m\u1ecdi n\u1ed9i dung \u0111\u1ec1u \u0111\u01b0\u1ee3c t\u00e1i hi\u1ec7n m\u1ed9t c\u00e1ch trung th\u1ef1c v\u00e0 s\u1eafc n\u00e9t. V\u1ec1 hi\u1ec7u su\u1ea5t C\u1ea3 hai chi\u1ebfc laptop \u0111\u1ec1u \u0111\u01b0\u1ee3c trang b\u1ecb b\u1ed9 vi x\u1eed l\u00fd Intel Celeron, ch\u1ec9 c\u00f3 s\u1ef1 kh\u00e1c bi\u1ec7t \u0111\u00f4i ch\u00fat v\u1ec1 phi\u00ean b\u1ea3n. Laptop M-SMART MBOOK 1409A s\u1eed d\u1ee5ng chipset Intel Celeron N4000, trong khi \u0111\u00f3 laptop Masstel E116 s\u1eed d\u1ee5ng chipset Intel Celeron N4020. Con chip Intel Celeron 4020 c\u00f3 t\u1ed1c \u0111\u1ed9 xung nh\u1ecbp t\u1eeb 1.1 Ghz l\u00ean t\u1edbi 2.8 Ghz, c\u1ea3i ti\u1ebfn 200Mhz so v\u1edbi th\u1ebf h\u1ec7 ti\u1ec1n nhi\u1ec7m tr\u01b0\u1edbc \u0111\u00f3 l\u00e0 Intel Celeron N4000, cho t\u1ed1c \u0111\u1ed9 x\u1eed l\u00fd nhanh h\u01a1n trong c\u00e1c t\u00e1c v\u1ee5 h\u00e0ng ng\u00e0y. V\u1ec1 \u00e2m thanh, webcam v\u00e0 dung l\u01b0\u1ee3ng pin C\u1ea3 laptop M-SMART MBOOK 1409A v\u00e0 Masstel E116 \u0111\u1ec1u cung c\u1ea5p ch\u1ea5t l\u01b0\u1ee3ng \u00e2m thanh ho\u00e0n h\u1ea3o nh\u1edd \u0111\u01b0\u1ee3c trang b\u1ecb h\u1ec7 th\u1ed1ng loa stereo k\u00e9p. M\u1ecdi n\u1ed9i dung d\u01b0\u1edbi d\u1ea1ng \u00e2m thanh \u0111\u1ec1u \u0111\u01b0\u1ee3c truy\u1ec1n t\u1ea3i \u0111\u1ebfn ng\u01b0\u1eddi d\u00f9ng m\u1ed9t c\u00e1ch tr\u1ecdn v\u1eb9n nh\u1ea5t. Nh\u1eefng t\u00e1c v\u1ee5 gi\u1ea3i tr\u00ed nh\u01b0 nghe nh\u1ea1c, xem phim\u2026 c\u0169ng nh\u1edd v\u1eady m\u00e0 tr\u1edf n\u00ean th\u00fa v\u1ecb h\u01a1n. B\u00ean c\u1ea1nh \u0111\u00f3, c\u1ea3 hai thi\u1ebft b\u1ecb \u0111\u1ec1u \u0111\u01b0\u1ee3c t\u00edch h\u1ee3p webcam tr\u00ean m\u00e0n h\u00ecnh. \u0110i\u1ec1u n\u00e0y mang l\u1ea1i s\u1ef1 ti\u1ec7n l\u1ee3i cho ng\u01b0\u1eddi d\u00f9ng trong c\u00e1c cu\u1ed9c tr\u00f2 chuy\u1ec7n qua video, h\u1ecdc t\u1eadp v\u00e0 l\u00e0m vi\u1ec7c tr\u1ef1c tuy\u1ebfn t\u1eeb xa\u2026 M\u1eb7c d\u00f9 n\u1eb1m trong ph\u00e2n kh\u00fac gi\u00e1 r\u1ebb nh\u01b0ng c\u1ea3 hai chi\u1ebfc laptop n\u00e0y \u0111\u1ec1u g\u00e2y b\u1ea5t ng\u1edd v\u1edbi th\u1eddi l\u01b0\u1ee3ng pin t\u01b0\u01a1ng \u0111\u1ed1i t\u1ed1t. M-SMART MBOOK 1409A \u0111\u01b0\u1ee3c trang b\u1ecb vi\u00ean pin 5000 mAh, cho th\u1eddi gian s\u1eed d\u1ee5ng t\u1eeb 6-8 ti\u1ebfng. Trong khi \u0111\u00f3 Masstel E116 \u0111\u01b0\u1ee3c trang b\u1ecb vi\u00ean pin 2-cell Li-Po 30.4 Wh, cho th\u1eddi gian s\u1eed d\u1ee5ng t\u1eeb 5-7 ti\u1ebfng. \u0110\u00e2y l\u00e0 nh\u1eefng con s\u1ed1 kh\u00e1 \u1ea5n t\u01b0\u1ee3ng \u0111\u1ed1i v\u1edbi m\u1ed9t chi\u1ebfc laptop b\u00ecnh d\u00e2n gi\u00e1 r\u1ebb, \u0111\u00e1p \u1ee9ng nhu c\u1ea7u s\u1eed d\u1ee5ng li\u00ean t\u1ee5c v\u1edbi c\u01b0\u1eddng \u0111\u1ed9 cao m\u00e0 kh\u00f4ng ph\u1ea3i s\u1ea1c l\u1ea1i pin qu\u00e1 nhi\u1ec1u l\u1ea7n. Mua laptop M-SMART MBOOK 1409A ch\u00ednh h\u00e3ng gi\u00e1 t\u1ed1t t\u1ea1i Ho\u00e0ng H\u00e0 Mobile B\u1ea1n \u0111ang t\u00ecm ki\u1ebfm m\u1ed9t chi\u1ebfc m\u00e1y t\u00ednh x\u00e1ch tay \u0111\u1ec3 ph\u1ee5c v\u1ee5 nh\u1eefng nhu c\u1ea7u s\u1eed d\u1ee5ng c\u01a1 b\u1ea3n h\u00e0ng ng\u00e0y, nh\u01b0ng ch\u1ec9 c\u00f3 m\u1ee9c ng\u00e2n s\u00e1ch kh\u00e1 h\u1ea1n ch\u1ebf? V\u1edbi thi\u1ebft k\u1ebf tr\u1ebb trung, c\u1ea5u h\u00ecnh \u1ed5n \u0111\u1ecbnh c\u00f9ng m\u1ee9c gi\u00e1 ph\u1ea3i ch\u0103ng trong ph\u00e2n kh\u00fac b\u00ecnh d\u00e2n, chi\u1ebfc laptop M-SMART MBOOK 1409A ch\u1eafc ch\u1eafn s\u1ebd l\u00e0m b\u1ea1n h\u00e0i l\u00f2ng v\u1edbi nh\u1eefng tr\u1ea3i nghi\u1ec7m tuy\u1ec7t v\u1eddi. T\u1ea1i Ho\u00e0ng H\u00e0 Mobile, ch\u00fang t\u00f4i cam k\u1ebft lu\u00f4n cung c\u1ea5p \u0111\u1ebfn tay qu\u00fd kh\u00e1ch h\u00e0ng nh\u1eefng s\u1ea3n ph\u1ea9m ch\u00ednh h\u00e3ng c\u1ee7a nh\u1eefng th\u01b0\u01a1ng hi\u1ec7u uy t\u00edn h\u00e0ng \u0111\u1ea7u, c\u00f3 ngu\u1ed3n g\u1ed1c v\u00e0 xu\u1ea5t x\u1ee9 r\u00f5 r\u00e0ng, ch\u1ebf \u0111\u1ed9 b\u1ea3o h\u00e0nh d\u00e0i h\u1ea1n, do \u0111\u00f3, qu\u00fd kh\u00e1ch h\u00e0ng ho\u00e0n to\u00e0n c\u00f3 th\u1ec3 y\u00ean t\u00e2m tr\u1ea3i nghi\u1ec7m v\u00e0 mua s\u1eafm. B\u00ean c\u1ea1nh \u0111\u00f3, qu\u00fd kh\u00e1ch h\u00e0ng c\u00f2n \u0111\u01b0\u1ee3c h\u1ed7 tr\u1ee3 \u0111\u1ed5i tr\u1ea3 1:1 trong v\u00f2ng 30 ng\u00e0y \u0111\u1ed1i v\u1edbi nh\u1eefng s\u1ea3n ph\u1ea9m c\u00f3 l\u1ed7i ph\u00e1t sinh t\u1eeb ph\u00eda nh\u00e0 s\u1ea3n xu\u1ea5t. \u0110i\u1ec1u n\u00e0y t\u1ea1o t\u00e2m l\u00fd tho\u1ea3i m\u00e1i cho qu\u00fd kh\u00e1ch h\u00e0ng khi mua s\u1eafm v\u00e0 s\u1eed d\u1ee5ng d\u1ecbch v\u1ee5 t\u1ea1i \u0111\u00e2y. \u0110\u1ebfn v\u1edbi Ho\u00e0ng H\u00e0 Mobile, qu\u00fd kh\u00e1ch h\u00e0ng s\u1ebd c\u00f3 c\u01a1 h\u1ed9i s\u1edf h\u1eefu nh\u1eefng s\u1ea3n ph\u1ea9m c\u00f4ng ngh\u1ec7 m\u00e0 m\u00ecnh y\u00eau th\u00edch v\u1edbi m\u1ee9c gi\u00e1 h\u1ea5p d\u1eabn ch\u01b0a t\u1eebng c\u00f3. T\u1ea1i \u0111\u00e2y, ch\u00fang t\u00f4i th\u01b0\u1eddng xuy\u00ean t\u1ed5 ch\u1ee9c c\u00e1c ch\u01b0\u01a1ng tr\u00ecnh gi\u1ea3m gi\u00e1 \u0111\u1ecbnh k\u1ef3 h\u00e0ng th\u00e1ng, t\u1eb7ng voucher khuy\u1ebfn m\u00e3i hay linh ph\u1ee5 ki\u1ec7n ch\u00ednh h\u00e3ng khi mua s\u1ea3n ph\u1ea9m,\u2026 V\u1edbi h\u1ec7 th\u1ed1ng 128 chi nh\u00e1nh tr\u00ean kh\u1eafp to\u00e0n qu\u1ed1c, Ho\u00e0ng H\u00e0 Mobile lu\u00f4n mong mu\u1ed1n \u0111\u01b0\u1ee3c ch\u00e0o \u0111\u00f3n v\u00e0 ph\u1ee5c v\u1ee5 nh\u1eefng ng\u01b0\u1eddi d\u00f9ng c\u00f4ng ngh\u1ec7 \u0111\u1ebfn t\u1eeb m\u1ecdi mi\u1ec1n \u0111\u1ea5t n\u01b0\u1edbc. Ngo\u00e0i ra, qu\u00fd kh\u00e1ch h\u00e0ng c\u00f3 th\u1ec3 mua s\u1eafm tr\u1ef1c tuy\u1ebfn m\u1ed9t c\u00e1ch nhanh ch\u00f3ng v\u00e0 d\u1ec5 d\u00e0ng tr\u00ean website hoanghamobile v\u00e0 s\u1ebd \u0111\u01b0\u1ee3c h\u1ed7 tr\u1ee3 mi\u1ec5n ph\u00ed v\u1eadn chuy\u1ec3n. \u0110\u1ec3 bi\u1ebft th\u00eam nh\u1eefng th\u00f4ng tin c\u1ee5 th\u1ec3 v\u1ec1 chi\u1ebfc laptop M-SMART MBOOK 1409A\u00a0 c\u0169ng nh\u01b0 nh\u1eefng s\u1ea3n ph\u1ea9m c\u00f4ng ngh\u1ec7 m\u1edbi nh\u1ea5t, qu\u00fd kh\u00e1ch h\u00e0ng c\u00f3 th\u1ec3 li\u00ean h\u1ec7 ngay v\u1edbi \u0111\u1ed9i ng\u0169 ch\u0103m s\u00f3c kh\u00e1ch h\u00e0ng c\u1ee7a Ho\u00e0ng H\u00e0 Mobile \u0111\u1ec3 \u0111\u01b0\u1ee3c t\u01b0 v\u1ea5n m\u1ed9t c\u00e1ch chu \u0111\u00e1o v\u00e0 t\u1eadn t\u00ecnh nh\u1ea5t. Xem to\u00e0n b\u1ed9 b\u00e0i vi\u1ebft",
        "promotion_1": "1. Tr\u00fang 8386 qu\u00e0 - T\u1ed5ng gi\u00e1 tr\u1ecb t\u1edbi 250 TRI\u1ec6U \u0110\u1ed2NG (\u00c1p d\u1ee5ng t\u1eeb 10/01 - 02/02/2025). (Xem chi ti\u1ebft). 2. T\u1eb7ng B\u00e0n di chu\u1ed9t Ho\u00e0ng H\u00e0 2024. 3. -50% gi\u00e1 RAM v\u00e0 SSD khi mua k\u00e8m Laptop, MacBook (L\u01b0u \u00fd: Gi\u1ea3m t\u1eeb gi\u00e1 ni\u00eam y\u1ebft). (Xem chi ti\u1ebft)",
        "promotion_2": "1. \u01afu \u0111\u00e3i \u0111\u1eb7c quy\u1ec1n Sinh vi\u00ean: Tr\u1ea3 g\u00f3p t\u1edbi 10 tri\u1ec7u \u0111\u1ed3ng ch\u1ec9 c\u1ea7n th\u1ebb sinh vi\u00ean!. (Xem chi ti\u1ebft). 2. -50% gia\u0301 RAM VA\u0300 SSD khi mua ke\u0300m Laptop, Ma\u0301y ti\u0301nh ba\u0309ng, iMac, \u0110i\u00ea\u0323n thoa\u0323i (L\u01b0u \u00fd: Gi\u1ea3m t\u01b0\u0300 gia\u0301 ni\u00eam y\u00ea\u0301t). (Xem chi ti\u1ebft). 3. Gi\u1ea3m 50% t\u1ed1i \u0111a 700.000\u0111 khi m\u1edf th\u1ebb t\u00edn d\u1ee5ng Vpbank tr\u00ean SenID. (Xem chi ti\u1ebft). 4. Mi\u1ec5n ph\u00ed chuy\u1ec3n \u0111\u1ed5i tr\u1ea3 g\u00f3p ho\u1eb7c gi\u1ea3m \u0111\u1ebfn 500.000\u0111 khi m\u1edf th\u1ebb TPBank EVO. (Xem chi ti\u1ebft). 5. Gi\u1ea3m th\u00eam 100.000\u0111 cho t\u1ea5t c\u1ea3 c\u00e1c s\u1ea3n ph\u1ea9m m\u00e0n h\u00ecnh khi mua k\u00e8m Laptop, MacBook, M\u00e1y t\u00ednh b\u1ea3ng v\u00e0 \u0110i\u1ec7n tho\u1ea1i.. 6. M\u1edf th\u1ebb HSBC - Ho\u00e0n ti\u1ec1n t\u1edbi 2 tri\u1ec7u \u0111\u1ed3ng. (Xem chi ti\u1ebft). 7. T\u1eb7ng mi\u1ec5n ph\u00ed ph\u00f4i sim khi mua \u0111i\u1ec7n tho\u1ea1i, m\u00e1y t\u00ednh b\u1ea3ng, laptop ho\u1eb7c ph\u1ee5 ki\u1ec7n t\u1ea1i Ho\u00e0ng H\u00e0 Mobile. (Xem chi ti\u1ebft)"
    }
]